id,sitzung,wahlperiode,in_writing,sequence,text,speaker_cleaned,speaker_fp,filename,speaker,speaker_party,type
23159,4,17,0,16,Das hat überwiegend die alte Regierung gemacht!,Thomas Oppermann,Thomas Oppermann,data/txt/17004.txt,Thomas Oppermann [SPD],spd,poi
23172,4,17,0,29,Sie können auch etwas dazu beitragen!,Thomas Oppermann,Thomas Oppermann,data/txt/17004.txt,Thomas Oppermann [SPD],spd,poi
23189,4,17,0,46,"Aber dort doch auch, oder?",Thomas Oppermann,Thomas Oppermann,data/txt/17004.txt,Thomas Oppermann [SPD],spd,poi
23427,4,17,0,284,Auf so was war ich auch eingestellt!,Thomas Oppermann,Thomas Oppermann,data/txt/17004.txt,Thomas Oppermann [SPD],spd,poi
26397,5,17,0,55,Die Börsen rufen danach! Die Finanzmärkte rufen danach!,Thomas Oppermann,Thomas Oppermann,data/txt/17005.txt,Thomas Oppermann [SPD],spd,poi
27479,6,17,0,81,"Sehr geehrter Herr Staatsminister von Klaeden, mit der Antwort kann man sich nicht zufriedengeben. Die Bundesregierung ist ja auch für die Einhaltung der Verfassung und die Respektierung der Rundfunkfreiheit in Deutschland zuständig und verantwortlich. Deshalb frage ich: Welche Haltung hat die Bundesregierung in dieser Frage?",Thomas Oppermann,Thomas Oppermann,data/txt/17006.txt,Thomas Oppermann (SPD),spd,speech
28098,7,17,0,80,Welche?,Thomas Oppermann,Thomas Oppermann,data/txt/17007.txt,Thomas Oppermann [SPD],spd,poi
28102,7,17,0,84,Ist das alles?,Thomas Oppermann,Thomas Oppermann,data/txt/17007.txt,Thomas Oppermann [SPD],spd,poi
28370,7,17,0,352,"Frau Präsidentin! Meine Damen und Herren! Der Verteidigungsminister hat heute Morgen hier erklärt, dass er uns als Parlament direkt darüber informiert, dass der Generalinspekteur militärisch Verantwortung übernommen hat und dass der Staatssekretär administrativ Verantwortung übernommen hat. Uns wurde aber nicht erklärt, wer die politische Verantwortung trägt.",Thomas Oppermann,Thomas Oppermann,data/txt/17007.txt,Thomas Oppermann (SPD),spd,speech
28372,7,17,0,354,"Der amtierende Verteidigungsminister war noch nicht zuständig, als sich die Luftangriffe in Afghanistan ereigneten. Aber der damals zuständige und verantwortliche Minister ist heute hier im Plenum. Wenn wir jetzt hören, dass ein Interview mit dem Verteidigungsminister a. D. Jung bei Phoenix bevorsteht, dann finde ich, dass das Parlament den Anspruch und das Recht hat, vorher persönlich Herrn Jung zu hören.",Thomas Oppermann,Thomas Oppermann,data/txt/17007.txt,Thomas Oppermann (SPD),spd,speech
28374,7,17,0,356,"Wenn Herr Jung als nicht mehr zuständiger Minister hier nicht reden darf, dann muss allerdings jemand anderes die politische Verantwortung übernehmen und über die politische Verantwortung reden. Wenn Herr Jung es nicht tun kann, dann kann es nur die Person tun, die damals im Amt war und heute im Amt ist; das ist die Bundeskanzlerin.",Thomas Oppermann,Thomas Oppermann,data/txt/17007.txt,Thomas Oppermann (SPD),spd,speech
28377,7,17,0,359,"Ich beantrage zunächst, dass der Informationsanspruch des Parlamentes dadurch erfüllt wird, dass jetzt Verteidigungsminister a. D. Jung das Wort erhält.",Thomas Oppermann,Thomas Oppermann,data/txt/17007.txt,Thomas Oppermann (SPD),spd,speech
28380,7,17,0,362,,Thomas Oppermann,Thomas Oppermann,data/txt/17007.txt,Thomas Oppermann (SPD),spd,speech
32881,9,17,0,1392,Da drüben sitzt die Regierung!,Thomas Oppermann,Thomas Oppermann,data/txt/17009.txt,Thomas Oppermann [SPD],spd,poi
32884,9,17,0,1395,Ihr Freund Milosevic! Gysi war doch bei Milosevic und wollte Jugoslawien retten!,Thomas Oppermann,Thomas Oppermann,data/txt/17009.txt,Thomas Oppermann [SPD],spd,poi
33278,9,17,0,1789,Geben Sie ihm zwei Minuten ab!,Thomas Oppermann,Thomas Oppermann,data/txt/17009.txt,Thomas Oppermann [SPD],spd,poi
33813,10,17,0,99,Zum Fenster raus!,Thomas Oppermann,Thomas Oppermann,data/txt/17010.txt,Thomas Oppermann [SPD],spd,poi
33854,10,17,0,140,Eben!,Thomas Oppermann,Thomas Oppermann,data/txt/17010.txt,Thomas Oppermann [SPD],spd,poi
33860,10,17,0,146,Was machen Sie denn?,Thomas Oppermann,Thomas Oppermann,data/txt/17010.txt,Thomas Oppermann [SPD],spd,poi
33939,10,17,0,225,Das war aber sehr kurz!,Thomas Oppermann,Thomas Oppermann,data/txt/17010.txt,Thomas Oppermann [SPD],spd,poi
35540,11,17,0,405,"Frau Präsidentin, der Brief, nach dem eben gefragt worden ist, betrifft die Umstände der Entlassung von Staatssekretär Wichert. Der Brief ist offenkundig an den Bundesverteidigungsminister zu Guttenberg geschrieben. Wir wollen Auskunft über den Inhalt dieses Briefes. Ganz offenkundig kann das nur der Bundesverteidigungsminister selbst. Deshalb verlange ich, dass er jetzt herbeigerufen wird.",Thomas Oppermann,Thomas Oppermann,data/txt/17011.txt,Thomas Oppermann (SPD),spd,speech
35543,11,17,0,408,,Thomas Oppermann,Thomas Oppermann,data/txt/17011.txt,Thomas Oppermann (SPD),spd,speech
35551,11,17,0,416,An den Minister!,Thomas Oppermann,Thomas Oppermann,data/txt/17011.txt,Thomas Oppermann [SPD],spd,poi
35583,11,17,0,448,Aber er hat es doch gemacht!,Thomas Oppermann,Thomas Oppermann,data/txt/17011.txt,Thomas Oppermann [SPD],spd,poi
35844,11,17,0,709,"Welche, Herr Guttenberg?",Thomas Oppermann,Thomas Oppermann,data/txt/17011.txt,Thomas Oppermann [SPD],spd,poi
35846,11,17,0,711,Das war alles in dem Bericht!,Thomas Oppermann,Thomas Oppermann,data/txt/17011.txt,Thomas Oppermann [SPD],spd,poi
35849,11,17,0,714,Er sagt aber noch etwas anderes!,Thomas Oppermann,Thomas Oppermann,data/txt/17011.txt,Thomas Oppermann [SPD],spd,poi
35855,11,17,0,720,Der Beifall wird immer schwächer!,Thomas Oppermann,Thomas Oppermann,data/txt/17011.txt,Thomas Oppermann [SPD],spd,poi
35940,11,17,0,805,"Frau Präsidentin! Sehr geehrter Herr zu Guttenberg, vor Ihrer Rede habe ich mich gefragt, warum Außenminister Westerwelle heute in einer so wichtigen verteidigungs- und außenpolitischen Debatte eigentlich nicht da ist,",Thomas Oppermann,Thomas Oppermann,data/txt/17011.txt,Thomas Oppermann (SPD),spd,speech
35942,11,17,0,807,"um Ihnen nicht wenigstens durch seine physische Anwesenheit Unterstützung zu leisten. Nach Ihrer Rede weiß ich, warum er nicht gekommen ist. In diese Sache will er sich nicht hineinziehen lassen.",Thomas Oppermann,Thomas Oppermann,data/txt/17011.txt,Thomas Oppermann (SPD),spd,speech
35945,11,17,0,810,"Sie haben hier eben unter Hinweis auf den Untersuchungsausschuss kritisiert, es sei Klamauk, wenn Sie jetzt gleichzeitig gebeten würden, einen Bericht im Verteidigungsausschuss vorzulegen. Ich muss Sie einmal darauf hinweisen, dass die Rechtsprechung des Bundesverfassungsgerichtes erst in diesem Sommer eindeutig klargestellt hat, dass der Grundsatz der parlamentarischen Verantwortlichkeit der Regierung durch Untersuchungsausschüsse in keiner Weise ersetzt wird. Sie werden sich in den nächsten Wochen und Monaten daran gewöhnen müssen, dass wir diese Frage nicht nur im Untersuchungsausschuss, sondern auch im Plenum des Deutschen Bundestages diskutieren.",Thomas Oppermann,Thomas Oppermann,data/txt/17011.txt,Thomas Oppermann (SPD),spd,speech
35947,11,17,0,812,"Herr zu Guttenberg, es wäre auch angemessen, wenn Sie künftig zur Fragestunde kämen und nicht nur den Staatssekretär schickten. Wer bei Beckmann antwortet, der kann auch im Bundestag antworten.",Thomas Oppermann,Thomas Oppermann,data/txt/17011.txt,Thomas Oppermann (SPD),spd,speech
35950,11,17,0,815,"Wer das ablehnt, der hat ein komisches parlamentarisches Verständnis.",Thomas Oppermann,Thomas Oppermann,data/txt/17011.txt,Thomas Oppermann (SPD),spd,speech
35953,11,17,0,818,,Thomas Oppermann,Thomas Oppermann,data/txt/17011.txt,Thomas Oppermann (SPD),spd,speech
35979,11,17,0,844,"Ich komme zum Schluss. - Ich bin sicher,",Thomas Oppermann,Thomas Oppermann,data/txt/17011.txt,Thomas Oppermann (SPD),spd,speech
35981,11,17,0,846,"dass Sie, wenn Sie nicht die Wahrheit gesagt haben, am Ende von sich aus Ihren Platz räumen. Ein Verteidigungsminister muss die Wahrheit sagen. Ein Verteidigungsminister, der nicht die Wahrheit sagt, ist nicht tragbar.",Thomas Oppermann,Thomas Oppermann,data/txt/17011.txt,Thomas Oppermann (SPD),spd,speech
35985,11,17,0,850,,Thomas Oppermann,Thomas Oppermann,data/txt/17011.txt,Thomas Oppermann (SPD),spd,speech
35990,11,17,0,855,Hat ja geklappt!,Thomas Oppermann,Thomas Oppermann,data/txt/17011.txt,Thomas Oppermann [SPD],spd,poi
39422,13,17,0,77,Sagen Sie doch mal was zu den russischen Oligarchen!,Thomas Oppermann,Thomas Oppermann,data/txt/17013.txt,Thomas Oppermann [SPD],spd,poi
40232,14,17,0,96,"Herr Präsident! Meine Damen und Herren! Lieber Kollege Altmaier, wer in der falschen Sache immer wieder gewinnt, kann trotzdem der Verlierer sein.",Thomas Oppermann,Thomas Oppermann,data/txt/17014.txt,Thomas Oppermann (SPD),spd,speech
40235,14,17,0,99,"Bei einer Umfrage von n-tv heute Morgen, ob die Bundesregierung käuflich sei, haben 82 Prozent mit Ja und 8 Prozent mit Nein geantwortet.",Thomas Oppermann,Thomas Oppermann,data/txt/17014.txt,Thomas Oppermann (SPD),spd,speech
40237,14,17,0,101,"Ich weiß nicht, ob die Spenden von 820 000 Euro an die CSU und von 1,1 Millionen Euro an die FDP durch Baron August von Finck mit dem Parteiengesetz vereinbar sind. Das wird der Präsident des Deutschen Bundestages prüfen. Wir warten das Ergebnis dieser Prüfung ab.

Eines können wir aber schon heute feststellen: Das Mehrwertsteuergeschenk für Hotelketten ist mit den Grundsätzen des allgemeinen Wohls im demokratischen und sozialen Rechtsstaat in eklatanter Weise unvereinbar.",Thomas Oppermann,Thomas Oppermann,data/txt/17014.txt,Thomas Oppermann (SPD),spd,speech
40239,14,17,0,103,Dieses allgemeine Wohl wird nicht durch die Summe mächtiger Einzelinteressen definiert.,Thomas Oppermann,Thomas Oppermann,data/txt/17014.txt,Thomas Oppermann (SPD),spd,speech
40241,14,17,0,105,"Maßstab für das allgemeine Wohl ist vielmehr das grundlegende Bedürfnis der Menschen, ihren Lebensunterhalt aus eigener Anstrengung zu verdienen und deshalb an Arbeit, Bildung, Gesundheit und sozialer Sicherheit teilzuhaben. Das ist der Maßstab und nicht die Interessen von Apothekern, von Hotelbesitzern, von Steuerberatern und anderen einzelnen Gruppen, die Sie bisher bedient haben.",Thomas Oppermann,Thomas Oppermann,data/txt/17014.txt,Thomas Oppermann (SPD),spd,speech
40243,14,17,0,107,"In einer parlamentarischen Demokratie muss man zumindest den Versuch unternehmen, für ein Gesetz eine allgemeine Plausibilität zu bekommen. Ich sage Ihnen: Das ist Ihnen beim Steuergeschenkgesetz nicht gelungen. 15 von 16 Experten haben den Gesetzentwurf bei der Anhörung abgelehnt.",Thomas Oppermann,Thomas Oppermann,data/txt/17014.txt,Thomas Oppermann (SPD),spd,speech
40245,14,17,0,109,"Der Finanzwissenschaftler Professor Homburg hat es als ökonomischen Irrsinn bezeichnet, und Norbert Lammert von der CDU hat gesagt, es sei willkürlich, bürokratisch und unsinnig.",Thomas Oppermann,Thomas Oppermann,data/txt/17014.txt,Thomas Oppermann (SPD),spd,speech
40247,14,17,0,111,"Ich frage Sie: Warum haben Sie dieses Gesetz trotzdem durchgesetzt? Sie haben es durchgesetzt, weil Sie die Interessen einer ganz bestimmten Gruppe befriedigen wollen. Sie haben das allgemeine Wohl aus den Augen verloren.",Thomas Oppermann,Thomas Oppermann,data/txt/17014.txt,Thomas Oppermann (SPD),spd,speech
40249,14,17,0,113,,Thomas Oppermann,Thomas Oppermann,data/txt/17014.txt,Thomas Oppermann (SPD),spd,speech
40254,14,17,0,118,"Gerne. Ich habe verstanden, Herr Präsident. - Ich finde es unerträglich, dass ein Milliardär mit einer Mil-lionenspende maßgeblich Einfluss darauf nehmen kann, was die Mehrheit hier im Bundestag beschließt.",Thomas Oppermann,Thomas Oppermann,data/txt/17014.txt,Thomas Oppermann (SPD),spd,speech
40257,14,17,0,121,"Ich finde es schlimm, dass Sie damit den Anschein erweckt haben, als ob unser Staat käuflich sei.",Thomas Oppermann,Thomas Oppermann,data/txt/17014.txt,Thomas Oppermann (SPD),spd,speech
40259,14,17,0,123,"Deshalb tragen Sie jetzt die Verantwortung und die Beweislast dafür, dass dieser böse Anschein einer gekauften Koalition widerlegt wird.",Thomas Oppermann,Thomas Oppermann,data/txt/17014.txt,Thomas Oppermann (SPD),spd,speech
40261,14,17,0,125,"Wir fordern Folgendes:

Erstens. CSU und FDP müssen diese Spenden zurückgeben. Auf diesem Geld liegt kein Segen.",Thomas Oppermann,Thomas Oppermann,data/txt/17014.txt,Thomas Oppermann (SPD),spd,speech
40263,14,17,0,127,Zweitens. Das mit dem Makel der Käuflichkeit behaftete Mehrwertsteuergeschenk für Hotelketten muss aufgehoben werden.,Thomas Oppermann,Thomas Oppermann,data/txt/17014.txt,Thomas Oppermann (SPD),spd,speech
40265,14,17,0,129,"Drittens. Frau Bundeskanzlerin, Sie haben den Koalitionsvertrag verhandelt,",Thomas Oppermann,Thomas Oppermann,data/txt/17014.txt,Thomas Oppermann (SPD),spd,speech
40267,14,17,0,131,"und deshalb tragen Sie Verantwortung dafür, dass für den hemmungslosen Durchmarsch der Lobbyisten in Deutschland alle Türen aufgemacht worden sind.",Thomas Oppermann,Thomas Oppermann,data/txt/17014.txt,Thomas Oppermann (SPD),spd,speech
40269,14,17,0,133,"Ich fordere Sie auf: Machen Sie diese Türen wieder zu und kehren Sie zurück zu einer Politik, die am allgemeinen Wohl interessiert ist!

Ich sage Ihnen noch etwas, Frau Bundeskanzlerin: Ihr persönlicher politischer Aufstieg war verbunden mit dem Ende der „Bimbesrepublik“ Deutschland.",Thomas Oppermann,Thomas Oppermann,data/txt/17014.txt,Thomas Oppermann (SPD),spd,speech
40272,14,17,0,136,"Ich prophezeie Ihnen: Wenn es Ihnen nicht gelingt, die Rückkehr in die „Bimbesrepublik“ zu verhindern, dann ist das der Anfang Ihres politischen Abstiegs.",Thomas Oppermann,Thomas Oppermann,data/txt/17014.txt,Thomas Oppermann (SPD),spd,speech
40274,14,17,0,138,,Thomas Oppermann,Thomas Oppermann,data/txt/17014.txt,Thomas Oppermann (SPD),spd,speech
40433,14,17,0,297,Hat Nešković mitgestimmt?,Thomas Oppermann,Thomas Oppermann,data/txt/17014.txt,Thomas Oppermann [SPD],spd,poi
42276,15,17,0,14,Da freuen sie sich!,Thomas Oppermann,Thomas Oppermann,data/txt/17015.txt,Thomas Oppermann [SPD],spd,poi
42308,15,17,0,46,Neustart!,Thomas Oppermann,Thomas Oppermann,data/txt/17015.txt,Thomas Oppermann [SPD],spd,poi
42377,15,17,0,115,Schließen Sie denn Beitragserhöhungen aus?,Thomas Oppermann,Thomas Oppermann,data/txt/17015.txt,Thomas Oppermann [SPD],spd,poi
42426,15,17,0,164,Sie? Bitte nicht!,Thomas Oppermann,Thomas Oppermann,data/txt/17015.txt,Thomas Oppermann [SPD],spd,poi
42437,15,17,0,175,Wäre aber wünschenswert!,Thomas Oppermann,Thomas Oppermann,data/txt/17015.txt,Thomas Oppermann [SPD],spd,poi
42452,15,17,0,190,"Das ist bildungsfeindlich, was Sie da machen!",Thomas Oppermann,Thomas Oppermann,data/txt/17015.txt,Thomas Oppermann [SPD],spd,poi
42460,15,17,0,198,Jetzt sind wir sehr gespannt!,Thomas Oppermann,Thomas Oppermann,data/txt/17015.txt,Thomas Oppermann [SPD],spd,poi
42477,15,17,0,215,Es wird bürokratischer und teurer!,Thomas Oppermann,Thomas Oppermann,data/txt/17015.txt,Thomas Oppermann [SPD],spd,poi
42480,15,17,0,218,Die kleinen Einkommen zahlen doch gar keine Steuern!,Thomas Oppermann,Thomas Oppermann,data/txt/17015.txt,Thomas Oppermann [SPD],spd,poi
42482,15,17,0,220,"Frau Bundeskanzlerin, die kleinen Einkommen zahlen gar keine Steuern!",Thomas Oppermann,Thomas Oppermann,data/txt/17015.txt,Thomas Oppermann [SPD],spd,poi
42502,15,17,0,240,Mit der Kopfpauschale?,Thomas Oppermann,Thomas Oppermann,data/txt/17015.txt,Thomas Oppermann [SPD],spd,poi
42522,15,17,0,260,Das haben Sie im Wahlkampf noch bestritten!,Thomas Oppermann,Thomas Oppermann,data/txt/17015.txt,Thomas Oppermann [SPD],spd,poi
42526,15,17,0,264,Davor haben die meisten Angst!,Thomas Oppermann,Thomas Oppermann,data/txt/17015.txt,Thomas Oppermann [SPD],spd,poi
42535,15,17,0,273,Mit der FDP?,Thomas Oppermann,Thomas Oppermann,data/txt/17015.txt,Thomas Oppermann [SPD],spd,poi
42668,15,17,0,406,"Koste es, was es wolle!",Thomas Oppermann,Thomas Oppermann,data/txt/17015.txt,Thomas Oppermann [SPD],spd,poi
42674,15,17,0,412,Warum klatscht die Union da gar nicht?,Thomas Oppermann,Thomas Oppermann,data/txt/17015.txt,Thomas Oppermann [SPD],spd,poi
42689,15,17,0,427,Und das finanzieren Sie alles auf Pump! Sie haben doch gar kein Geld dafür!,Thomas Oppermann,Thomas Oppermann,data/txt/17015.txt,Thomas Oppermann [SPD],spd,poi
42697,15,17,0,435,"Ja, wo denn?",Thomas Oppermann,Thomas Oppermann,data/txt/17015.txt,Thomas Oppermann [SPD],spd,poi
42699,15,17,0,437,"Dann sagen Sie doch mal, wo!",Thomas Oppermann,Thomas Oppermann,data/txt/17015.txt,Thomas Oppermann [SPD],spd,poi
42707,15,17,0,445,"Sagen Sie mal, wo Sie sparen wollen!",Thomas Oppermann,Thomas Oppermann,data/txt/17015.txt,Thomas Oppermann [SPD],spd,poi
42709,15,17,0,447,Hotelsubvention!,Thomas Oppermann,Thomas Oppermann,data/txt/17015.txt,Thomas Oppermann [SPD],spd,poi
42731,15,17,0,469,Erst Mövenpick und dann das Land!,Thomas Oppermann,Thomas Oppermann,data/txt/17015.txt,Thomas Oppermann [SPD],spd,poi
42753,15,17,0,491,Wollen Sie dazu die Steuern erhöhen?,Thomas Oppermann,Thomas Oppermann,data/txt/17015.txt,Thomas Oppermann [SPD],spd,poi
42796,15,17,0,534,Antworten Sie doch mal auf die Frage! Das war eine konkrete Frage!,Thomas Oppermann,Thomas Oppermann,data/txt/17015.txt,Thomas Oppermann [SPD],spd,poi
42902,15,17,0,640,Jetzt kommt der Neustart!,Thomas Oppermann,Thomas Oppermann,data/txt/17015.txt,Thomas Oppermann [SPD],spd,poi
42908,15,17,0,646,Dann haben Sie nicht zugehört!,Thomas Oppermann,Thomas Oppermann,data/txt/17015.txt,Thomas Oppermann [SPD],spd,poi
42910,15,17,0,648,Auf Vorschlag der SPD!,Thomas Oppermann,Thomas Oppermann,data/txt/17015.txt,Thomas Oppermann [SPD],spd,poi
42924,15,17,0,662,Peer Steinbrück!,Thomas Oppermann,Thomas Oppermann,data/txt/17015.txt,Thomas Oppermann [SPD],spd,poi
42927,15,17,0,665,"Und ich habe den Eindruck, dass Sie keinen haben!",Thomas Oppermann,Thomas Oppermann,data/txt/17015.txt,Thomas Oppermann [SPD],spd,poi
42932,15,17,0,670,Sie waren auch schon mal besser!,Thomas Oppermann,Thomas Oppermann,data/txt/17015.txt,Thomas Oppermann [SPD],spd,poi
42935,15,17,0,673,Das haben Sie noch vor sich!,Thomas Oppermann,Thomas Oppermann,data/txt/17015.txt,Thomas Oppermann [SPD],spd,poi
42941,15,17,0,679,Und des Hotelgewerbes!,Thomas Oppermann,Thomas Oppermann,data/txt/17015.txt,Thomas Oppermann [SPD],spd,poi
44338,16,17,0,44,Ist das eine Frage der Rechtspolitik oder der Arbeitsmarktpolitik?,Thomas Oppermann,Thomas Oppermann,data/txt/17016.txt,Thomas Oppermann [SPD],spd,poi
44345,16,17,0,51,Das stimmt nicht!,Thomas Oppermann,Thomas Oppermann,data/txt/17016.txt,Thomas Oppermann [SPD],spd,poi
44347,16,17,0,53,Was? Mit Rüttgers waren wir uns schon einig!,Thomas Oppermann,Thomas Oppermann,data/txt/17016.txt,Thomas Oppermann [SPD],spd,poi
44361,16,17,0,67,Ihre Zeit als Familienministerin!,Thomas Oppermann,Thomas Oppermann,data/txt/17016.txt,Thomas Oppermann [SPD],spd,poi
47933,18,17,0,286,Aber das war ein bisschen undurchsichtig bei Ihnen!,Thomas Oppermann,Thomas Oppermann,data/txt/17018.txt,Thomas Oppermann [SPD],spd,poi
48357,19,17,0,102,Jetzt kommen Sie aber auch mal zur Sache!,Thomas Oppermann,Thomas Oppermann,data/txt/17019.txt,Thomas Oppermann [SPD],spd,poi
48363,19,17,0,108,Sieht Frau von der Leyen das auch so?,Thomas Oppermann,Thomas Oppermann,data/txt/17019.txt,Thomas Oppermann [SPD],spd,poi
51888,20,17,0,603,"Und was machen Sie gerade dafür? Erzählen Sie, was Sie machen!",Thomas Oppermann,Thomas Oppermann,data/txt/17020.txt,Thomas Oppermann [SPD],spd,poi
51898,20,17,0,613,Sie wollen doch nur Ihre Lobby davor schützen!,Thomas Oppermann,Thomas Oppermann,data/txt/17020.txt,Thomas Oppermann [SPD],spd,poi
51907,20,17,0,622,Aber Sie wollen das ja nicht mal mit Ausnahmen!,Thomas Oppermann,Thomas Oppermann,data/txt/17020.txt,Thomas Oppermann [SPD],spd,poi
51915,20,17,0,630,"Sie sagen doch, es ist zu viel Geld im Umlauf! Was passiert, wenn Sie das Geld he-rausnehmen?",Thomas Oppermann,Thomas Oppermann,data/txt/17020.txt,Thomas Oppermann [SPD],spd,poi
51945,20,17,0,660,Die haben keinen Kompass!,Thomas Oppermann,Thomas Oppermann,data/txt/17020.txt,Thomas Oppermann [SPD],spd,poi
52157,20,17,0,872,Das ist Ihr Generalsekretär!,Thomas Oppermann,Thomas Oppermann,data/txt/17020.txt,Thomas Oppermann [SPD],spd,poi
52167,20,17,0,882,Das sieht Herr Seehofer aber ganz anders!,Thomas Oppermann,Thomas Oppermann,data/txt/17020.txt,Thomas Oppermann [SPD],spd,poi
52184,20,17,0,899,Aber Sie haben die Frage nicht beantwortet!,Thomas Oppermann,Thomas Oppermann,data/txt/17020.txt,Thomas Oppermann [SPD],spd,poi
57559,24,17,0,1048,Eine große Nummer haben Sie noch nicht zustande gebracht!,Thomas Oppermann,Thomas Oppermann,data/txt/17024.txt,Thomas Oppermann [SPD],spd,poi
61547,27,17,0,492,"Bei der Hotelsteuer, ja!",Thomas Oppermann,Thomas Oppermann,data/txt/17027.txt,Thomas Oppermann [SPD],spd,poi
61596,27,17,0,541,Er leidet nicht!,Thomas Oppermann,Thomas Oppermann,data/txt/17027.txt,Thomas Oppermann [SPD],spd,poi
61652,27,17,0,597,"Frau Kollegin Flach, Sie reden hier für die FDP-Bundestagsfraktion. Können Sie uns mal erklären, warum Bundesgesundheitsminister Rösler in dieser Debatte nicht das Wort ergreift? Hat er uns in dieser Diskussion nichts zu sagen, oder müssen Sie ihn verstecken?",Thomas Oppermann,Thomas Oppermann,data/txt/17027.txt,Thomas Oppermann (SPD),spd,speech
61655,27,17,0,600,,Thomas Oppermann,Thomas Oppermann,data/txt/17027.txt,Thomas Oppermann (SPD),spd,speech
64925,28,17,0,187,Wie die Kesselflicker streiten sie!,Thomas Oppermann,Thomas Oppermann,data/txt/17028.txt,Thomas Oppermann [SPD],spd,poi
64927,28,17,0,189,Der ist sowieso ein Leichtmatrose!,Thomas Oppermann,Thomas Oppermann,data/txt/17028.txt,Thomas Oppermann [SPD],spd,poi
65027,28,17,0,289,Die Kanzlerin!,Thomas Oppermann,Thomas Oppermann,data/txt/17028.txt,Thomas Oppermann [SPD],spd,poi
65034,28,17,0,296,Gucken Sie einmal die Umfragen in Nordrhein-Westfalen an! Seien Sie mal etwas demütiger! In Nordrhein-Westfalen können Sie so nicht mehr auftrumpfen!,Thomas Oppermann,Thomas Oppermann,data/txt/17028.txt,Thomas Oppermann [SPD],spd,poi
69029,30,17,0,173,Mit dem Liberalen Sparbuch!,Thomas Oppermann,Thomas Oppermann,data/txt/17030.txt,Thomas Oppermann [SPD],spd,poi
69046,30,17,0,190,Durch Ihren Beitrag ganz bestimmt nicht!,Thomas Oppermann,Thomas Oppermann,data/txt/17030.txt,Thomas Oppermann [SPD],spd,poi
69054,30,17,0,198,Wir regieren schon?,Thomas Oppermann,Thomas Oppermann,data/txt/17030.txt,Thomas Oppermann [SPD],spd,poi
69060,30,17,0,204,"Sind Sie sicher, dass Ihnen Ihre Leute folgen können?",Thomas Oppermann,Thomas Oppermann,data/txt/17030.txt,Thomas Oppermann [SPD],spd,poi
69063,30,17,0,207,Sie haben Ihre Leute nicht überzeugt!,Thomas Oppermann,Thomas Oppermann,data/txt/17030.txt,Thomas Oppermann [SPD],spd,poi
69080,30,17,0,224,In die Kopfpauschale! Nicht für die Kinder!,Thomas Oppermann,Thomas Oppermann,data/txt/17030.txt,Thomas Oppermann [SPD],spd,poi
69091,30,17,0,235,Ein Kongress! Ein Zwischengipfel! Ein Arbeitskreis!,Thomas Oppermann,Thomas Oppermann,data/txt/17030.txt,Thomas Oppermann [SPD],spd,poi
69101,30,17,0,245,Darum geht es doch nicht!,Thomas Oppermann,Thomas Oppermann,data/txt/17030.txt,Thomas Oppermann [SPD],spd,poi
69120,30,17,0,264,Klingt nicht sehr überzeugend!,Thomas Oppermann,Thomas Oppermann,data/txt/17030.txt,Thomas Oppermann [SPD],spd,poi
69169,30,17,0,313,Bürgerversicherung! Ist doch klar!,Thomas Oppermann,Thomas Oppermann,data/txt/17030.txt,Thomas Oppermann [SPD],spd,poi
69193,30,17,0,337,Seit wann?,Thomas Oppermann,Thomas Oppermann,data/txt/17030.txt,Thomas Oppermann [SPD],spd,poi
69325,30,17,0,469,80 Milliarden Schulden!,Thomas Oppermann,Thomas Oppermann,data/txt/17030.txt,Thomas Oppermann [SPD],spd,poi
74953,32,17,0,951,"Ich glaube, Sie brauchen dringend seinen Rat!",Thomas Oppermann,Thomas Oppermann,data/txt/17032.txt,Thomas Oppermann [SPD],spd,poi
76582,34,17,0,84,Davon haben wir nichts gespürt!,Thomas Oppermann,Thomas Oppermann,data/txt/17034.txt,Thomas Oppermann [SPD],spd,poi
76611,34,17,0,113,Durchsichtig!,Thomas Oppermann,Thomas Oppermann,data/txt/17034.txt,Thomas Oppermann [SPD],spd,poi
80420,35,17,0,977,Kommen Sie mal zum Schluss!,Thomas Oppermann,Thomas Oppermann,data/txt/17035.txt,Thomas Oppermann [SPD],spd,poi
80505,35,17,0,1062,"Jetzt kommen Sie mal zur Sache, Herr Kollege!",Thomas Oppermann,Thomas Oppermann,data/txt/17035.txt,Thomas Oppermann [SPD],spd,poi
80553,35,17,0,1110,"Erstens fordert sie nicht, und zweitens handelt sie nicht!",Thomas Oppermann,Thomas Oppermann,data/txt/17035.txt,Thomas Oppermann [SPD],spd,poi
80683,35,17,0,1240,"Ja, ja, darauf haben wir aber lange warten müssen!",Thomas Oppermann,Thomas Oppermann,data/txt/17035.txt,Thomas Oppermann [SPD],spd,poi
80688,35,17,0,1245,Mehr Netto in die eigene Tasche?,Thomas Oppermann,Thomas Oppermann,data/txt/17035.txt,Thomas Oppermann [SPD],spd,poi
80691,35,17,0,1248,Wann kommen denn Ihre Schritte?,Thomas Oppermann,Thomas Oppermann,data/txt/17035.txt,Thomas Oppermann [SPD],spd,poi
80693,35,17,0,1250,Sie sind ein Vorkämpfer der Kapitalverkehrsfreiheit!,Thomas Oppermann,Thomas Oppermann,data/txt/17035.txt,Thomas Oppermann [SPD],spd,poi
80697,35,17,0,1254,Bei den Hotels haben Sie die Steuern erst mal halbiert!,Thomas Oppermann,Thomas Oppermann,data/txt/17035.txt,Thomas Oppermann [SPD],spd,poi
80701,35,17,0,1258,Auf die Kanal-inseln!,Thomas Oppermann,Thomas Oppermann,data/txt/17035.txt,Thomas Oppermann [SPD],spd,poi
80710,35,17,0,1267,Die Wagenknecht will alles besteuern!,Thomas Oppermann,Thomas Oppermann,data/txt/17035.txt,Thomas Oppermann [SPD],spd,poi
80736,35,17,0,1293,Das sind Fluchthelfer!,Thomas Oppermann,Thomas Oppermann,data/txt/17035.txt,Thomas Oppermann [SPD],spd,poi
80976,35,17,0,1533,Und das steht alles bei Röttgen? Mein lieber Mann!,Thomas Oppermann,Thomas Oppermann,data/txt/17035.txt,Thomas Oppermann [SPD],spd,poi
