id,sitzung,wahlperiode,in_writing,sequence,text,speaker_cleaned,speaker_fp,filename,speaker,speaker_party,type
245265,130,17,0,2102,Ich habe mich mit meiner Kollegin verständigt.,Thomas Oppermann,Thomas Oppermann,data/txt/17130.txt,Thomas Oppermann (SPD),spd,speech
245267,130,17,0,2104,"Überhangmandate sind verfassungswidrig, weil sie den Wählern ein doppeltes Stimmgewicht geben, die durch Stimmensplitting dafür sorgen, dass nicht nur der direkt gewählte, sondern auch ein weiterer Kandidat in den Bundestag kommt. Das ist mit dem großen Versprechen der Demokratie aber nicht vereinbar. Dieses große Versprechen der Demokratie ist: gleiches Wahlrecht für alle und gleiches Stimmgewicht. Damit ist ein doppeltes Stimmgewicht nicht vereinbar.",Thomas Oppermann,Thomas Oppermann,data/txt/17130.txt,Thomas Oppermann (SPD),spd,speech
245269,130,17,0,2106,Der zweite Punkt ist: Überhangmandate führen zu einer regionalen Ungleichverteilung der Mandate. Die CDU hat in Baden-Württemberg bei der letzten Bundestagswahl zehn Überhangmandate gewonnen.,Thomas Oppermann,Thomas Oppermann,data/txt/17130.txt,Thomas Oppermann (SPD),spd,speech
245271,130,17,0,2108,"Allein durch die Überhangmandate hat Baden-Württemberg ein zusätzliches politisches Gewicht im Deutschen Bundestag erhalten, das dem ganzen politischen Gewicht der Hansestadt Hamburg entspricht, die über 13 Mandate verfügt.",Thomas Oppermann,Thomas Oppermann,data/txt/17130.txt,Thomas Oppermann (SPD),spd,speech
245273,130,17,0,2110,"Drittens. Überhangmandate verletzen die Chancengleichheit der politischen Parteien. Die SPD braucht für ein Mandat 68 500 Stimmen, die CSU 62 000 Stimmen und die CDU 61 000 Stimmen. Ein Wahlrecht, das so unterschiedliche Voraussetzungen für die Gewinnung eines Mandates vorsieht, ist kein faires Wahlrecht.

Viertens und letztens. Überhangmandate können die Mehrheit im Deutschen Bundestag umdrehen. Maßgebend für die Zusammensetzung des Parlaments sind die Zweitstimmen; das hat auch das Bundesverfassungsgericht mehrfach betont. Bei einer großen Zahl von Überhangmandaten kann es jetzt dazu kommen, dass die Parteien, die eine Mehrheit der Stimmen erhalten haben, nicht die Mehrheit der Mandate haben. Das wäre unerträglich. Das würde uns in eine Verfassungs- und Staatskrise führen. Deshalb sage ich: Sie ignorieren das Bundesverfassungsgericht. Sie benutzen das Wahlrecht zum eigenen Machterhalt.",Thomas Oppermann,Thomas Oppermann,data/txt/17130.txt,Thomas Oppermann (SPD),spd,speech
245275,130,17,0,2112,"Die Stimme eines jeden Bürgers und einer jeden Bürgerin muss gleich viel wert sein. Damit das durchgesetzt wird, werden wir vor dem Bundesverfassungsgericht klagen. Wir hoffen darauf, dass das Bundesverfassungsgericht ein gleiches Wahlrecht durchsetzt.

Vielen Dank.",Thomas Oppermann,Thomas Oppermann,data/txt/17130.txt,Thomas Oppermann (SPD),spd,speech
245277,130,17,0,2114,,Thomas Oppermann,Thomas Oppermann,data/txt/17130.txt,Thomas Oppermann (SPD),spd,speech
245289,130,17,0,2126,Warum wollten Sie dann ausgerechnet mit uns den Kompromiss machen?,Thomas Oppermann,Thomas Oppermann,data/txt/17130.txt,Thomas Oppermann [SPD],spd,poi
245314,130,17,0,2151,Das haben Sie aber doch selber erzeugt! Das gab es vorher gar nicht!,Thomas Oppermann,Thomas Oppermann,data/txt/17130.txt,Thomas Oppermann [SPD],spd,poi
245323,130,17,0,2160,Na ja! Das bezweifle ich!,Thomas Oppermann,Thomas Oppermann,data/txt/17130.txt,Thomas Oppermann [SPD],spd,poi
245354,130,17,0,2191,Sie nähern sich den 5 Prozent ja auch wieder in bedrohlicher Weise an!,Thomas Oppermann,Thomas Oppermann,data/txt/17130.txt,Thomas Oppermann [SPD],spd,poi
245433,130,17,0,2270,Weil Sie sich nicht einigen konnten!,Thomas Oppermann,Thomas Oppermann,data/txt/17130.txt,Thomas Oppermann [SPD],spd,poi
245450,130,17,0,2287,Aber jetzt sind wir bei Ihnen!,Thomas Oppermann,Thomas Oppermann,data/txt/17130.txt,Thomas Oppermann [SPD],spd,poi
245485,130,17,0,2322,So ist es!,Thomas Oppermann,Thomas Oppermann,data/txt/17130.txt,Thomas Oppermann [SPD],spd,poi
245504,130,17,0,2341,Seit drei!,Thomas Oppermann,Thomas Oppermann,data/txt/17130.txt,Thomas Oppermann [SPD],spd,poi
245507,130,17,0,2344,Ein Dreivierteljahr!,Thomas Oppermann,Thomas Oppermann,data/txt/17130.txt,Thomas Oppermann [SPD],spd,poi
245559,130,17,0,2396,Das ist so Ihre Art!,Thomas Oppermann,Thomas Oppermann,data/txt/17130.txt,Thomas Oppermann [SPD],spd,poi
245565,130,17,0,2402,Ah!,Thomas Oppermann,Thomas Oppermann,data/txt/17130.txt,Thomas Oppermann [SPD],spd,poi
245568,130,17,0,2405,Sie wollen es! Sie haben 24 Stühle aufgestellt!,Thomas Oppermann,Thomas Oppermann,data/txt/17130.txt,Thomas Oppermann [SPD],spd,poi
245580,130,17,0,2417,Geschenkt!,Thomas Oppermann,Thomas Oppermann,data/txt/17130.txt,Thomas Oppermann [SPD],spd,poi
245582,130,17,0,2419,Es geht doch gar nicht um Tortenstücke!,Thomas Oppermann,Thomas Oppermann,data/txt/17130.txt,Thomas Oppermann [SPD],spd,poi
245591,130,17,0,2428,Da backen Sie kleinere Brötchen!,Thomas Oppermann,Thomas Oppermann,data/txt/17130.txt,Thomas Oppermann [SPD],spd,poi
247798,132,17,0,131,"Da stellt sich für mich die Frage, Herr Staatssekretär, wie Sie das ohne Kenntnis des Quellcodes machen können.

Meine eigentliche Frage lautet, ob es nicht insgesamt angezeigt wäre, wenn in einer so sensiblen Materie wie der Überwachung laufender Computerkommunikation durch den Staat der Staat selbst die volle Kontrolle über die Überwachungsvorgänge behält, indem er die Software selbst entwickelt und weiterentwickelt, sicher auch unter Nutzung privaten Know-hows, aber doch unter ständiger vollständiger staatlicher Kontrolle des gesamten Vorgangs.",Thomas Oppermann,Thomas Oppermann,data/txt/17132.txt,Thomas Oppermann (SPD),spd,speech
247962,132,17,0,295,"Herr Staatssekretär, Sie haben eben gesagt, dass die Bundesregierung die Rechtsprechung der Gerichte respektiert. Das nenne ich einen Fortschritt. Das ist ja nicht immer so.",Thomas Oppermann,Thomas Oppermann,data/txt/17132.txt,Thomas Oppermann (SPD),spd,speech
247965,132,17,0,298,"Die Vorschriften der Strafprozessordnung, um die es hier geht - §§ 100 a und 100 b StPO -, sind in einer Zeit geschaffen worden, in der wir Skype-Telefonie über Computer und Internet noch nicht kannten. Das Bundesverfassungsgericht hat bei der Formulierung des Grundrechts auf Gewährleistung der Vertraulichkeit und auf Sicherheit informationstechnischer Systeme Wert darauf gelegt, dass ein Eingriff in diese Grundrechte nur aufgrund von präzisen, bereichsspezifischen Regelungen und nach Maßgabe des Verhältnismäßigkeitsgrundsatzes erfolgen kann. Sehen Sie vor diesem Hintergrund nicht einen grundlegenden Regelungsbedarf in der Strafprozessordnung? Sie haben gesagt, dass Sie die Rechtsprechung respektieren und die Rechtssituation prüfen wollen. Wie wahrscheinlich ist es, dass diesbezüglich ein Vorschlag für eine Neuregelung von Ihnen vorgelegt wird?",Thomas Oppermann,Thomas Oppermann,data/txt/17132.txt,Thomas Oppermann (SPD),spd,speech
248113,132,17,0,446,"Verehrter Herr Präsident! Meine Damen und Herren! Ich möchte meinen Beitrag beginnen mit einem Lob für diejenigen, die den Grund gesetzt haben für diese Aktuelle Stunde. Das ist der Chaos Computer Club.",Thomas Oppermann,Thomas Oppermann,data/txt/17132.txt,Thomas Oppermann (SPD),spd,speech
248115,132,17,0,448,"Der hat den rechtswidrigen Einsatz von Staatstrojanern in Bayern analysiert und ist zu dem Ergebnis gekommen, dass es im Umgang mit Staatstrojanern eklatante Schwächen beim Grundrechtsschutz gibt.",Thomas Oppermann,Thomas Oppermann,data/txt/17132.txt,Thomas Oppermann (SPD),spd,speech
248117,132,17,0,450,"Die heutigen Gremiensitzungen, einschließlich der Fragestunde des Bundestages, haben gezeigt, dass viele politische Verantwortliche - nicht nur in Bayern - sorglos, fahrlässig und zum Teil ahnungslos mit so schwierigen Instrumenten wie dem Staatstrojaner umgehen.",Thomas Oppermann,Thomas Oppermann,data/txt/17132.txt,Thomas Oppermann (SPD),spd,speech
248120,132,17,0,453,"Das Beispiel zeigt: Für den effektiven Schutz der Grundrechte reicht es nicht, einen demokratischen Staat, unabhängige Gerichte und freie Medien zu haben. Vielmehr brauchen wir auch eine aufmerksame, wachsame Zivilgesellschaft. Der Chaos Computer Club ist ein hervorragender Repräsentant einer wachsamen Zivilgesellschaft in Deutschland.",Thomas Oppermann,Thomas Oppermann,data/txt/17132.txt,Thomas Oppermann (SPD),spd,speech
248122,132,17,0,455,"Der CCC hat chaotische Verhältnisse auch in der Bundesregierung aufgedeckt. Nur einen Tag, nachdem die Defizite der Staatstrojaner bekannt geworden sind, zetteln die beiden für die Verfassung und die Grundrechte zuständigen Minister, der Innenminister und die Justizministerin, einen Streit auf offener Bühne an. Erst sagt Friedrich, es habe keinen Einsatz eines Staatstrojaners von der Firma DigiTask auf Bundesebene gegeben. Dann muss er zugeben, dass sich auch der Bund dort eingedeckt hat.",Thomas Oppermann,Thomas Oppermann,data/txt/17132.txt,Thomas Oppermann (SPD),spd,speech
248124,132,17,0,457,"Die Justizministerin sah Bedarf für gesetzliche Präzisierungen. Der Innenminister sagte dann, es gebe keinen Graubereich, die Rechtslage sei klar. Im gleichen Atemzug sagte er aber, die Justizministerin müsse die Rechtslage klarstellen. Ich kann nur feststellen: Bei so viel politischem Durcheinander müssen die Bürgerinnen und Bürger das Vertrauen in die Funktionsfähigkeit unseres Rechtsstaates verlieren.",Thomas Oppermann,Thomas Oppermann,data/txt/17132.txt,Thomas Oppermann (SPD),spd,speech
248126,132,17,0,459,,Thomas Oppermann,Thomas Oppermann,data/txt/17132.txt,Thomas Oppermann (SPD),spd,speech
248143,132,17,0,476,Das war ein Forschungsprojekt!,Thomas Oppermann,Thomas Oppermann,data/txt/17132.txt,Thomas Oppermann [SPD],spd,poi
248148,132,17,0,481,"Heute regieren auch Sie, bitte schön!",Thomas Oppermann,Thomas Oppermann,data/txt/17132.txt,Thomas Oppermann [SPD],spd,poi
248220,132,17,0,553,Nur der CSU-Staat!,Thomas Oppermann,Thomas Oppermann,data/txt/17132.txt,Thomas Oppermann [SPD],spd,poi
248237,132,17,0,570,BKA läuft gut!,Thomas Oppermann,Thomas Oppermann,data/txt/17132.txt,Thomas Oppermann [SPD],spd,poi
248240,132,17,0,573,Wer hat denn dafür die politische Verantwortung?,Thomas Oppermann,Thomas Oppermann,data/txt/17132.txt,Thomas Oppermann [SPD],spd,poi
248247,132,17,0,580,"Das hat doch gar keiner behauptet, dass sich die Beamten rechtswidrig verhalten haben!",Thomas Oppermann,Thomas Oppermann,data/txt/17132.txt,Thomas Oppermann [SPD],spd,poi
248252,132,17,0,585,"Aber nicht in Bayern! Das gilt nicht für Bayern, was Sie da sagen!",Thomas Oppermann,Thomas Oppermann,data/txt/17132.txt,Thomas Oppermann [SPD],spd,poi
248254,132,17,0,587,In Bayern war das anders!,Thomas Oppermann,Thomas Oppermann,data/txt/17132.txt,Thomas Oppermann [SPD],spd,poi
248264,132,17,0,597,Sie haben ein sehr reduziertes Weltbild!,Thomas Oppermann,Thomas Oppermann,data/txt/17132.txt,Thomas Oppermann [SPD],spd,poi
250918,134,17,0,20,So ist es!,Thomas Oppermann,Thomas Oppermann,data/txt/17134.txt,Thomas Oppermann [SPD],spd,poi
251015,134,17,0,117,"Herr Präsident! Meine Damen und Herren! Wir befinden uns in der Tat in einer schwierigen Situation, in einer Situation, die dieses Parlament so noch nicht erlebt hat.

Zum zweiten Mal ist ein europäischer Gipfel verschoben worden. Die Bundeskanzlerin hat die für heute angekündigte Regierungserklärung zum Gipfel abgesagt. Heute Nachmittag soll in einer nichtöffentlichen Sitzung des Haushaltsausschusses legitimiert werden, über was am Wochenende beim Gipfel verhandelt wird. Da sagen Sie, Herr Barthle, wir sollten Vertrauen in diese Regierung haben. Ich sage Ihnen: Wir haben kein Vertrauen in diese Regierung.",Thomas Oppermann,Thomas Oppermann,data/txt/17134.txt,Thomas Oppermann (SPD),spd,speech
251017,134,17,0,119,"Es ist richtig: Über die Leitlinien zum Rettungsfonds wird nach dem Gesetz im Haushaltausschuss entschieden. Als wir aber vor drei Wochen dieses Gesetz im Bundestag verabschiedet haben, sind alle davon ausgegangen, dass Leitlinien eine Art Geschäftsordnung, technische Regeln sind. Aber nach der Verabschiedung des Gesetzes begann eine Debatte darüber, dass in diesen Leitlinien gehebelt werden soll. Die Leitlinien sind jetzt plötzlich der Ort, wo aus den Milliarden, die wir hier beschlossen haben, Billionen werden.",Thomas Oppermann,Thomas Oppermann,data/txt/17134.txt,Thomas Oppermann (SPD),spd,speech
251019,134,17,0,121,"Das berührt selbstverständlich das Ausfallrisiko und das Verlustrisiko. Dieses Verlustrisiko ist eine inhaltliche, materielle Frage und keine Frage, die in einer Geschäftsordnung geregelt werden kann.",Thomas Oppermann,Thomas Oppermann,data/txt/17134.txt,Thomas Oppermann (SPD),spd,speech
251022,134,17,0,124,"Wo kommen wir hin, wenn der Bundestag über Milliarden beschließen darf, aber die Entscheidung über die Billionen im nichtöffentlich tagenden Haushaltsausschuss fällt?",Thomas Oppermann,Thomas Oppermann,data/txt/17134.txt,Thomas Oppermann (SPD),spd,speech
251025,134,17,0,127,"Sie nähren doch mit diesem Verfahren den Verdacht, dass Sie uns und der Öffentlichkeit etwas unterjubeln wollen.",Thomas Oppermann,Thomas Oppermann,data/txt/17134.txt,Thomas Oppermann (SPD),spd,speech
251028,134,17,0,130,"Es kann doch nicht sein, dass wir hier über einen Teil der Richtlinien beschließen und nächste Woche der andere Teil kommt. Diese Richtlinien sind ein Torso. Der Bundesfinanzminister hat gestern im Haushaltsausschuss noch gesagt, das sei der Entwurf eines Entwurfes. Ich frage Sie, meine Damen und Herren von der Koalition: Können Sie wirklich alle Details überblicken, die in diesen Leitlinien geregelt sind?",Thomas Oppermann,Thomas Oppermann,data/txt/17134.txt,Thomas Oppermann (SPD),spd,speech
251030,134,17,0,132,"Haben Sie in diesen wenigen Stunden den notwendigen Sachverstand hinzuziehen können, um das jetzt beurteilen zu können? - Nein, meine Damen und Herren, dies ist kein angemessenes Verfahren.

Die Debatte über die Leitlinien gehört hier in den Deutschen Bundestag. Vor den Augen der Bürgerinnen und Bürger muss debattiert und entschieden werden, mit welchem Haftungsrisiko wir in den Rettungsfonds hineingehen.",Thomas Oppermann,Thomas Oppermann,data/txt/17134.txt,Thomas Oppermann (SPD),spd,speech
251034,134,17,0,136,"Wir stehen zur Euro-Rettung. Wir haben der Entscheidung zum Rettungsschirm zugestimmt. Wir waren auch diejenigen, die gesagt haben, dass die bewilligten Mittel wahrscheinlich nicht ausreichen, um eine Stabilisierung unserer Währung herbeizuführen. Da haben Sie widersprochen. Jetzt wollen Sie in den Leitlinien hebeln. Sie wollen ein Verlustrisiko beschließen, ohne dass die Öffentlichkeit genau weiß, was da passiert.

Frau Bundeskanzlerin, sagen Sie uns bitte nicht, Sie stünden jetzt unter Zeitdruck. Auch wir meinen, dass schnell entschieden werden muss, aber Sie hatten alle Zeit der Welt.",Thomas Oppermann,Thomas Oppermann,data/txt/17134.txt,Thomas Oppermann (SPD),spd,speech
251037,134,17,0,139,"Statt diese Zeit zu nutzen, haben Sie hier Regierungserklärungen gehalten und der Opposition vorgeworfen, sie betreibe die Vergemeinschaftung der Schulden. Statt Ihre Hausaufgaben zu machen, haben Sie gestern den Bundesfinanzminister und den Vizekanzler vor die Presse treten und unverantwortliche Steuersenkungen verkünden lassen.",Thomas Oppermann,Thomas Oppermann,data/txt/17134.txt,Thomas Oppermann (SPD),spd,speech
251039,134,17,0,141,"Wer inmitten der größten Schuldenkrise, inmitten der größten europäischen Krise Steuersenkungen auf Pump beschließt und damit die Schulden erhöht, der handelt nicht verantwortlich. Deshalb, meine Damen und Herren: Über den Rettungsschirm und über die Richtlinien muss im Parlament entschieden werden. Dies ist der Ort, vor den Augen der Bürgerinnen und Bürger, die am Ende mit ihren Euros für das haften müssen, was wir hier tun.

Ich danke für die Aufmerksamkeit.",Thomas Oppermann,Thomas Oppermann,data/txt/17134.txt,Thomas Oppermann (SPD),spd,speech
251041,134,17,0,143,,Thomas Oppermann,Thomas Oppermann,data/txt/17134.txt,Thomas Oppermann (SPD),spd,speech
251072,134,17,0,174,Das haben wir Ihnen vorletzte Woche schon gesagt!,Thomas Oppermann,Thomas Oppermann,data/txt/17134.txt,Thomas Oppermann [SPD],spd,poi
251080,134,17,0,182,Ist das so schlimm? Haben Sie Angst davor?,Thomas Oppermann,Thomas Oppermann,data/txt/17134.txt,Thomas Oppermann [SPD],spd,poi
251085,134,17,0,187,"Es muss ihm aber schlechtgehen, dass er so laut pfeifen muss!",Thomas Oppermann,Thomas Oppermann,data/txt/17134.txt,Thomas Oppermann [SPD],spd,poi
251089,134,17,0,191,Aber Sie haben das voll im Auge!,Thomas Oppermann,Thomas Oppermann,data/txt/17134.txt,Thomas Oppermann [SPD],spd,poi
251117,134,17,0,219,Sie hat sie mit herbeigeführt!,Thomas Oppermann,Thomas Oppermann,data/txt/17134.txt,Thomas Oppermann [SPD],spd,poi
251119,134,17,0,221,Doch!,Thomas Oppermann,Thomas Oppermann,data/txt/17134.txt,Thomas Oppermann [SPD],spd,poi
251121,134,17,0,223,Aber nicht krisenverschärfend!,Thomas Oppermann,Thomas Oppermann,data/txt/17134.txt,Thomas Oppermann [SPD],spd,poi
252017,135,17,0,58,Ein Jahr zu spät!,Thomas Oppermann,Thomas Oppermann,data/txt/17135.txt,Thomas Oppermann [SPD],spd,poi
252036,135,17,0,77,Das klang letzte Woche noch anders!,Thomas Oppermann,Thomas Oppermann,data/txt/17135.txt,Thomas Oppermann [SPD],spd,poi
252158,135,17,0,199,Die alte Leier!,Thomas Oppermann,Thomas Oppermann,data/txt/17135.txt,Thomas Oppermann [SPD],spd,poi
252274,135,17,0,315,Das müssen wir aber erst hineinverhandeln! Das steht nicht drin!,Thomas Oppermann,Thomas Oppermann,data/txt/17135.txt,Thomas Oppermann [SPD],spd,poi
257047,137,17,0,603,Gegen den Willen der FDP! Sie haben das Konjunkturprogramm abgelehnt!,Thomas Oppermann,Thomas Oppermann,data/txt/17137.txt,Thomas Oppermann [SPD],spd,poi
259588,139,17,0,399,"Jetzt bitte eine liberale Rede, Herr Kollege!",Thomas Oppermann,Thomas Oppermann,data/txt/17139.txt,Thomas Oppermann [SPD],spd,poi
259705,139,17,0,516,Was wäre daran schlimm?,Thomas Oppermann,Thomas Oppermann,data/txt/17139.txt,Thomas Oppermann [SPD],spd,poi
259846,139,17,0,657,Das ist doch gut! Das ist okay!,Thomas Oppermann,Thomas Oppermann,data/txt/17139.txt,Thomas Oppermann [SPD],spd,poi
259855,139,17,0,666,Haben Sie noch etwas anderes drauf?,Thomas Oppermann,Thomas Oppermann,data/txt/17139.txt,Thomas Oppermann [SPD],spd,poi
259861,139,17,0,672,"Wir wollen uns nicht mit Hartz IV bedanken, sondern mit Arbeitsplätzen!",Thomas Oppermann,Thomas Oppermann,data/txt/17139.txt,Thomas Oppermann [SPD],spd,poi
264127,141,17,0,119,Sie müssen einmal die Statistik aufarbeiten!,Thomas Oppermann,Thomas Oppermann,data/txt/17141.txt,Thomas Oppermann [SPD],spd,poi
264272,141,17,0,264,"Herr Präsident! Meine Damen und Herren! Wir stehen erst am Beginn der Aufklärung dieser Verbrechen. Wir können aber schon jetzt sagen - es ist ein durch und durch deprimierender Befund -: Die deutschen Sicherheitsbehörden haben es den rechten Terroristen einfach gemacht, diese Morde zu begehen. Das ist das Ergebnis einer systematischen Unterschätzung des Rechtsextremismus in Deutschland. Wir müssen uns fragen: Was ist eigentlich der Kern dieser Fehleinschätzung? Wer das erkennen will, der muss sich die Entstehungsgeschichte dieser Terrorgruppe genau anschauen.

Der Nationalsozialistische Untergrund ist entstanden in der Neonazi-Szene, in der freien Szene. Er ist entstanden aus rechtsextremen Kameradschaften, aus der Sektion des sogenannten Thüringer Heimatschutzes. Das heißt, es ist genau das passiert, was die Verfassungsschutzbehörden ausgeschlossen hatten, nämlich dass bei den rechtsextremen Kameradschaften die aggressive Gewalt und die menschenverachtende Ideologie in rechten Terror umschlagen können. Wenn das aber so ist, dann können wir nicht einfach zur Tagesordnung übergehen. Wenn diese Kameradschaften hochgefährlich sind, dann brauchen wir jetzt eine härtere Gangart gegenüber diesen Kameradschaften.",Thomas Oppermann,Thomas Oppermann,data/txt/17141.txt,Thomas Oppermann (SPD),spd,speech
264274,141,17,0,266,"Es gibt in Deutschland 5 000 bis 6 000 Neonazis. Insgesamt gibt es über 9 000 gewaltbereite Rechtsextremisten. Es ist nach meinem Verständnis die Aufgabe des Staates, die Menschen vor diesen Rechtsextremisten zu schützen. Deshalb, Herr Bundesinnenminister Friedrich, habe ich die Bitte an Sie, jetzt gemeinsam mit Ihren Kollegen in den Ländern ein Konzept zu entwickeln, wie der Fahndungs- und Beobachtungsdruck auf potenzielle neonazistische Gewalttäter in Deutschland massiv erhöht werden kann.",Thomas Oppermann,Thomas Oppermann,data/txt/17141.txt,Thomas Oppermann (SPD),spd,speech
264276,141,17,0,268,"Wir brauchen mehr Polizeipräsenz in den Regionen, in denen diese Personen auf dem Vormarsch sind und glauben, den Ton angeben zu können.

Als Anfang der 60er-Jahre die schwarzen Kinder in Atlanta nicht zur Schule gehen konnten, weil Rassisten das verhindert haben, da hat der amerikanische Präsident die Nationalgarde in die Stadt geschickt, und sie ist dort so lange geblieben, bis die Kinder wieder zur Schule gehen konnten. So muss jetzt der deutsche Staat in den Regionen handeln, in denen Rechtsextreme glauben, das Kommando übernommen zu haben.",Thomas Oppermann,Thomas Oppermann,data/txt/17141.txt,Thomas Oppermann (SPD),spd,speech
264278,141,17,0,270,"Zu einer härteren Gangart gegen rechts gehört aber auch, dass wir jetzt wieder ein NPD-Verbotsverfahren in Gang bringen. Die Bundeskanzlerin hat zugesagt, das zu prüfen. Ich gehe davon aus, dass das nicht nur eine taktische Äußerung war, um auf das Entsetzen zu reagieren, sondern dass es ernst gemeint war. Die NPD ist eine verfassungsfeindliche Partei. Die NPD ist ausländerfeindlich. Sie ist antisemitisch, antidemokratisch und in Teilen gewaltbereit. Es gibt nicht den geringsten Zweifel daran, dass diese Partei verfassungsfeindlich ist. Ich sage ganz klar: Wir brauchen keine V-Leute, um diesen Befund belegen zu können.",Thomas Oppermann,Thomas Oppermann,data/txt/17141.txt,Thomas Oppermann (SPD),spd,speech
264280,141,17,0,272,,Thomas Oppermann,Thomas Oppermann,data/txt/17141.txt,Thomas Oppermann (SPD),spd,speech
264282,141,17,0,274,Ja.,Thomas Oppermann,Thomas Oppermann,data/txt/17141.txt,Thomas Oppermann (SPD),spd,speech
264286,141,17,0,278,"Das wäre wünschenswert; denn ich glaube, es kommt jetzt darauf an, dass wir ein gemeinsames Verständnis von der Gefährlichkeit der NPD entwickeln. Auch der Bundesinnenminister muss erkennen, dass die NPD nicht irgendeine legale Partei ist; die NPD ist als legale Partei der legale Arm einer Vielzahl von rechtsextremistischen, gewalttätigen, illegalen Gruppen in diesem Land. Wir müssen den Gesamtkomplex sehen; auch Herr Friedrich muss ihn sehen.",Thomas Oppermann,Thomas Oppermann,data/txt/17141.txt,Thomas Oppermann (SPD),spd,speech
264288,141,17,0,280,"Frau Justizministerin, Sie haben davon gesprochen, dass die V-Leute ein Verfahrenshindernis sind. Das ist so. Aber es kann doch nicht sein, dass wir, der demokratische Staat, in einer verfassungsfeindlichen Partei Verfahrenshindernisse platzieren. Die V-Leute in der NPD dürfen doch jetzt nicht zu einer Entwicklungs- und Bestandsgarantie für diese rechtsextreme Partei werden.",Thomas Oppermann,Thomas Oppermann,data/txt/17141.txt,Thomas Oppermann (SPD),spd,speech
264290,141,17,0,282,"Ein NPD-Verbot fällt nicht vom Himmel; es muss hart erarbeitet werden. Die Arbeit muss sofort beginnen. Wir brauchen jetzt einen Masterplan für ein neues Verbotsverfahren. Wir brauchen einen Plan, wie die V-Leute aus dieser Partei systematisch abgezogen werden.

Ich will gerne einräumen, dass ein kluger, dosierter Einsatz von V-Leuten in gewalttätigen Gruppen außerhalb der NPD durchaus auch in Zukunft notwendig ist. Aber es ist doch nicht hinnehmbar, wenn an der Spitze rechtsextremistischer Organisationen hasserfüllte neonazistische Gewalttäter stehen und dann auch noch vom Staat finanziert werden.",Thomas Oppermann,Thomas Oppermann,data/txt/17141.txt,Thomas Oppermann (SPD),spd,speech
264292,141,17,0,284,"So war es beim Thüringer Heimatschutz.

Wenn sich jetzt bei den Ermittlungen herausstellen sollte, dass staatliche Zuwendungen am Ende dazu beigetragen haben, dass diese Terrorgruppe in den ersten Monaten nach dem Untertauchen ihr Leben im Untergrund finanzieren konnte, dann wäre das der größte anzunehmende Unfall für unseren Rechtsstaat; denn dann hätte am Ende der Staat selber mit dazu beigetragen, dass diese schrecklichen Verbrechen möglich geworden sind. Deshalb sage ich ganz klar: Wir müssen das System der V-Leute im deutschen Verfassungsschutz und in den Nachrichtendiensten generell überdenken. Im Zweifel müssen wir uns gegen die V-Leute und für den Rechtsstaat, für die Demokratie entscheiden.",Thomas Oppermann,Thomas Oppermann,data/txt/17141.txt,Thomas Oppermann (SPD),spd,speech
264294,141,17,0,286,,Thomas Oppermann,Thomas Oppermann,data/txt/17141.txt,Thomas Oppermann (SPD),spd,speech
264296,141,17,0,288,"Ich will eine Schlussbemerkung machen, Herr Präsident. - Erstens. Kein Bundesamt kann den stärksten Verfassungsschutz bieten. Den stärksten Verfassungsschutz kann nur eine wachsame, aktive demokratische Zivilgesellschaft bieten. Deshalb noch einmal: Die Aktivitäten aus dieser Zivilgesellschaft dürfen nicht gegängelt, sie müssen gefördert werden, und sie müssen ermuntert werden.",Thomas Oppermann,Thomas Oppermann,data/txt/17141.txt,Thomas Oppermann (SPD),spd,speech
