id,sitzung,wahlperiode,in_writing,sequence,text,speaker_cleaned,speaker_fp,filename,speaker,speaker_party,type
447671,243,17,0,72,"In dem Zusammenhang müssen wir auch über die Städtebauförderung reden. Die Koalition hat die Städtebauförderung als zentrales Instrument für die zukunftsfähige Entwicklung der Städte und Gemeinden in den -vergangenen vier Jahren systematisch gekürzt und vernachlässigt. Trotz eines unstreitig anerkannten Bedarfes in Höhe von 700 Millionen Euro stehen nur 455 Millionen Euro zur Verfügung - und das, obwohl ein von -Ihnen selbst vorgelegtes Gutachten belegt, dass die Städtebauförderung eine enorme Investitionsanreizwirkung hat. Auf 1 Euro öffentliche Gelder kommen 7 Euro private Gelder, die investiert werden. Das ist eine optimale Relation.

Ihnen fehlt aber nicht nur das Verständnis für eine angemessene Finanzausstattung, sondern auch für die inhaltliche Ausrichtung der Strukturförderung des Bundes an den gesellschaftspolitischen Herausforderungen der Kommunen. Dazu gehört vor allem, das Programm Soziale Stadt wieder vernünftig auszustatten. Es war falsch, dieses Programm 2010 um fast 70 Prozent zu kürzen.",Thomas Oppermann,Thomas Oppermann,data/txt/17243.txt,Thomas Oppermann (SPD),spd,speech
447673,243,17,0,74,"Das war ein absoluter Fehlgriff, Herr Schäuble. Da verwundert es auch nicht, dass in den 20 größten Städten Deutschlands nur noch drei CDU-Oberbürgermeister regieren. Auch die sind nicht mehr sicher - jedenfalls wenn Sie diese Politik nicht grundlegend korrigieren.",Thomas Oppermann,Thomas Oppermann,data/txt/17243.txt,Thomas Oppermann (SPD),spd,speech
447675,243,17,0,76,"Mit dem Programm Soziale Stadt konnten in der Vergangenheit in vielen Stadtquartieren drohende Abwärtsentwicklungen gestoppt werden. Wir wollen sichtbare städtebauliche Erneuerungen im Wohnumfeld -sowie im Bereich der sozialen und kulturellen Infrastruktur. Diese sind Voraussetzung dafür, dass das soziale Miteinander, der nachbarschaftliche Zusammenhalt und die Integration gelebt werden können.

Ich komme zum Schluss, Herr Präsident. - Das Ziel der SPD sind starke Kommunen. Wir wollen die Kommunen wieder stärken. Von starken Kommunen hängt es ab, ob unsere Kinder gute Kindergärten und Schulen vorfinden. Von starken Kommunen hängt es ab, wie Menschen aufwachsen und leben. Von starken Kommunen hängt es ab, ob Integration, ob das Zusammenleben von Menschen unterschiedlicher Herkunft gelingt, und davon hängt auch ab, ob sich die Menschen in unseren Gemeinden und Städten sicher fühlen. Das ist der zentrale Unterschied zwischen uns und Ihnen: Wir wollen, dass es allen besser geht. Das ist das Gegenteil von Klientelpolitik für einige wenige. In den Kommunen fangen wir damit an.

Vielen Dank.",Thomas Oppermann,Thomas Oppermann,data/txt/17243.txt,Thomas Oppermann (SPD),spd,speech
447677,243,17,0,78,,Thomas Oppermann,Thomas Oppermann,data/txt/17243.txt,Thomas Oppermann (SPD),spd,speech
447687,243,17,0,88,50 Jahre Altlasten!,Thomas Oppermann,Thomas Oppermann,data/txt/17243.txt,Thomas Oppermann [SPD],spd,poi
447703,243,17,0,104,"Verlorene Jahre, Frau Kollegin!",Thomas Oppermann,Thomas Oppermann,data/txt/17243.txt,Thomas Oppermann [SPD],spd,poi
450542,244,17,0,1,"Herr Präsident! Meine Damen und Herren! Gestern hat das Bundesverfassungsgericht entschieden, dass Lebenspartnerschaften steuerlich nicht länger diskriminiert werden dürfen. Sexuelle Orientierung darf kein Anknüpfungspunkt für Diskriminierung mehr sein.",Thomas Oppermann,Thomas Oppermann,data/txt/17244.txt,Thomas Oppermann (SPD),spd,speech
450545,244,17,0,4,"Das ist ein großer Fortschritt. Viele Menschen in diesem Land freuen sich über diese Entscheidung; denn in der Tat: Es gibt überhaupt keinen vernünftigen Grund, dass Lebenspartnerschaften, in denen Menschen fürei-nander einstehen und Verantwortung übernehmen, steuerlich diskriminiert werden, nur weil sie das gleiche Geschlecht haben.",Thomas Oppermann,Thomas Oppermann,data/txt/17244.txt,Thomas Oppermann (SPD),spd,speech
450547,244,17,0,6,"Wir wollen diese Entscheidung jetzt ganz schnell und ohne weitere Verzögerungen umsetzen. Deshalb rufen wir den im Bundesrat schon beschlossenen Gesetzentwurf auf. Wenn wir ihn heute auf die Tagesordnung setzen, dann können wir ihn heute in erster Lesung an die Ausschüsse überweisen und diesen verfassungswidrigen Zustand schon am nächsten Freitag endgültig beseitigen. Deshalb bitten wir Sie um Zustimmung zu unserem Geschäftsordnungsantrag.

An die Adresse der Union möchte ich noch sagen: Natürlich kann man sich politisch auch einmal irren; aber Sie irren ja nicht, Sie haben sich jahrelang taub und stumm gestellt, und jetzt sind Sie auch noch stur.",Thomas Oppermann,Thomas Oppermann,data/txt/17244.txt,Thomas Oppermann (SPD),spd,speech
450550,244,17,0,9,"Sie sind in dieser Frage so oft mit dem Kopf gegen die Wand gelaufen, dass es einem schon beim Zusehen wehgetan hat.",Thomas Oppermann,Thomas Oppermann,data/txt/17244.txt,Thomas Oppermann (SPD),spd,speech
450553,244,17,0,12,"Sie haben den Anschluss an die Gesellschaft von heute verloren. Sie wollen nicht wahrhaben, dass sich diese Gesellschaft weiterentwickelt hat.",Thomas Oppermann,Thomas Oppermann,data/txt/17244.txt,Thomas Oppermann (SPD),spd,speech
450555,244,17,0,14,75 Prozent der Deutschen sind für die Gleichstellung von Ehe und Lebenspartnerschaft.,Thomas Oppermann,Thomas Oppermann,data/txt/17244.txt,Thomas Oppermann (SPD),spd,speech
450557,244,17,0,16,Ihre Verweigerungshaltung ist Ausdruck eines vormodernen Gesellschaftsverständnisses.,Thomas Oppermann,Thomas Oppermann,data/txt/17244.txt,Thomas Oppermann (SPD),spd,speech
450559,244,17,0,18,"Aber es ist für einige von Ihnen auch eine Chance. Denn wenn Sie unserem Antrag heute zustimmen,",Thomas Oppermann,Thomas Oppermann,data/txt/17244.txt,Thomas Oppermann (SPD),spd,speech
450561,244,17,0,20,"dann wäre das der erste Schritt heraus aus der homophoben Parallelgesellschaft, in der einige von Ihnen jahrelang gelebt haben.",Thomas Oppermann,Thomas Oppermann,data/txt/17244.txt,Thomas Oppermann (SPD),spd,speech
450563,244,17,0,22,"Sie haben auch den Anschluss an die Rechtsprechung verloren. Sie wollen nicht wahrhaben, dass sich das Recht in Deutschland weiterentwickelt hat: vom rot-grünen Lebenspartnerschaftsgesetz bis zu den Entscheidungen des Bundesverfassungsgerichtes.",Thomas Oppermann,Thomas Oppermann,data/txt/17244.txt,Thomas Oppermann (SPD),spd,speech
450565,244,17,0,24,Es gab Urteile zur Gleichstellung bei der Altersversorgung.,Thomas Oppermann,Thomas Oppermann,data/txt/17244.txt,Thomas Oppermann (SPD),spd,speech
450569,244,17,0,28,"Das mache ich. - Ich will noch ein zentrales Argument nennen, Herr Präsident, warum das Thema heute auf die Tagesordnung gehört. Wir haben vier Entscheidungen des Bundesverfassungsgerichtes: zur Gleichstellung bei der Altersversorgung, bei der Erbschaft- und Schenkungsteuer, beim Familienzuschlag und bei der Sukzessivadoption. Jetzt gibt es auch noch das Urteil zum Ehegattensplitting. Stellen Sie sich nicht länger quer. Das wäre eine Missachtung des Bundesverfassungsgerichtes.",Thomas Oppermann,Thomas Oppermann,data/txt/17244.txt,Thomas Oppermann (SPD),spd,speech
450571,244,17,0,30,"Stimmen Sie unserem Antrag zu. Dann können wir den verfassungswidrigen Zustand schnellstmöglich beenden.

Vielen Dank.",Thomas Oppermann,Thomas Oppermann,data/txt/17244.txt,Thomas Oppermann (SPD),spd,speech
450574,244,17,0,33,,Thomas Oppermann,Thomas Oppermann,data/txt/17244.txt,Thomas Oppermann (SPD),spd,speech
450605,244,17,0,64,Seit wann ist das klar?,Thomas Oppermann,Thomas Oppermann,data/txt/17244.txt,Thomas Oppermann [SPD],spd,poi
450608,244,17,0,67,Haben wir gemacht!,Thomas Oppermann,Thomas Oppermann,data/txt/17244.txt,Thomas Oppermann [SPD],spd,poi
450611,244,17,0,70,"Doch, natürlich! Für noch nicht rechtskräftige Bescheide!",Thomas Oppermann,Thomas Oppermann,data/txt/17244.txt,Thomas Oppermann [SPD],spd,poi
450617,244,17,0,76,"Ja, ja!",Thomas Oppermann,Thomas Oppermann,data/txt/17244.txt,Thomas Oppermann [SPD],spd,poi
450627,244,17,0,86,Genau! Das war die Einstellung!,Thomas Oppermann,Thomas Oppermann,data/txt/17244.txt,Thomas Oppermann [SPD],spd,poi
450666,244,17,0,125,Sie haben doch schon Nachhilfe vom Bundesverfassungsgericht bekommen!,Thomas Oppermann,Thomas Oppermann,data/txt/17244.txt,Thomas Oppermann [SPD],spd,poi
450676,244,17,0,135,"Senden Sie ein Signal, Herr van Essen, dass Sie die Lektion gelernt haben!",Thomas Oppermann,Thomas Oppermann,data/txt/17244.txt,Thomas Oppermann [SPD],spd,poi
453512,246,17,0,20,Wie hieß der?,Thomas Oppermann,Thomas Oppermann,data/txt/17246.txt,Thomas Oppermann [SPD],spd,poi
453532,246,17,0,40,Die hätte Friedrich auch erwähnen können!,Thomas Oppermann,Thomas Oppermann,data/txt/17246.txt,Thomas Oppermann [SPD],spd,poi
454957,246,17,0,1465,Das ist die Frage!,Thomas Oppermann,Thomas Oppermann,data/txt/17246.txt,Thomas Oppermann [SPD],spd,poi
454975,246,17,0,1483,Er hat über Sie gesprochen!,Thomas Oppermann,Thomas Oppermann,data/txt/17246.txt,Thomas Oppermann [SPD],spd,poi
454998,246,17,0,1506,Keine überstürzte Anschaffung!,Thomas Oppermann,Thomas Oppermann,data/txt/17246.txt,Thomas Oppermann [SPD],spd,poi
455373,246,17,0,1881,Haben Sie den Minister beraten bei seiner Entscheidung?,Thomas Oppermann,Thomas Oppermann,data/txt/17246.txt,Thomas Oppermann [SPD],spd,poi
457247,247,17,0,331,Frau Präsidentin! Meine Damen und Herren! Unsere parlamentarische Demokratie hat - nach über 60 Jahren können wir das feststellen -,Thomas Oppermann,Thomas Oppermann,data/txt/17247.txt,Thomas Oppermann (SPD),spd,speech
457249,247,17,0,333,"gut funktioniert. Sie ermöglicht schnelle Entscheidungen, wenn es darauf ankommt. Sie hat auch den einen oder anderen guten Regierungswechsel ermöglicht, und es gibt nicht den geringsten Grund, unsere parlamentarische Demokratie infrage zu stellen.

Allerdings dürfen wir nicht ignorieren, dass es Probleme gibt. Die Kommunalwahlen in Schleswig-Holstein vor drei Wochen sind mit einem Negativrekord zu Ende gegangen: Nur noch 46 Prozent der Wahlberechtigten haben ihre Stimme abgegeben. Seit Jahren sinkt die Wahlbeteiligung auf allen Ebenen. Wenn aber eine Mehrheit der Menschen nicht mehr an den Wahlen teilnimmt, dann darf uns das nicht gleichgültig sein.",Thomas Oppermann,Thomas Oppermann,data/txt/17247.txt,Thomas Oppermann (SPD),spd,speech
457251,247,17,0,335,"Die Bild-Zeitung hat heute ebenfalls eine Studie vorgelegt, nach der im Herbst nur jeder Zweite - jedenfalls nach heutiger Bereitschaft - an der Bundestagswahl teilnehmen will. Sie empfiehlt im Kommentar eine Wahlpflicht. Ich meine, die Wahlpflicht ist der falsche Weg. Wir müssen die Menschen von der Demokratie und der Notwendigkeit des Wählens überzeugen.",Thomas Oppermann,Thomas Oppermann,data/txt/17247.txt,Thomas Oppermann (SPD),spd,speech
457253,247,17,0,337,"Die Bertelsmann-Stiftung hat am Montag eine Studie zur Wahlbeteiligung veröffentlicht. Sie zeigt eines ganz deutlich: Viel zu viele Menschen fühlen sich heute von der Politik ausgeschlossen. Sie empfinden Politik als schwer verständlich, haben resigniert und glauben nicht mehr daran, dass sich politisches Engagement lohnt. Ich meine, wir dürfen diese Menschen nicht verloren geben, meine Damen und Herren.",Thomas Oppermann,Thomas Oppermann,data/txt/17247.txt,Thomas Oppermann (SPD),spd,speech
457255,247,17,0,339,"Allerdings geht es nicht nur um Frust oder politisches Desinteresse. Das ist der große Irrtum der Konservativen, die jede Veränderung immer gleich als Niedergang deuten. Tatsache ist nämlich auch, dass sich Formen des Engagements gewandelt haben. Die Wahlbeteiligung mag noch so niedrig sein, trotzdem ist der Wunsch vieler Menschen, etwa bei einem Bauprojekt in ihrer Nachbarschaft mitzureden, niemals größer gewesen. Niemals zuvor waren Bürgerinnen und Bürger so gut informiert und kompetent wie heute. Schließlich ist die Fachinformation oft nur einen Mausklick entfernt.

Im Internet diskutieren heute Millionen in Foren oder auf Blogs. Die Ereignisse der letzten Woche in der Türkei bewegen auch in Deutschland viele Menschen. Früher hätte das vielleicht zu Solidaritätsdemonstrationen auf den Straßen geführt. Heute bekunden Tausende ihre Unterstützung mit Tweets und Retweets, mit YouTube-Beiträgen oder Like Buttons.

Aber auch die analoge Welt verändert sich. Denken Sie an das Hochwasser in Halle an der Saale. Das Rote Kreuz und die Feuerwehren mögen Schwierigkeiten haben, neue Mitglieder zu gewinnen; als aber in Halle das Hochwasser vor den Toren stand, ist die ganze Universität ausgerückt. Tausende von Studierenden und junge Leute haben mit angepackt und Sandsäcke geschleppt. Das Engagement ist also da.",Thomas Oppermann,Thomas Oppermann,data/txt/17247.txt,Thomas Oppermann (SPD),spd,speech
457257,247,17,0,341,"Diese Beispiele zeigen: Engagement wird heute viel weniger in Institutionen und Gremien geleistet. Es ist eher punktuell und themenbezogen. Das ist auch der Grund dafür, warum sich an der Abstimmung über Stuttgart 21 mehr Menschen beteiligt haben als an der Kommunalwahl in Schleswig-Holstein. Das bedeutet aber auch: Der Rückgang der Wahlbeteiligung ist nicht zwangsläufig eine Absage an Demokratie. Er ist für uns ein Auftrag, unsere Demokratie fortzuentwickeln und zu modernisieren.",Thomas Oppermann,Thomas Oppermann,data/txt/17247.txt,Thomas Oppermann (SPD),spd,speech
457259,247,17,0,343,"Die SPD ist seit jeher die Partei der modernen Demokratie. Wir haben das Dreiklassenwahlrecht abgeschafft, wir haben das Frauenwahlrecht und auch das Wahlalter 18 eingeführt.",Thomas Oppermann,Thomas Oppermann,data/txt/17247.txt,Thomas Oppermann (SPD),spd,speech
457262,247,17,0,346,"Jetzt schlagen wir vor, unsere repräsentative Demokratie um Elemente der direkten Demokratie zu erweitern. Wir wollen den Menschen auf Bundesebene ermöglichen, im Wege der Volksabstimmungen selbst zu entscheiden. Dabei ist klar: Wir wollen die parlamentarische Demokratie um die Möglichkeit ergänzen, zwischen zwei Wahltagen innerhalb von vier Jahren eine Regierung, die man ja nicht einfach abwählen kann, dennoch in wichtigen Sachfragen punktuell zu korrigieren. Diese Möglichkeit wollen wir den Bürgern einräumen.",Thomas Oppermann,Thomas Oppermann,data/txt/17247.txt,Thomas Oppermann (SPD),spd,speech
457264,247,17,0,348,,Thomas Oppermann,Thomas Oppermann,data/txt/17247.txt,Thomas Oppermann (SPD),spd,speech
457290,247,17,0,374,"Darf ich noch kurz zu Ende bringen, Frau Präsidentin? Ich nehme noch eine Minute.",Thomas Oppermann,Thomas Oppermann,data/txt/17247.txt,Thomas Oppermann (SPD),spd,speech
457292,247,17,0,376,Gibt es eine Frage?,Thomas Oppermann,Thomas Oppermann,data/txt/17247.txt,Thomas Oppermann (SPD),spd,speech
457294,247,17,0,378,"Okay. Danke schön. - Ich glaube, dass Volksentscheide in Deutschland auch die politische Kultur verändern werden. Eine Regierungsmehrheit muss stärker -begründen, was sie vorhat. Sie muss viel mehr Überzeugungsaufwand betreiben. Das geht nicht mehr so wie in der Europapolitik, wo oft der Eindruck erweckt wird, dass man gar nicht richtig hinter den Dingen steht, die dort beschlossen werden. Bei politischen Entscheidungen im Parlament muss man stärker im Auge behalten, was die Mehrheit der Bevölkerung will, und muss den Dialog früher suchen.

Ich glaube, dass die direkte Demokratie unserer Verfassung guttut. Das wird von Ihnen in der Union seit 60 Jahren blockiert. Besonders doppelzüngig agiert die Fraktion der CSU. Sie tritt immer dann für Volksabstimmungen ein, wenn es gegen den Euro geht.",Thomas Oppermann,Thomas Oppermann,data/txt/17247.txt,Thomas Oppermann (SPD),spd,speech
457296,247,17,0,380,"Wenn wir aber Volksabstimmungen für alle Themen einführen wollen, dann sind Sie dagegen. Sie haben ein rein taktisches Verhältnis zu Volksabstimmungen. Das lehnen wir ab. Wir brauchen - das möchte ich zum Schluss sagen - heute mehr Möglichkeiten zur Beteiligung und zur demokratischen Mitbestimmung. Die einen erwarten das von uns. Für die anderen ist es eine Chance, die Menschen wieder stärker politisch zu aktivieren.",Thomas Oppermann,Thomas Oppermann,data/txt/17247.txt,Thomas Oppermann (SPD),spd,speech
457298,247,17,0,382,"Meine dringende Bitte an Sie, Kolleginnen und Kollegen von der Union: Geben Sie Ihre Blockade auf! Überwinden Sie endlich Ihre Angst! Ein Politiker, der Angst vor dem Volk hat, ist wie ein Fisch, der wasserscheu ist. Beide haben Ihre Bestimmung verfehlt.

Herzlichen Dank.",Thomas Oppermann,Thomas Oppermann,data/txt/17247.txt,Thomas Oppermann (SPD),spd,speech
457301,247,17,0,385,,Thomas Oppermann,Thomas Oppermann,data/txt/17247.txt,Thomas Oppermann (SPD),spd,speech
458938,249,17,0,69,"Frau Präsidentin! Meine Damen und Herren! Sehr geehrter Herr Bundesinnenminister, ich bin einigermaßen schockiert, dass Sie sich ein, zwei Wochen nach Bekanntwerden dieser Vorfälle",Thomas Oppermann,Thomas Oppermann,data/txt/17249.txt,Thomas Oppermann (SPD),spd,speech
458940,249,17,0,71,immer noch völlig ahnungslos präsentieren und ganz offenkundig nicht das richtige Problembewusstsein für diese Frage entwickelt haben.,Thomas Oppermann,Thomas Oppermann,data/txt/17249.txt,Thomas Oppermann (SPD),spd,speech
458943,249,17,0,74,"Wenn das, was Edward Snowden berichtet hat, zutrifft, wenn US-Geheimdienste beliebigen Zugriff nicht nur auf die Verbindungsdaten, sondern auch auf die Kommunikationsinhalte über die US-amerikanischen Internetfirmen wie Google, Apple, Facebook, Skype usw. haben, wenn es zutrifft, dass britische Dienste 200  transatlantische Glasfaserverbindungen überwachen und Informationen aus diesen speichern können, wenn die Verbindungsdaten und sogar die Inhalte von Millionen Telefongesprächen, E-Mails und Videos überwacht und gespeichert werden, dann ist das der umfassendste Eingriff in die Grundrechte deutscher Staatsbürger, den wir bisher erlebt haben.",Thomas Oppermann,Thomas Oppermann,data/txt/17249.txt,Thomas Oppermann (SPD),spd,speech
458946,249,17,0,77,"Die Bundeskanzlerin hat in diesem Zusammenhang festgestellt, das Internet sei Neuland. Das mag sie so sehen. Aber was kein Neuland ist, ist unsere Verfassung. Das Grundgesetz schützt die informationelle Selbstbestimmung, das Grundgesetz garantiert das Fernmeldegeheimnis, und das Bundesverfassungsgericht hat aus dem allgemeinen Persönlichkeitsrecht das Grundrecht auf die Vertraulichkeit und Integrität informationstechnischer Systeme abgeleitet.",Thomas Oppermann,Thomas Oppermann,data/txt/17249.txt,Thomas Oppermann (SPD),spd,speech
458949,249,17,0,80,Über allem steht der Verhältnismäßigkeitsgrundsatz. Das bedeutet: Der schrankenlose Zugriff von Nachrichtendiensten auf die privaten Informationen von Bürgerinnen und Bürgern ist eindeutig illegal und verfassungswidrig.,Thomas Oppermann,Thomas Oppermann,data/txt/17249.txt,Thomas Oppermann (SPD),spd,speech
458951,249,17,0,82,"Das ist jedenfalls nach deutschem Recht so. Gleichwohl haben Sie als Bundesregierung die Pflicht, gegenüber der britischen und der amerikanischen Regierung zu intervenieren und die Rechte deutscher Staatsbürger zu schützen.",Thomas Oppermann,Thomas Oppermann,data/txt/17249.txt,Thomas Oppermann (SPD),spd,speech
458953,249,17,0,84,"Herr Friedrich, ich will Ihnen gar nicht persönlich zum Vorwurf machen, dass Sie das alles nicht wussten.",Thomas Oppermann,Thomas Oppermann,data/txt/17249.txt,Thomas Oppermann (SPD),spd,speech
458955,249,17,0,86,"Aber ich finde es unerträglich, dass der deutsche Innenminister von solchen Sachverhalten aus der Zeitung erfährt. Ich finde es schwer erträglich, dass unsere Nachrichtendienste nicht wissen, was da passiert; und die Kanzlerin ist auch noch ahnungslos. Dabei geht es hier ja nicht um Cyberangriffe aus Russland oder China - in solchen Fällen hätte ich das noch gelten lassen -,",Thomas Oppermann,Thomas Oppermann,data/txt/17249.txt,Thomas Oppermann (SPD),spd,speech
458957,249,17,0,88,"sondern es geht um Grundrechtseingriffe durch die Dienste befreundeter Staaten.

Großbritannien ist Mitglied der Europäischen Union,",Thomas Oppermann,Thomas Oppermann,data/txt/17249.txt,Thomas Oppermann (SPD),spd,speech
458959,249,17,0,90,"und mit den Amerikanern zusammen sind wir in der NATO verbunden. Wir verteidigen ein gemeinsames Wertesystem, und dazu gehören auch die Freiheitsrechte der Bürgerinnen und Bürger.",Thomas Oppermann,Thomas Oppermann,data/txt/17249.txt,Thomas Oppermann (SPD),spd,speech
458961,249,17,0,92,"Wir werden mit unseren Verbündeten darüber reden müssen, wie die Freiheitsrechte eingehalten werden können.

Klar ist natürlich: Wir brauchen auch funktionierende Nachrichtendienste, die uns rechtzeitig vor Anschlägen warnen und schützen. Aber Nachrichtendienste sind an Gesetz und Recht, an den Grundsatz der Verhältnismäßigkeit gebunden.",Thomas Oppermann,Thomas Oppermann,data/txt/17249.txt,Thomas Oppermann (SPD),spd,speech
458963,249,17,0,94,Das Sammeln von Informationen über terroristische Anschläge rechtfertigt keine Totalüberwachung der Bürgerinnen und Bürger.,Thomas Oppermann,Thomas Oppermann,data/txt/17249.txt,Thomas Oppermann (SPD),spd,speech
458966,249,17,0,97,"Ende der Woche tagt der Europäische Rat. Ich habe die klare Erwartung, dass die Bundeskanzlerin die mit dem britischen Spähprogramm verbundene Problematik anspricht, und zwar so klar, dass es auch Konsequenzen hat.

Herr Friedrich, Frau Leutheusser-Schnarrenberger, von Ihnen erwarte ich mehr, als nur einen Brief an die Botschaft zu schicken",Thomas Oppermann,Thomas Oppermann,data/txt/17249.txt,Thomas Oppermann (SPD),spd,speech
458968,249,17,0,99,"und abzuwarten, welche Antwort Sie bekommen,",Thomas Oppermann,Thomas Oppermann,data/txt/17249.txt,Thomas Oppermann (SPD),spd,speech
458970,249,17,0,101,"sowie ein bisschen öffentliche Besorgnis und Empörung zu zeigen. Das reicht natürlich nicht. Wir erwarten, dass Sie sich mit Ihren Amtskollegen an einen Tisch setzen und die Rechtslage und die Faktenlage aufarbeiten, damit wir präzise Informationen über das erhalten, was da passiert. Das ist Ihre Aufgabe.",Thomas Oppermann,Thomas Oppermann,data/txt/17249.txt,Thomas Oppermann (SPD),spd,speech
458972,249,17,0,103,"Wir wollen wissen: Wie umfassend und intensiv wird in die Grundrechte deutscher Staatsbürger eingegriffen? Auf welcher Rechtsgrundlage geschieht das? Welche Schutzvorkehrungen gibt es? Und wie können wir zu vergleichbaren Rechtsvorschriften kommen?

Nicht nur private Bürgerinnen und Bürger, sondern auch die mittelständischen Unternehmen in Deutschland machen sich große Sorgen. Sie haben zu Recht Angst vor Wirtschaftsspionage. Dadurch gehen diesen Unternehmen Milliardenwerte verloren. Ihre Investitionen in Forschung und Entwicklung werden entwertet. Wenn schon befreundete Nachrichtendienste es so leicht haben, wer schützt unsere elektronische Kommunikation dann vor weniger freundlich gesinnten Zeitgenossen?",Thomas Oppermann,Thomas Oppermann,data/txt/17249.txt,Thomas Oppermann (SPD),spd,speech
458974,249,17,0,105,"Der Präsident des Bundesverfassungsgerichts hat gestern den Hinweis gegeben, die Bürgerinnen und Bürger sollten europäische Clouds nutzen.",Thomas Oppermann,Thomas Oppermann,data/txt/17249.txt,Thomas Oppermann (SPD),spd,speech
458976,249,17,0,107,"Gibt es die überhaupt in ausreichender Anzahl? Es gibt eine riesige Nachfrage nach sicherer elektronischer Kommunikation. Wir müssen die Rahmenbedingungen so setzen, dass diese Nachfrage befriedigt werden kann.

Wenn Sie jetzt von einem Internetsicherheitsgesetz sprechen, frage ich mich: Wo ist denn der Gesetzentwurf?",Thomas Oppermann,Thomas Oppermann,data/txt/17249.txt,Thomas Oppermann (SPD),spd,speech
458978,249,17,0,109,"Ich habe eben nach der Drucksache gesucht. Herr Bundesinnenminister, die Wahlperiode ist fast vorbei. Sie hatten vier Jahre Zeit. Diesen Gesetzentwurf haben Sie Ihren Innenministerkollegen auf den Tisch gelegt, aber Sie haben sich gegenüber der FDP nicht durchsetzen können. Dieser Gesetzentwurf ist nicht einmal in den Bundestag eingebracht worden, und dies ist bekanntlich die letzte reguläre Sitzungswoche in dieser Legislaturperiode.",Thomas Oppermann,Thomas Oppermann,data/txt/17249.txt,Thomas Oppermann (SPD),spd,speech
458980,249,17,0,111,"Wenn Sie jetzt damit kommen, dann ist das ein Armutszeugnis. Damit gestehen Sie ein, dass Sie hier nicht rechtzeitig gehandelt haben. Wir brauchen eine europäische Cybersicherheitsstrategie. Dafür müssen Sie Rahmenbedingungen setzen, rechtliche und ökonomische! Wir müssen die Daten und Informationen in unserer Kommunikation besser schützen können.

Vor allen Dingen brauchen wir, meine Damen und Herren - dies soll meine letzte Bemerkung sein -, europäische Sicherheitsstandards. Dazu gehört auch, dass die EU-Datenschutzrichtlinie dringend überarbeitet wird. Diese Regierung hat das verhindert, weil sich Frau Leutheusser-Schnarrenberger und Herr Friedrich darüber nicht einigen konnten.",Thomas Oppermann,Thomas Oppermann,data/txt/17249.txt,Thomas Oppermann (SPD),spd,speech
458982,249,17,0,113,"Das Internet ist global,",Thomas Oppermann,Thomas Oppermann,data/txt/17249.txt,Thomas Oppermann (SPD),spd,speech
458984,249,17,0,115,"und die Angriffe aus dem Internet sind auch global. Der Schutz vor solchen Angriffen ist national, und der Datenschutz ist auch national. Das ist absurd. Das müssen wir überwinden. Wir müssen eine europäische Cybersicherheitsstrategie und einen europäischen Datenschutzstandard entwickeln, der uns in die Lage versetzt, den Datenschutz international, auch gegenüber den Vereinigten Staaten, durchzusetzen. Daran hätten Sie arbeiten müssen. Vier Jahre lang haben Sie nichts davon getan.",Thomas Oppermann,Thomas Oppermann,data/txt/17249.txt,Thomas Oppermann (SPD),spd,speech
458986,249,17,0,117,,Thomas Oppermann,Thomas Oppermann,data/txt/17249.txt,Thomas Oppermann (SPD),spd,speech
