id,sitzung,wahlperiode,in_writing,sequence,text,speaker_cleaned,speaker_fp,filename,speaker,speaker_party,type
59594,25,17,0,257,"Einer Sache können Sie sich sicher sein: Die Debatte über Afghanistan ist heute nicht zu Ende. Sie fängt heute erst richtig an.

Vielen Dank für das Zuhören.",Lars Klingbeil,,data/txt/17025.txt,Lars Klingbeil (SPD),spd,speech
59595,25,17,0,258,Beifall bei der SPD,,,data/txt/17025.txt,,,poi
59596,25,17,0,259,,Lars Klingbeil,,data/txt/17025.txt,Lars Klingbeil (SPD),spd,speech
59597,25,17,0,260,Letzter Redner zu diesem Tagesordnungspunkt ist der Kollege Roderich Kiesewetter für die CDU/CSU-Fraktion.,Dr. Norbert Lammert,,data/txt/17025.txt,Präsident Dr. Norbert Lammert,,chair
59598,25,17,0,261,Beifall bei der CDU/CSU,,,data/txt/17025.txt,,,poi
59599,25,17,0,262,,Dr. Norbert Lammert,,data/txt/17025.txt,Präsident Dr. Norbert Lammert,,chair
59600,25,17,0,263,"Herr Präsident! Meine sehr verehrten Kolleginnen und Kollegen! Liebe Damen und Herren! Herr Kollege Klingbeil, aller Abschied ist schwer. Die Presseerklärung vom 22. Januar hat bestimmt dazu beigetragen, dass Sie von der Überschallgeschwindigkeit, mit der Sie sich von der bisherigen Politik verabschieden wollten, die Kurve zur Rückkehr zu einer vernünftigen Afghanistan-Politik gefunden haben.",Roderich Kiesewetter,,data/txt/17025.txt,Roderich Kiesewetter (CDU/CSU),cducsu,speech
59601,25,17,0,264,Beifall bei der CDU/CSU und der FDP,,,data/txt/17025.txt,,,poi
59602,25,17,0,265,"Heute haben wir intensiv über den ISAF-Einsatz debattiert. Heute jährt sich aber auch der erste islamistische Terroranschlag auf die Vereinigten Staaten von Amerika. Sechs Menschen starben, über 1 000 Menschen wurden verletzt. Das war der Bombenanschlag auf das World Trade Center vom 26. Februar 1993. Weitere Anschläge haben in London, in Madrid und in New York stattgefunden. Der 11. September 2001 ist die Zäsur, die auch uns nach Afghanistan gebracht hat. Deshalb verlangt die heutige Entscheidung erhebliche Ernsthaftigkeit. Ziel ist doch, dass wir einen dauerhaften Frieden in Afghanistan und Sicherheit für das afghanische Volk erreichen. „Friede ist niemals durch Koexistenz, sondern nur in Kooperation“, sagte Karl Jaspers, unser deutscher Philosoph. Diese Kooperation brauchen wir zwischen Soldaten, Polizisten, zivilen Wiederaufbauhelfern und der afghanischen Bevölkerung. Diese Kooperation brauchen wir im Bündnis mit den über 40 Mitgliedstaaten und Nationen, die sich am Afghanistan-Einsatz beteiligen. Ich sage an dieser Stelle ganz deutlich: Insbesondere die Vereinigten Staaten von Amerika befähigen uns im Norden von Afghanistan zu unserem Strategiewechsel. Ich erinnere nur an die Unterstützung in der Polizeiausbildung und - das ist ganz wichtig - bei den Hubschraubern.",Roderich Kiesewetter,,data/txt/17025.txt,Roderich Kiesewetter (CDU/CSU),cducsu,speech
59603,25,17,0,266,Beifall bei Abgeordneten der CDU/CSU,,,data/txt/17025.txt,,,poi
59604,25,17,0,267,"Kooperation ist genauso wichtig innerhalb Afghanistans. Es geht um die Volksstämme, um die Gruppierungen, um die ehemaligen Warlords und um kooperationsbereite Taliban. Die Kernfrage ist doch: Wo sehen wir als Parlament in den nächsten fünf Jahren Afghanistan? Wie sehen wir die Entwicklung der weiteren Region? Wir müssen den Blick auch auf Zentralasien, auf Pakistan und Indien und deren schwieriges Verhältnis, auf Iran, China und Russland richten. Dies ist die größte sicherheitspolitische Herausforderung unserer Zeit. Dazu brauchen wir ein verantwortungsbewusstes Krisenmanagement; denn wir werden nicht nur aus Afghanistan, sondern auch aus anderen Krisenregionen unserer Welt sehr genau beobachtet. Es wird betrachtet, wie wir diese Verantwortung wahrnehmen. Mit unserer heutigen Entscheidung stellen wir in Afghanistan die Weichen für die Glaubwürdigkeit unserer westlichen Wertegemeinschaft.

Ich teile einen Ansatz der Grünen: All das, was wir in Afghanistan anbieten - auch mein Vorredner, Herr Klingbeil, hat das angesprochen; das ist auch die Position der Union -, muss dem landestypischen afghanischen Charakter entsprechen. Wir müssen die Eigenständigkeit stärken; auch Frau Hoff hat dies vorhin angesprochen.

Unser heutiges Mandat stellt damit die Weichen in die richtige Richtung. Wir stehen mit unserer Verantwortung an der Seite der gewählten afghanischen Regierung. Wir wollen die Übergabe in Verantwortung. Aber dazu müssen wir als Parlament auch die Region betrachten. Wir müssen Brisanz durch Kooperation ersetzen, ganz im Jaspers’schen Sinne.",Roderich Kiesewetter,,data/txt/17025.txt,Roderich Kiesewetter (CDU/CSU),cducsu,speech
59605,25,17,0,268,Beifall bei der CDU/CSU sowie bei Abgeordneten der FDP,,,data/txt/17025.txt,,,poi
59606,25,17,0,269,"Dazu brauchen wir eine klare Perspektive. Nur so bleiben wir glaubwürdig. Das darf sich nicht auf den detaillierten Einsatz - Tornado hier, OMLT, das Operational Mentoring and Liaison Team, da - beschränken. Wir müssen deutlich machen, dass wir vor einer strategischen Herausforderung stehen. Von uns als Parlament wird eine strategische Leistung erwartet. Nur so setzen wir unseren Anspruch „Bundeswehr gleich Parlamentsarmee“ glaubwürdig um. Das sind wir auch unseren Soldaten schuldig.

Wie können wir - das ist die Kernfrage - die Nachbarn Afghanistans nachhaltig in eine solche Strategie einbeziehen? Hier geht es besonders um unsere außen- und sicherheitspolitische Verantwortung. Das sind die wahren strategischen Fragen, Frau Künast. Was würde denn passieren, wenn wir unseren Einsatz, unseren Schwung abschwächen würden?

Wir alle sind heute in diesem Haus Zeugen eines bedauerlichen Erlebens. Wir tragen die Last und nicht die Lust der Verantwortung. Schon gar nicht leisten wir uns den Luxus, wie dies eine Fraktion tut, uns aus der Verantwortung zu ziehen. Das möchte ich hier ganz besonders betonen.",Roderich Kiesewetter,,data/txt/17025.txt,Roderich Kiesewetter (CDU/CSU),cducsu,speech
59607,25,17,0,270,Beifall bei der CDU/CSU und der FDP,,,data/txt/17025.txt,,,poi
59608,25,17,0,271,"Zur strategischen Perspektive. Es ist wichtig, dass wir in Afghanistan und darum herum strategische Partner aufbauen. Wir müssen Übergabe in Verantwortung auch in der Region leisten. Wer sind - das müssen wir klären - mögliche verantwortungsbewusste Partner? Wie können diese Partner wirksam unterstützt werden? Es geht um die politische, wirtschaftliche, soziale, aber auch militärische Stabilität in dieser Region. Der afghanische Islam zeichnete sich früher durch sprichwörtliche Toleranz aus. Wir brauchen den verstärkten Dialog der Religionsgemeinschaften. Wir müssen auch die verständlichen afghanischen Befindlichkeiten in Sachen russischer Beteiligung ernst nehmen, gleichwohl wir wissen und schätzen, wie sehr die Russen unseren Einsatz im Hintergrund unterstützen.

Über die heutige Entscheidung hinaus treffen wir in voller Absicht und bewusst eine Weichenstellung für unsere westliche Gemeinschaft. Denn es geht um die Frage: Wie gehen wir künftig mit Konflikten und Krisenregionen um? Unsere Entscheidung wird daran gemessen werden.

Es heißt jetzt also Partner suchen, Afghanistan selbstständig machen und so rasch wie möglich Verantwortung übertragen. Das mag Kosten, Aufwendungen verursachen; aber die Stabilisierung der Region muss uns teuer sein. Der Nutzen wird auf lange Sicht größer, und der Preis wird es wert sein.",Roderich Kiesewetter,,data/txt/17025.txt,Roderich Kiesewetter (CDU/CSU),cducsu,speech
59609,25,17,0,272,Beifall bei der CDU/CSU und der FDP,,,data/txt/17025.txt,,,poi
59610,25,17,0,273,"Die Herausforderungen werden wir mit strategischem Weitblick bewältigen. Dazu brauchen wir als Parlament auch regelmäßige Informationen. Wir sind uns sicher, dass die Bundesregierung sie uns regelmäßig gibt.

Lassen Sie uns mit unserer Zustimmung zum Afghanistan-Mandat über die Parteigrenzen hinweg ein deutliches Zeichen der Verbundenheit mit unseren Soldatinnen und Soldaten, den Polizisten und den zivilen Wiederaufbauhelferinnen und -helfern setzen. Lassen Sie uns aber auch Gedanken machen über ein deutlich sichtbares Zeichen dieser Verbundenheit. Darüber könnten wir in der nächsten Zeit diskutieren. Lassen Sie uns heute ein klares Zeichen für entschiedenes Handeln und ein Zeichen der Geschlossenheit unseres hohen und verantwortungsbewussten Hauses geben.

Ich danke Ihnen.",Roderich Kiesewetter,,data/txt/17025.txt,Roderich Kiesewetter (CDU/CSU),cducsu,speech
59611,25,17,0,274,Beifall bei der CDU/CSU sowie bei Abgeordneten der FDP,,,data/txt/17025.txt,,,poi
59612,25,17,0,275,,Roderich Kiesewetter,,data/txt/17025.txt,Roderich Kiesewetter (CDU/CSU),cducsu,speech
59613,25,17,0,276,"Ich schließe die Aussprache.

Bevor wir zur Abstimmung kommen, möchte ich noch einige Hinweise zur Abstimmungslage machen und Sie um Zustimmung zu einem Vorschlag zur Abweichung von der Geschäftsordnung bitten. Vielleicht können Sie dafür noch einen Augenblick Platz nehmen.

Liebe Kolleginnen und Kollegen, ich will, vor allem zur Verdeutlichung der geschäftsordnungsrechtlichen Zusammenhänge für die interessierte Öffentlichkeit, noch einmal auf die einschlägigen Bestimmungen unserer Geschäftsordnung hinweisen: Nach § 38 der Geschäftsordnung des Deutschen Bundestages kann der Präsident wegen gröblicher Verletzung der Ordnung ein Mitglied des Bundestages, auch ohne dass ein Ordnungsruf ergangen ist, für die Dauer der Sitzung aus dem Saal verweisen. Ein Mitglied des Bundestages kann bis zu 30 Sitzungstage ausgeschlossen werden. Davon habe ich vorhin Gebrauch gemacht.

Ich weise noch einmal auf das Protokoll der von mir vorhin ohne Datum zitierten Sitzung des Ältestenrates vom 26. März 2009 hin, in der es um einen sehr vergleichbaren Vorgang ging und wo wir uns über die gemeinsame Handhabung solcher Situationen verständigt haben. Ich habe da ausdrücklich auf die Geschäftsordnungslage verwiesen und mich vergewissern wollen, ob es eine gemeinsame Auffassung im Ältestenrat über die Interpretation dieser Bestimmungen gebe. Nach dem Protokoll - ich zitiere -

… vergewissert sich der Präsident abschließend, ob der Ältestenrat seine Auffassung teile, dass Vorgänge wie der heutige einen groben Verstoß gegen die parlamentarischen Sitten darstellen. Im Ältestenrat besteht diesbezüglich Einvernehmen. Dem stimmt auf Nachfrage des Präsidenten auch die Parlamentarische Geschäftsführerin der Fraktion Die Linke zu.

Ich entnehme einer Agenturmeldung vor wenigen Minuten mit Blick auf die Situation, die hier gerade im Plenum stattgefunden hat: Mit der Aktion habe die Linke dagegen protestieren wollen, dass es bislang vonseiten der Bundesregierung keine offizielle Entschuldigung bei den Angehörigen der Opfer des Luftschlages gebe, sagte Dagmar Enkelmann, Parlamentarische Geschäftsführerin der Linksfraktion. „Den Genossen sei bewusst gewesen, dass sie mit der Aktion gegen die Geschäftsordnung des Bundestages verstoßen würden. ‚Aber manchmal muss man auch solche Wege gehen‘, sagte Enkelmann. Den Verweis durch Lammert halte sie für ‚überzogen‘.“

Liebe Kolleginnen und Kollegen, im Deutschen Bundestag hat es in allen Legislaturperioden - völlig unabhängig von den Mehrheitsverhältnissen - immer einen Konsens darüber gegeben, dass die Regeln dieses Hauses ausnahmslos für alle gelten.",Dr. Norbert Lammert,,data/txt/17025.txt,Präsident Dr. Norbert Lammert,,chair
59614,25,17,0,277,"Beifall bei der CDU/CSU, der SPD und der FDP sowie bei Abgeordneten des BÜNDNISSES 90/DIE GRÜNEN",,,data/txt/17025.txt,,,poi
59615,25,17,0,278,"Wir haben die Unverzichtbarkeit der strikten Einhaltung dieser Regeln auch im Bewusstsein der historischen Erfahrung für unabdingbar gehalten,",Dr. Norbert Lammert,,data/txt/17025.txt,Präsident Dr. Norbert Lammert,,chair
59616,25,17,0,279,"Beifall bei der CDU/CSU, der SPD, der FDP und dem BÜNDNIS 90/DIE GRÜNEN",,,data/txt/17025.txt,,,poi
59617,25,17,0,280,"dass ein deutsches Parlament an dem leichtfertigen Umgang mit den selbstgesetzten Regeln bereits einmal gescheitert ist.

Nun muss ich Sie auf Folgendes aufmerksam machen: Die Geschäftsordnung des Deutschen Bundestages lässt keine Differenzierung zwischen dem Ausschluss von der Sitzung und dem Ausschluss von Abstimmungen zu. Gleichwohl möchte ich Ihnen das aus, wie Sie hoffentlich nachvollziehen können, naheliegenden Gründen empfehlen, was nach § 126 der gleichen Geschäftsordnung möglich ist, wenn es der Deutsche Bundestag mit Zweidrittelmehrheit beschließt. Nach § 126 unserer Geschäftsordnung sind

Abweichungen von den Vorschriften dieser Geschäftsordnung … im einzelnen Fall mit Zweidrittelmehrheit der anwesenden Mitglieder des Bundestages [möglich], wenn die Bestimmungen des Grundgesetzes dem nicht entgegenstehen.

Ich empfehle Ihnen auch nach Rücksprache mit den Fraktionsführungen aller im Bundestag jetzt anwesenden Fraktionen, dass wir von dieser Möglichkeit Gebrauch machen, die Sitzung für zehn Minuten unterbrechen und anschließend eine Abstimmung zu diesem Tagesordnungspunkt durchführen, an der auch die von der heutigen Sitzung ausgeschlossenen Mitglieder teilnehmen können.

Ich darf Sie fragen, ob Sie mit diesem Vorschlag einverstanden sind. Wer dem zustimmt, den bitte ich um das Handzeichen. - Wer stimmt dagegen? - Wer enthält sich? - Damit ist das mit überwältigender Mehrheit beschlossen.

Ich unterbreche die Sitzung für zehn Minuten und rufe dann die Abstimmung auf.",Dr. Norbert Lammert,,data/txt/17025.txt,Präsident Dr. Norbert Lammert,,chair
59618,25,17,0,281,Unterbrechung von 10.46 bis 10.57 Uhr,,,data/txt/17025.txt,,,poi
59619,25,17,0,282,,Dr. Norbert Lammert,,data/txt/17025.txt,Präsident Dr. Norbert Lammert,,chair
59620,25,17,0,283,"Die unterbrochene Sitzung ist wieder eröffnet.

Wir kommen nun zur Abstimmung über die Beschlussempfehlung des Auswärtigen Ausschusses auf Drucksache 17/816 zu dem Antrag der Bundesregierung zur Fortsetzung der Beteiligung bewaffneter deutscher Streitkräfte an dem Einsatz der Internationalen Sicherheitsunterstützungstruppe in Afghanistan unter Führung der NATO. Der Ausschuss empfiehlt in seiner Beschlussempfehlung, den Antrag auf Drucksache 17/654 anzunehmen.

Mir liegt zu diesem Antrag eine ganze Reihe von namentlichen Erklärungen nach § 31 unserer Geschäftsordnung vor, die wir wie üblich dem Protokoll beifügen.1

Bevor ich die namentliche Abstimmung, die dazu beantragt ist, eröffne, weise ich darauf hin, dass im Anschluss an die namentliche Abstimmung noch über den Entschließungsantrag der Fraktion Bündnis 90/Die Grünen auf Drucksache 17/818 abzustimmen ist und nach der vorhin vom Plenum getroffenen Geschäftsordnungsentscheidung an diesen beiden Abstimmungen alle Kolleginnen und Kollegen des Hauses teilnehmen können. Um möglichen Missverständnissen vorzubeugen, weise ich noch einmal ausdrücklich darauf hin, dass für die dann folgenden Tagesordnungspunkte die an der Aktion beteiligten Mitglieder ausgeschlossen sind. Es gibt nicht einen Ausschluss einer Fraktion, sondern beteiligter Kolleginnen und Kollegen.

Ich darf die Schriftführerinnen und Schriftführer bitten, die vorgesehenen Plätze an den Abstimmungsurnen einzunehmen und mir ein Signal zu geben, wann wir mit der Abstimmung beginnen können.

Hier vorne links vor dem Präsidium fehlt noch ein Schriftführer. - Sind die Plätze an den Urnen jetzt alle besetzt? - Es fehlt immer noch ein Schriftführer aus den Reihen der Opposition vorne links vom Präsidium.

Alle Urnen sind jetzt ordnungsgemäß mit Schriftführerinnen und Schriftführern von Mehrheit und Minderheit des Hauses besetzt.

Ich eröffne damit die Abstimmung.

Ist noch ein Kollege im Saal anwesend, der seine Stimmkarte nicht abgegeben hat? - Das ist nicht der Fall. Dann schließe ich die Abstimmung und bitte die Schriftführerinnen und Schriftführer, mit der Auszählung zu beginnen. Wir geben das Ergebnis der Auszählung später, während des nächsten Tagesordnungspunktes, bekannt.2

Wir kommen nun zur Abstimmung über den Entschließungsantrag der Fraktion Bündnis 90/Die Grünen auf Drucksache 17/818. Wer stimmt für diesen Entschließungsantrag? - Wer stimmt dagegen? - Wer enthält sich? - Damit ist der Entschließungsantrag mit der Mehrheit des Hauses abgelehnt.",Dr. Norbert Lammert,,data/txt/17025.txt,Präsident Dr. Norbert Lammert,,chair
59621,25,17,0,284,"Ich bitte um Entschuldigung für die kurze Unterbrechung und setze die Sitzung fort.

Ich rufe die Tagesordnungspunkte 19 a und 19 b auf:

a)	Beratung des Antrags der Fraktion der SPD

10 Jahre EEG - Auf dem besten Weg zu einer ökologischen und sozialen Energiewende

- Drucksache 17/778 -

Überweisungsvorschlag:

Ausschuss für Umwelt, Naturschutz und Reaktorsicherheit (f)

Ausschuss für Wirtschaft und Technologie

Ausschuss für Ernährung, Landwirtschaft und Verbraucherschutz

Ausschuss für Verkehr, Bau und Stadtentwicklung

b)	Beratung des Antrags der Abgeordneten Hans-Josef Fell, Bärbel Höhn, Sylvia Kotting-Uhl, weiterer Abgeordneter und der Fraktion BÜND-NIS 90/DIE GRÜNEN

Erneuerbare Energie ausbauen statt Atomkraft verlängern

- Drucksache 17/799 -

Überweisungsvorschlag:

Ausschuss für Umwelt, Naturschutz und Reaktorsicherheit (f)

Ausschuss für Wirtschaft und Technologie

Nach einer interfraktionellen Vereinbarung sind für die Aussprache anderthalb Stunden vorgesehen. Gibt es Widerspruch? - Das ist nicht der Fall. Dann ist das so beschlossen.

Ich eröffne die Aussprache. Das Wort als erster Redner hat der Kollege Hermann Scheer von der SPD-Fraktion. - Bitte schön, Herr Scheer.",Dr. Hermann Otto Solms,,data/txt/17025.txt,Vizepräsident Dr. Hermann Otto Solms,,chair
59622,25,17,0,285,Beifall bei der SPD sowie bei Abgeordneten des BÜNDNISSES 90/DIE GRÜNEN,,,data/txt/17025.txt,,,poi
59623,25,17,0,286,,Dr. Hermann Otto Solms,,data/txt/17025.txt,Vizepräsident Dr. Hermann Otto Solms,,chair
59624,25,17,0,287,"Herr Präsident! Meine Damen und Herren! Vor zehn Jahren hat der Deutsche Bundestag mit den Stimmen der SPD, der Fraktionen der Grünen und der PDS sowie mit einigen Stimmen aus der CDU/CSU-Fraktion das Erneuerbare-Energien-Gesetz verabschiedet. Dieses Gesetz ist in der Tat das erfolgreichste Gesetz zur Mobilisierung erneuerbarer Energien in der ganzen Welt geworden. Über 45 Länder haben dieses Gesetz inzwischen übernommen, weil sie sehen: Es ist der schnellste Weg zur Mobilisierung erneuerbarer Energien, der denkbar ist, und allen anderen Politikansätzen überlegen; daran kommt niemand mehr vorbei. Das hat uns in eine federführende Position gebracht, nicht nur bei der Einführung, sondern auch bei der Entwicklung und der industriellen Produktion erneuerbarer Energietechniken.

Dieses Gesetz muss weitergeführt werden. Es muss nahtlos weitergeführt werden können. Es hat eine unselige Entwicklung überwunden, die hier und andernorts lange Zeit vorherrschte. Es gab pausenlos Stop-and-go-Programme, die es unmöglich gemacht haben, dass auf diesem Gebiet eine industrielle Entwicklung stattfinden konnte.

Dieses Gesetz wurde aber immer infrage gestellt - es wird auch heute noch infrage gestellt -, weil es den herkömmlichen energiewirtschaftlichen Strukturen und den dahinterstehenden Interessen widerspricht. Es ist die Einleitung eines Strukturwandels, der unabdingbar ist und der selbstverständlich kein Win-win-Konzept darstellen kann. Wir machen uns etwas vor, wenn das behauptet wird; denn der Strukturwandel in der Energieversorgung, der historisch ansteht, ist zwangsläufig ein Strukturwandel von einer überwiegend zentralisierten Energieversorgung, vor allem im Strombereich, um den es hier geht, hin zu einer dezentralen Energiebereitstellung. Das hängt mit der Natur der Energiequellen zusammen. Es ist ein Strukturwandel weg von einem Brennstoffmarkt hin zu einem Technologiemarkt; denn bei erneuerbaren Energien, außer bei der Bioenergie, werden alle Brennstoffe kostenlos von der Natur bereitgestellt.

Es ist klar, dass das Ziel, den Ausbau der erneuerbaren Energien bis hin zur Vollversorgung zu ermöglichen, bedeutet, dass der Brennstoffmarkt allmählich verschwinden und irgendwann nicht mehr vorhanden sein wird. Ansonsten brauchte man mit der Förderung der erneuerbaren Energien gar nicht erst anzufangen, wenn es gleichzeitig darum ginge, das Öl-, Gas-, Kohle- oder Urangeschäft in der Weltwirtschaft aufrechtzuerhalten. Das ist das Prinzip.

Woher kommen die Infragestellungen? Worüber wird heute und wahrscheinlich auch in den nächsten Wochen debattiert? Die Frage ist: Entspricht dieses Vorgehen Marktprinzipien oder nicht? Es gibt bestimmte, sehr oberflächliche Marktvorstellungen, die dem Erneuerbare-Energien-Gesetz immer wieder entgegengestellt werden, die aber einer näheren Betrachtung nicht standhalten. Marktprinzip heißt, an allererster Stelle Marktgleichheit zu ermöglichen. Marktgleichheit kann nicht bestehen, wenn es über viele Jahrzehnte hinweg durch gesetzliche Privilegien wie durch viele Milliarden an Subventionen zu einer hochkonzentrierten, herkömmlichen Energiewirtschaft gekommen ist und wenn dann im Zuge der Liberalisierung gesagt wird: Jetzt können die hochgepäppelten Energieunternehmen in ihrer erworbenen und über Jahrzehnte hinweg politisch gestützten Stellung so weitermachen wie bisher; gleichzeitig sollen neue Energietechnologien dagegen antreten. Das heißt, es gab und gibt noch immer nicht die Situation von Marktgleichheit.

Wenn es aber aus zwingenden ökologischen und weiteren gesellschaftlichen Überlegungen politisches Ziel ist, auf die erneuerbaren Energien umzusteigen, dann muss ein Ausgleich gegenüber der hochkonzentrierten und hochprivilegierten Situation herkömmlicher Energieversorgung geschaffen werden. Dann bedarf es zur Herstellung von Marktgleichheit einer gesonderten Privilegierung erneuerbarer Energien. Das drückt das Gesetz aus.",Dr. Hermann Scheer,,data/txt/17025.txt,Dr. Hermann Scheer (SPD),spd,speech
59625,25,17,0,288,Beifall bei der SPD und dem BÜNDNIS 90/ DIE GRÜNEN,,,data/txt/17025.txt,,,poi
59626,25,17,0,289,"Das Gesetz heißt nicht zufällig „Gesetz für den Vorrang Erneuerbarer Energien“. Das ist der eigentliche Sinn des Gesetzes. Es ist nicht marktwidrig, sondern es schafft überhaupt erst die Voraussetzungen, dass künftig tatsächlich von einem Energiemarkt geredet werden kann. Es wird auch dazu führen, dass es statt weniger Anbieter sehr viele Produzenten und Anbieter geben wird. Markt heißt nicht wenige Anbieter oder gar nur ein Monopolist mit Millionen Kunden, sondern Markt heißt möglichst viele Anbieter. Deswegen ist das Erneuerbare-Energien-Gesetz mit all dem, was es bewirkt hat, ein Weg zur tatsächlichen Schaffung von Energiemarktbedingungen in der Gesellschaft. Das ist ein ganz wesentlicher Punkt, der in der Debatte nicht vergessen werden darf.",Dr. Hermann Scheer,,data/txt/17025.txt,Dr. Hermann Scheer (SPD),spd,speech
59627,25,17,0,290,Beifall bei der SPD sowie bei Abgeordneten des BÜNDNISSES 90/DIE GRÜNEN,,,data/txt/17025.txt,,,poi
59628,25,17,0,291,"Deswegen ist es falsch, im Zusammenhang mit der Einspeisevergütung das Wort „Subvention“ in den Mund zu nehmen. Dieses Wort kommt manchem allzu schnell über die Lippen. In einigen Fällen wird es leichtfertig verwendet; in der Regel ist es vorwurfsvoll gedacht.

Die Einspeisevergütungen, die das Erneuerbare-Energien-Gesetz garantiert, sind aber keine Subvention. Wenn Sie das Urteil des Europäischen Gerichtshofes vom März 2001 zum deutschen Erneuerbare-Energien-Gesetz lesen, erkennen Sie, dass der Europäische Gerichtshof den Faden aufgenommen hat, der bei der Begründung, Erstellung und Abfassung des Erneuerbare-Energien-Gesetzes im Vordergrund stand. Zunächst trifft der Subventionsbegriff der EU auf das Erneuerbare-Energien-Gesetz nicht zu. Unter einer Subvention im EU-Sinne wird nämlich direkte oder indirekte staatliche Hilfe verstanden. Die gibt es bei der Einspeisevergütung des EEG nicht; denn die öffentlichen Kassen sind gar nicht involviert.

Es gibt aber noch einen anderen Grund, der viel tiefer geht: Bei der garantierten Einspeisevergütung handelt es sich um eine Kaufpflicht, die - mit gewissen Ausnahmen bei Großverbrauchern - alle Stromkunden betrifft. Eine Kaufpflicht kann nur begründet werden, wenn ein zwingendes öffentliches Interesse erkennbar ist. Keiner bestreitet mehr, dass es ein öffentliches Interesse an einer Umstellung der Energieversorgung auf erneuerbare Energien gibt. Das öffentliche Interesse ist also eindeutig gegeben. Dieses öffentliche Interesse wird durch die Kaufpflicht umgesetzt. Wenn in Deutschland heute 16 Prozent des Strombedarfs aus erneuerbaren Energien gedeckt werden, heißt das, dass schon heute praktisch jeder einzelne Stromkunde in Deutschland zu 16 Prozent Ökostrom bezieht; das ist eine automatische Folge der Kaufpflicht.

Kaufpflichten im öffentlichen Interesse gibt es zuhauf: Denken Sie nur an die Haftpflichtversicherung, die abschließen muss, wer Auto fahren will. Niemand darf ohne Haftpflichtversicherung Auto fahren. Niemand käme auf die Idee, das eine Subventionierung der Haftpflichtversicherer zu nennen. Es gibt ein öffentliches Interesse daran, dass jeder eine Haftpflichtversicherung hat: dass sich niemand seiner Verantwortung für Schäden, die er verursacht hat, entzieht. Dasselbe gilt für Hausversicherungen und viele andere Sachen.",Dr. Hermann Scheer,,data/txt/17025.txt,Dr. Hermann Scheer (SPD),spd,speech
59629,25,17,0,292,Beifall bei Abgeordneten der SPD und des BÜNDNISSES 90/DIE GRÜNEN,,,data/txt/17025.txt,,,poi
59630,25,17,0,293,,Dr. Hermann Scheer,,data/txt/17025.txt,Dr. Hermann Scheer (SPD),spd,speech
59631,25,17,0,294,"Herr Kollege, denken Sie bitte an die Zeit!",Dr. Hermann Otto Solms,,data/txt/17025.txt,Vizepräsident Dr. Hermann Otto Solms,,chair
