id,sitzung,wahlperiode,in_writing,sequence,text,speaker_cleaned,speaker_fp,filename,speaker,speaker_party,type
51682,20,17,0,397,"Ein wichtiges Ziel unserer Arbeitsmarkt- und Sozialpolitik war immer, die private Altersvorsorge zu fördern, um einer möglichen Altersarmut von breiten Bevölkerungsschichten rechtzeitig vorzubeugen. Auch aus diesem Grund wird innerhalb unserer Partei schon lange gefordert, das Schonvermögen zu erhöhen. So haben wir in der christlich-liberalen Koalition",Paul Lehrieder,,data/txt/17020.txt,Paul Lehrieder (CDU/CSU),cducsu,speech
51683,20,17,0,398,„Christdemokratisch“ heißt es!,Christian Lange,,data/txt/17020.txt,Christian Lange [Backnang] [SPD],spd,poi
51684,20,17,0,399,"- ich habe es bewusst gesagt, Herr Kollege, damit Sie Ihren Zuruf machen können - beschlossen, als eine der ersten Maßnahmen den Freibetrag beim Schonvermögen im SGB II deutlich anzuheben. Ich freue mich ganz besonders, dass dieser Beschluss in den Koalitionsvertrag zwischen Union und FDP Eingang gefunden hat. Gemeinsam mit unserem Koalitionspartner haben wir uns darauf geeinigt, die Freibeträge für das Altersvorsorgevermögen von 250 auf 750 Euro je vollendetem Lebensjahr zu verdreifachen. Kollege Vogel von der FDP hat in seiner Rede darauf hingewiesen.

Unsere Botschaft lautet: Wer für das Alter vorsorgt, hat auch für den Fall der Arbeitslosigkeit richtig gehandelt.",Paul Lehrieder,,data/txt/17020.txt,Paul Lehrieder (CDU/CSU),cducsu,speech
51685,20,17,0,400,Beifall bei der CDU/CSU sowie bei Abgeordneten der FDP,,,data/txt/17020.txt,,,poi
51686,20,17,0,401,"Ich weiß, auch vonseiten der Opposition gab und gibt es Forderungen und Anträge in diese Richtung. Wir aber wollten einen vernünftigen und ordentlich ausgearbeiteten Gesetzentwurf. Dieser liegt Ihnen jetzt vor. Damit haben wir unser Versprechen eingelöst.

Noch einen weiteren Aspekt, der für die Arbeitsmarktpolitik von Bedeutung ist, wird das Sozialversicherungs-Stabilisierungsgesetz regeln. Durch die krisenbedingten Einnahmeausfälle und steigenden Ausgaben verzeichnete die Bundesagentur für Arbeit für das vergangene Jahr ein Defizit von 10,9 Milliarden Euro. Die Rücklage der BA ist zum Jahresende 2009 auf rund 1,9 Milliarden Euro gesunken. Für das Haushaltsjahr 2010 erwartet die BA bei einem unveränderten Beitragssatz in Höhe von 2,8 Prozent ein Defizit in Höhe von rund 17,9 Milliarden Euro. Dies entspricht einem Fehlbestand von rund 16 Milliarden Euro am Jahresende.

Wenn Herr Kollege Birkwald von der Linkspartei hier ausführt, es sei ein Fehler gewesen, die Arbeitslosenversicherungsbeiträge von damals 6,5 Prozent auf heute 2,8 Prozent zu reduzieren, so sei Ihnen, aber auch den Zuschauern auf den Tribünen und am Fernseher gesagt: Wenn wir die Beitragssätze bei 6,5 Prozent belassen hätten, wäre die Konsequenz gewesen, dass jeder Arbeitnehmer und natürlich jeder Arbeitgeber - das Ganze ist ja paritätisch finanziert - Monat für Monat 3,7 Prozentpunkte mehr an Sozialabgaben hätte zahlen müssen. Wenn Sie den Wunsch erfüllen wollen, müssen Sie den Forderungen der Linkspartei folgen.",Paul Lehrieder,,data/txt/17020.txt,Paul Lehrieder (CDU/CSU),cducsu,speech
51687,20,17,0,402,Beifall bei Abgeordneten der CDU/CSU,,,data/txt/17020.txt,,,poi
51688,20,17,0,403,Aber nicht mit uns!,Georg Schirmbeck,,data/txt/17020.txt,Georg Schirmbeck [CDU/CSU],cducsu,poi
51689,20,17,0,404,,Paul Lehrieder,,data/txt/17020.txt,Paul Lehrieder (CDU/CSU),cducsu,speech
51690,20,17,0,405,"Herr Kollege, gestatten Sie eine Zwischenfrage des Kollegen Birkwald?",Dr. h. c. Wolfgang Thierse,,data/txt/17020.txt,Vizepräsident Dr. h. c. Wolfgang Thierse,,chair
51691,20,17,0,406,"Ja, natürlich. Ich bitte darum.",Paul Lehrieder,,data/txt/17020.txt,Paul Lehrieder (CDU/CSU),cducsu,speech
51692,20,17,0,407,"Herr Kollege Lehrieder, sind Sie bereit, zur Kenntnis zu nehmen, dass der Wunsch der Linken ist, dass alle Erwerbslosen in der Krise 24 Monate Arbeitslosengeld erhalten? Dafür braucht man Geld, und es ist sinnvoller, höhere Beiträge zu zahlen, damit man dann, wenn man auf das Pflaster geworfen wird, einen gewissen Schutz hat und erst später in das unsoziale Hartz-IV-System gelangt.",Matthias W. Birkwald,,data/txt/17020.txt,Matthias W. Birkwald (DIE LINKE),linke,speech
51693,20,17,0,408,"Herr Kollege Birkwald, sind Sie bereit, zur Kenntnis zu nehmen, dass wir genau diesen Schutzschirm haben und dass wir in diesem Gesetzentwurf vorsehen, die Beiträge zur Bundesagentur stabil zu halten und den Ausgleich des Defizits aus steuerfinanzierten Mitteln zu übernehmen? Es ist ja auch ein Wunsch, den Sie als Umverteilungspartei hier regelmäßig vortragen, dass wir über steuerfinanzierte Leistungen die Arbeitnehmer, all diejenigen, die im Berufsleben stehen, ein Stück weit entlasten sollen. Da sind wir mit Sicherheit sozialer als die Linkspartei.",Paul Lehrieder,,data/txt/17020.txt,Paul Lehrieder (CDU/CSU),cducsu,speech
51694,20,17,0,409,Beifall bei der CDU/CSU sowie bei Abgeordneten der FDP,,,data/txt/17020.txt,,,poi
51695,20,17,0,410,Widerspruch bei der LINKEN,,,data/txt/17020.txt,,,poi
51696,20,17,0,411,"Dieser Fehlbestand soll nun nicht als zurückzuzahlendes Darlehen, sondern als einmaliger Bundeszuschuss zur Verfügung gestellt werden. Wie wir auch im Koalitionsvertrag festgeschrieben haben, muss die Auszahlung dieses Zuschusses selbstverständlich an strenge Kriterien gebunden werden.

Sehr geehrter Herr Präsident, liebe Kolleginnen und Kollegen, mit dem hier vorliegenden Gesetzentwurf setzen wir einen weiteren Markstein auf dem Weg zur Überwindung der Krise und ihrer Folgen. Aus dem Wachstumsbeschleunigungsgesetz und dem Sozialversicherungs-Stabilisierungsgesetz ergeben sich steuerliche Erleichterungen. Allein mit dem Wachstumsbeschleunigungsgesetz entlasten wir die Bürger und Unternehmen um insgesamt rund 8,5 Milliarden Euro. Wir wollen die Sozialbeiträge von Arbeitgebern und Arbeitnehmern stabil halten - hier unterscheiden wir uns von den Linken - und die Lohnnebenkosten nicht zusätzlich belasten. Es gilt, im Rahmen des haushaltspolitisch Verantwortbaren zusätzliche Impulse zu geben. Nur so werden wir das Vertrauen von Investoren und Konsumenten in die Kontinuität der künftigen Steuer-, Finanz- und Haushaltspolitik stärken und damit langfristig die Weichen für mehr Wachstum und Beschäftigung stellen.",Paul Lehrieder,,data/txt/17020.txt,Paul Lehrieder (CDU/CSU),cducsu,speech
51697,20,17,0,412,Beifall bei der CDU/CSU sowie bei Abgeordneten der FDP,,,data/txt/17020.txt,,,poi
51698,20,17,0,413,"Nur so wird es uns gelingen, dabei zu helfen, dass die Unternehmen die Krise meistern, Beschäftigungsverhältnisse erhalten und mehr Arbeitsplätze schaffen. Wir können es uns nicht leisten, in der konjunkturellen Talsohle zu verharren und sehenden Auges zuzulassen, dass die Unternehmen und damit die Arbeitsplätze immer stärker unter Druck geraten.

Ich weiß, liebe Kolleginnen und Kollegen von der Opposition, dass Sie das eigentlich genauso sehen. Deshalb möchte ich Sie einladen, uns auf unserem Weg zu unterstützen und diesen Gesetzentwurf mitzutragen.

Danke schön.",Paul Lehrieder,,data/txt/17020.txt,Paul Lehrieder (CDU/CSU),cducsu,speech
51699,20,17,0,414,Beifall bei der CDU/CSU sowie bei Abgeordneten der FDP,,,data/txt/17020.txt,,,poi
51700,20,17,0,415,,Paul Lehrieder,,data/txt/17020.txt,Paul Lehrieder (CDU/CSU),cducsu,speech
51701,20,17,0,416,"Ich schließe die Aussprache.

Interfraktionell wird Überweisung der Vorlagen auf Drucksachen 17/507 und 17/495 an die in der Tagesordnung aufgeführten Ausschüsse vorgeschlagen. Sind Sie damit einverstanden? - Das ist der Fall. Dann sind die Überweisungen so beschlossen.

Liebe Kolleginnen und Kollegen, ich rufe nun die Tagesordnungspunkte 19 a bis 19 c auf:

a)	Beratung des Antrags der Abgeordneten Nicolette Kressl, Joachim Poß, Ingrid Arndt-Brauer, weiterer Abgeordneter und der Fraktion der SPD

Maßnahmenbündel gegen Spekulationen auf den Finanzmärkten und ungerechtfertigte Banker-Boni

- Drucksache 17/526 -

Überweisungsvorschlag:

Finanzausschuss (f)

Rechtsausschuss

Ausschuss für Wirtschaft und Technologie

Ausschuss für Ernährung, Landwirtschaft und Verbraucherschutz

Ausschuss für wirtschaftliche Zusammenarbeit und Entwicklung

Ausschuss für die Angelegenheiten der Europäischen Union

Haushaltsausschuss

b)	Beratung des Antrags der Abgeordneten Dr. Carsten Sieling, Nicolette Kressl, Joachim Poß, weiterer Abgeordneter und der Fraktion der SPD

Die Lasten der Krise gerecht verteilen, Spekulationen eindämmen - Internationale Finanztransaktionsteuer einführen

- Drucksache 17/527 -

Überweisungsvorschlag:

Finanzausschuss (f)

Rechtsausschuss

Ausschuss für Wirtschaft und Technologie

Ausschuss für Ernährung, Landwirtschaft und Verbraucherschutz

Ausschuss für wirtschaftliche Zusammenarbeit und Entwicklung

Ausschuss für die Angelegenheiten der Europäischen Union

Haushaltsausschuss

c)	Beratung des Antrags der Abgeordneten Dr. Axel Troost, Dr. Barbara Höll, Eva Bulling-Schröter, weiterer Abgeordneter und der Fraktion DIE LINKE

Finanztransaktionsteuer international vorantreiben und national einführen

- Drucksache 17/518 -

Überweisungsvorschlag:

Finanzausschuss (f)

Haushaltsausschuss

Nach einer interfraktionellen Vereinbarung sind für die Aussprache eineinhalb Stunden vorgesehen. - Ich höre keinen Widerspruch. Dann ist das so beschlossen.

Ich eröffne die Aussprache und erteile das Wort dem Kollegen Joachim Poß für die SPD-Fraktion.",Dr. h. c. Wolfgang Thierse,,data/txt/17020.txt,Vizepräsident Dr. h. c. Wolfgang Thierse,,chair
51702,20,17,0,417,Beifall bei Abgeordneten der SPD,,,data/txt/17020.txt,,,poi
51703,20,17,0,418,,Dr. h. c. Wolfgang Thierse,,data/txt/17020.txt,Vizepräsident Dr. h. c. Wolfgang Thierse,,chair
51704,20,17,0,419,"Herr Präsident! Meine Damen und Herren! Die Finanzmarktkrise, in der wir seit gut zwei Jahren stecken, ist für uns insgesamt eine große Zäsur, und zwar eine gesellschaftliche Zäsur und nicht nur eine vordergründig politisch-ökonomische.

Wir mussten erfahren, dass unsere Abhängigkeit von Banken und Finanzindustrie größer und tiefer ist, als wir bis dahin vielleicht gedacht hatten. Die Verantwortungslosigkeit und Gier, die Risikobereitschaft und manchmal sogar die Dummheit von Bankern, Finanzmanagern und auch von Verwaltungsräten öffentlicher Landesbanken sprengen das bisher Vorstellbare.

Hier setzt unsere gemeinsame Aufgabe ein, meine Damen und Herren, die Aufgabe der Politik: Wir müssen diese Leute aus der Parallelwelt holen, in der sie sich - jede Äußerung dieser Tage macht das deutlich - noch immer befinden.",Joachim Poß,,data/txt/17020.txt,Joachim Poß (SPD),spd,speech
51705,20,17,0,420,Beifall bei Abgeordneten der SPD,,,data/txt/17020.txt,,,poi
51706,20,17,0,421,Einige Leute!,Leo Dautzenberg,,data/txt/17020.txt,Leo Dautzenberg [CDU/CSU],cducsu,poi
51707,20,17,0,422,"Keine Pauschalverurteilungen, Herr Poß!",Dr. h. c. Hans Michelbach,,data/txt/17020.txt,Dr. h. c. Hans Michelbach [CDU/CSU],cducsu,poi
51708,20,17,0,423,"- Ich rede von denen, die offenkundig auch im Namen anderer sprechen. Ich halte überhaupt nichts von Ackermann-Bashing; aber Herr Ackermann ist nun einmal ein Sprecher der ganzen Branche,",Joachim Poß,,data/txt/17020.txt,Joachim Poß (SPD),spd,speech
51709,20,17,0,424,Also doch!,Dr. h. c. Hans Michelbach,,data/txt/17020.txt,Dr. h. c. Hans Michelbach [CDU/CSU],cducsu,poi
51710,20,17,0,425,"und jede Äußerung von ihm belegt, dass wir die Branche aus ihrer Parallelwelt holen müssen.",Joachim Poß,,data/txt/17020.txt,Joachim Poß (SPD),spd,speech
51711,20,17,0,426,Beifall bei der SPD sowie bei Abgeordneten der LINKEN,,,data/txt/17020.txt,,,poi
51712,20,17,0,427,Teile der Branche!,Leo Dautzenberg,,data/txt/17020.txt,Leo Dautzenberg [CDU/CSU],cducsu,poi
51713,20,17,0,428,"Nehmen wir als Beispiel nur die Diskussion über die Boni. Welche Rechtfertigung gibt es denn für ein solches Bonisystem? Arbeiten die Arbeitnehmerinnen und Arbeitnehmer, für die es kein solches System gibt, nicht auch motiviert? Solche Fragen muss man stellen. Einige haben sich eingerichtet in diesem System und haben politische Unterstützer gefunden. Da müssen wir umkehren.",Joachim Poß,,data/txt/17020.txt,Joachim Poß (SPD),spd,speech
51714,20,17,0,429,Wer hat denn in den letzten Jahren regiert?,Frank Schäffler,,data/txt/17020.txt,Frank Schäffler [FDP],fdp,poi
51715,20,17,0,430,"Nur dadurch, dass die Notenbanken und die Staaten bis an die Grenzen ihrer Möglichkeiten und Mittel gegangen sind, konnte ein flächendeckender Kollaps der Finanzmärkte verhindert werden. Uns allen, meine Damen und Herren, muss klar sein: Noch eine solche Krise, wie wir sie in den letzten zwei Jahren erlebt haben, könnte auch Deutschland nicht mehr bewältigen. Daraus lässt sich nur eine Konsequenz ziehen: Die Strukturen in der Finanzindustrie, die Bankenwelt und die Finanzmärkte insgesamt sind so zu verändern, dass sich eine solche Krise möglichst nicht mehr wiederholt.",Joachim Poß,,data/txt/17020.txt,Joachim Poß (SPD),spd,speech
51716,20,17,0,431,Beifall bei Abgeordneten der SPD,,,data/txt/17020.txt,,,poi
51717,20,17,0,432,"Wenn man die Berichte aus Davos verfolgt, bekommt man mit, dass - polemisch gesprochen - beim Champa-gner schon wieder gesagt wird: Das darf aber nicht zu weit gehen. Nach der Obama-Rede haben Herr Ackermann und andere aus der Branche in die gleiche Richtung argumentiert - Originalton -: Die Regierungen werden jetzt doch nicht die falschen Schlussfolgerungen ziehen, weltweit und europäisch!",Joachim Poß,,data/txt/17020.txt,Joachim Poß (SPD),spd,speech
51718,20,17,0,433,"Wir werden schon das Richtige tun, Herr Kollege!",Leo Dautzenberg,,data/txt/17020.txt,Leo Dautzenberg [CDU/CSU],cducsu,poi
51719,20,17,0,434,"Angesichts dessen muss man sich fragen: In welcher Welt leben diese Menschen? Sie sollten Davos schnell verlassen und sich einmal die soziale Realität, zum Beispiel in der Bundesrepublik Deutschland, anschauen.",Joachim Poß,,data/txt/17020.txt,Joachim Poß (SPD),spd,speech
51720,20,17,0,435,Beifall bei der SPD,,,data/txt/17020.txt,,,poi
51721,20,17,0,436,"So, Sie sind in der Opposition angekommen!",Frank Schäffler,,data/txt/17020.txt,Frank Schäffler [FDP],fdp,poi
51722,20,17,0,437,"Das ist eine der zentralen Gestaltungsaufgaben dieses Hauses: Wir müssen uns nicht den Kopf zerbrechen, ob und wie wir für diesen oder jenen noch mehr Steuern senken können; das aber machen Sie in dieser Koalition hauptsächlich. Sie müssen endlich zu Potte kommen und eine Strategie entwickeln, wie wir mit nationalen, europäischen und internationalen Maßnahmen die Aufgabe, die ich beschrieben habe, endlich in den Griff bekommen.",Joachim Poß,,data/txt/17020.txt,Joachim Poß (SPD),spd,speech
51723,20,17,0,438,Was haben Sie denn letztes Jahr gemacht?,Frank Schäffler,,data/txt/17020.txt,Frank Schäffler [FDP],fdp,poi
51724,20,17,0,439,"Da ist bei Ihnen Pause, Ende der Durchsage. Warum denn? Es ist doch ein Skandal, dass sich diese schwarz-gelbe Koalition in einer der zentralen Fragen unserer Zeit nicht verständigen kann,",Joachim Poß,,data/txt/17020.txt,Joachim Poß (SPD),spd,speech
51725,20,17,0,440,Beifall bei der SPD,,,data/txt/17020.txt,,,poi
51726,20,17,0,441,"bei der Finanzmarkttransaktionsteuer unterschiedlicher Meinung ist.

Frau Merkel äußert Verständnis. Aus der CSU kommen sozialdemokratische Töne.",Joachim Poß,,data/txt/17020.txt,Joachim Poß (SPD),spd,speech
51727,20,17,0,442,Das besorgt Sie!,Leo Dautzenberg,,data/txt/17020.txt,Leo Dautzenberg [CDU/CSU],cducsu,poi
51728,20,17,0,443,"Die FDP sagt wie üblich Nein, weil sie am engsten mit dem Finanzmarkt verflochten ist. Das Ganze offenbart ein erschreckendes Defizit im Hinblick auf ein ernsthaftes Politikverständnis.",Joachim Poß,,data/txt/17020.txt,Joachim Poß (SPD),spd,speech
51729,20,17,0,444,Wer im Glashaus sitzt!,Frank Schäffler,,data/txt/17020.txt,Frank Schäffler [FDP],fdp,poi
51730,20,17,0,445,"Was wurden hier, auch während der Zeit der Großen Koalition, für Reden gehalten, von Frau Merkel, philosophisch von Ihrem Herrn Röttgers - -",Joachim Poß,,data/txt/17020.txt,Joachim Poß (SPD),spd,speech
51731,20,17,0,446,Röttgen!,Leo Dautzenberg,,data/txt/17020.txt,Leo Dautzenberg [CDU/CSU],cducsu,poi
51732,20,17,0,447,"- Röttgen. Röttgers ist die Mischung aus Rüttgers und Röttgen; denn die beiden tun sich da nicht viel: Große Reden, nichts dahinter!",Joachim Poß,,data/txt/17020.txt,Joachim Poß (SPD),spd,speech
51733,20,17,0,448,Beifall bei der SPD,,,data/txt/17020.txt,,,poi
51734,20,17,0,449,"Die Rede von Herrn Röttgen war philosophisch angelegt, blieb aber ohne Konsequenzen. Wenn es um Konkretes geht: Ende der Durchsage. Sie sind in diesem Politikfeld blank, so wie in der Gesundheitspolitik und in anderen Politikfeldern. Sie haben für die Zukunft unseres Landes konzeptionell nichts zu bieten. Das ist die Realität; darüber wird hinweggetäuscht.",Joachim Poß,,data/txt/17020.txt,Joachim Poß (SPD),spd,speech
51735,20,17,0,450,Beifall bei Abgeordneten der SPD,,,data/txt/17020.txt,,,poi
51736,20,17,0,451,"Eine solche Haltung können wir uns nicht mehr leisten: Es werden immer nur Fensterreden von Frau Merkel oder von Herrn Schäuble gehalten. Jetzt wird eine Finanzmarktkonferenz abgehalten, aber nicht erst im Mai, sondern schon im April,",Joachim Poß,,data/txt/17020.txt,Joachim Poß (SPD),spd,speech
51737,20,17,0,452,Sie haben gar keine abgehalten!,Dr. h. c. Hans Michelbach,,data/txt/17020.txt,Dr. h. c. Hans Michelbach [CDU/CSU],cducsu,poi
51738,20,17,0,453,"rechtzeitig vor einer wichtigen Landtagswahl, um zu sagen: Irgendwann werden wir uns um die Probleme kümmern. Was ist das für eine Regierung, die in dieser Situation nicht die Ärmel aufkrempelt!",Joachim Poß,,data/txt/17020.txt,Joachim Poß (SPD),spd,speech
51739,20,17,0,454,Beifall bei der SPD,,,data/txt/17020.txt,,,poi
51740,20,17,0,455,"Man kann fast den Eindruck haben, dass in dieser Koalition nicht die schwäbische Hausfrau Merkel, sondern die schwäbische Drossel Homburger das Sagen hat.",Joachim Poß,,data/txt/17020.txt,Joachim Poß (SPD),spd,speech
51741,20,17,0,456,Heiterkeit bei der SPD,,,data/txt/17020.txt,,,poi
51742,20,17,0,457,"Da fragt man sich doch, welche speziellen Interessen sich hier durchsetzen. Wir werden einmal recherchieren, welche Spenden da vielleicht unterwegs sind oder waren.",Joachim Poß,,data/txt/17020.txt,Joachim Poß (SPD),spd,speech
51743,20,17,0,458,Sprechen Sie einmal zum Thema!,Frank Schäffler,,data/txt/17020.txt,Frank Schäffler [FDP],fdp,poi
51744,20,17,0,459,"Wir haben es doch nicht vergessen: Kurz vor der Wahl kamen einige ganz dicke Spenden aus der Finanzindus-trie bei den jetzigen Koalitionspartnern an. Da wird doch wohl kein Zusammenhang zu dem konkreten Nichthandeln bestehen?

Sie sind von der letzten Obama-Rede aufgeschreckt worden. Erst muss der amerikanische Präsident kommen und etwas zur Begrenzung von Bankenmacht und hochriskanten Finanzgeschäften ausführen; dann kommt die deutsche Regierung und sagt: Wir halten eine Konferenz zu diesem Thema ab. Das ist in der Tat ein Armutszeugnis. Es muss wirklich anders gehen. Wir brauchen dringend so etwas wie einen deutschen Aktionsplan, ein konkretes Konzept, wie Deutschlands Beitrag zur nachhaltigen und dauerhaften Stabilisierung der Finanzmärkte und des Bankensektors aussehen soll.

Viel Zeit wurde vertan. Wir haben diese Diskussion schon in der Großen Koalition geführt, auch über eine Sonderabgabe des Bankenbereichs. Da haben Sie blockiert. Ich habe mit Ihnen in einer Gruppe zur Begrenzung von Managergehältern verhandelt. Ein Dreivierteljahr lang mussten wir Ihnen Stück für Stück notwendige gesetzliche Veränderungen regelrecht aus der Nase ziehen, je nachdem, wie hoch der Druck in der Finanzmarktkrise gerade war. Bei der Frage der Begrenzung der steuerlichen Abzugsfähigkeit von Gehältern und Abfindungen - dazu zählen Boni - haben Sie sich von vornherein verweigert.

Was ist denn das für eine Haltung! Auch da müssen Sie sich bewegen.",Joachim Poß,,data/txt/17020.txt,Joachim Poß (SPD),spd,speech
51745,20,17,0,460,Beifall bei Abgeordneten der SPD,,,data/txt/17020.txt,,,poi
51746,20,17,0,461,"Sie müssen doch auf nationaler Ebene machen, was auf nationaler Ebene möglich ist. Diese Chance nutzen Sie nicht. Sie machen unverbindliche Gedanken- und Meinungsaustausche und gehen die Probleme nicht an. Wir haben auch auf nationaler Ebene Regelungsbedarf. Sie sind nicht glaubwürdig.

Auch Frau Merkel, die ein internationales Renommee hat - wer wollte das denn bestreiten! -, kann mit ihrem europäischen oder internationalen Renommee überhaupt nichts anfangen, weil sie gar nicht weiß, wofür sie sich bei den Gipfeltreffen in Europa oder den G-20-Treffen in der Welt nachhaltig einsetzen soll; denn sie hat kein eindeutiges Mandat dieser Koalition. Dieser Zustand muss sich ändern.

Um Ihnen da auf die Sprünge zu helfen, haben wir zwei Anträge formuliert, die heute im Einzelnen noch gut begründet werden. Wir werden dann ja sehen, wie Sie sich dazu verhalten.

Die Zeit des Stillstands auf einem zentralen Politikfeld in Deutschland muss vorbei sein. Ihre Zeit ist in diesem Punkt jedenfalls abgelaufen. Bewegen Sie sich bitte!",Joachim Poß,,data/txt/17020.txt,Joachim Poß (SPD),spd,speech
51747,20,17,0,462,Beifall bei der SPD,,,data/txt/17020.txt,,,poi
51748,20,17,0,463,Wir hatten ja vier Jahre lang Stillstand!,Dr. Gerhard Schick,,data/txt/17020.txt,Dr. Gerhard Schick [BÜNDNIS 90/DIE GRÜNEN],gruene,poi
51749,20,17,0,464,,Joachim Poß,,data/txt/17020.txt,Joachim Poß (SPD),spd,speech
51750,20,17,0,465,Das Wort hat nun Leo Dautzenberg für die CDU/ CSU-Fraktion.,Dr. h. c. Wolfgang Thierse,,data/txt/17020.txt,Vizepräsident Dr. h. c. Wolfgang Thierse,,chair
51751,20,17,0,466,Beifall bei der CDU/CSU und der FDP,,,data/txt/17020.txt,,,poi
51752,20,17,0,467,,Dr. h. c. Wolfgang Thierse,,data/txt/17020.txt,Vizepräsident Dr. h. c. Wolfgang Thierse,,chair
51753,20,17,0,468,"Herr Präsident! Meine Damen und Herren! Liebe Kolleginnen und Kollegen! Herr Kollege Poß, durch Ihren Beitrag haben Sie im Grunde wieder bekundet, dass Sie sich hier unter Wert darstellen. Das gilt insbesondere im Hinblick auf das, was wir bereits in der Großen Koalition auf den Weg gebracht haben; denn das war stimmig. Die Argumente und Vorwürfe, die Sie heute hier dargestellt haben, entbehren jeder Grundlage. In der neuen Koalition, in der christlich-liberalen Koalition, führen wir jetzt die Dinge zielgenau fort, mit denen wir bereits im Finanzmarktstabilisierungsgesetz und durch weitere Maßnahmen begonnen haben.",Leo Dautzenberg,,data/txt/17020.txt,Leo Dautzenberg (CDU/CSU),cducsu,speech
51754,20,17,0,469,"Das Einzige, was Sie aussprechen können, ist „christlich-liberal“!",Joachim Poß,,data/txt/17020.txt,Joachim Poß [SPD],spd,poi
51755,20,17,0,470,"Ich darf vielleicht daran erinnern, was wir beispielsweise hinsichtlich der Vergütungsstrukturen schon auf den Weg gebracht haben, was wir gemeinsam beschlossen haben. Wir waren eben nicht bereit - das ist nach wie vor richtig -, bei den Vergütungsstrukturen unter steuerlichen Gesichtspunkten zwischen guten und schlechten Bezügen bzw. Einkünften und Ausgaben zu differenzieren. Das ist der falsche Ansatz.

Man setzt zu spät an, wenn man damit anfängt - das wurde auch in England teilweise vollzogen -, Boni zu versteuern. Diese Boni dürfen den Bereich der Banken im Grunde gar nicht verlassen, sondern sie sollten dafür genutzt werden, die Eigenkapitaldecke der Banken zu stärken. Das wäre der bessere Beitrag als der, hier zu einem späteren Zeitpunkt eine Besteuerung herbeizuführen, die über andere Vergütungssysteme teilweise wieder so ausgeglichen wird, dass Sie das, was Sie damit eigentlich beeinflussen wollen, gar nicht erfassen.",Leo Dautzenberg,,data/txt/17020.txt,Leo Dautzenberg (CDU/CSU),cducsu,speech
51756,20,17,0,471,Wie erreichen Sie das? Vorschläge!,Dr. Carsten Sieling,,data/txt/17020.txt,Dr. Carsten Sieling [SPD],spd,poi
51757,20,17,0,472,"Deshalb geht es darum, systematisch die Dinge fortzusetzen, mit denen wir bereits begonnen haben. Die Verabschiedung des Finanzmarktstabilisierungsgesetzes, dem bis auf die Linke alle Fraktionen in diesem Hause zugestimmt haben, war national der richtige Weg, um eine Stabilisierung zu erreichen. Das muss fortgesetzt werden.

Wenn wir uns anschauen, was auf europäischer Ebene und international momentan diskutiert wird und was wir national in der Pipeline haben, dann sehen wir, dass dies von folgenden Zielen gekennzeichnet ist:

Wir stimmen Ihnen zu, dass sich die Krise, die sich jetzt mit all ihren Folgen ereignet hat, so nicht wiederholen darf. Sie können nie ausschließen, dass es immer wieder Krisen geben wird, aber aufgrund der Erkenntnisse, die man aus der aktuellen Krise gewonnen hat, muss man jetzt die notwendigen Maßnahmen ergreifen, damit sich eine solche Krise mit den entsprechenden Folgen nicht wieder ereignet.

Mit allen Anträgen, die hier von den Oppositionsfraktionen gestellt worden sind, greifen Sie im Grunde zu kurz, da Sie nur über Abgabesysteme und Belastungen reden. Es wird nicht gesagt, wie wir systematisch und zielgenau die Erkenntnisse aus der Krise ziehen, die erforderlich sind, um die entsprechenden Maßnahmen durchführen zu können.

Als weiteres Ziel gilt es deshalb in der Tat, bestimmte Banken - die, die gerettet wurden; über die Rettung erfolgte eine Stabilisierung und wurde ein Nutzen erzielt - an den Kosten zu beteiligen. Man muss nur fragen, mit welchen Instrumenten dies geschehen soll. Dies muss auch differenziert geschehen.",Leo Dautzenberg,,data/txt/17020.txt,Leo Dautzenberg (CDU/CSU),cducsu,speech
