id,sitzung,wahlperiode,in_writing,sequence,text,speaker_cleaned,speaker_fp,filename,speaker,speaker_party,type
52203,20,17,0,918,"- Ja, Herr Dautzenberg, wenn ich das einmal gehört hätte.

Wir haben hier eine Debatte geführt, in der sich die Koalitionsvertreter als Parlamentsvertreter von ihrer eigenen Regierung distanziert haben.",Dr. Carsten Sieling,,data/txt/17020.txt,Dr. Carsten Sieling (SPD),spd,speech
52204,20,17,0,919,Da haben Sie nicht zugehört!,Leo Dautzenberg,,data/txt/17020.txt,Leo Dautzenberg [CDU/CSU],cducsu,poi
52205,20,17,0,920,"Sie haben philosophiert und allgemeine Grundprinzipien dargelegt,",Dr. Carsten Sieling,,data/txt/17020.txt,Dr. Carsten Sieling (SPD),spd,speech
52206,20,17,0,921,Teilen Sie denn unsere Vorstellungen?,Leo Dautzenberg,,data/txt/17020.txt,Leo Dautzenberg [CDU/CSU],cducsu,poi
52207,20,17,0,922,"aber keinen konkreten Vorschlag gemacht, wo es hingeht. So eine Regierung brauchen wir in dieser Zeit nicht.",Dr. Carsten Sieling,,data/txt/17020.txt,Dr. Carsten Sieling (SPD),spd,speech
52208,20,17,0,923,Beifall bei der SPD sowie bei Abgeordneten der LINKEN und des BÜNDNISSES 90/DIE GRÜNEN,,,data/txt/17020.txt,,,poi
52209,20,17,0,924,Ich habe den Koalitionsvertrag zitiert!,Frank Schäffler,,data/txt/17020.txt,Frank Schäffler [FDP],fdp,poi
52210,20,17,0,925,Koalition in der Auflösung! Die erreichen nicht den nächsten Wahltermin!,Joachim Poß,,data/txt/17020.txt,Joachim Poß [SPD],spd,poi
52211,20,17,0,926,"Ich darf vielleicht einmal darauf hinweisen, dass es hier um eine wichtige Frage geht. Herr Schäffler und Herr Dautzenberg, wir sind uns doch einig, dass dies eine zentrale Frage ist. Erklären Sie mir bitte, wie sich die Bundesregierung bei der Debatte über diese Frage so präsentieren kann, wie sie sich hier präsentiert. Sie zeigt kaum Präsenz; hier ist niemand.",Dr. Carsten Sieling,,data/txt/17020.txt,Dr. Carsten Sieling (SPD),spd,speech
52212,20,17,0,927,Beifall bei der SPD,,,data/txt/17020.txt,,,poi
52213,20,17,0,928,Der wichtigste Staatssekretär ist da!,Dr. h. c. Hans Michelbach,,data/txt/17020.txt,Dr. h. c. Hans Michelbach [CDU/CSU],cducsu,poi
52214,20,17,0,929,"Das geht so nicht. Ich befürchte, Herr Schäffler, die Vertreter der Bundesregierung sind nicht zur Debatte gekommen, weil sie sich nicht anhören wollen, wie Sie hier sagen, Sie seien Parlamentsvertreter, und das, was die Regierung macht, sei nicht Ihr Thema.

Was ist das für eine Koalition, was ist das für ein vielstimmiger Chor, von dem Deutschland regiert werden will?",Dr. Carsten Sieling,,data/txt/17020.txt,Dr. Carsten Sieling (SPD),spd,speech
52215,20,17,0,930,Beifall bei Abgeordneten der SPD,,,data/txt/17020.txt,,,poi
52216,20,17,0,931,Abg. Leo Dautzenberg [CDU/CSU] meldet sich zu einer Zwischenfrage,,,data/txt/17020.txt,,,poi
52217,20,17,0,932,- Bitte.,Dr. Carsten Sieling,,data/txt/17020.txt,Dr. Carsten Sieling (SPD),spd,speech
52218,20,17,0,933,"Herr Kollege Dautzenberg, bitte.",Gerda Hasselfeldt,,data/txt/17020.txt,Vizepräsidentin Gerda Hasselfeldt,,chair
52219,20,17,0,934,"Herr Kollege Sieling, teilen Sie meine Auffassung, dass wir eine Parlamentsdebatte haben, dass wir uns aufgrund Ihrer Anträge verständigt haben, diese Debatte hier im Parlament zu führen?

Wenn Sie zugehört hätten, wüssten Sie, dass die CDU/CSU-Fraktion viele Vorschläge gemacht hat.",Leo Dautzenberg,,data/txt/17020.txt,Leo Dautzenberg (CDU/CSU),cducsu,speech
52220,20,17,0,935,Ich habe sehr gut zugehört!,Dr. Carsten Sieling,,data/txt/17020.txt,Dr. Carsten Sieling [SPD],spd,poi
52221,20,17,0,936,"Ich betone nochmals: Wenn Sie das nur an den Anträgen festmachen, die Sie hier vorlegen, ist das zu eng.",Leo Dautzenberg,,data/txt/17020.txt,Leo Dautzenberg (CDU/CSU),cducsu,speech
52222,20,17,0,937,Das ist doch nicht alles!,Joachim Poß,,data/txt/17020.txt,Joachim Poß [SPD],spd,poi
52223,20,17,0,938,"- Herr Kollege Poß, das, was Sie hier fordern, muss aber Teil eines stimmigen Gesamtkonzepts sein.",Leo Dautzenberg,,data/txt/17020.txt,Leo Dautzenberg (CDU/CSU),cducsu,speech
52224,20,17,0,939,"Sie können uns nicht vorschreiben, was wir vorlegen!",Joachim Poß,,data/txt/17020.txt,Joachim Poß [SPD],spd,poi
52225,20,17,0,940,"Das halten Sie der Regierung doch immer vor. Deshalb lassen wir uns von Ihnen nicht vorhalten, was wir zu diskutieren haben.",Leo Dautzenberg,,data/txt/17020.txt,Leo Dautzenberg (CDU/CSU),cducsu,speech
52226,20,17,0,941,"Lächerlich! Sie sind nicht handlungsfähig; das ist der Punkt! Frau Merkel macht Sprüche, mehr nicht!",Joachim Poß,,data/txt/17020.txt,Joachim Poß [SPD],spd,poi
52227,20,17,0,942,Das sagt der Richtige!,Frank Schäffler,,data/txt/17020.txt,Gegenruf des Abg. Frank Schäffler [FDP],fdp,poi
52228,20,17,0,943,"Vieles von dem, was die Prüfaufträge angeht, ist - das ist betont worden - auf Herrn Steinbrück zurückzuführen. Herr Kollege Sieling, wäre diese Regierung und wären wir als Fraktionen nicht gut beraten,",Leo Dautzenberg,,data/txt/17020.txt,Leo Dautzenberg (CDU/CSU),cducsu,speech
52229,20,17,0,944,"Wir haben ein Papier Steinmeier/Steinbrück von Januar 2009, da steht alles drin!",Joachim Poß,,data/txt/17020.txt,Joachim Poß [SPD],spd,poi
52230,20,17,0,945,"im Hinblick auf die Finanztransaktionsteuer einen Prüfauftrag an den IWF zu geben mit der Bitte, die weltweiten Auswirkungen dieser Maßnahme zu untersuchen und Vorschläge zu unterbreiten?",Leo Dautzenberg,,data/txt/17020.txt,Leo Dautzenberg (CDU/CSU),cducsu,speech
52231,20,17,0,946,Das wissen wir doch alles! Das spricht doch nicht gegen unsere Vorschläge!,Joachim Poß,,data/txt/17020.txt,Joachim Poß [SPD],spd,poi
52232,20,17,0,947,Doch! Mal durchlesen!,Frank Schäffler,,data/txt/17020.txt,Gegenruf des Abg. Frank Schäffler [FDP],fdp,poi
52233,20,17,0,948,"- Auch wenn Sie das schon alles wissen, Herr Kollege Poß, auch wenn Sie schon wissen, wie sich eine solche Steuer auswirkt, ist es doch sinnvoll, zuerst abzuwarten, bis das Ergebnis vorliegt, ehe man die Bewertung übernimmt, dass eine solche Steuer ein Instrument, eine Option für ein mögliches Vorgehen darstellt.",Leo Dautzenberg,,data/txt/17020.txt,Leo Dautzenberg (CDU/CSU),cducsu,speech
52234,20,17,0,949,Das ersetzt doch nicht nationales Handeln! Das ist kein Gegensatz!,Joachim Poß,,data/txt/17020.txt,Joachim Poß [SPD],spd,poi
52235,20,17,0,950,"Sie hätten zuhören sollen, was wir als Fraktion - damit bin ich wieder im parlamentarischen Bereich - vorgeschlagen haben, nämlich ein Gesamtpaket: Finanzinstitute, Insolvenzrecht für Finanzinstitute und dessen Absicherung, Verbesserungen in der Aufsicht, das alles sind Punkte, wo wir national etwas umsetzen wollen und wo Vorarbeiten gemacht worden sind. Zu Regelungen für die Begrenzung von Vergütungen liegt ein Referentenentwurf vor, den Sie schon zur Kenntnis genommen haben müssten. Alles das, was wir national beeinflussen können, ist also schon auf den Weg gebracht.",Leo Dautzenberg,,data/txt/17020.txt,Leo Dautzenberg (CDU/CSU),cducsu,speech
52236,20,17,0,951,"Nein, eben nicht! Da haben wir Vorschläge gemacht!",Joachim Poß,,data/txt/17020.txt,Joachim Poß [SPD],spd,poi
52237,20,17,0,952,"Was international gemacht wird, Herr Kollege Sieling, muss von dem Ergebnis bestimmter Prüfaufträge abhängig gemacht werden. Wenn Sie ohne die Grundlage von Analysen Entscheidungen treffen wollen, werden Sie damit fehlgehen.",Leo Dautzenberg,,data/txt/17020.txt,Leo Dautzenberg (CDU/CSU),cducsu,speech
52238,20,17,0,953,Der Koalitionsvertrag spricht eine klare Sprache!,Frank Schäffler,,data/txt/17020.txt,Frank Schäffler [FDP],fdp,poi
52239,20,17,0,954,,Leo Dautzenberg,,data/txt/17020.txt,Leo Dautzenberg (CDU/CSU),cducsu,speech
52240,20,17,0,955,"Herr Kollege, das war ein bisschen der Versuch, Ihre Rede zu wiederholen und diese Punkte anzubringen.",Dr. Carsten Sieling,,data/txt/17020.txt,Dr. Carsten Sieling (SPD),spd,speech
52241,20,17,0,956,"Ich habe die Frage gestellt, ob Sie das zur Kenntnis genommen haben!",Leo Dautzenberg,,data/txt/17020.txt,Leo Dautzenberg [CDU/CSU],cducsu,poi
52242,20,17,0,957,- Sie haben mehrere Fragen gestellt. Ich will sie gerne nacheinander aufrufen.,Dr. Carsten Sieling,,data/txt/17020.txt,Dr. Carsten Sieling (SPD),spd,speech
52243,20,17,0,958,"Es wäre besser, Sie beantworten sie, statt sie aufzurufen!",Leo Dautzenberg,,data/txt/17020.txt,Leo Dautzenberg [CDU/CSU],cducsu,poi
52244,20,17,0,959,"Die erste, wichtige Frage betrifft Ihren Hinweis, dass dies eine Parlamentsdebatte sei. Ich habe bisher nicht gewusst, dass es üblich ist, dass in einer Parlamentsdebatte die Bundesregierung nicht dabei sein muss.",Dr. Carsten Sieling,,data/txt/17020.txt,Dr. Carsten Sieling (SPD),spd,speech
52245,20,17,0,960,Sie ist doch vertreten!,Leo Dautzenberg,,data/txt/17020.txt,Leo Dautzenberg [CDU/CSU],cducsu,poi
52246,20,17,0,961,"- Natürlich ist die Bundesregierung vertreten - gar keine Frage -; aber normalerweise erwartet man bei wichtigen Fragen die entsprechenden Repräsentantinnen und Repräsentanten und eine Vertretung in größerer Breite. Das ist doch ein relevanter Punkt, Herr Dautzenberg. Deshalb würden wir uns wünschen, dass die Ministerinnen und Minister, die Kabinettsmitglieder der Debatte beiwohnen. Das ist jedenfalls meine Auffassung.",Dr. Carsten Sieling,,data/txt/17020.txt,Dr. Carsten Sieling (SPD),spd,speech
52247,20,17,0,962,Beifall bei Abgeordneten der SPD,,,data/txt/17020.txt,,,poi
52248,20,17,0,963,"Ich will ganz klar sagen, dass wir Sozialdemokraten natürlich der Auffassung sind, dass wir ein breites Bündel an Maßnahmen brauchen.",Dr. Carsten Sieling,,data/txt/17020.txt,Dr. Carsten Sieling (SPD),spd,speech
52249,20,17,0,964,Aha! War das die Antwort auf meine Frage? Kann ich mich setzen?,Leo Dautzenberg,,data/txt/17020.txt,Leo Dautzenberg [CDU/CSU],cducsu,poi
52250,20,17,0,965,"- Da meine ganze Rede eine Antwort auf Sie ist, dürfen Sie sich gerne setzen, Herr Dautzenberg.",Dr. Carsten Sieling,,data/txt/17020.txt,Dr. Carsten Sieling (SPD),spd,speech
52251,20,17,0,966,Danke! Dann ist das erträglicher!,Leo Dautzenberg,,data/txt/17020.txt,Leo Dautzenberg [CDU/CSU],cducsu,poi
52252,20,17,0,967,"Aber ich kann das nicht entscheiden.

Ich will auch sehr deutlich sagen, dass Bundesfinanzminister Peer Steinbrück derjenige war, der im letzten Jahr die Vorschläge für entsprechende Maßnahmen gemacht hat.",Dr. Carsten Sieling,,data/txt/17020.txt,Dr. Carsten Sieling (SPD),spd,speech
52253,20,17,0,968,Wo ist er denn heute?,Frank Schäffler,,data/txt/17020.txt,Frank Schäffler [FDP],fdp,poi
52254,20,17,0,969,"Das ist die Grundlage, auf der wir jetzt aufbauen können. Sie werden bei den Sozialdemokraten in diesem Hause keinen finden, der zu dem, was Peer Steinbrück letztes Jahr angeschoben hat, nicht steht. Das will ich ein für allemal festhalten.",Dr. Carsten Sieling,,data/txt/17020.txt,Dr. Carsten Sieling (SPD),spd,speech
52255,20,17,0,970,Beifall bei der SPD,,,data/txt/17020.txt,,,poi
52256,20,17,0,971,Wo ist denn Herr Steinbrück?,Frank Schäffler,,data/txt/17020.txt,Frank Schäffler [FDP],fdp,poi
52257,20,17,0,972,"Der zweite Vorwurf, der ausgeräumt werden muss - hier werden immer wieder Missverständnisse aufgebaut -: Natürlich schlagen wir ein Gesamtkonzept vor. Wir wissen - Kollege Poß hat das bereits gesagt -, dass es ein Bündel von Maßnahmen geben muss: Natürlich müssen Bonizahlungen durch eine strengere Besteuerung angegangen werden. Und natürlich müssen wir im Zusammenhang mit Basel III die Eigenkapitalproblematik hart angehen. Da sind wir uns einig.",Dr. Carsten Sieling,,data/txt/17020.txt,Dr. Carsten Sieling (SPD),spd,speech
52258,20,17,0,973,Okay!,Leo Dautzenberg,,data/txt/17020.txt,Leo Dautzenberg [CDU/CSU],cducsu,poi
52259,20,17,0,974,"Das gehört dazu. Es gehört auch dazu, die Finanzaufsicht mit mehr Schlagkraft zu versehen. Das ist gar keine Frage; da sind wir nah beieinander. Das allein reicht aber nicht. Sie müssen auch den Mut haben, zum Beispiel das Thema Steueroasen",Dr. Carsten Sieling,,data/txt/17020.txt,Dr. Carsten Sieling (SPD),spd,speech
52260,20,17,0,975,Einverstanden!,Leo Dautzenberg,,data/txt/17020.txt,Leo Dautzenberg [CDU/CSU],cducsu,poi
52261,20,17,0,976,"und viele andere Dinge anzugehen. Es reicht überhaupt nicht aus, hier Präsident Obama für sein mutiges Vorgehen zu loben und dann seine Vorschläge Strich für Strich und Punkt für Punkt zu zerreden.",Dr. Carsten Sieling,,data/txt/17020.txt,Dr. Carsten Sieling (SPD),spd,speech
52262,20,17,0,977,Beifall bei der SPD,,,data/txt/17020.txt,,,poi
52263,20,17,0,978,Wollen Sie die hier übernehmen?,Leo Dautzenberg,,data/txt/17020.txt,Leo Dautzenberg [CDU/ CSU],cducsu,poi
52264,20,17,0,979,"Das geht nicht; das offenbart Ihre fehlende Ernsthaftigkeit an dieser Stelle. Sie beziehen sich nur auf zwei Vorschläge: zur Finanzaufsicht und zum Eigenkapital. So wird man diese Finanzkrise nicht in den Griff kriegen; das wird nicht ausreichen, um die Probleme zu lösen.

Deshalb schlagen wir heute in unserem Antrag eine ganze Reihe von Maßnahmen vor, legen den Fokus dabei aber auf die Einführung einer Finanztransaktionsteuer. Ich will an dieser Stelle sagen: Was ich hier gehört habe, sind verzweifelte Versuche, von Aussagen wegzurudern, die aus der eigenen Koalition stammen.",Dr. Carsten Sieling,,data/txt/17020.txt,Dr. Carsten Sieling (SPD),spd,speech
52265,20,17,0,980,Beifall bei der SPD,,,data/txt/17020.txt,,,poi
52266,20,17,0,981,"Das ist nichts anderes als der verzweifelte Versuch, an dieser Stelle abzulenken.

Viele Kolleginnen und Kollegen im Hause haben gestern erlebt, wie der Präsident des Deutschen Sparkassen- und Giroverbandes, Herr Haasis, die verschiedenen Punkte aus seiner Sicht diskutiert hat. Er ist zu dem Schluss gekommen, dass es sich bei der internationalen Finanztransaktionsteuer natürlich nicht um ein unkom-pliziertes Instrument handelt - wer will das behaupten! -, dies aber der Weg ist, der beschritten werden müsse.",Dr. Carsten Sieling,,data/txt/17020.txt,Dr. Carsten Sieling (SPD),spd,speech
52267,20,17,0,982,Nein! Er hat gesagt: Von allen schlechten Instrumenten ist das noch das harmloseste!,Leo Dautzenberg,,data/txt/17020.txt,Leo Dautzenberg [CDU/CSU],cducsu,poi
52268,20,17,0,983,"Wir fordern Sie dazu auf: Hören Sie auf die Stimmen aus der Finanzwirtschaft! Folgen Sie den Vorschlägen, die breite Unterstützung finden!",Dr. Carsten Sieling,,data/txt/17020.txt,Dr. Carsten Sieling (SPD),spd,speech
52269,20,17,0,984,Beifall bei der SPD und der LINKEN,,,data/txt/17020.txt,,,poi
52270,20,17,0,985,"Herr Dautzenberg, ich sage noch einmal: Sie retten sich nicht damit, dass Sie immer wieder dieselben zwei Vorschläge machen und den Kernpunkten ausweichen. Sie können das hier nicht wegfilibustern.

Man muss sich vor Augen führen - das ist in diesem Zusammenhang noch nicht ausreichend geschehen -, worum es dabei geht: Erstens. Die Finanztransaktionsteuer ist ein Instrument, das nicht nachsorgend reagiert, sondern die Bedingungen dafür schaffen würde, dass bestimmte Spekulationsentwicklungen nicht wieder erfolgen könnten.",Dr. Carsten Sieling,,data/txt/17020.txt,Dr. Carsten Sieling (SPD),spd,speech
52271,20,17,0,986,So ein Quatsch!,Frank Schäffler,,data/txt/17020.txt,Frank Schäffler [FDP],fdp,poi
52272,20,17,0,987,"Sie ist eine Steuer, die dem Wort „Steuer“ wirklich gerecht wird: Sie ist zum Steuern da; sie greift in die wirtschaftlichen Abläufe ein und nimmt schädlichen Spekulationen den Schwung. Das führt dazu, dass wir einen volkswirtschaftlichen Nutzen auch im Bereich der Finanzindustrie erzielen. Darum ist der Vorschlag richtig, darum wird er weitreichend unterstützt.",Dr. Carsten Sieling,,data/txt/17020.txt,Dr. Carsten Sieling (SPD),spd,speech
52273,20,17,0,988,Beifall bei der SPD sowie bei Abgeordneten der LINKEN,,,data/txt/17020.txt,,,poi
52274,20,17,0,989,"Sie können rufen und schreien, wie Sie wollen: Wir müssen ein Problem lösen. Heute läuft dasselbe Wertpapier 100-mal um den Globus, ohne einen Deut zur Wertschöpfung beizutragen.",Dr. Carsten Sieling,,data/txt/17020.txt,Dr. Carsten Sieling (SPD),spd,speech
52275,20,17,0,990,Derivate! Das ist richtig!,Leo Dautzenberg,,data/txt/17020.txt,Leo Dautzenberg [CDU/CSU],cducsu,poi
52276,20,17,0,991,"Wer kann denn sagen, dass das sinnvoll ist? Lassen Sie uns zusammen vorangehen und uns sagen: Deutschland schließt sich als große Industrienation dem Vorschlag an; wir wollen das einschränken.",Dr. Carsten Sieling,,data/txt/17020.txt,Dr. Carsten Sieling (SPD),spd,speech
52277,20,17,0,992,Beifall bei der SPD,,,data/txt/17020.txt,,,poi
52278,20,17,0,993,Das kann ich doch auch über Regulierung erreichen!,Leo Dautzenberg,,data/txt/17020.txt,Leo Dautzenberg [CDU/CSU],cducsu,poi
52279,20,17,0,994,"- Das können Sie vielleicht auch über Regulierung erreichen; aber diese Krise ist so komplex, dass man ein Bündel, einen Komplex von Maßnahmen braucht. Deshalb dürfen Sie den einzelnen Punkten nicht ausweichen.

Zweitens. Die Finanztransaktionsteuer - das ist mehrfach diskutiert worden - greift erheblich weiter als die bisher diskutierten Instrumente wie die Tobin-Tax und die Börsenumsatzsteuer.",Dr. Carsten Sieling,,data/txt/17020.txt,Dr. Carsten Sieling (SPD),spd,speech
52280,20,17,0,995,Das ist ja das Schlimme daran!,Frank Schäffler,,data/txt/17020.txt,Frank Schäffler [FDP],fdp,poi
52281,20,17,0,996,"Sie umfasst alle Finanztransaktionen. Deshalb ist sie das richtige Mittel, insgesamt Wirkung zu entfalten und keine Schlupflöcher offenzulassen.",Dr. Carsten Sieling,,data/txt/17020.txt,Dr. Carsten Sieling (SPD),spd,speech
52282,20,17,0,997,Und die Welt ist eine Scheibe!,Frank Schäffler,,data/txt/17020.txt,Frank Schäffler [FDP],fdp,poi
52283,20,17,0,998,"Drittens: die Höhe der Steuer. Es wird über einen Steuersatz zwischen 0,01 und 0,05 Prozent diskutiert. Das heißt, bei einer Transaktion in Höhe von 100 000 Euro - ich nenne eine Summe, die man mit normalem Menschenverstand überschauen kann - geht es um eine steuerliche Belastung von 50 Euro.",Dr. Carsten Sieling,,data/txt/17020.txt,Dr. Carsten Sieling (SPD),spd,speech
52284,20,17,0,999,Der Kleinsparer!,Frank Schäffler,,data/txt/17020.txt,Frank Schäffler [FDP],fdp,poi
52285,20,17,0,1000,So viel kostet eine Taxifahrt aus dem Obertaunus bis nach Frankfurt; diese Belastung wird man bei schädlichen Investitionen hinnehmen können.,Dr. Carsten Sieling,,data/txt/17020.txt,Dr. Carsten Sieling (SPD),spd,speech
52286,20,17,0,1001,Beifall bei der SPD sowie bei Abgeordneten der LINKEN,,,data/txt/17020.txt,,,poi
52287,20,17,0,1002,"Auch deshalb ist die Steuer vertretbar und richtig.

Es gibt das Argument - das muss ich noch einmal aufgreifen -, dass insbesondere die Kleinanleger betroffen sein werden.",Dr. Carsten Sieling,,data/txt/17020.txt,Dr. Carsten Sieling (SPD),spd,speech
52288,20,17,0,1003,"Ja, das tut Ihnen weh!",Frank Schäffler,,data/txt/17020.txt,Frank Schäffler [FDP],fdp,poi
52289,20,17,0,1004,"Herr Schäffler, Sie haben sich hier noch einmal auf die Aussagen von Herrn Pofalla und - ich glaube - Herrn Staatsminister Fahrenschon bezogen. Ich würde wirklich gerne einmal wissen, was genau dahintersteckt.",Dr. Carsten Sieling,,data/txt/17020.txt,Dr. Carsten Sieling (SPD),spd,speech
52290,20,17,0,1005,Das kann ich Ihnen sagen!,Frank Schäffler,,data/txt/17020.txt,Frank Schäffler [FDP],fdp,poi
52291,20,17,0,1006,"Erstens. Bei 80 Prozent aller Riester-Verträge sind die Gelder überhaupt nicht fondsbezogen angelegt. Dafür spielt das also überhaupt keine Rolle.

Zweitens. Sie haben das Beispiel genannt, dass die relevante Summe bei einem Riester-Sparer ein Betrag von circa 30 000 Euro sei. Aufgrund Ihrer Tätigkeit - Sie haben wahrscheinlich schon viele Verträge persönlich vermittelt; hoffentlich nicht im gefährlich-spekulativen Bereich - werden Sie wissen, dass der Sparer bei den in Ihrem Beispiel gewählten 30 000 Euro im Monat einen Sparbeitrag in Höhe von 87 Euro hat. Bei unserer niedrig angesetzten Finanztransaktionsteuer wäre das innerhalb von 20 Jahren eine Belastung von 10 bis 20 Euro.",Dr. Carsten Sieling,,data/txt/17020.txt,Dr. Carsten Sieling (SPD),spd,speech
52292,20,17,0,1007,Lachen des Abg. Frank Schäffler [FDP],,,data/txt/17020.txt,,,poi
52293,20,17,0,1008,"- Natürlich. Wenn Sie den Dreisatz beherrschen, dann werden Sie das sehen.",Dr. Carsten Sieling,,data/txt/17020.txt,Dr. Carsten Sieling (SPD),spd,speech
52294,20,17,0,1009,"Ja, im Gegensatz zu Ihnen kann ich den Dreisatz! Ich kann sogar die Zinseszinsrechnung!",Frank Schäffler,,data/txt/17020.txt,Frank Schäffler [FDP],fdp,poi
52295,20,17,0,1010,"Sie reden hier von 4 700 Euro. Wissen Sie, wann Sie die Zahl erreichen? In 9 000 Jahren! Sie machen hier eine Milchmädchenrechnung. Fragen Sie in der Branche nach! Keiner wird Ihnen diese Rechnung bestätigen.",Dr. Carsten Sieling,,data/txt/17020.txt,Dr. Carsten Sieling (SPD),spd,speech
52296,20,17,0,1011,Haben Sie schon einmal etwas von Zinseszinsen gehört?,Frank Schäffler,,data/txt/17020.txt,Frank Schäffler [FDP],fdp,poi
52297,20,17,0,1012,"Ich sage Ihnen hier: Sie verschrecken die Leute und machen ihnen Angst,",Dr. Carsten Sieling,,data/txt/17020.txt,Dr. Carsten Sieling (SPD),spd,speech
52298,20,17,0,1013,Mit Recht!,Frank Schäffler,,data/txt/17020.txt,Frank Schäffler [FDP],fdp,poi
52299,20,17,0,1014,"und das nur, damit dieses richtige Instrument, die Finanztransaktionsteuer, verhindert wird. Das können wir nicht akzeptieren.",Dr. Carsten Sieling,,data/txt/17020.txt,Dr. Carsten Sieling (SPD),spd,speech
52300,20,17,0,1015,Beifall bei der SPD sowie bei Abgeordneten der LINKEN und des BÜNDNISSES 90/DIE GRÜNEN,,,data/txt/17020.txt,,,poi
52301,20,17,0,1016,"Ich will an dieser Stelle sagen, dass in der Tat ein weiteres sozusagen nichtfachliches Element nötig ist, wenn man eine Steuer neu einführen will. Das Argument spielt bei vielen Menschen eine große Rolle. Natürlich muss man weitere Steuerbelastungen und neue Steuern gut begründen. Es geht darum, dass man für einen solchen Vorschlag nicht nur gute Argumente, sondern auch Unterstützung braucht.

Ich will an dieser Stelle einmal sagen, dass ich hier auch deshalb argumentiere und wir als SPD-Fraktion auch deshalb einen Antrag in dieser Richtung vorgelegt haben, weil es in Deutschland eine Petition mit 60 000 Unterschriften gibt, in der das gefordert wird,",Dr. Carsten Sieling,,data/txt/17020.txt,Dr. Carsten Sieling (SPD),spd,speech
52302,20,17,0,1017,Das ist aber wenig!,Leo Dautzenberg,,data/txt/17020.txt,Leo Dautzenberg [CDU/CSU],cducsu,poi
52303,20,17,0,1018,"und es sind noch viel mehr Menschen, die das fordern.

Das ist keine isolierte Sache, sondern das wird gesellschaftlich breit getragen. Das geht weit in die Gesellschaft hinein - auch in Ihr Spektrum, also auch in den Bereich der CDU und der CSU. Ob jemand von der FDP dabei ist, weiß ich nicht.

Sie wissen auch, dass weite Teile der Wissenschaft das mittragen. Amerikanische Ökonomen, Nobelpreisträger: Alle stehen dahinter.

Der Bundespräsident",Dr. Carsten Sieling,,data/txt/17020.txt,Dr. Carsten Sieling (SPD),spd,speech
52304,20,17,0,1019,Horst Köhler!,Joachim Poß,,data/txt/17020.txt,Joachim Poß [SPD],spd,poi
52305,20,17,0,1020,"- Horst Köhler, CDU - hat uns aufgefordert, eine internationale Finanztransaktionsteuer einzuführen.",Dr. Carsten Sieling,,data/txt/17020.txt,Dr. Carsten Sieling (SPD),spd,speech
52306,20,17,0,1021,"Hat er keine Wirtschaftskompetenz, Herr Michelbach?",Joachim Poß,,data/txt/17020.txt,Joachim Poß [SPD],spd,poi
52307,20,17,0,1022,"Darum frage ich mich, warum Sie hier so lange reden und darum herumgehen.",Dr. Carsten Sieling,,data/txt/17020.txt,Dr. Carsten Sieling (SPD),spd,speech
52308,20,17,0,1023,Beifall bei Abgeordneten der SPD und des BÜNDNISSES 90/DIE GRÜNEN,,,data/txt/17020.txt,,,poi
52309,20,17,0,1024,Wir schlagen hier einen Dreistufenplan vor.,Dr. Carsten Sieling,,data/txt/17020.txt,Dr. Carsten Sieling (SPD),spd,speech
52310,20,17,0,1025,"Wir schließen das doch nicht aus, Herr Kollege! Wir warten aber mal die Prüfung ab!",Leo Dautzenberg,,data/txt/17020.txt,Leo Dautzenberg [CDU/CSU],cducsu,poi
52311,20,17,0,1026,"- Ich glaube, wenn wir die Politik in Deutschland so anlegen, dass wir ständig nur Prüfungen durchführen und auf das Ergebnis dieser Prüfungen warten,",Dr. Carsten Sieling,,data/txt/17020.txt,Dr. Carsten Sieling (SPD),spd,speech
52312,20,17,0,1027,"Nein, nein, nein!",Leo Dautzenberg,,data/txt/17020.txt,Leo Dautzenberg [CDU/CSU],cducsu,poi
52313,20,17,0,1028,Frag doch mal den Horst Köhler!,Abg. Joachim Poß,,data/txt/17020.txt,"Abg. Joachim Poß [SPD], an den Abg. Leo Dautzenberg [CDU/CSU] gewandt",spd,poi
52314,20,17,0,1029,"dann kommt die nächste Finanzkrise schneller, als wir gucken können. Herr Kollege Dautzenberg, wir haben gar keine Zeit mehr, zu prüfen. Wir müssen handeln.",Dr. Carsten Sieling,,data/txt/17020.txt,Dr. Carsten Sieling (SPD),spd,speech
52315,20,17,0,1030,Beifall bei der SPD und dem BÜNDNIS 90/ DIE GRÜNEN,,,data/txt/17020.txt,,,poi
52316,20,17,0,1031,"Es muss ein Konzept auf dem Tisch liegen, damit die G 20 dieses umsetzen kann.",Dr. Carsten Sieling,,data/txt/17020.txt,Dr. Carsten Sieling (SPD),spd,speech
52317,20,17,0,1032,"Die internationale Finanztransaktionsteuer: Relativ wenige hier - Herr Schäffler tut das immer, aber für andere gilt das weniger - haben dagegen geredet. Diese Maßnahme auf internationaler Ebene wird breit gestützt. Herr Michelbach hat sich als Einziger aus der Koalition positiver dazu geäußert, weil er wahrscheinlich auch das Interview mit Herrn Dobrindt, Ihrem Generalsekretär, gelesen hat, der sehr, sehr deutlich gesagt hat, dass wir eine internationale Finanztransaktionsteuer brauchen.",Das ist der Kern unseres Antrags. Deshalb will ich das einmal herunterdeklinieren,,data/txt/17020.txt,Das ist der Kern unseres Antrags. Deshalb will ich das einmal herunterdeklinieren,,speech
