id,sitzung,wahlperiode,in_writing,sequence,text,speaker_cleaned,speaker_fp,filename,speaker,speaker_party,type
52764,20,17,0,1479,"Wir haben in den Koalitionsvertrag aufgenommen und werden es auch in Kürze umsetzen, dass die ehe- und familienrechtlichen Regelungen im Beamtenrecht auf die gleichgeschlechtlichen Lebenspartnerschaften übertragen werden.",Marco Buschmann,,data/txt/17020.txt,Marco Buschmann (FDP),fdp,speech
52765,20,17,0,1480,Wer hat denn beim Bundesverfassungsgericht dagegen geklagt? Wer war denn gegen die gleichgeschlechtlichen Lebensgemeinschaften? Das waren doch Sie!,Christine Lambrecht,,data/txt/17020.txt,Christine Lambrecht [SPD],spd,poi
52766,20,17,0,1481,"Wir werden die Magnus-Hirschfeld-Stiftung einrichten, die sich gegen Diskriminierung wendet, und wir werden das Transsexuellengesetz auf die Höhe der Zeit bringen.",Marco Buschmann,,data/txt/17020.txt,Marco Buschmann (FDP),fdp,speech
52767,20,17,0,1482,Beifall bei der FDP,,,data/txt/17020.txt,,,poi
52768,20,17,0,1483,"Selbst die CSU bzw. die bayerische Staatsregierung haben wir davon überzeugt, dass Homosexuelle fürsorgliche Stiefeltern sein können. Deshalb hat die bayerische Staatsregierung ihre Klage gegen das Lebenspartnerschaftsergänzungsgesetz vor dem Bundesverfassungsgericht zurückgezogen.",Marco Buschmann,,data/txt/17020.txt,Marco Buschmann (FDP),fdp,speech
52769,20,17,0,1484,Beifall bei der FDP,,,data/txt/17020.txt,,,poi
52770,20,17,0,1485,Widerspruch bei der SPD,,,data/txt/17020.txt,,,poi
52771,20,17,0,1486,"Kurzum: Auf die FDP ist Verlass, egal wann, egal wo und egal mit wem. Wir sorgen für Fortschritt in der Sache für die Menschen.",Marco Buschmann,,data/txt/17020.txt,Marco Buschmann (FDP),fdp,speech
52772,20,17,0,1487,Lachen beim BÜNDNIS 90/DIE GRÜNEN,,,data/txt/17020.txt,,,poi
52773,20,17,0,1488,Sie haben doch vor dem Verfassungsgericht dagegen geklagt!,Christine Lambrecht,,data/txt/17020.txt,Christine Lambrecht [SPD],spd,poi
52774,20,17,0,1489,"Daran können Sie von der SPD sich ein Beispiel nehmen. „Kannste was lernen“, um mit den Worten Bertolt Brechts zu sprechen. All die bleiernen Jahre in der Großen Koalition, in der auch Sie in Regierungsverantwortung standen und etwas hätten tun können, haben Sie immer gesagt: Wir würden ja gerne, aber die böse Union lässt uns nicht.

Wir haben es zusammen mit der Union geschafft.",Marco Buschmann,,data/txt/17020.txt,Marco Buschmann (FDP),fdp,speech
52775,20,17,0,1490,"Das Bundesverfassungsgericht, aber nicht Sie!",Christine Lambrecht,,data/txt/17020.txt,Christine Lambrecht [SPD],spd,poi
52776,20,17,0,1491,Das ist also möglich. Wir halten Wort. Nehmen Sie sich daran bitte ein Beispiel!,Marco Buschmann,,data/txt/17020.txt,Marco Buschmann (FDP),fdp,speech
52777,20,17,0,1492,Beifall bei der FDP sowie bei Abgeordneten der CDU/CSU,,,data/txt/17020.txt,,,poi
52778,20,17,0,1493,"Bei aller Sympathie für das Anliegen: Auch für die im Antrag geforderte Grundgesetzänderung gilt der Prüfungsmaßstab, den ich eingangs erwähnt habe: Es ist nämlich die Frage zu stellen, ob es eine Schutzlücke gibt, die wir schließen müssen. Diese Frage ist zu verneinen. Denn in Deutschland fehlt es nicht am verfassungsrechtlichen Schutz der sexuellen Identität.

Sie alle kennen die Entscheidung des Bundesverfassungsgerichts vom 7. Juli letzten Jahres. Darin hat das Bundesverfassungsgericht ausdrücklich aus Art. 3 Abs. 1 Grundgesetz einen entsprechenden grundrechtlichen Schutz abgeleitet, und zwar auf demselben Schutzniveau wie bei Art. 3 Abs. 3. Das ist kein Zufall.

Wenn hier so getan wird, als ob das eine volatile Rechtsprechung sei, die jederzeit umkippen könnte, dann machen Sie den Betroffenen nur Angst. Denn Sie alle wissen, dass das Bundesverfassungsgericht nie wieder zu einer Entscheidung wie zu der von 1957 käme. Das wissen auch Sie, Herr Beck - Sie schreiben es sogar auf Ihrer Internetseite -, weil es Ihnen ja in Ihrem eigenen Seminar zu diesem Thema erklärt worden ist.",Marco Buschmann,,data/txt/17020.txt,Marco Buschmann (FDP),fdp,speech
52779,20,17,0,1494,Heiterkeit bei der FDP,,,data/txt/17020.txt,,,poi
52780,20,17,0,1495,Habe ich denn etwas anderes behauptet?,Volker Beck,,data/txt/17020.txt,Volker Beck [Köln] [BÜNDNIS 90/DIE GRÜNEN],gruene,poi
52781,20,17,0,1496,"Wir haben auch neue Erkenntnisquellen. Das Bundesverfassungsgericht lehnt sich zum Beispiel an Art. 21 Abs. 1 der Grundrechte-Charta an. Das Bundesverfassungsgericht zieht die Rechtsprechung des EGMR heran. Eine solche Entscheidung wie die von 1957 ist heute undenkbar und kann nie wieder passieren. Wer etwas anderes behauptet, macht den Menschen Angst, um politisches Kapital daraus zu ziehen.",Marco Buschmann,,data/txt/17020.txt,Marco Buschmann (FDP),fdp,speech
52782,20,17,0,1497,Beifall bei der FDP und der CDU/CSU,,,data/txt/17020.txt,,,poi
52783,20,17,0,1498,"Kurzum: Es wäre lediglich von symbolischer Wirkung, die vorgeschlagene Ergänzung vorzunehmen. Aber eine bloß symbolische Wirkung reicht uns nicht für eine Operation am offenen Herzen, nicht für einen Eingriff in den Grundrechtekatalog unseres Grundgesetzes. Zugleich reichen wir Ihnen aber die Hand, um die eigentliche Baustelle abzuarbeiten. Die eigentliche Baustelle ist, auf der einfachrechtlichen Ebene mögliche Unterschiede zu identifizieren und zu beseitigen. Hier haben wir die Möglichkeit, unser Land toleranter, offener und liberaler zu gestalten. Ich würde mich freuen, wenn Sie sich konstruktiv einbringen würden.

Herzlichen Dank für Ihre Aufmerksamkeit.",Marco Buschmann,,data/txt/17020.txt,Marco Buschmann (FDP),fdp,speech
52784,20,17,0,1499,Beifall bei der FDP und der CDU/CSU,,,data/txt/17020.txt,,,poi
52785,20,17,0,1500,,Marco Buschmann,,data/txt/17020.txt,Marco Buschmann (FDP),fdp,speech
52786,20,17,0,1501,"Herr Kollege Buschmann, ich gratuliere im Namen des Hauses zu Ihrer ersten Rede im Bundestag.",Dr. Hermann Otto Solms,,data/txt/17020.txt,Vizepräsident Dr. Hermann Otto Solms,,chair
52787,20,17,0,1502,Beifall,,,data/txt/17020.txt,,,poi
52788,20,17,0,1503,"Ich bitte Sie aber, jetzt noch ein bisschen aufmerksam zu bleiben, weil sich die Frau Kollegin Lambrecht zu einer Kurzintervention gemeldet hat, auf die Sie erwidern dürfen.

Bitte schön, Frau Kollegin Lambrecht.",Dr. Hermann Otto Solms,,data/txt/17020.txt,Vizepräsident Dr. Hermann Otto Solms,,chair
52789,20,17,0,1504,"Bei allem Respekt, dass das Ihre erste Rede ist, Herr Buschmann: Ich glaube, was Recht ist, muss auch Recht bleiben. Es war keineswegs die FDP, die in diesem Hause für die gleichgeschlechtlichen Lebensgemeinschaften gekämpft hat. Es war RotGrün. Die FDP ist zum damaligen Zeitpunkt - da Sie neu dabei sind, können Sie das vielleicht nicht wissen; aber offensichtlich haben Sie sich auch nicht die Mühe der Recherche gemacht - sogar vor das Bundesverfassungsgericht gezogen, weil sie die Verfassungswidrigkeit der Regelung festgestellt haben wollte.

Darüber hinaus bitte ich Sie, zur Kenntnis zu nehmen, dass es nicht die FDP war, die die Union zu der Einsicht gebracht hat, dass man eine Gleichstellung von gleichgeschlechtlichen Lebensgemeinschaften mit der Ehe in bestimmten Teilbereichen akzeptieren muss, sondern es war ein Urteil des Bundesverfassungsgerichts. Daher bitte ich Sie, diese Tatsachen auch bei Ihrer ersten Rede zur Kenntnis zu nehmen und das, was Sie behauptet haben, nicht einfach so stehen zu lassen.",Christine Lambrecht,,data/txt/17020.txt,Christine Lambrecht (SPD),spd,speech
52790,20,17,0,1505,"Beifall bei der SPD, der LINKEN und dem BÜNDNIS 90/DIE GRÜNEN",,,data/txt/17020.txt,,,poi
52791,20,17,0,1506,,Christine Lambrecht,,data/txt/17020.txt,Christine Lambrecht (SPD),spd,speech
52792,20,17,0,1507,"Herr Kollege Buschmann zur Erwiderung, bitte.",Dr. Hermann Otto Solms,,data/txt/17020.txt,Vizepräsident Dr. Hermann Otto Solms,,chair
52793,20,17,0,1508,Ich mache es ganz kurz.,Marco Buschmann,,data/txt/17020.txt,Marco Buschmann (FDP),fdp,speech
52794,20,17,0,1509,"Geben Sie zu, dass Sie schlecht recherchiert haben!",Christine Lambrecht,,data/txt/17020.txt,Christine Lambrecht [SPD],spd,poi
52795,20,17,0,1510,"Selbstverständlich hat die FDP immer die Vorreiterrolle übernommen. Ich möchte Sie nicht daran erinnern müssen, dass es der sozialdemokratische Bundeskanzler Helmut Schmidt ist, dem ein Diktum nachgesagt wird, das an diskriminierendem Inhalt nicht zu überbieten ist.",Marco Buschmann,,data/txt/17020.txt,Marco Buschmann (FDP),fdp,speech
52796,20,17,0,1511,"Reden wir hier über Gerüchte, oder über was reden wir hier?",Christine Lambrecht,,data/txt/17020.txt,Christine Lambrecht [SPD],spd,poi
52797,20,17,0,1512,"Sie alle wissen, was ihm nachgesagt wird. Ich erlaube mir, dieses Zitat nicht zu wiederholen. Die SPD hat sich an ganz vielen Stellen verweigert. Die FDP war stets die treibende Kraft.",Marco Buschmann,,data/txt/17020.txt,Marco Buschmann (FDP),fdp,speech
52798,20,17,0,1513,Beifall bei der FDP,,,data/txt/17020.txt,,,poi
52799,20,17,0,1514,Lächerlich!,Wolfgang Wieland,,data/txt/17020.txt,Wolfgang Wieland [BÜNDNIS 90/DIE GRÜNEN],gruene,poi
52800,20,17,0,1515,Realitätsverlust ersten Grades!,Christine Lambrecht,,data/txt/17020.txt,Christine Lambrecht [SPD],spd,poi
52801,20,17,0,1516,,Marco Buschmann,,data/txt/17020.txt,Marco Buschmann (FDP),fdp,speech
52802,20,17,0,1517,Das Wort hat jetzt die Kollegin Dr. Barbara Höll von der Fraktion Die Linke.,Dr. Hermann Otto Solms,,data/txt/17020.txt,Vizepräsident Dr. Hermann Otto Solms,,chair
52803,20,17,0,1518,Beifall bei der LINKEN,,,data/txt/17020.txt,,,poi
52804,20,17,0,1519,,Dr. Hermann Otto Solms,,data/txt/17020.txt,Vizepräsident Dr. Hermann Otto Solms,,chair
52805,20,17,0,1520,"Herr Präsident! Liebe Kolleginnen und Kollegen! Herr Buschmann, so mancher überhebliche Reiter ist schon vom Pferd gefallen. Nur zu Ihrer Information: Im September 1991 hat die damalige Gruppe der PDS/Linke Liste als Erste die Diskussion über die ersatzlose Streichung des § 175 StGB angestoßen. Dass wir heute in erster Beratung über drei gleichlautende Gesetzentwürfe der Oppositionsfraktionen sprechen, ist natürlich auch Ergebnis eines gesellschaftlichen Prozesses. Das muss man zur Kenntnis nehmen.",Dr. Barbara Höll,,data/txt/17020.txt,Dr. Barbara Höll (DIE LINKE),linke,speech
52806,20,17,0,1521,"Beifall bei der LINKEN, der SPD und dem BÜNDNIS 90/DIE GRÜNEN",,,data/txt/17020.txt,,,poi
52807,20,17,0,1522,"Es geht nicht darum, wer sich welche Orden an die Brust heften kann.

Es geht um den Schutz, den Respekt und die Akzeptanz von Lesben, Schwulen, Transsexuellen, Transgendern, Bisexuellen, Intersexuellen und natürlich von heterosexuellen Frauen und Männern. Es geht um den Schutz der sexuellen Identität. Engagierte Lesben und Schwule haben es erneut auf die politische Agenda gesetzt. Sie sind dabei von Politikerinnen und Politikern aller Parteien unterstützt worden. Ole von Beust hat im Oktober im Bundesrat darüber gesprochen. Vom Münsteraner CDU-Oberbürgermeister, Berthold Tillmann, bis zum Präsidenten des Deutschen Fußball-Bundes, Theo Zwanziger, reicht die Unterstützung.

Das ist bemerkenswert. Er hat sein Engagement in den letzten Tagen wiederholt, er als Chef des Deutschen Fußball-Bundes, der letzten „Bastion des heterosexuellen Mannes“; denn hier weiß Mann, was Diskriminierung bedeutet.",Dr. Barbara Höll,,data/txt/17020.txt,Dr. Barbara Höll (DIE LINKE),linke,speech
52808,20,17,0,1523,Beifall bei der LINKEN sowie bei Abgeordneten der SPD und des BÜNDNISSES 90/DIE GRÜNEN,,,data/txt/17020.txt,,,poi
52809,20,17,0,1524,"Ich erlaube, Theo Zwanziger zu zitieren:

Ich habe in letzter Zeit mit einigen Leuten geredet, die in dieser Situation sind, und sie haben mir vermittelt, weshalb sie sich nicht outen wollen.

Es hängt damit zusammen, dass für einen Homosexuellen im Fußball die persönlichen Bindungen, die Freude am Sport und auch das Geldverdienen verloren gehen können, wenn er sich outet.

Das ist immer noch gesellschaftliche Realität in der Bundesrepublik Deutschland.",Dr. Barbara Höll,,data/txt/17020.txt,Dr. Barbara Höll (DIE LINKE),linke,speech
52810,20,17,0,1525,Dagegen hilft aber keine Grundgesetzänderung!,von der CDU/CSU,,data/txt/17020.txt,Zuruf von der CDU/CSU,cducsu,poi
52811,20,17,0,1526,"Schwule Fußballprofis heiraten dann eben mal zum Schein und versuchen alles Mögliche. Es nutzt eben nichts, dass es inzwischen lesbische Politikerinnen und schwule Politiker, homosexuelle Fernsehjournalistinnen und -journalisten oder vielleicht Künstler gibt. In der gesellschaftlichen Realität gibt es immer noch keine vollständige Gleichstellung.

Auch wenn der Deutsche Bundestag mit dem Allgemeinen Gleichbehandlungsgesetz einen umfassenden Diskriminierungsschutz beschlossen hat und auch wenn im vergangenen Jahr das bekannte Urteil ergangen ist, nutzt dies nichts. Wir sind dennoch in der Verantwortung, hier Art. 3 des Grundgesetzes zu ändern. Dies hätte verschiedene Wirkungen. Die rückholende Wirkung nach hinten, die den § 175 betrifft, wurde schon genannt. Es geht aber auch um die Frage einer Normsetzung nach vorn, sowohl für den rechtlichen Bereich - dies hätte unmittelbare Wirkungen; das wissen Sie - als auch für den außerrechtlichen Bereich. Wir halten es für notwendig, hier tatsächlich eine Norm zu setzen.

In der Debatte hier spielte es mehrmals eine Rolle, dass kaum noch offene Diskriminierungen vorkommen. Im Bundesrat gibt es jetzt die Initiative dreier Länder; Brandenburg hat sich angeschlossen. In einigen Bundesländern steht der Schutz schon in der Landesverfassung. Aber schauen Sie sich die Realität an!

In Thüringen steht es in der Landesverfassung. Aber wenn sich dort ein schwules oder lesbisches Paar, vielleicht im schönsten Weiß, eintragen lassen will, muss es zum Ordnungsamt gehen und steht dann mit Leuten in einer Reihe, die vielleicht Geld bezahlen müssen, weil sie falsch geparkt haben. Ist das würdevoll?

Das Antidiskriminierungsgebot steht dort in der Verfassung; es wird aber nicht umgesetzt. Jetzt hat die Fraktion Die Linke im Landtag in Thüringen eine Möglichkeit, dagegen zu klagen; wir tun es und hoffen, dass dann die Diskriminierung beseitigt wird.",Dr. Barbara Höll,,data/txt/17020.txt,Dr. Barbara Höll (DIE LINKE),linke,speech
52812,20,17,0,1527,Beifall bei der LINKEN,,,data/txt/17020.txt,,,poi
52813,20,17,0,1528,"Die Grundgesetzänderung, die wir verlangen und für die die einfache Mehrheit schon vorhanden war, ist jetzt notwendig. Für sie ist es Zeit, und sie steht uns allen einfach gut zu Gesicht, über alle politischen Parteien hinweg. Deshalb sollten wir das schnell und sachlich erledigen.

Ich danke Ihnen.",Dr. Barbara Höll,,data/txt/17020.txt,Dr. Barbara Höll (DIE LINKE),linke,speech
52814,20,17,0,1529,Beifall bei der LINKEN sowie bei Abgeordneten der SPD,,,data/txt/17020.txt,,,poi
52815,20,17,0,1530,,Dr. Barbara Höll,,data/txt/17020.txt,Dr. Barbara Höll (DIE LINKE),linke,speech
52816,20,17,0,1531,Das Wort hat jetzt der Kollege Dr. Stephan Harbarth von der CDU/CSU-Fraktion.,Dr. Hermann Otto Solms,,data/txt/17020.txt,Vizepräsident Dr. Hermann Otto Solms,,chair
52817,20,17,0,1532,Beifall bei der CDU/CSU,,,data/txt/17020.txt,,,poi
52818,20,17,0,1533,,Dr. Hermann Otto Solms,,data/txt/17020.txt,Vizepräsident Dr. Hermann Otto Solms,,chair
52819,20,17,0,1534,"Herr Präsident! Liebe Kolleginnen und Kollegen! Die heutige Debatte ist unnötig. Die von der Opposition vorgeschlagene Verfassungsänderung ist überflüssig. Der Bundesrat hat sie deshalb bereits völlig zu Recht abgelehnt,",Dr. Stephan Harbarth,,data/txt/17020.txt,Dr. Stephan Harbarth (CDU/CSU),cducsu,speech
52820,20,17,0,1535,Das war übrigens eine Initiative von Herrn von Beust!,Volker Beck,,data/txt/17020.txt,Volker Beck [Köln] [BÜNDNIS 90/DIE GRÜNEN],gruene,poi
52821,20,17,0,1536,und CDU/CSU werden sie auch im Deutschen Bundestag aus diesem Grunde völlig zu Recht ablehnen.,Dr. Stephan Harbarth,,data/txt/17020.txt,Dr. Stephan Harbarth (CDU/CSU),cducsu,speech
52822,20,17,0,1537,Beifall bei der CDU/CSU,,,data/txt/17020.txt,,,poi
52823,20,17,0,1538,"Über Fraktionsgrenzen hinweg eint uns das Ziel, gesellschaftliche Minderheiten zu schützen. Über Fraktionsgrenzen hinweg werben wir gemeinsam für Toleranz und wenden wir uns gemeinsam gegen die Diskriminierung von Teilen unserer Gesellschaft. Über Fraktionsgrenzen hinweg verurteilen wir gemeinsam die Diskriminierung von Menschen aufgrund ihrer sexuellen Identität.

Die christlich-liberale Koalition hat dies in ihrer Ko-alitionsvereinbarung sehr deutlich herausgestellt. Die Koalitionsvereinbarung sieht vor, dass die Ausgewogenheit von Rechten und Pflichten eingetragener Lebenspartnerschaften verbessert wird. Sie sieht vor, dass die familien- und ehebezogenen Regelungen über Besoldung, Versorgung und Beihilfe auf Lebenspartnerschaften erstreckt werden. Sie sieht vor, dass gleichheitswidrige Benachteiligungen im Steuerrecht abgebaut werden.

Das sind die Themen, an denen wir arbeiten müssen, nicht an Schaufensterprojekten, wie Sie sie heute präsentieren, meine Damen und Herren.",Dr. Stephan Harbarth,,data/txt/17020.txt,Dr. Stephan Harbarth (CDU/CSU),cducsu,speech
52824,20,17,0,1539,Beifall bei der CDU/CSU sowie bei Abgeordneten der FDP,,,data/txt/17020.txt,,,poi
52825,20,17,0,1540,Seit wann ist die Verfassung denn ein Schaufenster? Was ist denn das für ein Verständnis?,Christine Lambrecht,,data/txt/17020.txt,Christine Lambrecht [SPD],spd,poi
52826,20,17,0,1541,Heute geht es nicht um die Frage: Wer ist gegen Diskriminierung? Heute geht es vielmehr um die Frage: Brauchen wir eine Änderung des Grundgesetzes? Unser Grundgesetz ist das Fundament unserer staatlichen Ordnung.,Dr. Stephan Harbarth,,data/txt/17020.txt,Dr. Stephan Harbarth (CDU/CSU),cducsu,speech
52827,20,17,0,1542,"Ja, deshalb!",Wolfgang Wieland,,data/txt/17020.txt,Wolfgang Wieland [BÜNDNIS 90/DIE GRÜNEN],gruene,poi
52828,20,17,0,1543,"Deshalb sollten wir nicht leichtfertig nach Änderungen des Grundgesetzes rufen. Wir sollten nur dort Hand ans Grundgesetz anlegen, wo dies inhaltlich notwendig ist. Dies ist hier eindeutig nicht der Fall.",Dr. Stephan Harbarth,,data/txt/17020.txt,Dr. Stephan Harbarth (CDU/CSU),cducsu,speech
52829,20,17,0,1544,Beifall bei der CDU/CSU sowie bei Abgeordneten der FDP,,,data/txt/17020.txt,,,poi
52830,20,17,0,1545,"Wer unsere Verfassung als Ort für Symbolpolitik ansieht, wer unsere Verfassung als Versandhauskatalog zur Erfüllung politischer Wünsche betrachtet, der entwertet unsere Verfassung.",Dr. Stephan Harbarth,,data/txt/17020.txt,Dr. Stephan Harbarth (CDU/CSU),cducsu,speech
52831,20,17,0,1546,Beschämend!,Christine Lambrecht,,data/txt/17020.txt,Christine Lambrecht [SPD],spd,poi
52832,20,17,0,1547,Genau das wollen wir nicht.,Dr. Stephan Harbarth,,data/txt/17020.txt,Dr. Stephan Harbarth (CDU/CSU),cducsu,speech
52833,20,17,0,1548,Beifall bei der CDU/CSU und der FDP,,,data/txt/17020.txt,,,poi
52834,20,17,0,1549,"Schon heute ist klar: Wer andere diskriminiert, wer andere wegen ihrer sexuellen Identität in die gesellschaftliche Ecke drängt, wer andere wegen ihrer sexuellen Identität beleidigt, der verstößt schon heute gegen geltendes Recht. Diese Entscheidung unserer Rechtsordnung ist richtig. Unsere Verfassung enthält schon heute klare Vorgaben gegen Diskriminierung. Das im Grundgesetz verbürgte allgemeine Persönlichkeitsrecht schützt die persönliche Lebenssphäre. Es schützt damit auch die sexuelle Identität und die sexuelle Orientierung eines Menschen. In Art. 3 des Grundgesetzes ist es in Stein gemeißelt:

Alle Menschen sind vor dem Gesetz gleich.

Dieser Maßstab bindet die öffentliche Gewalt und wirkt weit darüber hinaus in wichtige Teile unserer Privatrechtsordnung hinein.

Vor Diskriminierung schützt aber nicht nur das Grundgesetz. Vor Diskriminierung schützt zugleich unser einfaches Gesetzesrecht: im Arbeitsrecht, im Beamtenrecht, im Sozialrecht und ebenso in weiteren Rechtsgebieten. Im Allgemeinen Gleichbehandlungsgesetz wird sogar als Gesetzesziel ausdrücklich genannt, Benachteiligungen wegen der sexuellen Identität zu verhindern und zu beseitigen. Der Befund ist also eindeutig: Unser Grundgesetz und unsere einfachen Gesetze schützen klar und wirksam vor Diskriminierung.

Sollten Gesetze den Vorgaben unserer Verfassung einmal nicht entsprechen, dann ist die Rechtsprechung gefordert. Wir sehen: Die Rechtsprechung erfüllt ihre Aufgabe zuverlässig und gewissenhaft. Dies belegt das jüngste Urteil des Bundesverfassungsgerichts vom Juli vergangen Jahres zur betrieblichen Hinterbliebenenrente.",Dr. Stephan Harbarth,,data/txt/17020.txt,Dr. Stephan Harbarth (CDU/CSU),cducsu,speech
52835,20,17,0,1550,"Herr Kollege Harbarth, obwohl das Ihre erste Rede ist, möchte Ihnen Herr Beck gerne eine Zwischenfrage stellen.",Dr. Hermann Otto Solms,,data/txt/17020.txt,Vizepräsident Dr. Hermann Otto Solms,,chair
52836,20,17,0,1551,"Herr Kollege Beck hatte heute schon genug Gelegenheit, sich zu produzieren. Ich möchte gerne in meiner Rede fortfahren.",Dr. Stephan Harbarth,,data/txt/17020.txt,Dr. Stephan Harbarth (CDU/CSU),cducsu,speech
52837,20,17,0,1552,Beifall bei der CDU/CSU und der FDP,,,data/txt/17020.txt,,,poi
52838,20,17,0,1553,"Der Beschwerdeführer hatte die Ungleichbehandlung von Ehe und eingetragener Lebenspartnerschaft im Bereich der betrieblichen Hinterbliebenenrente gerügt. Das Bundesverfassungsgericht hat ihm gerade nicht gesagt: Es tut uns leid, aber Art. 3 des Grundgesetzes hilft hier nicht weiter. - Vielmehr hat es dem Beschwerdeführer recht gegeben, und zwar ohne dass es dazu die von Ihnen vorgeschlagene Verfassungsänderung benötigt hätte. Der allgemeine Gleichheitssatz des Grundgesetzes „Alle Menschen sind vor dem Gesetz gleich“ war als Grundlage völlig ausreichend. Damit ist klipp und klar: Kein einziges der Argumente, die heute vorgetragen wurden, rechtfertigt eine Verfassungsänderung.

Sie berufen sich zur Begründung Ihres Gesetzentwurfs auf das Unrecht, das Menschen in der Zeit des Nationalsozialismus aufgrund ihrer sexuellen Identität widerfahren ist. Gewiss, das erlittene Unrecht ist Verpflichtung zu wirksamem verfassungsrechtlichen Schutz vor einer Wiederholung solchen Unrechts. Aber genau dies leistet das Grundgesetz schon heute. Genau dies leistet auch unsere Verfassungswirklichkeit schon heute, wie die Entscheidung des Bundesverfassungsgerichts belegt.",Dr. Stephan Harbarth,,data/txt/17020.txt,Dr. Stephan Harbarth (CDU/CSU),cducsu,speech
52839,20,17,0,1554,Beifall bei der CDU/CSU sowie bei Abgeordneten der FDP,,,data/txt/17020.txt,,,poi
52840,20,17,0,1555,"Sie berufen sich weiterhin auf die bewusstseinsprägende Wirkung einer Grundgesetzänderung. Aber Bewusstseinsprägung - lassen Sie sich das gesagt sein - ist nicht die wesentliche Aufgabe einer Verfassung. Das ist vielmehr Aufgabe aller, die sich im Sinne gesellschaftlicher Ziele einsetzen, also Aufgabe von uns allen. Deshalb sollten wir engagiert für unsere gesellschaftlichen Werte eintreten. Aber wir sollten am Grundgesetz nicht leichtfertig herumbasteln. Das sind wir unserer so erfolgreichen Verfassung schuldig.

Dass Sie vonseiten der Opposition wieder einmal nach einer Verfassungsänderung rufen, entspricht Ihrem Politikansatz: Sie entdecken ein Übel und wollen es verbieten. Das ist bequem und lässt sich in Presseerklärungen gut verkaufen. Die Philosophie „Ich mache ein Gesetz, und die Welt wird ein besserer Ort“ ist aber zu dünn.",Dr. Stephan Harbarth,,data/txt/17020.txt,Dr. Stephan Harbarth (CDU/CSU),cducsu,speech
52841,20,17,0,1556,Ihre Rede ist dünn!,Christine Lambrecht,,data/txt/17020.txt,Christine Lambrecht [SPD],spd,poi
52842,20,17,0,1557,Deshalb machen Sie es sich mit Ihrem Gesetzentwurf zu einfach.,Dr. Stephan Harbarth,,data/txt/17020.txt,Dr. Stephan Harbarth (CDU/CSU),cducsu,speech
52843,20,17,0,1558,Beifall bei der CDU/CSU sowie bei Abgeordneten der FDP,,,data/txt/17020.txt,,,poi
52844,20,17,0,1559,"Das klare öffentliche Wort und die Zivilcourage eines jeden Einzelnen sind gefragt, nicht die Änderung des Grundgesetzes. Deshalb werden wir Ihren Gesetzentwurf ablehnen.

Herzlichen Dank.",Dr. Stephan Harbarth,,data/txt/17020.txt,Dr. Stephan Harbarth (CDU/CSU),cducsu,speech
52845,20,17,0,1560,Beifall bei der CDU/CSU und der FDP,,,data/txt/17020.txt,,,poi
52846,20,17,0,1561,,Dr. Stephan Harbarth,,data/txt/17020.txt,Dr. Stephan Harbarth (CDU/CSU),cducsu,speech
52847,20,17,0,1562,"Herr Kollege Harbarth, auch Ihnen gratuliere ich im Namen des Hauses zu Ihrer ersten Rede im Deutschen Bundestag.

Für Sie gilt ebenfalls, dass Sie weiterhin aufmerksam sein sollten; denn der Kollege Beck hat eine Kurzintervention beantragt. Er erhält jetzt die Gelegenheit dazu. Bitte schön, Herr Beck.",Dr. Hermann Otto Solms,,data/txt/17020.txt,Vizepräsident Dr. Hermann Otto Solms,,chair
