id,sitzung,wahlperiode,in_writing,sequence,text,speaker_cleaned,speaker_fp,filename,speaker,speaker_party,type
59994,25,17,0,657,"Meine Damen und Herren, nichts ist so gut, als dass man es nicht noch verbessern könnte. Das trifft auch auf das EEG zu. Ein Erfolgskriterium für politische Steuerungsinstrumente ist sicher die Effektivität. Ein noch wichtigeres ist allerdings die Effizienz. Bei der Effizienz, also dem Erreichen der Ziele mit möglichst geringem finanziellen Aufwand, gibt es Defizite, die wir beseitigen müssen.

Das Hauptproblem im EEG lässt sich sehr einfach darstellen. Die Verbraucher zahlen für die Entwicklung der Fotovoltaik derzeit unnötig viel Geld. Genau deshalb haben wir bereits im Koalitionsvertrag vereinbart, in diesem Bereich der erneuerbaren Energien kurzfristig Anpassungen der Förderung vorzunehmen. Bei dieser Anpassung gibt es zwei zentrale Vorgaben: erstens die Entlastung der Bürger von unnötig hoher Einspeisevergütung und zweitens die Sicherung der Entwicklungsbedingungen für die Branche. Beiden Vorgaben gleichzeitig zu entsprechen, ist nicht einfach. Wir sind hier aber auf einem guten Weg.

Meine Damen und Herren, allen, die sich in der Diskussion gern schnell auf die Seite der Anlagenhersteller schlagen und meinen, mit möglichst großzügiger Vergütung würde viel erreicht, will ich ganz deutlich sagen: Die hohe Förderung der Fotovoltaik in Deutschland hat dazu geführt, dass im Jahre 2009 die Hälfte der hier installierten Module importiert war. Der Umfang der Produktion von Modulen im Inland ist im gleichen Jahr kaum noch gewachsen. Die hohe Einspeisevergütung hat also dazu geführt, dass die Innovationsdynamik der Hersteller in Deutschland deutlich nachgelassen hat. Ausländische Anbieter, zum Beispiel aus China, können wachsende Marktanteile für ihre billigeren Solarpaneele verbuchen.

Wir wollen dem Bereich erneuerbare Energien Entwicklungschancen geben. Wir sind dazu bereit, die Marktdurchdringung zu unterstützen. Ungerechtfertigt hohe Dauersubventionen - Herr Scheer, ob sie nun Subventionen heißen oder nicht, ist egal; Kosten für die Bürger sind das allemal - helfen aber niemandem.",Marie-Luise Dött,,data/txt/17025.txt,Marie-Luise Dött (CDU/CSU),cducsu,speech
59995,25,17,0,658,Beifall bei Abgeordneten der CDU/CSU,,,data/txt/17025.txt,,,poi
59996,25,17,0,659,"Wer dem Bereich Fotovoltaik wirklich helfen will, wer die notwendigen Innovationen anstoßen will, wer die internationale Wettbewerbsfähigkeit unserer Paneelhersteller sichern will, wer Arbeitsplätze in diesem Bereich erhalten und schaffen will und wer das EEG auch weiterhin als Steuerungsinstrument für die Entwicklung der erneuerbaren Energien behalten will, der muss die Einspeisevergütung so ausgestalten, dass eine wirtschaftliche Motivation für Effizienzsteigerungen bewirkt wird, und der muss mit notwendigen Änderungen gleichzeitig dafür sorgen, dass die Akzeptanz des EEG insgesamt und auch die Akzeptanz der erneuerbaren Energien insgesamt bei den Verbrauchern erhalten bleiben. Nur derjenige, der sich verändert und auf Entwicklungen reagiert, wird erfolgreich bleiben. Das gilt auch hinsichtlich des EEG.

Nicht nur ein effizientes EEG ist eine Voraussetzung für den Ausbau erneuerbarer Energien. Um die Erneuerbaren wie geplant zu einer entscheidenden Säule der Energieversorgung zu entwickeln, muss eine Integration in das Stromversorgungssystem erfolgen. Versorgungssicherheit und Preiswürdigkeit der Energiebereitstellung für Bürger und Unternehmen bleiben dafür Grundsätze.

Genau aufgrund dieser beiden Grundsätze ist es erforderlich, dass wir den heutigen Energiemix so entwickeln, dass bestehende Vorteile von Energieträgern wie Kohle, Kernenergie und Gas für die Integration der Erneuerbaren genutzt werden. Diese Vorteile sind: vergleichsweise günstige Preise, Grundlastfähigkeit und die Möglichkeit zur Bereitstellung von Regelenergie.

Insoweit unterstützen wir die Entwicklung der erneuerbaren Energien mit unserem aktuellen Energiemix. Diese Unterstützung der erneuerbaren Energien ist auch bis auf Weiteres noch erforderlich, zumindest so lange, bis es für die erneuerbaren Energien ein angemessenes Preisniveau gibt und bis durch Speichertechnologien, die eine Speicherung in ausreichendem Umfang sicherstellen, ein dauerhaft verlässliches Stromangebot aus Erneuerbaren ermöglicht wird. Das richte ich ganz besonders an die Adresse von Herrn Fell.",Marie-Luise Dött,,data/txt/17025.txt,Marie-Luise Dött (CDU/CSU),cducsu,speech
59997,25,17,0,660,Beifall bei der CDU/CSU und der FDP,,,data/txt/17025.txt,,,poi
59998,25,17,0,661,Schauen Sie sich einmal die Zahlen an!,Hans-Josef Fell,,data/txt/17025.txt,Hans-Josef Fell [BÜNDNIS 90/DIE GRÜNEN],gruene,poi
59999,25,17,0,662,"Insoweit ist das Ausspielen von Kohlestrom und Kernenergie gegen die Erneuerbaren nicht nur sachlich falsch, sondern auch ein durchsichtiges ideologisch motiviertes Manöver, um bis auf Weiteres wichtige Energieträger in Deutschland zu diskreditieren. Durch den Versuch, Kernenergie und Kohle gegen die erneuerbaren Energien auszuspielen, wird der Entwicklung der erneuerbaren Energien nicht geholfen, sondern geschadet. Man gibt den erneuerbaren Energien damit eine Rolle in der Energieversorgung, die bis heute noch nicht ausgefüllt werden kann. Man kann „leider“ dahinter sagen, aber es funktioniert halt noch nicht.

In unserer Verantwortung liegen Klimaschutzverträglichkeit, Versorgungssicherheit, Preiswürdigkeit. Das sind unsere Maßstäbe für die Energieversorgung. Anhand dieser Maßstäbe wird zu entscheiden sein, welcher Energieträger welche Rolle im Energiemix Deutschlands haben muss. Ich sage Ihnen schon heute: Es wird nur gemeinsam mit der Kohle und nur mit der Kernenergie funktionieren.

Meine Damen und Herren von der SPD und den Grünen, Ihre Anträge sind weniger ein Beitrag für die Entwicklung der erneuerbaren Energien, Ihr wahres Ziel ist vielmehr der Angriff auf andere Energieträger. Genau deshalb lehnen wir die Anträge ab.",Marie-Luise Dött,,data/txt/17025.txt,Marie-Luise Dött (CDU/CSU),cducsu,speech
60000,25,17,0,663,Beifall bei der CDU/CSU sowie bei Abgeordneten der FDP,,,data/txt/17025.txt,,,poi
60001,25,17,0,664,"Es gibt gute Gründe, die Atomenergie abzulehnen!",Hans-Josef Fell,,data/txt/17025.txt,Hans-Josef Fell [BÜND-NIS 90/DIE GRÜNEN],gruene,poi
60002,25,17,0,665,"Wer einmal mehr Ideologie vor Sachverstand setzt, der vernichtet wirtschaftliches Vermögen, gefährdet den Wirtschaftsstandort und damit Arbeitsplätze,",Marie-Luise Dött,,data/txt/17025.txt,Marie-Luise Dött (CDU/CSU),cducsu,speech
60003,25,17,0,666,Ach Gott! Kommen Sie endlich einmal weg von dem alten Denken!,Bärbel Höhn,,data/txt/17025.txt,Bärbel Höhn [BÜNDNIS 90/DIE GRÜNEN],gruene,poi
60004,25,17,0,667,"macht Deutschland zu einem politisch erpressbaren Energieimporteur und gefährdet den sozialen Frieden, weil die daraus resultierenden Kostensteigerungen letztlich durch die Bürger getragen werden müssen. Der Umbau der Energieversorgung, die Veränderung des Energiemix, muss ein evolutionärer Prozess sein. Genau diese evolutionäre Entwicklung wird durch das in Arbeit befindliche Energiekonzept der Bundesregierung erreicht.

Vielen Dank.",Marie-Luise Dött,,data/txt/17025.txt,Marie-Luise Dött (CDU/CSU),cducsu,speech
60005,25,17,0,668,Beifall bei der CDU/CSU und der FDP,,,data/txt/17025.txt,,,poi
60006,25,17,0,669,,Marie-Luise Dött,,data/txt/17025.txt,Marie-Luise Dött (CDU/CSU),cducsu,speech
60007,25,17,0,670,"Ich schließe die Aussprache.

Interfraktionell wird Überweisung der Vorlagen auf den Drucksachen 17/778 und 17/799 an die in der Tagesordnung aufgeführten Ausschüsse vorgeschlagen. Sind Sie damit einverstanden? - Das ist der Fall. Dann ist die Überweisung so beschlossen.

Ich rufe jetzt Tagesordnungspunkt 20 auf:

Beratung der Beschlussempfehlung und des Berichts des Verteidigungsausschusses (12. Ausschuss) zu der Unterrichtung durch den Wehrbeauftragten

Jahresbericht 2008 (50. Bericht)

- Drucksachen 16/12200, 17/591 Nr. 1.6, 17/713 -

Berichterstattung:

Abgeordnete Anita Schäfer (Saalstadt)

Karin Evers-Meyer

Christoph Schnurr

Paul Schäfer (Köln)

Omid Nouripour

Nach einer interfraktionellen Vereinbarung ist für die Aussprache eine halbe Stunde vorgesehen, wobei die Redezeit des Wehrbeauftragten nicht einbezogen ist. Gibt es Widerspruch dagegen? - Das ist nicht der Fall. Dann ist das so beschlossen.

Ich eröffne die Aussprache und erteile das Wort dem Wehrbeauftragten des Deutschen Bundestages Reinhold Robbe.",Dr. Hermann Otto Solms,,data/txt/17025.txt,Vizepräsident Dr. Hermann Otto Solms,,chair
60008,25,17,0,671,"Sehr geehrter Herr Präsident! Meine sehr geehrten Damen und Herren! Bevor ich gleich zu dem eigentlichen Tagesordnungspunkt kommen werde, nämlich zum Jahresbericht für das Jahr 2008, gestatten Sie mir bitte einige wenige Bemerkungen zu einem aktuellen Thema, das insbesondere in dieser Woche den Verteidigungsausschuss, aber auch die gesamte Öffentlichkeit unseres Landes beschäftigt hat. Ich meine damit die Schilderungen eines ehemaligen Rekruten aus der Bundeswehr - genauer gesagt, aus dem Bundeswehrstandort Mittenwald - über, wie ich es bewerte, geschmacklose Rituale, die nicht nur gegen das Prinzip der Inneren Führung verstoßen, sondern auch straf- und dienstrechtliche Auswirkungen haben können.

Nach dieser Eingabe des ehemaligen Obergefreiten, der heute gar nicht mehr in der Bundeswehr ist, der ausgeschieden ist, haben sich weitere ehemalige und aktive Soldaten an mich gewandt. Bis zum heutigen Tage, bis dato, liegen mir insgesamt 93 Zuschriften zu diesem Themenbereich vor. Dabei handelt es sich vorrangig um Meinungsäußerungen und Schilderungen eigener Erlebnisse in früheren Jahren und - zum Teil sehr weit zurückgehend - auch aus früheren Jahrzehnten.

Als Zwischenergebnis, meine sehr verehrten Damen und Herren, kann ich heute an dieser Stelle Folgendes feststellen: Die zuständigen Disziplinarvorgesetzten haben, insbesondere auf der Bataillons- und auf der Brigadeebene, unmittelbar gehandelt, nachdem ich beim Gebirgsjägerbataillon 233 in Mittenwald um Prüfung der Vorgänge gebeten hatte. Für ein Resümee oder für grundsätzliche Aussagen ist es allerdings heute noch zu früh, weil diese Überprüfungen noch nicht abgeschlossen sind. Sie gestalten sich zum Teil auch sehr schwierig, insbesondere wenn die Vorfälle Jahre oder sogar Jahrzehnte zurückliegen. Es wird auch nur teilweise gelingen, die in den Zuschriften beschriebenen Vorkommnisse ähnlicher und anderer Art ganz aufzuklären. Je länger sie zurückliegen, desto schwieriger wird es sein, Sachverhalte und beteiligte Personen zu ermitteln.

Mit Sorge nehme ich allerdings zur Kenntnis, dass sich die beschriebenen Rituale offensichtlich im Laufe von etlichen Jahren abseits von öffentlicher Wahrnehmung entwickelt haben und erst heute eher zufällig, durch die Zuschrift eines einzelnen Soldaten, bekannt wurden. Äußerst bedenklich erscheint mir die Tatsache, dass Vorgesetzte von den Ritualen wussten und die gefährlichen Geschmacklosigkeiten entweder duldeten oder einfach darüber hinwegsahen. Beides wäre aus meiner Sicht zumindest inakzeptabel.

Trotz der beschriebenen Vorkommnisse wäre es jetzt aber vollkommen falsch - ich betone dies ausdrücklich -, die gesamte Bundeswehr einem Generalverdacht auszusetzen. Dafür besteht überhaupt kein Grund. Unsere Soldatinnen und Soldaten in allen Teilstreitkräften bewähren sich im Truppenalltag und im Einsatzland. Ich sage das besonders vor dem Hintergrund der heutigen Debatte über den ISAF-Einsatz in Afghanistan. Unsere Soldaten müssen sich auch im internationalen Vergleich nicht verstecken. Gerade deshalb ist es wichtig, die Vorkommnisse so schnell und gründlich wie möglich aufzuklären und danach die richtigen Schlüsse daraus zu ziehen.

Eines gebe ich allerdings zu bedenken: Die in einer sogenannten Zentralen Dienstvorschrift ausführlich beschriebenen Grundsätze der Inneren Führung dürfen nicht nur auf dem Papier stehen. Die Soldaten müssen auch danach leben und vor allen Dingen handeln. Es bedarf dringender als je zuvor der Prüfung, ob neben allen sach- und funktionsbezogenen Ausbildungsgebieten noch genügend Raum für jene für das Vertrauen und den inneren Zustand so wichtigen Fragen bleibt, die ich unter folgenden Stichworten zusammenfassen möchte: Sozialisierung, fürsorgliche Dienstaufsicht, Kommunikation untereinander und Fragen der Menschenführung. Auch in diesem Jahr deuten die Eingaben, die Erkenntnisse anlässlich der Bearbeitung und die Äußerungen in vielen Begegnungen mit unseren Soldatinnen und Soldaten auf erheblichen Handlungsbedarf in diesem Bereich hin.

Meine sehr verehrten Damen und Herren, lassen Sie mich vor dem Hintergrund der beschränkten Zeit noch einige ganz wenige Aspekte meines Jahresberichtes 2008 im Lichte der Stellungnahme des Verteidigungsministeriums näher beleuchten.

Stichwort Auslandseinsätze: Das Ministerium widerspricht nach meiner Einschätzung in keinem wesentlichen Punkte den von mir beschriebenen Defiziten. Es fehlen jedoch beim Zulauf geschützter Fahrzeuge - ein sehr wichtiger Punkt -, bei der Vorausbildung, insbesondere der Fahrerausbildung sowie der Sprachausbildung, konkrete Zusagen in Bezug auf eine zügige Abhilfe. Da muss nachgebessert werden, damit gerade mit Blick auf das, was im Moment an Strukturveränderungen bezüglich des Einsatzes in Afghanistan stattfindet, alles getan wird, was auch für den Schutz der Soldatinnen und Soldaten absolut notwendig ist. Dies gilt insbesondere für meine Kritik bezüglich der Telekommunikationseinrichtungen, die ich Jahr für Jahr in meine Berichte aufnehmen musste. Die in Aussicht genommene Ausschreibung mit dem Ziel einer Verbesserung für Soldatinnen und Soldaten kommt einfach nicht voran. Auch hier wäre ich sehr dankbar, wenn pragmatisch entschieden würde, wohin man will und wer das in Zukunft verantwortlich machen soll.

Stichwort Führung und Ausbildung: Nach meiner Auffassung ist meine Kritik an Unzulänglichkeiten der Ausstattung ebenso wie die Kritik am hohen Administrationsaufwand in der Stellungnahme des Ministeriums nicht widerlegt. Damit die Vorgesetzten sich wirklich der Führungsaufgabe widmen können, bedarf es einer Analyse der bürokratischen Aufgaben nach Nutzen und Aufwand. Das muss ganz klar durchdekliniert werden.

Stichwort Auswirkungen des demografischen Wandels auf die Bundeswehr: Ich bin dankbar, dass das Ministerium ausdrücklich meine Einschätzung der Bedeutung des demografischen Wandels und der damit verbundenen weiteren Verschärfung des Wettbewerbs um qualifiziertes Personal teilt. Hierzu sind Konzepte entwickelt worden, die jetzt allerdings mit Leben erfüllt werden müssen.

Stichwort Vereinbarkeit von Familie und Dienst: Es genügt nicht, die Bedeutung der Thematik in Absichtserklärungen verbal hervorzuheben. Das Thema ist zu wichtig, als dass es nur in Konzepten und Papieren gepriesen werden kann. In Sachen Kinderbetreuung ist ebenso mehr zu veranlassen wie bei Teilzeit und bei Telearbeitsplätzen.

Stichwort Wehrpflicht: Ich denke, dass meine Ausführungen unter dem Stichwort „Sinnvolle Dienstgestaltung“ und die aktive Inangriffnahme des Problems Gammeldienst entgegen der Stellungnahme durchaus einen hohen Stellenwert haben und bei der bevorstehenden Debatte über die Verkürzung des Wehrdienstes eine noch größere Bedeutung erfahren sollten.

Stichwort Sanitätsdienst: Der Sanitätsdienst kann mit Fug und Recht als das, wie ich finde, größte Sorgenkind angesehen werden, sowohl was die truppenärztliche Versorgung als auch was die Bundeswehrkrankenhäuser betrifft. Erste Maßnahmen sind ergriffen, um dem Ärztemangel zu begegnen, was aber zugleich auch zu großem Unmut bei den Sanitätsoffizieren insgesamt geführt hat.

Hinsichtlich der Bundeswehrkrankenhäuser bestätigt das Ministerium die Engpässe, die zu Einschränkungen in der Leistungserbringung führen. Das Ministerium bestätigt auch, dass die zunehmend problematische Besetzungslage die regionalen Sanitätseinrichtungen vor sehr harte Belastungsproben stellt.

Sehr kritisch sehe ich nach wie vor die Behandlung der PTBS-Erkrankten, also posttraumatischen Belastungsstörungen ausgesetzten Soldaten, und hier im Besonderen die Umsetzung der Forderung des Bundestages nach Schaffung eines Traumazentrums, das seinen Namen wirklich verdient. Zu nennen sind hier zudem die personellen Vakanzen bei den Fachärzten für Psychiatrie, die nach meiner Einschätzung nicht durch die Zusammenarbeit mit zivilen Behandlungseinrichtungen ausreichend kompensiert werden können.

Lassen Sie mich ganz aktuell dazu sagen, ohne dass ich öffentlich Geheimnisse preisgebe, dass sich der Verteidigungsausschuss in seiner jüngsten Sitzung sehr ausführlich mit der optimalen Versorgung der PTBS-erkrankten Soldaten beschäftigt hat. Nach meiner unmaßgeblichen Einschätzung sind wir hier auf einem guten Weg. Ich darf mich ganz herzlich für die diesbezügliche Unterstützung bedanken.

Letztes Stichwort Infrastruktur: Es sind zweifellos Fortschritte bei der Sanierung gemacht worden, aber - das bestätigt auch das Ministerium - die Verfahrensabläufe, namentlich die personellen Knappheiten bei den Landesbaubehörden, verhindern das wirklich Notwendige. Hier muss vernünftig zusammengewirkt werden, damit wir insgesamt weiterkommen.

Ich könnte noch viel mehr sagen, auch zum Thema Pendlerunterkünfte, und viele andere Stichpunkte nennen. Ich bitte um Nachsicht, dass das aus Zeitgründen an dieser Stelle nicht möglich ist.

Lassen Sie mich aber abschließend eines sagen: Ich will an dieser Stelle allen Soldatinnen und Soldaten - einige sind heute als Zuhörer anwesend - ganz herzlich für ihren schweren und, wie ich finde, auch sehr anspruchsvollen und gefahrvollen Dienst danken.","Reinhold Robbe, Wehrbeauftragter des Deutschen Bundestages",,data/txt/17025.txt,"Reinhold Robbe, Wehrbeauftragter des Deutschen Bundestages",,speech
60009,25,17,0,672,"Beifall bei der CDU/CSU, der SPD, der FDP und dem BÜNDNIS 90/DIE GRÜNEN",,,data/txt/17025.txt,,,poi
60010,25,17,0,673,"Meine guten Wünsche begleiten alle im Einsatz verwundeten Soldaten. Mein ganz besonderes Mitgefühl gehört den Familien und Kameraden der gefallenen Soldaten sowie der verunglückten oder auf andere Weise ums Leben gekommenen Soldaten und Bundeswehrangehörigen.

Dank sage ich zu guter Letzt auch allen Mitgliedern des Verteidigungsausschusses und dem Bundesminister der Verteidigung, der militärischen und politischen Bundeswehrführung für das vertrauensvolle Zusammenwirken. Nicht zuletzt will ich auch meinen Mitarbeiterinnen und Mitarbeitern ganz herzlich für die ausgezeichnete Unterstützung danken.

Ich darf mich ganz besonders beim Präsidenten dafür bedanken, dass er mir gestattet hat, eine Minute länger zu reden, als ich eigentlich durfte.

Herzlichen Dank.","Reinhold Robbe, Wehrbeauftragter des Deutschen Bundestages",,data/txt/17025.txt,"Reinhold Robbe, Wehrbeauftragter des Deutschen Bundestages",,speech
60011,25,17,0,674,"Beifall bei der CDU/CSU, der SPD, der FDP und dem BÜNDNIS 90/DIE GRÜNEN",,,data/txt/17025.txt,,,poi
60012,25,17,0,675,,"Reinhold Robbe, Wehrbeauftragter des Deutschen Bundestages",,data/txt/17025.txt,"Reinhold Robbe, Wehrbeauftragter des Deutschen Bundestages",,speech
60013,25,17,0,676,"Das war gar nicht meine Absicht, aber ich denke, es ist trotzdem in Ordnung.

Das Wort hat nun Kollegin Anita Schäfer für die CDU/CSU-Fraktion.",Dr. h. c. Wolfgang Thierse,,data/txt/17025.txt,Vizepräsident Dr. h. c. Wolfgang Thierse,,chair
60014,25,17,0,677,Beifall bei der CDU/CSU und der FDP,,,data/txt/17025.txt,,,poi
60015,25,17,0,678,,Dr. h. c. Wolfgang Thierse,,data/txt/17025.txt,Vizepräsident Dr. h. c. Wolfgang Thierse,,chair
60016,25,17,0,679,"Sehr geehrter Herr Präsident! Liebe Kollegen! Sehr geehrter Herr Wehrbeauftragter! Meldungen über Vorkommnisse wie in Mittenwald verdecken in der öffentlichen Wahrnehmung leider etwas den Blick auf die wichtige Alltagsarbeit des Wehrbeauftragten, obwohl letztere viel mehr Soldaten betrifft. Auch 2008 machten Probleme des dienstlichen Umgangs und Personalangelegenheiten erneut einen großen Teil der Eingaben aus, ohne dass die Einzelfälle ein großes mediales Echo erfuhren. Dies hat sich über die bisher 50 Berichte hinweg wenig geändert.

Es geht in diesen Berichten daher zumeist um Dinge, die nicht primär materieller Natur sind. Die Klagen über die materielle Ausstattung der Truppe fallen nach meinem Eindruck gerade in den letzten Jahresberichten geringer aus. Es lassen sich also durchaus positive Trends ablesen. Teilweise haben hier bereits die in der letzten Legislaturperiode eingeleiteten Maßnahmen gegriffen. Es besteht aber noch kein Anlass, sich zurückzulehnen.

Beispielsweise ist der Mangel an geschützten Fahrzeugen in Afghanistan geringer geworden. Derzeit sind dort fast 1 000 geschützte Fahrzeuge im Einsatz. Wenn wir jetzt aber die neue Afghanistan-Strategie der Bundesregierung umsetzen, wenn mehr Soldaten häufiger außerhalb der Feldlager eingesetzt werden, dann muss auch die Ausstattung daran angepasst werden. Wir von der Koalition werden die notwendigen Maßnahmen weiterführen und vollständig umsetzen, sowohl in den entsprechenden Ausschüssen als auch - da bin ich mir ganz sicher - in den Ministerien. Allein in diesem Jahr werden rund 180 neue geschützte Fahrzeuge zulaufen, natürlich auch, um Ausfälle zu ersetzen.

Es nützt übrigens nichts, wenn Löcher gestopft werden und sich dadurch das nächste auftut. Ein Beispiel dafür sind die im Bericht monierten Defizite bei den Übungen mit Handwaffen. Mittlerweile ist gerade die Schießausbildung den Einsatzerfordernissen angepasst worden. Das heißt dann allerdings auch, dass man für ausreichend Munition sorgen muss. Ich bin sicher, dass die Bundesregierung unserem gerade beschlossenen Antrag nachkommen wird, eine angemessene Bevorratung mit Munition und anderen Verbrauchsgütern sicherzustellen.

Das vielleicht am eindringlichsten beschriebene Problemfeld im Jahresbericht 2008 betrifft den Sanitätsdienst. Die dortige schwierige Situation haben bereits die vorhergehenden Berichte immer wieder hervorgehoben. Dabei geht es einerseits um die Personallage und andererseits um die strukturellen Bedingungen dieser Truppengattung, die mit am stärksten durch Einsätze belastet ist. Beide Bereiche sind natürlich miteinander verbunden. Ziel muss sein, den Sanitätsdienst attraktiver und zugleich effektiver zu gestalten.",Anita Schäfer,,data/txt/17025.txt,Anita Schäfer (Saalstadt) (CDU/CSU),cducsu,speech
60017,25,17,0,680,Beifall bei der CDU/CSU sowie bei Abgeordneten der FDP,,,data/txt/17025.txt,,,poi
60018,25,17,0,681,"Es freut mich, dass diese Aufgabe mittlerweile zielgerichtet angegangen wurde. Wir haben bereits einige Maßnahmen eingeleitet. Dazu gehören die Verstärkung der Personalwerbung, die Aufstockung der Zahl der Medizinstudienplätze für die Bundeswehr, eine bessere klinische Ausbildung durch ein Tutoren- und Mentorensystem, die frühere Weiterbildung zum Facharzt und eine größere Flexibilität bei der Stellenbesetzung, wenn Elternzeit in Anspruch genommen wird. Diese größere Flexibilität gilt ebenso für die Gewinnung von Zeitarbeitspersonal und künftig auch für die Teilzeitbeschäftigung.

Wichtig ist zudem die Verbesserung der materiellen Attraktivität im Vergleich zum zivilen Arbeitsmarkt. Die monatliche Stellenzulage von 600 Euro für Fach- und Rettungsmediziner konnte da nur erste Hilfe sein. Wir wollen eine dauerhafte Besserstellung bei den Einkünften, auch für Bereitschaftsdienste und Privatbehandlungen.

Auf der Strukturseite streben wir eine Zentralisierung der Führung der Bundeswehrkrankenhäuser an. Vorhandene Ressourcen müssen effektiv genutzt werden. Das betrifft übrigens nicht nur den Sanitätsdienst. Wir müssen einmal überprüfen, wie sich die Balance zwischen Kopf und Gliedern in der gesamten Bundeswehr in den letzten zehn oder zwölf Jahren entwickelt hat. Deswegen wollen wir schnellstmöglich die im Koalitionsvertrag vereinbarte Strukturkommission einsetzen, damit bereits bis Ende dieses Jahres Eckpunkte einer neuen Organisationsstruktur vorliegen. Wir erwarten mit Interesse die Empfehlungen, die die Kommission hierzu aussprechen wird.

Der Wehrbeauftragte hat eben auf die erneute Steigerung der Zahl der Fälle von Posttraumatischer Belastungsstörung wie auch von anderen einsatzbedingten psychischen Erkrankungen hingewiesen. Im Jahr 2009 hat sich die Zahl der Fälle von PTBS - Posttraumatischer Belastungsstörung - gegenüber dem Berichtsjahr 2008 nochmals erhöht, von 226 auf 418. Dies ist natürlich zum Teil auf den sensibleren Umgang mit der Problematik in der Truppe zurückzuführen, aber auch auf die bessere Aufklärung der Soldaten und ihre erhöhte Behandlungsbereitschaft.

Die Bedeutung von angemessenen Möglichkeiten der Diagnose und Behandlung wurde erkannt. Allerdings befinden sich die entsprechenden Kapazitäten noch im Aufwuchs, sowohl innerhalb der Bundeswehr als auch im Rahmen des Psychosozialen Netzwerkes. Wir brauchen insbesondere eine Institution, in der die Kompetenz zur Behandlung von PTBS auf nationaler Ebene gebündelt wird. Die Einrichtung eines solchen Traumazentrums hat für die Koalition höchste Priorität. Auch dafür muss es natürlich die notwendigen Mittel geben. Ich begrüße es ausdrücklich, dass wir alle gemeinsam am Mittwoch im Verteidigungsausschuss dieses Vorhaben fraktionsübergreifend unterstützt haben. Herzlichen Dank dafür.",Anita Schäfer,,data/txt/17025.txt,Anita Schäfer (Saalstadt) (CDU/CSU),cducsu,speech
60019,25,17,0,682,"Beifall bei der CDU/CSU, der SPD, der FDP und dem BÜNDNIS 90/DIE GRÜNEN",,,data/txt/17025.txt,,,poi
