id,sitzung,wahlperiode,in_writing,sequence,text,speaker_cleaned,speaker_fp,filename,speaker,speaker_party,type
51285,20,17,0,0,"Guten Morgen, liebe Kolleginnen und Kollegen! Die Sitzung ist eröffnet.

Der Ältestenrat hat sich in seiner gestrigen Sitzung darauf verständigt, die Frist für die Einreichung von Fragen für die Fragestunde am Dienstag, dem 9. Februar 2010, auf Donnerstag, den 4. Februar 2010, 10 Uhr, vorzuverlegen. Sind Sie damit einverstanden? - Ich höre keinen Widerspruch. Dann ist das so beschlossen.

Ich rufe die Tagesordnungspunkte 18 a und 18 b auf:

a)	Erste Beratung des von der Bundesregierung eingebrachten Entwurfs eines Gesetzes zur Stabilisierung der Finanzlage der Sozialversicherungssysteme und zur Einführung eines Sonderprogramms mit Maßnahmen für Milchviehhalter sowie zur Änderung anderer Gesetze (Sozialversicherungs-Stabilisierungsgesetz - SozVersStabG)

- Drucksache 17/507 -

Überweisungsvorschlag:

Haushaltsausschuss (f)

Finanzausschuss

Ausschuss für Ernährung, Landwirtschaft und Verbraucherschutz

Ausschuss für Arbeit und Soziales

Ausschuss für Gesundheit

b)	Beratung des Antrags der Fraktion DIE LINKE

Versicherte in der Krise schützen - Finanzsitua-tion der gesetzlichen Krankenversicherung und der Bundesagentur für Arbeit entschärfen

- Drucksache 17/495 -

Überweisungsvorschlag:

Haushaltsausschuss (f)

Finanzausschuss

Ausschuss für Ernährung, Landwirtschaft und Verbraucherschutz

Ausschuss für Arbeit und Soziales

Ausschuss für Gesundheit

Nach einer interfraktionellen Vereinbarung sind für die Aussprache eineinhalb Stunden vorgesehen. - Ich höre dazu keinen Widerspruch. Dann ist das so beschlossen.

Ich eröffne die Aussprache und erteile dem Parlamentarischen Staatssekretär Steffen Kampeter das Wort.",Dr. h. c. Wolfgang Thierse,,data/txt/17020.txt,Vizepräsident Dr. h. c. Wolfgang Thierse,,chair
51286,20,17,0,1,Beifall bei der CDU/CSU sowie bei Abgeordneten der FDP,,,data/txt/17020.txt,,,poi
51287,20,17,0,2,,Dr. h. c. Wolfgang Thierse,,data/txt/17020.txt,Vizepräsident Dr. h. c. Wolfgang Thierse,,chair
51288,20,17,0,3,"Guten Morgen, Herr Präsident! Meine sehr verehrten Damen und Herren! Die soziale Marktwirtschaft als die Wirtschafts- und Gesellschaftsordnung der Bundesrepublik ist keine Schönwetterveranstaltung. Sie hat sich in ihrer mehr als 60-jährigen Geschichte vor allen Dingen bei großen Herausforderungen bewährt. Dabei kam es uns allen zugute, dass unsere Wirtschafts- und Gesellschaftsordnung kein statisches System ist, sondern sich ständig fortentwickelt hat.

Der Wiederaufbau nach dem Zweiten Weltkrieg war die Geburtsstunde und zugleich die erste Bewährungsprobe einer Ordnung, die Freiheit und Verantwortung miteinander verknüpft. Sie hat wesentlich dazu beigetragen, dass viele von dieser Phase als der Zeit des Wirtschaftswunders sprechen. Diese Ordnung hat Staat und Markt so miteinander verknüpft, dass die Verheißung vom „Wohlstand für alle“ sich nicht lediglich für wenige erfüllte.

Die Wiedervereinigung war eine große Bewährungsprobe, aber auch eine Bestätigung für das Konzept der sozialen Marktwirtschaft, in dem Maß und Mitte eine zentrale Rolle spielen. Mit der Wirtschafts-, Währungs- und Sozialunion wurde die soziale Marktwirtschaft als die Ordnung für das gesamte Deutschland fortentwickelt. In einer beispiellosen Solidaritätsaktion wurden die Folgekosten des Sozialismus übernommen und der Grundstein für eine Erfolgsgeschichte der Ideen von Ludwig Erhard, Wilhelm Röpke und Alfred Müller-Armack gelegt.",Steffen Kampeter,,data/txt/17020.txt,"Steffen Kampeter, Parl. Staatssekretär beim Bundesminister der Finanzen",,speech
51289,20,17,0,4,Beifall bei der CDU/CSU und der FDP,,,data/txt/17020.txt,,,poi
51290,20,17,0,5,"Wie zu den Zeiten der beiden ersten großen Herausforderungen unserer Ordnung ist es wiederum eine christlich-liberale Regierung, die die soziale Marktwirtschaft als Maßstab für ihre Handlungen in der Krise nimmt, dieses Mal für die Wiedererlangung von Wachstum und Stabilität nach der weltweit größten Wirtschafts- und Finanzkrise nach dem Zweiten Weltkrieg. Die Rezession ist vorbei; die Gefahr von Rückschlägen kann jedoch nicht ausgeschlossen werden. In jedem Falle sind die Krisenfolgen allerorten noch deutlich spürbar. Dies gilt nicht nur für die Finanzmärkte, die durch eine internationale Aktion stabilisiert wurden; dies gilt auch für die sozialen Sicherungssysteme, die krisenbedingt unter einem erheblichen Stress stehen.

Wir, die christlich-liberale Regierung, wollen die Anpassungslasten in den sozialen Sicherungssystemen nicht ausschließlich den Beitragszahlern aufbürden. In einer sozialen Marktwirtschaft, so wie wir sie verstehen, gilt es jetzt, Beschäftigung und die sozialen Sicherungssysteme in einer gleichwohl ungewöhnlichen Solidaritätsaktion zu stabilisieren. Diesem Ziel, dieser Fortentwicklung der sozialen Marktwirtschaft, dient der heute eingebrachte Gesetzentwurf.",Steffen Kampeter,,data/txt/17020.txt,"Steffen Kampeter, Parl. Staatssekretär beim Bundesminister der Finanzen",,speech
51291,20,17,0,6,Beifall bei der CDU/CSU und der FDP,,,data/txt/17020.txt,,,poi
51292,20,17,0,7,"Wir wollen konjunktur- bzw. krisenbedingte Mindereinnahmen in der Arbeitslosenversicherung und in der gesetzlichen Krankenversicherung mit Steuermitteln auffangen und damit sowohl die Lohnzusatzkosten als auch die Nettoeinkünfte der sozialversicherungspflichtig Beschäftigten stabilisieren. Das heißt, im Bereich der Bundesagentur für Arbeit soll das nach bisheriger Rechtslage im Haushaltsjahr 2010 zu gewährende Darlehen in einen Zuschuss an die Bundesagentur umgewandelt werden.

Der Regierungsentwurf zum Bundeshaushalt 2010 sieht hierfür einen Betrag in Höhe von 16 Milliarden Euro vor. Ausschlaggebend ist: Ohne diesen Zuschuss des Bundes müsste der Beitragssatz zur Arbeitslosenversicherung spürbar erhöht werden. Nur so würde die Bundesagentur für Arbeit in die Lage versetzt werden, das sonst notwendige Darlehen zeitnah zurückzuzahlen. Ich bin sicher, dass Sie meine Meinung teilen: Eine signifikante Erhöhung des Beitragssatzes zur Arbeitslosenversicherung wäre in der gegenwärtigen arbeitsmarkt- und konjunkturpolitischen Lage gelinde gesagt mehr als kontraproduktiv. Sie gilt es zu vermeiden.",Steffen Kampeter,,data/txt/17020.txt,"Steffen Kampeter, Parl. Staatssekretär beim Bundesminister der Finanzen",,speech
51293,20,17,0,8,Beifall bei der CDU/CSU und der FDP,,,data/txt/17020.txt,,,poi
51294,20,17,0,9,Warten wir mal ab!,Joachim Poß,,data/txt/17020.txt,Joachim Poß [SPD],spd,poi
51295,20,17,0,10,"Im Bereich der gesetzlichen Krankenversicherung soll der Gesundheitsfonds im laufenden Jahr einen einmaligen zusätzlichen Zuschuss in Höhe von 3,9 Milliar-den Euro erhalten. Ohne diesen einmaligen Zuschuss zur Kompensation krisenbedingter Einnahmeausfälle im Bereich der gesetzlichen Krankenversicherung würde sich der Druck auf die gesetzlichen Krankenkassen - Stichwort Zusatzbeiträge - noch weiter erhöhen, als es zum gegenwärtigen Zeitpunkt bedauerlicherweise der Fall ist.

Unter Berücksichtigung dieses zusätzlichen Zuschusses erhält der Gesundheitsfonds im laufenden Jahr Zuschüsse aus dem Bundeshaushalt in Höhe von fast 16 Milliarden Euro; das sind rund 5 Prozent der von der Regierung veranschlagten Ausgaben für das Jahr 2010. Nehmen wir die Bereiche Arbeitslosenversicherung und gesetzliche Krankenversicherung zusammen, wird deutlich, dass jeder zehnte Euro dieses Bundeshaushalts für Maßnahmen zur Stabilisierung der Beiträge in den sozialen Sicherungssystemen ausgegeben wird. Das zeigt, wo derzeit der Schwerpunkt unserer Aktivitäten als Reaktion auf die Finanzmarktkrise liegt.",Steffen Kampeter,,data/txt/17020.txt,"Steffen Kampeter, Parl. Staatssekretär beim Bundesminister der Finanzen",,speech
51296,20,17,0,11,Beifall bei der CDU/CSU sowie bei Abgeordneten der FDP,,,data/txt/17020.txt,,,poi
51297,20,17,0,12,"Zur Unterstützung der milcherzeugenden Landwirte schaffen wir einen Ausgleich der konjunkturell bedingt schwierigen Einnahme- bzw. Liquiditätssituation der deutschen Landwirte. Es geht auch darum, im Sinne einer nachhaltigen Entwicklung leistungsfähige Betriebe am Markt zu erhalten. Uns ist es besonders wichtig, die Milchproduktion an sogenannten Grünlandstandorten zu bewahren. Auf Grünland besteht häufig keine Alternative zur Milchproduktion. Gleichzeitig ist Grünland aus ökologischen, aber auch aus landschaftskulturellen Aspekten ein Milcherzeugungsstandort, der in der gegenwärtig schwierigen Situation auch unter konjunkturellen Gesichtspunkten einer besonderen Beachtung bedarf.",Steffen Kampeter,,data/txt/17020.txt,"Steffen Kampeter, Parl. Staatssekretär beim Bundesminister der Finanzen",,speech
51298,20,17,0,13,Beifall bei Abgeordneten der CDU/CSU und der FDP,,,data/txt/17020.txt,,,poi
51299,20,17,0,14,"Neben dem Grünlandmilchprogramm, dessen wesentlicher Bestandteil das Milchsonderprogramm ist und für das der Bund im laufenden Jahr ungefähr 300 Millionen Euro aufbringt, wird der Bereich Landwirtschaft mit weiteren Maßnahmen unterstützt. Wir stabilisieren durch einen Zuschuss die landwirtschaftliche Unfallversicherung. Zudem gibt es Liquiditätshilfen für Landwirte. Im Jahr 2010 sind für die Landwirtschaft insgesamt 425 Millionen Euro zusätzlich vorgesehen. Es bleibt bei unserer Festlegung, die wir im Koalitionsvertrag getroffen haben: Wir werden den Bereich der Landwirtschaft in diesem und im kommenden Jahr auf Initiative der Bundeslandwirtschaftsministerin Ilse Aigner mit insgesamt 750 Millionen Euro zusätzlich unterstützen.",Steffen Kampeter,,data/txt/17020.txt,"Steffen Kampeter, Parl. Staatssekretär beim Bundesminister der Finanzen",,speech
51300,20,17,0,15,Beifall bei der CDU/CSU und der FDP,,,data/txt/17020.txt,,,poi
51301,20,17,0,16,"Neben diesen drei finanziellen Unterstützungsmaßnahmen enthält der Entwurf dieses Gesetzes auch Änderungen im Bereich der Arbeitsmarktpolitik; denn soziale Marktwirtschaft bedeutet auch, in dieser Krisensituation die Lebensleistung der Menschen zu berücksichtigen. Konkret: Wir verdreifachen das Schonvermögen für Langzeitarbeitslose von 250 auf 750 Euro pro Lebensjahr.",Steffen Kampeter,,data/txt/17020.txt,"Steffen Kampeter, Parl. Staatssekretär beim Bundesminister der Finanzen",,speech
51302,20,17,0,17,Beifall bei der CDU/CSU und der FDP,,,data/txt/17020.txt,,,poi
51303,20,17,0,18,"Die Menschen, die infolge der Finanz- und Wirtschaftskrise ihre Arbeit verlieren, sollen nicht gezwungen sein, ihre private Altersvorsorge aufzulösen, um damit ihren Lebensunterhalt zu finanzieren, und dies im schlimmsten Fall mit der möglichen Folge, dass sie im Alter unterstützungsbedürftig werden. Demgegenüber erfordert die von uns vorgeschlagene gerechtere Vermögensanrechnung mehr Eigenverantwortung. Sie ist ein wichtiger Beitrag zur Vermeidung von Altersarmut. Sie stärkt in allen Bevölkerungsgruppen die Anreize, für das Alter vorzusorgen. Sie ist gelebte soziale Marktwirtschaft, so wie sie die christlich-liberale Koalition versteht.",Steffen Kampeter,,data/txt/17020.txt,"Steffen Kampeter, Parl. Staatssekretär beim Bundesminister der Finanzen",,speech
51304,20,17,0,19,Beifall bei der CDU/CSU und der FDP,,,data/txt/17020.txt,,,poi
51305,20,17,0,20,"Bundesminister Schäuble hat bereits in der vergangenen Haushaltswoche bekräftigt: Der Bundeshaushalt 2010 ist ein wichtiger und zentraler Meilenstein zur Überwindung der Finanz- und Wirtschaftskrise. Wir schreiben die Konjunkturpakete I und II und das Bürgerentlastungsgesetz fort, und wir entwickeln das Sofortprogramm der christlich-liberalen Koalition weiter. Aber erst mit dem Inkrafttreten des heute vorgelegten Entwurfs des Sozialversicherungs-Stabilisierungsgesetzes können die Maßnahmen tatsächlich umgesetzt werden. Der Bundeshaushalt auf der einen und dieses Gesetz auf der anderen Seite sind eng miteinander verzahnt.

Beide tragen dazu bei, dass die Lasten bei der Bewältigung der großen Finanz- und Wirtschaftskrise nicht einseitig und ungerecht verteilt werden.

Zulasten der öffentlichen Haushalte haben wir das Überleben des Finanzsektors unseres Landes gesichert. Jetzt wollen wir der Gesamtheit der Beitragszahler zu den sozialen Sicherungssystemen in einer entsprechenden Weise Teile der Lasten abnehmen. Das ist die Zielsetzung dieses Gesetzesvorhabens.

So richtig und wichtig es ist, in der gegenwärtigen Krise zu stabilisieren, so richtig und wichtig ist es auch, auf eine konsistente und geordnete Strategie für den Ausstieg aus den staatlichen Stabilisierungsmaßnahmen zu achten und diese - das haben wir angekündigt - entschieden durchzusetzen. Das heißt auch: Wir müssen uns jetzt mit Bedacht mit den Strukturen des Bundeshaushaltes und mit den Strukturen unserer sozialen Sicherungssysteme beschäftigen. Wir müssen gerade im Hinblick auf die neue Schuldenregel im Grundgesetz ganz genau hinschauen: Wo gibt es Ineffizienzen? Was können wir besser machen? Wo besteht über dieses Gesetz hinaus ordnungspolitischer Handlungsbedarf?

Dabei ist für uns die soziale Marktwirtschaft im 21. Jahrhundert Maßstab des Handelns zur Wiedererlangung von Wachstum und Stabilität.

Das bedeutet für diese Bundesregierung: Wir lassen die Menschen nicht im Stich. Konsolidierung und Gerechtigkeit sind kein Widerspruch, nein, sie bedingen einander. Auf unsere Wirtschaftsordnung, die sich in der Krise so handlungs- und reaktionsfähig zeigt, sollten wir stolz sein. In diesem Sinne werbe ich um die Zustimmung zu diesem Gesetz.",Steffen Kampeter,,data/txt/17020.txt,"Steffen Kampeter, Parl. Staatssekretär beim Bundesminister der Finanzen",,speech
51306,20,17,0,21,Beifall bei der CDU/CSU und der FDP,,,data/txt/17020.txt,,,poi
51307,20,17,0,22,,Steffen Kampeter,,data/txt/17020.txt,"Steffen Kampeter, Parl. Staatssekretär beim Bundesminister der Finanzen",,speech
51308,20,17,0,23,Das Wort hat nun Bettina Hagedorn für die SPD-Fraktion.,Dr. h. c. Wolfgang Thierse,,data/txt/17020.txt,Vizepräsident Dr. h. c. Wolfgang Thierse,,chair
51309,20,17,0,24,Beifall bei der SPD,,,data/txt/17020.txt,,,poi
51310,20,17,0,25,,Dr. h. c. Wolfgang Thierse,,data/txt/17020.txt,Vizepräsident Dr. h. c. Wolfgang Thierse,,chair
51311,20,17,0,26,"Verehrter Präsident! Liebe Kolleginnen! Liebe Kollegen! Herr Kollege Kampeter, ich bin Ihnen eigentlich sehr dankbar dafür, dass Sie gerade darauf hingewiesen haben, dass zwischen diesem Gesetzentwurf und dem Entwurf für den Bundeshaushalt 2010, über den wir hier vor einer Woche diskutiert haben, eine enge Verzahnung besteht. Allerdings meine ich das ganz anders, als Sie das gerade suggeriert haben.

Es ist nämlich so: Wenn man sich den Regierungsentwurf für den Bundeshaushalt 2010 genau anschaut, dann könnte man zu der Erkenntnis kommen, dass sich in diesem Gesetz ein Zuschuss der Steuerzahler an verschiedene Gruppen der Gesellschaft, vor allen Dingen aber an die BA und den Gesundheitsfonds von 20,6 Milliarden Euro verbirgt. Das ist aber nicht so. Um das zu erkennen, muss man das Kleingedruckte in diesem Gesetzentwurf lesen. In Wahrheit werden wir am Ende dieses Haushaltsjahres gemeinsam feststellen, dass es ungefähr, wenn überhaupt, 14 Milliarden Euro sein werden. Die 6 Milliarden Euro Differenz, die dazwischenliegen, werden nur bei einem Träger eingespart, so werden Sie es jedenfalls nennen - Sie werden von „Einsparungen“ reden -, und das wird die Bundesagentur für Arbeit sein. Wenn irgendeiner von den Kollegen hier das nicht so ganz nachvollziehen kann, bin ich gerne bereit, ihm das auf Nachfrage näher zu erläutern.",Bettina Hagedorn,,data/txt/17020.txt,Bettina Hagedorn (SPD),spd,speech
51312,20,17,0,27,Beifall bei Abgeordneten der SPD,,,data/txt/17020.txt,,,poi
51313,20,17,0,28,Machen Sie mal!,Dr. Heinrich L. Kolb,,data/txt/17020.txt,Dr. Heinrich L. Kolb [FDP],fdp,poi
51314,20,17,0,29,Machen Sie mal!,Georg Schirmbeck,,data/txt/17020.txt,Georg Schirmbeck [CDU/CSU],cducsu,poi
51315,20,17,0,30,"Wir reden heute über den Entwurf eines Gesetzes mit dem prägnanten, aber leicht irreführenden Titel „Sozialversicherungs-Stabilisierungsgesetz“. Die Gesetzesbegründung gibt vor, die in der Wirtschaftskrise notleidenden sozialen Sicherungssysteme bei Arbeitslosigkeit und Krankheit jeweils mit einem einmaligen Steuerzuschuss absichern zu wollen - ich sprach schon davon: 20 Milliarden Euro sollen es laut Haushaltsentwurf der Regierung sein -, um Beitragserhöhungen mitten in der Krise zu vermeiden und die Lohnnebenkosten stabil zu halten. Ein prinzipiell guter und richtiger Gedanke, dem sich auch die SPD prinzipiell sofort anschließen kann.

Aber Achtung: Nur weil jemand einen richtigen Gedanken zu haben vorgibt oder ein richtiges Ziel wie eine Monstranz vor sich herträgt, will er noch lange nicht die richtigen Instrumente gesetzlich festlegen, um dieses Ziel auch tatsächlich zu erreichen.",Bettina Hagedorn,,data/txt/17020.txt,Bettina Hagedorn (SPD),spd,speech
51316,20,17,0,31,Beifall bei der SPD,,,data/txt/17020.txt,,,poi
51317,20,17,0,32,"Mit den Namen von Gesetzen ist es bei dieser schwarz-gelben Koalition ja so eine Sache, wie wir schon in den ersten Regierungsmonaten lernen mussten. Auf der Verpackung steht manchmal etwas ganz anderes, als drin ist.",Bettina Hagedorn,,data/txt/17020.txt,Bettina Hagedorn (SPD),spd,speech
51318,20,17,0,33,Beifall bei der SPD,,,data/txt/17020.txt,,,poi
51319,20,17,0,34,"Gemeinhin ist dieser Tatbestand als Etikettenschwindel bekannt. Das war schon beim Wachstumsbeschleunigungsgesetz so,",Bettina Hagedorn,,data/txt/17020.txt,Bettina Hagedorn (SPD),spd,speech
51320,20,17,0,35,Sehr gutes Gesetz!,Johannes Singhammer,,data/txt/17020.txt,Johannes Singhammer [CDU/CSU],cducsu,poi
51321,20,17,0,36,"von dem alle Sachverständigen der Republik übereinstimmend sagen, dass es weder zu wirtschaftlichem Wachstum führt noch dieses etwa beschleunigt.",Bettina Hagedorn,,data/txt/17020.txt,Bettina Hagedorn (SPD),spd,speech
51322,20,17,0,37,Beifall bei Abgeordneten der SPD,,,data/txt/17020.txt,,,poi
51323,20,17,0,38,Nach vier Wochen?,von der FDP,,data/txt/17020.txt,Zuruf von der FDP,fdp,poi
51324,20,17,0,39,Schuldenbeschleunigungsgesetz oder Hotelierfördergesetz wären zutreffendere Namen.,Bettina Hagedorn,,data/txt/17020.txt,Bettina Hagedorn (SPD),spd,speech
51325,20,17,0,40,Beifall bei der SPD,,,data/txt/17020.txt,,,poi
51326,20,17,0,41,Jetzt muss was zu der Spendenpraxis kommen! Das gehört zusammen!,Georg Schirmbeck,,data/txt/17020.txt,Georg Schirmbeck [CDU/CSU],cducsu,poi
51327,20,17,0,42,"Wie dem auch sei, wer keinem Etikettenschwindel aufsitzen will, der ist gut beraten, sich den Inhalt kritisch anzuschauen und auch das Kleingedruckte zu lesen.

Was also steckt im sogenannten Sozialversicherungs-Stabilisierungsgesetz? Es steckt ein ganzer Bauchladen drin, ein Maßnahmebündel, das teilweise gut und richtig ist",Bettina Hagedorn,,data/txt/17020.txt,Bettina Hagedorn (SPD),spd,speech
51328,20,17,0,43,Immerhin! Stimmt alles!,Johannes Singhammer,,data/txt/17020.txt,Johannes Singhammer [CDU/CSU],cducsu,poi
51329,20,17,0,44,"und teilweise in die falsche Richtung geht. Da ist zunächst das Sonderprogramm für Milchviehhalter in Höhe von knapp 200 Millionen Euro pro Jahr. Da sind die Gründland- und die Kuhprämie, für die im Gesetzentwurf minutiös 54 Rinderarten aufgelistet sind. Das ist sicherlich weder ein Beitrag zum Bürokratieabbau à la FDP noch einer zur Stabilisierung der sozialen Sicherungssysteme.",Bettina Hagedorn,,data/txt/17020.txt,Bettina Hagedorn (SPD),spd,speech
51330,20,17,0,45,Beifall bei der SPD,,,data/txt/17020.txt,,,poi
51331,20,17,0,46,Aber für gesunde Kühe!,Norbert Barthle,,data/txt/17020.txt,Norbert Barthle [CDU/ CSU],cducsu,poi
51332,20,17,0,47,"Mein Kollege Wilhelm Priesmeier wird noch im Detail darauf eingehen.

Als weitere Maßnahme sieht der Gesetzentwurf die Verdreifachung des sogenannten Schonvermögens vor, das Menschen, die Arbeitslosengeld II beziehen, zur Vorsorge für das Alter absichern soll. Dieser Maßnahme stimmt die SPD mit ganzem Herzen zu. Schade ist nur, liebe Kollegen der CDU/CSU, dass Sie solche vernünftigen sozialen Maßnahmen, solange wir gemeinsam regiert haben, stets blockierten und erst jetzt auf solche vernünftigen Vorschläge kommen.",Bettina Hagedorn,,data/txt/17020.txt,Bettina Hagedorn (SPD),spd,speech
51333,20,17,0,48,Beifall bei der SPD,,,data/txt/17020.txt,,,poi
51334,20,17,0,49,Wer war das?,Dr. Heinrich L. Kolb,,data/txt/17020.txt,Dr. Heinrich L. Kolb [FDP],fdp,poi
51335,20,17,0,50,"Das könnte mit dem sozialeren Teil Ihrer Partei und mit bevorstehenden Wahlen in NRW zu tun haben. Ein Schelm, der Böses dabei denkt! Wie dem auch sei, mit dieser Maßnahme helfen wir zu Recht einer Bevölkerungsgruppe. Leider ist dies nur eine sehr kleine; denn nach Zahlen der Bundesagentur für Arbeit aus dem dritten Quartal 2009 können nur 0,2 Prozent der Antragsteller auf Arbeitslosengeld II von dieser Regelung profitieren. Immerhin, für diejenigen, die jahrzehntelang gearbeitet, gespart oder geerbt haben und jetzt gerade in der Krise - entgegen der Unterstellung von Ministerpräsident Koch meist trotz großer Bemühungen um einen neuen Arbeitsplatz - ohne Chance auf einen Job bleiben,",Bettina Hagedorn,,data/txt/17020.txt,Bettina Hagedorn (SPD),spd,speech
51336,20,17,0,51,Das kostet den Steuerzahler Jahr für Jahr Millionen!,Norbert Barthle,,data/txt/17020.txt,Norbert Barthle [CDU/CSU],cducsu,poi
51337,20,17,0,52,"ist es tröstlich und gerecht, dass ihnen dieser stattliche Betrag zur zusätzlichen Altersvorsorge bleibt.",Bettina Hagedorn,,data/txt/17020.txt,Bettina Hagedorn (SPD),spd,speech
51338,20,17,0,53,Beifall bei der SPD,,,data/txt/17020.txt,,,poi
51339,20,17,0,54,"Wenn jemand recht hat, dann ist das der Koch!",Georg Schirmbeck,,data/txt/17020.txt,Georg Schirmbeck [CDU/CSU],cducsu,poi
51340,20,17,0,55,"Ferner sieht dieser Gesetzentwurf einen steuerfinanzierten einmaligen Zuschuss an die gesetzliche Krankenversicherung von 3,9 Milliarden Euro vor. Auch das ist eine grundsätzlich positive und richtige Maßnahme. Allerdings bleibt die Frage, warum in diesem Gesetzentwurf krisenbedingte Einnahmeausfälle im Bereich Gesundheit in Höhe von 3,9 Milliarden Euro genannt werden und bei der Bundesagentur für Arbeit der komplett gleiche Sachverhalt nicht mit einer klaren Zahl wie im Haushaltsentwurf, nämlich 16 Milliarden Euro, beschrieben wird, sondern mit einer ausgesprochen komplizierten Formulierung. Dies wird automatisch dazu führen, dass die Bundesagentur für Arbeit bis Ende dieses Jahres ihre momentane Rücklage von 3 Milliarden Euro komplett plündern muss. Denn uns wurden niedrigere Arbeitslosenzahlen prognostiziert; dies wurde uns im Jahreswirtschaftsbericht diese Woche gezeigt.",Bettina Hagedorn,,data/txt/17020.txt,Bettina Hagedorn (SPD),spd,speech
51341,20,17,0,56,Hört! Hört!,Joachim Poß,,data/txt/17020.txt,Joachim Poß [SPD],spd,poi
51342,20,17,0,57,Nachhaltigkeit!,Elke Ferner,,data/txt/17020.txt,Elke Ferner [SPD],spd,poi
51343,20,17,0,58,"Wenn man das zugrunde legt, dann kommen wir auf einen steuerfinanzierten Zuschuss an die BA nicht von 16 Milliarden Euro, wie Sie uns glauben machen wollen, sondern von ungefähr 10 Milliarden Euro.

(Georg Schirmbeck (CDU/CSU): Das ist doch etwas Schönes! Oder wollen wir das bedauern?

Dass die Bundesagentur für Arbeit durch dieses Gesetz gezwungen wird, ihre Rücklagen auf null zu schrauben, eröffnet ihr ganz schwierige Perspektiven für die Jahre ab 2011. Es ist zu vermuten, dass diese Koalition das so will. Wenn die Bundesagentur für Arbeit in schwierige Zeiten kommt, lässt dies Übles befürchten hinsichtlich einer möglichen Anhebung des Arbeitslosenversicherungsbeitrages ab 2011. In dieser Koalition wird die BA als Steinbruch benutzt. Dafür kommt nur ein Titel der Bundesagentur für Arbeit infrage: Das ist der Eingliederungstitel. Beim Eingliederungstitel geht es um nichts anderes als aktive Arbeitsmarktpolitik. Es ist in der Finanz- und Wirtschaftskrise und angesichts des drohenden Fachkräftemangels genau das falsche Signal, der BA die Möglichkeit zu nehmen, Instrumente einzusetzen, um die Arbeitslosigkeit zu vermeiden.",Bettina Hagedorn,,data/txt/17020.txt,Bettina Hagedorn (SPD),spd,speech
51344,20,17,0,59,Beifall bei Abgeordneten der SPD,,,data/txt/17020.txt,,,poi
51345,20,17,0,60,Den Arbeitslosenversicherungsbeitrag haben wir in der Großen Koalition gemeinsam gesenkt.,Bettina Hagedorn,,data/txt/17020.txt,Bettina Hagedorn (SPD),spd,speech
51346,20,17,0,61,Gegen den Widerstand der SPD!,Norbert Barthle,,data/txt/17020.txt,Norbert Barthle [CDU/CSU],cducsu,poi
51347,20,17,0,62,"Es war durchaus das Ziel unserer gemeinsamen Bemühungen, den Arbeitslosenversicherungsbeitrag von 6,5 Pro-zent auf aktuell 2,8 Prozent zu senken. Dadurch sind Arbeitnehmer und Arbeitgeber in den letzten Jahren um 70 Milliarden Euro entlastet worden.",Bettina Hagedorn,,data/txt/17020.txt,Bettina Hagedorn (SPD),spd,speech
51348,20,17,0,63,Das war richtig!,Georg Schirmbeck,,data/txt/17020.txt,Georg Schirmbeck [CDU/CSU],cducsu,poi
51349,20,17,0,64,"Diese 70 Milliarden Euro haben dann aber logischerweise der Bundesagentur für Arbeit gefehlt.

Wenn Sie nicht ab 2011 wieder einen angemessenen Arbeitslosenversicherungsbeitrag erheben oder Steuerzuschüsse über 2011 hinaus gewähren, werden Sie - das wollen Sie offensichtlich - die aktive Arbeitsmarktpolitik der Bundesagentur für Arbeit an die Wand fahren.",Bettina Hagedorn,,data/txt/17020.txt,Bettina Hagedorn (SPD),spd,speech
51350,20,17,0,65,Beifall bei der SPD,,,data/txt/17020.txt,,,poi
51351,20,17,0,66,Was schlagen Sie vor?,von der CDU/ CSU,,data/txt/17020.txt,Zuruf von der CDU/ CSU,cducsu,poi
