id,sitzung,wahlperiode,in_writing,sequence,text,speaker_cleaned,speaker_fp,filename,speaker,speaker_party,type
85233,38,17,0,865,"Frau Nahles, es ist richtig: Bei uns, der christlich-liberalen Koalition, steht der Mensch im Mittelpunkt der Politik. Zur Würde eines Menschen gehört, dass er Arbeit hat, dass er einen Platz in der Gesellschaft hat und Anerkennung findet. Wir nehmen dies sehr ernst. Deshalb gilt für uns - auch wenn Sie das nicht gerne hören -: Sozial ist, was Arbeit schafft.",Lucia Puttrich,,data/txt/17038.txt,Lucia Puttrich (CDU/CSU),cducsu,speech
85234,38,17,0,866,Beifall bei der CDU/CSU,,,data/txt/17038.txt,,,poi
85235,38,17,0,867,"Unsozial ist, was Arbeitsplätze vernichtet. Ihr gesetzlicher Mindestlohn würde Arbeitsplätze vernichten.

Die Union ist die Partei der sozialen Marktwirtschaft mit christlichem Leitbild.",Lucia Puttrich,,data/txt/17038.txt,Lucia Puttrich (CDU/CSU),cducsu,speech
85236,38,17,0,868,"Beim christlichen Leitbild sehen wir ja gerade, was mit dem passiert!",Ute Kumpf,,data/txt/17038.txt,Ute Kumpf [SPD],spd,poi
85237,38,17,0,869,"Wir stehen für die Kombination des freien Marktes mit dem sozialen Ausgleich. Deshalb bilden Freiheit und Verantwortung für uns ein unauflösbares Begriffspaar. Zwar ist es die Aufgabe des Staates, den Rahmen für einen funktionierenden Markt bzw. Wettbewerb zu schaffen. Aber wir wollen nicht den allmächtigen Staat. Wir meinen nicht, dass der Staat alles regeln muss, dass er das regeln sollte, was andere viel besser können, in diesem Fall die Sozialpartner.",Lucia Puttrich,,data/txt/17038.txt,Lucia Puttrich (CDU/CSU),cducsu,speech
85238,38,17,0,870,Beifall bei Abgeordneten der CDU/CSU,,,data/txt/17038.txt,,,poi
85239,38,17,0,871,"Blickt man auf 60 Jahre Bundesrepublik zurück, dann kann man nur sagen, dass die soziale Marktwirtschaft ein ausgesprochen erfolgreiches Modell ist. Sie aber entmündigen Gewerkschaften und Arbeitgeber. Sie verabschieden sich von der verfassungsrechtlich garantierten Tarifautonomie. Deshalb kann ich nur sagen: Wenn Sie Mindestlöhne in die Hände von Kommissionen geben wollen und wenn Sie sogar tarifliche Vereinbarungen unwirksam machen und durch Mindestlöhne ersetzen wollen, dann trauen Sie offensichtlich den Tarifpartnern nicht mehr zu, im Interesse der Arbeitnehmerinnen und Arbeitnehmer zu verhandeln. Meinen Sie ernsthaft, dass verordnete Löhne mehr Arbeitsplätze schaffen als tariflich ausgehandelte? Mit Ihren Forderungen suggerieren Sie den Menschen, Probleme zu lösen. Wenn Sie aber ernsthaft glauben, dass das funktioniert, dann sind Zweifel an Ihrem wirtschaftspolitischen Sachverstand durchaus angebracht.",Lucia Puttrich,,data/txt/17038.txt,Lucia Puttrich (CDU/CSU),cducsu,speech
85240,38,17,0,872,Beifall bei der CDU/CSU und der FDP,,,data/txt/17038.txt,,,poi
85241,38,17,0,873,"Lassen Sie mich zum Schluss kommen. Mit gesetzlichen Mindestlöhnen setzen Sie Arbeitsplätze aufs Spiel. Sie grenzen Geringqualifizierte vom Arbeitsmarkt aus und - das ist sehr ernst zu nehmen - erhöhen das Risiko der Jugendarbeitslosigkeit. Sie verlassen mit Ihren Forderungen den Boden des Erfolgsmodells der sozialen Marktwirtschaft, das Grundlage für Freiheit und Wohlstand ist. Der Staat setzt fest, der Staat lenkt, und der Staat denkt - dies scheint Ihr ordnungspolitischer Ansatz zu sein. Unserer ist es nicht. Deshalb lehnen wir den Antrag ab.",Lucia Puttrich,,data/txt/17038.txt,Lucia Puttrich (CDU/CSU),cducsu,speech
85242,38,17,0,874,Beifall bei der CDU/CSU und der FDP,,,data/txt/17038.txt,,,poi
85243,38,17,0,875,,Lucia Puttrich,,data/txt/17038.txt,Lucia Puttrich (CDU/CSU),cducsu,speech
85244,38,17,0,876,"Ich schließe die Aussprache.

Interfraktionell wird Überweisung der Vorlage auf Drucksache 17/1408 an die in der Tagesordnung aufgeführten Ausschüsse vorgeschlagen. Sind Sie damit einverstanden? - Das ist der Fall. Dann ist die Überweisung so beschlossen.

Ich rufe die Tagesordnungspunkte 26 a und 26 b auf:

b)	Beratung des Antrags der Abgeordneten Ulla Lötzer, Dr. Barbara Höll, Eva Bulling-Schröter weiterer Abgeordneter und der Fraktion DIE LINKE

Opel - Zukunftsfähige Arbeitsplätze statt Standortwettlauf

- Drucksache 17/1404 -

Überweisungsvorschlag:

Ausschuss für Wirtschaft und Technologie (f)

Ausschuss für Ernährung, Landwirtschaft und Verbraucherschutz

a)	Beratung der Beschlussempfehlung und des Berichts des Ausschusses für Wirtschaft und Technologie (9. Ausschuss)

-	zu dem Antrag der Abgeordneten Garrelt Duin, Hubertus Heil (Peine), Doris Barnett, weiterer Abgeordneter und der Fraktion der SPD

Für eine Politik der wirtschaftlichen Vernunft - Nachhaltiges Wachstum und mehr Beschäftigung schaffen

-	zu dem Antrag der Abgeordneten Ulla Lötzer, Dr. Barbara Höll, Matthias W. Birkwald, weiterer Abgeordneter und der Fraktion DIE LINKE

Zukunftsprogramm für 2 Millionen Arbeitsplätze

- Drucksachen 17/521, 17/470, 17/873 -

Berichterstattung:

Abgeordneter Dr. Joachim Pfeiffer

Nach einer interfraktionellen Vereinbarung ist für die Aussprache eine halbe Stunde vorgesehen. - Ich höre keinen Widerspruch. Dann ist so beschlossen.

Ich eröffne die Aussprache. Das Wort hat die Kollegin Ulla Lötzer für die Fraktion Die Linke.",Petra Pau,,data/txt/17038.txt,Vizepräsidentin Petra Pau,,chair
85245,38,17,0,877,Beifall bei der LINKEN,,,data/txt/17038.txt,,,poi
85246,38,17,0,878,,Petra Pau,,data/txt/17038.txt,Vizepräsidentin Petra Pau,,chair
85247,38,17,0,879,"Frau Präsidentin! Kolleginnen und Kollegen! Der Name Brüderle steht nicht erst seit heute für eine Wirtschaftspolitik des Nichtstuns für Arbeitsplätze, Wachstum und Erneuerung. Alle - von IWF bis OECD - haben erst diese Woche wieder Maßnahmen zur Stärkung des Binnenmarktes gefordert. Sie tun nichts. In unserem Antrag zum Zukunftsprogramm finden Sie Alternativen: 2 Millionen Arbeitsplätze durch öffentliche Investitionen in Bildung und ökologische Erneuerung, mehr Beschäftigte im öffentlichen Dienst, in Krankenhäusern, in der Pflege, in Schulen und Kindergärten sowie unsere Vorschläge für eine aktive Industriepolitik.",Ulla Lötzer,,data/txt/17038.txt,Ulla Lötzer (DIE LINKE),linke,speech
85248,38,17,0,880,Beifall bei der LINKEN,,,data/txt/17038.txt,,,poi
85249,38,17,0,881,"Trotz Kurzarbeit wurden in der Industrie im letzten Jahr 242 000 Arbeitsplätze abgebaut. 200 000 Arbeitsplätze sollen nach Aussagen der Industrieverbände in diesem Jahr gestrichen werden. Herr Brüderle fabuliert von einem sich selbsttragenden Aufschwung und vom Ende der Krise. Ein Beispiel für Ihre verheerende Politik ist Opel. Millionen hat die alte Regierung als Überbrückungskredit vergeben und dabei auf Mitspracherechte verzichtet. Nachdem GM mithilfe der Steuergelder wieder obenauf ist, vergießen Sie jetzt Krokodilstränen, weil das Unternehmen nicht macht, was die Regierung gern möchte. Da Sie keine europäische Abstimmung herbeiführen, lassen Sie sich von GM-Manager Reilly am Nasenring durch die Arena ziehen. Im Wochenrhythmus werden von GM Produktionszusagen für das Elektroauto mal dem und mal jenem in Aussicht gestellt und dann widerrufen.

Natürlich ist es richtig, von General Motors Antworten zur Finanzierung und zur Frage der Patente zu verlangen. Aber die entscheidenden Fragen stellen Sie bis heute nicht: Wie sollen die Arbeitsplätze und die Standorte erhalten werden? Wie soll angesichts der Überproduktion von Automobilen die Zukunft der Arbeitsplätze langfristig gesichert werden? Statt ein industriepolitisches Konzept vorzulegen, fordern Sie von den Beschäftigten den Verzicht auf tarifliche Leistungen in Höhe von 120 Millionen Euro allein in Deutschland. Das ist keine Innovation, sondern eine Fortsetzung der Politik des Tarif- und Lohndumpings in der Automobilindustrie.",Ulla Lötzer,,data/txt/17038.txt,Ulla Lötzer (DIE LINKE),linke,speech
85250,38,17,0,882,Beifall bei der LINKEN,,,data/txt/17038.txt,,,poi
85251,38,17,0,883,"Das ist ein Skandal, aber kein Ausweg aus der Krise. Wir sagen Ja zu öffentlichen Mitteln, aber nur gegen Beschäftigungssicherung und Standorterhalt, gegen Beteiligung und Mitsprachrechte der Belegschaften. Wir wollen einen Beirat, der zukunftsfähige Produkte und Produktfelder für die Automobilindustrie entwickelt und die öffentlichen Gelder bei Opel dafür einsetzt, diesen Umbau voranzubringen.",Ulla Lötzer,,data/txt/17038.txt,Ulla Lötzer (DIE LINKE),linke,speech
85252,38,17,0,884,Beifall bei der LINKEN,,,data/txt/17038.txt,,,poi
85253,38,17,0,885,"Ein weiteres Beispiel für Ihr Nichtstun: Im Stahlbereich sollen die Preise um über 100 Prozent steigen. Der Grund: Rohstoffspekulation und ein Machtkartell. 13 000 Stahlarbeiter haben gestern in Duisburg und Brüssel dagegen demonstriert. Wie ist Ihre Antwort? Sie überlassen die Zukunft den Zockern im Kasino. Die Rohstoffspekulation kann und muss endlich verboten werden. Auch in der Stahlindustrie muss mit aktiver Industriepolitik der Einsatz von Rohstoffen und Stahlrecycling gefördert werden. Dazu braucht es keine Gespräche mit Stahlunternehmen, die Herr Brüderle heute Morgen als Lösung angeboten hat. Vielmehr muss die Regierung endlich handeln und darf nicht nur schwätzen.",Ulla Lötzer,,data/txt/17038.txt,Ulla Lötzer (DIE LINKE),linke,speech
85254,38,17,0,886,Beifall bei der LINKEN,,,data/txt/17038.txt,,,poi
85255,38,17,0,887,"Ihre Wirtschaftspolitik des Nachtwächterstaates, des Marktradikalismus und der Lobbypflege bei Hoteliers und Großindustriellen haben die Menschen bei Opel, bei Thyssen, in der Zuliefererindustrie und anderswo nicht verdient. Für NRW gibt es am 9. Mai eine Chance auf Veränderung. Ich glaube, die Menschen werden sie massenhaft ergreifen.

Ich danke für die Aufmerksamkeit.",Ulla Lötzer,,data/txt/17038.txt,Ulla Lötzer (DIE LINKE),linke,speech
85256,38,17,0,888,Beifall bei der LINKEN,,,data/txt/17038.txt,,,poi
85257,38,17,0,889,,Ulla Lötzer,,data/txt/17038.txt,Ulla Lötzer (DIE LINKE),linke,speech
85258,38,17,0,890,Das Wort hat der Kollege Ernst Hinsken für die Unionsfraktion.,Petra Pau,,data/txt/17038.txt,Vizepräsidentin Petra Pau,,chair
85259,38,17,0,891,Beifall bei der CDU/CSU,,,data/txt/17038.txt,,,poi
85260,38,17,0,892,,Petra Pau,,data/txt/17038.txt,Vizepräsidentin Petra Pau,,chair
85261,38,17,0,893,"Werte Frau Präsidentin! Liebe Kolleginnen und Kollegen! Dieser Tagesordnungspunkt ist praktisch eine Fortsetzung der Regierungserklärung von heute Morgen. Wir können die Möglichkeit nutzen, uns auszutauschen und der Öffentlichkeit darzulegen, wie wir die anstehenden Probleme zum gegenwärtigen Zeitpunkt und in Zukunft bewältigen können. Eines will ich Ihnen vorweg sagen, Frau Lötzer: Es steht unbestritten fest, dass kaum ein anderes Land die Wirtschafts- und Finanzkrise besser gemeistert hat als die Bundesrepublik Deutschland.",Ernst Hinsken,,data/txt/17038.txt,Ernst Hinsken (CDU/CSU),cducsu,speech
85262,38,17,0,894,Beifall bei der CDU/CSU und der FDP,,,data/txt/17038.txt,,,poi
85263,38,17,0,895,"Ja, es stimmt: Die Sozialdemokraten haben einen entscheidenden Anteil daran, weil im vergangenen Jahr diesbezüglich einige Beschlüsse gefasst worden sind.",Ernst Hinsken,,data/txt/17038.txt,Ernst Hinsken (CDU/CSU),cducsu,speech
85264,38,17,0,896,"Ich glaube, Sie sind heute der Erste, der das sagt!",Garrelt Duin,,data/txt/17038.txt,Garrelt Duin [SPD],spd,poi
85265,38,17,0,897,"Schließlich wurden einige Weichenstellungen schon von der Großen Koalition vorgenommen.

Der Aufschwung ist zu spüren. Er kommt an. Deutschland ist auf einem guten Weg. Die Angst, dass es wirtschaftlich weiter nach unten geht, ist vorbei. Von den befürchteten 3,7 Millionen Arbeitslosen im Jahresschnitt sind wir weit entfernt.",Ernst Hinsken,,data/txt/17038.txt,Ernst Hinsken (CDU/CSU),cducsu,speech
85266,38,17,0,898,Aber nicht mehr lange!,von der LINKEN,,data/txt/17038.txt,Zuruf von der LINKEN,linke,poi
85267,38,17,0,899,"Wenn die jetzigen Prognosen stimmen, sind es circa 10 Prozent weniger als im Januar vorhergesagt. Die Bundesregierung erwartet in ihrer Frühjahrsprojektion einen Anstieg des realen Bruttoinlandsprodukts von 1,4 Prozent in diesem Jahr. Für das Jahr 2011 geht die Bundesregierung von einer weiteren leichten Beschleunigung des Wachstums in Höhe von 1,6 Prozent aus. Begleitet wird die Erholung der deutschen Wirtschaft von einer stabilen Entwicklung des Arbeitsmarktes in beiden Jahren. Darüber sollten wir uns alle freuen; denn das sind gute Einkommensperspektiven für die Arbeitnehmerinnen und Arbeitnehmer. Zudem ist es erfreulich - es liegt mir besonders am Herzen, das in den Mittelpunkt meiner Ausführungen zu stellen -, dass wir damit unseren jungen Menschen gute Perspektiven für die Zukunft geben. Es sollte uns mit Genugtuung erfüllen, dass die Jugendarbeitslosigkeit in Deutschland um 11 Prozent gesunken ist, während sie in der EU im Durchschnitt um 28 Prozent, in Spanien sogar um 86 Prozent gestiegen ist. Haben Sie sich schon einmal auf der Zunge zergehen lassen, wie blendend wir, speziell was Jugendarbeitslosigkeit anbelangt, in der Bundesrepublik Deutschland im Vergleich mit anderen Staaten dastehen?

Dieser Rückgang der Jugendarbeitslosigkeit ist vor allem auf das Engagement der Wirtschaft zurückzuführen, die allein im letzten Jahr wieder über 30 Mil-liarden Euro für die Ausbildung bereitgestellt hat. Ein herzliches Wort des Dankes dafür! Diese Leistung der Wirtschaft für den Staat sollte auch einmal anerkannt werden.",Ernst Hinsken,,data/txt/17038.txt,Ernst Hinsken (CDU/CSU),cducsu,speech
85268,38,17,0,900,Beifall bei der CDU/CSU und der FDP,,,data/txt/17038.txt,,,poi
85269,38,17,0,901,"Das duale System, um das wir weltweit beneidet werden, hat sich unter schwierigen Bedingungen bewährt. Die deutschen Betriebe haben die Zeichen der Zeit erkannt. Sie setzen auf die Jugend und wirken dem prognostizierten Fachkräftemangel durch Ausbildung entgegen.

Die gute allgemeine Entwicklung ist vor allem das Verdienst der Tarifpartner, also der Unternehmen und der Arbeitnehmer. Beiden gebührt an dieser Stelle ebenfalls ein Dankeschön für ihr maßvolles Handeln; denn wir können seitens der Politik bzw. des Staates schließlich nur den Rahmen schaffen. Ausfüllen müssen ihn die Betriebe. Aber die Rahmenbedingungen müssen stimmen. Hierfür wurde einiges getan. Darauf sind wir zu Recht stolz. Schließlich verbessern sich die wirtschaftliche Lage und die Lage am Arbeitsmarkt Tag für Tag. Wie heißt es so schön in einem Sprichwort? Wer rastet, der rostet. Deshalb muss weiter Gas gegeben werden. Seitens des Staates müssen wir die verschiedenen Fesseln lockern, insbesondere die der Bürokratie. Das kann dazu beitragen, dass vor allem der Mittelstand als Konjunktur- und Beschäftigungslokomotive unser Land weiter aus der Krise zieht. Dies ist das Credo der schwarz-gelben Koalition.

In jüngster Zeit zeigt sich mehr und mehr: Sie von der SPD und der Linken setzen auf den Staat und auf unfinanzierbare und unrealistische Konjunkturprogramme. Wofür stehen Sie auf der linken Seite dieses Hauses denn? Erstens. Mit Ihren Vorschlägen wollen Sie eine Wiederbelebung des Sozialismus im 21. Jahrhundert erreichen.",Ernst Hinsken,,data/txt/17038.txt,Ernst Hinsken (CDU/CSU),cducsu,speech
85270,38,17,0,902,Lachen bei der LINKEN,,,data/txt/17038.txt,,,poi
85271,38,17,0,903,Das langweilt sogar mich!,Garrelt Duin,,data/txt/17038.txt,Garrelt Duin [SPD],spd,poi
85272,38,17,0,904,"Zweitens. Sie legen einen Fahrplan vor, der in Richtung Staatswirtschaft führt. Drittens. Die Chancen am Arbeitsmarkt stellen Sie hintan; Sie wollen sie zerstören. Viertens. Steuern und Abgaben sollen drastisch erhöht werden. Fünftens. Transferleistungen sollen aufgebläht werden.",Ernst Hinsken,,data/txt/17038.txt,Ernst Hinsken (CDU/CSU),cducsu,speech
85273,38,17,0,905,Zuruf der Abg. Ulla Lötzer [DIE LINKE],,,data/txt/17038.txt,,,poi
85274,38,17,0,906,"- Warum schreiben Sie es denn rein, wenn Sie sich davon distanzieren wollen, Frau Lötzer? Sie müssen schon dazu stehen. Sie müssen den Leuten schon erklären, wie Sie die Wirtschaftspolitik ausgerichtet haben wollen, um die Probleme zu bewältigen.",Ernst Hinsken,,data/txt/17038.txt,Ernst Hinsken (CDU/CSU),cducsu,speech
85275,38,17,0,907,Wir haben einen Antrag vorgelegt!,Ulla Lötzer,,data/txt/17038.txt,Ulla Lötzer [DIE LINKE],linke,poi
85276,38,17,0,908,Das ist nicht die Konzeption für die Zukunft. Gerade jetzt und in Zukunft braucht Deutschland keine rot-roten Experimente. Das ist unsere Botschaft.,Ernst Hinsken,,data/txt/17038.txt,Ernst Hinsken (CDU/CSU),cducsu,speech
85277,38,17,0,909,Beifall bei der CDU/CSU und der FDP,,,data/txt/17038.txt,,,poi
85278,38,17,0,910,"Was wir jetzt brauchen, ist weiteres Wachstum, um endgültig aus der Krise zu kommen. Dabei setzen wir von der CDU/CSU insbesondere auf Mittelstand und Handwerk. Unsere Strategie hierzu heißt: Wir wollen weiter auf unsere Stärken setzen. Die Union hat in den letzten Jahren in der Bundesregierung mit dafür gesorgt, dass wir wirtschaftspolitisch unsere Hausaufgaben erledigt und die richtigen Weichenstellungen vorgenommen haben. Das Ergebnis: Die deutschen Unternehmen, insbesondere im Mittelstand, zählen auch deshalb zu den wettbewerbsfähigsten der ganzen Welt. Davon profitieren unsere Industriestandorte, unsere Arbeitsplätze und die Exportwirtschaft als eine der zentralen Stützen unseres Wirtschaftswachstums. Im europäischen Vergleich werden wir darum beneidet. Der Vorwurf, der vor allem aus Frankreich kommt, unser Exportüberschuss bringe andere Länder in Schwierigkeiten, ist meiner Meinung nach haltlos. Diese Kritik ist doch völlig falsch; denn wir sorgen für den stabilen Außenwert des Euro und das Vertrauen der Kapitalmärkte in die gemeinsame Währung und somit für niedrige Zinsen. Deshalb muss es umgekehrt sein: Alle anderen EU-Länder sind aufgefordert, auf uns zu schauen und es so zu machen, wie wir es in Deutschland praktizieren. Dann fahren sie gut; dann sind sie auf dem richtigen Weg.",Ernst Hinsken,,data/txt/17038.txt,Ernst Hinsken (CDU/CSU),cducsu,speech
85279,38,17,0,911,Beifall bei der CDU/CSU,,,data/txt/17038.txt,,,poi
85280,38,17,0,912,Wie in Bayern!,von der LINKEN,,data/txt/17038.txt,Zuruf von der LINKEN,linke,poi
85281,38,17,0,913,"- Dass Bayern noch besser ist als die Bundesrepublik Deutschland insgesamt, möchte ich nicht bestreiten.",Ernst Hinsken,,data/txt/17038.txt,Ernst Hinsken (CDU/CSU),cducsu,speech
85282,38,17,0,914,Beifall bei der CDU/CSU sowie bei Abgeordneten der FDP,,,data/txt/17038.txt,,,poi
85283,38,17,0,915,"Von uns werden die jetzt so hoch verschuldeten Mitglieder der Euro-Zone profitieren.

Gerade wir von der CDU/CSU haben darauf gedrängt, dass in der Krise insbesondere die Binnennachfrage gestärkt wurde. Das ist der richtige Ansatz. Der Beweis: Deutschland hat mit zwei Konjunkturpaketen der schwarz-roten Koalition und dem Wachstumsbeschleunigungsgesetz der christlich-liberalen Bundesregierung deutliche Impulse für die Binnennachfrage gesetzt. Das ist mehr, als die anderen EU-Mitgliedstaaten getan haben. Insbesondere die Konjunkturpakete kamen zum Beispiel beim Handwerk an. Sie waren zur Stärkung der Binnenkonjunktur maßgeschneidert. Dadurch konnte das Handwerk seine Stärken voll ausspielen.

Zudem wurden die Bürger seit dem 1. Januar 2010 um 22 Milliarden Euro entlastet. Außerdem haben wir das Kindergeld und den Kinderfreibetrag - er liegt jetzt bei 7 008 Euro je Kind - erhöht. Unsere Maxime lautet: Wir wollen den Schwächeren und Bedürftigen helfen. Deshalb ist es richtig, dass wir kinderreiche Familien unterstützen. So zahlt in der Bundesrepublik Deutschland seit 1. Januar dieses Jahres ein Vierpersonenhaushalt erst ab einem Einkommen von rund 30 000 Euro Steuern. Wir haben gehalten, was wir vor den Wahlen versprochen haben. Das kann sich sehen lassen.",Ernst Hinsken,,data/txt/17038.txt,Ernst Hinsken (CDU/CSU),cducsu,speech
85284,38,17,0,916,Beifall bei der CDU/CSU und der FDP,,,data/txt/17038.txt,,,poi
85285,38,17,0,917,"Ich sage das deshalb, weil ein altes Sprichwort sagt: Tue Gutes und rede darüber - noch dazu, wenn du einlösen kannst, was du versprochen hast. Man kann es spüren: Gerade in diesem Jahr profitieren Konsum und Investitionen von den wirtschafts- und finanzpolitischen Stützungsmaßnahmen. 2010 steigen durch die bereits beschlossene Entlastung die Nettoeinkommen je Arbeitnehmer um voraussichtlich 2,5 Prozent.

Wir haben zudem etliches für die Unternehmen getan. Es war uns ein Herzensanliegen, den Fehler bei den geringwertigen Wirtschaftsgütern, den wir gemeinsam gemacht haben, zu bereinigen. Auch sollte nicht verschwiegen werden, dass Bürokratieabbau das beste Konjunkturprogramm ist. Seit dieser im Kanzleramt bei Bundeskanzlerin Angela Merkel angesiedelt ist, sind die Erfolge unübersehbar. Bis Ende 2009 wurde die deutsche Wirtschaft um rund 7 Milliarden Euro pro Jahr entlastet. Das ist ein fast um die Hälfte höheres Volumen als die 5 Milliarden Euro, die die Unternehmensteuerreform 2008 generiert hat, und das ohne zusätzliche staatliche Ausgaben oder Einsparungen bei staatlichen Leistungen.

Wenn wir von Wettbewerbsfähigkeit sprechen, dann dürfen wir nicht vergessen, dass auch Kommunikation ein Wettbewerbsfaktor ist. Wenn wir uns vor Augen führen, wie teuer das Telefonieren noch vor 20 Jahren war und wie teuer es jetzt ist, stellen wir fest, dass allein das Telefonieren im Festnetz um 95 Prozent günstiger geworden ist. Das kann sich durchaus sehen und hören lassen.

Wir, die Union und die FDP, ruhen uns nicht aus, sondern gehen entschlossen ans Werk. Bis zum 1. Juli dieses Jahres wollen wir weitere Entlastungsmaßnahmen beschließen, um die durch den Bund verursachten Kosten bei den Informationspflichten der Wirtschaft bis Ende 2011 um netto 25 Prozent im Vergleich zu 2006 zu senken. Diese Maßnahmen werden die Unternehmen nicht nur finanziell entlasten, sondern schaffen auch ein Mehr an Freiheit für die Bürgerinnen und Bürger. Das ist für uns soziale Marktwirtschaft.",Ernst Hinsken,,data/txt/17038.txt,Ernst Hinsken (CDU/CSU),cducsu,speech
85286,38,17,0,918,Beifall bei der CDU/CSU,,,data/txt/17038.txt,,,poi
85287,38,17,0,919,"Gleichzeitig werden dadurch Wachstumspotenziale generiert.

Verehrte Kolleginnen und Kollegen, ich wollte noch etwas zur Bildung sagen. Das muss ich weglassen, weil schon das rote Licht leuchtet. Aber es sei mir noch gestattet und erlaubt, auf Opel einzugehen.",Ernst Hinsken,,data/txt/17038.txt,Ernst Hinsken (CDU/CSU),cducsu,speech
85288,38,17,0,920,"Wenn Sie das in einem Satz schaffen, ja, Kollege Hinsken.",Petra Pau,,data/txt/17038.txt,Vizepräsidentin Petra Pau,,chair
85289,38,17,0,921,"Ja. - Hier können verschiedene Möglichkeiten ins Auge gefasst werden. Die Bundesregierung schiebt dieses Problem nicht beiseite. Man wird sich mit den zuständigen Institutionen, Persönlichkeiten und allen, die dazugehören, unterhalten. Aber eines steht fest: Wir wollen es nicht so machen, wie es einmal bei der Firma Holzmann gemacht worden ist. Dort hat man hinausposaunt, man könne alles retten. Zu guter Letzt ist das Ganze in die Hose gegangen. Das darf bei Opel nicht passieren. Dafür wird die Bundesregierung sorgen. Ich bin zuversichtlich: Auch dieses Problem werden wir bewältigen.",Ernst Hinsken,,data/txt/17038.txt,Ernst Hinsken (CDU/CSU),cducsu,speech
85290,38,17,0,922,Beifall bei Abgeordneten der CDU/CSU,,,data/txt/17038.txt,,,poi
85291,38,17,0,923,"Nur noch einen Satz, verehrte Frau Präsidentin. Ich bedanke mich für das Zuhören und wünsche allen, dass es wirtschaftlich so weitergeht, wie wir das in der Bundesrepublik Deutschland dringend brauchen.

Danke schön.",Ernst Hinsken,,data/txt/17038.txt,Ernst Hinsken (CDU/CSU),cducsu,speech
85292,38,17,0,924,Beifall bei der CDU/CSU und der FDP,,,data/txt/17038.txt,,,poi
85293,38,17,0,925,,Ernst Hinsken,,data/txt/17038.txt,Ernst Hinsken (CDU/CSU),cducsu,speech
85294,38,17,0,926,Das Wort hat der Kollege Garrelt Duin für die SPD-Fraktion.,Petra Pau,,data/txt/17038.txt,Vizepräsidentin Petra Pau,,chair
85295,38,17,0,927,"Vielen Dank, Frau Präsidentin! Liebe Kolleginnen und Kollegen! Kollege Hinsken, ich will Ihnen zunächst einmal im Nachgang zu den Ereignissen des frühen Morgens ganz herzlich dazu gratulieren, dass Sie nun der Vorsitzende des Unterausschusses ""Regionale Wirtschaftspolitik"" sind, und wünsche Ihnen für dieses Amt alles Gute und ein gutes Händchen, damit in diesem so wichtigen wirtschaftspolitischen Bereich durch den Deutschen Bundestag wirklich etwas vorangebracht werden kann.",Garrelt Duin,,data/txt/17038.txt,Garrelt Duin (SPD),spd,speech
85296,38,17,0,928,"Beifall bei der SPD, der CDU/CSU, der FDP und dem BÜNDNIS 90/DIE GRÜNEN",,,data/txt/17038.txt,,,poi
85297,38,17,0,929,"Ich hoffe, dass Sie mich dabei unterstützen!",Ernst Hinsken,,data/txt/17038.txt,Ernst Hinsken [CDU/CSU],cducsu,poi
85298,38,17,0,930,"- Sehr gerne. - Gleichwohl hatte ich bei Ihrer Rede gerade eben den Eindruck - verzeihen Sie mir den Vergleich -, dass Ihre berufliche Herkunft als gelernter Bäcker- und Konditormeister ein bisschen mit Ihnen durchgegangen ist. Sie haben hier ein Bild nach dem Motto ""Friede, Freude, Eierkuchen"" gemalt und das Ganze schön verziert, wie es ein Konditor eben macht.",Garrelt Duin,,data/txt/17038.txt,Garrelt Duin (SPD),spd,speech
85299,38,17,0,931,Zuckerguss!,Ute Kumpf,,data/txt/17038.txt,Ute Kumpf [SPD],spd,poi
