id,sitzung,wahlperiode,in_writing,sequence,text,speaker_cleaned,speaker_fp,filename,speaker,speaker_party,type
84869,38,17,0,501,"Wie gerecht wäre es, wenn ein Arbeitnehmer im teuren München das Gleiche bekäme wie der Kollege im ländlichen Raum mit eher niedrigen Lebenshaltungskosten? Und hilft ein Mindestlohn Geringqualifizierten oder Langzeitarbeitslosen bei der Suche nach einem Arbeitsplatz? Nein, im Gegenteil.

Denn erstens: Ein gesetzlicher Mindestlohn in der geforderten Höhe vernichtet Arbeitsplätze.",Gitta Connemann,,data/txt/17038.txt,Gitta Connemann (CDU/CSU),cducsu,speech
84870,38,17,0,502,Das ist zu einfach!,Dr. Wolfgang Strengmann-Kuhn,,data/txt/17038.txt,Dr. Wolfgang Strengmann-Kuhn [BÜNDNIS 90/ DIE GRÜNEN],gruene,poi
84871,38,17,0,503,"Es ist eine bittere Wahrheit, aber auch der Faktor Arbeit unterliegt volkswirtschaftlichen Gesetzen.",Gitta Connemann,,data/txt/17038.txt,Gitta Connemann (CDU/CSU),cducsu,speech
84872,38,17,0,504,Beifall bei der CDU/CSU und der FDP,,,data/txt/17038.txt,,,poi
84873,38,17,0,505,"Eine Gesetzmäßigkeit lautet: Betriebe, die wegen zu hoher Löhne zu hohe Preise verlangen müssen, können auf Dauer am Markt nicht bestehen. Ist ein Mindestlohn zu hoch, vernichtet er also Arbeitsplätze.",Gitta Connemann,,data/txt/17038.txt,Gitta Connemann (CDU/CSU),cducsu,speech
84874,38,17,0,506,Das ist alles viel zu einfach!,Dr. Wolfgang Strengmann-Kuhn,,data/txt/17038.txt,Dr. Wolfgang Strengmann-Kuhn [BÜND-NIS 90/DIE GRÜNEN],gruene,poi
84875,38,17,0,507,"Meine Damen und Herren von der Opposition, Sie werden jetzt sagen, die Betriebe könnten mehr zahlen, sie wollten bloß nicht. Wer so etwas sagt, weiß in keiner Weise um die Lage gerade der kleinen und mittelständischen Unternehmen vor Ort.",Gitta Connemann,,data/txt/17038.txt,Gitta Connemann (CDU/CSU),cducsu,speech
84876,38,17,0,508,Beifall bei der CDU/CSU und der FDP,,,data/txt/17038.txt,,,poi
84877,38,17,0,509,"Wissen Sie, was einem Handwerksbetrieb bleibt? Zwischen 2 und 4 Prozent. Wenn Sie das auf einen Stundensatz umlegen, dann sind wir bei 0,56 bis 1,30 Euro in der Stunde. Da bleiben keine Spielräume mehr.

Zweitens. Ein gesetzlicher Mindestlohn schadet gering qualifizierten Menschen; denn darunter leiden vor allem die Ungelernten ohne Ausbildung, ohne Abschluss, ohne Perspektive.",Gitta Connemann,,data/txt/17038.txt,Gitta Connemann (CDU/CSU),cducsu,speech
84878,38,17,0,510,"Das ist doch alles hundertmal widerlegt, Frau Connemann!",Andrea Nahles,,data/txt/17038.txt,Andrea Nahles [SPD],spd,poi
84879,38,17,0,511,"Wenn ihre Arbeit teurer wird, haben sie keinerlei Chance am Arbeitsmarkt. Sie sind damit nicht nur von der Chance auf einen eigenen Verdienst abgeschnitten, sondern übrigens auch von der Anerkennung, die jede Arbeit darstellt. Denn eines müssen wir an dieser Stelle auch festhalten: Es geht bei Arbeit nicht nur um Geld, sondern Arbeit gibt auch Würde.",Gitta Connemann,,data/txt/17038.txt,Gitta Connemann (CDU/CSU),cducsu,speech
84880,38,17,0,512,Beifall bei der CDU/CSU und der FDP,,,data/txt/17038.txt,,,poi
84881,38,17,0,513,Genau das ist der Punkt!,Andrea Nahles,,data/txt/17038.txt,Andrea Nahles [SPD],spd,poi
84882,38,17,0,514,"Drittens. Ein gesetzlicher Mindestlohn gefährdet insbesondere Arbeitsplätze in ohnehin schwachen Regionen. Niemand hat etwas davon, in Berlin einen Lohn festzulegen, der in Grenzregionen Arbeitsplätze zerstört. Die Verhältnisse in Frankfurt unterscheiden sich eben danach, ob man an der Oder oder am Main ist.",Gitta Connemann,,data/txt/17038.txt,Gitta Connemann (CDU/CSU),cducsu,speech
84883,38,17,0,515,"Von 3,80 Euro kann man nirgendwo leben!",Brigitte Pothmer,,data/txt/17038.txt,Brigitte Pothmer [BÜNDNIS 90/DIE GRÜNEN],gruene,poi
84884,38,17,0,516,"Die Brandenburger Betriebe stehen im Wettbewerb zu polnischen. Dort gibt es einen gesetzlichen Mindestlohn, vollkommen richtig; aber dieser liegt bei 1,53 Euro.",Gitta Connemann,,data/txt/17038.txt,Gitta Connemann (CDU/CSU),cducsu,speech
84885,38,17,0,517,Hört! Hört!,Patrick Kurth,,data/txt/17038.txt,Patrick Kurth [Kyffhäuser] [FDP],fdp,poi
84886,38,17,0,518,"Ein Mindestlohn von 8,50 Euro auf deutscher Seite hätte nur ein Ergebnis: Jobvernichtung. Unterschiedliche Verhältnisse müssen unterschiedlich behandelt werden. Ein gesetzlicher Mindestlohn für ganz Deutschland gewährleistet dies nicht.",Gitta Connemann,,data/txt/17038.txt,Gitta Connemann (CDU/CSU),cducsu,speech
84887,38,17,0,519,Beifall bei der CDU/CSU und der FDP,,,data/txt/17038.txt,,,poi
84888,38,17,0,520,"Meine Damen und Herren von der Opposition, ich höre schon Ihren Einwand, dass in anderen europäischen Ländern höhere Mindestlöhne gezahlt werden als in Polen.",Gitta Connemann,,data/txt/17038.txt,Gitta Connemann (CDU/CSU),cducsu,speech
84889,38,17,0,521,Frau Connemann kennt sich in der Tarifpolitik nicht aus!,Ute Kumpf,,data/txt/17038.txt,Ute Kumpf [SPD],spd,poi
84890,38,17,0,522,"Das ist völlig korrekt. Es gibt insgesamt 20 Staaten in der EU, die einen Mindestlohn eingeführt haben; aber der Durchschnittslohn in der EU beläuft sich auf 4,08 Euro.",Gitta Connemann,,data/txt/17038.txt,Gitta Connemann (CDU/CSU),cducsu,speech
84891,38,17,0,523,"Nun hören Sie doch auf! Sagen Sie doch, was Frankreich oder England bekommen!",Andrea Nahles,,data/txt/17038.txt,Andrea Nahles [SPD],spd,poi
84892,38,17,0,524,Oder die Niederlande!,Anette Kramme,,data/txt/17038.txt,Anette Kramme [SPD],spd,poi
84893,38,17,0,525,"So unterrichtete uns das Bundesministerium für Arbeit und Soziales am Anfang dieses Monats darüber, dass der Mindestlohn in der EU durchschnittlich 4,08 Euro beträgt. Das Ministerium wies uns übrigens auch auf folgende Erkenntnis hin: In Staaten ohne gesetzlichen Mindestlohn ist der Durchschnittslohn 30 Prozent höher als in Staaten mit gesetzlichem Mindestlohn.",Gitta Connemann,,data/txt/17038.txt,Gitta Connemann (CDU/CSU),cducsu,speech
84894,38,17,0,526,"Das sind die skandinavischen Länder! Die brauchen das nicht, weil sie einen flächendeckenden Tarifvertrag haben! Das ist völliger Unsinn, was Sie da erzählen!",Dr. Wolfgang Strengmann-Kuhn,,data/txt/17038.txt,Dr. Wolfgang Strengmann-Kuhn [BÜND-NIS 90/DIE GRÜNEN],gruene,poi
84895,38,17,0,527,"Denn auch ohne gesetzlichen Mindestlohn sind Hunger- bzw. Armutslöhne in Deutschland schon heute verboten. Das Gesetz untersagt sittenwidrige Löhne. Bleibt das Einkommen auffällig hinter dem tarifüblichen oder ortsüblichen Lohn zurück, hat der Arbeitnehmer das Recht auf Nachzahlung und übrigens der Staat auf Bestrafung. Leider melden sich Betroffene kaum, und wo kein Kläger, da kein Richter. Da hilft auch kein gesetzlicher Mindestlohn, übrigens auch nicht dem System.

Ihre Behauptung, liebe Frau Nahles, gesetzliche Mindestlöhne würden zu Mehreinnahmen in der gesetzlichen Sozialversicherung führen, ist reines Wunschdenken. Umgekehrt wird ein Schuh daraus: Höhere Arbeitslosigkeit durch gesetzliche Mindestlöhne führt zu Mindereinnahmen in der Rentenversicherung und in der Arbeitslosenversicherung.",Gitta Connemann,,data/txt/17038.txt,Gitta Connemann (CDU/CSU),cducsu,speech
84896,38,17,0,528,So ist es!,Patrick Kurth,,data/txt/17038.txt,Patrick Kurth [Kyffhäuser] [FDP],fdp,poi
84897,38,17,0,529,"Es ist deshalb sinnvoll, die Lohnfrage dort zu lassen, wo sie hingehört, nämlich in den Tarifverhandlungen.",Gitta Connemann,,data/txt/17038.txt,Gitta Connemann (CDU/CSU),cducsu,speech
84898,38,17,0,530,Beifall bei der CDU/CSU und der FDP,,,data/txt/17038.txt,,,poi
84899,38,17,0,531,"Wir, die Union, wollen Mindestlöhne, aber branchenbezogen; denn so wie sich die regionalen Verhältnisse in Deutschland nicht vergleichen lassen, gibt es auch Unterschiede zwischen den Branchen,",Gitta Connemann,,data/txt/17038.txt,Gitta Connemann (CDU/CSU),cducsu,speech
84900,38,17,0,532,Das haben wir ja gesehen!,Andrea Nahles,,data/txt/17038.txt,Andrea Nahles [SPD],spd,poi
84901,38,17,0,533,"von der Chemiebranche bis zur Agrarbranche. Sind Arbeitnehmer und Arbeitgeber sich dort einig, können wir den Branchentariflohn auf alle erstrecken. Das haben wir gemacht, vom Bau bis zur Pflege, und zwar mit großem Erfolg.",Gitta Connemann,,data/txt/17038.txt,Gitta Connemann (CDU/CSU),cducsu,speech
84902,38,17,0,534,Selbst das wollten Sie nicht!,Anton Schaaf,,data/txt/17038.txt,Anton Schaaf [SPD],spd,poi
84903,38,17,0,535,"Wir in der Union sind offen für weitere Branchen. Das Prinzip, das übrigens unter Kohl und Blüm eingeführt worden ist, hat sich bewährt. Die Lohnfindung erfolgt durch die Tarifvertragsparteien. Niemand kann es besser.",Gitta Connemann,,data/txt/17038.txt,Gitta Connemann (CDU/CSU),cducsu,speech
84904,38,17,0,536,"Frau Kollegin Connemann, möchten Sie eine Zwischenfrage des Kollegen Schlecht zulassen?",Dr. Norbert Lammert,,data/txt/17038.txt,Präsident Dr. Norbert Lammert,,chair
84905,38,17,0,537,Aber immer gerne.,Gitta Connemann,,data/txt/17038.txt,Gitta Connemann (CDU/CSU),cducsu,speech
84906,38,17,0,538,Bitte.,Dr. Norbert Lammert,,data/txt/17038.txt,Präsident Dr. Norbert Lammert,,chair
84907,38,17,0,539,Warum macht ihr das? Das ist eine Redezeitverlängerung!,Brigitte Pothmer,,data/txt/17038.txt,Brigitte Pothmer [BÜNDNIS 90/DIE GRÜNEN],gruene,poi
84908,38,17,0,540,,Dr. Norbert Lammert,,data/txt/17038.txt,Präsident Dr. Norbert Lammert,,chair
84909,38,17,0,541,"Verehrte Frau Kollegin, ich finde Ihr Plädoyer für die Tarifautonomie sehr charmant. Ich selbst war 20 Jahre lang in der Tarifpolitik verantwortlich tätig. Wir haben bereits gehört, dass mittlerweile nur noch 50 Prozent der Beschäftigungsverhältnisse in Deutschland durch Tarifverträge abgedeckt sind. Wie wollen Sie mit den anderen 50 Prozent der Arbeitnehmerinnen und Arbeiternehmer, für die es mittlerweile durch vielfältige Prozesse, die durch Politik herbeigeführt worden sind, keine Tarifverträge mehr gibt, umgehen, wenn der Abschluss von Tarifverträgen nicht mehr möglich ist?",Michael Schlecht,,data/txt/17038.txt,Michael Schlecht (DIE LINKE),linke,speech
84910,38,17,0,542,"Herr Kollege, zunächst einmal halte ich Ihre Behauptung, dass es aufgrund politischer Einwirkung oder Vorgaben zu keinen Tarifabschlüssen mehr käme, für absolut abenteuerlich.",Gitta Connemann,,data/txt/17038.txt,Gitta Connemann (CDU/CSU),cducsu,speech
84911,38,17,0,543,So ist es! Völlig richtig!,Dr. Johann Wadephul,,data/txt/17038.txt,Dr. Johann Wadephul [CDU/CSU],cducsu,poi
84912,38,17,0,544,"Bei Tarifverhandlungen haben wir immer noch auf der einen Seite unabhängige Gewerkschaften, zum Beispiel den DGB - Frau Nahles hat ihn genannt -, Verdi oder die Einzelgewerkschaften",Gitta Connemann,,data/txt/17038.txt,Gitta Connemann (CDU/CSU),cducsu,speech
84913,38,17,0,545,"Der führt aber keine Tarifverhandlungen, Frau Connemann! Das haben Sie nicht verstanden! Da sind Sie auf dem Holzweg! Das ist Gemeinschaftskunde erste Lektion!",Ute Kumpf,,data/txt/17038.txt,Ute Kumpf [SPD],spd,poi
84914,38,17,0,546,"- Sie brauchen sich gar nicht zu ereifern -, und auf der anderen Seite die Arbeitgeberverbände. Damit hat die Politik nichts zu tun. Das ist auch gut so; denn das Prinzip der Tarifautonomie hat sich in diesem Lande bewährt.",Gitta Connemann,,data/txt/17038.txt,Gitta Connemann (CDU/CSU),cducsu,speech
84915,38,17,0,547,"Ja, ja, ja! Das sind doch wirklich Ausreden ohnegleichen!",Andrea Nahles,,data/txt/17038.txt,Andrea Nahles [SPD],spd,poi
84916,38,17,0,548,"Sie haben natürlich recht: Es gibt Branchen, in denen wir keine Tarifverträge bzw. ältere Tarifverträge haben. In diesen Fällen helfen wir mit einer Ausweitung des Arbeitnehmer-Entsendegesetzes, weil ein Grundsatz für uns in der Union unantastbar ist: Die Lohnfindung ist bei den Tarifvertragsparteien auf jeden Fall besser angesiedelt als beim Staat",Gitta Connemann,,data/txt/17038.txt,Gitta Connemann (CDU/CSU),cducsu,speech
84917,38,17,0,549,Beifall bei Abgeordneten der CDU/CSU und der FDP,,,data/txt/17038.txt,,,poi
84918,38,17,0,550,"oder bei Kommissionen, wie sie hier auch gefordert werden.",Gitta Connemann,,data/txt/17038.txt,Gitta Connemann (CDU/CSU),cducsu,speech
84919,38,17,0,551,Für die 50 Prozent!,Michael Schlecht,,data/txt/17038.txt,Michael Schlecht [DIE LINKE],linke,poi
84920,38,17,0,552,"Weder der Staat noch eine unabhängige Kommission könnte es besser, Herr Kollege. Das gilt mit Ausnahme des Bereichs der Pflege. Dort gibt es wegen der Mehrzahl der kirchlichen Anbieter keine Tarifverhandlungen. Hier wurde eine Mindestlohnkommission gegründet. Das war die Ausnahme. Ansonsten haben wir unabhängige Tarifvertragsparteien. An diesem Prinzip wollen wir festhalten. Es hat sich bewährt.

Dort, wo es keine Branchenmindestlöhne gibt, müssen wir ein Mindesteinkommen schaffen, und zwar durch staatliche Zuschüsse. Mit uns sind Hungerlöhne nicht zu machen. Das sage ich wiederholt von dieser Stelle aus.",Gitta Connemann,,data/txt/17038.txt,Gitta Connemann (CDU/CSU),cducsu,speech
84921,38,17,0,553,Beifall bei der CDU/CSU sowie bei Abgeordneten der FDP,,,data/txt/17038.txt,,,poi
84922,38,17,0,554,"Anders als Sie streuen wir den Menschen aber keinen Sand in die Augen, liebe Damen und Herren von der Opposition.",Gitta Connemann,,data/txt/17038.txt,Gitta Connemann (CDU/CSU),cducsu,speech
84923,38,17,0,555,2 Millionen Menschen verdienen weniger als 5 Euro die Stunde!,Brigitte Pothmer,,data/txt/17038.txt,Brigitte Pothmer [BÜNDNIS 90/DIE GRÜNEN],gruene,poi
84924,38,17,0,556,"Wir sagen offen: Nicht jeder Beschäftigte kann von seinem Lohn leben, zum Beispiel, weil er Teilzeit arbeitet, zum Beispiel, weil er eine geringere Qualifikation hat. Ich sage Ihnen auch: Arbeitslosigkeit zu finanzieren ist allemal teurer, als in diesen Fällen ein Mindesteinkommen durch staatliche Zuzahlung zum Lohn zu sichern.",Gitta Connemann,,data/txt/17038.txt,Gitta Connemann (CDU/CSU),cducsu,speech
84925,38,17,0,557,Beifall bei der CDU/CSU und der FDP,,,data/txt/17038.txt,,,poi
84926,38,17,0,558,"Benachteiligte Bewerber können mit einem solchen Kombilohn auf dem Arbeitsmarkt Fuß fassen. Das lohnt sich übrigens, bevor das restliche Leben perspektivlos wird. Ihnen mit Zuschüssen eine sinnvolle Arbeit zu geben, ist eine Chance für die Betroffenen wie für uns.

Es gibt viele Wege im Kampf gegen Arbeitslosigkeit. Der gesetzliche Mindestlohn ist kein Patentrezept. Deshalb werden wir Ihren Antrag ablehnen.",Gitta Connemann,,data/txt/17038.txt,Gitta Connemann (CDU/CSU),cducsu,speech
84927,38,17,0,559,Beifall bei der CDU/CSU und der FDP,,,data/txt/17038.txt,,,poi
84928,38,17,0,560,,Gitta Connemann,,data/txt/17038.txt,Gitta Connemann (CDU/CSU),cducsu,speech
84929,38,17,0,561,Das Wort hat der Kollege Werner Dreibus für die Fraktion Die Linke.,Petra Pau,,data/txt/17038.txt,Vizepräsidentin Petra Pau,,chair
84930,38,17,0,562,Beifall bei der LINKEN,,,data/txt/17038.txt,,,poi
84931,38,17,0,563,,Petra Pau,,data/txt/17038.txt,Vizepräsidentin Petra Pau,,chair
84932,38,17,0,564,"Frau Präsidentin! Liebe Kolleginnen! Liebe Kollegen! Liebe Kollegin Nahles, herzlich willkommen im Kreis der Befürworter eines gesetzlichen Mindestlohns. Um mit den Worten Friedrich Schillers anzufangen: ""Spät kommt Ihr - Doch Ihr kommt!"" Immerhin.",Werner Dreibus,,data/txt/17038.txt,Werner Dreibus (DIE LINKE),linke,speech
84933,38,17,0,565,Beifall bei der LINKEN,,,data/txt/17038.txt,,,poi
84934,38,17,0,566,"Ich freue mich, dass wir innerhalb von nur vier Sitzungswochen bereits die zweite Debatte zum Thema Mindestlohn im Bundestag führen. Nachdem wir Anfang März unseren Antrag ""Niedriglöhne bekämpfen - Gesetzlichen Mindestlohn einführen"" vorgestellt haben, zieht heute die SPD nach und präsentiert einen Antrag mit einem fast wortgleichen Titel. Das Thema Mindestlohn hat für Millionen Menschen eine so existenzielle Bedeutung, dass wir als Linke bereit wären, jede Woche im Bundestag über die Einführung eines flächendeckenden, einheitlichen gesetzlichen Mindestlohns zu diskutieren.",Werner Dreibus,,data/txt/17038.txt,Werner Dreibus (DIE LINKE),linke,speech
84935,38,17,0,567,Nein!,Brigitte Pothmer,,data/txt/17038.txt,Brigitte Pothmer [BÜNDNIS 90/DIE GRÜNEN],gruene,poi
84936,38,17,0,568,"Wir wollen nicht vergessen, dass es die Linke war, die in den letzten Jahren den gesetzlichen Mindestlohn immer wieder, auch hier im Haus, zum Thema gemacht hat.",Werner Dreibus,,data/txt/17038.txt,Werner Dreibus (DIE LINKE),linke,speech
84937,38,17,0,569,Beifall bei der LINKEN,,,data/txt/17038.txt,,,poi
84938,38,17,0,570,Die Grünen waren zuerst!,Manuel Sarrazin,,data/txt/17038.txt,Manuel Sarrazin [BÜNDNIS 90/DIE GRÜNEN],gruene,poi
84939,38,17,0,571,"Ich nenne nur zwei, drei Beispiele. Ich erinnere an die eindrucksvolle Sachverständigenanhörung, die wir im Mai 2006, also vor fast vier Jahren, hier im Bundestag durchgeführt haben. Wir haben die Vertreter der Low Pay Commission aus Großbritannien eingeladen. Übrigens waren Vertreter der Gewerkschaften, der Arbeitgeber und der Wissenschaft bei uns. Sie berichteten schon damals übereinstimmend in Berlin, dass der gesetzliche Mindestlohn in Großbritannien ein voller Erfolg ist, keine Arbeitsplätze gekostet hat, im Gegenteil sogar zusätzliche Arbeitsplätze entstanden sind.",Werner Dreibus,,data/txt/17038.txt,Werner Dreibus (DIE LINKE),linke,speech
84940,38,17,0,572,Das stimmt doch gar nicht!,Dr. Matthias Zimmer,,data/txt/17038.txt,Dr. Matthias Zimmer [CDU/CSU],cducsu,poi
84941,38,17,0,573,"- Hören Sie gut zu! - So sagte der Vertreter des Industrieverbandes wörtlich - das war nicht der Vertreter der Gewerkschaft -: In unserem Land gibt es niemanden mehr, der den Mindestlohn wieder abschaffen möchte.

Ich erinnere auch an die Unterschriftenkampagne der SPD im Jahr 2007, mit der sie öffentlichkeitswirksam feststellte: Deutschland braucht den Mindestlohn. Doch statt als Regierungspartei in der vergangenen Legislaturperiode selbst eine Gesetzesinitiative für den gesetzlichen Mindestlohn zu starten, musste erst die Linke die Resolution der SPD zur Abstimmung in den Bundestag bringen. Das Ergebnis ist bekannt. Ich erinnere daran: Die SPD stimmte gegen ihre eigene Resolution. Hätten Sie mit uns und mit den Grünen in der letzten Legislaturperiode für Ihre Resolution gestimmt, hätten wir bereits seit drei Jahren in Deutschland einen gesetzlichen Mindestlohn.",Werner Dreibus,,data/txt/17038.txt,Werner Dreibus (DIE LINKE),linke,speech
84942,38,17,0,574,Beifall bei der LINKEN,,,data/txt/17038.txt,,,poi
84943,38,17,0,575,"Ich erinnere auch kurz an die vielen Anträge der Linken, mit denen wir wiederholt die Einführung eines flächendeckenden gesetzlichen Mindestlohns gefordert haben. All diese Chancen haben Sie nicht genutzt.

Kollegin Nahles hat völlig zu Recht darauf hingewiesen, dass der Niedriglohnsektor in den letzten Jahren massiv angewachsen ist. Mittlerweile arbeiten mehr als 6,5 Millionen Menschen - das ist fast jeder vierte Beschäftigte - für einen Niedriglohn. Das ist nicht hinnehmbar. Fast jeder zehnte regulär Beschäftigte ist von Niedriglöhnen betroffen. Es sind vor allem Menschen in prekären Beschäftigungsverhältnissen, die zu Hungerlöhnen arbeiten. Das trifft vier von fünf sogenannten Minijobberinnen und Minijobbern, zwei Drittel der Leiharbeiterinnen und Leiharbeiter, 40 Prozent der befristet Beschäftigten, 39 Prozent aller Beschäftigten in Ostdeutschland und vor allem Frauen, nicht zu vergessen die 1,4 Millionen Menschen, die so wenig verdienen, dass sie neben ihrem Lohn noch Hartz IV beziehen müssen. Das kostet die Steuerzahler - auch das ist schon gesagt worden - jährlich 9,3 Milliarden Euro. Das ist völlig inakzeptabel.",Werner Dreibus,,data/txt/17038.txt,Werner Dreibus (DIE LINKE),linke,speech
84944,38,17,0,576,Beifall bei der LINKEN sowie des Abg. Dr. Wolfgang Strengmann-Kuhn [BÜND-NIS 90/DIE GRÜNEN],,,data/txt/17038.txt,,,poi
84945,38,17,0,577,"An dieser Stelle sollte die Regierungskoalition, insbesondere die Kolleginnen und Kollegen von der FDP, ansetzen, wenn sie Steuerzahlerinnen und Steuerzahler wirklich entlasten will. Je schneller es in diesem Haus eine Mehrheit für einen gesetzlichen Mindestlohn gibt, desto besser ist es für die Betroffenen und für die Steuerzahler.",Werner Dreibus,,data/txt/17038.txt,Werner Dreibus (DIE LINKE),linke,speech
84946,38,17,0,578,Beifall bei der LINKEN,,,data/txt/17038.txt,,,poi
84947,38,17,0,579,"Zurück zum Antrag der SPD. Sie tun so, als ob Sie mit der ganzen Entwicklung überhaupt nichts zu tun hätten. Weder in Ihrem Antrag noch im Grundsatzpapier Ihres Parteivorstandes ""Fairness auf dem Arbeitsmarkt"" findet sich auch nur eine Zeile, in der Sie sich kritisch mit Ihrer eigenen Rolle als Regierungspartei in den letzten elf Jahren auseinandersetzen. Finden Sie das gerade bei diesem Thema fair? Ich finde es nicht fair. Wer hat denn sachgrundlose Befristungen gesetzlich ermöglicht? Wer hat die wichtigsten Schutzbestimmungen in der Leiharbeit abgeschafft? Wer hat es ermöglicht, durch Tarifverträge vom Prinzip ""Gleicher Lohn für gleiche Arbeit"" nach unten abzuweichen? Wer?",Werner Dreibus,,data/txt/17038.txt,Werner Dreibus (DIE LINKE),linke,speech
84948,38,17,0,580,Rot-Grün!,von der LINKEN,,data/txt/17038.txt,Zuruf von der LINKEN,linke,poi
84949,38,17,0,581,"Wer hat die Minijobs gesetzlich erleichtert? Wer hat mit Hartz IV ein Zwangssystem für Arbeitslose eingeführt, das die Menschen entsprechend der Maxime ""Jede Arbeit, jede billige Arbeit ist zumutbar""",Werner Dreibus,,data/txt/17038.txt,Werner Dreibus (DIE LINKE),linke,speech
84950,38,17,0,582,Ist auch richtig so!,Max Straubinger,,data/txt/17038.txt,Max Straubinger [CDU/CSU],cducsu,poi
84951,38,17,0,583,"in den Niedriglohnsektor zwingt und alle Beschäftigten einschüchtert? Wer? Auch wenn Sie heute nichts mehr davon wissen wollen: Es war die SPD zusammen mit den Grünen, und zwar unter Beifall und Zustimmung durch CDU/CSU und FDP.",Werner Dreibus,,data/txt/17038.txt,Werner Dreibus (DIE LINKE),linke,speech
84952,38,17,0,584,Mit denen wollt Ihr doch koalieren!,Dr. Matthias Zimmer,,data/txt/17038.txt,Dr. Matthias Zimmer [CDU/CSU],cducsu,poi
84953,38,17,0,585,"Es ist Ihre gemeinsame Politik, die dafür gesorgt hat, dass Millionen Menschen zu Niedriglöhnen schuften müssen, dass fast 8 Millionen Menschen in prekären Jobs stecken. Sie sind chancenlos, ohne Zukunft.",Werner Dreibus,,data/txt/17038.txt,Werner Dreibus (DIE LINKE),linke,speech
84954,38,17,0,586,Zuruf der Abg. Andrea Nahles [SPD],,,data/txt/17038.txt,,,poi
84955,38,17,0,587,"Wenn Sie wirklich glaubwürdig sein wollen, dann sollten Sie zu Ihrer gemeinsamen Verantwortung stehen.

Jeder hat das Recht, einen falschen Weg zu korrigieren. Deshalb freuen wir uns über diesen Antrag. Vielleicht wäre es aber besser, sich nicht nur bei der Überschrift an unserem Antrag zu orientieren. Denn Sie bleiben, wie so oft, auf halbem Weg stecken. Sie schreiben in Ihrem Antrag: Ein genereller gesetzlicher Mindestlohn könnte derzeit 8,50 Euro betragen. Die Betonung liegt auf ""könnte"".",Werner Dreibus,,data/txt/17038.txt,Werner Dreibus (DIE LINKE),linke,speech
84956,38,17,0,588,Vielleicht auch 10 Euro!,Gabriele Hiller-Ohm,,data/txt/17038.txt,Gabriele Hiller-Ohm [SPD],spd,poi
84957,38,17,0,589,"Er könnte nach Ihrem Antrag auch deutlich darunter liegen. Als Kriterien für die Höhe des Mindestlohnes nennen Sie lediglich, dass er Vollzeitbeschäftigten ein existenzsicherndes Einkommen und eine angemessene Teilhabe am gesellschaftlichen Leben ermöglichen soll. Könnte das, wenn ich auf Hartz IV blicke, heißen, dass der Mindestlohn einem Vollzeitbeschäftigten ein Leben ohne aufstockende Hartz-IV-Leistungen ermöglichen soll? Das würde bei einer 40-Stunden-Woche einem Mindestlohn von gerade einmal 7,12 Euro entsprechen. Wir müssten zumindest noch einmal darüber nachdenken, ob wir das wollen. Das reicht vielleicht Ihnen, aber nicht den Betroffenen.",Werner Dreibus,,data/txt/17038.txt,Werner Dreibus (DIE LINKE),linke,speech
84958,38,17,0,590,Beifall bei der LINKEN,,,data/txt/17038.txt,,,poi
84959,38,17,0,591,"Die Linke macht klare Vorgaben, an die sich eine Mindestlohnkommission, die auch wir wollen, orientieren muss. Wir wollen einen flächendeckenden gesetzlichen Mindestlohn, der noch in dieser Wahlperiode, also spätestens bis Herbst 2013, auf 10 Euro steigen soll.",Werner Dreibus,,data/txt/17038.txt,Werner Dreibus (DIE LINKE),linke,speech
84960,38,17,0,592,Und in der nächsten?,Frank Heinrich,,data/txt/17038.txt,Frank Heinrich [CDU/CSU],cducsu,poi
84961,38,17,0,593,"Damit liegt unser Vorschlag über der Niedriglohngrenze von 9,85 Euro. Diesen Wert haben nicht wir erfunden oder errechnet, er entspricht der Berechnung des Statistischen Bundesamtes auf Grundlage des von der OECD und der ILO angewandten Verfahrens zur Bestimmung der Niedriglohngrenze. Die Zahl wurde mir gerade heute in einer Antwort der Bundesregierung auf eine schriftliche Anfrage noch einmal ausdrücklich bestätigt: 9,85 Euro. Niedriglöhne darf es in Deutschland nicht mehr geben. Das sollte eines der großen Ziele dieser Legislaturperiode sein. Wer Vollzeit arbeitet, der muss davon wirklich leben können.",Werner Dreibus,,data/txt/17038.txt,Werner Dreibus (DIE LINKE),linke,speech
84962,38,17,0,594,Beifall bei der LINKEN,,,data/txt/17038.txt,,,poi
84963,38,17,0,595,"Mit dieser Forderung stehen wir nicht allein: 70 Pro-zent der Bundesbürger befürworten die Einführung eines gesetzlichen Mindestlohns. Meine Damen und Herren von SPD und Grünen, meine Damen und Herren von der Regierungskoalition, ich halte das für einen klaren Auftrag unserer Wählerinnen und Wähler, den wir im Sinne der Betroffenen endlich erfüllen sollten.",Werner Dreibus,,data/txt/17038.txt,Werner Dreibus (DIE LINKE),linke,speech
84964,38,17,0,596,Beifall bei der LINKEN,,,data/txt/17038.txt,,,poi
