id,sitzung,wahlperiode,in_writing,sequence,text,speaker_cleaned,speaker_fp,filename,speaker,speaker_party,type
84616,38,17,0,248,"Sie haben bisher auch nichts dagegen unternommen, dass weiterhin ein großer Teil dessen, was in dieser Wirtschaft erzeugt wird und an Wirtschaftsleistung erbracht wird, letztendlich auf den Finanzmärkten landet. Die Banken zocken; insofern haben Sie recht, wenn Sie sagen: Wir sind gut aufgestellt. Die Banken sind wahrlich gut aufgestellt. Herr Ackermann macht wieder seine Profite. Wenn wir nicht gegensteuern - das sage ich Ihnen -, beachten Sie eine Grundregel der Ökonomie überhaupt nicht. Das ist die VNKN-Regel, Herr Brüderle: Von nichts kommt nichts.",Klaus Ernst,,data/txt/17038.txt,Klaus Ernst (DIE LINKE),linke,speech
84617,38,17,0,249,Heiterkeit bei der LINKEN,,,data/txt/17038.txt,,,poi
84618,38,17,0,250,Diese Regel passt zu Ihnen!,Dr. Georg Nüßlein,,data/txt/17038.txt,Dr. Georg Nüßlein [CDU/CSU],cducsu,poi
84619,38,17,0,251,"Wenn man das Geld in die Finanzwelt abwandern lässt, wenn man nichts dagegen tut, dass die Banken, die Kredite billigst aufnehmen können, einem normalen Menschen aber 12 oder 13 Prozent Zinsen abverlangen, wenn er sein Konto überzieht, wenn Sie nichts dagegen tun, dass die Mittelständler, selbst wenn sie bei den Banken um Kredite betteln, keinen Kredit bekommen, weil die Banken mit dem Geld an den Finanzmärkten mehr verdienen können, als wenn sie es dem Mittelstand als Kredit geben, dann werden Sie Ihrer Aufgabe als Wirtschaftsminister nicht gerecht, Herr Brüderle.",Klaus Ernst,,data/txt/17038.txt,Klaus Ernst (DIE LINKE),linke,speech
84620,38,17,0,252,Beifall bei der LINKEN,,,data/txt/17038.txt,,,poi
84621,38,17,0,253,Von Tuten und Blasen keine Ahnung!,Ernst Hinsken,,data/txt/17038.txt,Ernst Hinsken [CDU/CSU],cducsu,poi
84622,38,17,0,254,"Jetzt sage ich Ihnen, was notwendig wäre, um das zu ändern.",Klaus Ernst,,data/txt/17038.txt,Klaus Ernst (DIE LINKE),linke,speech
84623,38,17,0,255,Jetzt sind wir gespannt!,Arnold Vaatz,,data/txt/17038.txt,Arnold Vaatz [CDU/CSU],cducsu,poi
84624,38,17,0,256,"- Ja. - Wir brauchen eine Stärkung der Binnennachfrage. Diese Stärkung der Binnennachfrage erreichen wir nur dadurch, dass wir uns das Erfolgsmodell Deutschland, das wir einmal hatten, zumindest in Gedanken tatsächlich wieder vor Augen führen.

Worin bestand das denn? - Leistung muss sich lohnen.",Klaus Ernst,,data/txt/17038.txt,Klaus Ernst (DIE LINKE),linke,speech
84625,38,17,0,257,Hört! Hört!,Dr. Georg Nüßlein,,data/txt/17038.txt,Dr. Georg Nüßlein [CDU/CSU],cducsu,poi
84626,38,17,0,258,"Es war selbstverständlich so, dass Produkte aus Deutschland ganz besonders gefragt wurden.

Worin lag die Ursache? - Wenn jemand bei uns in der Bundesrepublik mehr Geld verdienen und als Unternehmer innovativ sein wollte, dann musste er sich etwas einfallen lassen. Er musste darüber nachdenken, welche neuen Produkte er einführt und welche neuen Verfahren er möglicherweise praktiziert.",Klaus Ernst,,data/txt/17038.txt,Klaus Ernst (DIE LINKE),linke,speech
84627,38,17,0,259,Das gilt heute genauso!,Ernst Hinsken,,data/txt/17038.txt,Ernst Hinsken [CDU/CSU],cducsu,poi
84628,38,17,0,260,"Eines ging nämlich nicht: einfach die Löhne nach unten drücken oder die Arbeitszeiten verlängern. Das war entsprechend geregelt. Wenn Sie das aber nun vernachlässigen, dann heißt das in der Konsequenz: Erfolgreiche Innovationen sind nicht mehr gefragt, und es ist nicht notwendig, sich über neue Verfahren Gedanken zu machen, weil ein Unternehmer nun einfach die Löhne nach unten drücken oder die Arbeitszeiten verlängern kann.

Unser Erfolgsmodell Deutschland hing davon ab, dass es geregelte Arbeitsbeziehungen gab, aufgrund derer es nicht möglich war, mehr Geld zu verdienen, indem man die Leute mehr quälte. Diese Ebene haben Sie verlassen,",Klaus Ernst,,data/txt/17038.txt,Klaus Ernst (DIE LINKE),linke,speech
84629,38,17,0,261,Beifall bei der LINKEN,,,data/txt/17038.txt,,,poi
84630,38,17,0,262,Was erzählen Sie denn hier für einen Unsinn? Das gibt es doch überhaupt nicht!,Patrick Kurth,,data/txt/17038.txt,Patrick Kurth [Kyff-häuser] [FDP],fdp,poi
84631,38,17,0,263,"indem Sie zum Beispiel keine Regeln für Mindestlöhne aufstellen, indem Sie die Gewerkschaften massiv geschwächt haben, indem es nach wie vor kein vernünftiges Streikrecht gibt und indem Sie letztendlich flexible Arbeitsmärkte - es geht zum Beispiel um Leiharbeit, Befristungen und Ähnliches - nicht vernünftig regeln.

Deshalb sage ich Ihnen: Wenn Sie für all das jetzt nicht sorgen, dann bereiten Sie jetzt die nächste Krise vor. Wenn Sie sich weigern, Regelungen dafür zu treffen, dass das Geld in die Realwirtschaft fließt und nicht in die Finanzmärkte abwandert, dann bereiten Sie die nächste Krise vor.

Herr Brüderle, es kann ja sein, dass Sie Ihre Brüderles in den Banken und Ihre Brüderles bei den Hoteliers damit möglicherweise gut bedenken,",Klaus Ernst,,data/txt/17038.txt,Klaus Ernst (DIE LINKE),linke,speech
84632,38,17,0,264,"Das ist doch nicht Ihr Ernst, Herr Ernst!",Patrick Kurth,,data/txt/17038.txt,Patrick Kurth [Kyffhäuser] [FDP],fdp,poi
84633,38,17,0,265,"aber ich kann Ihnen sagen: Es ist nicht akzeptabel, dass Sie sich kurz vor einer Wahl in Nordrhein-Westfalen hier hinstellen und Steuergeschenke verteilen, die letztendlich auf einer neuen Rechenart beruhen; denn es ist ja eigentlich nicht möglich, bei sinkenden Einnahmen mehr Geld auszugeben. Wenn Sie so verfahren, sagen Sie den Bürgern dieser Republik und insbesondere denen in Nordrhein-Westfalen nicht die Wahrheit. Die Wahrheit werden Sie aber präsentieren müssen, spätestens dann, wenn der Finanzminister wieder da ist. Er wird Ihnen nämlich vorrechnen, dass man Geld nur dann ausgeben kann, wenn man es hat. Er ist nämlich Schwabe, Herr Brüderle, und nicht aus der Pfalz.",Klaus Ernst,,data/txt/17038.txt,Klaus Ernst (DIE LINKE),linke,speech
84634,38,17,0,266,Beifall bei Abgeordneten der LINKEN,,,data/txt/17038.txt,,,poi
84635,38,17,0,267,"Damit komme ich zum Schluss. Ich finde es absolut inakzeptabel, dass, wenn wir hier Vorschläge machen, permanent die Rede davon ist, die Linke würde Luftnummern verbreiten und könne nicht rechnen. Herr Brüderle, das, was Sie hier vorgelegt haben, ist nichts anderes als eine Luftnummer. Ich kann Ihnen sagen: Die Bürger werden das merken. Deshalb liegen auch Ihre Umfragewerte im Keller.

Ich danke fürs Zuhören.",Klaus Ernst,,data/txt/17038.txt,Klaus Ernst (DIE LINKE),linke,speech
84636,38,17,0,268,Beifall bei der LINKEN,,,data/txt/17038.txt,,,poi
84637,38,17,0,269,Eine Rede voller Widersprüche!,Ernst Hinsken,,data/txt/17038.txt,Ernst Hinsken [CDU/CSU],cducsu,poi
84638,38,17,0,270,Ihre Rede war eine Luftnummer!,Patrick Kurth,,data/txt/17038.txt,Patrick Kurth [Kyffhäuser] [FDP],fdp,poi
84639,38,17,0,271,,Klaus Ernst,,data/txt/17038.txt,Klaus Ernst (DIE LINKE),linke,speech
84640,38,17,0,272,Das Wort hat nun der Kollege Dr. Heinrich Kolb für die FDP-Fraktion.,Dr. Norbert Lammert,,data/txt/17038.txt,Präsident Dr. Norbert Lammert,,chair
84641,38,17,0,273,Beifall bei der FDP,,,data/txt/17038.txt,,,poi
84642,38,17,0,274,,Dr. Norbert Lammert,,data/txt/17038.txt,Präsident Dr. Norbert Lammert,,chair
84643,38,17,0,275,"Herr Präsident! Liebe Kolleginnen und Kollegen! Ich möchte mit einer Anmerkung zu der Rede von Herrn Steinmeier beginnen.

Herr Steinmeier, ich habe mit Interesse gehört - das ist ja ausdrücklich zu begrüßen -, dass Sie regelmäßig Besuche in Betrieben durchführen",Dr. Heinrich L. Kolb,,data/txt/17038.txt,Dr. Heinrich L. Kolb (FDP),fdp,speech
84644,38,17,0,276,Nicht so von oben herab!,Dr. Frank-Walter Steinmeier,,data/txt/17038.txt,Dr. Frank-Walter Steinmeier [SPD],spd,poi
84645,38,17,0,277,"und sich anhören, wo die Unternehmen der Schuh drückt. Ich habe nur den Eindruck, Herr Steinmeier, dass hier gilt - dabei kommt mir ein altes Wortspiel in den Sinn -: Gehört ist nicht verstanden.",Dr. Heinrich L. Kolb,,data/txt/17038.txt,Dr. Heinrich L. Kolb (FDP),fdp,speech
84646,38,17,0,278,"Das stimmt, Herr Kolb, darunter leiden Sie schon lange!",Dr. Frank-Walter Steinmeier,,data/txt/17038.txt,Dr. Frank-Walter Steinmeier [SPD],spd,poi
84647,38,17,0,279,Wann waren Sie denn das letzte Mal im Betrieb?,Hubertus Heil,,data/txt/17038.txt,Hubertus Heil [Peine] [SPD],spd,poi
84648,38,17,0,280,"Wenn Sie nämlich das, was Sie in den Betrieben gehört haben, tatsächlich verstanden hätten, Herr Steinmeier, dann müssten Sie die Arbeiten an der Neuausrichtung Ihrer Wirtschaftspolitik sofort stoppen - das wäre konsequent, Herr Steinmeier -",Dr. Heinrich L. Kolb,,data/txt/17038.txt,Dr. Heinrich L. Kolb (FDP),fdp,speech
84649,38,17,0,281,Beifall bei der FDP sowie bei Abgeordneten der CDU/CSU,,,data/txt/17038.txt,,,poi
84650,38,17,0,282,Das habe ich jetzt wirklich nicht verstanden!,Dr. Frank-Walter Steinmeier,,data/txt/17038.txt,Dr. Frank-Walter Steinmeier [SPD],spd,poi
84651,38,17,0,283,"und dann müssten Sie die fortschreitende Abkehr Ihrer Partei und ihrer Fraktion von der Agenda 2010,",Dr. Heinrich L. Kolb,,data/txt/17038.txt,Dr. Heinrich L. Kolb (FDP),fdp,speech
84652,38,17,0,284,"Ja, ja, ja!",Dr. Frank-Walter Steinmeier,,data/txt/17038.txt,Dr. Frank-Walter Steinmeier [SPD],spd,poi
84653,38,17,0,285,"Reden Sie einmal mit der Wirtschaft darüber, was sie über die Ihre denkt!",Hubertus Heil,,data/txt/17038.txt,Hubertus Heil [Peine] [SPD],spd,poi
84654,38,17,0,286,"deren Architekt Sie im Bundeskanzleramt ja gewesen sind, unverzüglich aufhalten. Genau dies tun Sie aber nicht. Deswegen klaffen bei Ihnen Reden und Handeln auseinander.",Dr. Heinrich L. Kolb,,data/txt/17038.txt,Dr. Heinrich L. Kolb (FDP),fdp,speech
84655,38,17,0,287,Beifall bei der FDP,,,data/txt/17038.txt,,,poi
84656,38,17,0,288,"Wer keine Linie hat, kann sie nicht verlassen!",Dr. Frank-Walter Steinmeier,,data/txt/17038.txt,Dr. Frank-Walter Steinmeier [SPD],spd,poi
84657,38,17,0,289,Das sagt einer von der FDP!,Hubertus Heil,,data/txt/17038.txt,Hubertus Heil [Peine] [SPD],spd,poi
84658,38,17,0,290,"Meine Damen und Herren, für eine Wirtschaftspolitik für Wachstum und Arbeitsplätze müssen wir, wie ich glaube - das ist aus dem bisherigen Verlauf der Debatte auch schon deutlich geworden -, Zweierlei tun. Wir müssen zum einen unser erfolgreiches Krisenmanagement fortsetzen.",Dr. Heinrich L. Kolb,,data/txt/17038.txt,Dr. Heinrich L. Kolb (FDP),fdp,speech
84659,38,17,0,291,Wieso Ihr Krisenmanagement?,Hubertus Heil,,data/txt/17038.txt,Hubertus Heil [Peine] [SPD],spd,poi
84660,38,17,0,292,"Zum anderen müssen wir die Voraussetzungen für ein möglichst starkes Wachstum schaffen, damit sich die Perspektiven für die Unternehmen, die auch für das Niveau der Beschäftigung in unserem Lande von entscheidender Bedeutung sind, möglichst schnell wieder verbessern.

Ich will mit dem ersten Punkt, dem Krisenmanagement, beginnen und dabei auf das zentrale Instrument des Kurzarbeitergeldes zu sprechen kommen. Es war und bleibt das wichtigste Instrument in der Krise.",Dr. Heinrich L. Kolb,,data/txt/17038.txt,Dr. Heinrich L. Kolb (FDP),fdp,speech
84661,38,17,0,293,Danken Sie Olaf Scholz doch mal dafür!,Hubertus Heil,,data/txt/17038.txt,Hubertus Heil [Peine] [SPD],spd,poi
84662,38,17,0,294,"- Nein, die Kurzarbeit steht schon ewig im Gesetz.",Dr. Heinrich L. Kolb,,data/txt/17038.txt,Dr. Heinrich L. Kolb (FDP),fdp,speech
84663,38,17,0,295,Olaf Scholz hat es verbessert! Sie haben es verschlechtert!,Hubertus Heil,,data/txt/17038.txt,Hubertus Heil [Peine] [SPD],spd,poi
84664,38,17,0,296,"Sie haben es genutzt, wie es andere Regierungen in dieser Situation auch getan hätten. Aber Sie haben es nicht hundertprozentig richtig ausgestaltet, Herr Heil. Deswegen war es wichtig - darauf hat unsere Fraktion gedrungen -, dass wir bei der Verlängerung der Erstattungsmöglichkeiten beim Kurzarbeitergeld Veränderungen vorgenommen haben. Ich hielt es für falsch, als Sie damals beschlossen haben, die Konzernklausel in das Kurzarbeitergesetz aufzunehmen, nach der, wenn in einem Betrieb eines Arbeitgebers mindestens sechs Monate Kurzarbeit durchgeführt wurde, alle Betriebe dieses Arbeitgebers ab dem ersten Tag die Möglichkeit erhielten, eine hundertprozentige Beitragserstattung zu bekommen. Das war aus meiner Sicht - ich habe das damals deutlich gesagt und wiederhole es jetzt noch einmal - für die großen Unternehmen eine Lizenz zum Ausplündern der Kasse der Bundesagentur in Nürnberg.",Dr. Heinrich L. Kolb,,data/txt/17038.txt,Dr. Heinrich L. Kolb (FDP),fdp,speech
84665,38,17,0,297,Die hatten auch große Probleme!,Hubertus Heil,,data/txt/17038.txt,Hubertus Heil [Peine] [SPD],spd,poi
84666,38,17,0,298,Dies haben wir korrigiert. Das war für uns wichtig.,Dr. Heinrich L. Kolb,,data/txt/17038.txt,Dr. Heinrich L. Kolb (FDP),fdp,speech
84667,38,17,0,299,Keine Ahnung von der Industrie!,Hubertus Heil,,data/txt/17038.txt,Hubertus Heil [Peine] [SPD],spd,poi
84668,38,17,0,300,"Jetzt gilt wieder die arbeitgeberbezogene Ausrichtung. Ein Unternehmen, in dem Kurzarbeit durchgeführt wurde, hat ab dem siebten Monat die Möglichkeit, für die Arbeitnehmer dieses Unternehmens zu 100 Prozent die Beitragserstattung zu bekommen. Das halte ich für richtig und angemessen.",Dr. Heinrich L. Kolb,,data/txt/17038.txt,Dr. Heinrich L. Kolb (FDP),fdp,speech
84669,38,17,0,301,Beifall bei der FDP,,,data/txt/17038.txt,,,poi
84670,38,17,0,302,"Für uns war auch wichtig, Herr Heil - das ist der zweite Punkt -, dass die Förderung tariflicher Kurzarbeit durch Beitragsmittel, die man avisiert hatte und die auch schon im Tarifabschluss im Metallbereich angelegt war, für die Zukunft ausgeschlossen wird.",Dr. Heinrich L. Kolb,,data/txt/17038.txt,Dr. Heinrich L. Kolb (FDP),fdp,speech
84671,38,17,0,303,"Gut, dass Sie es noch einmal sagen!",Hubertus Heil,,data/txt/17038.txt,Hubertus Heil [Peine] [SPD],spd,poi
84672,38,17,0,304,"Das wollen wir ausdrücklich nicht. Denn es kann nicht sein, dass es eine Tarifpolitik zulasten der Beitragszahler gibt.",Dr. Heinrich L. Kolb,,data/txt/17038.txt,Dr. Heinrich L. Kolb (FDP),fdp,speech
84673,38,17,0,305,"Für Arbeit ist das, nicht zulasten!",Hubertus Heil,,data/txt/17038.txt,Hubertus Heil [Peine] [SPD],spd,poi
84674,38,17,0,306,Das werden wir nicht mitmachen.,Dr. Heinrich L. Kolb,,data/txt/17038.txt,Dr. Heinrich L. Kolb (FDP),fdp,speech
84675,38,17,0,307,Beifall bei der FDP,,,data/txt/17038.txt,,,poi
84676,38,17,0,308,"Das Instrument der Kurzarbeit ist also wichtig. Es muss nachgesteuert werden. Das tun wir. Missbrauch befürchte ich nicht. Das will ich deutlich sagen; denn dafür ist das Instrument der Kurzarbeit für die Unternehmen zu teuer. Zwei Drittel der Kosten werden von den Arbeitnehmern und den Arbeitgebern, also den Unternehmen, getragen. Das ist per se ein, wie ich denke, wirksamer Schutz gegen Missbrauch.

Für uns ist auch wichtig, dass es künftig bei Qualifizierungsmaßnahmen die Möglichkeit der hundertprozentigen Erstattung gibt. Diese Entscheidung haben wir sehr bewusst getroffen, weil wir die Wichtigkeit von Bildung und Weiterbildung im Berufsleben anerkennen und dies ausdrücklich fördern wollen.",Dr. Heinrich L. Kolb,,data/txt/17038.txt,Dr. Heinrich L. Kolb (FDP),fdp,speech
84677,38,17,0,309,Beifall bei Abgeordneten der FDP,,,data/txt/17038.txt,,,poi
84678,38,17,0,310,"Es gibt jetzt eine Exit-Strategie. Das ist wichtig. Das Ende der Krise rückt in den Blick. Das Licht am Ende des Tunnels wird sichtbar. Deswegen haben wir keine vollständige Synchronisierung der Bezugsfristen und der Erstattungsmöglichkeit vorgenommen, sondern die Erstattungsmöglichkeit nur bis zum Frühjahr 2012 verlängert. Danach gibt es selbstverständlich weiterhin Kurzarbeit, aber keine Beitragserstattung mehr. Diese Übergangslösung verhindert, dass es fallbeilartig zu einem Ende der Kurzarbeit kommt. Stattdessen wird sich die Förderung langsam ausschleichen. Das wird helfen, Brüche am Arbeitsmarkt zu verhindern.

Mein Kollege Vogel wird noch Weiteres zum Beschäftigungschancengesetz vortragen. Ich will zum Schluss meiner Ausführungen festhalten, dass wir unser Augenmerk jetzt auf die Anstrengungen zur wirtschaftlichen Erholung richten müssen.

Wir brauchen selbstverständlich weiterhin Steuersenkungen. Das Thema steht auf der Agenda. Arbeit muss sich lohnen. Wir brauchen Entbürokratisierung und auch Steuervereinfachung, Herr Kollege Ernst. Wir brauchen, um die Anregung der Ministerin aufzunehmen, eine moderne Form der Zuwanderung von qualifizierten Arbeitnehmern in unsere Volkswirtschaft. Das ist sehr wichtig.

Ich glaube, wenn wir den Weg fortsetzen, den wir in den letzten Monaten eingeschlagen haben, dann haben wir die besten Voraussetzungen dafür, dass die Unternehmen, nachdem sie in der Krise die Segel nach unten geholt haben, diese baldmöglichst wieder hochziehen können, damit der entstehende Wind die Segel füllt und die Schiffe wieder Fahrt aufnehmen.",Dr. Heinrich L. Kolb,,data/txt/17038.txt,Dr. Heinrich L. Kolb (FDP),fdp,speech
84679,38,17,0,311,Und Sie sind der Windbeutel!,Dr. Frank-Walter Steinmeier,,data/txt/17038.txt,Dr. Frank-Walter Steinmeier [SPD],spd,poi
84680,38,17,0,312,"In diesem Sinne, Herr Steinmeier - ich sehe durchaus konstruktive Beiträge, die Ihre Fraktion geleistet hat, ausdrücklich auch bei dem Thema Orga-Reform, das die Ministerin angesprochen hat; ich habe auch die Zusammenarbeit mit Ihrem Kollegen Heil in diesem Punkt als sehr angenehm empfunden -, wünsche ich Ihnen und uns Mut, Tatkraft, Weitsicht, Fingerspitzengefühl und das nötige Verständnis für die aktuellen Herausforderungen.

Ich bedanke mich für Ihre Aufmerksamkeit.",Dr. Heinrich L. Kolb,,data/txt/17038.txt,Dr. Heinrich L. Kolb (FDP),fdp,speech
84681,38,17,0,313,Beifall bei der FDP und der CDU/CSU,,,data/txt/17038.txt,,,poi
84682,38,17,0,314,,Dr. Heinrich L. Kolb,,data/txt/17038.txt,Dr. Heinrich L. Kolb (FDP),fdp,speech
84683,38,17,0,315,Das Wort erhält der Kollege Fritz Kuhn für die Fraktion Bündnis 90/Die Grünen.,Dr. Norbert Lammert,,data/txt/17038.txt,Präsident Dr. Norbert Lammert,,chair
84684,38,17,0,316,"Sehr geehrter Herr Präsident! Liebe Kolleginnen und Kollegen! Nachdem ich mir die bisher geführte Debatte angehört habe, frage ich mich schon, wie die Bundesregierung eigentlich aufgestellt ist. Ich mache das einmal an der Verlängerung des Kurzarbeitergeldes deutlich.",Fritz Kuhn,,data/txt/17038.txt,Fritz Kuhn (BÜNDNIS 90/DIE GRÜNEN),gruene,speech
84685,38,17,0,317,Wo ist eigentlich Frau von der Leyen?,Renate Künast,,data/txt/17038.txt,Renate Künast [BÜNDNIS 90/DIE GRÜNEN],gruene,poi
84686,38,17,0,318,"Natürlich kann man das Kurzarbeitergeld verlängern. Eine Verlängerung bis zum März 2012 ist aber doch ein Zeichen dafür, dass man die wirtschaftspolitische Situation für fragil hält; denn sonst würde man nicht einen so langen Zeitraum wählen. Wenn dies der Fall ist, kann man nicht, wie Herr Minister Brüderle es am Mittwoch und auch in seiner heutigen Rede getan hat, in eine Grundsatzeuphorie nach dem Muster ""Alles ist schon geregelt"" ausbrechen. Entweder das eine oder das andere! An diesem Prozedere erkennen Sie, dass die Regierung insgesamt keinen gemeinsamen Nenner bei der Krisendeutung hat.

Frau von der Leyen - -",Fritz Kuhn,,data/txt/17038.txt,Fritz Kuhn (BÜNDNIS 90/DIE GRÜNEN),gruene,speech
84687,38,17,0,319,Vielleicht könnte die einmal zuhören!,Renate Künast,,data/txt/17038.txt,Renate Künast [BÜNDNIS 90/DIE GRÜNEN],gruene,poi
84688,38,17,0,320,Widerspruch von der CDU/CSU,,,data/txt/17038.txt,,,poi
84689,38,17,0,321,,Fritz Kuhn,,data/txt/17038.txt,Fritz Kuhn (BÜNDNIS 90/DIE GRÜNEN),gruene,speech
84690,38,17,0,322,"Da sich die Ministerin gerade um eine Kollegin gekümmert hat, der unwohl war, sollten wir an dieser Stelle nun wirklich keine unnötige Spekulation anstellen.",Dr. Norbert Lammert,,data/txt/17038.txt,Präsident Dr. Norbert Lammert,,chair
84691,38,17,0,323,"Frau von der Leyen, Ihre eben gehaltene Rede war für mich kein argumentativer Höhepunkt. Ich will Ihnen auch sagen, warum. Sie sprechen bei der vom Bundesverfassungsgericht erzwungenen Reform der Jobcenter von einer ""Allianz der Vernünftigen"". Das können Sie seriöserweise nicht tun, nachdem die CDU - das weiß die gesamte Öffentlichkeit - jahrelang die Reform der Jobcenter verhindert hat.",Fritz Kuhn,,data/txt/17038.txt,Fritz Kuhn (BÜNDNIS 90/DIE GRÜNEN),gruene,speech
84692,38,17,0,324,Beifall beim BÜNDNIS 90/DIE GRÜNEN und bei der SPD,,,data/txt/17038.txt,,,poi
84693,38,17,0,325,"Das ist einfach nicht redlich. Meines Erachtens ist es eigentlich auch unter Ihrer Würde, hier mit solchen Zaubertricks zu argumentieren.

Die Verlängerung der Kurzarbeiterregelung ist okay. Ich bitte Sie aber, mehr Initiativen zu ergreifen, damit die Möglichkeiten zur Qualifizierung, die die Kurzarbeit bietet - die in der Quote heute nur bei 10 Prozent liegt -, ausgeschöpft werden. Dafür gibt es auch einen wirtschaftspolitischen Grund. Wir haben nämlich nicht nur Konjunkturkrise, sondern auch Strukturkrise.",Fritz Kuhn,,data/txt/17038.txt,Fritz Kuhn (BÜNDNIS 90/DIE GRÜNEN),gruene,speech
84694,38,17,0,326,Wir haben auch eine Weiterbildungskrise!,Ute Kumpf,,data/txt/17038.txt,Ute Kumpf [SPD],spd,poi
84695,38,17,0,327,"Ein Merkmal der Überwindung einer Strukturkrise ist, dass Sie innerbetrieblich umsteuern und die Weiterbildung vorantreiben. Das wäre der entscheidende Punkt; das erwarten wir von einer Arbeitsministerin an dieser Stelle auch.",Fritz Kuhn,,data/txt/17038.txt,Fritz Kuhn (BÜNDNIS 90/DIE GRÜNEN),gruene,speech
84696,38,17,0,328,Beifall beim BÜNDNIS 90/DIE GRÜNEN sowie bei Abgeordneten der SPD,,,data/txt/17038.txt,,,poi
84697,38,17,0,329,"Frau von der Leyen, viel Neues haben Sie nicht vorgelegt. Vieles von dem, was Sie zum Beispiel in Bezug auf die Jugendlichen vorschlagen, ist bereits Gesetz. Eines ist mir aber wichtig: Wenn Sie etwas für die Alleinerziehenden tun wollen und deren Arbeitsfähigkeit und die Kinderbetreuungsmöglichkeiten verbessern wollen, dann tragen Sie dazu bei, dass man die Kommunen in ihrer finanziellen Basis nicht weiter ausbluten lässt.",Fritz Kuhn,,data/txt/17038.txt,Fritz Kuhn (BÜNDNIS 90/DIE GRÜNEN),gruene,speech
84698,38,17,0,330,Beifall beim BÜNDNIS 90/DIE GRÜNEN und bei der SPD,,,data/txt/17038.txt,,,poi
84699,38,17,0,331,"Wenn sie Schulden und kein Geld haben, können sie die Kinderbetreuung nämlich nicht verbessern. Da können Sie Tagesmütter durch die Bundesagentur schulen lassen, soviel Sie wollen.

Meine weitere Bitte an Sie lautet: Wir müssen aufpassen, dass in den nächsten Jahren neue Arbeitsplätze in Deutschland nicht weiterhin in Form prekärer Arbeitsverhältnisse ausgestaltet werden. Vielmehr brauchen wir vernünftige Vollerwerbsarbeitsplätze. Wenn ich höre, dass Sie nach der Wahl die Weiterbeschäftigung auf befristeten Arbeitsplätzen in Form von Kettenverträgen erleichtern wollen, kann ich nur sagen: Das ist die falsche Politik. Wir müssen dazu kommen, dass nicht mehr Sicherheit in Unsicherheit verwandelt wird, sondern dass auf dem Arbeitsmarkt Unsicherheit zunehmend in Sicherheit verwandelt wird. Das schafft nämlich Vertrauen bei den Bürgerinnen und Bürgern sowie bei der Wirtschaft.",Fritz Kuhn,,data/txt/17038.txt,Fritz Kuhn (BÜNDNIS 90/DIE GRÜNEN),gruene,speech
84700,38,17,0,332,Beifall beim BÜNDNIS 90/DIE GRÜNEN,,,data/txt/17038.txt,,,poi
84701,38,17,0,333,"Herr Brüderle, als ich Ihre Ausführungen am Mittwoch gehört habe, habe ich mich schon gefragt, was denn in Sie gefahren ist. Angesichts Ihrer ""Wachstumsbesoffenheit"" müssten Sie eigentlich in die Ausnüchterungszelle. Die von Ihnen vorgelegten Zahlen geben das nämlich nicht her. Sie sprechen jetzt von einem Wirtschaftswachstum von 1,4 Prozent im Jahr 2010 und 1,6 Prozent im Jahr 2011. Daraus leiten Sie ab, dass Geld ohne Ende in der Kasse ist, ignorieren aber, dass in der Haushaltsplanung des Bundes für die Jahre 2011 ff. 2 Prozent Wachstum angesetzt sind. Diese Nummer, es sei genügend Geld für Ihre Steuersenkungspläne vorhanden, können Sie nicht seriös verkaufen. Die können Sie sich wirklich abschminken.",Fritz Kuhn,,data/txt/17038.txt,Fritz Kuhn (BÜNDNIS 90/DIE GRÜNEN),gruene,speech
84702,38,17,0,334,Beifall beim BÜNDNIS 90/DIE GRÜNEN,,,data/txt/17038.txt,,,poi
84703,38,17,0,335,"Sie agieren wie jemand, der kaum Geld und darüber hinaus noch Schulden hat, aber bei der Sparkasse Geld leihen will, weil er ein Haus für 1 Million Euro kaufen will, und dann, wenn die Sparkasse dafür keinen Kredit gibt, sagt: Dann nehme ich eben eines für 500 000 Euro. - Das ist doch absoluter Unsinn. So kann man nicht agieren. Wer die Steuern nicht um 35 Milliarden Euro senken kann, der hat auch keinen Spielraum für eine Steuersenkung von 16 Milliarden Euro, die Sie in Ihrem jüngsten Fünfstufentarif vorgeschlagen haben.",Fritz Kuhn,,data/txt/17038.txt,Fritz Kuhn (BÜNDNIS 90/DIE GRÜNEN),gruene,speech
84704,38,17,0,336,Beifall beim BÜNDNIS 90/DIE GRÜNEN und bei der SPD,,,data/txt/17038.txt,,,poi
84705,38,17,0,337,Das ist nicht logisch!,Dr. Georg Nüßlein,,data/txt/17038.txt,Dr. Georg Nüßlein [CDU/ CSU],cducsu,poi
