id,sitzung,wahlperiode,in_writing,sequence,text,speaker_cleaned,speaker_fp,filename,speaker,speaker_party,type
91324,42,17,0,507,"Wir wollen natürlich auch, dass die Bürgerinnen und Bürger in unserem Land wissen, dass nicht ausschließlich der Staat und die Steuerzahler mit Bürgschaften für die Stabilität eintreten, sondern auch diejenigen an den Kosten beteiligt werden, die als Spekulanten mit dazu beigetragen haben, dass die Situation so schwierig geworden ist. Deshalb sagen wir: Wir fordern die Bundesregierung auf, dass sie europaweit, am besten global eine Finanzmarktsteuer einführt. Wir sagen: Die Transaktionsteuer oder die Finanzaktivitätsteuer, eine von beiden muss neben der von uns bereits beschlossenen Bankenabgabe kommen.",Volker Kauder,,data/txt/17042.txt,Volker Kauder (CDU/CSU),cducsu,speech
91325,42,17,0,508,Welche?,Mechthild Rawert,,data/txt/17042.txt,Mechthild Rawert [SPD],spd,poi
91326,42,17,0,509,Welche denn nun?,Jürgen Trittin,,data/txt/17042.txt,Jürgen Trittin [BÜNDNIS 90/DIE GRÜNEN],gruene,poi
91327,42,17,0,510,"Herr Kollege Steinmeier, die Bundeskanzlerin hat an diesem Rednerpult ausdrücklich gesagt, dass sie sich dafür einsetzen wird, dass dieses auch so geschieht, der Bundesfinanzminister hat das ebenfalls zugesagt. Die Bundesregierung hat eine klare Zusage gemacht; dafür sagen wir herzlichen Dank.",Volker Kauder,,data/txt/17042.txt,Volker Kauder (CDU/CSU),cducsu,speech
91328,42,17,0,511,Beifall bei der CDU/CSU sowie bei Abgeordneten der FDP,,,data/txt/17042.txt,,,poi
91329,42,17,0,512,"Meine sehr verehrten Damen und Herren, wir dürfen aber nicht übersehen - ich glaube, da sind wir uns alle einig -, dass die Ursache für diese schwierige Situation nicht die Spekulanten sind. Aber die Spekulanten haben an der Schraube gedreht. Deswegen müssen auch sie herangezogen werden, deswegen brauchen wir Kontrollen, deswegen muss die Regulierung bei Hedgefonds intensiver und dichter werden als bisher. Man kann Wolfgang Schäuble nur dafür danken, dass es gelungen ist, über das Votum der Briten hinweg zu erreichen, dass auch Hedgefonds reguliert werden. Das ist ein großartiger Erfolg.",Volker Kauder,,data/txt/17042.txt,Volker Kauder (CDU/CSU),cducsu,speech
91330,42,17,0,513,Beifall bei Abgeordneten der CDU/CSU und der FDP,,,data/txt/17042.txt,,,poi
91331,42,17,0,514,"Es ist auch richtig - und zeigt im Übrigen die Handlungsfähigkeit dieser Regierung -, dass die Leerverkäufe seit Mitternacht verboten sind und damit ein Teil der Spekulationsmöglichkeiten abgeschafft worden ist. Diese Regierung und diese Koalition handeln, sie machen genau das, was in der konkreten Situation richtig und möglich ist.",Volker Kauder,,data/txt/17042.txt,Volker Kauder (CDU/CSU),cducsu,speech
91332,42,17,0,515,Beifall bei Abgeordneten der CDU/CSU und der FDP,,,data/txt/17042.txt,,,poi
91333,42,17,0,516,"Die Bundeskanzlerin hat zu Recht darauf hingewiesen, dass wir mit diesen ganzen Maßnahmen, die von den Summen her nicht nur den Menschen in diesem Land, sondern auch uns gigantisch erscheinen, nur dann Erfolg haben werden, wenn wir das Übel an der Wurzel packen: Das ist die hohe Staatsverschuldung, die wir überall haben.",Volker Kauder,,data/txt/17042.txt,Volker Kauder (CDU/CSU),cducsu,speech
91334,42,17,0,517,Beifall bei Abgeordneten der CDU/CSU,,,data/txt/17042.txt,,,poi
91335,42,17,0,518,"Auch wir in der Bundesrepublik Deutschland haben mit der Neuverschuldung von über 80 Milliarden Euro, die wir in diesem Jahr zu verantworten haben, ein schweres Paket zu tragen. Aber, liebe Kolleginnen und Kollegen, wir wissen doch alle, warum wir das getan haben: Wir mussten Schutzschirme für die Sparerinnen und Sparer, für die Arbeitnehmerinnen und Arbeitnehmer und für die mittelständische Wirtschaft aufspannen. Ich kann nur sagen: Am Aufspannen dieser Schutzschirme war die SPD in der Großen Koalition beteiligt. Die neue Koalition hat richtige Maßnahmen ergriffen und fortgeführt. Wir haben dadurch verhindert, dass aus Kurzarbeit Arbeitslosigkeit wird. Wir sind besser durch die Krise gekommen als viele andere in Europa. Dafür hat sich der Einsatz dieser Mittel gelohnt.",Volker Kauder,,data/txt/17042.txt,Volker Kauder (CDU/CSU),cducsu,speech
91336,42,17,0,519,Beifall bei der CDU/CSU und der FDP,,,data/txt/17042.txt,,,poi
91337,42,17,0,520,"Jetzt geht es darum, die Konsolidierung durchzuführen. Das wird kein einfacher Weg. Wir müssen den Menschen sagen, dass wir für die Zukunftsfähigkeit unseres Landes, für die Zukunft der jungen Generation die Konsolidierung durchführen müssen. Die Botschaft muss sein - auch an viele draußen in der Welt, die uns manches gar nicht mehr zutrauen -, dass wir es organisieren können und werden, dass auch in einer älter werdenden Gesellschaft jugendliche Dynamik steckt. Das muss erreicht werden.",Volker Kauder,,data/txt/17042.txt,Volker Kauder (CDU/CSU),cducsu,speech
91338,42,17,0,521,Beifall bei Abgeordneten der CDU/CSU,,,data/txt/17042.txt,,,poi
91339,42,17,0,522,"Deswegen bleiben Forschung, Bildung und Innovation trotz Konsolidierung des Haushalts zentrale Themen.",Volker Kauder,,data/txt/17042.txt,Volker Kauder (CDU/CSU),cducsu,speech
91340,42,17,0,523,Beifall bei der CDU/CSU sowie bei Abgeordneten der FDP,,,data/txt/17042.txt,,,poi
91341,42,17,0,524,"Wir werden im weltweiten Wettbewerb getrieben von Staaten wie China und Indien. Diesen Wettbewerb werden wir bestehen. Wir brauchen dazu eine qualifiziert ausgebildete junge Generation. Wir brauchen dazu jeden, der in diesem Land lebt. Deswegen geht es bei Bildung auch um Integration. Wir haben in der Integration noch nicht das erreicht, was notwendig ist; aber wir werden dies mit unseren Maßnahmen für Bildung, Innovation und Forschung vorantreiben.",Volker Kauder,,data/txt/17042.txt,Volker Kauder (CDU/CSU),cducsu,speech
91342,42,17,0,525,Was sagt Herr Koch dazu?,Jürgen Trittin,,data/txt/17042.txt,Jürgen Trittin [BÜNDNIS 90/DIE GRÜNEN],gruene,poi
91343,42,17,0,526,"Durch die Entscheidung, die wir in dieser Woche fällen, wird viel über die Zukunftsfähigkeit in diesem Land ausgesagt werden. Wir wissen, dass diese für uns alle nicht einfach ist, und wir wissen, dass wir den Bürgerinnen und Bürgern auch erklären müssen, warum wir so handeln. Wir können das erklären: Es geht um die Stabilität unserer Währung, unserer Grundlage und unserer Zukunft und auch um den Erhalt Europas.

Ich gehöre einer Generation an, die nach einem grässlichen Krieg und einer verbrecherischen Diktatur in Deutschland zum ersten Mal in Frieden aufwachsen durfte. Ich habe allen Grund, diesem Europa jenseits von Angebot und Nachfrage, jenseits von Cent und Euro, Dank dafür zu sagen, dass dieses Europa die größte Friedenssicherung nach dem Zweiten Weltkrieg geworden ist.",Volker Kauder,,data/txt/17042.txt,Volker Kauder (CDU/CSU),cducsu,speech
91344,42,17,0,527,Beifall bei der CDU/CSU und der FDP,,,data/txt/17042.txt,,,poi
91345,42,17,0,528,"Deshalb sollten wir alle miteinander Interesse daran haben, dieses Europa trotz der Schwierigkeiten, die wir jetzt überwinden müssen, in eine gute Zukunft zu führen.

Es mag banal klingen, aber trotzdem ist es eine ganz einfache Aussage: Jede Generation ist in eine bestimmte Aufgabe hineingestellt. - Wir haben jetzt die Aufgabe, den Euro zu stabilisieren und zu retten und die Zukunft Europas zu gestalten. An der Bewältigung dieser Aufgabe sollten wir alle in diesem Haus uns beteiligen.",Volker Kauder,,data/txt/17042.txt,Volker Kauder (CDU/CSU),cducsu,speech
91346,42,17,0,529,Beifall bei der CDU/CSU und der FDP,,,data/txt/17042.txt,,,poi
91347,42,17,0,530,Eine Rede der Verlegenheit! Ausdruck der Verlegenheit und Unklarheit in dieser Koalition! Keine konkreten Angebote!,Joachim Poß,,data/txt/17042.txt,Joachim Poß [SPD],spd,poi
91348,42,17,0,531,,Volker Kauder,,data/txt/17042.txt,Volker Kauder (CDU/CSU),cducsu,speech
91349,42,17,0,532,Nächster Redner ist der Kollege Jürgen Trittin für die Fraktion Bündnis 90/Die Grünen.,Dr. Norbert Lammert,,data/txt/17042.txt,Präsident Dr. Norbert Lammert,,chair
91350,42,17,0,533,"Herr Präsident! Meine Damen und Herren! Liebe Frau Bundeskanzlerin, hinsichtlich eines Befundes will ich Ihnen zustimmen. Sie haben gesagt, die gegenwärtige Krise des Euro sei die größte Bewährungsprobe, die Europa seit Jahrzehnten zu bestehen habe. - Das ist richtig. Ich kann Ihnen deshalb aber eine einfache Frage nicht ersparen: Warum musste erst der US-Präsident Barack Obama am 7. Mai 2010 bei Ihnen anrufen, damit Sie diese Krise bemerken?",Jürgen Trittin,,data/txt/17042.txt,Jürgen Trittin (BÜNDNIS 90/DIE GRÜNEN),gruene,speech
91351,42,17,0,534,Beifall beim BÜNDNIS 90/DIE GRÜNEN und bei der SPD sowie bei Abgeordneten der LINKEN,,,data/txt/17042.txt,,,poi
91352,42,17,0,535,So ein Unsinn!,Norbert Barthle,,data/txt/17042.txt,Norbert Barthle [CDU/CSU],cducsu,poi
91353,42,17,0,536,"Es wäre leicht, an dieser Stelle zu sagen, es habe vielleicht an der NRW-Wahl gelegen. Das wäre auch richtig, aber der andere Teil der Wahrheit ist: Obama hat auch bei Nicolas Sarkozy angerufen. - Deswegen stehen wir vor einem, wie ich finde, erschreckenden Befund. Wir sind nicht nur in einer großen Krise dieses Europas, sondern wir haben auch den Ausfall der klassischen Führungsmächte dieses Europas zu konstatieren: den Ausfall Deutschlands und den Ausfall Frankreichs.",Jürgen Trittin,,data/txt/17042.txt,Jürgen Trittin (BÜNDNIS 90/DIE GRÜNEN),gruene,speech
91354,42,17,0,537,Beifall beim BÜNDNIS 90/DIE GRÜNEN sowie bei Abgeordneten der SPD,,,data/txt/17042.txt,,,poi
91355,42,17,0,538,"Was hätte es denn geheißen, dieser Krise entgegenzuwirken? Sie hätten all das machen müssen, wofür Sie sich jetzt, Frau Homburger, Herr Kauder, beginnen, auf die Schulter zu klopfen.

Seit gestern Nacht sind ungedeckte Leerverkäufe von Staatsanleihen in Deutschland verboten. Warum erst seit gestern? Warum haben Sie diese in unserem Land überhaupt wieder zugelassen?",Jürgen Trittin,,data/txt/17042.txt,Jürgen Trittin (BÜNDNIS 90/DIE GRÜNEN),gruene,speech
91356,42,17,0,539,Beifall beim BÜNDNIS 90/DIE GRÜNEN und bei der SPD,,,data/txt/17042.txt,,,poi
91357,42,17,0,540,"Seit gestern liegt ein Regelungsvorschlag des Rates zur Regelung von Hedgefonds vor, der mit Mehrheit im Rat beschlossen wurde. Warum erst seit gestern? Die Mehrheit, die es dafür gab, gab es auch schon vorher. Aber bisher war Deutschland nicht bereit, sich an dieser Mehrheit zu beteiligen. Das ist die Wahrheit.",Jürgen Trittin,,data/txt/17042.txt,Jürgen Trittin (BÜNDNIS 90/DIE GRÜNEN),gruene,speech
91358,42,17,0,541,Beifall beim BÜNDNIS 90/DIE GRÜNEN und bei der SPD,,,data/txt/17042.txt,,,poi
91359,42,17,0,542,Das stimmt doch gar nicht! Das ist falsch!,Volker Kauder,,data/txt/17042.txt,Volker Kauder [CDU/ CSU],cducsu,poi
91360,42,17,0,543,"Frau Bundeskanzlerin, ich wäre an Ihrer Stelle vorsichtig mit einem Zwischenruf, in dem jemand der Unwahrheit geziehen wird. Sie müssten dem Hohen Haus dann auch erklären, worin in der Frage einer europäischen Finanzmarktaufsicht die Differenz besteht. Warum kommen der Rat, also die Regierung, und das Europäische Parlament hier nicht zu einer gemeinsamen Schlussfolgerung?

Es gibt viele Gründe. Ein Grund soll aber sein, dass die deutsche Bundesregierung im Rat Maßnahmen der europäischen Finanzaufsicht gegenüber deutschen Behörden ablehnt. Das wäre aber eine zahnlose Finanzaufsicht. Deswegen sollten Sie sich an die eigene Nase fassen, bevor Sie in dieser Frage auf das Europäische Parlament verweisen.",Jürgen Trittin,,data/txt/17042.txt,Jürgen Trittin (BÜNDNIS 90/DIE GRÜNEN),gruene,speech
91361,42,17,0,544,Beifall beim BÜNDNIS 90/DIE GRÜNEN sowie bei Abgeordneten der SPD,,,data/txt/17042.txt,,,poi
91362,42,17,0,545,"Das Ganze hat zu einem beispiellosen Schlingerkurs geführt. Noch am 9. Mai haben Sie persönlich in diesem Hause in namentlicher Abstimmung alle Anträge der Grünen, der SPD und der Linken für die Einführung einer Finanzmarkttransaktionsteuer abgelehnt. Zwei Tage später haben Sie in Brüssel einem Ratsbeschluss zugestimmt, in dem es heißt, die Möglichkeiten einer globalen Transaktionsteuer sollten nun geprüft werden. Heute legt uns die Koalition einen Gesetzentwurf vor, der besagt: Wir wissen nicht recht, ob wir eine neue Umsatzsteuer oder Einkommensteuer einführen wollen, aber wir schreiben irgendwas hinein. - Das ist das Gegenteil von Führung und Handeln.",Jürgen Trittin,,data/txt/17042.txt,Jürgen Trittin (BÜNDNIS 90/DIE GRÜNEN),gruene,speech
91363,42,17,0,546,Beifall beim BÜNDNIS 90/DIE GRÜNEN und bei der SPD sowie bei Abgeordneten der LINKEN,,,data/txt/17042.txt,,,poi
91364,42,17,0,547,"Wenn Sie diese Krise bekämpfen wollen, dann brauchen Sie eine Finanzmarkttransaktionsteuer. Sie ist zielgenau, und anders als die Aktivitätsteuer ist sie auch in der Lage, die Volumina zu generieren, die Sie brauchen, um endlich mit solchen Krisen fertig zu werden. Hören Sie auf, mit Peanuts auf Krisenfragen zu antworten!",Jürgen Trittin,,data/txt/17042.txt,Jürgen Trittin (BÜNDNIS 90/DIE GRÜNEN),gruene,speech
91365,42,17,0,548,Beifall beim BÜNDNIS 90/DIE GRÜNEN sowie bei Abgeordneten der SPD und der LINKEN,,,data/txt/17042.txt,,,poi
91366,42,17,0,549,"Mag sein, dass Sie das nicht gerne von Grünen hören. Aber Sie sind nicht einmal mehr in der eigenen konservativen Parteienfamilie wirklich in der Mehrheit. Hören Sie doch auf Magister Josef Pröll, den österreichischen Finanzminister, der sich für eine europäische Finanzmarkttransaktionsteuer einsetzt!",Jürgen Trittin,,data/txt/17042.txt,Jürgen Trittin (BÜNDNIS 90/DIE GRÜNEN),gruene,speech
91367,42,17,0,550,Weltweit!,Dr. h. c. Hans Michelbach,,data/txt/17042.txt,Dr. h. c. Hans Michelbach [CDU/CSU],cducsu,poi
91368,42,17,0,551,"- Nein, er möchte eine europäische, und zwar klar und deutlich.

Hören Sie doch auf Ihren christdemokratischen Parteifreund Jean-Claude Juncker, der als Vorsitzender der Euro-Zone sagt: Wir brauchen diese europäische Finanzmarkttransaktionsteuer, weil ohne sie international nichts geht! Fangen Sie also an, in Europa zu handeln, damit sich auch international endlich etwas bewegt! Das ist die richtige Reihenfolge.",Jürgen Trittin,,data/txt/17042.txt,Jürgen Trittin (BÜNDNIS 90/DIE GRÜNEN),gruene,speech
91369,42,17,0,552,Beifall beim BÜNDNIS 90/DIE GRÜNEN und bei der SPD sowie bei Abgeordneten der LINKEN,,,data/txt/17042.txt,,,poi
91370,42,17,0,553,"Hören Sie auf, Deutschland permanent in eine Sonderrolle zu drängen! Da sind wir nämlich inzwischen. Fragen Sie sich doch einmal, warum aus Europa 2020 nichts wird! Daraus wird nichts, weil diese Bundesregierung europäische Bildungsstandards europaweit blockiert. Das kann ich verstehen, wenn ich Herrn Koch in meinen Reihen habe. Aber es ist nicht europäisch, und es ist nicht zukunftsgewandt.",Jürgen Trittin,,data/txt/17042.txt,Jürgen Trittin (BÜNDNIS 90/DIE GRÜNEN),gruene,speech
91371,42,17,0,554,Beifall beim BÜNDNIS 90/DIE GRÜNEN sowie bei Abgeordneten der SPD und der LINKEN,,,data/txt/17042.txt,,,poi
91372,42,17,0,555,"Es ist diese Bundesregierung, die bei Europa 2020 europäische Standards bei der Armutsbekämpfung blockiert. Auch das kann ich verstehen, wenn ich Menschen wie die in der FDP in meinen Reihen habe, denen die Hoteliers wichtiger sind als die Armen in diesem Lande.",Jürgen Trittin,,data/txt/17042.txt,Jürgen Trittin (BÜNDNIS 90/DIE GRÜNEN),gruene,speech
91373,42,17,0,556,Beifall beim BÜNDNIS 90/DIE GRÜNEN sowie bei Abgeordneten der SPD,,,data/txt/17042.txt,,,poi
91374,42,17,0,557,Frechheit!,von der FDP,,data/txt/17042.txt,Zuruf von der FDP,fdp,poi
91375,42,17,0,558,"Aber eine vernünftige europäische Politik ist das nicht. Mit dieser Haltung haben Sie sich mittlerweile in dieselbe Situation gebracht wie ein Kind, das bockig in der Ecke sitzt und regelmäßig dazu gebracht werden muss, mitzuspielen. Ich finde, das ist der größten Nation, dem größten Mitgliedsland innerhalb der Europäischen Union nicht angemessen. Wir müssen endlich wieder gemeinsam mit den anderen Mitgliedstaaten Europa gestalten und aus der Ecke der Bockigkeit herauskommen.",Jürgen Trittin,,data/txt/17042.txt,Jürgen Trittin (BÜNDNIS 90/DIE GRÜNEN),gruene,speech
91376,42,17,0,559,Beifall beim BÜNDNIS 90/DIE GRÜNEN und bei der SPD,,,data/txt/17042.txt,,,poi
91377,42,17,0,560,,Jürgen Trittin,,data/txt/17042.txt,Jürgen Trittin (BÜNDNIS 90/DIE GRÜNEN),gruene,speech
91378,42,17,0,561,"Herr Kollege Trittin, gestatten Sie eine Zwischenfrage des Kollegen Barthle?",Dr. Norbert Lammert,,data/txt/17042.txt,Präsident Dr. Norbert Lammert,,chair
91379,42,17,0,562,Bitte.,Jürgen Trittin,,data/txt/17042.txt,Jürgen Trittin (BÜNDNIS 90/DIE GRÜNEN),gruene,speech
91380,42,17,0,563,"Herr Kollege Trittin, Sie haben gerade mehrfach die CDU/CSU-FDP-geführte Bundesregierung angegriffen, zuerst mit der Aussage, dass eine Kontrolle der Finanzen durch die Europäische Kommission von der Regierung nicht zugelassen werde, danach sind Sie auf die europäischen Standards eingegangen. Gestehen Sie mir zu, dass die Bundesregierung im Auftrag dieses Parlaments handelt und dass dieser Auftrag schon in den vergangenen Legislaturperioden an die Regierung gerichtet wurde?",Norbert Barthle,,data/txt/17042.txt,Norbert Barthle (CDU/CSU),cducsu,speech
91381,42,17,0,564,"Lieber Herr Kollege Barthle, mir kommt es fast vor, als hätten Sie den weiteren Verlauf meiner Rede antizipativ vorweggenommen. Das freut mich für Sie. Aber es wird für Sie am Ende außerordentlich unangenehm.",Jürgen Trittin,,data/txt/17042.txt,Jürgen Trittin (BÜNDNIS 90/DIE GRÜNEN),gruene,speech
91382,42,17,0,565,Oh! Oh!,e von der CDU/CSU und der FDP,,data/txt/17042.txt,Zurufe von der CDU/CSU und der FDP,cducsu:fdp,poi
91383,42,17,0,566,"Denn Sie haben Deutschland mittlerweile nicht nur in der europäischen Politik in die Isolation geführt. Die Bundesregierung hat mit dem Vorgehen, das sie an dieser Stelle praktiziert hat, nichts anderes gemacht, als gegen das Grundgesetz zu verstoßen.",Jürgen Trittin,,data/txt/17042.txt,Jürgen Trittin (BÜNDNIS 90/DIE GRÜNEN),gruene,speech
91384,42,17,0,567,Alles deutsche Interessen!,Dr. h. c. Hans Michelbach,,data/txt/17042.txt,Dr. h. c. Hans Michelbach [CDU/CSU],cducsu,poi
91385,42,17,0,568,"- Lieber Herr Kollege, das Grundgesetz steht nie im Widerspruch zu deutschen Interessen. Es ist die Grundlage deutscher Interessen, wenn ich mir diese Bemerkung erlauben darf.",Jürgen Trittin,,data/txt/17042.txt,Jürgen Trittin (BÜNDNIS 90/DIE GRÜNEN),gruene,speech
91386,42,17,0,569,"Beifall beim BÜNDNIS 90/DIE GRÜNEN, bei der SPD und der LINKEN",,,data/txt/17042.txt,,,poi
91387,42,17,0,570,"Sie haben einfachgesetzliches Recht gebrochen, und Sie haben sich auf eine Vertragsregelung der Europäischen Union berufen, auf die Sie sich nicht hätten berufen dürfen. Ich will Ihnen das gerne durchbuchstabieren, wenn Sie wollen.",Jürgen Trittin,,data/txt/17042.txt,Jürgen Trittin (BÜNDNIS 90/DIE GRÜNEN),gruene,speech
91388,42,17,0,571,Ein bisschen mehr Bescheidenheit!,Volker Kauder,,data/txt/17042.txt,Volker Kauder [CDU/CSU],cducsu,poi
91389,42,17,0,572,"Ich verweise auf Art. 23 des Grundgesetzes. - Herr Kollege Barthle, ich bin noch immer bei der Beantwortung Ihrer Frage. Sie haben gesagt, die Bundesregierung handele im Auftrag des Bundestages.",Jürgen Trittin,,data/txt/17042.txt,Jürgen Trittin (BÜNDNIS 90/DIE GRÜNEN),gruene,speech
91390,42,17,0,573,"Herr Kollege Trittin, da Sie freundlicherweise darauf hingewiesen hatten, dass das ohnehin ein Bestandteil Ihrer sorgfältig vorbereiteten Rede ist,",Dr. Norbert Lammert,,data/txt/17042.txt,Präsident Dr. Norbert Lammert,,chair
91391,42,17,0,574,Beifall bei Abgeordneten der CDU/CSU,,,data/txt/17042.txt,,,poi
91392,42,17,0,575,"setze ich das Einvernehmen des Plenums voraus, dass sich der Kollege Barthle setzen darf und Sie im Rahmen Ihrer Redezeit Ihre Ausführungen vervollständigen.",Dr. Norbert Lammert,,data/txt/17042.txt,Präsident Dr. Norbert Lammert,,chair
91393,42,17,0,576,Beifall bei Abgeordneten der FDP,,,data/txt/17042.txt,,,poi
91394,42,17,0,577,,Dr. Norbert Lammert,,data/txt/17042.txt,Präsident Dr. Norbert Lammert,,chair
91395,42,17,0,578,"Der Kollege Barthle geht also wieder in den Sitzstreik, okay.

Art. 23 des Grundgesetzes ist völlig eindeutig. Vor dem Setzen von Rechtsakten im Rat ist der Deutsche Bundestag zu befassen. Dies ist bei der infrage stehenden Rechtsverordnung nicht geschehen. Die nachträgliche Unterrichtung der Fraktionsvorsitzenden ist keine Befassung des Deutschen Bundestages.",Jürgen Trittin,,data/txt/17042.txt,Jürgen Trittin (BÜNDNIS 90/DIE GRÜNEN),gruene,speech
91396,42,17,0,579,Beifall beim BÜNDNIS 90/DIE GRÜNEN und bei der SPD sowie bei Abgeordneten der LINKEN,,,data/txt/17042.txt,,,poi
91397,42,17,0,580,"Daher sage ich Ihnen: Sie haben das Recht und die Verfassung mit Ihrem Vorgehen gebrochen. Sicherlich musste man schnell handeln. Ich bin bereit, mit Ihnen darüber zu diskutieren, wie man künftig mit solchen Fällen umgehen soll. Ich bin hier für jedes Gespräch zu haben. Aber es geht nicht, dass Sie, nachdem Sie diesen Rechtsbruch begangen haben, dieses Hohe Haus, den Deutschen Bundestag, mit weiteren Zumutungen belästigen. Sie erwarten von uns, dass wir eine Kreditermächtigung in Höhe von über 148 Milliarden Euro erteilen. Das entspricht fast dem Volumen eines halben Bundeshaushaltes. Auf die Frage, wie dieses Geld ausgegeben werden soll, haben wir gestern vom Bundesfinanzminister ein Term Sheet als Antwort bekommen, ein einseitiges Blatt Papier mit den geplanten Konditionen. Das ist nichts anderes als eine unverbindliche Absichtserklärung, in der darauf verwiesen wird, dass man eine Zweckgesellschaft nach luxemburgischem Recht gründen möchte. Ich bin froh, dass es wenigstens keine Liechtensteiner Stiftung ist.",Jürgen Trittin,,data/txt/17042.txt,Jürgen Trittin (BÜNDNIS 90/DIE GRÜNEN),gruene,speech
91398,42,17,0,581,Beifall beim BÜNDNIS 90/DIE GRÜNEN und bei der SPD sowie bei Abgeordneten der LINKEN,,,data/txt/17042.txt,,,poi
91399,42,17,0,582,"Aber ganz im Ernst - das sage ich besonders an die Adresse der Parlamentarier auf der Regierungsseite -: Können Sie sich ernsthaft vorstellen, 148 Milliarden Euro auszugeben, ohne dass Sie das Vertragswerk kennen und geprüft haben? Ich kann mir das als Parlamentarier nicht vorstellen. Ich wünsche mir auch aufseiten der Regierung Parlamentarier, die sich dies nicht vorstellen können.",Jürgen Trittin,,data/txt/17042.txt,Jürgen Trittin (BÜNDNIS 90/DIE GRÜNEN),gruene,speech
91400,42,17,0,583,Beifall beim BÜNDNIS 90/DIE GRÜNEN und bei der SPD sowie bei Abgeordneten der LINKEN,,,data/txt/17042.txt,,,poi
91401,42,17,0,584,"Das Parlament ernst zu nehmen, hieße, dies zusammen mit dem Deutschen Bundestag zu machen, anstatt mit einem solchen Verfahren weiter fortzuschreiten.

Ich erwarte von Ihnen auch, dass bei der Freigabe der einzelnen Mittel ein Missstand beseitigt wird, der geradezu absurd ist. Wenn Sie das Recht der Beteiligung des Bundestages ernst nehmen, dann kann der Deutsche Bundestag zu jeder Kreditermächtigung über die 60 Milliarden Euro EU-Mittel künftig einen Vorbehalt einlegen. Das haben wir gemeinsam so geregelt. Aber zu den 148 Milliarden Euro werden wir lediglich unterrichtet, wenn nichts anderes dem entgegensteht. Alle Vierteljahre darf dann Alex Bonde prüfen, ob Sie das Ganze ordentlich rechnungsmäßig verbucht haben. Das, was Sie uns mit diesem Vorschlag unterbreiten, ist eine Brüskierung des Bundestages. Diese Brüskierung des Bundestages kann auch von Ihnen nicht ernsthaft akzeptiert werden.",Jürgen Trittin,,data/txt/17042.txt,Jürgen Trittin (BÜNDNIS 90/DIE GRÜNEN),gruene,speech
91402,42,17,0,585,Beifall beim BÜNDNIS 90/DIE GRÜNEN und bei der SPD sowie bei Abgeordneten der LINKEN,,,data/txt/17042.txt,,,poi
91403,42,17,0,586,"Meine Damen und Herren, wenn Sie das tun wollen, was die Bundeskanzlerin zu Recht gesagt hat, nämlich dass Sie dieses Verfahren durchführen und dabei der Budgethoheit des Bundestages in vollem Umfang Rechnung tragen wollen - so ist das gesagt worden -, dann müssen Sie erstens dafür sorgen, dass uns vor der Entscheidung hier im Bundestag dieser Vertrag vorgelegt wird, und Sie müssen zweitens dafür sorgen, dass der Bundestag künftig entscheiden kann und nicht nur unterrichtet wird.",Jürgen Trittin,,data/txt/17042.txt,Jürgen Trittin (BÜNDNIS 90/DIE GRÜNEN),gruene,speech
91404,42,17,0,587,Beifall bei Abgeordneten des BÜNDNIS-SES 90/DIE GRÜNEN,,,data/txt/17042.txt,,,poi
91405,42,17,0,588,"Erzählen Sie uns hier nicht, das sei wegen der Eilbedürftigkeit nicht machbar. Erstens. Die 60 Milliarden Euro stehen schon jetzt zur Verfügung. Zweitens. Ohne Zweckgesellschaft fließt sowieso kein Geld. Welchen Grund gibt es also, uns, bevor dieser Vertrag vorliegt, zu nötigen, hier einen Gesetzentwurf zu verabschieden? Einen solchen Grund vermag ich nicht zu erkennen. Deswegen sage ich Ihnen: Ändern Sie das, tun Sie etwas in dieser Richtung!",Jürgen Trittin,,data/txt/17042.txt,Jürgen Trittin (BÜNDNIS 90/DIE GRÜNEN),gruene,speech
91406,42,17,0,589,Beifall beim BÜNDNIS 90/DIE GRÜNEN und bei der SPD sowie bei Abgeordneten der LINKEN,,,data/txt/17042.txt,,,poi
