id,sitzung,wahlperiode,in_writing,sequence,text,speaker_cleaned,speaker_fp,filename,speaker,speaker_party,type
91865,42,17,0,1048,"Vielen Dank, Herr Präsident! - Sehr geehrter Herr Abgeordneter, die Bundesregierung unterstützt die Pledges, welche die EU auf der Überprüfungskonferenz von Kampala einbringen will. Dabei geht es um folgende Punkte:

Erstens. Die EU will ihre Bemühungen fortsetzen, die Universalität des Römischen Statuts zu fördern und seine Integrität zu bewahren. Hierzu gehören beispielsweise EU-Demarchen, um in Drittstaaten für den Beitritt zum Römischen Statut zu werben.

Zweitens. Die EU will in ihren Abkommen mit Drittstaaten Klauseln zum Internationalen Strafgerichtshof aufnehmen. Damit bekennen sich die EU-Partner auch in ihren vertraglichen Beziehungen nach außen zum Kampf gegen die Straflosigkeit bei schwersten Verbrechen, welche die internationale Gemeinschaft als Ganzes berühren.

Drittens. Die EU will ihre finanzielle Unterstützung für diejenigen Zivilgesellschaften und Drittstaaten fortsetzen, die Hilfestellung beim Beitritt zum Römischen Statut oder bei seiner Umsetzung wünschen.

Viertens. Die Europäische Union will ihre Instrumente zur Unterstützung des Internationalen Strafgerichtshofs auf eventuellen Anpassungsbedarf überprüfen. Dies betrifft in erster Linie den Gemeinsamen Standpunkt zum Internationalen Strafgerichtshof aus dem Jahre 2003 sowie den Aktionsplan aus dem Jahre 2004.

Zusätzlich zu den Zusicherungen der EU wird Deutschland auf der Überprüfungskonferenz folgende Zusagen machen: Erstens. Deutschland wird an den Opferschutzfonds des Internationalen Strafgerichtshofs im Jahre 2010 einen freiwilligen Beitrag in Höhe von 300 000 Euro leisten. Zweitens. Deutschland wird in den Jahren 2010 und 2011 die Stelle einer juristischen Fachkraft beim Opferschutzfonds des Internationalen Strafgerichtshofs finanzieren. Drittens. Deutschland plant, im Haushaltsjahr 2010 Mittel in Höhe von 250 000 Euro für Projekte zur Förderung des Beitritts zum Römischen Statut und seiner Umsetzung bereitzustellen.

Die Bundesregierung ist davon überzeugt, dass von diesen Zusagen ein deutliches Signal der Stärkung des Internationalen Strafgerichtshofs und seiner Arbeit ausgeht.",Cornelia Pieper,,data/txt/17042.txt,"Cornelia Pieper, Staatsministerin im Auswärtigen Amt",,speech
91866,42,17,0,1049,"Bitte schön, Kollege Beck.",Dr. h. c. Wolfgang Thierse,,data/txt/17042.txt,Vizepräsident Dr. h. c. Wolfgang Thierse,,chair
91867,42,17,0,1050,"Ich bin etwas erstaunt, dass Sie ein Thema nicht angesprochen haben. Das zentrale Thema in Kampala wird sein, ob der Tatbestand des Aggressionsverbrechens anerkannt wird. Er ist im Statut eigentlich enthalten, wurde aber mit dem Hinweis, dass sich die Vertragsstaaten noch auf eine Definition verständigen müssen, außer Kraft gesetzt. Dazu haben Sie nichts gesagt. Im Menschenrechtsausschuss hatten wir in der letzten Woche eine Anhörung. Die Sachverständigen haben sich durch die Bank dafür ausgesprochen, dass man diesen Schritt endlich machen soll. Deshalb frage ich Sie, ob die Bundesregierung hier entsprechend tätig geworden ist und solche Forderungen für die Konferenz in Kampala vorbereitet hat.",Volker Beck,,data/txt/17042.txt,Volker Beck (Köln) (BÜNDNIS 90/DIE GRÜNEN),gruene,speech
91868,42,17,0,1051,"Zunächst können Sie davon ausgehen, dass die Bundesregierung dieser Überprüfungskonferenz grundsätzlich große Bedeutung beimisst. Wenn das Thema in der Sitzung des Menschenrechtsausschusses, an der ich nicht teilnehmen konnte, behandelt worden ist, dann wird die Bundesregierung sicher die Vorschläge der Abgeordneten berücksichtigen.

Darüber hinaus wissen Sie, dass die Bundesregierung kein Relocation Agreement mit dem Internationalen Strafgerichtshof in Bezug auf den Opfer- und Zeugenschutz abgeschlossen hat, weil sie der Auffassung ist, dass sie den Opferschutz derzeit ohne ein solches Abkommen gewährleisten kann, sodass sich diese Frage nicht stellt.",Cornelia Pieper,,data/txt/17042.txt,"Cornelia Pieper, Staatsministerin im Auswärtigen Amt",,speech
91869,42,17,0,1052,"Sie haben mich verwirrt, weil Sie einen Sprechzettel zum falschen Thema vorgelesen haben. Wenn Sie darüber nicht Bescheid wissen, dann können Sie die Antwort ja im Nachgang der Fragestunde liefern. Wir hatten es heute schon ein paar Mal, dass die Staatssekretäre - in dem Fall die Staatsministerin - bekennen mussten, dass sie nicht wissen, was ihr Haus vertritt.

Ich frage Sie, ob sich die Bundesregierung aktiv dafür einsetzt - das wird wahrscheinlich für längere Zeit die letzte Gelegenheit sein; dann schließt sich wahrscheinlich das Zeitfenster dafür -, dass der Tatbestand des Aggressionsverbrechens künftig der Gerichtsbarkeit des Internationalen Strafgerichtshofs unterliegen wird, wie es bei der Verabschiedung des Statuts beabsichtigt war, aber nicht erreicht worden ist.",Volker Beck,,data/txt/17042.txt,Volker Beck (Köln) (BÜNDNIS 90/DIE GRÜNEN),gruene,speech
91870,42,17,0,1053,"Herr Abgeordneter, ich bin darauf nicht eingegangen, weil das nicht der Hintergrund Ihrer ursprünglichen Fragestellung war.",Cornelia Pieper,,data/txt/17042.txt,"Cornelia Pieper, Staatsministerin im Auswärtigen Amt",,speech
91871,42,17,0,1054,Das stimmt nicht! Sie haben dann die Frage nicht vollständig verstanden!,Volker Beck,,data/txt/17042.txt,Volker Beck [Köln] [BÜNDNIS 90/DIE GRÜNEN],gruene,poi
91872,42,17,0,1055,"Die ursprüngliche Frage war eine andere als die, die Sie gestellt haben.

Sie können davon ausgehen, dass der Menschenrechtsbeauftragte, Herr Löning, der die Leitung der Delegation hat, die Vorschläge des Menschenrechtsausschusses mitnehmen und dort zur Sprache bringen wird.

Was die Position des Ausschusses anbelangt, bin ich gerne bereit, auch die Position unseres Hauses nachzuliefern. Ich sagte ja schon, dass ich an der Diskussion leider nicht teilnehmen konnte. Im Moment kann ich sie auch nicht nachvollziehen.",Cornelia Pieper,,data/txt/17042.txt,"Cornelia Pieper, Staatsministerin im Auswärtigen Amt",,speech
91873,42,17,0,1056,Dieser Punkt ist der zentrale Gegenstand in Kampala. Dass Sie darüber nicht Bescheid wissen!,Volker Beck,,data/txt/17042.txt,Volker Beck (Köln) (BÜNDNIS 90/DIE GRÜNEN),gruene,speech
91874,42,17,0,1057,"Danke schön.

Die Fragen 62 und 63 des Kollegen Tom Koenigs, die Frage 64 des Kollegen Ströbele, die Frage 65 der Kollegin Höger und die Frage 66 der Kollegin Daðdelen werden schriftlich beantwortet.

Damit sind wir am Schluss unserer Fragestunde. Da der Beginn der Aktuellen Stunde für 15.00 Uhr angesetzt ist und noch nicht alle Kollegen eingetroffen sind, unterbreche ich bis dahin die Sitzung.",Dr. h. c. Wolfgang Thierse,,data/txt/17042.txt,Vizepräsident Dr. h. c. Wolfgang Thierse,,chair
91875,42,17,0,1058,Unterbrechung von 14.52 bis 15.02 Uhr,,,data/txt/17042.txt,,,poi
91876,42,17,0,1059,,Dr. h. c. Wolfgang Thierse,,data/txt/17042.txt,Vizepräsident Dr. h. c. Wolfgang Thierse,,chair
91877,42,17,0,1060,"Die unterbrochene Sitzung ist wieder eröffnet.

Ich rufe den Zusatzpunkt 3 auf:

Aktuelle Stunde

auf Verlangen der Fraktion der SPD

Unterschiedliche verfassungsrechtliche Auffassungen in der Bundesregierung zur Verlängerung von Atomkraftwerkslaufzeiten

Ich eröffne die Aussprache. Das Wort hat der Kollege Ulrich Kelber für die SPD-Fraktion.",Petra Pau,,data/txt/17042.txt,Vizepräsidentin Petra Pau,,chair
91878,42,17,0,1061,Beifall bei der SPD,,,data/txt/17042.txt,,,poi
91879,42,17,0,1062,,Petra Pau,,data/txt/17042.txt,Vizepräsidentin Petra Pau,,chair
91880,42,17,0,1063,,Ulrich Kelber,,data/txt/17042.txt,Ulrich Kelber (SPD),spd,speech
91881,42,17,0,1064,,Frau in! Meine sehr geehrten Damen und Herren! Wieder wird Lobbyistenbedienung zum Zentralgestirn schwarzgelber Politik,,data/txt/17042.txt,Frau Präsidentin! Meine sehr geehrten Damen und Herren! Wieder wird Lobbyistenbedienung zum Zentralgestirn schwarz-gelber Politik,,speech
91882,42,17,0,1065,Lachen des Abg. Michael Kauch [FDP],,,data/txt/17042.txt,,,poi
91883,42,17,0,1066,"zu Beginn das sogenannte Mövenpick-Gesetz, Herr Kauch, jetzt der Versuch, Milliardengeschenke an die Atomlobby zu verteilen, sogar indem man windige, verfassungswidrige Konstruktionen in den Gesetzen anstrebt, und das trotz klar erkannter negativer wirtschaftlicher Effekte auf große Teile der restlichen Energiewirtschaft.",Frau in! Meine sehr geehrten Damen und Herren! Wieder wird Lobbyistenbedienung zum Zentralgestirn schwarzgelber Politik,,data/txt/17042.txt,Frau Präsidentin! Meine sehr geehrten Damen und Herren! Wieder wird Lobbyistenbedienung zum Zentralgestirn schwarz-gelber Politik,,speech
91884,42,17,0,1067,Das zumindest ist falsch!,Dr. Georg Nüßlein,,data/txt/17042.txt,Dr. Georg Nüßlein [CDU/CSU],cducsu,poi
91885,42,17,0,1068,"Die Liebe zu den Lobbyisten geht so weit, dass aus den Reihen der Union, aus den Reihen der CDU, sogar der eigene Umweltminister zum Rücktritt aufgefordert wird, weil er der Atomlobby nur einen zweistelligen Milliardenbetrag anstatt eines dreistelligen Milliardenbetrages schenken möchte. So weit ist die Verbrüderung an der Stelle schon gegangen.

Minister Pofalla hat öffentlich verkündet, er möchte die Gesetzgebung zur Verlängerung der Laufzeiten von Atomkraftwerken ohne eine Beteiligung des Bundesrates machen, also eine windige verfassungsrechtliche Konstruktion zur Lobbyistenbedienung finden; so kann man das Ganze auch nennen. Heute erfahren wir per Tickermeldung, dass die Bundeskanzlerin sich gegenüber der CDU/CSU-Fraktion geäußert hat. Man will dazu jetzt doch bis zum 4. Juni eine Rechtsexpertise von Umweltministerium, Justizministerium und Innenministerium einholen. Da frage ich mich: Hat sich der Minister im Kanzleramt, Pofalla, erst einmal eine Meinung gebildet, und will er sich jetzt die dazu passende Rechtsexpertise einholen? Hat er das also ohne Rechtsexpertise gemacht? Ist die Tatsache, dass Herr Pofalla Jurist ist, vielleicht keine ausreichende Qualifikation mehr, wenn es um entsprechende Gesetzesvorhaben geht?

Man muss gar nicht die Opposition oder die Medien zu diesem Vorgehen der schwarz-gelben Koalition befragen, sondern nur die eigenen Leute: Die Ministerpräsidentin von Thüringen nennt den Vorschlag Pofallas ein - Zitat - ""Mogelgesetz"". Die schleswig-holsteinische Regierung - schwarz-gelb - sagt, dass das so nicht geht. Die saarländische Regierung, auch mit Schwarzen und Gelben in der Regierung, widerspricht; Niedersachsen ebenso. Die abgewählte schwarz-gelbe Landesregierung in Nordrhein-Westfalen widerspricht, und am 30. September 2009, also drei Tage nach der Bundestagswahl, schrieben der damalige baden-württembergische Ministerpräsident Oettinger und der hessische Ministerpräsident Koch Bundeskanzlerin Merkel einen Brief, in dem sie darauf verwiesen, dass eine Nichtbeteiligung des Bundesrates an dieser Stelle höchst strittig ist. Das ist übrigens derselbe Herr Koch, der gestern gesagt hat, er habe gar keine Zweifel, dass die Nichtbeteiligung des Bundesrates in dieser Frage machbar sei. Eine Wahlniederlage in Nordrhein-Westfalen ändert also Ihre Auffassung darüber, was verfassungsgemäß ist. Auch das ist bezeichnend für Ihre Politik.

Über die Frage, ob leichtfertig mit der Verfassung umgegangen wird, hinaus hat das Ganze zusätzliche Implikationen. Sie haben zugesichert, Sie würden eine Verlängerung der Laufzeiten nur unter höchsten Sicherheitsanforderungen anstreben, also unter der Voraussetzung, dass die Atomkraftwerke entsprechend nachgerüstet werden. Sie wissen genau, dass in dem Augenblick, wo der Bund zusätzliche Sicherheitsanforderungen stellt, die Atomaufsicht der Länder berührt ist und damit die Zustimmungspflicht gilt. Das heißt, wer die Zustimmungspflicht umgehen will, muss auf Sicherheitsauflagen für die Atomkraftwerke verzichten. Das ist Wortbruch Nummer eins, den Sie planen.

Wortbruch Nummer zwei. Sie haben gesagt, Sie werden die Gewinne, die die Atomkonzerne machen, zum größten Teil - andere sagen: zur Hälfte - abschöpfen. Wir sind gespannt darauf, wie Ihr Vorschlag aussehen wird - wenn Sie sich am Ende noch trauen. In dem Augenblick, in dem Sie das gesetzlich regeln, sind aber wieder die Länder betroffen, sodass Sie über den Bundesrat gehen müssten. Wenn Sie darauf verzichten wollen, können Sie nur eine freiwillige Vereinbarung mit den Konzernen machen. Das Vorgehen, zu sagen: ""Ich mache ein Gesetz zu deinem Vorteil, wenn du mir vorher Geld gibst"", nennt man außerhalb dieses direkten Zusammenhangs Korruption und nicht Gesetzgebung.",Frau in! Meine sehr geehrten Damen und Herren! Wieder wird Lobbyistenbedienung zum Zentralgestirn schwarzgelber Politik,,data/txt/17042.txt,Frau Präsidentin! Meine sehr geehrten Damen und Herren! Wieder wird Lobbyistenbedienung zum Zentralgestirn schwarz-gelber Politik,,speech
91886,42,17,0,1069,"He, he, he!",Dr. Georg Nüßlein,,data/txt/17042.txt,Dr. Georg Nüßlein [CDU/CSU],cducsu,poi
91887,42,17,0,1070,"- Sie haben es ja noch nicht gemacht. Vermeiden Sie doch, dass es am Ende als Korruption bezeichnet werden kann!

Damit das auch klar ist: Bundesminister Röttgen ist in dieser Frage keine grüne Lichtgestalt, sondern allerhöchstens das beste Fußballteam Grönlands: Auch er will eine windige, verfassungswidrige Konstruktion, auch er versucht den Bundesrat zu umgehen, auch er will den Lobbyisten Milliarden schenken, auch er will Schrottreaktoren wie Biblis A länger laufen lassen, ohne zusätzliche Sicherheitsmaßnahmen zur Auflage zu machen.

Sie müssen die Wahrheit sagen, Herr Röttgen: Auch eine um ""nur"" acht Jahre längere Laufzeit bedeutet mehr Atommüll. Die Zwischenlager an den Reaktoren sind aber nur für die Menge Atommüll, die der im Atomkonsens vereinbarten Restlaufzeit entspricht, zugelassen. Für eine neue atomrechtliche Genehmigung dieser Zwischenlager bräuchten Sie die Bundesländer. Wenn Sie das umgehen wollen, wollen Sie in diesen acht Jahren zusätzliche Atommülltransporte quer durch Deutschland von jedem der 17 Reaktoren. Das müssen Sie hier sagen.

Sie können nicht Sonntagsredenminister sein. Sie sind noch nicht einmal Alltagsminister. In dieser Frage sind Sie wirklich ein Trauerstundenminister.

Vielen Dank.",Frau in! Meine sehr geehrten Damen und Herren! Wieder wird Lobbyistenbedienung zum Zentralgestirn schwarzgelber Politik,,data/txt/17042.txt,Frau Präsidentin! Meine sehr geehrten Damen und Herren! Wieder wird Lobbyistenbedienung zum Zentralgestirn schwarz-gelber Politik,,speech
91888,42,17,0,1071,Beifall bei der SPD sowie bei Abgeordneten des BÜNDNISSES 90/DIE GRÜNEN,,,data/txt/17042.txt,,,poi
91889,42,17,0,1072,,Frau in! Meine sehr geehrten Damen und Herren! Wieder wird Lobbyistenbedienung zum Zentralgestirn schwarzgelber Politik,,data/txt/17042.txt,Frau Präsidentin! Meine sehr geehrten Damen und Herren! Wieder wird Lobbyistenbedienung zum Zentralgestirn schwarz-gelber Politik,,speech
91890,42,17,0,1073,Das Wort hat Bundesminister Dr. Norbert Röttgen.,Petra Pau,,data/txt/17042.txt,Vizepräsidentin Petra Pau,,chair
91891,42,17,0,1074,Beifall bei der CDU/CSU und der FDP,,,data/txt/17042.txt,,,poi
91892,42,17,0,1075,,Petra Pau,,data/txt/17042.txt,Vizepräsidentin Petra Pau,,chair
91893,42,17,0,1076,"Frau Präsidentin! Sehr geehrte Kolleginnen und Kollegen! Ich möchte mich zunächst bei der SPD-Fraktion für die Beantragung der Aktuellen Stunde bedanken; sie gibt nämlich die Gelegenheit zu einer Versachlichung der Debatte. Dass der erste Redner der SPD diese Chance nicht voll ergriffen hat, ist bedauerlich; aber es gibt ja auch noch Redner der CDU/CSU- und der FDP-Fraktion, die die Chance, die Sie eröffnet haben, dann auch nutzen.",Dr. Norbert Röttgen,,data/txt/17042.txt,"Dr. Norbert Röttgen, Bundesminister für Umwelt, Naturschutz und Reaktorsicherheit",,speech
91894,42,17,0,1077,Wo ist denn Herr Mappus?,Oliver Krischer,,data/txt/17042.txt,Oliver Krischer [BÜNDNIS 90/DIE GRÜNEN],gruene,poi
91895,42,17,0,1078,"Ich will zunächst einmal auf das Thema der Aktuellen Stunde eingehen; es liegt ja nicht so fern, dass man auf das Thema der Debatte eingeht. Die verfassungsrechtliche Frage, um die es geht, lautet: Benötigt eine Bundesgesetzgebung - dass der Bundesgesetzgeber zuständig ist, ist unstrittig - zu einer Verlängerung der Laufzeit von Atomkraftwerken die Zustimmung des Bundesrates?

Meine erste Anmerkung dazu ist: Das ist eine rein verfassungsrechtliche Frage. Nicht nur als Minister, auch als Abgeordneter des Deutschen Bundestages, das heißt, als Teil des Gesetzgebers, plädiere ich ausdrücklich dafür, dass wir diese Frage rein verfassungsrechtlich, so gut wir können, beantworten und sie nicht politisieren. Wir alle haben keinen Vorteil davon, verfassungsrechtliche Fragen zu politisieren. Unser Selbstverständnis als Gesetzgeber muss sein, verfassungskonforme Gesetzgebung zu machen, nicht aber, Risiken einzugehen und dann zu warten, ob man von Karlsruhe korrigiert wird. Unser Selbstverständnis muss sein, die verfassungsrechtliche Frage korrekt zu beantworten.

Darum will ich hier auch darlegen, was überhaupt der inhaltliche Gesichtspunkt in diesem Zusammenhang ist. Warum könnte überhaupt eine Zustimmungsbedürftigkeit der Länder, des Bundesrates, vorliegen? Darüber muss man dann doch auch hier debattieren, weil das nicht nur eine Frage ist, deren Beantwortung wir von Experten entgegennehmen, sondern das Parlament muss sich sein Urteil auch selber bilden.

Es geht darum, dass das Atomgesetz in einer besonderen Form durch die Länder vollzogen wird, und zwar nicht in der Normalform der Landeseigenverwaltung - das ist die normale Form, in der die Länder Bundesgesetze vollziehen -, sondern in der Sonderform der sogenannten Bundesauftragsverwaltung. Durch diese Bundesauftragsverwaltung erfolgt ein besonderer Eingriff des Bundes in die Vollzugshoheit bzw. die Staatshoheit der Länder, weil dem Bund, dem zuständigen Minister, ein Weisungsrecht gegenüber den Landesministern und den Ländern beim Vollzug von Bundesgesetzen eingeräumt wird. Es ist also ein Eingriff in die Staatshoheit bzw. Staatsqualität der Länder.

Das Atomgesetz bedurfte bei seiner Verabschiedung der Zustimmung des Bundesrates, weil mit diesem Atomgesetz und der Aufgabe, Kernkraftwerke zu beaufsichtigen, dieser Eingriff des Bundes in die Verwaltungszuständigkeit der Länder verbunden war. Darum bedurfte der Ausstieg aus dieser Aufgabe nach meiner Auffassung konsequenterweise auch nicht der Zustimmung des Bundesrates, weil der Eingriff ja gerade beendet wurde.",Dr. Norbert Röttgen,,data/txt/17042.txt,"Dr. Norbert Röttgen, Bundesminister für Umwelt, Naturschutz und Reaktorsicherheit",,speech
91896,42,17,0,1079,Richtig!,Bärbel Höhn,,data/txt/17042.txt,Bärbel Höhn [BÜNDNIS 90/DIE GRÜNEN],gruene,poi
91897,42,17,0,1080,"Jetzt stellt sich die Frage, ob eine Zustimmungsbedürftigkeit dadurch ausgelöst wird, dass der Eingriff durch eine Laufzeitverlängerung fortgesetzt, zumindest aber verlängert wird, weil ja ein an sich schon beendeter Eingriff verlängert und quasi neu begründet wird. Diese verfassungsrechtliche Frage stellt sich. Wir sollten sie so gut wir können beantworten, und zwar nicht politisch, sondern verfassungsrechtlich, weil vom Verfassungsgericht keine politischen Vorstellungen und Argumente gewichtet werden.",Dr. Norbert Röttgen,,data/txt/17042.txt,"Dr. Norbert Röttgen, Bundesminister für Umwelt, Naturschutz und Reaktorsicherheit",,speech
91898,42,17,0,1081,Beifall bei der CDU/CSU und der FDP,,,data/txt/17042.txt,,,poi
91899,42,17,0,1082,Verfassungspolitische Antwort!,Dr. Hermann Ott,,data/txt/17042.txt,Dr. Hermann Ott [BÜNDNIS 90/DIE GRÜNEN],gruene,poi
91900,42,17,0,1083,"- Das ist unser Selbstverständnis. Ich rate als Jurist, aber auch als Parlamentarier dazu, bei verfassungsrechtlichen Fragen nicht zu eifern und zu geifern, sondern sie nach bestem Gewissen und Wissen zu beantworten. Das ist mein Rat dafür, wie wir mit verfassungsrechtlichen Fragen umgehen sollten.",Dr. Norbert Röttgen,,data/txt/17042.txt,"Dr. Norbert Röttgen, Bundesminister für Umwelt, Naturschutz und Reaktorsicherheit",,speech
91901,42,17,0,1084,Beifall bei der CDU/CSU und der FDP,,,data/txt/17042.txt,,,poi
91902,42,17,0,1085,"Die Bundesregierung wird das tun. Sie haben darauf hingewiesen: Die Verfassungsressorts und die beteiligten Fachressorts werden ihre Auffassung dazu bis Anfang des nächsten Monats darlegen. Dann ist die Position der Bundesregierung klar.

Das war meine verfassungsrechtliche Anmerkung zu dem Thema. Ich möchte aber auch noch zwei politische Anmerkungen machen:

Erste politische Anmerkung. Die Energiepolitik wird in Zukunft noch mehr, als das in der Vergangenheit auch schon der Fall war, nur dann erfolgreich sein können, wenn eine enge Abstimmung zwischen dem Bund und den Ländern erfolgt. Der Umbau von der bisherigen Energieversorgung zur Energieversorgung mittels erneuerbarer Energien mit den dazu notwendigen Veränderungen - ich nenne nur einmal den Netzausbau - bedarf einer engen Abstimmung und auch einer Kongruenz von Bund und Ländern. Darum ist der faire Umgang zwischen dem Bund und den Ländern an dieser Stelle Voraussetzung für den Erfolg der Energiepolitik für Deutschland.

Deshalb lege ich Wert darauf, dass wir die Energiepolitik gemeinsam mit den Ländern gestalten, und zwar, wenn es nach mir geht, auch über parteipolitische Grenzen hinweg, weil es eine grundlegende Aufgabe in Bezug auf die Infrastruktur und entscheidend für die Zukunft unseres Landes ist, die Energieversorgung sicher, klimaverträglich und wettbewerbsfähig zu realisieren. Wir sollten uns diesen Konsens und das Bemühen darum erhalten, bei einigen wichtigen Zukunftsfragen dieses Landes über Parteigrenzen hinweg konsensfähig zu bleiben.",Dr. Norbert Röttgen,,data/txt/17042.txt,"Dr. Norbert Röttgen, Bundesminister für Umwelt, Naturschutz und Reaktorsicherheit",,speech
91903,42,17,0,1086,Beifall bei der CDU/CSU und der FDP,,,data/txt/17042.txt,,,poi
91904,42,17,0,1087,"Zweite politische Anmerkung. Die Energiewirtschaft hat durchaus unterschiedliche Interessen - legitimerweise übrigens. Die kommunalen Unternehmen suchen ihre Chance im Markt und sagen: Durch eine Laufzeitverlängerung wird eine Wettbewerbssituation zementiert, in der wir keine Chance haben. - Andere sagen: Wir stehen gerade vor dem Markteintritt und hätten mit Laufzeitverlängerungen die Chance, so viel Gewinne wie noch nie zuvor zu machen. - Andererseits besteht die Notwendigkeit, auf die Energieversorgung mittels erneuerbarer Energien umzusteuern bzw. umzuschalten.

Das heißt, in der Energiewirtschaft, die hinsichtlich der erneuerbaren Energien eine mittelständische Branche und hinsichtlich der traditionellen Energieträger oligopolistisch geprägt ist - daneben wird es zu einem Wettbewerbseintritt der kommunalen Unternehmen kommen -, gibt es eine sehr heterogene Interessenlage. Es gibt aber ein gemeinsames Interesse der gesamten Energiewirtschaft. Das ist das Interesse an Klarheit durch die Politik.",Dr. Norbert Röttgen,,data/txt/17042.txt,"Dr. Norbert Röttgen, Bundesminister für Umwelt, Naturschutz und Reaktorsicherheit",,speech
91905,42,17,0,1088,Die hatten wir geschaffen!,Rolf Hempelmann,,data/txt/17042.txt,Rolf Hempelmann [SPD],spd,poi
91906,42,17,0,1089,"Die Energiewirtschaft hat ein berechtigtes Interesse an Klarheit und Sicherheit. Diese müssen wir ihnen bieten, weil das Maß an Unsicherheit, das wir auch durch verfassungsrechtliche Risiken produzieren, zu einer Investitionszurückhaltung der Energiewirtschaft führen würde.",Dr. Norbert Röttgen,,data/txt/17042.txt,"Dr. Norbert Röttgen, Bundesminister für Umwelt, Naturschutz und Reaktorsicherheit",,speech
91907,42,17,0,1090,Seit neun Monaten!,Rolf Hempelmann,,data/txt/17042.txt,Rolf Hempelmann [SPD],spd,poi
91908,42,17,0,1091,"Die können wir uns nicht leisten. Darum werden wir als Koalition diese Klarheit schaffen, damit die Energieversorgungswirtschaft das bekommt, was sie in jedem Fall berechtigterweise erwartet: Klarheit der politischen Entscheidungen, damit Investitionen erfolgen.

Wir brauchen in jedem Fall Investitionen. Unklarheit, auch die Belastung mit verfassungsrechtlichen Risiken, bedeutet Investitionszurückhaltung, die sich Deutschland nicht leisten kann.",Dr. Norbert Röttgen,,data/txt/17042.txt,"Dr. Norbert Röttgen, Bundesminister für Umwelt, Naturschutz und Reaktorsicherheit",,speech
91909,42,17,0,1092,Beifall bei der CDU/CSU und der FDP,,,data/txt/17042.txt,,,poi
91910,42,17,0,1093,Bei einer Bundestagswahl ist das so!,Ulrich Kelber,,data/txt/17042.txt,Ulrich Kelber [SPD],spd,poi
91911,42,17,0,1094,"Ich hoffe, das war als Selbstkritik gemeint!",Rolf Hempelmann,,data/txt/17042.txt,Rolf Hempelmann [SPD],spd,poi
91912,42,17,0,1095,"Sie werden die Klarheit bekommen, und zwar in dem verfassungsrechtlichen Bemühen, diese herzustellen.

Eine letzte Bemerkung: Nach meinem Urteil diskutieren wir zu viel über Ausstieg und zu wenig über Einstieg. Das ist das Thema. Ich möchte noch einmal betonen, was der Koalitionsvertrag an dieser Stelle sagt. Das Ziel ist eindeutig definiert. Erneuerbare Energien sind die Energieversorgung der Zukunft: weder atomare noch fossile, sondern erneuerbare Energien. Die wollen wir.",Dr. Norbert Röttgen,,data/txt/17042.txt,"Dr. Norbert Röttgen, Bundesminister für Umwelt, Naturschutz und Reaktorsicherheit",,speech
91913,42,17,0,1096,Beifall bei Abgeordneten der SPD,,,data/txt/17042.txt,,,poi
