id,sitzung,wahlperiode,in_writing,sequence,text,speaker_cleaned,speaker_fp,filename,speaker,speaker_party,type
91692,42,17,0,875,"Beabsichtigt die Bundesregierung, den Bundesbankpräsidenten Axel Weber als Nachfolger für Jean-Claude Trichet für den Vorsitz der Europäischen Zentralbank vorzuschlagen, und hat sie dazu bereits Absprachen mit anderen europäischen Staaten getroffen?

Wie schätzt die Bundesregierung die Eignung von Axel Weber als Präsident der Europäischen Zentralbank ein angesichts der Tatsache, dass er als Präsident der Bundesbank im Rahmen der laufenden Aufsicht nicht verhindert hat, dass die deutschen Landesbanken zu den weltweit größten Abnehmern von drittklassigen Verbriefungsprodukten gehörten und im Zuge der Krise daher HSH Nordbank, SachsenLB, LBBW und Bayern LB nur mithilfe staatlicher Unterstützungen überleben konnten?

Bitte schön, Herr Staatssekretär.",Damit kommen wir zu den Fragen 5 und 6 der Kollegin Lisa Paus,,data/txt/17042.txt,Damit kommen wir zu den Fragen 5 und 6 der Kollegin Lisa Paus,,speech
91693,42,17,0,876,"Kollegin Paus, die Bundesregierung möchte Ihre erste Frage wie folgt beantworten: Die Amtszeit des Präsidenten der Europäischen Zentralbank läuft noch bis Oktober 2011. Aus Sicht der Bundesregierung ist es jetzt viel zu früh für eine Nachfolgediskussion. Dies gebietet auch der Respekt gegenüber dem Amtsinhaber und seiner erfolgreichen Arbeit. Wir schätzen Jean-Claude Trichet sehr.",Steffen Kampeter,,data/txt/17042.txt,"Steffen Kampeter, Parl. Staatssekretär beim Bundesminister der Finanzen",,speech
91694,42,17,0,877,"Wenn Sie Nachfragen haben, bitte.",Dr. h. c. Wolfgang Thierse,,data/txt/17042.txt,Vizepräsident Dr. h. c. Wolfgang Thierse,,chair
91695,42,17,0,878,"Herr Kampeter, wie erklärt sich die Bundesregierung dann die Berichterstattung im Handelsblatt vom 12. Mai 2010, nach der dies der Preis der Zustimmung zum Euro-Rettungsschirm seitens der deutschen Bundesregierung gewesen sein soll?",Lisa Paus,,data/txt/17042.txt,Lisa Paus (BÜNDNIS 90/DIE GRÜNEN),gruene,speech
91696,42,17,0,879,"Frau Kollegin Paus, manchmal wundert sich auch die Regierung, was deutsche Zeitungen über die Regierung schreiben.",Steffen Kampeter,,data/txt/17042.txt,"Steffen Kampeter, Parl. Staatssekretär beim Bundesminister der Finanzen",,speech
91697,42,17,0,880,Vereinzelt Heiterkeit,,,data/txt/17042.txt,,,poi
91698,42,17,0,881,"Von daher kann ich Ihnen keine näheren Erkenntnisse über den Inhalt der Recherche des von Ihnen genannten Publikationsorgans geben. Richtig ist, dass in den deutschen Medien zweifelsohne eine informelle Diskussion über die Nachfolge stattfindet. Aber die Bundesregierung beabsichtigt nicht, sich an dieser Nachfolgediskussion öffentlich zu beteiligen. Wir werden zu einem gegebenen Zeitpunkt - der jetzige wäre zu früh - unsere Gedanken über die Nachfolge und gegebenenfalls auch unsere Vorschläge zur Nachfolge des derzeitigen Präsidenten der Europäischen Zentralbank einbringen.",Steffen Kampeter,,data/txt/17042.txt,"Steffen Kampeter, Parl. Staatssekretär beim Bundesminister der Finanzen",,speech
91699,42,17,0,882,"Haben Sie eine weitere Nachfrage? - Bitte schön, Kollegin Paus.",Dr. h. c. Wolfgang Thierse,,data/txt/17042.txt,Vizepräsident Dr. h. c. Wolfgang Thierse,,chair
91700,42,17,0,883,"Habe ich Sie richtig verstanden, dass es an diesem Wochenende keine Nebenabsprachen der Bundesregierung gegeben hat?",Lisa Paus,,data/txt/17042.txt,Lisa Paus (BÜNDNIS 90/DIE GRÜNEN),gruene,speech
91701,42,17,0,884,"Frau Kollegin, ich war zwar nicht dabei; aber mir sind keine Nebenabsprachen bekannt bzw. bekannt gemacht worden.",Steffen Kampeter,,data/txt/17042.txt,"Steffen Kampeter, Parl. Staatssekretär beim Bundesminister der Finanzen",,speech
91702,42,17,0,885,"Kollege Beck, bitte.",Dr. h. c. Wolfgang Thierse,,data/txt/17042.txt,Vizepräsident Dr. h. c. Wolfgang Thierse,,chair
91703,42,17,0,886,"Ich muss unangenehmerweise nachfassen. Es ist uns in Fragestunden hin und wieder aufgefallen, dass den Staatssekretären manches nicht bekannt ist. Können Sie der Kollegin Paus im Nachgang schriftlich mitteilen, ob es tatsächlich keine Gespräche der Bundesregierung mit anderen Staaten der Europäischen Union über eine Nachfolgeregelung gegeben hat? Können Sie, falls, wie es die Kollegin in ihrer Frage formuliert, ""bereits Absprachen mit anderen europäischen Staaten getroffen"" wurden, schriftlich mitteilen, welche Gespräche dazu mit welchem Staat, bei welcher Gelegenheit und mit welchem Ergebnis geführt wurden?",Volker Beck,,data/txt/17042.txt,Volker Beck (Köln) (BÜNDNIS 90/DIE GRÜNEN),gruene,speech
91704,42,17,0,887,"Herr Kollege Beck, ich glaube, dass die Bundesregierung in umfassender Art und Weise auf die Frage geantwortet hat. Ich will mich selbstverständlich gerne bemühen, der Kollegin Paus in schriftlicher Form ergänzende Hinweise zu geben.",Steffen Kampeter,,data/txt/17042.txt,"Steffen Kampeter, Parl. Staatssekretär beim Bundesminister der Finanzen",,speech
91705,42,17,0,888,Wahrheitsgemäß und umfassend!,Volker Beck,,data/txt/17042.txt,Volker Beck [Köln] [BÜNDNIS 90/DIE GRÜNEN],gruene,poi
91706,42,17,0,889,"- Wahrheitsgemäß und umfassend. Im Übrigen können Sie mich alles fragen, was Sie wollen; ich freue mich jederzeit, Sie zu sehen und zu sprechen.",Steffen Kampeter,,data/txt/17042.txt,"Steffen Kampeter, Parl. Staatssekretär beim Bundesminister der Finanzen",,speech
91707,42,17,0,890,"Dass wir alles fragen dürfen, ist uns schon aufgefallen!",Volker Beck,,data/txt/17042.txt,Volker Beck [Köln] [BÜNDNIS 90/DIE GRÜNEN],gruene,poi
91708,42,17,0,891,,Steffen Kampeter,,data/txt/17042.txt,"Steffen Kampeter, Parl. Staatssekretär beim Bundesminister der Finanzen",,speech
91709,42,17,0,892,"Danke schön, Herr Staatssekretär. - Die Frage 7 des Abgeordneten Günter Gloser wird schriftlich beantwortet.

Damit kommen wir zum Geschäftsbereich des Bundesministeriums für Wirtschaft und Technologie. Zur Beantwortung steht der Parlamentarische Staatssekretär Ernst Burgbacher zur Verfügung.

Wir kommen zur Frage 8 des Kollegen Hans-Joachim Hacker:

Beabsichtigt die Bundesregierung nach dem Urteil des Oberverwaltungsgerichts Greifswald über die Aufhebung der ""Bäderregelung"" zur Sonntags-Ladenöffnung in Mecklenburg-Vorpommern ein konzertiertes Vorgehen mit den Ländern, um im Interesse der Tourismusbranche und der Beschäftigten dauerhafte gerichtsfeste Regelungen zu schaffen?

Bitte schön, Herr Staatssekretär.",Dr. h. c. Wolfgang Thierse,,data/txt/17042.txt,Vizepräsident Dr. h. c. Wolfgang Thierse,,chair
91710,42,17,0,893,"Sehr geehrter Herr Kollege Hacker, mit dem Inkrafttreten der Föderalismusreform zum 1. September 2006 haben die Länder die ausschließliche Gesetzgebungskompetenz für das Ladenschlussrecht erhalten. Die Länder können daher jetzt die gesetzlichen Ladenöffnungszeiten in eigener Zuständigkeit regeln. Dies umfasst auch die Frage der Sonntagsöffnungen. Die Länder und Kommunen können unter Berücksichtigung des vom Bundesverfassungsgericht mit seiner Entscheidung vom 1. Dezember 2009 gesetzten Rahmens in eigener Verantwortung entscheiden, wie sie das gesetzliche Schutzkonzept zur Gewährleistung der Sonn- und Feiertagsruhe erfüllen. Der Bund hält es für richtig, diesen Handlungsspielraum in vollem Umfang bei den Ländern zu belassen.",Ernst Burgbacher,,data/txt/17042.txt,"Ernst Burgbacher, Parl. Staatssekretär beim Bundesminister für Wirtschaft und Technologie",,speech
91711,42,17,0,894,"Herr Kollege, haben Sie eine Nachfrage?",Dr. h. c. Wolfgang Thierse,,data/txt/17042.txt,Vizepräsident Dr. h. c. Wolfgang Thierse,,chair
91712,42,17,0,895,Ja.,Hans-Joachim Hacker,,data/txt/17042.txt,Hans-Joachim Hacker (SPD),spd,speech
91713,42,17,0,896,Bitte schön.,Dr. h. c. Wolfgang Thierse,,data/txt/17042.txt,Vizepräsident Dr. h. c. Wolfgang Thierse,,chair
91714,42,17,0,897,"Vielen Dank. - Sehr geehrter Herr Burgbacher, die verfassungsrechtlichen Grundlagen waren mir natürlich bekannt, als ich die Frage stellte.",Hans-Joachim Hacker,,data/txt/17042.txt,Hans-Joachim Hacker (SPD),spd,speech
91715,42,17,0,898,Das denke ich!,Ernst Burgbacher,,data/txt/17042.txt,"Ernst Burgbacher, Parl. Staatssekretär",,poi
91716,42,17,0,899,"Meine Frage richtete sich eigentlich darauf, ob die Bundesregierung im Sinne des Mittelstandes, der gerade für den Bereich der Tourismuswirtschaft prägend ist, einen Aktionsplan entwickeln könnte. Vor dem Hintergrund eines sich breitmachenden Wettbewerbsföderalismus in der Tourismusbranche leite ich daraus folgende Frage ab: Wie will die Bundesregierung darauf Einfluss nehmen, dass es bei Fortbestehen unterschiedlicher Regelungen zu den Sonntags-Ladenöffnungszeiten, der sogenannten Bäderregelung, zu keinen weiteren Wettbewerbsverzerrungen zwischen den Ländern kommt, unter denen insbesondere kleinere Gewerbetreibende zu leiden hätten?

Ich stelle die Frage, weil die Bundesregierung in der Vergangenheit und auch gegenwärtig in anderen Bereichen eine Koordinierungsfunktion übernommen hat. Ich nenne nur das Thema DZT, wo klare verfassungsrechtliche Regelungen bestehen, aber trotzdem seitens der Bundesregierung Handlungsbedarf gesehen wird. Herr Staatssekretär, ein solcher Handlungsbedarf müsste doch eigentlich auch hier bestehen.",Hans-Joachim Hacker,,data/txt/17042.txt,Hans-Joachim Hacker (SPD),spd,speech
91717,42,17,0,900,"Sehr geehrter Herr Kollege Hacker, bei der DZT liegt der Sachverhalt anders. Dort wurde versucht, ein gemeinsames Marketing der Länder einzuführen, das von den Ländern getragen wird. Dies wurde damals eingerichtet. Die Regelung der von Ihnen angesprochenen Frage basiert auf der Föderalismusreform. In diesem Hause bestand breiter Konsens darüber, hier zu mehr Wettbewerb zu kommen. Das Recht zur Regelung der Öffnungszeiten wurde ausdrücklich den Ländern übergeben. Deshalb müssen die Länder dies regeln.

Sie beklagen, dass hier ein Wettbewerb besteht, unter dem kleine und mittlere Unternehmen leiden. Wenn Sie daran etwas ändern wollen, müssen Sie auf die Landesregierung zugehen; entsprechende Regelungen müssen in den Ländern getroffen werden. Der Bund hält es für falsch, hier von sich aus Vorgaben zu machen.",Ernst Burgbacher,,data/txt/17042.txt,"Ernst Burgbacher, Parl. Staatssekretär beim Bundesminister für Wirtschaft und Technologie",,speech
91718,42,17,0,901,"Eine weitere Nachfrage? - Das ist nicht der Fall.

Die Fragen 9 und 10 des Kollegen Heinz Paula werden schriftlich beantwortet.

Wir kommen zur Frage 11 des Kollegen Manfred Nink:

Welche Vorschläge und Konzepte hat die Bundesregierung hinsichtlich einer stärkeren Koordinierung und Steuerung der Wirtschaftspolitik zur Umsetzung der vom Europäischen Rat in der neuen Strategie für die Europäische Union beschlossenen Leitziele, und wann beabsichtigt sie, mit der Umsetzung ihres Konzeptes zu beginnen?

Bitte schön, Herr Staatssekretär.",Dr. h. c. Wolfgang Thierse,,data/txt/17042.txt,Vizepräsident Dr. h. c. Wolfgang Thierse,,chair
91719,42,17,0,902,"Herr Kollege Nink, die Antwort auf die Frage 11 lautet: Die Bundesregierung hat sich bereits seit Beginn des Diskussionsprozesses zur Lissabon-Nachfolgestrategie für eine stärkere Rolle des Europäischen Rates zur stärkeren Koordinierung und Steuerung der Wirtschaftspolitik eingesetzt. Dazu liegt eine entsprechende Beschlussfassung - Sie kennen sie sicher - des Europäischen Rates vom 25./26. März dieses Jahres vor.

Die Bundesregierung wird bei den anstehenden Treffen des Europäischen Rates - das nächste findet am 17./18. Juni 2010 statt - ihren Beitrag zur Ausfüllung der dem Europäischen Rat zugewiesenen wichtigen Rolle leisten. Die Bundesregierung hält es darüber hinaus für dringlich, Gewicht und die politische Sichtbarkeit der Überwachung von strukturpolitischen Fehlentwicklungen durch ein eigenständiges Verfahren zu erhöhen. Die EU-Kommission hat hierzu in ihrer Mitteilung vom 12. Mai 2010 erste Vorschläge gemacht. Sie werden intensiv zu diskutieren und weiter auszubauen sein. Wir haben schon in der Debatte am Freitag und auch heute wieder erlebt, dass wir über genau diese Dinge sehr intensiv diskutieren.",Ernst Burgbacher,,data/txt/17042.txt,"Ernst Burgbacher, Parl. Staatssekretär beim Bundesminister für Wirtschaft und Technologie",,speech
91720,42,17,0,903,"Herr Kollege, bitte schön.",Dr. h. c. Wolfgang Thierse,,data/txt/17042.txt,Vizepräsident Dr. h. c. Wolfgang Thierse,,chair
91721,42,17,0,904,"Herr Staatssekretär, ich habe noch eine Nachfrage. Wie sehen Sie die zukünftige Beteiligung des Parlamentes an der Meinungsfindung und an der Umsetzung der Ziele?",Manfred Nink,,data/txt/17042.txt,Manfred Nink (SPD),spd,speech
91722,42,17,0,905,"Wir müssen zwei Ebenen unterscheiden. Selbstverständlich muss der deutsche Bundestag in alle Schritte weiter eingebunden werden. Wir wollen keine europäische Wirtschaftspolitik mit Kompetenzen bei der EU, sondern wir wollen, wie ich das ausgeführt habe, eine stärkere Koordinierung, teilweise auch Steuerung. Selbstverständlich aber bleibt Wirtschaftspolitik mit allen Rechten und Pflichten des Parlaments in nationaler Kompetenz. Eine ganz andere Frage, über die wir heute aber nicht reden, ist natürlich die Beteiligung des Europäischen Parlaments.",Ernst Burgbacher,,data/txt/17042.txt,"Ernst Burgbacher, Parl. Staatssekretär beim Bundesminister für Wirtschaft und Technologie",,speech
91723,42,17,0,906,"Wir kommen zur Frage 12 des Kollegen Nink:

Welche Möglichkeiten sieht die Bundesregierung, die Mitgliedstaaten der EU zur Umsetzung der Leitziele zu bewegen, und wie bewertet sie die von EU-Ratspräsident Herman Van Rompuy vorgeschlagenen Sanktionsmaßnahmen bei Zielverfehlung bzw. Belohnungssysteme bei Zielerreichung?

Bitte schön.",Dr. h. c. Wolfgang Thierse,,data/txt/17042.txt,Vizepräsident Dr. h. c. Wolfgang Thierse,,chair
91724,42,17,0,907,"Herr Kollege Nink, die Antwort auf diese Frage ist: Die stärkere Rolle des Europäischen Rates zur stärkeren Koordinierung und Steuerung zielt darauf ab, die erfolgreiche Umsetzung der Ziele der neuen Strategie zu befördern. Die Bundesregierung hält sowohl Sanktionsmaßnahmen bei Zielverfehlungen als auch Belohnungs-systeme bei Erreichung der quantitativen Oberziele der Strategie Europa 2020 für ungeeignet, da sie dem Charakter des partnerschaftlichen Dialoges zwischen den Mitgliedstaaten und der Europäischen Kommission widersprechen.",Ernst Burgbacher,,data/txt/17042.txt,"Ernst Burgbacher, Parl. Staatssekretär beim Bundesminister für Wirtschaft und Technologie",,speech
91725,42,17,0,908,"Herr Kollege, bitte schön.",Dr. h. c. Wolfgang Thierse,,data/txt/17042.txt,Vizepräsident Dr. h. c. Wolfgang Thierse,,chair
91726,42,17,0,909,"Sehen Sie keinen Widerspruch darin, dass wir jetzt beim Schnüren des neuen Finanzpaketes doch Sanktionen verhängen wollen?",Manfred Nink,,data/txt/17042.txt,Manfred Nink (SPD),spd,speech
91727,42,17,0,910,"Herr Kollege, wir wollen Sanktionen dann verhängen, wenn Länder den Stabilitäts- und Wachstumspakt verletzen. Wir arbeiten darauf hin, ihn eventuell neu zu formulieren. Das ist aber etwas anderes als die Strategie 2020, bei der wir erst dabei sind, quantitative Ziele zu formulieren.

Es geht zum Beispiel darum, welchen Prozentsatz die Bildungsausgaben am Haushalt ausmachen oder wie hoch der Beschäftigungsgrad der Personen zwischen 20 und 65 Jahren sein muss. Hierbei können Sie schlecht mit Sanktionen oder Belohnungen arbeiten. Das wäre ein Stück weit Aufgabe unserer Politik und widerspräche, wie gesagt, dem partnerschaftlichen Ansatz, den wir in der Union verfolgen.",Ernst Burgbacher,,data/txt/17042.txt,"Ernst Burgbacher, Parl. Staatssekretär beim Bundesminister für Wirtschaft und Technologie",,speech
91728,42,17,0,911,Danke!,Manfred Nink,,data/txt/17042.txt,Manfred Nink [SPD],spd,poi
91729,42,17,0,912,,Ernst Burgbacher,,data/txt/17042.txt,"Ernst Burgbacher, Parl. Staatssekretär beim Bundesminister für Wirtschaft und Technologie",,speech
91730,42,17,0,913,Eine weitere Nachfrage?,Dr. h. c. Wolfgang Thierse,,data/txt/17042.txt,Vizepräsident Dr. h. c. Wolfgang Thierse,,chair
91731,42,17,0,914,"Nein, danke.",Manfred Nink,,data/txt/17042.txt,Manfred Nink (SPD),spd,speech
91732,42,17,0,915,"Das ist nicht der Fall.

Die Frage 13 des Kollegen Michael Groß und die Frage 14 der Kollegin Katja Keul werden schriftlich beantwortet.

Ich rufe die Frage 15 der Kollegin Doris Barnett auf:

In welchem Rahmen plant die Bundesregierung bezüglich des gerade eingeführten Gesetzes über das Verfahren des elektronischen Entgeltnachweises, ELENA, kleine und mittelständische Unternehmen, KMU, zu bevorzugen und von der Meldeverpflichtung zu entbinden, und welche Auswirkungen hätte das Herauslösen von KMU aus dem ELENA-Verfahren auf das System insgesamt?

Bitte schön, Herr Staatssekretär.",Dr. h. c. Wolfgang Thierse,,data/txt/17042.txt,Vizepräsident Dr. h. c. Wolfgang Thierse,,chair
91733,42,17,0,916,"Frau Kollegin Barnett, ich beantworte die Frage 15 wie folgt: Die Bundesregierung wird eine mögliche Belastung von Kleinst- und Kleinunternehmen durch das ELENA-Verfahren sowie gegebenenfalls geeignete Maßnahmen zur Abhilfe prüfen. Die rechtlichen und faktischen Prüfungen, insbesondere der Auswirkungen auf das Gesamtverfahren, sind hierzu noch nicht abgeschlossen. Ich bitte Sie um Verständnis, dass ich das Ergebnis der Prüfung nicht vorwegnehmen kann, zumal an dem Verfahren drei Häuser beteiligt sind und es dadurch ein Stück komplizierter ist.",Ernst Burgbacher,,data/txt/17042.txt,"Ernst Burgbacher, Parl. Staatssekretär beim Bundesminister für Wirtschaft und Technologie",,speech
91734,42,17,0,917,Nachfrage? - Bitte.,Dr. h. c. Wolfgang Thierse,,data/txt/17042.txt,Vizepräsident Dr. h. c. Wolfgang Thierse,,chair
91735,42,17,0,918,"Bedenken Sie bei Ihren Prüfungen, dass die Datenübertragung an die anderen sozialen Sicherungssysteme bis hin zur Finanzverwaltung möglicherweise ebenfalls betroffen sein könnte? Wären sie ebenfalls aus dem Verfahren herausgelöst, dann müsste das finanziell in irgendeiner Weise abgegolten werden, weil die Daten benötigt werden.",Doris Barnett,,data/txt/17042.txt,Doris Barnett (SPD),spd,speech
91736,42,17,0,919,"Frau Kollegin, wir sprechen ausschließlich über das ELENA-Verfahren. Wir haben das schon immer isoliert, also ausdrücklich von anderen Verfahren losgelöst, durchgeführt. Das scheint mir auch unter datenschutzrechtlichen Bestimmung sehr wichtig zu sein. Wir übertragen Daten an eine zentrale Speichereinheit zur Erstellung der Nachweise. Darum geht es.

Wir wissen - im Ausschuss haben wir das mehrfach diskutiert -, dass es im Augenblick gerade bei kleinen und mittleren Unternehmen große Probleme gibt. Wir beide bekommen wahrscheinlich eine Menge Briefe zu diesem Thema. Wir prüfen zusammen mit den anderen beteiligten Häusern - BMJ, BMAS und BMI -, ob es weitere Möglichkeiten gibt. Wir befinden uns noch in der Prüfung.",Ernst Burgbacher,,data/txt/17042.txt,"Ernst Burgbacher, Parl. Staatssekretär beim Bundesminister für Wirtschaft und Technologie",,speech
91737,42,17,0,920,"Ich habe noch eine Verständnisfrage. Sie haben gesagt, dass Sie ELENA auf mögliche datenschutzrechtliche Probleme prüfen. Habe ich Sie richtig verstanden, dass Sie das hingegen nicht prüfen, wenn es um die Massenübermittlung von Daten an die sozialen Sicherungssysteme und an das Finanzamt geht?",Doris Barnett,,data/txt/17042.txt,Doris Barnett (SPD),spd,speech
91738,42,17,0,921,"Nein, wir haben nicht über das Datenschutzrecht, sondern ich habe über das System ELENA gesprochen. Darüber diskutieren wir. Wir prüfen, ob man kleine und mittlere Unternehmen von der Übermittlung von Daten an die zentrale Speicherstelle ausnehmen kann.",Ernst Burgbacher,,data/txt/17042.txt,"Ernst Burgbacher, Parl. Staatssekretär beim Bundesminister für Wirtschaft und Technologie",,speech
91739,42,17,0,922,Es gibt eine Nachfrage der Kollegin Zypries. Bitte schön.,Dr. h. c. Wolfgang Thierse,,data/txt/17042.txt,Vizepräsident Dr. h. c. Wolfgang Thierse,,chair
91740,42,17,0,923,"Herr Burgbacher, mich würde interessieren, was genau Sie in diesem Zusammenhang prüfen. Mir scheint es so zu sein, dass es vor allen Dingen einer politischen Entscheidung bedarf, ob man kleine und mittlere Unternehmen von der Meldepflicht entbindet.",Brigitte Zypries,,data/txt/17042.txt,Brigitte Zypries (SPD),spd,speech
91741,42,17,0,924,"Frau Kollegin Zypries, Sie wissen sicherlich, dass es aufgrund des Urteils des Bundesverfassungsgerichts eine juristische Bewertung hinsichtlich des Datenschutzes geben muss. Wir prüfen ernsthafte Einwendungen verschiedener Unternehmen, die darauf aufmerksam gemacht haben, dass sie mit der derzeitigen Regelung nicht klarkommen. Sie müssen beachten, dass die Übermittlung für große Unternehmen in der Regel kein Problem ist, weil sie die Software haben, um die Daten per Knopfdruck zu übermitteln. Aber viele kleine und mittlere Unternehmen teilen uns mit, dass die Übermittlung der Daten ein hoher Kostenfaktor für sie ist, weil sie es selbst nicht machen können, sondern einen Steuerberater einschalten müssen. Ihre Kosten steigen deshalb.

Ich als Mittelstandsbeauftragter der Bundesregierung nehme das besonders ernst. Wir prüfen, wie sich das auf das gesamte System auswirken würde. Das kann man nicht ohne Weiteres vorhersehen. Ich kann Ihnen so viel sagen: Ich habe mit meinen Mitarbeiterinnen und Mitarbeitern darüber gesprochen, dass es einige Probleme gibt. Ich bitte Sie um Verständnis; denn es macht nicht viel Sinn, während eines Prüfungsprozesses Zwischenergebnisse herauszugeben, die es im Übrigen auch noch nicht gibt.",Ernst Burgbacher,,data/txt/17042.txt,"Ernst Burgbacher, Parl. Staatssekretär beim Bundesminister für Wirtschaft und Technologie",,speech
91742,42,17,0,925,Gibt es einen Zeithorizont?,Brigitte Zypries,,data/txt/17042.txt,Brigitte Zypries (SPD),spd,speech
91743,42,17,0,926,"Das Gesetz ist zum 1. Januar in Kraft getreten. Daten werden bereits übermittelt. Das alles wurde vor unserer Zeit verabschiedet. Zum Thema Bürokratieabbau muss man deutlich sagen: Bei kleineren Unternehmen zeigt sich keine entsprechende Wirkung. Wir werden das Herauslösen von KMU so schnell wie möglich prüfen, aber der Vorgang muss mit weiteren Häusern abgestimmt werden.",Ernst Burgbacher,,data/txt/17042.txt,"Ernst Burgbacher, Parl. Staatssekretär beim Bundesminister für Wirtschaft und Technologie",,speech
91744,42,17,0,927,"Ich rufe die Frage 16 der Kollegin Barnett auf:

Welcher datenschutzrechtlichen Vorkehrungen bedarf es hinsichtlich der Übertragung und Verwaltung von Arbeitnehmerdaten an Dritte, die die Datenverwaltung für den Arbeitgeber übernommen haben - zum Beispiel Steuerbüros -, und in welchem Umfang können Arbeitnehmer eine Dateneinsicht dort vornehmen?",Dr. h. c. Wolfgang Thierse,,data/txt/17042.txt,Vizepräsident Dr. h. c. Wolfgang Thierse,,chair
91745,42,17,0,928,"Der Arbeitgeber hat bei der Übermittlung von Arbeitnehmerdaten an Dritte, zum Beispiel - ich habe es eben ausgeführt - an seinen Steuerberater, unterschiedliche datenschutzrechtliche Anforderungen zu erfüllen. Sofern im konkreten Einzelfall keine bereichsspezifischen Datenschutzvorschriften anzuwenden sind, kommen die Anforderungen des Bundesdatenschutzgesetzes zur Anwendung. Ich möchte an dieser Stelle noch einmal darauf hinweisen, dass es sich hierbei um keine spezifisch das ELENA-Verfahren betreffende Datenübermittlung handelt.",Ernst Burgbacher,,data/txt/17042.txt,"Ernst Burgbacher, Parl. Staatssekretär beim Bundesminister für Wirtschaft und Technologie",,speech
91746,42,17,0,929,"Ihre Nachfrage, bitte.",Dr. h. c. Wolfgang Thierse,,data/txt/17042.txt,Vizepräsident Dr. h. c. Wolfgang Thierse,,chair
91747,42,17,0,930,"Aber Sie geben mir doch Recht, Herr Staatssekretär, dass die Daten, die an ELENA übermittelt werden, die gleichen sind wie die, die an die Steuerberaterbüros übermittelt werden, die dann die Daten wieder herausrücken müssen?

Darüber hinaus haben Sie noch nicht die Frage beantwortet, wie die Arbeitnehmer, anders als bei ELENA, wenn die Daten einmal abgespeichert sind, Einsicht nehmen können, was alles beim Steuerberater abgespeichert ist.",Doris Barnett,,data/txt/17042.txt,Doris Barnett (SPD),spd,speech
91748,42,17,0,931,"Frau Kollegin Barnett, in Ihrer Frage liegt eigentlich schon ein Teil der Antwort. Dadurch, dass die kleinen Unternehmen Daten an den Steuerberater geben, der diese aufarbeitet, wird deutlich, dass dies andere Daten mit einem anderen Informationsgehalt sind. Es sind ja nicht diese Daten, die weitergeleitet werden, sondern die vom Steuerberater aufgearbeiteten werden an ELENA weitergeleitet. Deshalb macht es keinen Sinn, das zu übertragen.

Wir haben - eigentlich müsste man sagen: Sie haben - für ELENA ein sehr striktes Datenregime beschlossen. Für alle anderen Datenübertragungen gibt es das Bundesdatenschutzgesetz mit all seinen Auswirkungen. Wenn es da Bereiche gibt, mit denen Sie nicht einverstanden sind, dann müssen die ganz konkret benannt und dann muss das Bundesdatenschutzgesetz geändert werden.",Ernst Burgbacher,,data/txt/17042.txt,"Ernst Burgbacher, Parl. Staatssekretär beim Bundesminister für Wirtschaft und Technologie",,speech
91749,42,17,0,932,Eine weitere Nachfrage.,Dr. h. c. Wolfgang Thierse,,data/txt/17042.txt,Vizepräsident Dr. h. c. Wolfgang Thierse,,chair
91750,42,17,0,933,Die Frage bezüglich der Arbeitnehmer haben Sie immer noch nicht beantwortet.,Doris Barnett,,data/txt/17042.txt,Doris Barnett (SPD),spd,speech
