id,sitzung,wahlperiode,in_writing,sequence,text,speaker_cleaned,speaker_fp,filename,speaker,speaker_party,type
195779,100,17,0,601,Sie haben nach Einführung dieser Steuer gar kein Geld mehr!,Klaus-Peter Flosbach,,data/txt/17100.txt,Klaus-Peter Flosbach [CDU/CSU],cducsu,poi
195780,100,17,0,602,"Mit diesen 10 Milliarden Euro könnten wir locker die 3 Milliarden Euro, die wir für Erziehung und Bildung benötigen, finanzieren.",Michael Schlecht,,data/txt/17100.txt,Michael Schlecht (DIE LINKE),linke,speech
195781,100,17,0,603,Sie haben schon ein ganzes Land ruiniert!,Holger Krestel,,data/txt/17100.txt,Holger Krestel [FDP],fdp,poi
195782,100,17,0,604,"Wir könnten darüber hinaus in Baden-Württemberg mit diesen Mehrerträgnissen problemlos einen starken Aufwuchs bei den erneuerbaren Energien finanzieren, der notwendig ist, damit wir in Baden-Württemberg innerhalb sehr kurzer Zeit aus der Atomenergie aussteigen können.",Michael Schlecht,,data/txt/17100.txt,Michael Schlecht (DIE LINKE),linke,speech
195783,100,17,0,605,Beifall bei der LINKEN,,,data/txt/17100.txt,,,poi
195784,100,17,0,606,"Es gibt im Übrigen auch bei den Grünen in Baden-Württemberg seit kurzem einen Gesinnungswandel. Der Kandidat Kretschmann sagt, er sei dafür, sich bis 2018 bzw. 2019 eher noch mehr zu verschulden, um erneuerbare Energien aufzubauen. Dafür bin ich gar nicht. Ich bin vielmehr dafür, Reiche und Vermögende durch eine Millionärsteuer massiv zu besteuern, damit gerade in Baden-Württemberg, aber auch in anderen Bundesländern der Haushalt konsolidiert werden kann und darüber hinaus auch massiv in Erziehung und Bildung sowie in den Ausbau erneuerbarer Energien und in Energieeinsparmaßnahmen investiert werden kann. Damit kann unser Land vorangebracht werden.

Es ist ja so - das wissen viele wahrscheinlich gar nicht -, dass die Millionärsteuer eine Landessteuer ist. Sie wäre ein gutes Instrument, um den desolaten Zustand der Finanzen in den Ländern zu beenden und damit die Länder in die Lage zu versetzen, die ihnen obliegenden wichtigen Aufgaben der Daseinsvorsorge gerade auch im Bereich von Erziehung und Bildung ohne Verschuldung sauber durchzufinanzieren. Deshalb ist die Millionärsteuer eine zentrale Aufgabe.

Dass SPD und Grüne unserem Antrag nach wie vor reserviert gegenüberstehen, halte ich für sehr bedenklich.",Michael Schlecht,,data/txt/17100.txt,Michael Schlecht (DIE LINKE),linke,speech
195785,100,17,0,607,Zuruf des Abg. Manfred Zöllmer [SPD],,,data/txt/17100.txt,,,poi
195786,100,17,0,608,"Ich habe aber nicht die Hoffnung aufgegeben, dass auch hier eines Tages ein Umdenken einsetzt -",Michael Schlecht,,data/txt/17100.txt,Michael Schlecht (DIE LINKE),linke,speech
195787,100,17,0,609,"Herr Kollege, Sie müssen zum Ende kommen.",Dr. h. c. Wolfgang Thierse,,data/txt/17100.txt,Vizepräsident Dr. h. c. Wolfgang Thierse,,chair
195788,100,17,0,610,"- einen Satz noch - und ein entscheidender Fortschritt erreicht werden kann, jetzt am Sonntag in Baden-Württemberg durch die Abwahl von Mappus, -",Michael Schlecht,,data/txt/17100.txt,Michael Schlecht (DIE LINKE),linke,speech
195789,100,17,0,611,Wahlkampf pur!,Dr. Daniel Volk,,data/txt/17100.txt,Dr. Daniel Volk [FDP],fdp,poi
195790,100,17,0,612,,Michael Schlecht,,data/txt/17100.txt,Michael Schlecht (DIE LINKE),linke,speech
195791,100,17,0,613,"Herr Kollege, Sie müssen zum Ende kommen.",Dr. h. c. Wolfgang Thierse,,data/txt/17100.txt,Vizepräsident Dr. h. c. Wolfgang Thierse,,chair
195792,100,17,0,614,"- und weitere Fortschritte in den folgenden Jahren.

Danke schön.",Michael Schlecht,,data/txt/17100.txt,Michael Schlecht (DIE LINKE),linke,speech
195793,100,17,0,615,Beifall bei der LINKEN,,,data/txt/17100.txt,,,poi
195794,100,17,0,616,"Noch ein Wahlkampfplakat hochhalten, damit die Rede rund wird!",Holger Krestel,,data/txt/17100.txt,Holger Krestel [FDP],fdp,poi
195795,100,17,0,617,,Michael Schlecht,,data/txt/17100.txt,Michael Schlecht (DIE LINKE),linke,speech
195796,100,17,0,618,Das Wort hat nun Gerhard Schick für die Fraktion Bündnis 90/Die Grünen.,Dr. h. c. Wolfgang Thierse,,data/txt/17100.txt,Vizepräsident Dr. h. c. Wolfgang Thierse,,chair
195797,100,17,0,619,"Herr Präsident! Liebe Kolleginnen und Kollegen! Wenn man gegen einen Vorschlag ist, sollte man sich auch überlegen, welche Alternativen es gibt.",Dr. Gerhard Schick,,data/txt/17100.txt,Dr. Gerhard Schick (BÜNDNIS 90/DIE GRÜNEN),gruene,speech
195798,100,17,0,620,Die Alternative ist Schwarz-Gelb!,Dr. Daniel Volk,,data/txt/17100.txt,Dr. Daniel Volk [FDP],fdp,poi
195799,100,17,0,621,"Wir haben deswegen die Einführung einer Vermögensabgabe vorgeschlagen, weil wir wissen, dass der Riesenberg Schulden, den Deutschland in der Finanzkrise angehäuft hat, irgendwie abgetragen werden muss.

Wenn Sie nicht erklären, wer das tragen soll, wird es genauso geschehen wie bei der Wiedervereinigung: Sie werden es über große Staatsverschuldung in die Zukunft schieben und unser Land für die Zukunft stark belasten. Letztendlich müssen es die Arbeitnehmerinnen und Arbeitnehmer über die Sozialversicherungsbeiträge zahlen. Das wollen wir nicht. Geben Sie einmal zu, wer denn bei Ihrer Politik die Lasten tragen wird. Dann wird das Unsoziale Ihrer Politik erst richtig deutlich.",Dr. Gerhard Schick,,data/txt/17100.txt,Dr. Gerhard Schick (BÜNDNIS 90/DIE GRÜNEN),gruene,speech
195800,100,17,0,622,"Beifall beim BÜNDNIS 90/DIE GRÜNEN, bei der SPD und der LINKEN",,,data/txt/17100.txt,,,poi
195801,100,17,0,623,"Herr Volk, ich finde, Lautstärke sollte Wahrheit nicht ersetzen. Sie reden groß von Steuersenkungen. Sagen Sie doch einmal dazu, dass auch unter Ihrer Regierungsbeteiligung Steuern erhöht worden sind. Hier nenne ich nur die Kernbrennstoffsteuer, die Luftverkehrsabgabe und die Tabaksteuer.",Dr. Gerhard Schick,,data/txt/17100.txt,Dr. Gerhard Schick (BÜNDNIS 90/DIE GRÜNEN),gruene,speech
195802,100,17,0,624,Sind Sie dagegen?,Dr. Daniel Volk,,data/txt/17100.txt,Dr. Daniel Volk [FDP],fdp,poi
195803,100,17,0,625,"Machen Sie den Menschen doch nicht immer vor, es gäbe in der Steuerpolitik nur eine Richtung.",Dr. Gerhard Schick,,data/txt/17100.txt,Dr. Gerhard Schick (BÜNDNIS 90/DIE GRÜNEN),gruene,speech
195804,100,17,0,626,Da sind wir euch doch gefolgt! Diese Vorschläge gibt es schon seit Jahren!,Norbert Schindler,,data/txt/17100.txt,Norbert Schindler [CDU/CSU],cducsu,poi
195805,100,17,0,627,"Auch wenn Wahlkampf ist, sollte die Wahrheit bei Ihren Reden nicht ständig unter die Räder kommen.",Dr. Gerhard Schick,,data/txt/17100.txt,Dr. Gerhard Schick (BÜNDNIS 90/DIE GRÜNEN),gruene,speech
195806,100,17,0,628,Beifall beim BÜNDNIS 90/DIE GRÜNEN und bei der LINKEN sowie bei Abgeordneten der SPD,,,data/txt/17100.txt,,,poi
195807,100,17,0,629,"Der Sachverständigenrat hat das Kapitel zur Abgeltungsteuer in seinem Gutachten 2008/2009 mit den Worten ""Nach der Reform ist vor der Reform"" überschrieben, und zwar aus folgendem Grund: Diese Abgeltungsteuer hat so, wie sie eingeführt worden ist, massive Probleme verursacht. Das muss man einfach auch einmal zur Kenntnis nehmen.

Es ist schon interessant, dass Sie zu der Frage, was Sie in diesem Bereich eigentlich machen wollen, heute nichts gesagt haben - gar nichts.",Dr. Gerhard Schick,,data/txt/17100.txt,Dr. Gerhard Schick (BÜNDNIS 90/DIE GRÜNEN),gruene,speech
195808,100,17,0,630,Beim nächsten Tagesordnungspunkt!,Dr. Daniel Volk,,data/txt/17100.txt,Dr. Daniel Volk [FDP],fdp,poi
195809,100,17,0,631,"Ich zitiere das manager magazin, das ja nicht gerade als linksradikales Kampfblatt bekannt ist:

Die seit 2009 geltende Abgeltungsteuer sorgt nicht nur für mehr Ärger und Bürokratie bei der Mehrzahl der Steuerzahler, sondern auch für weniger Einnahmen für den Staat. Sie ist ein Rohrkrepierer.",Dr. Gerhard Schick,,data/txt/17100.txt,Dr. Gerhard Schick (BÜNDNIS 90/DIE GRÜNEN),gruene,speech
195810,100,17,0,632,"Die Abgeltungsteuer ist ... ein riesiges Steuergeschenk für sehr vermögende Bürger.

Das muss man einfach einmal zur Kenntnis nehmen. Es war ein Fehler, sie einzuführen, und zwar aus mehreren Gründen.

Erstens wurde versprochen: Die Abgeltungsteuer hilft uns im Kampf gegen die Steuerhinterziehung. Fakt ist: Dass der Steuerverwaltung über die anonymisierte Vereinnahmung der Kapitalerträge ein wichtiges Indiz fehlt, macht es schwieriger, Steuerhinterziehung zu bekämpfen. Das Gegenteil dessen, was bei der Einführung gesagt wurde, ist der Fall.",Weiter heißt es dort,,data/txt/17100.txt,Weiter heißt es dort,,speech
195811,100,17,0,633,Beifall beim BÜNDNIS 90/DIE GRÜNEN und der LINKEN,,,data/txt/17100.txt,,,poi
195812,100,17,0,634,"Zweitens wurde gesagt: Das Ganze wird einfacher. - Das stimmt nicht. Die Bundesregierung hat auch auf eine Anfrage meiner Kollegin Lisa Paus erklärt: Nur für wenige Leute ist es komplizierter geworden. - Nach Aussage des Sachverständigenrats haben es aber über die Hälfte der Bürgerinnen und Bürger durch die Abgeltungsteuer komplizierter und nicht einfacher. Das Gegenteil dessen, was erreicht werden sollte, ist erreicht worden.

Da muss man sich einfach einmal sagen: Das war nichts. Das war ein Fehler, den man korrigieren muss.",Weiter heißt es dort,,data/txt/17100.txt,Weiter heißt es dort,,speech
195813,100,17,0,635,Beifall beim BÜNDNIS 90/DIE GRÜNEN und der LINKEN,,,data/txt/17100.txt,,,poi
195814,100,17,0,636,"Drittens ist es ein typischer Steinbrück gewesen: guter Spruch, schlechte Substanz. Es stimmt einfach nicht, dass die Einnahmen größer geworden sind. Im Endeffekt sind sie gesunken. Das war auch schon bei der Einführung klar. Der Finanzminister hat mit dem schönen Spruch ""Lieber 25 Prozent von X als 45 Prozent von garnix"" behauptet: Die Einnahmen werden steigen. - Gleichzeitig war in dem Finanztableau schon enthalten, dass die Einnahmen sinken werden.

Die Gründe sind genau die von mir genannten: Die Abgeltungsteuer brachte nicht nur an vielen Stellen eine Verkomplizierung mit sich, sondern war auch ein Steuergeschenk für sehr Vermögende.

Vor diesem Hintergrund muss man einfach einmal konstatieren - ich nehme wahr, dass die Sozialdemokraten auf diesem Weg sind -: Es war ein Fehler, die Abgeltungsteuer einzuführen. Dieser Fehler muss korrigiert werden.",Weiter heißt es dort,,data/txt/17100.txt,Weiter heißt es dort,,speech
195815,100,17,0,637,Beifall beim BÜNDNIS 90/DIE GRÜNEN und bei der LINKEN,,,data/txt/17100.txt,,,poi
195816,100,17,0,638,,Weiter heißt es dort,,data/txt/17100.txt,Weiter heißt es dort,,speech
195817,100,17,0,639,Das Wort hat nun Kollege Christian Freiherr von Stetten für die CDU/CSU-Fraktion.,Dr. h. c. Wolfgang Thierse,,data/txt/17100.txt,Vizepräsident Dr. h. c. Wolfgang Thierse,,chair
195818,100,17,0,640,Beifall bei der CDU/CSU und der FDP,,,data/txt/17100.txt,,,poi
195819,100,17,0,641,,Dr. h. c. Wolfgang Thierse,,data/txt/17100.txt,Vizepräsident Dr. h. c. Wolfgang Thierse,,chair
195820,100,17,0,642,"Herr Präsident! Liebe Kolleginnen und Kollegen! Es ist in dieser Debatte schon erwähnt worden - die Medien haben Anfang dieses Jahres auch sehr ausführlich darüber berichtet -, dass es in der Linksfraktion eine neue Kommunismusdebatte gibt.

Nach meiner persönlichen Meinung haben Sie sich zwar nie aufrichtig vom Kommunismus distanziert.",Christian Freiherr von Stetten,,data/txt/17100.txt,Christian Freiherr von Stetten (CDU/CSU),cducsu,speech
195821,100,17,0,643,Dafür gibt es auch keinen Grund!,Matthias W. Birkwald,,data/txt/17100.txt,Matthias W. Birkwald [DIE LINKE],linke,poi
195822,100,17,0,644,Wir reden hier über Steuerpolitik!,Dr. Gerhard Schick,,data/txt/17100.txt,Dr. Gerhard Schick [BÜNDNIS 90/DIE GRÜNEN],gruene,poi
195823,100,17,0,645,"Aber wenn es noch eines Beweises bedarf, dass der Kommunismus wieder in Ihrer Partei angekommen ist, dann sollte man ruhig Ihren heutigen Antrag zur Wiedererhebung der Vermögensteuer lesen; denn darin steht einiges, was dem sehr nahe kommt.",Christian Freiherr von Stetten,,data/txt/17100.txt,Christian Freiherr von Stetten (CDU/CSU),cducsu,speech
195824,100,17,0,646,Beifall bei der CDU/CSU und der FDP,,,data/txt/17100.txt,,,poi
195825,100,17,0,647,"Damit wir uns nicht falsch verstehen: Wir von der CDU/CSU-Fraktion sind der Auffassung, dass starke Schultern mehr tragen müssen als schwache. Das, was Sie heute hier durchsetzen wollen, kommt aber - das haben alle Redner unserer Koalition deutlich gemacht, glaube ich - einer Enteignung der Bürger nahe. Das ist doch sehr nah am Kommunismus, liebe Kollegen.",Christian Freiherr von Stetten,,data/txt/17100.txt,Christian Freiherr von Stetten (CDU/CSU),cducsu,speech
195826,100,17,0,648,Beifall bei der CDU/CSU und der FDP,,,data/txt/17100.txt,,,poi
195827,100,17,0,649,"Also, wer 1 Million hat, ist enteignet? Das glauben Sie doch selber nicht!",Matthias W. Birkwald,,data/txt/17100.txt,Matthias W. Birkwald [DIE LINKE],linke,poi
195828,100,17,0,650,"Sie fordern heute allen Ernstes, nach Abzug eines Freibetrages eine Steuer von 5 Prozent auf das gesamte private Geldvermögen, auf die Verkehrswerte aller privaten Immobilien und Sachvermögen zu erheben. Das heißt: Wenn ein Familienvater über den Freibetrag hinaus eine Eigentumswohnung besitzt, in der er mit seiner Familie und seinen Kindern wohnt, wird er nach Ihrem Vorschlag nach spätestens 20 Jahren enteignet. Es kann doch nicht der Sinn und Zweck Ihres Gesetzes sein, Wohnungen nach spätestens 20 Jahren staatlich einzuziehen; das ist doch absurd.",Christian Freiherr von Stetten,,data/txt/17100.txt,Christian Freiherr von Stetten (CDU/CSU),cducsu,speech
195829,100,17,0,651,"Die Rechnung stimmt nicht! Die Aussage ist zwar richtig, aber die Rechnung ist falsch!",Dr. Gerhard Schick,,data/txt/17100.txt,Dr. Gerhard Schick [BÜNDNIS 90/DIE GRÜNEN],gruene,poi
195830,100,17,0,652,"Wir legen Wert darauf, festzustellen, dass das nicht nur die Wohnungseigentümer betrifft. Nicht dass Sie hier nachher als Robin Hood der Wohnungsmieterverbände auftreten: Sie treffen damit auch die Wohnungsmieter. Gerade die Mieterverbände müssen ein Interesse daran haben, dass Sie sich heute nicht durchsetzen. Überlegen Sie einmal, welche Folgen es auf dem deutschen Wohnungsmarkt hätte, wenn wir heute eine Vermögensteuer von 5 Prozent auf Immobilien beschließen würden. Nehmen wir hier das Beispiel eines vielleicht von Ihnen nicht geliebten, aber sehr vermögenden Immobilienbesitzers, der heute mit seiner Immobilie eine Rendite von 4 Prozent erreicht: Er müsste, nachdem er seine Ertragsteuer an das Finanzamt überwiesen hat, auch noch eine Substanzsteuer von 5 Prozent auf den Verkehrswert der Immobilien zahlen.

Das kann doch nicht Ihr Ernst sein. Ich möchte jetzt nicht so weit gehen wie der Vorsitzende des Finanzausschusses, der den Verdacht geäußert hat, dass Sie bei der Formulierung des Antrages völlig besoffen waren. Sie sollten aber den Referenten, der Ihnen das aufgeschrieben hat, zumindest einmal überprüfen.",Christian Freiherr von Stetten,,data/txt/17100.txt,Christian Freiherr von Stetten (CDU/CSU),cducsu,speech
195831,100,17,0,653,Beifall bei der FDP,,,data/txt/17100.txt,,,poi
195832,100,17,0,654,"Nehmen wir einmal an, dass Sie wirklich ernst meinen, was Sie uns zur Abstimmung stellen. Im Falle der Einführung einer solchen Steuer würde der Immobilienbesitzer versuchen - das ist völlig klar -, seine Immobilie zu verkaufen. Das Problem wäre nur: Er würde keinen Käufer finden, der ihm diese Immobilie abkauft; denn wer kauft schon eine Immobilie, die eine Rendite von 4 Prozent abwirft, wenn er 5 Prozent Substanzsteuer zahlen muss. Die Substanzsteuer in Höhe von 5 Prozent muss der Immobilienbesitzer übrigens auch dann zahlen, wenn er gar keinen Mieter hat oder die Wohnung gerade renoviert wird. Was wird er also machen, wenn er niemanden hat, der ihm die Wohnung abkauft? Er wird die zusätzlichen Kosten auf den Mieter übertragen.

Hier müssen wir wissen, worüber wir reden: Eine zusätzliche Belastung von 5 Prozent des Verkehrswertes würde bei uns in der Bundesrepublik Deutschland eine glatte Verdopplung der Miete bedeuten. Das heißt, die Familie, die heute 300 Euro im Monat zahlen muss, müsste dann 600 Euro im Monat zahlen; die Familie, die heute 500 Euro zahlen muss, müsste dann 1 000 Euro Miete berappen. Das ist nicht die Sozialpolitik, die wir uns vorstellen. Sie von der Linken sollten sich schämen, hier solche Anträge einzubringen. Wir wollen, dass in Deutschland auch in Zukunft billiger Wohnraum zur Verfügung steht.

(Beifall bei der CDU/CSU und der FDP -

Widerspruch bei der LINKEN)

- Sie brauchen sich gar nicht so aufzuregen.

Die Vorschläge, die Sie hier vorlegen, sind so weit am Thema vorbei, dass sogar die Kolleginnen und Kollegen von der SPD und den Grünen, die mit einer privaten Vermögensteuer inhaltlich sympathisieren, diesen Antrag im federführenden Finanzausschuss abgelehnt haben. Diese Maßnahme ist konjunkturpolitisch völlig falsch: Sie fördert nicht private Investitionen im Wohnungsbau, sondern verhindert sie. Wir werden sie heute mit einem klaren Nein verhindern.

Meine Damen und Herren, vorhin wurde vom Kollegen der Linken angesprochen, über welches Volumen wir reden: Sie reden von ""Steuermehreinnahmen in Höhe von 10 Milliarden Euro"" allein in Baden-Württemberg und von insgesamt 80 Milliarden Euro in der Bundesrepublik Deutschland, und das nicht einmalig, sondern jährlich. Da frage ich mich schon, in welchem Land Sie leben bzw. in welches Land Sie uns führen wollen. Sie zeigen mit dem Antrag wieder deutlich: Sie betreiben die Politik des Neides und des Klassenkampfes. Seit heute wissen wir: Sie betreiben auch die Politik der Enteignung.",Christian Freiherr von Stetten,,data/txt/17100.txt,Christian Freiherr von Stetten (CDU/CSU),cducsu,speech
195833,100,17,0,655,Beifall bei der CDU/CSU und der FDP,,,data/txt/17100.txt,,,poi
195834,100,17,0,656,,Christian Freiherr von Stetten,,data/txt/17100.txt,Christian Freiherr von Stetten (CDU/CSU),cducsu,speech
195835,100,17,0,657,"Herr Kollege, gestatten Sie eine Zwischenfrage des Kollegen Schlecht?",Dr. h. c. Wolfgang Thierse,,data/txt/17100.txt,Vizepräsident Dr. h. c. Wolfgang Thierse,,chair
195836,100,17,0,658,Gerne.,Christian Freiherr von Stetten,,data/txt/17100.txt,Christian Freiherr von Stetten (CDU/CSU),cducsu,speech
195837,100,17,0,659,"Ich finde Ihre Ausführungen interessant. Ich habe vorhin gesagt, dass man sich den Luxus leisten könnte, den Reichen ihren Reichtum zu lassen, wenn es keine Probleme gäbe. Nur können wir uns diesen Luxus nicht leisten. Das gilt auch für Baden-Württemberg; ich habe es Ihnen eben aufgezeigt. Mappus will natürlich nicht die Reichen besteuern, sondern massive Einsparungen im Bildungsbereich vornehmen: Er will 6 500 Lehrerstellen streichen. Wollen Sie das wirklich verantworten? Wie passt das zu den Sonntagsreden, die auch von Politikern der CDU/CSU gehalten werden, dass man mehr für Bildung tun muss? Wie passt das zusammen? Das ist doch ein vollkommen abenteuerlicher Kurs.

Ich frage mich manchmal wirklich, ob die in den letzten Jahren erfolgten Großspenden in Höhe von 30 Mil-lionen Euro an die Parteien der Regierungskoalition Ihre Gehirne so vernebelt haben, dass Sie nur noch Besitzansprüchen das Wort reden und die Interessen der breiten Bevölkerung mit Füßen treten.",Michael Schlecht,,data/txt/17100.txt,Michael Schlecht (DIE LINKE),linke,speech
195838,100,17,0,660,Beifall bei Abgeordneten der LINKEN,,,data/txt/17100.txt,,,poi
195839,100,17,0,661,Widerspruch bei der CDU/CSU,,,data/txt/17100.txt,,,poi
195840,100,17,0,662,Also!,Dr. Daniel Volk,,data/txt/17100.txt,Dr. Daniel Volk [FDP],fdp,poi
195841,100,17,0,663,Unverschämtheit!,von der FDP,,data/txt/17100.txt,Weiterer Zuruf von der FDP,fdp,poi
195842,100,17,0,664,,Michael Schlecht,,data/txt/17100.txt,Michael Schlecht (DIE LINKE),linke,speech
195843,100,17,0,665,"Ihre Frage macht deutlich, dass es höchste Zeit ist, dass der Wahlkampf zu Ende geht. Dann müssen wir uns solche Zwischenfragen auch nicht mehr gefallen lassen. Aber gerade Baden-Württemberg - das werden Sie sicherlich verstehen - hat unheimlich viel Geld in die Bildungspolitik investiert. Ich möchte Ihnen aber auch sagen: Ich bin Berichterstatter der Regierungsfraktionen zu diesem Gesetzentwurf. Sie haben Ihren Antrag vor gut 13 Monaten in den Bundestag eingebracht. Wenn es Ihnen wirklich um die inhaltliche politische Diskussion gegangen wäre, hätten Sie in diesen 13 Monaten wenigstens einmal zum Telefonhörer greifen und einen von uns anrufen können, um die inhaltlichen Punkte zu diskutieren.",Christian Freiherr von Stetten,,data/txt/17100.txt,Christian Freiherr von Stetten (CDU/CSU),cducsu,speech
195844,100,17,0,666,Ist das der neue Stil? Dafür gibt es ja Ausschusssitzungen!,Iris Gleicke,,data/txt/17100.txt,Iris Gleicke [SPD],spd,poi
195845,100,17,0,667,"Aber Sie haben kein einziges persönliches Gespräch geführt. Auch mit dieser Zwischenfrage machen Sie deutlich, dass es Ihnen nur um den Wahlkampf gegangen ist. - Jetzt dürfen Sie sich gerne wieder setzen. Danke schön.",Christian Freiherr von Stetten,,data/txt/17100.txt,Christian Freiherr von Stetten (CDU/CSU),cducsu,speech
195846,100,17,0,668,Beifall bei der CDU/CSU und der FDP,,,data/txt/17100.txt,,,poi
195847,100,17,0,669,Sehr billig!,Iris Gleicke,,data/txt/17100.txt,Iris Gleicke [SPD],spd,poi
195848,100,17,0,670,"Sie haben vorhin in Ihrer Rede deutlich gemacht, dass Sie wollen, dass auf die privaten Geldvermögen, Immobilienvermögen und Sachvermögen 5 Prozent Steuern erhoben werden. Sie haben uns allerdings bis heute nicht erklärt: Was passiert mit dem Betriebsvermögen oder mit dem landwirtschaftlichen Vermögen, vor allem vor dem Hintergrund des Bundesverfassungsgerichtsurteils zur Erbschaftsteuer? Nach diesem Urteil würde Ihr Antrag, selbst wenn wir ihn beschließen würden, vor dem Bundesverfassungsgericht ganz sicher nicht bestehen, weil Sie zu diesen Vermögensarten überhaupt keine Ausführungen machen.",Christian Freiherr von Stetten,,data/txt/17100.txt,Christian Freiherr von Stetten (CDU/CSU),cducsu,speech
195849,100,17,0,671,,"Aber, liebe Kollegen von den Linken, eines muss man euch zumindest zugutehalten",,data/txt/17100.txt,"Aber, liebe Kollegen von den Linken, eines muss man euch zumindest zugutehalten",linke,speech
195850,100,17,0,672,Bitte nicht duzen!,von der LINKEN,,data/txt/17100.txt,Zuruf von der LINKEN,linke,poi
195851,100,17,0,673,"Ihr habt einen Antrag zu dem Thema eingebracht. Der ist aus meiner Sicht zwar völlig falsch, aber er zeigt, dass Sie wenigstens einen Standpunkt haben - ganz im Gegensatz zu den Kollegen von SPD und Bündnis 90/Die Grünen.","Aber, liebe Kollegen von den Linken, eines muss man euch zumindest zugutehalten",,data/txt/17100.txt,"Aber, liebe Kollegen von den Linken, eines muss man euch zumindest zugutehalten",linke,speech
195852,100,17,0,674,Das ist aber arg billig!,Manfred Zöllmer,,data/txt/17100.txt,Manfred Zöllmer [SPD],spd,poi
195853,100,17,0,675,"Sie haben zwar zahlreiche Parteitagsbeschlüsse gefasst, und Sie haben auch in allen Reden heute deutlich gemacht, dass Sie zu dem Thema eine Meinung haben und diese auch kundtun wollen. Aber auch Sie haben hier in den letzten 13 Monaten - spätestens seitdem wissen Sie, dass wir über dieses Thema im Bundestag eine Debatte führen bzw. darüber abstimmen müssen - keinen Antrag eingebracht. Das ist bezeichnend.","Aber, liebe Kollegen von den Linken, eines muss man euch zumindest zugutehalten",,data/txt/17100.txt,"Aber, liebe Kollegen von den Linken, eines muss man euch zumindest zugutehalten",linke,speech
195854,100,17,0,676,"Wenn wir einen Antrag eingebracht hätten, hätten Sie dem zugestimmt?",Manfred Zöllmer,,data/txt/17100.txt,Manfred Zöllmer [SPD],spd,poi
195855,100,17,0,677,- Wir hätten dem Antrag ganz sicher nicht zugestimmt.,"Aber, liebe Kollegen von den Linken, eines muss man euch zumindest zugutehalten",,data/txt/17100.txt,"Aber, liebe Kollegen von den Linken, eines muss man euch zumindest zugutehalten",linke,speech
195856,100,17,0,678,"Das sagt er, bevor er ihn kennt! Das ist signifikant!",Dr. Gerhard Schick,,data/txt/17100.txt,Dr. Gerhard Schick [BÜNDNIS 90/DIE GRÜNEN],gruene,poi
195857,100,17,0,679,"Aber die Bevölkerung hätte Ihre Auffassung zu diesem Thema kennenlernen können. Beschlüsse für die Bundesrepublik Deutschland werden nicht auf Ihren Parteitagen getroffen, sondern hier im Deutschen Bundestag, und das ist auch gut so.

Auch beim Thema Steuervereinfachungen, das heute noch im Bundestag zu behandeln ist, haben Sie nicht viel anzubieten. Die Bundesregierung bringt dazu heute einen Gesetzentwurf ein.","Aber, liebe Kollegen von den Linken, eines muss man euch zumindest zugutehalten",,data/txt/17100.txt,"Aber, liebe Kollegen von den Linken, eines muss man euch zumindest zugutehalten",linke,speech
195858,100,17,0,680,Das ist der nächste Tagesordnungspunkt!,Dr. Gerhard Schick,,data/txt/17100.txt,Dr. Gerhard Schick [BÜNDNIS 90/DIE GRÜNEN],gruene,poi
195859,100,17,0,681,"Allerdings haben wir bereits in der internen Abstimmung mit Ihren rot-grün regierten Bundesländern gemerkt, dass keine besondere Steuervereinfachungseuphorie und nicht einmal der Wunsch danach zu spüren sind.","Aber, liebe Kollegen von den Linken, eines muss man euch zumindest zugutehalten",,data/txt/17100.txt,"Aber, liebe Kollegen von den Linken, eines muss man euch zumindest zugutehalten",linke,speech
195860,100,17,0,682,Lachen bei der SPD,,,data/txt/17100.txt,,,poi
195861,100,17,0,683,"Daran können Sie mal sehen, wie schlecht Ihre Vorschläge waren!",Manfred Zöllmer,,data/txt/17100.txt,Manfred Zöllmer [SPD],spd,poi
