id,sitzung,wahlperiode,in_writing,sequence,text,speaker_cleaned,speaker_fp,filename,speaker,speaker_party,type
195997,100,17,0,819,"Wie sieht es denn nun mit der zusätzlichen Portion Pommes aus? Das fragen wir uns alle am heutigen Tag. Wir müssen leider feststellen, dass es damit schlecht aussieht.",Lisa Paus,,data/txt/17100.txt,Lisa Paus (BÜNDNIS 90/DIE GRÜNEN),gruene,speech
195998,100,17,0,820,Beifall beim BÜNDNIS 90/DIE GRÜNEN und bei der SPD,,,data/txt/17100.txt,,,poi
195999,100,17,0,821,"Nicht 9 Milliarden, sondern ganze 330 Millionen Euro hat die Currywurst-und-Mayo-Partei dem Koalitionspartner abgetrotzt,",Lisa Paus,,data/txt/17100.txt,Lisa Paus (BÜNDNIS 90/DIE GRÜNEN),gruene,speech
196000,100,17,0,822,"Aber lesen können Sie noch, oder?",Ulrike Flach,,data/txt/17100.txt,Ulrike Flach [FDP],fdp,poi
196001,100,17,0,823,"um damit den Arbeitnehmerpauschbetrag von 920 auf 1 000 Euro zu erhöhen. Das bringt für den einzelnen Arbeitnehmer oder die einzelne Arbeitnehmerin maximal 36 Euro pro Jahr. Da muss man sich schon entscheiden, ob es einmal im Monat der Luxus einer Tasse Kaffee oder doch die lang ersehnte Portion Pommes sein soll. Das ist wirklich lächerlich.",Lisa Paus,,data/txt/17100.txt,Lisa Paus (BÜNDNIS 90/DIE GRÜNEN),gruene,speech
196002,100,17,0,824,Beifall beim BÜNDNIS 90/DIE GRÜNEN und bei der SPD sowie bei Abgeordneten der LINKEN,,,data/txt/17100.txt,,,poi
196003,100,17,0,825,"Man könnte sagen: ""Schwamm drüber"", wenn man den Eindruck hätte, dass selbst die FDP endlich verstanden hat: Steuersenkungsversprechen sind von gestern; die will keiner mehr hören, auch FDP-Anhänger nicht mehr.",Lisa Paus,,data/txt/17100.txt,Lisa Paus (BÜNDNIS 90/DIE GRÜNEN),gruene,speech
196004,100,17,0,826,Wer hat denn 2010 die Familien entlastet?,Dr. Daniel Volk,,data/txt/17100.txt,Dr. Daniel Volk [FDP],fdp,poi
196005,100,17,0,827,"Aber so ist es leider nicht. Im Gegenteil: Es ist viel schlimmer. Die Frage, ob die 36 Euro im Jahr 2012 oder doch schon im Jahr 2011 an die Beschäftigten ausgeschüttet werden sollen, war Herrn Westerwelle und seiner Currywurst-und-Mayo-Partei tatsächlich die Androhung eines Koalitionsbruches wert. Sie haben außerdem noch für diese 36 Euro der Erhöhung der Tabaksteuer um 4 bis 8 Cent pro Schachtel zugestimmt. Also gibt es keine Zigarette mehr zur Extratasse Kaffee. Das begrüße ich zwar aus gesundheitspolitischer Sicht, aber wir sollten nun zu einer ernsthaften Debatte zurückkehren.",Lisa Paus,,data/txt/17100.txt,Lisa Paus (BÜNDNIS 90/DIE GRÜNEN),gruene,speech
196006,100,17,0,828,Beifall beim BÜNDNIS 90/DIE GRÜNEN und bei der SPD,,,data/txt/17100.txt,,,poi
196007,100,17,0,829,"Trotz allen Steuersenkungsgeredes müssen wir festhalten: Wir haben nicht mehr Netto vom Brutto, sondern weniger. Die 36 Euro, die Sie spendiert haben, werden schon heute von den bis zu 115 Euro aufgefressen, die alle Beschäftigten seit dem 1. Januar zusätzlich in die Sozialkassen einzahlen müssen.",Lisa Paus,,data/txt/17100.txt,Lisa Paus (BÜNDNIS 90/DIE GRÜNEN),gruene,speech
196008,100,17,0,830,Sehr richtig!,Kerstin Andreae,,data/txt/17100.txt,Kerstin Andreae [BÜNDNIS 90/DIE GRÜNEN],gruene,poi
196009,100,17,0,831,"Sie argumentieren, es gehe nicht um Steuersenkung, sondern um Steuervereinfachung. So heißt es im Titel des Gesetzentwurfs. Dazu meint Horst Vinken, der Präsident der Bundessteuerberaterkammer, das Gesetz konterkariere in weiten Teilen sein Ziel und verschlimmbessere das Steuerrecht.",Lisa Paus,,data/txt/17100.txt,Lisa Paus (BÜNDNIS 90/DIE GRÜNEN),gruene,speech
196010,100,17,0,832,Das war auch nichts mit der Vereinfachung!,Kerstin Andreae,,data/txt/17100.txt,Kerstin Andreae [BÜNDNIS 90/DIE GRÜNEN],gruene,poi
196011,100,17,0,833,Murks wie immer!,Dr. Hermann Ott,,data/txt/17100.txt,Dr. Hermann Ott [BÜNDNIS 90/DIE GRÜNEN],gruene,poi
196012,100,17,0,834,"Ähnlich äußert sich die Deutsche Steuer-Gewerkschaft, deren Mitglieder das Gesetz in der Steuerverwaltung umzusetzen haben. Ich kann mich dieser Einschätzung nur anschließen.",Lisa Paus,,data/txt/17100.txt,Lisa Paus (BÜNDNIS 90/DIE GRÜNEN),gruene,speech
196013,100,17,0,835,Beifall beim BÜNDNIS 90/DIE GRÜNEN und bei der SPD,,,data/txt/17100.txt,,,poi
196014,100,17,0,836,"Allein Ihr Beharren darauf, den Arbeitnehmerpauschbetrag rückwirkend zu erhöhen, führt nicht zu weniger, sondern zu mehr Bürokratiekosten bei den Unternehmen. Sie weigern sich bis heute, die Frage zu beantworten, auf welche Höhe sich die Kosten belaufen werden.

Kinderbetreuungskosten gelten jetzt als Sonderausgaben. Das ist schön, aber leider steht in diesem Bereich noch ein Urteil aus, das die komplette Regelung hinfällig machen könnte.

Des Weiteren wollen Sie auf die Prüfung der Einkünfte erwachsener Kinder verzichten - das finden wir so weit in Ordnung. Aber Sie wollen das nur dann, wenn diese noch in der ersten Ausbildung sind. Was soll der Azubi dazu sagen, der später noch Abitur machen will?

Die zweijährige Steuererklärung ist das beste Beispiel, wie berechtigt die Einschätzung von Herrn Vinken von der Bundessteuerberaterkammer ist. Erstens lohnt sie sich für die Arbeitnehmerinnen und Arbeitnehmer nicht, weil sie nur noch alle zwei Jahre eine Rückzahlung erhalten. Damit geben sie nicht nur einen Kredit, sondern es kommt de facto einer Steuererhöhung gleich. Zweitens ist es keine Erleichterung, wenn man alle zwei Jahre nicht eine Steuererklärung machen kann, sondern zwei machen muss. Das muss dann aber mit einem Zusatzformular beantragt werden.",Lisa Paus,,data/txt/17100.txt,Lisa Paus (BÜNDNIS 90/DIE GRÜNEN),gruene,speech
196015,100,17,0,837,Das soll einfach sein?,Kerstin Andreae,,data/txt/17100.txt,Kerstin Andreae [BÜNDNIS 90/DIE GRÜNEN],gruene,poi
196016,100,17,0,838,- Genau. Das soll einfach sein?,Lisa Paus,,data/txt/17100.txt,Lisa Paus (BÜNDNIS 90/DIE GRÜNEN),gruene,speech
196017,100,17,0,839,Beifall beim BÜNDNIS 90/DIE GRÜNEN und bei der SPD,,,data/txt/17100.txt,,,poi
196018,100,17,0,840,"Aber damit nicht genug; denn drittens hätten die Finanzämter, wenn diese Möglichkeit tatsächlich massenhaft genutzt würde, ein gewaltiges Problem, allein schon wegen ihrer derzeit miserablen Personalausstattung. Stellen Sie sich einmal vor, in diesem Jahr würden alle keine Einkommensteuererklärung abgeben, sondern beide Steuererklärungen im nächsten Jahr gemeinsam einreichen. In Baden-Württemberg haben wir zurzeit 123 Finanzbeamte auf 100 000 Einwohner; das ist eine deutliche Unterausstattung. Stellen Sie sich einmal vor, in welchem wunderbaren Chaos unsere Finanzämter versinken würden, wenn tatsächlich von diesem von Ihnen neu eingeräumten Recht Gebrauch gemacht werden würde.

Auch der Parlamentarische Beirat für nachhaltige Entwicklung hat sich zu diesem Gesetzentwurf zu Wort gemeldet. Er hat uns dringend aufgerufen, den gesamten Gesetzentwurf noch einmal zu überprüfen. Dem Beirat ist insbesondere nicht ersichtlich, inwiefern Ihre Vorschläge den sozialen Zusammenhalt stärken und die Generationengerechtigkeit fördern. Als Berichterstatter hat Herr Aumer,",Lisa Paus,,data/txt/17100.txt,Lisa Paus (BÜNDNIS 90/DIE GRÜNEN),gruene,speech
196019,100,17,0,841,Guter Mann!,Stefan Müller,,data/txt/17100.txt,Stefan Müller [Erlangen] [CDU/CSU],cducsu,poi
196020,100,17,0,842,"CSU-Mitglied und Mitglied im Finanzausschuss, die Stellungnahme des Beirats unterzeichnet. Herr Aumer, ich bin gespannt, wie Sie Ihre Empfehlungen in den eigenen Reihen einbringen und durchsetzen werden. Wenn Sie Unterstützung brauchen, dann kommen Sie gerne zu uns.",Lisa Paus,,data/txt/17100.txt,Lisa Paus (BÜNDNIS 90/DIE GRÜNEN),gruene,speech
196021,100,17,0,843,Beifall beim BÜNDNIS 90/DIE GRÜNEN sowie bei Abgeordneten der SPD,,,data/txt/17100.txt,,,poi
196022,100,17,0,844,,Lisa Paus,,data/txt/17100.txt,Lisa Paus (BÜNDNIS 90/DIE GRÜNEN),gruene,speech
196023,100,17,0,845,"Frau Kollegin, kommen Sie bitte zum Schluss.",Dr. Hermann Otto Solms,,data/txt/17100.txt,Vizepräsident Dr. Hermann Otto Solms,,chair
196024,100,17,0,846,"Ich komme zum Schluss.

Auch der Normenkontrollrat spricht fehlende Informationen über die Kosten dieses Gesetzes an. Der Bundesrat fordert, die Pläne zu überdenken. Sie stellen sich stur. Herr Volk kritisiert den Bundesrat - ich zitiere -:

Es scheint, als hätte der Bundesrat den Begriff Steuervereinfachung nicht wirklich verstanden ...

Ich sagen Ihnen, Herr Volk: Der Bundesrat hat das sehr wohl verstanden, wir haben es alle richtig verstanden, nur Sie wollen es nicht verstehen, sondern wollen das Problem vertuschen. Wir alle wissen, Ihr Gesetzentwurf ist kein Steuervereinfachungspaket, sondern ein Placebowerk zum Erhalt des Koalitionsfriedens.",Lisa Paus,,data/txt/17100.txt,Lisa Paus (BÜNDNIS 90/DIE GRÜNEN),gruene,speech
196025,100,17,0,847,Beifall beim BÜNDNIS 90/DIE GRÜNEN und bei der SPD,,,data/txt/17100.txt,,,poi
196026,100,17,0,848,,Lisa Paus,,data/txt/17100.txt,Lisa Paus (BÜNDNIS 90/DIE GRÜNEN),gruene,speech
196027,100,17,0,849,Das Wort hat die Kollegin Antje Tillmann von der CDU/CSU-Fraktion.,Dr. Hermann Otto Solms,,data/txt/17100.txt,Vizepräsident Dr. Hermann Otto Solms,,chair
196028,100,17,0,850,Beifall bei der CDU/CSU und der FDP,,,data/txt/17100.txt,,,poi
196029,100,17,0,851,,Dr. Hermann Otto Solms,,data/txt/17100.txt,Vizepräsident Dr. Hermann Otto Solms,,chair
196030,100,17,0,852,"Herr Präsident! Liebe Kolleginnen und Kollegen! Liebe Zuschauer! Wir sind heute in der ersten Lesung zu einem Steuervereinfachungsgesetz. Das scheint in der Debatte ein bisschen untergegangen zu sein. Wir haben noch hinreichend Gelegenheit zur Diskussion all der guten Vorschläge zu dem, was wir nicht tun sollten. Ich hoffe, dass Sie die Diskussion dann aber auch durch positive Steuervereinfachungsvorschläge anreichern.",Antje Tillmann,,data/txt/17100.txt,Antje Tillmann (CDU/CSU),cducsu,speech
196031,100,17,0,853,Das ist gut! Machen wir!,Ingrid Arndt-Brauer,,data/txt/17100.txt,Ingrid Arndt-Brauer [SPD],spd,poi
196032,100,17,0,854,Davon ist nicht auszugehen!,Stefan Müller,,data/txt/17100.txt,Stefan Müller [Erlangen] [CDU/ CSU],cducsu,poi
196033,100,17,0,855,"Diesbezüglich werden wir in den nächsten Wochen gerne mit Ihnen ins Gespräch kommen.

Der Focus titelte im vergangenen Jahr: ""Kirchhof dampft Steuerrecht ein"". Aus mehreren Tausend Paragrafen sollen so 400 werden.

Ein großer Vorwurf im Zusammenhang mit diesem Steuervereinfachungsgesetz ist, dass es nur ein kleiner Schritt und nicht der große Wurf ist. Da wir vonseiten der Koalition aus CDU/CSU und FDP aber ziemlich sicher sind, dass von Ihnen auch zu dem Kirchhof-Konzept nur Kritik, aber keine positive Resonanz kommen würde,",Antje Tillmann,,data/txt/17100.txt,Antje Tillmann (CDU/CSU),cducsu,speech
196034,100,17,0,856,Davon kann man wohl ausgehen!,Dr. Axel Troost,,data/txt/17100.txt,Dr. Axel Troost [DIE LINKE],linke,poi
196035,100,17,0,857,"haben wir uns entschieden anzufangen, und zwar mit ganz vielen - zugegebenermaßen jeweils für sich genommen kleinen - Schritten, die mit Steuersenkungen allerdings nichts zu tun haben.

Unser Auftrag war von Anfang an, eine Vereinfachung durchzusetzen, die den Bundeshaushalt nicht belastet; denn wir sind überzeugt von der Richtigkeit des Mottos ""Schulden von heute sind die Steuererhöhungen von morgen"". Angesichts der Ergebnisse des EU-Rats sind wir fest entschlossen, den Bundeshaushalt zu konsolidieren und Vereinfachungen zu schaffen, die nicht zu Steuerausfällen in größerem Umfang für den Bundeshaushalt führen.",Antje Tillmann,,data/txt/17100.txt,Antje Tillmann (CDU/CSU),cducsu,speech
196036,100,17,0,858,Beifall bei der CDU/CSU,,,data/txt/17100.txt,,,poi
196037,100,17,0,859,Sie haben doch noch zwei Jahre Zeit!,Ingrid Arndt-Brauer,,data/txt/17100.txt,Ingrid Arndt-Brauer [SPD],spd,poi
196038,100,17,0,860,"Auf die Frage, ob 3 Euro nichts weiter als Pommes mit Mayo sind, antworte ich Ihnen: Wir sind in der Fastenzeit.",Antje Tillmann,,data/txt/17100.txt,Antje Tillmann (CDU/CSU),cducsu,speech
196039,100,17,0,861,"Deshalb keine Mayo, oder was?",Bernd Scheelen,,data/txt/17100.txt,Bernd Scheelen [SPD],spd,poi
196040,100,17,0,862,"Das gilt nicht nur im Privaten, sondern auch für den Bundeshaushalt. Es geht nicht um Steuersenkungen. Deswegen ist es auch völlig egal, ob es 3 Euro, 13 Euro oder 100 Euro sind. Es geht nicht um Steuersenkungen, sondern um ein einfacheres Steuerrecht, weil das als gerechtere Variante von den Bürgern eher akzeptiert wird.

Der wesentliche Teil der Entlastungen, die wir in diesem Vereinfachungsgesetz vorsehen, kommt den Familien zugute. Das gilt insbesondere für die Frage, ob wir die eigenen Einkünfte von volljährigen Kindern in Ausbildung prüfen. Die Abschaffung dieser Prüfung ist ein Vorschlag, den die Steuerverwaltung selbst gemacht hat, weil sie festgestellt hat, dass die Prüfung in 98 Prozent der Fälle zu dem Ergebnis führt, dass die Kinder und Jugendlichen unter dem Freibetrag von 8 004 Euro liegen.",Antje Tillmann,,data/txt/17100.txt,Antje Tillmann (CDU/CSU),cducsu,speech
196041,100,17,0,863,Die Eltern reichen ja nicht ein!,Ingrid Arndt-Brauer,,data/txt/17100.txt,Ingrid Arndt-Brauer [SPD],spd,poi
196042,100,17,0,864,"In Zukunft werden natürlich einige höhere Einkünfte haben. Aber unter dem Aspekt der Vereinfachung glauben wir, dass das akzeptabel ist. Wir wollen künftig insbesondere vermeiden - Frau Arndt-Brauer, Sie haben Ihre Kinder angesprochen -, dass zum Beispiel ein leistungsbereiter 18-Jähriger, der stolz ist, einen Ferienjob ergattert zu haben, und sich während der Ferien sechs Wochen engagieren will, von seinen Eltern zu hören bekommt: Engagier Dich mal ein bisschen weniger; denn sonst bekommen wir kein Kindergeld mehr.",Antje Tillmann,,data/txt/17100.txt,Antje Tillmann (CDU/CSU),cducsu,speech
196043,100,17,0,865,Die kriegen keine 7 000 Euro!,Ingrid Arndt-Brauer,,data/txt/17100.txt,Ingrid Arndt-Brauer [SPD],spd,poi
196044,100,17,0,866,"Dann sagen Sie doch mal, wo man so viel verdient! Zeigen Sie mir das doch mal!",Bernd Scheelen,,data/txt/17100.txt,Bernd Scheelen [SPD],spd,poi
196045,100,17,0,867,"Wir erziehen mit der jetzigen Regelung eine ganze Generation junger Menschen dazu, weniger zu leisten und lieber Sozialleistungen in Form des Kindergeldes zu beziehen, statt ihnen zu sagen: Es ist gut, wenn ihr euch engagiert; es ist gut, wenn ihr eigene Einkünfte erzielt.",Antje Tillmann,,data/txt/17100.txt,Antje Tillmann (CDU/CSU),cducsu,speech
196046,100,17,0,868,Beifall bei der CDU/CSU,,,data/txt/17100.txt,,,poi
196047,100,17,0,869,"Deshalb glauben wir, dass die wenigen Fälle, in denen es zu höheren Einkünften kommt, durchaus akzeptabel sind.

So gar nicht verstanden habe ich in der bisherigen Debatte die Aussagen zu den Kinderbetreuungskosten. Frau Höll, Sie beschimpfen das Finanzministerium, weil es im Gesetzgebungsverfahren einen Vorschlag von Bürgern aufgreift. Ihren Debattenbeitrag zur Bürgerbeteiligung habe ich bisher völlig anders verstanden. Es gibt nun einmal Bürger, die die Referentenentwürfe lesen - schon das finde ich sehr beeindruckend - und die dann auf uns zukommen und sagen: Habt ihr eigentlich bedacht, dass es Probleme bei den Kindergartengebühren gibt?",Antje Tillmann,,data/txt/17100.txt,Antje Tillmann (CDU/CSU),cducsu,speech
196048,100,17,0,870,Das haben wir eingebracht!,Dr. Barbara Höll,,data/txt/17100.txt,Dr. Barbara Höll [DIE LINKE],linke,poi
196049,100,17,0,871,"- Nein, das haben Sie nicht eingebracht. Das hatten wir lange vor Ihnen geklärt.

Nun reagiert das Finanzministerium auf die Vorschläge von Bürgern, und Sie sagen: So ein Mist! Jetzt habt ihr reagiert, und das Problem ist vom Tisch. - Ich kann nur sagen: Gott sei Dank gibt es Bürger, die die Gesetzgebungsverfahren verfolgen. Es hat Folgen, wenn uns Bürger auf Probleme hinweisen. Sie werden ernst genommen, sowohl vom Ministerium als auch von der Koalition. Wir wollen, dass sich die Bürger beteiligen, Sie offensichtlich nicht.",Antje Tillmann,,data/txt/17100.txt,Antje Tillmann (CDU/CSU),cducsu,speech
196050,100,17,0,872,Beifall bei der CDU/CSU und der FDP,,,data/txt/17100.txt,,,poi
196051,100,17,0,873,"Es hört sich an wie eine Drohung, was Sie sagen!",Christian Lange,,data/txt/17100.txt,Christian Lange [Backnang] [SPD],spd,poi
196052,100,17,0,874,"Ein weiteres Problem, Frau Arndt-Brauer, ist die Ehegattenveranlagung. Wir haben gemeinsam für das Faktorverfahren gekämpft. Ich glaube, wir sind uns einig, dass das nicht sehr erfolgreich war. Es gibt nun mindestens fünf verschiedene Varianten für die Ehegattenbesteuerung. Das ist mittlerweile so unübersichtlich geworden, dass der eigentliche Effekt, Einkünfte zwischen den Ehegatten gerecht zu verteilen, nicht mehr erzielt wird. Ich bin sehr gerne bereit, in den folgenden Wochen mit Ihnen über den entsprechenden Passus im Gesetz zu sprechen und nach besseren Lösungen zu suchen. Wenn wir bessere Lösungen finden, sind wir gerne bereit, sie aufzugreifen. Ich glaube, dass das mittlerweile ein Komplex ist, der für Ehegatten nicht mehr überschaubar ist und den Finanzbeamten nur unnötige Mehrarbeit bereitet. Wenn wir andere Lösungen finden: herzlich gerne.

Ich freue mich über die Steuerfreiheit von Stipendien. Hier haben wir erhebliche Rechtssicherheit für Familien geschaffen. Es ist jetzt unerheblich, ob das Stipendium unmittelbar für eine wissenschaftliche oder eine künstlerische Ausbildung gewährt wird. Die Gelder sind nun immer steuerfrei.

Das Gleiche gilt für die Bereitstellung von verbilligtem Wohnraum innerhalb von Familien. Wenn die Oma, die keine sehr hohe Rente hat, von ihren Kindern durch verbilligten Wohnraum unterstützt wird, dann kann das künftig mit wesentlich weniger bürokratischem Aufwand steuerlich berücksichtigt werden; darüber bin ich froh. Das ist eine echte Vereinfachung für alle betroffenen Fälle.",Antje Tillmann,,data/txt/17100.txt,Antje Tillmann (CDU/CSU),cducsu,speech
196053,100,17,0,875,Beifall bei der CDU/CSU und der FDP,,,data/txt/17100.txt,,,poi
196054,100,17,0,876,"Zur steuerlichen Absetzbarkeit von Spenden. Aktuell fließen Spenden aus der deutschen Bevölkerung sehr rege. Es ist aber ausgesprochen ärgerlich für den Spender, wenn er aufgrund eines Fehlers, den er in Unkenntnis der gesetzlichen Regelungen begangen hat, seine Spende nicht steuerlich absetzen kann. Es gibt nun Vereinfachungen, die das vermeiden helfen.

Das alles sind Themen aus dem Bereich der Einkommensteuer; darum geht es in erster Linie in diesem Gesetz. Deshalb verwundert es mich gar nicht, dass die Wirtschaftsverbände noch nicht glücklich sind. Aber wir hatten den Auftrag, Einkommensteuervereinfachungen vorzunehmen. Im vorliegenden Gesetzentwurf steht ausdrücklich, dass wir zusammen mit dem Ministerium bis September einen Gesetzentwurf zur Vereinfachung der Unternehmensteuern vorlegen werden; das kommt noch.

Trotzdem haben wir diesbezüglich schon einige Regelungen im vorliegenden Gesetzentwurf aufgegriffen, weil sie technisch schon so weit ausgereift waren, dass wir sie in Kraft setzen können. Da geht es zum Beispiel um die elektronische Rechnungstellung. Hier kommt immer die Diskussion auf: Wo ist denn der Entlastungseffekt? Ich glaube, es ist völlig wurscht, ob ich 50 Euro weniger Steuern zahle, wenn ich auf der anderen Seite über 1 000 Euro Bürokratiekosten habe. Für Unternehmen ist wesentlich wichtiger, dass wir sicherstellen, dass wir technisch auf dem neuesten Stand sind. Insbesondere müssen wir sicherstellen - der Staatssekretär hat das eben gesagt -, dass das Sozialversicherungsrecht und das Steuerrecht miteinander harmonieren. Momentan wird in den beiden Ausschüssen noch nicht einmal über das Gleiche diskutiert. So soll ein neues IT-System zur Erhebung der Sozialversicherungsbeiträge neben dem des Steuerrechts eingeführt werden. Dadurch fallen in der Wirtschaft Bürokratiekosten in Milliardenhöhe an. Das kann nicht richtig sein.

Das Gleiche gilt für den Komplex ""Konsens"". Es ist für den Bürger ausgesprochen interessant, vieles, was er steuerlich mit den Finanzbehörden zu klären hat, demnächst über den Rechner zu erledigen. Elster.de kommt gut an; das ist ein gutes Programm. Die Bürgerinnen und Bürger nutzen es zahlreich. Wir müssen es auf die Unternehmen ausweiten und zum Beispiel für Zerlegungsbescheide für die Körperschaftsteuer nutzen. Das bringt den Unternehmen erheblichen Zeitgewinn und natürlich auch erhebliche Einsparungen.

Zeitnahe Betriebsprüfungen und die E-Bilanz sind schon genannt worden. Im Rahmen der E-Bilanz müssen wir sicherstellen, dass auch auf dem Rückweg von der Steuerverwaltung zum Steuerberater oder zum Bürger die Vereinfachungseffekte wirken und dass der Steuerberater die berichtigte E-Bilanz zurückbekommt. Auch das spart erhebliche Kosten und hat für den Bundeshaushalt keine negativen Auswirkungen.

Da wir heute erst mit der Debatte starten, lassen Sie mich sagen: Es gibt Probleme, die wir noch nicht gelöst haben. Eines der größten und leider auch teuersten Probleme, die wir noch nicht gelöst haben, ist die Istbesteuerung. Die Umsatzgrenze bei der Istbesteuerung von 500 000 Euro gilt nur noch bis zum 31. Dezember 2011. Danach fällt sie wieder auf 250 000 Euro zurück.

Der Bundesrat hat das in seiner Stellungnahme beanstandet. Der Vereinfachungseffekt liegt darin, dass jetzt Buchführungsgrenzen und Istbesteuerungsgrenzen identisch sind, sodass bis 500 000 Euro Umsatz keine Bilanz zu erstellen ist, wenn man unter der Gewinngrenze bleibt. Wir suchen eine Lösung. Das kostet leider 1,95 Milliarden Euro. Daher kann es keine Lösung sein, dass der Bundesrat das einfach mit in dieses Gesetz packen will; denn bei diesem Gesetz waren die Finanzverwaltung und wir uns einig, dass der Bundeshaushalt die kompletten Kosten trägt, weil wir Länder und Kommunen nicht zusätzlich belasten wollen. Ich sage Ihnen an dieser Stelle zu: Wir wollen das Problem lösen und werden es angehen. Den Kolleginnen und Kollegen der Länder, die das Protokoll nachlesen, kündige ich schon einmal gute kameradschaftliche Verhandlungen an. Ich glaube, wir werden im Verlauf des Gesetzgebungsverfahrens gemeinsam eine Lösung finden. Das wäre ein zusätzlicher Punkt bei echter Vereinfachung.

Ich danke an dieser Stelle dem Zentralverband des Deutschen Handwerks, der gleichzeitig Gegenfinanzierungsvorschläge gemacht hat. Ich danke auch anderen Verbänden, die unseren Konsolidierungskurs Gott sei Dank unterstützen und bei ihren Vorschlägen zur Steuervereinfachung immer auch die Finanzierung berücksichtigen. Jeder Vorschlag, der gegenfinanziert ist, wird von uns gerne in die Verhandlungen aufgenommen. Ich freue mich auf die Beratungen der nächsten Wochen.",Antje Tillmann,,data/txt/17100.txt,Antje Tillmann (CDU/CSU),cducsu,speech
196055,100,17,0,877,Beifall bei der CDU/CSU und der FDP,,,data/txt/17100.txt,,,poi
196056,100,17,0,878,,Antje Tillmann,,data/txt/17100.txt,Antje Tillmann (CDU/CSU),cducsu,speech
196057,100,17,0,879,Jetzt hat das Wort die Kollegin Sabine Bätzing-Lichtenthäler für die SPD-Fraktion.,Dr. Hermann Otto Solms,,data/txt/17100.txt,Vizepräsident Dr. Hermann Otto Solms,,chair
196058,100,17,0,880,Beifall bei der SPD,,,data/txt/17100.txt,,,poi
196059,100,17,0,881,,Dr. Hermann Otto Solms,,data/txt/17100.txt,Vizepräsident Dr. Hermann Otto Solms,,chair
196060,100,17,0,882,"Herr Präsident! Liebe Kolleginnen und Kollegen! Alle meine Reden in dieser Legislaturperiode enthielten bisher immer den Aufruf an die Regierungsfraktionen: Machen Sie Schluss mit Ihrer Klientelpolitik! - Leider geben Sie mir mit Ihren Gesetzentwürfen immer wieder Gelegenheit, genau diesen Ausruf anzustimmen. Dabei hören sich Ihre Gesetzentwürfe und die Behauptung dessen, was Sie eigentlich tun wollen, ganz gut an, auch heute. Steuervereinfachungsgesetz - wer könnte dem nicht zustimmen? Es gibt zwar keine Steuersenkungen, die Sie den Menschen vor der Wahl eigentlich versprochen haben, aber Steuervereinfachungen, Vereinfachungen für die Bürger, Vereinfachungen für die Verwaltung. Wer wollte das nicht? Aber setzen Sie das auch um?",Sabine Bätzing-Lichtenthäler,,data/txt/17100.txt,Sabine Bätzing-Lichtenthäler (SPD),spd,speech
196061,100,17,0,883,Ja!,Dr. Volker Wissing,,data/txt/17100.txt,Dr. Volker Wissing [FDP],fdp,poi
196062,100,17,0,884,"Daran hat nicht nur meine Fraktion Zweifel. Ich darf dazu einige Stimmen zitieren. ""Das ist eine Luftnummer der Politik, ein PR-Gag, der niemandem was bringt"", so Herr Ondracek von der Deutschen Steuer-Gewerkschaft. ""Reförmchen"", sagt der Bund der Steuerzahler. ""Mogelpackung"", sagt Horst Vinken, der Präsident der Bundessteuerberaterkammer. Der Bundesverband der Lohnsteuerhilfevereine erklärt, dass die gemeinsame Abgabe von Steuererklärungen für mehrere Jahre in der jetzigen Form nicht zu Ende gedacht und deshalb abzulehnen sei. Shakespeare hat es schön formuliert: ""Much Ado about Nothing"". Auf Deutsch: Viel Lärm um nichts.",Sabine Bätzing-Lichtenthäler,,data/txt/17100.txt,Sabine Bätzing-Lichtenthäler (SPD),spd,speech
196063,100,17,0,885,Beifall bei der SPD sowie bei Abgeordneten des BÜNDNISSES 90/DIE GRÜNEN,,,data/txt/17100.txt,,,poi
