id,sitzung,wahlperiode,in_writing,sequence,text,speaker_cleaned,speaker_fp,filename,speaker,speaker_party,type
273499,145,17,0,286,"Ich habe eine letzte Frage. Sie antworten hier als Mitglied der Bundesregierung. Mir ist zu Ohren gekommen, dass Sie sich in der Unionsfraktion dafür verwandt haben, die Kürzungen der Mittel im Haushalt der Bundesministerin für Familie, Senioren, Frauen und Jugend, Dr. Kristina Schröder, für den Kampf gegen Rechtsextremismus zurückzunehmen. Haben Sie sich auch für die Rücknahme der Kürzungen der Mittel für die Bundeszentrale für politische Bildung, die in Ihrem eigenen Ressort beheimatet ist, verwandt?",Daniela Kolbe,,data/txt/17145.txt,Daniela Kolbe (Leipzig) (SPD),spd,speech
273500,145,17,0,287,"Auch im Etat des Familienministeriums war nie eine Kürzung der Mittel für Maßnahmen gegen Rechtsextremismus vorgesehen. Das heißt, die 2 Millionen Euro, die im Haushaltsaufstellungsverfahren jetzt zusätzlich zur Verfügung gestellt wurden, stellen eine Steigerung um 2 Millionen Euro dar. Wir sind damit jetzt bei 24 Millionen Euro. Wir haben nämlich erreicht, dass die Administrierung und Verwaltung der Programme nicht mehr wie bisher extern durchgeführt wird, sondern vom Bundesamt für den Zivildienst. Von daher geben wir jetzt noch mehr Geld für den Kampf gegen Rechtsextremismus aus als zunächst vorgesehen.

Noch einmal: Es gab keine Kürzung. Diese Bundesregierung gibt mehr Geld für den Kampf gegen Rechtsextremismus aus als beispielsweise Rot-Grün. Das bitte ich zur Kenntnis zu nehmen.",Dr. Ole Schröder,,data/txt/17145.txt,"Dr. Ole Schröder, Parl. Staatssekretär beim Bundesminister des Innern",,speech
273501,145,17,0,288,Beifall des Abg. Patrick Kurth [Kyffhäuser] [FDP],,,data/txt/17145.txt,,,poi
273502,145,17,0,289,,Dr. Ole Schröder,,data/txt/17145.txt,"Dr. Ole Schröder, Parl. Staatssekretär beim Bundesminister des Innern",,speech
273503,145,17,0,290,"Vielen Dank, Herr Staatssekretär.

Wir kommen dann zum Geschäftsbereich des Ministeriums der Justiz. Zur Beantwortung steht der Parlamentarische Staatssekretär Dr. Max Stadler zur Verfügung.

Die Fragen 36 und 37 des Abgeordneten Strässer sowie die Fragen 38 und 39 des Abgeordneten Dr. Franke sollen schriftlich beantwortet werden.

Damit kommen wir zur Frage 40 der Kollegin Sonja Steffen:

Hat sich, und wenn ja, wie, die Bundesregierung in Bezug auf die Neuregelung des Sorgerechts nichtehelicher Väter geeinigt, bzw. ist eine Einigung absehbar?

Bitte schön, Herr Staatssekretär.",Dr. Hermann Otto Solms,,data/txt/17145.txt,Vizepräsident Dr. Hermann Otto Solms,,chair
273504,145,17,0,291,"Die Kollegin Steffen fragt nach der Neuregelung des Sorgerechts nichtehelicher Väter. Auf eine schriftliche Frage ihrer Kollegin Ingrid Hönlinger vom 24. Oktober 2011 nach einem Gesetzentwurf der Bundesregierung habe ich eine Antwort gegeben und Folgendes ausgeführt - ich zitiere -:

Es trifft zu, dass sich die Koalitionsfraktionen derzeit intensiv im Gespräch befinden, um sich auf einen gemeinsamen Regelungsvorschlag zur Neuregelung der gemeinsamen Sorge bei nicht miteinander verheirateten Eltern zu verständigen. Ein konkreter Termin der Vorlage eines Gesetzentwurfs an das Kabinett ist noch nicht geplant.

Diese Darstellung stellt weiterhin den aktuellen Sachverhalt dar.",Dr. Max Stadler,,data/txt/17145.txt,"Dr. Max Stadler, Parl. Staatssekretär bei der Bundesministerin der Justiz",,speech
273505,145,17,0,292,"Frau Kollegin Steffen, haben Sie eine Nachfrage?",Dr. Hermann Otto Solms,,data/txt/17145.txt,Vizepräsident Dr. Hermann Otto Solms,,chair
273506,145,17,0,293,"Vielen Dank, Herr Präsident. - Herr Staatssekretär, vielleicht können Sie Auskunft geben über den Stand der Diskussion. Wir wissen ja, dass es zwei Grundmodelle gibt: ein Antragsmodell und ein Widerspruchsmodell. Können Sie vielleicht etwas genauer erklären, wie der derzeitige Diskussionsstand ist?",Sonja Steffen,,data/txt/17145.txt,Sonja Steffen (SPD),spd,speech
273507,145,17,0,294,"Frau Kollegin Steffen, Sie benennen richtig den zentralen Streitpunkt. Es ist ja so, dass wir keinerlei Probleme haben, wenn nicht miteinander verheiratete Elternteile sich auf eine gemeinsame Sorge für das Kind einigen. Es ist ebenfalls klar, dass im Streitfall am Ende eine gerichtliche Entscheidung zu treffen ist und dass diese gerichtliche Entscheidung sich am Kindeswohl zu orientieren hat.

Die Diskussion dreht sich, verkürzt dargestellt, hauptsächlich um die Frage, wer eigentlich diesen Streit gegebenenfalls zu Gericht bringen soll, ob die Väter dort einen Antrag stellen sollen oder ob es Sache der Mütter ist, auf eine Sorgerechtserklärung der Väter mit einem Widerspruch zu antworten. Darüber, um nur diesen Hauptpunkt zu nennen, konnte bisher keine Einigung erzielt werden.",Dr. Max Stadler,,data/txt/17145.txt,"Dr. Max Stadler, Parl. Staatssekretär bei der Bundesministerin der Justiz",,speech
273508,145,17,0,295,Eine weitere Nachfrage?,Dr. Hermann Otto Solms,,data/txt/17145.txt,Vizepräsident Dr. Hermann Otto Solms,,chair
273509,145,17,0,296,"Vielleicht können Sie uns einmal ganz grob sagen, in welchem zeitlichen Rahmen wir damit rechnen können, dass wir uns zusammensetzen, wobei wir darauf hoffen, dass wir dann eine gute Lösung finden werden.",Sonja Steffen,,data/txt/17145.txt,Sonja Steffen (SPD),spd,speech
273510,145,17,0,297,"Das Bundesministerium der Justiz begleitet die Gespräche der Fraktionen natürlich aktiv. Wir sind selber an einer Lösung interessiert. Derzeit muss sich ja die Praxis auf eine einstweilige Anordnung des Bundesverfassungsgerichts stützen. Damit kommt die Praxis zwar einigermaßen zurecht, aber trotzdem ist eine gesetzliche Neuregelung wünschenswert. Wir arbeiten daran. Ich kann leider nicht präzise vorhersagen, zu welchem Zeitpunkt eine Einigung erzielt wird.",Dr. Max Stadler,,data/txt/17145.txt,"Dr. Max Stadler, Parl. Staatssekretär bei der Bundesministerin der Justiz",,speech
273511,145,17,0,298,"Vielen Dank. - Dann kommen wir zur Frage 41 der Kollegin Sonja Steffen:

Plant die Bundesregierung, weiterhin die von der Bundesministerin Sabine Leutheusser-Schnarrenberger in ihrer Rede zum Insolvenzrechtstag angekündigte Reform des Verbraucherinsolvenzverfahrens umzusetzen, oder hat es in Bezug auf die damals vorgestellten Eckpunkte Positionsänderungen der Bundesregierung gegeben?",Dr. Hermann Otto Solms,,data/txt/17145.txt,Vizepräsident Dr. Hermann Otto Solms,,chair
273512,145,17,0,299,Ich darf Ihnen folgende Antwort mitteilen: Frau Bundesministerin Sabine Leutheusser-Schnarrenberger hat sich zuletzt am 28. Oktober 2011 auf dem Insolvenzverwalterkongress in Berlin umfassend zur Reform des Verbraucherinsolvenzverfahrens geäußert. Sie hat dort die wesentlichen Eckpunkte für eine künftige Reform dargestellt. Ein Diskussionsentwurf des Bundesministeriums der Justiz wird in Kürze der Öffentlichkeit vorgestellt werden.,Dr. Max Stadler,,data/txt/17145.txt,"Dr. Max Stadler, Parl. Staatssekretär bei der Bundesministerin der Justiz",,speech
273513,145,17,0,300,Nachfrage? - Frau Kollegin Steffen.,Dr. Hermann Otto Solms,,data/txt/17145.txt,Vizepräsident Dr. Hermann Otto Solms,,chair
273514,145,17,0,301,"Können Sie ganz kurz schildern, ob eine Verkürzung der Wohlverhaltensphase vorgesehen ist, und, wenn ja, mit welchen Bedingungen diese verbunden sein wird?",Sonja Steffen,,data/txt/17145.txt,Sonja Steffen (SPD),spd,speech
273515,145,17,0,302,"Nach unseren Vorstellungen ist vorgesehen, dass die Wohlverhaltensphase von sechs auf drei Jahre verkürzt werden soll, falls der Schuldner innerhalb dieses Zeitraums eine Mindestbefriedigungsquote von 25 Prozent erfüllt. Eine weitere Verkürzung - von sechs auf fünf Jahre - ist vorgesehen, wenn der Schuldner innerhalb dieses Zeitraums zumindest die Verfahrenskosten begleicht. Wenn keine der beiden Voraussetzungen erfüllt wird, soll die Wohlverhaltensperiode sechs Jahre betragen und dann die Restschuldbefreiung erteilt werden.",Dr. Max Stadler,,data/txt/17145.txt,"Dr. Max Stadler, Parl. Staatssekretär bei der Bundesministerin der Justiz",,speech
273516,145,17,0,303,"Eine weitere Nachfrage? - Das ist nicht der Fall. Dann kommen wir zu Frage 42 des Kollegen Burkhard Lischka.

Wie erklärt es die Bundesregierung, dass angesichts von 762 rechtsextremistisch motivierten Gewalttaten im Jahr 2010 - darunter 638 Körperverletzungen - lediglich 68 Anträge auf Gewährung von ""Härteleistungen für Opfer extremistischer Übergriffe"" positiv beschieden worden sind und im Jahr 2010 aus dem mit 1 Million Euro ausgestatteten Haushaltstitel 681 01 des Bundesamtes für Justiz insgesamt nur 8 160 Euro für Opfer extremistischer Übergriffe ausbezahlt wurden?",Dr. Hermann Otto Solms,,data/txt/17145.txt,Vizepräsident Dr. Hermann Otto Solms,,chair
273517,145,17,0,304,"Zu dieser Frage darf ich mitteilen, dass im Jahr 2010 bei dem für die Bearbeitung dieser Anträge zuständigen Bundesamt für Justiz von Opfern rechtsextremistischer Übergriffe insgesamt 97 Anträge auf Bewilligung von Härteleistungen gestellt worden sind. Davon sind 67 Anträge positiv beschieden worden, 22 Anträge abgelehnt worden, und über acht Anträge ist noch nicht entschieden.

Die Diskrepanz zwischen der Zahl der erfassten rechtsextremistisch motivierten Gewalttaten, die ja höher liegt, und der relativ geringen Zahl der gestellten Anträge lässt sich vielleicht teilweise dadurch erklären, dass die jährlichen polizeilichen Statistiken über politisch motivierte Kriminalität weitaus mehr Taten erfassen als jene, bei denen die Opfer Härtefallleistungen erhalten können. Ein weiterer Grund dürfte darin liegen, dass in den Bundesländern ein sehr unterschiedliches Netz von Opferberatungsstellen existiert. In manchen Ländern wird sehr intensiv beraten, in anderen weniger. Gleichwohl sind diese Erklärungen auch für uns nicht völlig ausreichend. Insgesamt sind die Gründe für die geringe Zahl der Antragsstellungen daher nicht genau zu benennen.

Wir bemühen uns, die Opfer verstärkt zu informieren. Dafür gibt es verschiedene Maßnahmen, die ich wegen der Ein-Minuten-Regel jetzt nicht im Detail aufzählen kann. Aber das Bundesministerium der Justiz ist mit allen Stellen, die für die Opfer in Betracht kommen, in Kontakt und informiert über die Möglichkeit der Antragstellungen, mehrmals jährlich auch mit Rundschreiben. Es bleibt zu hoffen, dass damit diese Möglichkeit der Ersatzleistungen besser bekannt wird und die Zahl der Anträge, für die ja Mittel zur Verfügung stehen, zunehmen wird.",Dr. Max Stadler,,data/txt/17145.txt,"Dr. Max Stadler, Parl. Staatssekretär bei der Bundesministerin der Justiz",,speech
273518,145,17,0,305,"Eine Nachfrage, Herr Kollege Lischka? - Bitte sehr.",Dr. Hermann Otto Solms,,data/txt/17145.txt,Vizepräsident Dr. Hermann Otto Solms,,chair
273519,145,17,0,306,"Herr Stadler, könnten Sie mir mitteilen, wie viel Gelder im vergangenen Jahr zum einen an die Opfer rechtsextremistischer Gewalttaten und zum anderen an die Opfer linksextremistischer Gewalttaten ausgezahlt wurden? Können Sie vielleicht auch etwas zu der Spannbreite der ausgezahlten Einzelbeträge sagen?",Burkhard Lischka,,data/txt/17145.txt,Burkhard Lischka (SPD),spd,speech
273520,145,17,0,307,"Ich habe, da Sie ja insbesondere nach der Zahl der rechtsextremistisch motivierten Gewalttaten gefragt und die Frage gestellt haben, wieso nur ein Teil der Opfer Anträge gestellt hat, in Vorbereitung meiner Antwort auch die Summe, die an Opfer rechtsextremistischer Gewalt ausgezahlt worden ist, notiert. Diese Summe betrug im Jahr 2010 etwa 63 000 Euro. Im Jahr 2011 sind bisher 67 800 Euro zugesprochen worden. Die Summen variieren natürlich im Einzelfall. Sie werden sich erinnern, weil es ja auch veröffentlicht worden ist, dass jetzt für die Angehörigen der Opfer der Nazi-Mordserie Beträge von 10 000 Euro vorgesehen sind.",Dr. Max Stadler,,data/txt/17145.txt,"Dr. Max Stadler, Parl. Staatssekretär bei der Bundesministerin der Justiz",,speech
273521,145,17,0,308,Weitere Nachfrage.,Dr. Hermann Otto Solms,,data/txt/17145.txt,Vizepräsident Dr. Hermann Otto Solms,,chair
273522,145,17,0,309,"Vielen Dank. - Herr Stadler, ich darf den letzten Aspekt, den Sie genannt haben, direkt aufgreifen. Es ist durch die Bundesjustizministerin angekündigt worden, dass die Angehörigen der durch die Zwickauer Terrorzelle Ermordeten eine Pauschalentschädigung in Höhe von 10 000 Euro erhalten sollen. Nun habe ich dem Merkblatt des Bundesamtes der Justiz entnommen, dass darüber hinaus beispielsweise auch Unterhaltsschäden ersetzt werden können, die im Einzelfall natürlich weitaus höher sein können als der Betrag von 10 000 Euro, der jetzt pauschal ausgezahlt werden soll. Haben die Angehörigen - neben dieser Pauschalentschädigung - die Möglichkeit, noch weitere Schäden geltend zu machen, oder sollen diese mit der Pauschalentschädigung abgegolten sein?",Burkhard Lischka,,data/txt/17145.txt,Burkhard Lischka (SPD),spd,speech
273523,145,17,0,310,"Im streng juristischen Sinn kann man bei diesen Leistungen nicht von Entschädigung sprechen. Sie sind vielmehr als eine Art Soforthilfe und als Anerkennung des erlittenen Unrechts gedacht. Daher wird dieses Geld auch pauschal ausgereicht. In jedem Einzelfall wird geprüft, ob besondere Umstände hinzukommen, was zu einer zusätzlichen Entscheidung führen kann. Das kann ich aber nur anhand des Einzelfalls bewerten.",Dr. Max Stadler,,data/txt/17145.txt,"Dr. Max Stadler, Parl. Staatssekretär bei der Bundesministerin der Justiz",,speech
273524,145,17,0,311,"Ich rufe nun die Frage 43 des Kollegen Lischka auf:

Wie begründet die Bundesregierung ihre in der Pressemitteilung vom 9. November 2011 vertretene Position, die Einführung einer nachträglichen Therapieunterbringung würde ""vor dem Bundesverfassungsgericht oder dem Europäischen Gerichtshof für Menschenrechte nicht bestehen""?",Dr. Hermann Otto Solms,,data/txt/17145.txt,Vizepräsident Dr. Hermann Otto Solms,,chair
273525,145,17,0,312,"Ich darf dazu aus der Pressemitteilung des Bundesministeriums der Justiz vom 9. November 2011 die Passage, auf die Sie sich beziehen, wörtlich zitieren, sonst kann man den Zusammenhang nicht verstehen. Dort heißt es:

Die nachträgliche Sicherungsverwahrung, deren Wiedereinführung nun einige Bundesländer fordern, war wenig praxisrelevant, rechtlich kaum handhabbar und hatte negative Auswirkungen auf den Vollzug insgesamt. Ihre Wiedereinführung birgt das Risiko, dass das deutsche Recht vor dem Bundesverfassungsgericht oder dem Europäischen Gerichtshof für Menschenrechte abermals nicht besteht. Das kann dazu führen, dass erneut Sicherungsverwahrte entlassen werden müssten. Dieses Risiko sollte gerade angesichts des äußerst geringen Anwendungsbereichs der nachträglichen Sicherungsverwahrung unbedingt vermieden werden.

Um Ihre Frage mit der hier gebotenen Kürze zu beantworten: Wir haben auf bestehende Risiken hingewiesen. Es kann keine sichere Prognose gestellt werden, wie das von einigen Ländern vorgeschlagene Institut bei den beiden genannten Gerichten letztendlich bewertet würde. Aber wenn man die bisherige Rechtsprechung betrachtet, sehen wir da jedenfalls ein erhebliches Risiko. Darauf haben wir hingewiesen.",Dr. Max Stadler,,data/txt/17145.txt,"Dr. Max Stadler, Parl. Staatssekretär bei der Bundesministerin der Justiz",,speech
273526,145,17,0,313,"Nachfrage, Herr Kollege Lischka?",Dr. Hermann Otto Solms,,data/txt/17145.txt,Vizepräsident Dr. Hermann Otto Solms,,chair
273527,145,17,0,314,"Vielen Dank. - Herr Stadler, darf ich Ihrer Antwort entnehmen, dass Sie es für unmöglich halten, eine verfassungskonforme Regelung im Hinblick auf eine nachträgliche Therapieunterbringung zu entwickeln?",Burkhard Lischka,,data/txt/17145.txt,Burkhard Lischka (SPD),spd,speech
273528,145,17,0,315,"Das habe ich nicht gesagt. Ich darf auf Folgendes hinweisen: Die nachträgliche Sicherungsverwahrung - selbst wenn man jetzt eine andere Bezeichnung wählt, handelt es sich unserer Meinung nach in der Sache um eine nachträgliche Sicherungsverwahrung, die in die Debatte gebracht wird - ist mit der Reform zum 1. Januar 2011 vom Deutschen Bundestag und vom Bundesrat mit den Stimmen der CDU/CSU, der FDP und der SPD zugunsten eines neuen Konzepts abgeschafft worden. Das neue Konzept sieht den Ausbau der sogenannten primären Sicherungsverwahrung und der im Urteil vorbehaltenen Sicherungsverwahrung vor. Auch die Fraktion der Grünen hat diesen Teil der Reform für richtig gehalten.",Dr. Max Stadler,,data/txt/17145.txt,"Dr. Max Stadler, Parl. Staatssekretär bei der Bundesministerin der Justiz",,speech
273529,145,17,0,316,Signalton,,,data/txt/17145.txt,,,poi
273530,145,17,0,317,"Wir sind der Meinung, dass man bei der vor etwa einem Jahr politisch getroffenen Entscheidung bleiben sollte, und weisen darauf hin, dass ein hohes Risiko im Hinblick darauf besteht, dass das Bundesverfassungsgericht in seiner Entscheidung vom Mai 2011 den Vertrauensgrundsatz bemüht hat. Man sollte daher jetzt hinter die damals gemeinsam getroffene Entscheidung nicht zurückgehen.",Dr. Max Stadler,,data/txt/17145.txt,"Dr. Max Stadler, Parl. Staatssekretär bei der Bundesministerin der Justiz",,speech
273531,145,17,0,318,Wir kommen zu einer zweiten Nachfrage des Kollegen Lischka.,Dr. Hermann Otto Solms,,data/txt/17145.txt,Vizepräsident Dr. Hermann Otto Solms,,chair
273532,145,17,0,319,"Herr Staatssekretär, vielen Dank. Eine kurze Nachfrage: Zu welchem Ergebnis kommt denn ein Gutachten, das im Bundesjustizministerium zur Frage der Verfassungsmäßigkeit einer nachträglichen Therapieunterbringung gefertigt wurde?",Burkhard Lischka,,data/txt/17145.txt,Burkhard Lischka (SPD),spd,speech
273533,145,17,0,320,"Herr Kollege Lischka, ich weiß jetzt offen gestanden nicht ganz genau, worauf Sie sich beziehen. Ich kann nur die Position unseres Hauses vortragen; denn das ist das Entscheidende und nicht die Frage, was in einer Meinungsäußerung dargelegt worden ist.

Dazu darf ich Folgendes ausführen: Die Bundesministerin der Justiz hat jetzt einen Entwurf zur Neuregelung der Sicherungsverwahrung an die Bundesländer versandt; denn im Mai 2011 sind die bisherigen Regelungen hauptsächlich wegen eines Verstoßes gegen das Abstandsgebot zum Strafvollzug aufgehoben worden. Das Bundesverfassungsgericht hat dabei keineswegs die Konzeption des Reformgesetzes infrage gestellt, das wir im Bundestag gemeinsam mit Ihnen zum 1. Januar 2011 beschlossen haben. Wir haben daher in dem Entwurf, den wir versandt haben, die nachträgliche Sicherungsverwahrung nicht aufgeführt.",Dr. Max Stadler,,data/txt/17145.txt,"Dr. Max Stadler, Parl. Staatssekretär bei der Bundesministerin der Justiz",,speech
273534,145,17,0,321,Signalton,,,data/txt/17145.txt,,,poi
273535,145,17,0,322,Wir werden jetzt die Antworten und Stellungnahmen der Bundesländer bekommen und dann darüber diskutieren.,Dr. Max Stadler,,data/txt/17145.txt,"Dr. Max Stadler, Parl. Staatssekretär bei der Bundesministerin der Justiz",,speech
273536,145,17,0,323,"Ich darf noch einmal auf die Neuregelung mit dem Signalton hinweisen. Den jeweiligen Staatssekretären ist für die Antwort auf die schriftliche Frage etwas mehr Zeit gegeben; Nachfragen und Antworten aber sollen jeweils nur eine Minute dauern. - Ich hätte dem Kollegen Stadler gerne mehr Zeit eingeräumt, weil er regelmäßig so druckreif zu antworten versteht. Ich muss aber alle Staatssekretäre gleich behandeln. Deshalb kann ich keine Ausnahme machen.",Dr. Hermann Otto Solms,,data/txt/17145.txt,Vizepräsident Dr. Hermann Otto Solms,,chair
273537,145,17,0,324,"Das ist ein alter Rechtsgrundsatz, Herr Präsident.",Dr. Max Stadler,,data/txt/17145.txt,"Dr. Max Stadler, Parl. Staatssekretär bei der Bundesministerin der Justiz",,speech
273538,145,17,0,325,"Wir kommen dann zur Frage 44 des Kollegen Stefan Rebmann:

Wie verhält sich die Anzahl der Anordnungen des Vorbehalts der Sicherungsverwahrung im Erwachsenenstrafrecht in den ersten zehn Monaten dieses Jahres im Vergleich zu den ersten zehn Monaten letzten Jahres?",Dr. Hermann Otto Solms,,data/txt/17145.txt,Vizepräsident Dr. Hermann Otto Solms,,chair
273539,145,17,0,326,"Herr Kollege Rebmann, Sie fragen nach den Zahlen der sogenannten vorbehaltenen Sicherungsverwahrung. Darunter versteht man, dass in einem Strafurteil noch nicht die Entscheidung getroffen wird, ob der Verurteilte nach Verbüßung der Strafe in Sicherungsverwahrung kommen wird, dass aber diese Möglichkeit vorbehalten wird und eine Entscheidung darüber später ergeht.

Diese im Urteil vorbehaltene Sicherungsverwahrung wird in den Statistiken der Strafrechtspflege nicht erfasst. Wir werten aber die Einträge im Bundeszentralregister aus, weil sich daraus ein - wenngleich nicht vollständig präzises - Bild ergibt. Dem Register haben wir folgende Zahlen entnehmen können: Im Jahr 2009 sind bisher neun Urteile rechtskräftig geworden, in denen die Sicherungsverwahrung im Urteil vorbehalten worden ist. Im Jahr 2010 war dies erst in einem einzigen Urteil der Fall.",Dr. Max Stadler,,data/txt/17145.txt,"Dr. Max Stadler, Parl. Staatssekretär bei der Bundesministerin der Justiz",,speech
273540,145,17,0,327,"Nachfrage, Herr Kollege Rebmann?",Dr. Hermann Otto Solms,,data/txt/17145.txt,Vizepräsident Dr. Hermann Otto Solms,,chair
273541,145,17,0,328,"Herzlichen Dank. - Herr Staatsekretär Stadler, ich habe eine Nachfrage: Wie beurteilen Sie und die Bundesregierung die Prognose, dass aufgrund des Wegfalls der nachträglich angeordneten Sicherungsverwahrung die Anzahl der Anordnungen der vorbehaltenen Sicherungsverwahrung ansteigen wird?",Stefan Rebmann,,data/txt/17145.txt,Stefan Rebmann (SPD),spd,speech
273542,145,17,0,329,"Herr Kollege Rebmann, ich habe darauf hingewiesen, dass die jetzt genannten Zahlen noch kein vollständiges Bild ergeben. In das Bundeszentralregister werden nur rechtskräftige Verurteilungen eingetragen. Das heißt, Urteile aus dem Jahr 2011, nach denen Sie gefragt haben, werden erst nach und nach in dieses Register Eingang finden, nämlich dann, wenn sie rechtskräftig geworden sind. Außerdem gibt es bestimmte Fristen für den Eintrag, sodass das Ganze nur eine Momentaufnahme ist.

Ich rechne damit, dass der Anstieg der Zahlen, bei denen von der vorbehaltenen Sicherungsverwahrung Gebrauch gemacht wird, erst noch bevorsteht. Wir haben jetzt den Vergleich von einem Fall in 2010 zu neun Fällen in 2009. Das ist noch nicht aussagekräftig genug. Ich rechne durchaus noch mit höheren Zahlen von vorbehaltener Sicherungsverwahrung im Urteil, so wie es der Konzeption des von uns gemeinsam verabschiedeten Reformprojekts entspricht.",Dr. Max Stadler,,data/txt/17145.txt,"Dr. Max Stadler, Parl. Staatssekretär bei der Bundesministerin der Justiz",,speech
273543,145,17,0,330,"Weitere Nachfrage? - Nein. Danke schön.

Dann kommen wir zur Frage 45 des Kollegen Rebmann:

Will die Bundesregierung entsprechend ihrem Koalitionsvertrag vom Oktober 2009 und entsprechend der Forderung der Justizministerinnen und Justizminister der Länder auf ihrer Herbstkonferenz vom 9. November 2011 in Berlin den Ländern die Möglichkeit geben, ihre Verwaltungs- und Sozialgerichte zu einheitlichen Fachgerichten zusammenzuführen, und falls ja, wie weit sind die Pläne fortgeschritten?",Dr. Hermann Otto Solms,,data/txt/17145.txt,Vizepräsident Dr. Hermann Otto Solms,,chair
273544,145,17,0,331,"Herr Kollege, ich darf Ihnen mitteilen: Das Bundesministerium der Justiz prüft derzeit die Möglichkeit einer gesetzlichen Umsetzung. Dabei ist allerdings zu berücksichtigen, dass jede Form der Zusammenlegung dieser Gerichte einer Grundgesetzänderung bedarf. Davon wären auch die Bundesratsinitiativen zur Einführung bloß einer Länderöffnungsklausel aus der 15. und 16. Legislaturperiode betroffen gewesen; davon ist der Bundesrat selber ausgegangen. Somit liegt hier eine sehr hohe Hürde für eine Zusammenlegung der Verwaltungs- und Sozialgerichte vor.",Dr. Max Stadler,,data/txt/17145.txt,"Dr. Max Stadler, Parl. Staatssekretär bei der Bundesministerin der Justiz",,speech
273545,145,17,0,332,"Nachfrage, Kollege Rebmann? - Keine Nachfrage. Die Frage 46 des Kollegen Volker Beck wird schriftlich beantwortet.

Vielen Dank, Herr Staatssekretär Stadler.

Wir kommen dann zum Geschäftsbereich des Bundesministeriums der Finanzen. Die Frage 47 des Kollegen Dr. Gerhard Schick, die Frage 48 der Kollegin Lisa Paus sowie die Fragen 49 und 50 der Kollegin Dr. Barbara Höll sollen schriftlich beantwortet werden.

Dann kommen wir zum Geschäftsbereich des Bundesministeriums für Arbeit und Soziales. Zur Beantwortung steht der Parlamentarische Staatssekretär Dr. Ralf Brauksiepe zur Verfügung.

Wir kommen zur Frage 51 des Kollegen Uwe Kekeritz:

Mit welcher Begründung stellt sich die Bundesregierung gegen die von der Europäischen Union am 25. Oktober 2011 veröffentlichte Corporate-Social-Responsibility-Strategie (KOM[2011] 681; vergleiche Brief des Parlamentarischen Staatssekretärs beim Bundesminister für Wirtschaft und Technologie Ernst Burgbacher an den EU-Kommissar Antonio Tajani), und wie wird sich die Bundesregierung bei der Überarbeitung der Rechnungslegungsrichtlinien (78/660/ EWG und 83/349/EWG) im Ministerrat verhalten?",Dr. Hermann Otto Solms,,data/txt/17145.txt,Vizepräsident Dr. Hermann Otto Solms,,chair
