id,sitzung,wahlperiode,in_writing,sequence,text,speaker_cleaned,speaker_fp,filename,speaker,speaker_party,type
273358,145,17,0,145,"Vielen Dank. - Der Rat für Auswärtige Angelegenheiten der Europäischen Union wird morgen zusammentreten. Die Bundesregierung hat angeregt, den Generalsekretär der Arabischen Liga zu diesen Beratungen hinzuzubitten. Nach meinem gegenwärtigen Kenntnisstand - das muss ich aber mit Vorbehalt sagen - wird das stattfinden. Wir begrüßen es außerordentlich. Es erhöht unsere Glaubwürdigkeit und wahrscheinlich auch die Effektivität unserer Bemühungen, wenn wir uns mit den Vertretern der Arabischen Liga hier auf das Engste abstimmen.",Dr. Werner Hoyer,,data/txt/17145.txt,"Dr. Werner Hoyer, Staatsminister im Auswärtigen Amt",,speech
273359,145,17,0,146,"Vielen Dank.

Die Fragen 3 und 4 der Kollegin Dr. Eva Högl werden schriftlich beantwortet.

Ich rufe nun die Frage 5 unseres Kollegen Johannes Pflug auf:

Welche konkreten Ergebnisse hat die Afghanistan-Konferenz in Istanbul Anfang November 2011 erbracht, die eine konstruktive Einbindung der Nachbarstaaten Afghanistans in den afghanischen Stabilisierungsprozess begünstigen sollen, und wie werden sich die Ergebnisse der Konferenz, nach Einschätzung der Bundesregierung, auf das zukünftige deutsche Engagement in Afghanistan auswirken?

Bitte schön, Herr Staatsminister.",Eduard Oswald,,data/txt/17145.txt,Vizepräsident Eduard Oswald,,chair
273360,145,17,0,147,"Herr Kollege Pflug, zum Teil bin ich schon auf Einzelaspekte des Themas eingegangen, das Sie mit Ihrer Frage angesprochen haben.

Die Regionalkonferenz ""Security and Cooperation in the Heart of Asia"" am 2. November in Istanbul hat einen regionalen Annährungsprozess, den sogenannten Istanbul-Prozess, zwischen Afghanistan und seinen unmittelbaren und weiteren Nachbarn in Gang gesetzt. Ziel ist es, die regionalen Kooperationen bei Sicherheits-, Wirtschafts- und Entwicklungsfragen langfristig zu vertiefen und zu systematisieren. Das Fundament bildet eine Reihe von Prinzipien - unter anderem Gewaltverzicht, territoriale Integrität und Nichteinmischung -, die für die Sicherheit und Stabilität der Region als grundlegend angesehen werden und die für die Staaten der Region verpflichtend werden sollen. Dazu zählt auch die Unterstützung des innerafghanischen Versöhnungsprozesses. Als Grundlage für den nunmehr beginnenden Prozess dient ein Katalog von vertrauensbildenden Maßnahmen. Als weiterer Schritt ist ein Treffen auf Ebene der Außenminister im Juni 2012 in Kabul vereinbart worden. Das wird zuvor auf Arbeitsebene vorbereitet, und es werden voraussichtlich vertrauensbildende Maßnahmen im Bereich Sicherheit beraten.

Die Einbettung Afghanistans als selbstständiger und souveräner Partner in der Region ist ein wichtiger Bestandteil der deutschen Afghanistan-Politik und ist für die langfristige Stabilisierung des Landes unverzichtbar. Sie ist natürlich auch integraler Bestandteil unseres Konzeptes für die Afghanistan-Konferenz Anfang der nächsten Woche in Bonn.",Dr. Werner Hoyer,,data/txt/17145.txt,"Dr. Werner Hoyer, Staatsminister im Auswärtigen Amt",,speech
273361,145,17,0,148,"Ihre erste Nachfrage, Kollege Johannes Pflug.",Eduard Oswald,,data/txt/17145.txt,Vizepräsident Eduard Oswald,,chair
273362,145,17,0,149,"Herzlichen Dank, Herr Staatsminister. - Sind auf der Konferenz in Istanbul irgendwelche Verifizierungsgespräche, Nachfolgekonferenzen oder Institutionalisierungen von Gesprächsformaten vereinbart worden, die von uns auch im Hinblick auf die in Bonn anstehende Konferenz genutzt werden könnten?",Johannes Pflug,,data/txt/17145.txt,Johannes Pflug (SPD),spd,speech
273363,145,17,0,150,"Ja und nein. Der Prozess soll eine Fortsetzung in der Konferenz von Kabul finden, die aber erst nach der Bonner Konferenz stattfindet. Es macht Sinn, das, was in Istanbul beschlossen worden ist, in die Bonner Konferenz einfließen zu lassen und dann weitere Schlussfolgerungen zu ziehen. Um es etwas flapsig auszudrücken: Die Istanbul-Konferenz ist keine Eintagsfliege.",Dr. Werner Hoyer,,data/txt/17145.txt,"Dr. Werner Hoyer, Staatsminister im Auswärtigen Amt",,speech
273364,145,17,0,151,Ihre zweite Nachfrage.,Eduard Oswald,,data/txt/17145.txt,Vizepräsident Eduard Oswald,,chair
273365,145,17,0,152,"Herr Staatsminister, an dieser Konferenz hat Pakistan noch teilgenommen. Wie würden Sie die Rolle Pakistans auf dieser Konferenz charakterisieren?",Johannes Pflug,,data/txt/17145.txt,Johannes Pflug (SPD),spd,speech
273366,145,17,0,153,"Unter dem Vorbehalt, dass ich selbst nicht dabei war und ich mich auf die Berichte von Bundesminister Westerwelle, der an dieser Konferenz teilgenommen hat, beziehen muss, will ich sagen: Ich fand die Teilnahme und die Art der Teilnahme Pakistans an dieser Konferenz hoffnungsspendend.

Deswegen halten wir ja so an dem Wunsch fest, mit Pakistan weiterhin zusammenzuarbeiten. In der Pakistan-Politik gibt es im globalen Maßstab große Fragezeichen und große Probleme. Pakistan ist ein wichtiges Land in der Region und in der Welt. Es ist auch ein Land, das Probleme hat, die im Nuklearzeitalter für uns alle relevant sind. Deswegen müssen wir uns intensiv darum kümmern und müssen sagen, was geht und was nicht geht. Ich warne vor der Dämonisierung eines solchen Partners, der für die Stabilisierung dieser Region und der Welt von herausragender Bedeutung ist. Deswegen sollten wir uns um einen konstruktiven Umgang bemühen.",Dr. Werner Hoyer,,data/txt/17145.txt,"Dr. Werner Hoyer, Staatsminister im Auswärtigen Amt",,speech
273367,145,17,0,154,"Vielen Dank.

Wir kommen zur Frage 6 des Abgeordneten Johannes Pflug:

Wie beurteilt die Bundesregierung die bisherigen Ergebnisse der Loya Jirga vom November 2011 mit Blick auf die stagnierenden Gespräche zwischen der afghanischen Regierung und den Aufständischen, und welche Schritte hat die Bundesregierung unternommen und geplant, um diesen abgebrochenen Gesprächsprozess wieder in Gang zu bringen?

Bitte schön, Herr Staatsminister.",Eduard Oswald,,data/txt/17145.txt,Vizepräsident Eduard Oswald,,chair
273368,145,17,0,155,"Die Bundesregierung begrüßt es, dass die Delegierten der Loya Jirga den Prozess einer politischen Einbindung der Aufständischen ausdrücklich unterstützt haben. Nach der Ermordung des Vorsitzenden des Hohen Friedensrates Burhanuddin Rabbani und der aufgeheizten Stimmungslage in den Folgewochen setzten die Delegierten mit ihrer Resolution ein klares Zeichen der Fortsetzung der Friedenspolitik.

Die Bundesregierung teilt die Auffassung der afghanischen Regierung, dass eine Lösung letztlich nur politisch gelingen kann. Zwischen der afghanischen Regierung und der internationalen Gemeinschaft besteht Einigkeit, dass der Versöhnungsprozess unter afghanischer Führung stehen muss. Die Bundesregierung ist auf Wunsch der afghanischen Regierung bereit, diesen Prozess im Rahmen des ihr Möglichen zu unterstützen. So wurde unter deutschem Vorsitz im Sanktionsausschuss der Vereinten Nationen die Trennung in ein Al-Qaida- und ein Afghanistan-Taliban-Sanktionsregime bewirkt. Nach ersten bereits erfolgten Entlistungen - also die Streichung von den Listen, wie man das so schön nennt - im Sommer 2011 werden zurzeit weitere Anträge im Sinne von vertrauensbildenden Maßnahmen zur Unterstützung des politischen Prozesses bearbeitet.

Wir sind insofern bei diesem überaus komplexen Thema verhalten optimistisch.",Dr. Werner Hoyer,,data/txt/17145.txt,"Dr. Werner Hoyer, Staatsminister im Auswärtigen Amt",,speech
273369,145,17,0,156,"Ihre erste Nachfrage, Kollege Pflug.",Eduard Oswald,,data/txt/17145.txt,Vizepräsident Eduard Oswald,,chair
273370,145,17,0,157,"Danke schön, Herr Staatsminister. - Ein wichtiges Ergebnis dieser Loya Jirga ist wohl die Akzeptanz einer dauerhaften amerikanischen Truppenpräsenz in Afghanistan auch nach dem Jahr 2014. Angesichts des dramatisch verschlechterten Verhältnisses zwischen den USA und Pakistan stellt sich natürlich die Frage, wie die Auswirkungen einer dauerhaften Truppenpräsenz in Afghanistan beurteilt werden. Halten Sie es für denkbar, dass die Deutschen bzw. die Europäer gemeinsam mit den Amerikanern versuchen, ihre Interessen in dieser Region Südasiens zu definieren, um vielleicht doch noch zu einer ansatzweisen Stabilisierung zu kommen?",Johannes Pflug,,data/txt/17145.txt,Johannes Pflug (SPD),spd,speech
273371,145,17,0,158,"Es ist völlig klar, dass wir mit unseren amerikanischen Freunden in einem sehr engen Dialog stehen und dass wir die Sensibilitäten im Hinblick auf die verschiedenen Truppensteller in der Region - Afghanistan selber, aber auch Pakistan und andere Länder - kennen. Deswegen ist es logisch, dass sich die NATO mit diesen Fragen befasst und wir direkt mit unseren amerikanischen Freunden kommunizieren.

Jetzt aber - unmittelbar vor der Bonn-Konferenz und unmittelbar nach diesem furchtbaren Ereignis, das uns vorhin beschäftigt hat - wäre es falsch, einen Schnellschuss zu machen.",Dr. Werner Hoyer,,data/txt/17145.txt,"Dr. Werner Hoyer, Staatsminister im Auswärtigen Amt",,speech
273372,145,17,0,159,"Ihre nächste Nachfrage, Herr Kollege Pflug.",Eduard Oswald,,data/txt/17145.txt,Vizepräsident Eduard Oswald,,chair
273373,145,17,0,160,"Herr Staatsminister, können Sie die Hoffnung bestätigen, dass es auch auf der Seite der Aufständischen Gesprächspartner gibt, mit deren Hilfe man vielleicht doch noch zu positiven Ergebnissen in diesem Verhandlungs- und Friedensprozess kommen kann?",Johannes Pflug,,data/txt/17145.txt,Johannes Pflug (SPD),spd,speech
273374,145,17,0,161,"Das ist einer der brisantesten Komplexe, die es hier zu bearbeiten gilt. Ich möchte nicht einer Illusionspolitik geziehen werden. Wenn Sie mich aber so persönlich fragen, würde ich sagen: Bei mir ist ein Funken Hoffnung da.",Dr. Werner Hoyer,,data/txt/17145.txt,"Dr. Werner Hoyer, Staatsminister im Auswärtigen Amt",,speech
273375,145,17,0,162,"Vielen Dank.

Die Frage 7 des Abgeordneten Hans-Christian Ströbele sowie die Fragen 8 und 9 des Abgeordneten Dr. h. c. Gernot Erler werden schriftlich beantwortet.

Wir kommen zur Frage 10 des Abgeordneten Dr. Rolf Mützenich:

Welche gemeinsamen Kriterien legt die Bundesregierung dem Begriff der Gestaltungsmächte zugrunde, und welche Länder zählt sie im Einzelnen dazu?

Bitte schön, Herr Staatsminister.",Eduard Oswald,,data/txt/17145.txt,Vizepräsident Eduard Oswald,,chair
273376,145,17,0,163,"Die Bundesregierung erstellt derzeit unter Federführung des Auswärtigen Amts ein ressortabgestimmtes Konzept zur Zusammenarbeit mit aufstrebenden Mächten zur Gestaltung deutscher Globalisierungspolitik. Wir befinden uns in einem intellektuellen Findungsprozess, der von einem Abschluss noch weit entfernt ist. Insofern kann ich Ihnen über Ergebnisse noch keinen Bericht erstatten. Ziel des Konzeptes ist es, das Zeitalter der globalen Interdependenzen mit aufstrebenden Mächten durch eine kohärente Globalisierungspolitik aktiv mitzugestalten. Aber wir befinden uns hier in einer relativ frühen Phase. Da das Thema eine solche Dimension hat, muss ich sagen: Man muss etwas wachsen lassen, und die politische Führung muss sich intensiv damit beschäftigen. Da würde ich nicht gleich jeden Referentenentwurf für bare Münze nehmen.",Dr. Werner Hoyer,,data/txt/17145.txt,"Dr. Werner Hoyer, Staatsminister im Auswärtigen Amt",,speech
273377,145,17,0,164,"Ihre erste Nachfrage, Kollege Dr. Mützenich.",Eduard Oswald,,data/txt/17145.txt,Vizepräsident Eduard Oswald,,chair
273378,145,17,0,165,"Vielen Dank, Herr Staatsminister. - Ich gehe davon aus, dass die Bundeskanzlerin keine Referentenentwürfe in die Kabinettsberatungen einbringt. Es war aber die Bundeskanzlerin, die im Zusammenhang mit der Diskussion über Panzerlieferungen an Saudi-Arabien sehr konkret von der Gestaltungsmacht Saudi-Arabiens gesprochen hat. Deswegen verwundert es mich jetzt schon, dass Sie auf der einen Seite noch in einem offenen intellektuellen Findungsprozess mit aufstrebenden Mächten zur Gestaltung deutscher Globalisierungspolitik sind und auf der anderen Seite bereits Waffenlieferungen in den Nahen Osten genehmigt haben. Wie passt das zusammen? Wie bewerten Sie, wenn Saudi-Arabien zu den Gestaltungsmächten gehört, mit Blick auf die Waffenlieferungen an dieses Land eine Studie der Stiftung Wissenschaft und Politik - die Stiftung arbeitet sowohl der Bundesregierung als auch dem Bundestag zu; die Studie ist im Netz abrufbar -, in der insbesondere steht, dass Saudi-Arabien unruhigen Zeiten entgegengeht?",Dr. Rolf Mützenich,,data/txt/17145.txt,Dr. Rolf Mützenich (SPD),spd,speech
273379,145,17,0,166,"Das geht weit über den Scope Ihrer ursprünglichen Fragestellung hinaus; aber das ist völlig legitim. - Ich bleibe dabei, dass wir in dem Moment, in dem wir das zu einem in der Regierung abgestimmten Konzept erklären, eine Vorlage präsentieren müssen, die weit über die Definition des Begriffs ""neue Gestaltungsmacht"" hinausgeht. Ein solches globalisierungspolitisches Konzept gibt es aber noch nicht. Ich wäre da sehr vorsichtig. Deswegen würde ich den Begriff nicht auf einen Kontext reduzieren, der ausgesprochen streitig ist und differenziert zu betrachten ist. Der von Ihnen hergestellte Zusammenhang mit Rüstungsexporten führt von vornherein auf eine falsche Spur. Wenn man ein umfassendes Konzept einer aktiveren Globalisierungspolitik erstellen möchte, dann muss man sich mit dieser Frage umfassender beschäftigen.

Ansonsten bleibt es dabei, dass es hier um Staaten geht, die im regionalen oder internationalen Bereich eine besondere Wirtschaftskraft aufweisen, einen starken Gestaltungswillen in verschiedenen Politikbereichen haben und denen eine zentrale Bedeutung bei der Gestaltung globaler Ordnungspolitik zukommt. Das wäre der Versuch einer Definition; aber er reicht nicht aus, um ein globalisierungspolitisches Konzept zu entwickeln.",Dr. Werner Hoyer,,data/txt/17145.txt,"Dr. Werner Hoyer, Staatsminister im Auswärtigen Amt",,speech
273380,145,17,0,167,"Ihre zweite Nachfrage, Kollege Dr. Mützenich.",Eduard Oswald,,data/txt/17145.txt,Vizepräsident Eduard Oswald,,chair
273381,145,17,0,168,"Vielen Dank, Herr Präsident. - Herr Staatsminister, trotz der großen Sympathie sowohl für Ihre Antwort als auch für Ihre Person muss ich noch einmal nachfragen. Sie sagen, es gebe zurzeit einen Abstimmungsprozess im Hinblick auf die Rolle der Gestaltungsmächte in der deutschen Außenpolitik. Wie lange muss der Bundestag nach Ihrer Einschätzung auf die abschließende Bewertung der Rolle der Gestaltungsmächte in der internationalen Politik durch die Bundesregierung warten? Wird eine solche Bewertung bis zum Ende der Legislaturperiode, egal wie lange sie dauert, vorliegen?",Dr. Rolf Mützenich,,data/txt/17145.txt,Dr. Rolf Mützenich (SPD),spd,speech
273382,145,17,0,169,"Da kann ich Sie beruhigen: Unsere Fachleute sind bei der Behandlung dieser Frage sehr ambitioniert und möchten bald etwas beschlossen sehen. Ich halte die Frage aber für so brisant, dass wir in der politischen Führung sehr genau darüber diskutieren müssen und dass wir unsere, wie ich finde, immer sehr anregenden Begegnungen im Auswärtigen Ausschuss dazu nutzen sollten, einen intellektuellen Diskurs darüber zu führen und dann hoffentlich gemeinsam etwas zustande bringen. Denn das ist die Frage, mit der wir uns in den nächsten Jahren prioritär befassen werden: Wie werden wir die Selbstbehauptung Deutschlands im europäischen Kontext und in der Globalisierung organisieren? Dies ist eine ganz entscheidende Frage.",Dr. Werner Hoyer,,data/txt/17145.txt,"Dr. Werner Hoyer, Staatsminister im Auswärtigen Amt",,speech
273383,145,17,0,170,"Wir kommen zur Frage 11 unseres Kollegen Dr. Rolf Mützenich:

Warum beurteilt die Bundesregierung die Umbrüche in Nordafrika als ""Gefahr für die Sicherheit"" (siehe die Stellungnahme der Bundesregierung zum Grünbuch der EU-Kommission zum EU-Ausfuhrkontrollsystem von Dual-Use-Gütern), anstatt die ihnen innewohnenden politischen Chancen dieser gesellschaftspolitischen Entwicklungen für die Nachbarregion Europas aktiv politisch zu nutzen?

Bitte schön, Herr Staatsminister.",Eduard Oswald,,data/txt/17145.txt,Vizepräsident Eduard Oswald,,chair
273384,145,17,0,171,"Hier ist, glaube ich, ein begriffliches Problem entstanden, und zwar dadurch, dass der negativ konnotierte Ausdruck ""Gefahr für die Sicherheit"" in Zusammenhang mit den Entwicklungen in Nordafrika verwendet worden ist. Es ist natürlich völlig klar, dass die Bundesregierung den Entwicklungen der vergangenen Monate in nordafrikanischen Ländern in Richtung Gewährleistung von Rechtsstaatlichkeit, politischer Teilhabe und Menschenwürde mit großer Sympathie begegnet und sie begrüßt. Die Bundesregierung sieht diese Entwicklungen zunächst einmal als eine große Chance für diese Länder selber, aber eben auch als eine Chance für die Vertiefung der bilateralen und der interregionalen Zusammenarbeit, insbesondere der Zusammenarbeit Nordafrikas mit der Europäischen Union. Die Bundesregierung unterstützt diese Entwicklungen durch konkrete Vorhaben in der Zusammenarbeit, wie sie in den Transformationspartnerschaften, zunächst mit Ländern wie Tunesien und Ägypten, zum Ausdruck kommen. Auch in der Europäischen Union setzt sich die Bundesregierung dafür ein, dass durch eine Neuausrichtung der europäischen Nachbarschaftspolitik insbesondere die reformorientierten Staaten Nordafrikas unterstützt werden und wir somit die Chancen dieser Entwicklungen fördern.",Dr. Werner Hoyer,,data/txt/17145.txt,"Dr. Werner Hoyer, Staatsminister im Auswärtigen Amt",,speech
273385,145,17,0,172,"Ihre erste Nachfrage, Herr Kollege Dr. Mützenich. Bitte schön.",Eduard Oswald,,data/txt/17145.txt,Vizepräsident Eduard Oswald,,chair
273386,145,17,0,173,"Herr Staatsminister, ich bin dankbar, dass wir uns darauf verständigen können, dass es ein gewisses - wie Sie es formuliert haben - begriffliches Problem gibt, was die Stellungnahme der Bundesregierung an die Europäischen Kommission betrifft. In der Tat bergen solche Umbruchsituationen auf der einen Seite Risiken, aber sie bieten auf der anderen Seite durchaus auch Chancen für Europa. Das haben Sie eben ausgeführt.

Kann es dennoch sein, dass nicht ein begriffliches Problem besteht - diese Stellungnahme wurde unter Federführung des Wirtschaftsministeriums erarbeitet -, sondern dass damit die Begründung für eine Lieferung sowohl von Dual-Use-Gütern als auch möglicherweise von Rüstungsgütern erleichtert wurde?",Dr. Rolf Mützenich,,data/txt/17145.txt,Dr. Rolf Mützenich (SPD),spd,speech
273387,145,17,0,174,"Ich will das nicht auf die Federführung des Wirtschaftsministeriums reduziert wissen. Das ist ein umfassenderes Problem; denn die Entwicklungen in den einzelnen Ländern Nordafrikas sind sehr unterschiedlich. Risiken durch die Umleitung von problematischen Gütern an Dritte sind angesichts teilweise längst noch nicht hinreichend ausgeprägter staatlicher - auch rechtsstaatlich kontrollierter - Strukturen nicht ganz auszuschließen. Deswegen müssen wir uns offenen Auges mit diesem Problem befassen. Auf die möglichen Risiken und Gefahren besonders vor dem Hintergrund der Ausfuhrkontrolle weist die Formulierung der Bundesregierung in der Stellungnahme zum Grünbuch der EU-Kommission hin, ohne einen falschen Verdacht produzieren zu wollen; das wäre sicherlich unangemessen.

Nehmen Sie als Beispiel die Risiken im Verhältnis zu anderen fragilen Sahel-Staaten, in denen al-Qaida im islamischen Maghreb seine Aktivitäten ausdehnt. Neulich wurde uns über massive Zuflüsse von Waffen aus libyschen Beständen an al-Qaida in der Region berichtet. Das ist ein Problem, das man nicht einfach wegdiskutieren kann. Ich möchte aber um Himmels willen nicht die demokratischen, rechtsstaatlichen Kräfte, die sich in Nordafrika auf einen großartigen Reformweg begeben, unter Generalverdacht stellen. Das wäre völlig unangemessen.",Dr. Werner Hoyer,,data/txt/17145.txt,"Dr. Werner Hoyer, Staatsminister im Auswärtigen Amt",,speech
273388,145,17,0,175,"Ihre zweite Nachfrage, Kollege Dr. Mützenich.",Eduard Oswald,,data/txt/17145.txt,Vizepräsident Eduard Oswald,,chair
273389,145,17,0,176,"Danke schön, Herr Präsident. - Herr Staatsminister, da wir von Ihnen gerade gehört haben, dass es sich um ein begriffliches Problem bzw. um eine unzutreffende Zuschreibung handelt, gehe ich davon aus, dass die Bundesregierung in Zukunft vorsichtiger bei der Verwendung solcher Formulierungen sein wird. Ich hoffe, dass das Auswärtige Amt seinen Beitrag dazu leisten wird.

Unabhängig davon: Sind Sie mit mir der Meinung, dass - wie es auch in der Stellungnahme der Bundesregierung zum Grünbuch der Europäischen Kommission heißt - eine Harmonisierung bei EU-Ausfuhren von Dual-Use-Gütern oder Rüstungsgütern nicht mehr beabsichtigt ist? Gibt es in der Bundesregierung einen Paradigmenwechsel, was die Harmonisierung bei der Ausfuhr solcher Güter innerhalb der Europäischen Union betrifft?",Dr. Rolf Mützenich,,data/txt/17145.txt,Dr. Rolf Mützenich (SPD),spd,speech
273390,145,17,0,177,"Dieser Zusammenhang geht mir jetzt zu weit. Das wäre eine Frage der grundsätzlichen Orientierung, der Neuorientierung der Rüstungsexportpolitik bzw. der Dual-Use-Exportpolitik. Das lässt sich anhand dieses einen Beispiels nicht beantworten. Das wäre leichtfertig.",Dr. Werner Hoyer,,data/txt/17145.txt,"Dr. Werner Hoyer, Staatsminister im Auswärtigen Amt",,speech
273391,145,17,0,178,"Nachdem der Kollege Dr. Mützenich seine zwei Nachfragen gestellt hat, hat jetzt Frau Kollegin Katja Keul das Wort.",Eduard Oswald,,data/txt/17145.txt,Vizepräsident Eduard Oswald,,chair
273392,145,17,0,179,"Vielen Dank. - Nachdem Sie uns erklärt haben, dass die Formulierung ""Gefahr für die Sicherheit"" eine begriffliche Verwirrung ist, möchte ich Sie fragen, ob Ihnen klar ist, dass nicht nur im Wirtschaftsministerium, sondern auch im Verteidigungsministerium offensichtlich solche Verwirrungen herrschen. Wir haben in der Debatte über eine Verlängerung des Militäreinsatzes Operation Active Endeavour im Mittelmeer das seltsam anmutende Argument gehört, dass es zwar schwierig sei, diesen Einsatz angesichts seiner bisherigen Legitimation zu rechtfertigen, dass aber durch die Umbrüche in Nordafrika jetzt alles so gefährlich sei, dass man die Begründung dieses Militäreinsatz darauf stützen könne. Das scheint mir doch über eine begriffliche Verwirrung hinauszugehen. Wie stehen Sie zu dieser Einschätzung des Verteidigungsministeriums?",Katja Keul,,data/txt/17145.txt,Katja Keul (BÜNDNIS 90/DIE GRÜNEN),gruene,speech
273393,145,17,0,180,"Ich glaube, wir sprechen hier ein Stück weit unterschiedliche Sprachen. Ich habe gesagt: Dieser Begriff ist problematisch, wenn er mit den gegenwärtigen Reformprozessen in Nordafrika in Zusammenhang gebracht wird. Diese Reformprozesse sind großartig. Sie verdienen unsere Unterstützung, nicht unsere Verdächtigungen.

Trotzdem haben wir objektiv betrachtet Probleme mit dem Nachweis des Verbleibs von bestimmten Gütern. Deswegen müssen wir der Sache genau auf den Grund gehen. Wenn Probleme im Hinblick auf die Leistungsfähigkeit und die Belastbarkeit staatlicher Institutionen bestehen, auch im Kontrollbereich - auf der Konferenz der Körber-Stiftung, die gestern in Berlin stattfand, haben die Menschen aus der Region das nachhaltig unterstrichen -, dann müssen wir diese ernst nehmen, auch mit Blick auf die Gefahren, die aus den Exportaktivitäten resultieren können. Das ist überhaupt keine diskriminierende Äußerung gegenüber den Ländern in der Region. Man muss bei der Formulierung aufpassen. Dass das Wirtschaftsministerium, welches diese Vorlage, wie ich glaube, gemacht hat, darauf hinweist, dass es ein Problem gibt, finde ich vollkommen realistisch. Ich glaube, Sie würden uns als Erste vorwerfen, nicht hinreichend aufgepasst zu haben, wenn ein Rüstungsgut in einem Land auftauchen würde, in das es nicht gehört.",Dr. Werner Hoyer,,data/txt/17145.txt,"Dr. Werner Hoyer, Staatsminister im Auswärtigen Amt",,speech
273394,145,17,0,181,"Vielen Dank.

Wir bleiben in diesem Geschäftsbereich. Ich rufe die Frage 12, gestellt von unserem Kollegen Niema Movassat, auf:

Was hat der deutsche Botschafter in Namibia, Egon Kochanke, am 16. November 2011 in Windhuk gemeint, als er anlässlich der Unterzeichnung der bilateralen Vereinbarungen der Entwicklungszusammenarbeit gegenüber der Presse Bezug auf die namibische Delegation in Berlin anlässlich der Rückführung von Gebeinen von Opfern des deutschen Vernichtungsfeldzugs nach Namibia nahm und davon sprach, dass diese ""aufgrund ihrer versteckten Agenda"" einen ""negativen Eindruck"" hinterlassen habe (vergleiche The Namibian, 17. November 2011, www.namibian.com.na/index.php?id= 28&tx_ttnews[tt_news]=90164&no_cache=1)?

Herr Staatsminister, bitte.",Eduard Oswald,,data/txt/17145.txt,Vizepräsident Eduard Oswald,,chair
