id,sitzung,wahlperiode,in_writing,sequence,text,speaker_cleaned,speaker_fp,filename,speaker,speaker_party,type
273618,145,17,0,405,"Mancher Passant war verdutzt und irritiert. Die üblichen Schubladen passten nicht mehr. So zeigt sich Demokratie von ihrer besten Seite, wie ich finde.",Christian Lange,,data/txt/17145.txt,Christian Lange (Backnang) (SPD),spd,speech
273619,145,17,0,406,Beifall bei der SPD,,,data/txt/17145.txt,,,poi
273620,145,17,0,407,"Deshalb gibt es auch keine Verliererinnen und Verlierer bei der Stuttgart-21-Debatte, sondern die Sache hat gewonnen. Stuttgart 21 wird gebaut.

Schließlich: Ja, die Volksabstimmung verlangt auch von den Bürgern, das Ergebnis zu akzeptieren. Das Stuttgarter Ergebnis mit 52,9 Prozent für Stuttgart 21 hilft dabei - davon bin ich fest überzeugt -, eine befriedende Wirkung zu entfalten. Gerade die Projektgegner haben jetzt aber eine große Verantwortung. Trauern - ja. Doch es waren keine Verschwörungen und auch keine finsteren Mächte, die das Ergebnis herbeigeführt haben.",Christian Lange,,data/txt/17145.txt,Christian Lange (Backnang) (SPD),spd,speech
273621,145,17,0,408,Die SPD war aber auch nicht dabei!,Thomas Strobl,,data/txt/17145.txt,Thomas Strobl [Heilbronn] [CDU/CSU],cducsu,poi
273622,145,17,0,409,"Wer so argumentiert, der kann der direkten Demokratie nichts Richtiges abgewinnen. Auch das gehört zur ganzen Wahrheit.

Schließen will ich mit einem Zitat von Tissy Bruns. Sie hat gestern im Tagesspiegel geschrieben:

In der Volksabstimmung zeigt sich ein erfreulicher Common sense, den öffentliche Debatten in den letzten Jahren so oft vermissen ließen. Das Ergebnis hat nicht nur aufgeräumt mit der Vorstellung einer allmächtigen Bürgerwut. Es entmystifiziert auch die überzogenen Befürchtungen und Beschwörungen einer ""Dagegen""-Republik, in der jeder und jede nur noch an den eigenen Vorgarten denkt. Die Energiewende wird schwierig; dass sie aber an den Widerständen doppelmoralischer Bürger scheitert, die keine Atomkraft wollen, aber den Netzausbau blockieren, ist sehr unwahrscheinlich. Die Bürger, hat sich in Stuttgart gezeigt, wollen mitreden, und sie lassen mit sich reden.

Das finde ich ermutigend.

Herzlichen Dank.",Christian Lange,,data/txt/17145.txt,Christian Lange (Backnang) (SPD),spd,speech
273623,145,17,0,410,Beifall bei der SPD,,,data/txt/17145.txt,,,poi
273624,145,17,0,411,So kann man sich eine Niederlage schönreden!,Siegfried Kauder,,data/txt/17145.txt,Siegfried Kauder [Villingen-Schwenningen] [CDU/CSU],cducsu,poi
273625,145,17,0,412,Welche Niederlage denn?,Katja Mast,,data/txt/17145.txt,Gegenruf der Abg. Katja Mast [SPD],spd,poi
273626,145,17,0,413,,Christian Lange,,data/txt/17145.txt,Christian Lange (Backnang) (SPD),spd,speech
273627,145,17,0,414,Für die FDP-Fraktion hat jetzt der Kollege Patrick Döring das Wort.,Dr. Hermann Otto Solms,,data/txt/17145.txt,Vizepräsident Dr. Hermann Otto Solms,,chair
273628,145,17,0,415,Beifall bei der FDP und der CDU/CSU,,,data/txt/17145.txt,,,poi
273629,145,17,0,416,,Dr. Hermann Otto Solms,,data/txt/17145.txt,Vizepräsident Dr. Hermann Otto Solms,,chair
273630,145,17,0,417,"Herr Präsident! Liebe Kolleginnen und Kollegen! Zunächst erlaube ich mir, weil man das der Rede des geschätzten Kollegen Lange nicht so sehr anmerkte, die Bemerkung, dass die Mehrheit der Bevölkerung von Baden-Württemberg bereits bei der vergangenen Landtagswahl überwiegend für die Parteien, die für Stuttgart 21 waren, gestimmt hat; denn die SPD konnte man ja eindeutig dazuzählen. Deshalb war die Wahl als solche keine Abstimmung über dieses Projekt. Aber ich sage auch: Die Mehrheit vom vergangenen Sonntag bestätigt das, was der Kollege Strobl gesagt hat: Stadtrat, Landtag und Bundestag haben in ihren zahlreichen Entscheidungen für Stuttgart 21 nicht gegen den Willen des Volkes agiert, sondern den Geist und den Mut der Menschen ganz offensichtlich getroffen.",Patrick Döring,,data/txt/17145.txt,Patrick Döring (FDP),fdp,speech
273631,145,17,0,418,Beifall bei der FDP und der CDU/CSU,,,data/txt/17145.txt,,,poi
273632,145,17,0,419,"Die deutsche Bevölkerung ist demnach zukunftsfähiger, aufgeschlossener gegenüber Neuem und aufgeschlossener gegenüber Innovationen, als von einigen in diesem Hause gelegentlich der Eindruck erweckt wird. Die deutsche Bevölkerung ist offenbar auch viel mehr bereit, Opfer auf sich zu nehmen - in Stuttgart selbst durch jahrelange Bautätigkeit -, als hier gelegentlich geglaubt wird. Ja, die repräsentative Demokratie hatte bei diesem Thema in den vergangenen 15 Jahren offenbar den richtigen Riecher. Dafür dürfen wir all denjenigen, die daran über Jahrzehnte parlamentarisch beteiligt waren, durchaus auch einmal ein Kompliment machen. Demokratie funktioniert in diesem Land, liebe Kolleginnen und Kollegen.",Patrick Döring,,data/txt/17145.txt,Patrick Döring (FDP),fdp,speech
273633,145,17,0,420,Beifall bei der FDP und der CDU/CSU,,,data/txt/17145.txt,,,poi
273634,145,17,0,421,"Ich bin sehr dankbar, dass der Kollege Lange auf die Rolle der Landesregierung hingewiesen hat. Es gehört eben mehr zur Projektbeförderung durch einen Vertragspartner als konstruktiv-kritische Begleitung. Der Finanzierungsvertrag gilt.",Patrick Döring,,data/txt/17145.txt,Patrick Döring (FDP),fdp,speech
273635,145,17,0,422,Wollten Sie nicht eigentlich über den Standort Deutschland sprechen?,Britta Haßelmann,,data/txt/17145.txt,Britta Haßelmann [BÜNDNIS 90/DIE GRÜNEN],gruene,poi
273636,145,17,0,423,"Deshalb erwarte ich, dass auch die Landesregierung ihren Teil dazu beiträgt, die jetzt entstandene zwölfmonatige Verzögerung bei der Realisierung des Projekts durch schnelles Verwaltungshandeln ein Stück weit aufzuholen. Es muss aufhören, dass die von Herrn Minister Hermann in Dienst gestellten früheren Demonstranten in seinem Ministerium Häcksel in die Wurst schneiden. Sie müssen endlich damit anfangen, das Projekt wirklich zu befördern, liebe Kolleginnen und Kollegen.",Patrick Döring,,data/txt/17145.txt,Patrick Döring (FDP),fdp,speech
273637,145,17,0,424,Beifall bei der FDP und der CDU/CSU,,,data/txt/17145.txt,,,poi
273638,145,17,0,425,"Na, na, na! Jetzt reicht es aber! Nicht im Ton vergreifen!",Sylvia Kotting-Uhl,,data/txt/17145.txt,Sylvia Kotting-Uhl [BÜNDNIS 90/DIE GRÜNEN],gruene,poi
273639,145,17,0,426,Am letzten für die Grünen in diesem Hause so schmerzlichen Sonntag hat auch ein Bundesparteitag der Grünen stattgefunden.,Patrick Döring,,data/txt/17145.txt,Patrick Döring (FDP),fdp,speech
273640,145,17,0,427,Oh ja!,Dr. Joachim Pfeiffer,,data/txt/17145.txt,Dr. Joachim Pfeiffer [CDU/CSU],cducsu,poi
273641,145,17,0,428,"Ich will mir, weil wir über Mobilität und Verkehr sprechen, bei dieser Gelegenheit erlauben, dieses Hohe Haus, aber auch die Zuhörerinnen und Zuhörer auf die verkehrspolitisch und mobilitätspolitisch relevanten Entscheidungen hinzuweisen, die dort getroffen wurden.",Patrick Döring,,data/txt/17145.txt,Patrick Döring (FDP),fdp,speech
273642,145,17,0,429,Hochinteressant!,Thomas Strobl,,data/txt/17145.txt,Thomas Strobl [Heilbronn] [CDU/CSU],cducsu,poi
273643,145,17,0,430,"Sie haben sich in Ihrem Beschluss dazu bekannt, dass Sie mit Steuern steuern wollen. Sie wollen nicht nur in eine ganz andere Richtung steuern, nein, Sie wollen den Menschen in Wahrheit ihr Lebensgefühl und ihre Lebensart diktieren. Dazu sagen wir: Das ist der falsche Weg, um die Menschen mitzunehmen - auch in der politischen Debatte.",Patrick Döring,,data/txt/17145.txt,Patrick Döring (FDP),fdp,speech
273644,145,17,0,431,Beifall bei der FDP und der CDU/CSU,,,data/txt/17145.txt,,,poi
273645,145,17,0,432,Gilt das auch für das Betreuungsgeld?,Florian Pronold,,data/txt/17145.txt,Florian Pronold [SPD],spd,poi
273646,145,17,0,433,"Sie haben entschieden, die Pendlerpauschale zu streichen und damit den Weg von der Wohnung zur Arbeitsstätte für Millionen Arbeitnehmerinnen und Arbeitnehmer, die jeden Morgen viele Kilometer auf sich nehmen, um ihrer Arbeit nachzugehen, ihr Leben schwerer zu machen, deren Steuerlast zu erhöhen und damit leistungsfeindliche Anreize zu setzen.",Patrick Döring,,data/txt/17145.txt,Patrick Döring (FDP),fdp,speech
273647,145,17,0,434,Richtig lesen hilft!,Sylvia Kotting-Uhl,,data/txt/17145.txt,Sylvia Kotting-Uhl [BÜNDNIS 90/DIE GRÜNEN],gruene,poi
273648,145,17,0,435,Das ist falsch.,Patrick Döring,,data/txt/17145.txt,Patrick Döring (FDP),fdp,speech
273649,145,17,0,436,Beifall bei der FDP und der CDU/CSU,,,data/txt/17145.txt,,,poi
273650,145,17,0,437,"Sie haben sich dafür entschieden, die Lkw-Maut zu einer Schwerverkehrsabgabe umzubauen und damit auf allen Straßen in Deutschland für alle Fahrzeuge schwerer als 3,5 Tonnen Gebühren zu erheben. Das ist leistungsfeindlich für die vielen Handwerkerinnen und Handwerker in Deutschland, die Arbeitsplätze schaffen, für den Mittelstand und für das örtliche Gewerbe. Das ist falsch in der sozialen Marktwirtschaft.",Patrick Döring,,data/txt/17145.txt,Patrick Döring (FDP),fdp,speech
273651,145,17,0,438,Beifall bei der FDP und der CDU/CSU,,,data/txt/17145.txt,,,poi
273652,145,17,0,439,"Obwohl Deutschland als eines der wenigen Länder auf der Erde bereits eine Luftverkehrsabgabe erhebt, haben Sie sich entschieden, zusätzlich als einziges Land auf der Welt Kerosin zu besteuern. Das ist falsch in einem Land, das vom Export lebt, das international denkt und handelt und das vor allen Dingen ohne Luftfracht nicht existieren könnte. Auch das eine falsche Entscheidung.",Patrick Döring,,data/txt/17145.txt,Patrick Döring (FDP),fdp,speech
273653,145,17,0,440,Beifall bei der FDP sowie bei Abgeordneten der CDU/CSU,,,data/txt/17145.txt,,,poi
273654,145,17,0,441,"Noch viel besser finde ich, dass Sie die tolle Idee geboren haben, die Besteuerung von Mineralöl zukünftig an einen Verbraucherpreisindex zu koppeln. Man muss dazu wissen, dass die Inflation in diesem Bereich seit 1999 etwas höher als insgesamt war. Das würde dazu führen - ich habe das heute einmal ausgerechnet -, dass die Mineralölsteuer für 1 Liter Diesel um etwa 5 Cent und danach jedes Jahr um die Teuerungsrate des Energiepreises steigen würde. Es gibt dann also noch extra einen Anreiz dafür, dass der Staat nicht preismildernd eingreift, zum Beispiel durch die Zerschlagung von Kartellen, sondern preistreibend.",Patrick Döring,,data/txt/17145.txt,Patrick Döring (FDP),fdp,speech
273655,145,17,0,442,Unsozial!,Volkmar Vogel,,data/txt/17145.txt,Volkmar Vogel [Kleinsaara] [CDU/CSU],cducsu,poi
273656,145,17,0,443,"Wer das in der Steuerpolitik tatsächlich realisieren will, ist auf dem falschen Dampfer und handelt wieder leistungsfeindlich und entgegen den Prinzipien der sozialen Marktwirtschaft.",Patrick Döring,,data/txt/17145.txt,Patrick Döring (FDP),fdp,speech
273657,145,17,0,444,Beifall bei der FDP sowie bei Abgeordneten der CDU/CSU,,,data/txt/17145.txt,,,poi
273658,145,17,0,445,Horrorszenario!,Thomas Strobl,,data/txt/17145.txt,Thomas Strobl [Heilbronn] [CDU/CSU],cducsu,poi
273659,145,17,0,446,Und mit Ihrer Politik sind Sie ja auch so beliebt!,Sylvia Kotting-Uhl,,data/txt/17145.txt,Sylvia Kotting-Uhl [BÜNDNIS 90/DIE GRÜNEN],gruene,poi
273660,145,17,0,447,,Patrick Döring,,data/txt/17145.txt,Patrick Döring (FDP),fdp,speech
273661,145,17,0,448,"Die Bundesregierung muss endlich ihre Blockadepolitik gegen Möglichkeiten aufgeben, Sanktionen nicht nur bei übermäßigen Defiziten, sondern auch bei übermäßigen Leistungsbilanzüberschüssen verhängen zu können, um makroökonomische Ungleichgewichte abzubauen.","Ein Letztes. Sie haben den schönen Satz beschlossen - ich will ihn deshalb hier vorlesen, weil er so unfassbar ist",,data/txt/17145.txt,"Ein Letztes. Sie haben den schönen Satz beschlossen - ich will ihn deshalb hier vorlesen, weil er so unfassbar ist -",,speech
273662,145,17,0,449,Beifall bei Abgeordneten des BÜNDNIS-SES 90/DIE GRÜNEN,,,data/txt/17145.txt,,,poi
273663,145,17,0,450,Aha!,Dr. Joachim Pfeiffer,,data/txt/17145.txt,Dr. Joachim Pfeiffer [CDU/CSU],cducsu,poi
273664,145,17,0,451,Hört! Hört!,Thomas Strobl,,data/txt/17145.txt,Thomas Strobl [Heilbronn] [CDU/CSU],cducsu,poi
273665,145,17,0,452,"Das ist eine Verelendungsstrategie für das Exportland Deutschland. Wir müssen uns für die Leistung unserer Wirtschaft nicht entschuldigen - nicht bei Ihnen und bei niemand anderem in Europa.

Vielen Dank.","Ein Letztes. Sie haben den schönen Satz beschlossen - ich will ihn deshalb hier vorlesen, weil er so unfassbar ist",,data/txt/17145.txt,"Ein Letztes. Sie haben den schönen Satz beschlossen - ich will ihn deshalb hier vorlesen, weil er so unfassbar ist -",,speech
273666,145,17,0,453,Beifall bei der FDP und der CDU/CSU,,,data/txt/17145.txt,,,poi
273667,145,17,0,454,Entschuldigen Sie sich lieber für die Strategie der FDP! Da ist viel zu tun!,Sylvia Kotting-Uhl,,data/txt/17145.txt,Sylvia Kotting-Uhl [BÜNDNIS 90/DIE GRÜNEN],gruene,poi
273668,145,17,0,455,,"Ein Letztes. Sie haben den schönen Satz beschlossen - ich will ihn deshalb hier vorlesen, weil er so unfassbar ist",,data/txt/17145.txt,"Ein Letztes. Sie haben den schönen Satz beschlossen - ich will ihn deshalb hier vorlesen, weil er so unfassbar ist -",,speech
273669,145,17,0,456,Das Wort hat jetzt die Kollegin Sabine Leidig von der Fraktion Die Linke.,Dr. Hermann Otto Solms,,data/txt/17145.txt,Vizepräsident Dr. Hermann Otto Solms,,chair
273670,145,17,0,457,Beifall bei der LINKEN,,,data/txt/17145.txt,,,poi
273671,145,17,0,458,,Dr. Hermann Otto Solms,,data/txt/17145.txt,Vizepräsident Dr. Hermann Otto Solms,,chair
273672,145,17,0,459,"Herr Präsident! Werte Kolleginnen und Kollegen! Ja, wir haben in der vergangenen Woche erlebt, wie die Projektbetreiber einen Machtkampf um Stuttgart 21 organisiert haben - Goliath gegen David, sozusagen.",Sabine Leidig,,data/txt/17145.txt,Sabine Leidig (DIE LINKE),linke,speech
273673,145,17,0,460,Ach je!,Thomas Strobl,,data/txt/17145.txt,Thomas Strobl [Heilbronn] [CDU/CSU],cducsu,poi
273674,145,17,0,461,"Die Freundinnen und Freunde des Kopfbahnhofes sind unterlegen. So ist es.

Es würde sich lohnen, sich die Bedingungen, die Irreführungen und die konkreten Ergebnisse dieser Volksabstimmung im Detail anzuschauen. Aber das würde meine Redezeit hier sprengen. Nur so viel: In der Stadt Stuttgart haben über 47 Prozent für den Ausstieg gestimmt. Die Bevölkerung ist tief gespalten. Daran sind die Grünen in der Landesregierung mit schuld, weil sie die offensichtlichen Fehler dieses Projektes nicht zum Ausstieg genutzt haben, sondern auf Koalitionsfrieden mit der SPD setzen.

Damit bin ich bei dem Thema, das tatsächlich auf die Tagesordnung des Bundestages gehört: Stuttgart 21 ist zum Scheitern verurteilt, so oder so, weil eine Reihe ganz gravierender Probleme überhaupt nicht gelöst ist. Davon will ich hier nur zwei herausgreifen:

Erstens: die Kostenfrage. Bereits am Tag nach der Volksabstimmung hat Bahnchef Grube angedeutet, was alle schon längst wissen: Bereits vor Baubeginn ist die Kostenobergrenze von 4,5 Milliarden Euro überschritten.",Sabine Leidig,,data/txt/17145.txt,Sabine Leidig (DIE LINKE),linke,speech
273675,145,17,0,462,Quatsch!,Steffen Bilger,,data/txt/17145.txt,Steffen Bilger [CDU/CSU],cducsu,poi
273676,145,17,0,463,"Jeder hier im Plenarsaal weiß, dass bis ins nächste Jahrzehnt hinein 7 Milliarden Euro und mehr für dieses Projekt fällig werden, aber Bund, Land und Stadt haben erklärt, keine Mehrkosten zu tragen, und die DB AG weigert sich, die Kostenübernahme zuzusichern.

Was bedeutet das? Wenn angefangen wird, zu graben, könnten Bauruinen entstehen. Die Anlagen können nämlich erst dann in Betrieb genommen werden, wenn sie vollständig fertiggestellt sind. Wir werden etwas Ähnliches erleben wie bei der Hochgeschwindigkeitsstrecke Nürnberg-Erfurt, wo seit Jahren So-da-Brücken in der Landschaft stehen, Brücken, die einfach so da stehen, weil das Bauprojekt nicht fertiggestellt wird. Der Unterschied ist, dass die gigantische Bauruine inmitten der Landeshauptstadt liegen wird.",Sabine Leidig,,data/txt/17145.txt,Sabine Leidig (DIE LINKE),linke,speech
273677,145,17,0,464,"Das liegt aber nicht an der Bahn! Das liegt daran, dass Sie die Leute auf die Zinnen bringen!",Patrick Döring,,data/txt/17145.txt,Patrick Döring [FDP],fdp,poi
273678,145,17,0,465,"- Nein, das liegt daran, dass das Geld nicht reicht.",Sabine Leidig,,data/txt/17145.txt,Sabine Leidig (DIE LINKE),linke,speech
273679,145,17,0,466,Das stimmt nicht! Die Planfeststellungsprozesse werden auch verzögert!,Patrick Döring,,data/txt/17145.txt,Patrick Döring [FDP],fdp,poi
273680,145,17,0,467,"Als zweiten Punkt nenne ich den Schaden für die Schiene. Dieser Punkt ist der allergravierendste. Die Argumente dafür, dass dieses Projekt der Schiene schadet, waren von Anfang an der wichtigste Einwand gegen den Tunnelbahnhof. Das hat auch in der Faktenschlichtung eine zentrale Rolle gespielt. Ich erinnere an den Schlichterspruch von Heiner Geißler vor etwa einem Jahr, an den sich alle Projektbeteiligten quasi wie an einen Urteilsspruch gehalten haben. Dort heißt es:

Die Deutsche Bahn AG muss dabei den Nachweis führen, dass ein Fahrplan mit 30 Prozent Leistungszuwachs in der Spitzenstunde mit guter Betriebsqualität möglich ist.",Sabine Leidig,,data/txt/17145.txt,Sabine Leidig (DIE LINKE),linke,speech
273681,145,17,0,468,"Unsere Überprüfung der Simulationsergebnisse hat gezeigt, dass die geforderten 49 Ankünfte im Hauptbahnhof Stuttgart in der am meisten belasteten Stunde ... abgewickelt werden können.

Auch dazu haben Sie hier in einer Aktuellen Stunde triumphiert, während das Aktionsbündnis aus guten Gründen gezweifelt hat. Nun ist vergangene Woche bekannt geworden, dass die Ergebnisse dieses Stresstests falsch sind. Die Fakten über die Fälschung sind auf der Internetplattform WikiReal nachzulesen. Sie wurden von Dr. Engelhardt zusammengetragen, der als Sachverständiger an der Stresstestpräsentation teilgenommen hat. Das ist unter anderem im ZDF-Magazin Frontal 21 dokumentiert und durch einen der bekanntesten Verkehrswissenschaftler im deutschsprachigen Raum bestätigt worden, Professor Knoflacher.

Demnach hat die Bahn systematisch gegen die Richtlinie verstoßen, die für eine solche Simulation maßgebend ist, nämlich die Richtlinie mit der Bezeichnung ""Fahrwegkapazität R 405"". Tatsächlich können in der Spitzenstunde nämlich nicht 49, sondern maximal 38 Züge abgefertigt werden. Was bedeutet das? Das sind weniger Züge als im heutigen vernachlässigten Kopfbahnhof und nur 60 Prozent von dem, was ein ertüchtigter Kopfbahnhof leisten könnte.",Im Sommer dieses Jahres hat die Bahn verkündet,,data/txt/17145.txt,Im Sommer dieses Jahres hat die Bahn verkündet,,speech
273682,145,17,0,469,Das nenne ich Betrug!,von der LINKEN,,data/txt/17145.txt,Zuruf von der LINKEN,linke,poi
273683,145,17,0,470,"Das ist der Punkt, an dem die Bundesregierung eingreifen muss, Herr Ramsauer. Die Untersuchung zeigt, dass mit Stuttgart 21 faktisch ein Rückbau der Eisenbahninfrastruktur des Bundes geplant ist.",Im Sommer dieses Jahres hat die Bahn verkündet,,data/txt/17145.txt,Im Sommer dieses Jahres hat die Bahn verkündet,,speech
273684,145,17,0,471,"Quatsch! Sie haben es wieder nicht begriffen! Das ist einfach die blanke Unkenntnis, die Sie hier vortragen!",Patrick Döring,,data/txt/17145.txt,Patrick Döring [FDP],fdp,poi
273685,145,17,0,472,"Da können Sie sich nicht einfach zurücklehnen und sich damit herausreden, dass es sich um ein eigenwirtschaftliches Projekt der Bahn handelt.",Im Sommer dieses Jahres hat die Bahn verkündet,,data/txt/17145.txt,Im Sommer dieses Jahres hat die Bahn verkündet,,speech
273686,145,17,0,473,Beifall bei der LINKEN,,,data/txt/17145.txt,,,poi
273687,145,17,0,474,"Was interessieren mich die Fakten, wenn ich die Ideologie habe?",Dr. Joachim Pfeiffer,,data/txt/17145.txt,Dr. Joachim Pfeiffer [CDU/CSU],cducsu,poi
273688,145,17,0,475,"Mit Stuttgart 21 wird der entscheidende Bahnknoten in Südwestdeutschland enger gezogen. Es wird ein Nadelöhr geschaffen. Dafür sollen Milliarden Euro an Steuergeldern fließen. Wenn Sie es mit dem Standort Deutschland gut meinen, dann dürfen Sie nicht zulassen, dass die Eisenbahn in ihrer zukünftigen Entwicklung behindert wird.",Im Sommer dieses Jahres hat die Bahn verkündet,,data/txt/17145.txt,Im Sommer dieses Jahres hat die Bahn verkündet,,speech
273689,145,17,0,476,Beifall bei der LINKEN,,,data/txt/17145.txt,,,poi
273690,145,17,0,477,"Wir werden nicht nachlassen, die Fakten auf den Tisch zu bringen. Die Linke will dazu beitragen, dass Stuttgart 21 aus vernünftigen Gründen scheitert und nicht im Desaster endet.",Im Sommer dieses Jahres hat die Bahn verkündet,,data/txt/17145.txt,Im Sommer dieses Jahres hat die Bahn verkündet,,speech
273691,145,17,0,478,Nicht nötig!,Steffen Bilger,,data/txt/17145.txt,Steffen Bilger [CDU/CSU],cducsu,poi
273692,145,17,0,479,"Ich fordere Sie auf, Herr Ramsauer: Übernehmen Sie die Verantwortung, und wenden Sie Schaden von der Bahninfrastruktur in diesem Land ab!

Danke.",Im Sommer dieses Jahres hat die Bahn verkündet,,data/txt/17145.txt,Im Sommer dieses Jahres hat die Bahn verkündet,,speech
273693,145,17,0,480,Beifall bei der LINKEN,,,data/txt/17145.txt,,,poi
273694,145,17,0,481,Das war: Die Partei hat halt immer recht!,Thomas Strobl,,data/txt/17145.txt,Thomas Strobl [Heilbronn] [CDU/CSU],cducsu,poi
273695,145,17,0,482,"Zu optimistisch, was Ramsauer anbetrifft!",Florian Pronold,,data/txt/17145.txt,Florian Pronold [SPD],spd,poi
273696,145,17,0,483,,Im Sommer dieses Jahres hat die Bahn verkündet,,data/txt/17145.txt,Im Sommer dieses Jahres hat die Bahn verkündet,,speech
273697,145,17,0,484,Das Wort hat jetzt der Kollege Fritz Kuhn von Bündnis 90/Die Grünen.,Dr. Hermann Otto Solms,,data/txt/17145.txt,Vizepräsident Dr. Hermann Otto Solms,,chair
273698,145,17,0,485,Jetzt wird es dialektisch!,Dr. Joachim Pfeiffer,,data/txt/17145.txt,Dr. Joachim Pfeiffer [CDU/CSU],cducsu,poi
273699,145,17,0,486,,Dr. Hermann Otto Solms,,data/txt/17145.txt,Vizepräsident Dr. Hermann Otto Solms,,chair
273700,145,17,0,487,Herr Präsident! Liebe Kolleginnen und Kollegen! Die Aktuelle Stunde heißt: Standort Deutschland sichern - S 21 zügig umsetzen und grüne Pläne zur Belastung des Mittelstands stoppen. - Ich kann nur sagen: Jedem Zehntklässler in Deutschland würde man diese Formulierung um die Ohren hauen.,Fritz Kuhn,,data/txt/17145.txt,Fritz Kuhn (BÜNDNIS 90/DIE GRÜNEN),gruene,speech
273701,145,17,0,488,Beifall beim BÜNDNIS 90/DIE GRÜNEN und bei der SPD sowie bei Abgeordneten der LINKEN,,,data/txt/17145.txt,,,poi
273702,145,17,0,489,Aber nur bei grünen Lehrern!,Volker Kauder,,data/txt/17145.txt,Volker Kauder [CDU/CSU],cducsu,poi
273703,145,17,0,490,"Wenn Sie in Zukunft einmal Formulierungshilfen brauchen, können Sie sich gerne an meine Fraktion wenden. Wir beherrschen so etwas, Herr Kauder.

Ich kann zur Abstimmung über Stuttgart 21 nur sagen, Herr Kauder: Damit hat die grün-rote Regierung dem Land und der Demokratie einen großen Gefallen getan.",Fritz Kuhn,,data/txt/17145.txt,Fritz Kuhn (BÜNDNIS 90/DIE GRÜNEN),gruene,speech
273704,145,17,0,491,Beifall beim BÜNDNIS 90/DIE GRÜNEN und bei der SPD,,,data/txt/17145.txt,,,poi
273705,145,17,0,492,"Was ihr in 17 Jahren nicht geschafft habt - so lange läuft das Ganze schon -, ist jetzt durch einen Volksentscheid entschieden worden. Selbstverständlich werden wir als Grüne - das hat die Landesregierung immer zum Ausdruck gebracht - uns an dieses Votum halten und Stuttgart 21 jetzt umsetzen,

(Beifall bei der CDU/CSU und der FDP - Dr. Martin Lindner (Berlin) (FDP): Sie sehen das jetzt demokratieexperimentell!

konstruktiv-kritisch, Herr Kauder. Das bedeutet: Es gibt einen vereinbarten Kostendeckel von 4,5 Milliarden Euro. Vor dem Entscheid hat Herr Grube noch gesagt: Es ist kein Problem, ihn einzuhalten. - Seit Montag ist ihm der Kupferpreis eingefallen, wodurch es eventuell doch teurer wird.

Aber wir werden auf den Kostendeckel achten: 4,5 Milliarden Euro. Der Landesanteil kann nicht zunehmen; die Bahn muss sich eben darum kümmern, wie sie das finanziert.",Fritz Kuhn,,data/txt/17145.txt,Fritz Kuhn (BÜNDNIS 90/DIE GRÜNEN),gruene,speech
273706,145,17,0,493,Beifall beim BÜNDNIS 90/DIE GRÜNEN,,,data/txt/17145.txt,,,poi
273707,145,17,0,494,"Das ist nicht vereinbart, wie damit umzugehen ist!",von der FDP,,data/txt/17145.txt,Zuruf von der FDP,fdp,poi
273708,145,17,0,495,"Wichtig ist, dass Ihre These ""Das ist jetzt gut für den Standort Deutschland"" ein bisschen überhöht ist, Herr Strobl.",Fritz Kuhn,,data/txt/17145.txt,Fritz Kuhn (BÜNDNIS 90/DIE GRÜNEN),gruene,speech
273709,145,17,0,496,Beifall beim BÜNDNIS 90/DIE GRÜNEN,,,data/txt/17145.txt,,,poi
273710,145,17,0,497,"Wir werden weiter die Frage stellen: Was ist gut für den Standort Deutschland? Es könnte sein, dass die Milliarden, die jetzt für den unterirdischen Bahnhof verwendet werden - wie gesagt, wir akzeptieren die Entscheidung -, an anderen Stellen auch in Baden-Württemberg fehlen und Schieneninfrastruktur dann nicht mehr gebaut werden wird.",Fritz Kuhn,,data/txt/17145.txt,Fritz Kuhn (BÜNDNIS 90/DIE GRÜNEN),gruene,speech
273711,145,17,0,498,Beifall beim BÜNDNIS 90/DIE GRÜNEN,,,data/txt/17145.txt,,,poi
273712,145,17,0,499,"Wir sind sehr gespannt, ob Herr Ramsauer die Rheintaltrasse oder die Strecke Frankfurt-Mannheim in den Investitionsplan aufnehmen wird oder ob die Mittel dafür fehlen.",Fritz Kuhn,,data/txt/17145.txt,Fritz Kuhn (BÜNDNIS 90/DIE GRÜNEN),gruene,speech
273713,145,17,0,500,Jetzt kommt ihr mit den alten Geschichten! Schlechte Verlierer seid ihr!,Thomas Strobl,,data/txt/17145.txt,Thomas Strobl [Heilbronn] [CDU/CSU],cducsu,poi
273714,145,17,0,501,Das werden wir genau verfolgen.,Fritz Kuhn,,data/txt/17145.txt,Fritz Kuhn (BÜNDNIS 90/DIE GRÜNEN),gruene,speech
