id,sitzung,wahlperiode,in_writing,sequence,text,speaker_cleaned,speaker_fp,filename,speaker,speaker_party,type
459311,249,17,0,442,"Das sind zwei Fragen, Herr von Notz. Heute Morgen ist im Innenausschuss - das sollten wir hier auch berichten - gesagt worden, dass die Daten von Deutschen, die auf rechtswidrige Art und Weise im Ausland gesammelt wurden, nicht wieder zurückgespielt und von unseren Nachrichtendiensten genutzt werden. Deswegen sollten Sie diesen Sachverhalt in einer öffentlichen Sitzung richtig darstellen.

Das Zweite ist - das ist mir wichtig -: Wie gehen wir mit der Vertrauenskrise im Internet und der Jugend um? Ich glaube, wir haben eine Aufklärungsverpflichtung. Wir müssen vor allem den jungen Menschen, aber auch den älteren - jedem Internetnutzer - sagen: Deine Daten im Netz sind absolut unsicher. - Wir sollten ihnen auch nicht vorgaukeln, wir könnten Paragrafen produzieren, die sie sicher machen. Das ist eine Illusion. Sie sollten keine Illusionen verkaufen, Herr von Notz, auch nicht im Wahlkampf.",Dr. Hans-Peter Uhl,,data/txt/17249.txt,Dr. Hans-Peter Uhl (CDU/CSU),cducsu,speech
459312,249,17,0,443,Es geht nicht nur um das Internet!,Josef Philip Winkler,,data/txt/17249.txt,Josef Philip Winkler [BÜNDNIS 90/DIE GRÜNEN],gruene,poi
459313,249,17,0,444,"Das sollten Sie nicht tun. Sie sollten den Menschen ehrlich sagen, dass das Internet eine wunderbare Chance zur weltweiten Information und Kommunikation ist, aber auch gefährlich sein kann. Bitte sagen Sie ihnen auch, dass es gefährlich sein kann und dass Daten immer im Netz bleiben, wenn man sie einmal ins Netz gestellt hat, und dass man nicht weiß, wer die Daten heruntergeladen hat, bevor man sie gelöscht hat. Sagen Sie es den Menschen. Tun Sie nicht so, als könnten Sie, wenn Sie die politische Macht hätten, das Internet weltweit für den deutschen Wähler sicher machen. Es ist ein Unfug, so etwas zu verbreiten.

Meine Damen und Herren, lassen Sie mich zum Schluss kommen: Wir brauchen Sicherheit im Netz, und zwar für den Bereich, der für unsere Gesellschaft und für unseren Staat wichtig ist. Wenn der Staat kommuniziert, muss dies sicher sein. Wenn wir kritische Infrastrukturen aufrechterhalten wollen, müssen sie sicher sein vor Hacking, vor Angriffen und vor Spionage. Unsere Unternehmen müssen vor Wirtschaftsspionage sicher sein. Sie haben das Problembewusstsein noch nicht. Sicherheit kostet Geld. Sie haben sich bisher geweigert, Geld für die sichere Kommunikation in ihren Unternehmen auszugeben. Dafür ist diese Diskussion sehr hilfreich. Bei dem ganzen Schaden, den wir haben, gibt es auch einen Nutzen. Die Menschen fangen jetzt an, darüber nachzudenken, wie wir Sicherheit in der IT-Kommunikation herstellen können, wo wir sie auf jeden Fall brauchen und wo wir gefährlich leben, wenn wir uns ins Netz begeben.

Vielen herzlichen Dank.",Dr. Hans-Peter Uhl,,data/txt/17249.txt,Dr. Hans-Peter Uhl (CDU/CSU),cducsu,speech
459314,249,17,0,445,Beifall bei der CDU/CSU und der FDP,,,data/txt/17249.txt,,,poi
459315,249,17,0,446,,Dr. Hans-Peter Uhl,,data/txt/17249.txt,Dr. Hans-Peter Uhl (CDU/CSU),cducsu,speech
459316,249,17,0,447,Das Wort hat der Kollege Lars Klingbeil für die SPD-Fraktion.,Petra Pau,,data/txt/17249.txt,Vizepräsidentin Petra Pau,,chair
459317,249,17,0,448,Beifall bei der SPD,,,data/txt/17249.txt,,,poi
459318,249,17,0,449,,Petra Pau,,data/txt/17249.txt,Vizepräsidentin Petra Pau,,chair
459319,249,17,0,450,"Sehr geehrte Frau Präsidentin! Liebe Kolleginnen und Kollegen! Lieber Kollege Uhl, das, was Sie gesagt haben, war sehr moderat. Herzlichen Dank! Nachdem Prism bekannt wurde, habe ich eigentlich damit gerechnet, dass manche in der Union schon die Bestellzettel ausfüllen und sagen: Wir wollen das auch. - Ich glaube, es ist gut, wenn wir an dieser Stelle im Parlament moderat diskutieren und uns fragen: Was sollen wir tun? Was können wir tun? Was muss getan werden, um für Vertrauen und Sicherheit zu sorgen?

In der Enquete-Kommission ""Internet und digitale Gesellschaft"" haben wir viele Stunden damit verbracht, über die Chancen des Internets zu diskutieren. Dabei ging es um mehr Beteiligung, um mehr Transparenz und die Stärkung von Demokratie. Wenn man sich den 2 000 Seiten langen Abschlussbericht anschaut, kann man an vielen Stellen die Hoffnung sehen, dass es in der Politik dadurch besser wird, dass sich viele Menschen über das Internet beteiligen. Wir haben aber auch die Gefahren von Kontrolle, von Überwachung, auch von Totalüberwachung, die mit dem Internet möglich sind, kritisch diskutiert. Als wir dann von Prism, von Tempora erfahren haben, waren wir schockiert, obwohl wir wussten, dass es so etwas geben kann. Wenn man dann aber das erste Mal den Namen und den Umfang in der Zeitung und im Fernsehen sieht, dann ist man schockiert. Eigentlich hätte man es wissen müssen. Noch einmal: Es ist gut, dass wir heute darüber diskutieren. Aus dem Parlament muss ein klares Signal kommen, dass wir Parlamentarier verlangen, dass endlich alle Fakten auf den Tisch gelegt werden, dass wir Transparenz bekommen, dass es dann um Aufklärung geht, dass es um Schutz geht und darum, das Vertrauen der Menschen in die Kommunikation wiederherzustellen. Die zentrale Frage, die wir Parlamentarier uns stellen müssen, ist: Wie viel darf der Staat unternehmen? Welche Maßnahmen darf der Staat ergreifen, um die Bürgerinnen und Bürger zu schützen? Darf er massive und intransparente Eingriffe in das Grundrecht vornehmen? Ich sage: Nein. Das darf nicht der Fall sein. Der Rechtsstaat muss die Bürgerinnen und Bürger vor einem übermächtigen und alles kontrollierenden Staat schützen.",Lars Klingbeil,,data/txt/17249.txt,Lars Klingbeil (SPD),spd,speech
459320,249,17,0,451,Beifall bei der SPD und dem BÜNDNIS 90/DIE GRÜNEN sowie des Abg. Stefan Liebich [DIE LINKE],,,data/txt/17249.txt,,,poi
459321,249,17,0,452,"Ich sage: Der Rechtsstaat muss auch diejenigen, die politische Macht haben, kontrollieren und deren Wirkung einschränken. Das darf nicht nur national, sondern muss auch global gelten. Wir brauchen eine globale Rechtsstaatlichkeit; das hat die Diskussion der letzten Wochen gezeigt. Hier hätte ich mir klare Worte der schwarz-gelben Bundesregierung gewünscht.",Lars Klingbeil,,data/txt/17249.txt,Lars Klingbeil (SPD),spd,speech
459322,249,17,0,453,Beifall bei der SPD und dem BÜNDNIS 90/DIE GRÜNEN sowie des Abg. Stefan Liebich [DIE LINKE],,,data/txt/17249.txt,,,poi
459323,249,17,0,454,"Wir haben heute auch viel über die Vergangenheit diskutiert. Ja, es sind auch Sachen unternommen worden, die aus heutiger Perspektive vielleicht nicht richtig erscheinen. Wir Parlamentarier wissen doch aber - egal ob Opposition oder Regierung -, dass es ein ständiges Ringen um die Fragen Freiheit und Sicherheit ist. Das ist doch eine Sache, mit der wir uns jeden Tag auseinandersetzen. Deswegen sollten es oftmals nicht die einfachen Antworten sein, die wir geben.

Ich möchte folgendes Zitat anführen: ""Unsere Antwort wird mehr Offenheit und mehr Demokratie sein"". Das war der Ausspruch von Jens Stoltenberg nach den furchtbaren Anschlägen in Oslo und auf Utøya. Wir alle hätten vielleicht sogar Verständnis gehabt, wenn in Norwegen anders reagiert worden wäre. Man hat den Feinden der Demokratie aber mehr Demokratie, mehr Transparenz und mehr Freiheit entgegengesetzt. Liebe Kolleginnen und Kollegen, ich denke, so manches Mal sollte das auch unsere Antwort sein, wenn es darum geht, die Demokratie zu verteidigen.",Lars Klingbeil,,data/txt/17249.txt,Lars Klingbeil (SPD),spd,speech
459324,249,17,0,455,Beifall bei der SPD und dem BÜNDNIS 90/DIE GRÜNEN sowie des Abg. Stefan Liebich [DIE LINKE],,,data/txt/17249.txt,,,poi
459325,249,17,0,456,"Ich sage: Wir dürfen unsere Demokratie nicht auf Kosten unserer demokratischen Grundwerte verteidigen. Wenn das passiert, sind wir auf dem falschen Weg.

Ich möchte zu den Ereignissen der letzten Tage einige konkrete Anmerkungen machen: Herr Minister, wir haben im Unterausschuss ""Neue Medien"" über Prism und Tempora diskutiert. Aus Ihrem Haus waren Vertreter anwesend, die ich gefragt habe, ob sie denn über Prism Bescheid wussten. Die Antwort war: Nein, wir wussten über Prism nicht Bescheid. - Ich habe dann gefragt: War denn bekannt, dass Maßnahmen der Überwachung und auch der Totalüberwachung stattfinden? - Da war die Antwort: Ja, wir haben so etwas vermutet. - Als ich dann gefragt habe: ""Was hat man in den letzten Monaten unternommen?"", war die Antwort: nichts. - Da frage ich mich schon: Warum wird diese schwarz-gelbe Bundesregierung eigentlich erst dann aktiv, wenn ein Informant Informationen an die Öffentlichkeit gibt, obwohl man doch gewusst hat, dass es solche Programme gibt? Warum hat sich diese Bundesregierung nicht darum gekümmert, die Grundrechte der Bürgerinnen und Bürger zu schützen?",Lars Klingbeil,,data/txt/17249.txt,Lars Klingbeil (SPD),spd,speech
459326,249,17,0,457,Beifall bei der SPD sowie bei Abgeordneten der LINKEN,,,data/txt/17249.txt,,,poi
459327,249,17,0,458,"Ich sage Ihnen: Ich bin dankbar, dass die Kanzlerin so offen ist und sagt, dass das Internet für sie Neuland ist. Ich mag schließlich auch keine Politiker, die behaupten, sie hätten von allem Ahnung. Aber man kann doch mit dieser Begründung nicht bagatellisieren, was da in den letzten Jahren passiert ist.",Lars Klingbeil,,data/txt/17249.txt,Lars Klingbeil (SPD),spd,speech
459328,249,17,0,459,Beifall bei der SPD und dem BÜNDNIS 90/DIE GRÜNEN,,,data/txt/17249.txt,,,poi
459329,249,17,0,460,"Man kann doch nicht sagen, dass das Internet ein bürgerrechtsfreier Raum sein darf, nur weil man keine Ahnung hat. Da sage ich: Dann muss die Kanzlerin jemanden fragen, der sich damit auskennt.",Lars Klingbeil,,data/txt/17249.txt,Lars Klingbeil (SPD),spd,speech
459330,249,17,0,461,Hat sie aber nicht!,Iris Gleicke,,data/txt/17249.txt,Iris Gleicke [SPD],spd,poi
459331,249,17,0,462,"Ein paar davon gibt es schließlich auch in der Regierungskoalition.

Dann wird gesagt, die Kanzlerin habe mit Obama einen Dialog vereinbart, der neben dem Treffen stattfinden soll.",Lars Klingbeil,,data/txt/17249.txt,Lars Klingbeil (SPD),spd,speech
459332,249,17,0,463,Na toll!,Renate Künast,,data/txt/17249.txt,Renate Künast [BÜNDNIS 90/DIE GRÜNEN],gruene,poi
459333,249,17,0,464,"Diesbezüglich haben wir im Unterausschuss ""Neue Medien"" gefragt: Was hat es denn mit diesem Dialog auf sich? - Das konnten die Vertreter Ihres Hauses nicht sagen. Da wurde gesagt: Es wird jetzt erst einmal von denjenigen, die dabei waren, eine Protokollnotiz angefertigt. - Ich kann Ihnen sagen, was das Ziel dieses Dialogs ist: Das Ziel wird es sein, über den 22. September 2013 hinauszukommen. Wir sehen doch heute schon, dass diese Koalition überhaupt keine abgestimmte Position hat, wenn es darum geht, mit den amerikanischen und englischen Partnern zu diskutieren und auch einmal Tacheles zu reden. Wir brauchen eine Regierung, die handelt.",Lars Klingbeil,,data/txt/17249.txt,Lars Klingbeil (SPD),spd,speech
459334,249,17,0,465,Beifall bei der SPD und dem BÜNDNIS 90/DIE GRÜNEN,,,data/txt/17249.txt,,,poi
459335,249,17,0,466,"Wir haben große Erwartungen an den Europäischen Rat; das ist angesprochen worden. Herr Minister, wir haben auch über das IT-Sicherheitsgesetz gesprochen. Ich will hier einmal in aller Deutlichkeit sagen: Dass ich Sie auffordern muss, endlich aktiv zu werden, und dass ich Sie auffordern muss, endlich für Sicherheit, für Recht und für Ordnung zu sorgen, ist für mich schon eines der Highlights dieser Legislaturperiode. Sie haben in dieser Legislaturperiode und in dieser Koalition nichts gemacht, um die IT-Sicherheit zu stärken. Sie haben nicht dafür gesorgt, dass auch Bedrohungen im Cyberraum endlich angegangen werden.",Lars Klingbeil,,data/txt/17249.txt,Lars Klingbeil (SPD),spd,speech
459336,249,17,0,467,Beifall bei der SPD,,,data/txt/17249.txt,,,poi
459337,249,17,0,468,"Sehr geehrte Damen und Herren, die ganze Diskussion lässt mich zu einem Zwischenfazit kommen: Erstens. Wir brauchen für globale Kommunikation auch globale Regeln. Zweitens. Wir brauchen endlich eine Regierung, die sich kümmert. Diese schwarz-gelbe Regierung tut es nicht. Ich hoffe, dass das Ganze am 22. September 2013 ein Ende hat.

Vielen Dank fürs Zuhören.",Lars Klingbeil,,data/txt/17249.txt,Lars Klingbeil (SPD),spd,speech
459338,249,17,0,469,Beifall bei der SPD und dem BÜNDNIS 90/DIE GRÜNEN,,,data/txt/17249.txt,,,poi
459339,249,17,0,470,"Ich glaube nicht, dass es Ihnen bei Herrn Oppermann besser geht!",Gisela Piltz,,data/txt/17249.txt,Gisela Piltz [FDP],fdp,poi
459340,249,17,0,471,,Lars Klingbeil,,data/txt/17249.txt,Lars Klingbeil (SPD),spd,speech
459341,249,17,0,472,Das Wort hat der Kollege Armin Schuster für die Unionsfraktion.,Petra Pau,,data/txt/17249.txt,Vizepräsidentin Petra Pau,,chair
459342,249,17,0,473,Beifall bei der CDU/CSU und der FDP,,,data/txt/17249.txt,,,poi
459343,249,17,0,474,,Petra Pau,,data/txt/17249.txt,Vizepräsidentin Petra Pau,,chair
459344,249,17,0,475,"Sehr geehrte Frau Präsidentin! Meine lieben Kolleginnen und Kollegen! Herr Klingbeil, ich nennen Ihnen zwei Beispiele dafür, wie diese Regierung im Gegensatz zur früheren rot-grünen Regierung arbeitet: Wir haben den Amerikanern bei den Verhandlungen über das SWIFT-Abkommen beim Thema der Übermittlung sensibler Bankdaten jedenfalls deutlich mehr abgerungen als Sie; denn Sie haben einen Blankoscheck ausgestellt.",Armin Schuster,,data/txt/17249.txt,Armin Schuster (Weil am Rhein) (CDU/CSU),cducsu,speech
459345,249,17,0,476,Beifall bei der CDU/CSU und der FDP,,,data/txt/17249.txt,,,poi
459346,249,17,0,477,"Ich habe auch den Eindruck, dass die Amerikaner im Zusammenhang mit PNR, mit Fluggastdaten, gelernt haben, wie man bei uns mit Daten umgeht.

Ich habe mir noch einmal die wichtigsten Daten zu Gemüte geführt - vielleicht muss man sich in die Situation der Amerikaner und der Briten hineindenken -:",Armin Schuster,,data/txt/17249.txt,Armin Schuster (Weil am Rhein) (CDU/CSU),cducsu,speech
459347,249,17,0,478,Ich denke erst mal nur an die Rechtslage! Dann bin ich schon beschäftigt!,Renate Künast,,data/txt/17249.txt,Renate Künast [BÜNDNIS 90/DIE GRÜNEN],gruene,poi
459348,249,17,0,479,"Am 11. September 2001 gab es die Anschläge auf das World Trade Center und das Pentagon, 2002 den Anschlag in Djerba, 2004 die Anschläge in Madrid und am 7. Juli 2005 die furchtbaren Anschläge in London. Wir in der westlichen Welt haben in diesen Jahren richtigerweise - in Deutschland mit den Otto-Katalogen - die Antiterrorgesetze verschärft. Der Schmerz in den hauptsächlich von den Anschlägen betroffenen Ländern wie den USA oder Großbritannien sitzt immer noch tief.

Wir können von Glück reden, dass es uns nicht getroffen hat. Vielleicht ist es uns auch deshalb wesentlich leichter gefallen, unsere Sicherheitsgesetze, wie in dieser Legislaturperiode, pflichtgemäß zu evaluieren und die Wirkung der Grundrechtseingriffe kritisch zu überprüfen. Wir haben die Geltung unserer Gesetze verlängert, aber eben auch die Regelungen eingeschränkt.",Armin Schuster,,data/txt/17249.txt,Armin Schuster (Weil am Rhein) (CDU/CSU),cducsu,speech
459349,249,17,0,480,Was?,Hans-Christian Ströbele,,data/txt/17249.txt,Hans-Christian Ströbele [BÜNDNIS 90/DIE GRÜNEN],gruene,poi
459350,249,17,0,481,"Deutschland beantwortet regelmäßig die Frage, ob der angestrebte Nutzen für die innere Sicherheit in einem vertretbaren Verhältnis dazu steht, wie stark wir in Bürgerrechte eingreifen.

Wie steht es in den USA oder Großbritannien um solche Abwägungen? Sowohl die hohe Emotionalisierung durch Terroranschläge wie auch die Erfolge der vergangenen Jahre in der Terrorbekämpfung könnten - könnten! - aus meiner Sicht eine Ursache dafür sein, dass es hier infolge geringerer Kontrollen zu Übertreibungen gekommen ist. Was stimmt, werden wir hier und heute nicht klären können; aber wir können wahrscheinlich von zwei Szenarien ausgehen: Das eine Szenario ist, dass unsere Bündnispartner nach ihrem geltenden Recht gehandelt haben. Dann wäre die Frage zu stellen, ob das geltende Recht und dessen Anwendung einer rechtsstaatlichen Kontrolle unterliegen, wie es bei uns üblich ist. Nach allem, was wir jetzt wissen, sind diese Aktionen wahrscheinlich nicht mit unserem Rechtsverständnis in Einklang zu bringen. Es geht um unsere Bürger; aber es könnte in den USA eben legal sein. Vom zweiten Szenario, das ich schlimmer fände, gehe ich nicht aus, nämlich dass die USA oder Großbritannien gegen ihr eigenes Recht verstoßen haben. Ich sehe im Moment keinen Anlass, das zu glauben.

In beiden Fällen besteht aus deutscher Sicht Bedarf an diplomatischen Gesprächen. Dem kommt die Bundesregierung nach; wer heute Morgen im Innenausschuss war, weiß das. Es geht nicht nur um Schreiben und Fragenkataloge; hier wurde schnell im Sinne einer Sachverhaltsaufklärung gehandelt. Ich persönlich würde mir allerdings auch wünschen, dass die Europäische Union sich ebenfalls dieses Themas annimmt; das stärkt unsere Position.",Armin Schuster,,data/txt/17249.txt,Armin Schuster (Weil am Rhein) (CDU/CSU),cducsu,speech
459351,249,17,0,482,Aha!,Hans-Christian Ströbele,,data/txt/17249.txt,Hans-Christian Ströbele [BÜNDNIS 90/DIE GRÜNEN],gruene,poi
459352,249,17,0,483,"Es ist möglich, Sicherheit und Freiheit gleichermaßen in der Balance zu halten. Wir gewährleisten das für unsere Bürger. Insofern erwarten wir es natürlich auch von unseren Bündnispartnern. Sollten die Rechte deutscher Staatsbürger hier verletzt worden sein oder gar fortgesetzt verletzt werden, brauchen wir eine lückenlose Aufklärung. Wir wollen wissen, ob das, was dort geschieht, diplomatisch verhandelbar ist. Denn wir sprechen hier nicht mit Chinesen oder Russen, sondern mit deutschen Bündnispartnern.

Ich halte es aber, meine Damen und Herren, für wenig hilfreich, wenn die entsprechenden Verhandlungen der Regierung durch eine überbordende politische Entrüstungspolemik, wie sie die öffentliche Debatte derzeit bestimmt, konterkariert werden. ""Albtraum"", ""Skandal"", ""Katastrophe"" - solche Fatalisierungen schaffen schlechte Voraussetzungen für erfolgreiche Verhandlungen mit Partnern.",Armin Schuster,,data/txt/17249.txt,Armin Schuster (Weil am Rhein) (CDU/CSU),cducsu,speech
459353,249,17,0,484,Beifall des Abg. Stephan Mayer [Altötting] [CDU/CSU],,,data/txt/17249.txt,,,poi
459354,249,17,0,485,"Wir in der Bundesrepublik hatten beim Thema innere Sicherheit bisher Glück; noch ist kein Anschlagsplan aufgegangen. Wir profitieren immer noch von den Leistungen unserer Partner. Deshalb schließe ich mich nicht denen an, die Fragen der inneren Sicherheit, Herr Dr. von Notz, immer wieder nur unter Datenschutzaspekten diskutieren. Das ist einäugig. Sie ziehen sich hinsichtlich der rot-grünen Regierungszeit auf das Ressortprinzip zurück und sagen, dass Sie nichts machen konnten. Es wäre aber mannhaft gewesen, wenn Sie in Baden-Württemberg versucht hätten, endlich einmal den Innenminister zu stellen, um zu beweisen, dass Sie mehr können, als den Ritter der Bürgerrechte zu geben.",Armin Schuster,,data/txt/17249.txt,Armin Schuster (Weil am Rhein) (CDU/CSU),cducsu,speech
459355,249,17,0,486,Beifall bei der CDU/CSU und der FDP,,,data/txt/17249.txt,,,poi
459356,249,17,0,487,"Ich erwarte von der Bundesregierung, dass sie sich bei der Abwägung der Verhältnismäßigkeit den Fragen der inneren Sicherheit mit der gleichen Akribie widmet wie den Fragen des Datenschutzes. Es gibt nur eine Fraktion in diesem Haus, die das macht, und das sind wir.",Armin Schuster,,data/txt/17249.txt,Armin Schuster (Weil am Rhein) (CDU/CSU),cducsu,speech
459357,249,17,0,488,Ihr seid die Größten!,Stefan Liebich,,data/txt/17249.txt,Stefan Liebich [DIE LINKE],linke,poi
459358,249,17,0,489,"Der Blick aller anderen Fraktionen ist in irgendeiner Form einseitig, der der CDU/CSU nicht.",Armin Schuster,,data/txt/17249.txt,Armin Schuster (Weil am Rhein) (CDU/CSU),cducsu,speech
459359,249,17,0,490,Beifall bei der CDU/CSU,,,data/txt/17249.txt,,,poi
459360,249,17,0,491,"Dass die Bereiche Vorratsdatenspeicherung, Onlinedurchsuchung und Telekommunikationsüberwachung in einen Topf geworfen werden, finde ich nicht seriös. Bei der Vorratsdatenspeicherung geht es um Verkehrsdaten, liebe Frau Piltz; bei den Spähaktionen sprechen wir über ganz andere Dinge.",Armin Schuster,,data/txt/17249.txt,Armin Schuster (Weil am Rhein) (CDU/CSU),cducsu,speech
459361,249,17,0,492,Dann haben Sie mir nicht zugehört!,Gisela Piltz,,data/txt/17249.txt,Gisela Piltz [FDP],fdp,poi
459362,249,17,0,493,"Ich behaupte sogar das Gegenteil: Diese Debatte bietet Anlass, gerade über die Vorratsdatenspeicherung zu sprechen, eine verfassungsmäßig in höchstem Maße seriöse Maßnahme, die richterlich abgesichert ist.",Armin Schuster,,data/txt/17249.txt,Armin Schuster (Weil am Rhein) (CDU/CSU),cducsu,speech
459363,249,17,0,494,Beifall bei Abgeordneten der CDU/CSU,,,data/txt/17249.txt,,,poi
459364,249,17,0,495,"Fazit: Wir haben das richtige Personal, um mit unseren Partnern diplomatisch zu verhandeln. Wir haben Minister und einen Kanzleramtschef, die das können.",Armin Schuster,,data/txt/17249.txt,Armin Schuster (Weil am Rhein) (CDU/CSU),cducsu,speech
459365,249,17,0,496,Widerspruch bei Abgeordneten der LINKEN und des BÜNDNISSES 90/DIE GRÜNEN,,,data/txt/17249.txt,,,poi
459366,249,17,0,497,"Wir haben eine Bundeskanzlerin, die sich um diese schwierigen Fragen kümmert. Das können Sie sich nur wünschen.",Armin Schuster,,data/txt/17249.txt,Armin Schuster (Weil am Rhein) (CDU/CSU),cducsu,speech
459367,249,17,0,498,"Das ist das einzige Programm, das ihr habt!",Dr. Kirsten Tackmann,,data/txt/17249.txt,Dr. Kirsten Tackmann [DIE LINKE],linke,poi
459368,249,17,0,499,"Wir werden die Probleme lösen.

Danke schön.",Armin Schuster,,data/txt/17249.txt,Armin Schuster (Weil am Rhein) (CDU/CSU),cducsu,speech
459369,249,17,0,500,Beifall bei der CDU/CSU,,,data/txt/17249.txt,,,poi
459370,249,17,0,501,Ihr könnt Briefe schreiben! Das kann jeder Pennäler!,Wolfgang Wieland,,data/txt/17249.txt,Wolfgang Wieland [BÜNDNIS 90/DIE GRÜNEN],gruene,poi
459371,249,17,0,502,,Armin Schuster,,data/txt/17249.txt,Armin Schuster (Weil am Rhein) (CDU/CSU),cducsu,speech
459372,249,17,0,503,Das Wort hat der Kollege Stephan Mayer aus der Unionsfraktion.,Petra Pau,,data/txt/17249.txt,Vizepräsidentin Petra Pau,,chair
459373,249,17,0,504,"Sehr verehrte Frau Präsidentin! Sehr verehrte Kolleginnen! Sehr geehrte Kollegen! Es kann uns nicht egal sein, dass die Enthüllungen über die geheimdienstlichen Internetüberwachungsprogramme Prism und Tempora unsere Bürgerinnen und Bürger enorm beunruhigen und verunsichern. Bisher hat diese Debatte nicht zu mehr Aufklärung beitragen können. Momentan gibt es noch sehr viele Fragen, aber nur sehr wenige Antworten.

Die Bundesregierung hat zwei umfangreiche Fragenkataloge an die US-Regierung und an die britische Regierung geschickt. Die US-Regierung hat noch nicht geantwortet; die britische Regierung hat offenbar - wie man den Agenturmeldungen heute entnehmen kann - auf die dreizehn Fragen mit drei Zeilen geantwortet. Mit Verlaub: Das ist schon etwas dürftig. Ich kann nur meiner Hoffnung Ausdruck verleihen, dass der britische Premierminister David Cameron, wenn er die Bundeskanzlerin am Donnerstag beim EU-Gipfel in Brüssel trifft, die Gelegenheit nutzt, etwas mehr dazu zu sagen.",Stephan Mayer,,data/txt/17249.txt,Stephan Mayer (Altötting) (CDU/CSU),cducsu,speech
459374,249,17,0,505,Die will doch gar nicht darüber reden!,Hans-Christian Ströbele,,data/txt/17249.txt,Hans-Christian Ströbele [BÜNDNIS 90/DIE GRÜNEN],gruene,poi
459375,249,17,0,506,Wir müssen festhalten: Es ist noch sehr viel unklar.,Stephan Mayer,,data/txt/17249.txt,Stephan Mayer (Altötting) (CDU/CSU),cducsu,speech
459376,249,17,0,507,Die will doch gar nichts wissen!,Hans-Christian Ströbele,,data/txt/17249.txt,Hans-Christian Ströbele [BÜNDNIS 90/DIE GRÜNEN],gruene,poi
459377,249,17,0,508,"Der Konjunktiv überwiegt; wir können nur sehr wenige Aussagen im Indikativ feststellen. Es gilt deshalb, die Priorität zunächst auf die Aufklärung des Sachverhalts zu setzen.",Stephan Mayer,,data/txt/17249.txt,Stephan Mayer (Altötting) (CDU/CSU),cducsu,speech
459378,249,17,0,509,Aha! Dann mal ran!,Hans-Christian Ströbele,,data/txt/17249.txt,Hans-Christian Ströbele [BÜNDNIS 90/DIE GRÜNEN],gruene,poi
459379,249,17,0,510,"Aus meiner Sicht muss das in erster Linie angestrebt werden. Des Weiteren geht es darum, die Frage zu stellen, auf welcher Rechtsgrundlage diese Programme ausgeführt wurden und ob gegen geltendes nationales Recht verstoßen wurde, möglicherweise auch gegen internationales Recht.

Ich möchte unserer Bundeskanzlerin sehr herzlich dafür danken,",Stephan Mayer,,data/txt/17249.txt,Stephan Mayer (Altötting) (CDU/CSU),cducsu,speech
459380,249,17,0,511,Was?,Hans-Christian Ströbele,,data/txt/17249.txt,Hans-Christian Ströbele [BÜNDNIS 90/DIE GRÜNEN],gruene,poi
459381,249,17,0,512,dass sie dieses Thema anlässlich des Besuches des US-Präsidenten in der vergangenen Woche offen und eindringlich angesprochen hat.,Stephan Mayer,,data/txt/17249.txt,Stephan Mayer (Altötting) (CDU/CSU),cducsu,speech
459382,249,17,0,513,Beifall bei der CDU/CSU,,,data/txt/17249.txt,,,poi
459383,249,17,0,514,Was hat sie gesagt?,Hans-Christian Ströbele,,data/txt/17249.txt,Hans-Christian Ströbele [BÜNDNIS 90/DIE GRÜNEN],gruene,poi
