id,sitzung,wahlperiode,in_writing,sequence,text,speaker_cleaned,speaker_fp,filename,speaker,speaker_party,type
459055,249,17,0,186,"Erst zu viel Ausforschung, dann zu wenig Ausforschung",Michael Grosse-Brömer,,data/txt/17249.txt,Michael Grosse-Brömer [CDU/CSU],cducsu,poi
459056,249,17,0,187,was stimmt denn nun?,,,data/txt/17249.txt,,,poi
459057,249,17,0,188,"Das wäre ein weiterer Beweis dafür, dass diese Geheimdienste nichts, aber auch gar nichts zu unserer Sicherheit beitragen. Viel wahrscheinlicher ist aber, dass Sie sehr wohl gewusst haben, was da läuft.

Der frühere BND-Chef beispielsweise, Herr Wieck, sagte gestern im Deutschlandfunk, ein solches Vorgehen sei - ich zitiere - ""das natürliche, tägliche Brot von Geheimdiensten"", auch des BND; er setzt nämlich darauf, von den erschnüffelten Erkenntnissen etwas abzukriegen. So wie der BND sich nicht scheut, Aussagen zu verwerten, die erpresst wurden - zum Beispiel, wie wir wissen, in Folterknästen wie Guantánamo -, will er auch illegal abgefangene E-Mails verwerten. Wenn der BND nicht genauso schnüffelt, dann nicht, weil er Skrupel davor hätte, sondern weil ihm schlicht und einfach die Ressourcen dazu fehlen - zum Glück, kann man da nur sagen.",Ulla Jelpke,,data/txt/17249.txt,Ulla Jelpke (DIE LINKE),linke,speech
459058,249,17,0,189,Was Sie alles wissen! Das ist ja unglaublich!,Michael Grosse-Brömer,,data/txt/17249.txt,Michael Grosse-Brömer [CDU/CSU],cducsu,poi
459059,249,17,0,190,"Aber wir wissen auch, dass der BND mit einem Millionenprogramm aufrüsten will, um es seinem großen Bruder gleichzutun. Die Linke erwartet, dass die zuständigen Ausschüsse hier keine Zusagen machen und keinen Cent dafür freigeben.",Ulla Jelpke,,data/txt/17249.txt,Ulla Jelpke (DIE LINKE),linke,speech
459060,249,17,0,191,Beifall bei der LINKEN,,,data/txt/17249.txt,,,poi
459061,249,17,0,192,"Meine Damen und Herren, wir erleben in diesen Tagen, dass die westliche Welt, die sich selbst so arrogant die ""freie"" Welt nennt, sich als Raum der Überwachung, der Verletzung der Intimsphäre und des Unrechts entpuppt. Ich weiß nicht, ob Verhandlungen über Datenschutzabkommen weiterhelfen. Was nottut, sind auf jeden Fall Schutzprogramme, um die Überwachung zu verhindern oder wenigstens ihren Preis massiv hochzutreiben.

Die Linke erwartet von der Bundesregierung klare Ansagen: Was wollen Sie tun, um die Überwachungsangriffe aus den USA und Großbritannien auf unsere Grundwerte abzuwehren?

Noch etwas: Je mehr sich herausstellt, dass die westlichen Geheimdienste sich einen Dreck um die Demokratie scheren, desto mehr verdienen jene Anerkennung, die tatsächlich für Freiheitsrechte kämpfen. Ich rede von Leuten wie den Aktiven von WikiLeaks, von Bradley Manning, der seit Jahren in einem US-Militärknast schmort, und von Edward Snowden. Snowden hat die Schnüffelpraxis der USA und der Geheimdienste aufgedeckt. Für dieses Verdienst droht ihm nun schwerste Verfolgung durch die US-Behörden. Es wäre ein gutes Zeichen, wenn wir alle ihm sagen würden: Du bist hier willkommen. - Edward Snowden verdient unsere Solidarität und unser Asyl.

Ich danke Ihnen.",Ulla Jelpke,,data/txt/17249.txt,Ulla Jelpke (DIE LINKE),linke,speech
459062,249,17,0,193,Beifall bei der LINKEN sowie des Abg. Hans-Christian Ströbele [BÜNDNIS 90/DIE GRÜNEN],,,data/txt/17249.txt,,,poi
459063,249,17,0,194,,Ulla Jelpke,,data/txt/17249.txt,Ulla Jelpke (DIE LINKE),linke,speech
459064,249,17,0,195,Für die Fraktion Bündnis 90/Die Grünen hat nun die Kollegin Renate Künast das Wort.,Petra Pau,,data/txt/17249.txt,Vizepräsidentin Petra Pau,,chair
459065,249,17,0,196,Der geballte Sachverstand!,Dr. Hans-Peter Uhl,,data/txt/17249.txt,Dr. Hans-Peter Uhl [CDU/CSU],cducsu,poi
459066,249,17,0,197,,Petra Pau,,data/txt/17249.txt,Vizepräsidentin Petra Pau,,chair
459067,249,17,0,198,"Frau Präsidentin! Liebe Kolleginnen und Kollegen! Herr Minister, Ihre Rede hier wäre selbst einem Erstsemester in den Rechtswissenschaften komisch aufgestoßen.",Renate Künast,,data/txt/17249.txt,Renate Künast (BÜNDNIS 90/DIE GRÜNEN),gruene,speech
459068,249,17,0,199,Beifall beim BÜNDNIS 90/DIE GRÜNEN sowie bei Abgeordneten der SPD und der LINKEN,,,data/txt/17249.txt,,,poi
459069,249,17,0,200,"Da geben Sie zum Besten, dass die Exekutive an Recht und Gesetz gebunden ist. Ja, und dann, Herr Minister? An welches Recht, an welches Gesetz, was sind die Regeln, und halten Sie sich daran? Das sind doch die Fragen.",Renate Künast,,data/txt/17249.txt,Renate Künast (BÜNDNIS 90/DIE GRÜNEN),gruene,speech
459070,249,17,0,201,Beifall beim BÜNDNIS 90/DIE GRÜNEN sowie bei Abgeordneten der SPD,,,data/txt/17249.txt,,,poi
459071,249,17,0,202,Sie sind nicht der deutsche Innenminister!,Michael Grosse-Brömer,,data/txt/17249.txt,Michael Grosse-Brömer [CDU/CSU],cducsu,poi
459072,249,17,0,203,"Es geht um Millionen von Verbindungsdaten, es geht um Inhalte, es geht um umfassende Eingriffe. Aber Sie sind nicht einmal in der Lage, hier darzustellen, wie umfassend die Eingriffe sind, was alles ausspioniert wird - geht es um Wirtschaftsspionage bis hin zum Terrorismus, um den gesamten Privatverkehr all derer, die hier oben auf der Tribüne sitzen oder gerade im Livestream zuschauen? - und was mit diesen Daten passiert. Kein Wort haben Sie dazu gesagt. Aber Sie haben einmal den Eid geleistet, unser aller Rechte in Deutschland zu wahren. Wo bleiben Ihre entsprechenden Aktivitäten?",Renate Künast,,data/txt/17249.txt,Renate Künast (BÜNDNIS 90/DIE GRÜNEN),gruene,speech
459073,249,17,0,204,Beifall beim BÜNDNIS 90/DIE GRÜNEN sowie bei Abgeordneten der SPD und der LINKEN,,,data/txt/17249.txt,,,poi
459074,249,17,0,205,Wo soll denn der Rechtsverstoß des Ministers sein?,Michael Grosse-Brömer,,data/txt/17249.txt,Michael Grosse-Brömer [CDU/CSU],cducsu,poi
459075,249,17,0,206,"Sie erzählen uns hier wieder, dass Freiheit und Sicherheit zusammengehörten und es Freiheit ohne Sicherheit nicht gebe. Auf diesem Parkett könnte ich jetzt auch herumtänzeln.",Renate Künast,,data/txt/17249.txt,Renate Künast (BÜNDNIS 90/DIE GRÜNEN),gruene,speech
459076,249,17,0,207,Lieber nicht!,von der CDU/CSU,,data/txt/17249.txt,Zuruf von der CDU/CSU,cducsu,poi
459077,249,17,0,208,"Wir sind doch längst weiter. Wir wissen, dass es in diesem Spannungsverhältnis eine Balance zu finden gilt. Wir kommen allerdings zu unterschiedlichen Ergebnissen, wie diese Balance aussehen sollte. Außerdem geht es hier um einen realen Fall. Auch deshalb ist uns mit einer Erstsemestervorlesung in Philosophie nicht gedient.",Renate Künast,,data/txt/17249.txt,Renate Künast (BÜNDNIS 90/DIE GRÜNEN),gruene,speech
459078,249,17,0,209,Beifall beim BÜNDNIS 90/DIE GRÜNEN sowie bei Abgeordneten der SPD,,,data/txt/17249.txt,,,poi
459079,249,17,0,210,"Im konkreten Fall werden wir alle zu gläsernen Bürgern: Anlasslos und schwellenlos wird vermutlich alles gesammelt, was sich gerade aktuell im Netz tut. Das, Frau Leutheusser-Schnarrenberger, ist kein Albtraum, kein Hollywoodfilm, sondern es ist offenbar Realität.",Renate Künast,,data/txt/17249.txt,Renate Künast (BÜNDNIS 90/DIE GRÜNEN),gruene,speech
459080,249,17,0,211,Beifall beim BÜNDNIS 90/DIE GRÜNEN sowie bei Abgeordneten der SPD und des Abg. Stefan Liebich [DIE LINKE],,,data/txt/17249.txt,,,poi
459081,249,17,0,212,"Jeder muss sich Sorgen machen. Sie haben allgemein philosophiert; aber was sagen Sie eigentlich konkret zum Fall Snowden? Wie kann es eigentlich sein, dass ein Land jemanden, der lediglich sagt, was er arbeitet, zum meistgesuchten Menschen der Welt macht? Dazu kam von Ihnen kein Wort.

Es kam auch kein Wort von Ihnen dazu, wie die britische Regierung mit den Fragen, die die Bundesregierung gestellt hat, umgeht. Einer Tickermeldung nach ist die britische Regierung nicht gewillt, die Fragen der Bundesregierung zu beantworten. Stattdessen empfehle London der Bundesregierung als geeigneten Kanal bzw. geeignete Ebene für bilaterale Gespräche die Nachrichtendienste selbst. Und das lassen Sie sich gefallen, Herr Friedrich? Wir alle werden in unserer Kommunikation ausgespäht - als wären wir alle Schwerverbrecher, Terroristen oder Wirtschaftsspione -, und nun sollen wir damit zufrieden sein, wenn sich die Geheimdienste in als klassifiziert eingestuften Gesprächen darüber austauschen? Das kann doch nicht Ihr Ernst sein!",Renate Künast,,data/txt/17249.txt,Renate Künast (BÜNDNIS 90/DIE GRÜNEN),gruene,speech
459082,249,17,0,213,Beifall beim BÜNDNIS 90/DIE GRÜNEN sowie bei Abgeordneten der SPD und des Abg. Stefan Liebich [DIE LINKE],,,data/txt/17249.txt,,,poi
459083,249,17,0,214,"Ich hätte erwartet, dass Sie Ihre Stimme erheben und an dieser Stelle klar sagen: Der Schnüffelskandal ist kein bilaterales Problem zwischen uns und den USA oder zwischen uns und Großbritannien, sondern hier gilt internationales Recht.

Im Hinblick auf Großbritannien muss man doch auch darauf hinweisen, dass europäisches Recht einzuhalten ist.",Renate Künast,,data/txt/17249.txt,Renate Künast (BÜNDNIS 90/DIE GRÜNEN),gruene,speech
459084,249,17,0,215,Beifall beim BÜNDNIS 90/DIE GRÜNEN sowie bei Abgeordneten der SPD,,,data/txt/17249.txt,,,poi
459085,249,17,0,216,"Die Rechtsgrundlagen der Europäischen Union - schon die Binnenmarktregeln, nicht erst die Grundrechtecharta, die Großbritannien ja nicht unterzeichnet hat - besagen, dass wir alle das Recht haben, dass unsere persönlichen Daten geschützt werden. Deshalb ist dieser Schnüffelskandal kein bilaterales Problem, sondern dieses Thema gehört - das haben wir in unserem Antrag geschrieben - auf die Tagesordnung des Europäischen Rates in dieser Woche.",Renate Künast,,data/txt/17249.txt,Renate Künast (BÜNDNIS 90/DIE GRÜNEN),gruene,speech
459086,249,17,0,217,Beifall beim BÜNDNIS 90/DIE GRÜNEN sowie bei Abgeordneten der SPD und des Abg. Stefan Liebich [DIE LINKE],,,data/txt/17249.txt,,,poi
459087,249,17,0,218,"Wer so tut, als könnte man dieses Thema irgendwie bilateral bzw. in Gesprächen der Geheimdienste miteinander klären, der will nicht ernsthaft aufklären und unsere Rechte verteidigen, Herr Friedrich. Dieses Thema muss aber auf die Tagesordnung des Europäischen Rates kommen. Wir wollen wissen, was passiert ist und passiert. Wir wollen laut sagen, was rechtlich nicht geht. Wir wollen, dass diese Bundesregierung prüft, welche rechtlichen Schritte gegenüber den USA bzw. Großbritannien eingeleitet werden können, zum Beispiel ein Vertragsverletzungsverfahren wegen Missachtung und Verletzung des europäischen Rechts. Das muss ganz klar angesprochen werden.",Renate Künast,,data/txt/17249.txt,Renate Künast (BÜNDNIS 90/DIE GRÜNEN),gruene,speech
459088,249,17,0,219,Beifall beim BÜNDNIS 90/DIE GRÜNEN sowie bei Abgeordneten der SPD und der LINKEN,,,data/txt/17249.txt,,,poi
459089,249,17,0,220,"Dazu kam von Ihnen kein Wort. Ich sage Ihnen: Wenn diese Schnüffelprogramme jetzt nicht politisch und rechtlich zurückgewiesen werden, wenn wir unser Recht jetzt nicht verteidigen, dann sind die Verfassungsrechte der westlichen Demokratien das Papier, auf dem sie geschrieben stehen, am Ende nicht wert.

Wozu ist eine Regierung eigentlich da? Die Aufgabe einer Regierung ist es, Gesetze zu machen, die Ausführung zu kontrollieren und unser aller Rechte zu vertreten, meine Damen und Herren. Es ist schön, Herr Schulz, dass Sie die Vorratsdatenspeicherung abgelehnt haben; aber dann erwarte ich von der FDP auch, dass sie an dieser Stelle genauso klar sagt: Dieser Schnüffelskandal muss auf die Tagesordnung des Europäischen Rates, und wir müssen prüfen, ob gegen Großbritannien ein Vertragsverletzungsverfahren eingeleitet werden kann.",Renate Künast,,data/txt/17249.txt,Renate Künast (BÜNDNIS 90/DIE GRÜNEN),gruene,speech
459090,249,17,0,221,Beifall beim BÜNDNIS 90/DIE GRÜNEN sowie bei Abgeordneten der SPD und des Abg. Stefan Liebich [DIE LINKE],,,data/txt/17249.txt,,,poi
459091,249,17,0,222,"Recht, meine Damen und Herren, soll und darf nicht nur auf dem Papier stehen, sondern muss auch in der Realität praktiziert werden. Deshalb sage ich Ihnen an dieser Stelle ganz klar: Die Aufgabe der Bundesregierung ist zuerst, unsere Rechte hier und heute zu verteidigen. Dann, lieber Thomas Oppermann, kann man über europäische Datenschutzrichtlinien und über eine europäische Cyberstrategie reden. Das ist immer richtig; denn nur so können wir das Recht auf Datenschutz, das Recht auf informationelle Selbstbestimmung, tatsächlich verteidigen. Aber als Allererstes wollen wir wissen, was war, und wir wollen, dass endlich das europäische Recht eingehalten wird.",Renate Künast,,data/txt/17249.txt,Renate Künast (BÜNDNIS 90/DIE GRÜNEN),gruene,speech
459092,249,17,0,223,Beifall beim BÜNDNIS 90/DIE GRÜNEN und bei der SPD sowie des Abg. Stefan Liebich [DIE LINKE],,,data/txt/17249.txt,,,poi
459093,249,17,0,224,,Renate Künast,,data/txt/17249.txt,Renate Künast (BÜNDNIS 90/DIE GRÜNEN),gruene,speech
459094,249,17,0,225,Das Wort hat der Kollege Michael Grosse-Brömer für die Unionsfraktion.,Petra Pau,,data/txt/17249.txt,Vizepräsidentin Petra Pau,,chair
459095,249,17,0,226,Beifall bei der CDU/CSU und der FDP,,,data/txt/17249.txt,,,poi
459096,249,17,0,227,,Petra Pau,,data/txt/17249.txt,Vizepräsidentin Petra Pau,,chair
459097,249,17,0,228,"Sehr geehrte Frau Präsidentin! Liebe Kolleginnen und Kollegen! Frau Künast, am besten war Ihre Passage mit dem ""Herumtänzeln"".",Michael Grosse-Brömer,,data/txt/17249.txt,Michael Grosse-Brömer (CDU/CSU),cducsu,speech
459098,249,17,0,229,Widerspruch beim BÜNDNIS 90/DIE GRÜNEN,,,data/txt/17249.txt,,,poi
459099,249,17,0,230,"Sie selber sind um das Thema herumgetänzelt. Ihr Vorwurf, der Minister sei unkonkret gewesen, war völlig abwegig.",Michael Grosse-Brömer,,data/txt/17249.txt,Michael Grosse-Brömer (CDU/CSU),cducsu,speech
459100,249,17,0,231,Dann sagen Sie etwas zur Vertragsverletzung!,Renate Künast,,data/txt/17249.txt,Renate Künast [BÜNDNIS 90/DIE GRÜNEN],gruene,poi
459101,249,17,0,232,Natürlich sind wir - welch eine Binsenweisheit - nicht alle Terroristen. Wir alle werden aber auch nicht ständig überwacht.,Michael Grosse-Brömer,,data/txt/17249.txt,Michael Grosse-Brömer (CDU/CSU),cducsu,speech
459102,249,17,0,233,Woher wissen Sie das?,Hans-Christian Ströbele,,data/txt/17249.txt,Hans-Christian Ströbele [BÜNDNIS 90/DIE GRÜNEN],gruene,poi
459103,249,17,0,234,"Das ist genauso richtig.

Wer sich mit dem Thema ernsthaft und sachlich auseinandersetzt, wird sich doch um die Kernfragen dieser Problematik kümmern, nämlich um Prism und um Tempora, und die Fragen stellen, die das Ministerium eben schon gestellt hat.",Michael Grosse-Brömer,,data/txt/17249.txt,Michael Grosse-Brömer (CDU/CSU),cducsu,speech
459104,249,17,0,235,Fangen Sie mal an damit!,Dr. Konstantin von Notz,,data/txt/17249.txt,Dr. Konstantin von Notz [BÜNDNIS 90/DIE GRÜNEN],gruene,poi
459105,249,17,0,236,Da sind wir aber gespannt!,Iris Gleicke,,data/txt/17249.txt,Iris Gleicke [SPD],spd,poi
459106,249,17,0,237,Es gibt aber keine Antworten!,Renate Künast,,data/txt/17249.txt,Renate Künast [BÜNDNIS 90/DIE GRÜNEN],gruene,poi
459107,249,17,0,238,"Nur tun Sie doch nicht so, als hätte es irgendeinen Rechtsverstoß deutscher Ministerien oder gar des deutschen Innenministeriums gegeben. Das ist doch völlig abwegig, und darum geht es hier auch gar nicht. Wo ist denn der Rechtsverstoß des Ministers? Sie suggerieren hier immer, es gebe eine permanente Kontrolle",Michael Grosse-Brömer,,data/txt/17249.txt,Michael Grosse-Brömer (CDU/CSU),cducsu,speech
459108,249,17,0,239,Welche Rechtsverstöße!,Renate Künast,,data/txt/17249.txt,Renate Künast [BÜNDNIS 90/DIE GRÜNEN],gruene,poi
459109,249,17,0,240,Untätigkeit!,Dr. Konstantin von Notz,,data/txt/17249.txt,Dr. Konstantin von Notz [BÜNDNIS 90/DIE GRÜNEN],gruene,poi
459110,249,17,0,241,und irgendwelche Fehler von deutschen Ministern. Darum geht es hier gar nicht.,Michael Grosse-Brömer,,data/txt/17249.txt,Michael Grosse-Brömer (CDU/CSU),cducsu,speech
459111,249,17,0,242,Doch!,Dr. Konstantin von Notz,,data/txt/17249.txt,Dr. Konstantin von Notz [BÜNDNIS 90/DIE GRÜNEN],gruene,poi
459112,249,17,0,243,"Hier geht es um eine Überwachung - darüber kann man nachdenken - und um eine Bundesregierung, die unverzüglich, schnell und besonnen gehandelt und sich um Aufklärung bemüht hat. Das ist die Wahrheit.",Michael Grosse-Brömer,,data/txt/17249.txt,Michael Grosse-Brömer (CDU/CSU),cducsu,speech
459113,249,17,0,244,Beifall bei der CDU/CSU und der FDP,,,data/txt/17249.txt,,,poi
459114,249,17,0,245,Das ist absurd!,Stefan Liebich,,data/txt/17249.txt,Stefan Liebich [DIE LINKE],linke,poi
459115,249,17,0,246,Zurufe vom BÜNDNIS 90/DIE GRÜNEN,,,data/txt/17249.txt,,,poi
459116,249,17,0,247,"- Das gefällt Ihnen nicht; aber es ist die Aufgabe der Regierung, genau das zu tun, was sie getan hat.",Michael Grosse-Brömer,,data/txt/17249.txt,Michael Grosse-Brömer (CDU/CSU),cducsu,speech
459117,249,17,0,248,Briefe geschrieben hat sie!,Stefan Liebich,,data/txt/17249.txt,Stefan Liebich [DIE LINKE],linke,poi
459118,249,17,0,249,"Im Übrigen können wir noch einmal nachfragen. Nicht nur die Kanzlerin hat sich mit Herrn Obama unterhalten. Was hat Herr Steinbrück - der amerikanische Präsident musste lernen, dass er nicht ""Steinberg"" heißt; aber das hat er irgendwann mitbekommen - denn bei seinen Gesprächen herausgefunden? Er hat doch bestimmt mit dem Präsidenten auch über Prism geredet.",Michael Grosse-Brömer,,data/txt/17249.txt,Michael Grosse-Brömer (CDU/CSU),cducsu,speech
459119,249,17,0,250,Zuruf des Abg. Dr. Konstantin von Notz [BÜNDNIS 90/DIE GRÜNEN],,,data/txt/17249.txt,,,poi
459120,249,17,0,251,"Deswegen habe ich mich schon gewundert, dass Sie diese Debatte überhaupt mit beantragt haben. Eigentlich müsste angesichts der diplomatischen Fähigkeiten Ihres Kanzlerkandidaten schon alles klar sein.",Michael Grosse-Brömer,,data/txt/17249.txt,Michael Grosse-Brömer (CDU/CSU),cducsu,speech
459121,249,17,0,252,Der SPD nicht!,Dr. Dagmar Enkelmann,,data/txt/17249.txt,Dr. Dagmar Enkelmann [DIE LINKE],linke,poi
459122,249,17,0,253,"Um das ganz klar zu sagen: Ich wäre ein Stück weit vorsichtig mit schnellen, voreiligen Schlussfolgerungen. Was Deutschland anbelangt, ist eines richtig: Wir haben klare gesetzliche Grundlagen für das, was wir hier tun. Wenn andere die nicht einhalten, wird in der Tat nachgefragt,",Michael Grosse-Brömer,,data/txt/17249.txt,Michael Grosse-Brömer (CDU/CSU),cducsu,speech
459123,249,17,0,254,Aha!,Hans-Christian Ströbele,,data/txt/17249.txt,Hans-Christian Ströbele [BÜNDNIS 90/DIE GRÜNEN],gruene,poi
459124,249,17,0,255,und dann tritt man in einen kritischen Dialog ein. Das alles fordern natürlich auch wir als Union.,Michael Grosse-Brömer,,data/txt/17249.txt,Michael Grosse-Brömer (CDU/CSU),cducsu,speech
459125,249,17,0,256,"Das muss abgestellt werden, nicht nachgefragt werden!",Stefan Liebich,,data/txt/17249.txt,Stefan Liebich [DIE LINKE],linke,poi
459126,249,17,0,257,"Niemand kann angesichts dieser Meldungen zufrieden sein, die da in den Zeitungen - im Guardian oder sonst wo - standen,",Michael Grosse-Brömer,,data/txt/17249.txt,Michael Grosse-Brömer (CDU/CSU),cducsu,speech
459127,249,17,0,258,"Das ist schon 14 Tage her, dass Sie nichts gemacht haben!",Hans-Christian Ströbele,,data/txt/17249.txt,Hans-Christian Ströbele [BÜNDNIS 90/DIE GRÜNEN],gruene,poi
459128,249,17,0,259,"und niemand kann angesichts der Aussagen von Herrn Snowden beruhigt sein und sagen: Da wird schon nichts dran sein. - Nein, vollständige Aufklärung ist hier gefragt. Keine Frage. Die findet aber auch statt.",Michael Grosse-Brömer,,data/txt/17249.txt,Michael Grosse-Brömer (CDU/CSU),cducsu,speech
459129,249,17,0,260,Wo denn?,Hans-Christian Ströbele,,data/txt/17249.txt,Hans-Christian Ströbele [BÜNDNIS 90/DIE GRÜNEN],gruene,poi
459130,249,17,0,261,"Jedenfalls wird die Bundesregierung genau das tun, was sie schon am Anfang gemacht hat.",Michael Grosse-Brömer,,data/txt/17249.txt,Michael Grosse-Brömer (CDU/CSU),cducsu,speech
459131,249,17,0,262,Was denn?,vom BÜNDNIS 90/DIE GRÜNEN,,data/txt/17249.txt,Zuruf vom BÜNDNIS 90/DIE GRÜNEN,gruene,poi
459132,249,17,0,263,"Sie wird Fragenkataloge erstellen und gerade befreundete Staaten und Nachbarn konkret auffordern, hier vernünftig Auskunft zu geben.

Ich will Ihnen - gerade weil Deutschland nicht zuletzt wegen seiner historischen Erfahrungen eine wehrhafte Demokratie ist - sagen: Natürlich müssen wir Bedrohungen der Sicherheit der Menschen in unserem Land abwenden. Darum geht es doch im Zweifel auch. Deswegen brauchen wir Nachrichtendienste. Tun Sie doch nicht immer so, als wäre die Ausspähung das einzige Interesse. Hier geht es konkret um den Schutz der Menschen in Deutschland. Auch das ist im Übrigen eine verfassungsrechtlich verankerte Aufgabe.",Michael Grosse-Brömer,,data/txt/17249.txt,Michael Grosse-Brömer (CDU/CSU),cducsu,speech
459133,249,17,0,264,Beifall bei der CDU/CSU und der FDP,,,data/txt/17249.txt,,,poi
459134,249,17,0,265,"Deswegen gilt es, genau das zu tun, was der Minister gesagt hat, nämlich die passende Balance zu finden: Das eine tun, ohne das andere zu lassen. Darum geht es.",Michael Grosse-Brömer,,data/txt/17249.txt,Michael Grosse-Brömer (CDU/CSU),cducsu,speech
459135,249,17,0,266,Das ist aber sehr konkret! Wir danken auch!,Renate Künast,,data/txt/17249.txt,Renate Künast [BÜNDNIS 90/DIE GRÜNEN],gruene,poi
459136,249,17,0,267,,Michael Grosse-Brömer,,data/txt/17249.txt,Michael Grosse-Brömer (CDU/CSU),cducsu,speech
459137,249,17,0,268,"Es kann ja nicht sein, dass die Verbrecher technologisch aufrüsten, immer effizienter das Netz nutzen - und wir als Staat dem nichts entgegensetzen können.","Natürlich hatte der Bundesinnenminister recht, als er vor einigen Tagen in einem Interview sagte",,data/txt/17249.txt,"Natürlich hatte der Bundesinnenminister recht, als er vor einigen Tagen in einem Interview sagte",,speech
459138,249,17,0,269,Machen wir alles mit!,Stefan Liebich,,data/txt/17249.txt,Stefan Liebich [DIE LINKE],linke,poi
459139,249,17,0,270,"Weiter stellte er fest, man müsse dafür Sorge tragen,

dass wir Kontrollverluste über die Kommunikation von Kriminellen durch neue rechtliche und technologische Mittel ausgleichen.","Natürlich hatte der Bundesinnenminister recht, als er vor einigen Tagen in einem Interview sagte",,data/txt/17249.txt,"Natürlich hatte der Bundesinnenminister recht, als er vor einigen Tagen in einem Interview sagte",,speech
459140,249,17,0,271,Finden Sie Tempora jetzt gut? Dann sagen Sie es!,Dr. Konstantin von Notz,,data/txt/17249.txt,Dr. Konstantin von Notz [BÜNDNIS 90/DIE GRÜNEN],gruene,poi
459141,249,17,0,272,"Natürlich ist das die Aufgabe; seien wir doch einmal ehrlich. Es geht doch nicht nur um eine Ausspähung, sondern es ist doch auch die Aufgabe des Staates, sich genau darum zu kümmern. Ich möchte Sie hören - dann würden Sie sich als Erste melden -, wenn in Deutschland ein terroristischer Anschlag stattfinden würde:","Natürlich hatte der Bundesinnenminister recht, als er vor einigen Tagen in einem Interview sagte",,data/txt/17249.txt,"Natürlich hatte der Bundesinnenminister recht, als er vor einigen Tagen in einem Interview sagte",,speech
459142,249,17,0,273,"Was müssen Sie ihn jetzt verteidigen? Sagen Sie doch, was richtig ist!",Renate Künast,,data/txt/17249.txt,Renate Künast [BÜNDNIS 90/DIE GRÜNEN],gruene,poi
459143,249,17,0,274,"Dann würde bei Ihnen nicht mehr die Empörung über das Ausspähen an erster Stelle stehen, sondern die Empörung darüber, dass der Staat zu wenig zum Schutz seiner Bürgerinnen und Bürger gehandelt hat. Das wäre dann der nächste Vorwurf. Insofern geht es in der Tat um die richtige Balance.

Wir wollen keinen Überwachungsstaat, und wir haben auch keinen Überwachungsstaat. Wir haben eindeutige Rechtsgrundlagen für Überwachungsmaßnahmen im Bereich der Telekommunikation. Es gibt die Polizeigesetze der Länder und die Strafprozessordnung. Wir haben das Gesetz zur Beschränkung des Brief-, Post- und Fernmeldegeheimnisses, das G-10-Gesetz.","Natürlich hatte der Bundesinnenminister recht, als er vor einigen Tagen in einem Interview sagte",,data/txt/17249.txt,"Natürlich hatte der Bundesinnenminister recht, als er vor einigen Tagen in einem Interview sagte",,speech
459144,249,17,0,275,"Es geht doch nicht um die StPO! Das sind Geheimdienste, falls Sie den Unterschied kennen! Nach der StPO ist das alles verboten, was da passiert!",Renate Künast,,data/txt/17249.txt,Renate Künast [BÜNDNIS 90/DIE GRÜNEN],gruene,poi
459145,249,17,0,276,"All das bildet in Deutschland das rechtliche Gerüst, um eben blinde und unverhältnismäßige Ausforschung zu verhindern. Es gibt strenge Regeln, an die wir uns halten.

Deswegen besteht in Deutschland aus meiner Sicht auch die richtige Balance zwischen dem Schutz der inneren Sicherheit, dem Recht auf Privatsphäre und dem Recht auf informationelle Selbstbestimmung.

Im Übrigen haben wir heute noch eine Sitzung des Parlamentarischen Kontrollgremiums.","Natürlich hatte der Bundesinnenminister recht, als er vor einigen Tagen in einem Interview sagte",,data/txt/17249.txt,"Natürlich hatte der Bundesinnenminister recht, als er vor einigen Tagen in einem Interview sagte",,speech
459146,249,17,0,277,Da sind wir gespannt!,Hans-Christian Ströbele,,data/txt/17249.txt,Hans-Christian Ströbele [BÜNDNIS 90/DIE GRÜNEN],gruene,poi
