id,sitzung,wahlperiode,in_writing,sequence,text,speaker_cleaned,speaker_fp,filename,speaker,speaker_party,type
459472,249,17,0,603,"Aus gegebenem Anlass weise ich gerne darauf hin, dass wir verabredet haben, dass wir bei der ersten Frage zwei Minuten antworten und uns bei den jeweils weiteren Nachfragen eine Minute für die Frage und eine Minute für die Antwort Zeit lassen können.

Frau Krüger-Leißner, möchten Sie noch eine Nachfrage stellen? - Bitte schön.",Katrin Göring-Eckardt,,data/txt/17249.txt,Vizepräsidentin Katrin Göring-Eckardt,,chair
459473,249,17,0,604,"Wir haben übrigens heute im Ausschuss diese Frage zweimal gestellt. Sie steht im Zusammenhang mit den Ergebnissen des Bundesrechnungshofberichts, der im Spiegel veröffentlicht wurde. Es gibt sehr wohl große Kritik an der Arbeitsvermittlung. Festgestellt wurde, dass nicht alle Arbeitsuchenden gleichermaßen vermittelt wurden, dass Kunden ausgegrenzt werden und dass es Verschiebungen vom SGB III in das SGB II gibt. Deshalb habe ich diese Frage gestellt. Das Bundesministerium für Arbeit und Soziales ist ein Teil des Verwaltungsrates der BA.

Ich möchte wissen: Haben Sie über die Probleme, die seit November bekannt sind, gesprochen? Was ist neu vereinbart worden, um dem gesetzlichen Auftrag nachkommen zu können?",Angelika Krüger-Leißner,,data/txt/17249.txt,Angelika Krüger-Leißner (SPD),spd,speech
459474,249,17,0,605,"Frau Kollegin, es gibt, mit Verlaub, keinen Bundesrechnungshofbericht, sondern eine Prüfungsmitteilung des Bundesrechnungshofes an das Bundesministerium für Arbeit und Soziales und die Bundesagentur für Arbeit. Es gibt auf dem üblichen verwaltungsinternen Weg dazu Stellungnahmen, unter anderem meines Hauses. Diese werden, wie ich Ihnen schon im Ausschuss erläutert habe, in den abschließenden Bericht des Bundesrechnungshofes einfließen, der dann dem Haushaltsausschuss des Deutschen Bundestages zugeleitet werden wird.

Selbstverständlich befasst sich auch der Verwaltungsrat der Bundesagentur für Arbeit mit diesen Themen. Selbstverständlich beteiligen sich die auf Vorschlag der Bundesregierung dorthin entsandten Mitglieder aktiv daran. Das heißt aber nicht, dass die Bundesregierung Teil des Verwaltungsrates ist. Der Verwaltungsrat ist Teil der Selbstverwaltung der Bundesagentur für Arbeit. Dort werden solche Themen selbstverständlich besprochen.

Die Bundesregierung führt die Rechtsaufsicht über die Bundesagentur für Arbeit, das heißt die Rechtsaufsicht über den Vorstand. Gäbe es Hinweise darauf, dass vom Vorstand aus gezielt Maßnahmen veranlasst würden, die dazu führten, dass Menschen um ihre Rechte gebracht würden, dann wäre das Gegenstand rechtsaufsichtlichen Handelns. Wenn vor Ort einmal Fehler passieren - auch dort arbeiten schließlich nur Menschen -, dann ist das kein Fall für die Rechtsaufsicht.",Dr. Ralf Brauksiepe,,data/txt/17249.txt,"Dr. Ralf Brauksiepe, Parl. Staatssekretär bei der Bundesministerin für Arbeit und Soziales",,speech
459475,249,17,0,606,Sie haben eine zweite Nachfrage? - Bitte schön.,Katrin Göring-Eckardt,,data/txt/17249.txt,Vizepräsidentin Katrin Göring-Eckardt,,chair
459476,249,17,0,607,"Es ist zum Teil auch eine Feststellung. - Das sind zum Teil die gleichen ausweichenden Antworten, die wir bereits im Ausschuss bekommen haben. Herr Weise hat heute im Ausschuss zugegeben, dass Fehler gemacht worden sind. Ich wüsste gerne, welchen Einfluss Sie auf das weitere Verfahren nehmen, um gemäß Ihrem gesetzlichen Auftrag Langzeitarbeitslosigkeit zu vermeiden. Bislang habe ich dazu wieder nichts gehört.",Angelika Krüger-Leißner,,data/txt/17249.txt,Angelika Krüger-Leißner (SPD),spd,speech
459477,249,17,0,608,"Frau Kollegin, wie Sie wissen und wie ich gerne wiederhole, haben wir in Deutschland eine Rekordbeschäftigung und eine Arbeitslosenquote zu verzeichnen, die so niedrig wie seit Jahrzehnten nicht mehr ist. Das ist das Ergebnis einer großen Gemeinschaftsleistung. Dazu tragen der Deutsche Bundestag mit seinen Gesetzen, die Bundesregierung mit ihren Verordnungen und die Bundesagentur für Arbeit mit ihren Maßnahmen bei, die sie in Eigenverantwortung im Rahmen von Recht und Gesetz ergreift. So ist die Rechtslage.

Wir alle sind sehr interessiert daran, die bestehenden Probleme zu erkennen und zu lösen. Das macht jeder im Rahmen seines Verantwortungsbereichs. Hier geht es um den Verantwortungsbereich der Bundesagentur für Arbeit.

Die Bundesregierung ist sicher, dass die Bundesagentur für Arbeit ihrer Verantwortung gerecht wird, wobei ich noch einmal betone: Wir haben keinen abschließenden Bericht des Bundesrechnungshofes, sondern es gibt einen Prüfungsvermerk. Der Bundesrechnungshof selber hat mitgeteilt - die Aussage ist zur Veröffentlichung freigegeben -, dass die Bundesagentur für Arbeit ihm ihre Überlegungen zur Weiterentwicklung des Zielsystems bereits vorgestellt hat und dass diese Überlegungen grundsätzlich positiv aufgenommen worden sind.",Dr. Ralf Brauksiepe,,data/txt/17249.txt,"Dr. Ralf Brauksiepe, Parl. Staatssekretär bei der Bundesministerin für Arbeit und Soziales",,speech
459478,249,17,0,609,"Vielen Dank.

Ich rufe nun die mündlichen Fragen auf Drucksache 17/14063 in der üblichen Reihenfolge auf.

Wir beginnen mit dem Geschäftsbereich des Bundesministeriums der Verteidigung. Zur Beantwortung der Fragen steht der Parlamentarische Staatssekretär Christian Schmidt zur Verfügung.

Ich rufe die Frage 1 des Abgeordneten Dr. Hans-Peter Bartels auf:

Verantwortliche welcher Ebenen des Bundesministeriums der Verteidigung (Bundesminister, Staatssekretär, Abteilungsleiter, Bundesamt für Ausrüstung, Informationstechnik und Nutzung der Bundeswehr) waren an der Aushandlung des Memorandum of Understanding zur ""Stückzahlanpassung für Unterstützungshubschrauber Tiger und NATO-Helikopter NH90"" (Pressemitteilung des Bundesministeriums der Verteidigung vom 15. März 2013) beteiligt?",Katrin Göring-Eckardt,,data/txt/17249.txt,Vizepräsidentin Katrin Göring-Eckardt,,chair
459479,249,17,0,610,"Herzlichen Dank, Frau Präsidentin. - Lieber Kollege Bartels, ich darf Ihnen auf Ihre Frage folgende Antwort geben: Die Gespräche zur Aushandlung des Memorandum of Understanding, also der grundsätzlichen Regelungsvereinbarung, wurden im Verantwortungsbereich des für Rüstung zuständigen Staatssekretärs geführt. Über den Gesamtzeitraum der Verhandlungen haben fachlich Zuständige des Bundesministeriums der Verteidigung wie auch des Bundesamts für Ausrüstung, Informationstechnik und Nutzung der Bundeswehr ebenfalls Gespräche geführt. Die Schlussverhandlung über die Stückzahlanpassung erfolgte am 15. März 2013 durch den für Rüstungsfragen zuständigen Staatssekretär in Anwesenheit des Bundesministers der Verteidigung.",Christian Schmidt,,data/txt/17249.txt,"Christian Schmidt, Parl. Staatssekretär beim Bundesminister der Verteidigung",,speech
459480,249,17,0,611,"Herr Bartels, Sie haben eine Nachfrage. Bitte.",Katrin Göring-Eckardt,,data/txt/17249.txt,Vizepräsidentin Katrin Göring-Eckardt,,chair
459481,249,17,0,612,"Meine erste Nachfrage lautet: Nach meinem Kenntnisstand hat es zwei Verhandlungsrunden gegeben, auf der einen Seite Thomas Enders von EADS und auf der anderen Seite Bundesminister de Maizière. Können Sie, Herr Staatssekretär, das bestätigen?",Dr. Hans-Peter Bartels,,data/txt/17249.txt,Dr. Hans-Peter Bartels (SPD),spd,speech
459482,249,17,0,613,"Das kann ich nicht bestätigen. Ich kann bestätigen, dass es - die genaue Zahl kann ich nicht nennen; die müsste ich nachreichen, soweit sie von Relevanz für die Auskunft ist - Gespräche zwischen dem Vorstandsvorsitzenden der EADS, Tom Enders, und dem Bundesminister der Verteidigung gegeben hat. Die Verhandlungen bis hin zum 15. März wurden vom Staatssekretär für Rüstung, Herrn Staatssekretär Beemelmans, geführt.

Auf der anderen Seite - das rein nachrichtlich; das müsste ich noch verifizieren - war grundsätzlich Lutz Bertling, der damalige Vorstandsvorsitzende von Eurocopter, zu finden.",Christian Schmidt,,data/txt/17249.txt,"Christian Schmidt, Parl. Staatssekretär beim Bundesminister der Verteidigung",,speech
459483,249,17,0,614,Ihre zweite Nachfrage. Bitte schön.,Katrin Göring-Eckardt,,data/txt/17249.txt,Vizepräsidentin Katrin Göring-Eckardt,,chair
459484,249,17,0,615,"Vielen Dank. - Die zweite Nachfrage bezieht sich auf das Kompensationsgeschäft innerhalb dieses Hubschrauberdeals, der eine Reduzierung bei den 202 Hubschraubern, die ursprünglich in Auftrag gegeben wurden, um 45 Hubschrauber, die jetzt nicht abgenommen werden, vorsieht. Von denen, die jetzt abgenommen werden, sollen 18 Hubschrauber für die Marine verwendet werden. Sind diese Hubschrauber bewaffnet?",Dr. Hans-Peter Bartels,,data/txt/17249.txt,Dr. Hans-Peter Bartels (SPD),spd,speech
459485,249,17,0,616,"Lieber Herr Kollege, Sie sprechen von 202 Hubschraubern. Ich habe noch die Zahl 212 in Erinnerung. - Moment! Da habe ich mich getäuscht. Das sind die 212 Tiger-Hubschrauber, die noch Rudolf Scharping bestellt hatte und die von Peter Struck dann auf 80 reduziert worden sind. Entschuldigung, das war jetzt ein Missverständnis. Sie meinen beide, NH90 und Tiger, in der Konfiguration, die Peter Struck vereinbart hatte.",Christian Schmidt,,data/txt/17249.txt,"Christian Schmidt, Parl. Staatssekretär beim Bundesminister der Verteidigung",,speech
459486,249,17,0,617,Genau! 122 plus 80!,Dr. Hans-Peter Bartels,,data/txt/17249.txt,Dr. Hans-Peter Bartels [SPD],spd,poi
459487,249,17,0,618,"- Genau. 122 NH90-Hubschrauber und 80 sogenannte Unterstützungshubschrauber Tiger.

Die 18 Marinehubschrauber MH90 sind nicht aus der gleichen Serie, aber aus dem gleichen Programm und haben eine spezielle Marinetauglichkeit. Der MH90 ist ein Hubschrauber, der an die Notwendigkeiten der Marine - ich nenne als Beispiel das Radar - angepasst wird.

Er wird in beschränktem Rahmen über Bekämpfungsmöglichkeiten verfügen.

Ich gehe davon aus - ohne dass ich Ihnen das jetzt bestätigen kann; eventuell konnten Sie es schon im Verteidigungsausschuss eruieren; ich werde Ihnen eine eindeutige Antwort nachliefern -, dass er zumindest Möglichkeiten zur Bewaffnung hat.

Habe ich jetzt die beiden Nachfragen beantwortet, oder habe ich eine versteckte zusätzliche halbe Nachfrage übersehen, Herr Kollege?",Christian Schmidt,,data/txt/17249.txt,"Christian Schmidt, Parl. Staatssekretär beim Bundesminister der Verteidigung",,speech
459488,249,17,0,619,Es gibt ja nur zwei Nachfragen. Eine halbe Nachfrage gibt es nicht.,Katrin Göring-Eckardt,,data/txt/17249.txt,Vizepräsidentin Katrin Göring-Eckardt,,chair
459489,249,17,0,620,Ich habe verstanden: mehr oder weniger Bewaffnung!,Dr. Hans-Peter Bartels,,data/txt/17249.txt,Dr. Hans-Peter Bartels [SPD],spd,poi
459490,249,17,0,621,,Katrin Göring-Eckardt,,data/txt/17249.txt,Vizepräsidentin Katrin Göring-Eckardt,,chair
459491,249,17,0,622,"Frau Präsidentin, wir sind am Ende der Legislaturperiode, und ich wollte im Sinne einer gewissen immer noch bestehenden parlamentarischen Großzügigkeit -",Christian Schmidt,,data/txt/17249.txt,"Christian Schmidt, Parl. Staatssekretär beim Bundesminister der Verteidigung",,speech
459492,249,17,0,623,"Milde, milde.",Katrin Göring-Eckardt,,data/txt/17249.txt,Vizepräsidentin Katrin Göring-Eckardt,,chair
459493,249,17,0,624,- auch eine halbe Nachfrage beantworten.,Christian Schmidt,,data/txt/17249.txt,"Christian Schmidt, Parl. Staatssekretär beim Bundesminister der Verteidigung",,speech
459494,249,17,0,625,Wir verstehen uns gut!,Dr. Hans-Peter Bartels,,data/txt/17249.txt,Dr. Hans-Peter Bartels [SPD],spd,poi
459495,249,17,0,626,,Christian Schmidt,,data/txt/17249.txt,"Christian Schmidt, Parl. Staatssekretär beim Bundesminister der Verteidigung",,speech
459496,249,17,0,627,"Das ist schön, Herr Bartels.

Ich rufe die Frage 2, ebenfalls des Kollegen Bartels, auf:

Gibt es Verzögerungen oder zeichnen sich Hindernisse ab, die zu Verzögerungen führen können, beim geplanten und vom Bundesministerium der Verteidigung angewiesenen Outsourcing von 2 500 Mitarbeiterinnen und Mitarbeitern der Wehrverwaltung mit ihren Bundeswehraufgaben in die Geschäftsbereiche des Bundesministeriums der Finanzen bzw. des Bundesministeriums des Innern?",Katrin Göring-Eckardt,,data/txt/17249.txt,Vizepräsidentin Katrin Göring-Eckardt,,chair
459497,249,17,0,628,"Herr Kollege, Ihre Frage beantworte ich wie folgt: Die Verlagerung der Aufgaben bei der Personalabrechnung der Bundeswehr in die Geschäftsbereiche des Bundesministeriums des Innern und des Bundesministeriums der Finanzen wird wie geplant zum 1. Juli 2013, also zum kommenden Montag, realisiert. Die wesentlichen organisatorischen und sonstigen Vorbereitungen konnten erfolgreich abgeschlossen werden.

Aber auch nach dem Verlagerungszeitpunkt werden noch Arbeiten durchzuführen sein. Das liegt auch daran, dass die Zustimmung der örtlichen Personalvertretungen zu den einzelnen Personalmaßnahmen bisher noch aussteht. Infolgedessen kann das Personal nicht zum 1. Juli 2013 in die Geschäftsbereiche der aufnehmenden Ressorts abgeordnet oder versetzt werden. Diese Personen werden deshalb bis zum Abschluss dieser Verfahren als Beschäftigte der Bundeswehrverwaltung die aufnehmenden Behörden in ihrer Aufgabenwahrnehmung unterstützen. Absicht ist es, noch in dieser Woche, tunlichst vor dem 1. Juli 2013, eine entsprechende Vereinbarung zwischen den betroffenen Ressorts zu zeichnen.",Christian Schmidt,,data/txt/17249.txt,"Christian Schmidt, Parl. Staatssekretär beim Bundesminister der Verteidigung",,speech
459498,249,17,0,629,"Sie haben eine Nachfrage, Herr Bartels. Bitte schön.",Katrin Göring-Eckardt,,data/txt/17249.txt,Vizepräsidentin Katrin Göring-Eckardt,,chair
459499,249,17,0,630,"Auf welcher Rechtsgrundlage werden die abzuordnenden Kollegen, die zwar nicht abgeordnet werden können, von den aufnehmenden Dienststellen aber aufgenommen werden, diese in der Wahrnehmung ihrer Aufgaben unterstützen? Was ist also die Rechtsgrundlage?",Dr. Hans-Peter Bartels,,data/txt/17249.txt,Dr. Hans-Peter Bartels (SPD),spd,speech
459500,249,17,0,631,"Ich denke, auf der Grundlage einer Ressortvereinbarung, die unbenommen lässt, dass der rechtliche Status der Betreffenden so ist, wie er gegenwärtig ist, vorbehaltlich der entsprechenden Maßnahmen, durch die die Mitwirkung der Personalvertretungen gewährleistet ist. Erst wenn dies der Fall ist, kann das Ganze realisiert werden. Was vorher geschieht, ist keine Abordnung, sondern eine Zusammenarbeit zwischen Bundesressorts bei bestimmten Aufgaben. Es ist eine nicht ganz ungewöhnliche Vorstellung, dass sich zwei Bundesressorts in ihrer Aufgabenerfüllung durchaus unterstützen können.",Christian Schmidt,,data/txt/17249.txt,"Christian Schmidt, Parl. Staatssekretär beim Bundesminister der Verteidigung",,speech
459501,249,17,0,632,Haben Sie eine zweite Nachfrage? - Bitte sehr.,Katrin Göring-Eckardt,,data/txt/17249.txt,Vizepräsidentin Katrin Göring-Eckardt,,chair
459502,249,17,0,633,"Wessen Weisungen sind diese nicht abgeordneten Kollegen, die die aufnehmenden Ressorts bei ihrer Aufgabenwahrnehmung unterstützen, unterworfen? Wer gibt ihnen also Weisungen, der Bundesminister der Verteidigung und seine Beauftragten oder der Innenminister?",Dr. Hans-Peter Bartels,,data/txt/17249.txt,Dr. Hans-Peter Bartels (SPD),spd,speech
459503,249,17,0,634,"Frau Präsidentin, gestatten Sie mir ausnahmsweise, eine Frage zu qualifizieren: Dies ist eine sehr spannende Frage. Ich werde mich bemühen, sie in einer Nachreichung auf Grundlage dessen, was in der Vereinbarung festgeschrieben ist, zu beantworten.",Christian Schmidt,,data/txt/17249.txt,"Christian Schmidt, Parl. Staatssekretär beim Bundesminister der Verteidigung",,speech
459504,249,17,0,635,,Katrin Göring-Eckardt,,data/txt/17249.txt,Vizepräsidentin Katrin Göring-Eckardt,,chair
459505,249,17,0,636,"Wie hoch sind die Baukosten, die die Bundeswehr für die geplante Feuerwache auf dem Munitionsdepot der Bundeswehr in Dorsten-Wulfen veranschlagt?

Bitte schön, Herr Staatssekretär.",Wir sind bei der Frage 3 des Kollegen Gerdes,,data/txt/17249.txt,Wir sind bei der Frage 3 des Kollegen Gerdes,,speech
459506,249,17,0,637,"Herr Kollege, Ihre Frage beantworte ich wie folgt: Die Kosten für den Bau der Feuerwache auf dem Munitionsdepot der Bundeswehr in Dorsten-Wulfen sind mit 3,687 Millionen Euro geplant.",Christian Schmidt,,data/txt/17249.txt,"Christian Schmidt, Parl. Staatssekretär beim Bundesminister der Verteidigung",,speech
459507,249,17,0,638,"Herr Gerdes, haben Sie eine Nachfrage? - Das ist nicht der Fall.

Wir kommen zur Frage 4, ebenfalls des Kollegen Gerdes:

Stimmt es, wie in der WAZ vom 7. Juni 2013 berichtet, dass das planende Bundesamt für Infrastruktur, Umweltschutz und Dienstleistungen der Bundeswehr nicht über eine kosteneinsparende Zusammenarbeit vor Ort nachgedacht hat, obwohl sich die zivile Feuerwache in direkter Nachbarschaft zum Munitionsdepot befindet, und besteht die Möglichkeit zu einer militärisch-zivilen Kooperation, zumal der Bau der Feuerwache auf dem Militärgelände erst 2014 beginnen soll?",Katrin Göring-Eckardt,,data/txt/17249.txt,Vizepräsidentin Katrin Göring-Eckardt,,chair
459508,249,17,0,639,"Herr Kollege, Ihre zweite Frage beschäftigt sich mit der Möglichkeit einer Kooperation. Hierzu muss ich nochmals etwas Bewertendes sagen: Ich habe Verständnis dafür, wenn man vor Ort sagt: Mensch, hier wird eine Feuerwehr gebaut, und ihr baut auch eine. Kann man das nicht gemeinsam machen? - So verstehe ich die Intention einer sehr pragmatischen und durchaus naheliegenden Überlegung, die jeder anstellen wird, der in politischer und kommunalpolitischer Verantwortung steht.

Trotzdem muss ich die Frage wie folgt beantworten: Von der Regelungs- und Vollzugszuständigkeit im Bereich des abwehrenden Brandschutzes her ist klar, dass die Bundeswehr im Rahmen ihres Auftrags den bundeswehreigenen Brandschutz leisten muss. Das ist immer dann der Fall, wenn es gilt, militärspezifische Gefahren im Bereich des Brandschutzes abzuwehren. Im Rahmen dieser Zuständigkeit hat die Bundeswehr Regelungen in Bezug auf den Brandschutz im eigenen Geschäftsbereich zu treffen. Das hat sie getan. Deswegen hat sie auch Bundeswehr-Feuerwehren aufgestellt. Wenn Verwaltungsgebäude der Bundeswehr irgendwo in einer Stadt stehen, unterliegen die natürlich nicht diesem Brandschutz - es sei denn, bundeswehrspezifische Notwendigkeiten der Gefahrenabwehr stehen dem entgegen.

Im Munitionsdepot in Dorsten-Wulfen ist diese Zuständigkeit wegen des speziellen militärischen Gefahrenpotenzials gegeben. Aufgrund dieses Auftrags ist die unmittelbare Unterbringung der Feuerwache im Mun-Depot notwendig.

Kooperationen sind grundsätzlich erwünscht. Es gibt auch gemeinsame Übungen. Im Rahmen der Amtshilfe beteiligt sich die Bundeswehr-Feuerwehr selbstverständlich auch an Hilfseinsätzen im zivilen Umfeld, kann sich aber in dieser konkreten Situation wegen der Unmittelbarkeit bzw. der Nähe zu einem möglichen Gefahrenherd leider nicht auf eine Kooperation einlassen.",Christian Schmidt,,data/txt/17249.txt,"Christian Schmidt, Parl. Staatssekretär beim Bundesminister der Verteidigung",,speech
459509,249,17,0,640,"Haben Sie eine Nachfrage, Herr Gerdes? - Das ist nicht der Fall.

Die Fragen 5 und 6 der Kollegin Keul werden schriftlich beantwortet.

Dann sind wir beim Geschäftsbereich des Bundesministeriums für Familie, Senioren, Frauen und Jugend. Der Parlamentarische Staatssekretär Dr. Hermann Kues steht zur Beantwortung zur Verfügung.

Die Frage 7 der Kollegin Humme wird schriftlich beantwortet.

Wir kommen zur Frage 8 der Kollegin Humme:

Hält die Bundesregierung Maßnahmen für erforderlich und, wenn ja, welche, um den Effekt, dass die Entlastungen von Paaren durch das Ehegattensplitting, die zum großen Teil bei Familien im oberen Einkommensbereich anfallen, und unabhängig davon, ob Kinder in der Ehe leben oder nicht, zu verringern?",Katrin Göring-Eckardt,,data/txt/17249.txt,Vizepräsidentin Katrin Göring-Eckardt,,chair
459510,249,17,0,641,"Frau Kollegin Humme, ich beantworte die Frage gern. Das Ehegattensplitting kommt vorwiegend Familien zugute. Etwa 90 Prozent des Splittingvolumens entfällt auf Ehepaare, die aktuell Kinder haben oder die Kinder hatten. Nach der Rechtsprechung des Bundesverfassungsgerichtes ist dies keine beliebig veränderbare Steuervergünstigung, sondern eine an dem Schutzgebot des Art. 6 Abs. 1 des Grundgesetzes und der wirtschaftlichen Leistungsfähigkeit der Ehegatten orientierte, sachgerechte Besteuerung. Dieses Verfahren berücksichtigt die gegenseitigen Unterhaltsverpflichtungen der Partner im Rahmen der Ehe, und es dient auch - so sagt das Bundesverfassungsgericht - der hervorgehobenen Gewährleistung der Gestaltungsfreiheit im Hinblick auf die persönliche und wirtschaftliche Lebensführung und ist in diesem Sinne Ausdruck der Gleichwertigkeit von Familienarbeit und Erwerbstätigkeit.

In seinem jüngsten Beschluss vom 7. Mai 2013 - das ist noch nicht ganz so lange her - hält das Bundesverfassungsgericht dies noch einmal fest. Ich erlaube mir, dies wörtlich zu zitieren. Dort heißt es:

Art. 6 Abs. 1 GG garantiert den Eheleuten eine Sphäre privater Lebensgestaltung, die staatlicher Einwirkung entzogen ist ...

Es heißt weiter:

Der Gesetzgeber muss daher Regelungen vermeiden, die geeignet sind, in die freie Entscheidung der Ehegatten über ihre Aufgabenverteilung in der Ehe einzugreifen ...

Schließlich stellt das Bundesverfassungsgericht fest, es habe schon früher hervorgehoben, dass in diesem Bereich auch die Entscheidung darüber fällt,

ob ein Ehepartner sich ausschließlich dem Haushalt und der Erziehung der Kinder widmen oder beruflich tätig sein und eigenes Einkommen erwerben will. Der besondere verfassungsrechtliche Schutz von Ehe und Familie erstreckt sich

- so heißt es dort -

auf die ""Alleinverdienerehe"" daher ebenso wie auf die ""Doppelverdienerehe"" ... und schließt es aus, dass Ehegatten zu einer bestimmten Gestaltung ihrer Ehe gedrängt werden.

Vor diesem Hintergrund der Rechtsprechung des Bundesverfassungsgerichts sieht die Bundesregierung keine Möglichkeit, das Splittingverfahren bei der Zusammenveranlagung der Ehegatten grundlegend zu modifizieren.",Dr. Hermann Kues,,data/txt/17249.txt,"Dr. Hermann Kues, Parl. Staatssekretär bei der Bundesministerin für Familie, Senioren, Frauen und Jugend",,speech
459511,249,17,0,642,"Frau Kollegin, Sie haben eine Nachfrage. Bitte schön.",Katrin Göring-Eckardt,,data/txt/17249.txt,Vizepräsidentin Katrin Göring-Eckardt,,chair
459512,249,17,0,643,"Schönen Dank, Herr Kollege. - Ich denke, Sie haben gerade darstellen wollen, dass das Ehegattensplitting dazu führt, dass man in der Familie die Wahlfreiheit hat, die Arbeit aufzuteilen. Aber die Bundesregierung hat in einem Evaluationsmodul zur Förderung und zum Wohlergehen von Kindern wieder einmal festgestellt, dass das Ehegattensplitting in seiner derzeitigen Form negative Auswirkungen auf das Arbeitsangebot für Mütter und auf die Bildungsangebote für Kinder hat. Das ist eine Feststellung aus den Untersuchungen der Bundesregierung. Wie passt das zu den Äußerungen, die Sie gerade gemacht haben?",Christel Humme,,data/txt/17249.txt,Christel Humme (SPD),spd,speech
459513,249,17,0,644,"Sie zitieren einen Satz aus einer sehr umfangreichen Untersuchung, die insgesamt 3 500 Seiten umfasst. In dieser Untersuchung wird mit bestimmten Hypothesen gearbeitet, die überprüft werden. Dies sind aber keine Aussagen im Hinblick auf verfassungsrechtliche und politische Zusammenhänge.

Diese Expertise, die Sie zum Teil sicherlich kennen, enthält im Übrigen Feststellungen von Fachleuten aus unterschiedlichen Disziplinen. Diese Fachleute machen aber nicht die Politik. Die Politik wird vom Parlament und von der Bundesregierung gemacht. Letztendlich entscheidet die Bevölkerung, welche Politik sie möchte.",Dr. Hermann Kues,,data/txt/17249.txt,"Dr. Hermann Kues, Parl. Staatssekretär bei der Bundesministerin für Familie, Senioren, Frauen und Jugend",,speech
459514,249,17,0,645,"Frau Humme, Sie haben eine zweite Nachfrage. Bitte sehr.",Katrin Göring-Eckardt,,data/txt/17249.txt,Vizepräsidentin Katrin Göring-Eckardt,,chair
459515,249,17,0,646,"Es ist richtig: Die Fachleute beraten natürlich die Politik und haben umfangreiche Untersuchungen gemacht. Sie sagen selber, das Werk ist über 3 000 Seiten lang. In diesem wurden viele Erkenntnisse, gerade zum Ehegattensplitting, hervorgehoben, zum Beispiel auch die Tatsache, dass die Familienförderung, die Sie in Ihrer ersten Antwort angesprochen haben, sehr unsozial ist, weil mittlerweile 30 Prozent der Kinder in Familienzusammenhängen ohne Trauschein wohnen. Sehen Sie nicht auch, dass hier ein soziales Ungleichgewicht bei der Familienförderung geschaffen wird?",Christel Humme,,data/txt/17249.txt,Christel Humme (SPD),spd,speech
