id,sitzung,wahlperiode,in_writing,sequence,text,speaker_cleaned,speaker_fp,filename,speaker,speaker_party,type
481223,13,18,0,429,"Danke. Ich kann es kurz machen. - Sie haben zwei Kriterien angeführt. Sie haben angegeben, dass der Kennzeichnungsschwellenwert bisher 0,03 Gramm je Kilogramm beträgt. Der Schwellenwert für die Verpflichtung zur Kennzeichnung liegt ja mit 0,9 Prozent höher. Jetzt muss ich darauf hinweisen, dass dieser Schwellenwert von 0,03 Gramm auf Basis der Tatsache festgelegt wurde, dass es in der Vergangenheit so gut wie keinen Gentechnikanbau in Deutschland gegeben hat. Was soll denn nach Auffassung der Bundesregierung eigentlich aus diesem Wirtschaftszweig werden, wenn es einen solchen Anbau gibt? Gerade eben hat die Bundesregierung mit ihrer Enthaltung im Zusammenhang mit der Zulassung von Genmais 1507 einen Beitrag dazu geleistet, dass es einen entsprechenden Anbau in Europa gibt. Wir müssen schauen, wie in Zukunft die Situation der Imker und ihres Honigs sein wird, wenn dieser Schwellenwert etwa erreicht wird - was oft nebenher geschieht. Es kann durchaus sein, dass das für sie unzumutbare finanzielle Belastungen zur Folge hätte.",Renate Künast,,data/txt/18013.txt,Renate Künast (BÜNDNIS 90/DIE GRÜNEN),gruene,speech
481224,13,18,0,430,"Liebe Frau Kollegin Künast, ich verstehe Ihre Sorge. Allerdings haben wir uns, was den Sachverhalt angeht, falsch verstanden. Die 0,03 Gramm sind keineswegs ein Grenzwert oder ein Schwellenwert.",Dr. Maria Flachsbarth,,data/txt/18013.txt,"Dr. Maria Flachsbarth, Parl. Staatssekretärin beim Bundesminister für Ernährung und Landwirtschaft",,speech
481225,13,18,0,431,Ich habe das richtig verstanden!,Renate Künast,,data/txt/18013.txt,Renate Künast [BÜNDNIS 90/DIE GRÜNEN],gruene,poi
481226,13,18,0,432,"Vielmehr ist es so, dass der Anteil des Pollens im Honig im Normalfall ungefähr nur 0,03 Gramm je Kilogramm Honig beträgt. Das ist ein Fakt.",Dr. Maria Flachsbarth,,data/txt/18013.txt,"Dr. Maria Flachsbarth, Parl. Staatssekretärin beim Bundesminister für Ernährung und Landwirtschaft",,speech
481227,13,18,0,433,"Es gibt auch Leute, die Pollen verkaufen!",Renate Künast,,data/txt/18013.txt,Renate Künast [BÜNDNIS 90/DIE GRÜNEN],gruene,poi
481228,13,18,0,434,"- Ja, das ist so. Wir sprachen im Zusammenhang mit der Honigrichtlinie aber über Honig und nicht über reinen Pollen, der verkauft werden soll. In Bezug darauf hatte ich Ihnen die relevanten Grenzwerte genannt. Diese Grenzwerte sind durch die verfügbare Analysetechnik nicht nachweisbar. Von daher stehen wir vor einer Pro-blematik, die nicht ausschließlich politisch, sondern auch materiell begründet ist.",Dr. Maria Flachsbarth,,data/txt/18013.txt,"Dr. Maria Flachsbarth, Parl. Staatssekretärin beim Bundesminister für Ernährung und Landwirtschaft",,speech
481229,13,18,0,435,"Vielen Dank, Frau Staatssekretärin. - Wir sind damit am Ende der Fragestunde. Die übrigen Fragen werden entsprechend unseren Regeln schriftlich beantwortet.

Ich rufe den Zusatzpunkt 1 auf:

Aktuelle Stunde

auf Verlangen der Fraktion DIE LINKE

Haltung der Bundesregierung zur strafbefreienden Selbstanzeige bei Steuerhinterziehung

Ich eröffne die Aussprache. Das Wort hat der Kollege Klaus Ernst für die Fraktion Die Linke.",Petra Pau,,data/txt/18013.txt,Vizepräsidentin Petra Pau,,chair
481230,13,18,0,436,Beifall bei der LINKEN,,,data/txt/18013.txt,,,poi
481231,13,18,0,437,,Petra Pau,,data/txt/18013.txt,Vizepräsidentin Petra Pau,,chair
481232,13,18,0,438,"Frau Präsidentin! Meine sehr verehrten Damen und Herren! Es geht uns um die Frage, wie wir die strafbefreiende Selbstanzeige künftig regeln wollen. Wollen wir als Staat solche Straftaten nicht mehr ahnden? Damit entsteht sogar der Eindruck, als würde der Staat alles tun, um insbesondere Vermögende vor einer Strafverfolgung zu schützen. Das ist jedenfalls der Eindruck, der draußen im Land entsteht.

Wie sonst ist es erklärbar, dass man bei vorsätzlicher Steuerhinterziehung, Beispiele Alice Schwarzer und Hoeneß, durch Selbstanzeige einer eindeutigen Straftat - zu der man sich selbst auch noch bekannt hat - einer Strafe entgehen kann? Wie sonst ist es erklärbar, dass eine Strafverfolgung unterbleibt, selbst dann, wenn der hinterzogene Betrag 50 000 Euro übersteigt und damit nach dem Gesetz eigentlich eine Straffreiheit ausgeschlossen wäre - wenn der Betrüger nach § 398 a der Abgabenordnung doch noch seine Steuern zahlt plus, sagen wir, 5 Prozent Freikaufgebühr? Bei den Bürgern muss doch der Eindruck entstehen: Aha, wer Kohle hat, der kann sich irgendwie freikaufen.

Stellen Sie sich vor: Jemand knackt einen Geldautomaten und holt sich 10 000 Euro raus. Auf dem Nachhauseweg fällt ihm ein: Hoppla, ich könnte vielleicht gefilmt worden sein. - Nun bringt er die 10 000 Euro zurück und sagt: Das war zwar eine Straftat; ich zahle aber 500 Euro. - Bleibt er dann auch straffrei? Wo ist eigentlich der Unterschied zwischen demjenigen, der sich Geld aus einem manipulierten Geldautomaten holt, und demjenigen, der Steuern hinterzogen hat? Ich kann keinen erkennen.",Klaus Ernst,,data/txt/18013.txt,Klaus Ernst (DIE LINKE),linke,speech
481233,13,18,0,439,Beifall bei der LINKEN,,,data/txt/18013.txt,,,poi
481234,13,18,0,440,"Warum ist Ladendiebstahl eine Straftat und hat gegebenenfalls gravierende Folgen, während ein Steuerhinterzieher oft nicht einmal vorbestraft ist, obwohl er zigtausend Euro hinterzogen hat?

Meine Damen und Herren, die Argumente des Finanzministers sind mir bekannt. Herr Schäuble, Sie sagen: Durch die Selbstanzeige wird dem Staat letztendlich die Möglichkeit gegeben, Millionen in seine Kassen zu bekommen, die er sonst nicht erhalten würde. - Aber, Herr Schäuble, ist es wirklich die Möglichkeit der Selbstanzeige, die zu Steuerehrlichkeit führt, oder ist es nicht vielmehr die Angst desjenigen, der die Steuern hinterzogen hat, entdeckt zu werden, weil der Staat inzwischen, jedenfalls einige Länder, Gott sei Dank und richtigerweise Steuer-CDs kauft?",Klaus Ernst,,data/txt/18013.txt,Klaus Ernst (DIE LINKE),linke,speech
481235,13,18,0,441,Beifall bei der LINKEN,,,data/txt/18013.txt,,,poi
481236,13,18,0,442,"Ich kann Ihr Argument nicht ernst nehmen, weil Sie auf der einen Seite sagen, dass der Staat Geld einnehmen soll, sich auf der anderen Seite aber immer vehement dagegen gewehrt haben, dass der Staat Steuer-CDs aufkauft. Herr Schäuble, Sie müssen sich entscheiden, was Sie wollen: Wenn Sie die Kohle wollen, dann müssen Sie auch dafür sorgen, dass die Kohle reinkommen kann. Mit dem Ankauf von Steuer-CDs erreichen wir bei weitem mehr als durch die strafbefreiende Selbstanzeige bei Steuerhinterziehung, die Sie gegenwärtig verteidigen.",Klaus Ernst,,data/txt/18013.txt,Klaus Ernst (DIE LINKE),linke,speech
481237,13,18,0,443,Beifall bei der LINKEN,,,data/txt/18013.txt,,,poi
481238,13,18,0,444,"Ähnlich ist es mit dem Steuerabkommen mit der Schweiz; Herr Schäuble, auch das muss ich sagen. Man konnte den Eindruck gewinnen, dass Sie wirklich an das Geld herankommen wollten. Bei dem Steuerabkommen mit der Schweiz ging es aber um nichts anderes als darum, die Anonymität der Straftäter zu wahren. Wir unterscheiden offensichtlich Straftäter im Steuersystem mit entsprechenden Einkommen von allen anderen Straftätern. Das ist nicht akzeptabel, Herr Schäuble.",Klaus Ernst,,data/txt/18013.txt,Klaus Ernst (DIE LINKE),linke,speech
481239,13,18,0,445,Beifall bei der LINKEN sowie bei Abgeordneten des BÜNDNISSES 90/DIE GRÜNEN,,,data/txt/18013.txt,,,poi
481240,13,18,0,446,"Deshalb möchte ich hier noch einmal eindeutig sagen: Die strafbefreiende Selbstanzeige gehört abgeschafft. Gleichzeitig muss geregelt werden, dass Bagatelldelikte - die gibt es ja auch; die sind jetzt auch in dieser Regelung enthalten - ausgenommen bleiben, sodass wir nicht den Kleinen erwischen, sondern die Großen, die von der strafbefreienden Selbstanzeige Gebrauch machen.

Der Bundesrepublik gehen nach Angaben der Deutschen Steuer-Gewerkschaft jährlich circa 50 Milliarden Euro durch Steuerhinterziehung verloren. Das ist ein Sechstel des Bundeshaushalts. Eine Klimaveränderung ist notwendig: Es muss klar sein, dass Steuerhinterziehung kein Bagatelldelikt ist. Das wird insbesondere dadurch erreicht, dass man den Straftatbestand der Steuerhinterziehung als solchen wertet und die Steuerbetrüger nicht mit allen möglichen Tricks letztendlich straffrei stellt. Das kann nicht sein.",Klaus Ernst,,data/txt/18013.txt,Klaus Ernst (DIE LINKE),linke,speech
481241,13,18,0,447,Beifall bei der LINKEN,,,data/txt/18013.txt,,,poi
481242,13,18,0,448,"Steuergerechtigkeit ist notwendig: Wer betrügt, wird bestraft. Auch wenn dieser Grundsatz gilt, sieht das Strafrecht die Möglichkeit zur Unterscheidung vor. Ein Richter kann natürlich unterscheiden: Ist der Täter geständig? Macht er freiwillig Angaben? Das kann der Richter beim Strafmaß berücksichtigen. Aber rechtlich festzulegen, dass ein solcher Täter prinzipiell straffrei bleibt, obwohl er den Straftatbestand erfüllt hat, das geht meines Erachtens überhaupt nicht.",Klaus Ernst,,data/txt/18013.txt,Klaus Ernst (DIE LINKE),linke,speech
481243,13,18,0,449,Beifall bei der LINKEN,,,data/txt/18013.txt,,,poi
481244,13,18,0,450,"Was wir brauchen, sind mehr Steuerfahnder, Herr Schäuble. Wir wissen, dass jeder Steuerfahnder ungefähr das Zwanzigfache von dem hereinbringt, was er kostet. Wo bleibt die Initiative dieser Bundesregierung, damit wir durch mehr Steuerfahnder ein wenig von den 50 Milliarden Euro hereinholen, die uns jährlich verloren gehen?",Klaus Ernst,,data/txt/18013.txt,Klaus Ernst (DIE LINKE),linke,speech
481245,13,18,0,451,Beifall bei Abgeordneten der LINKEN,,,data/txt/18013.txt,,,poi
481246,13,18,0,452,Kein Steuerflüchtling soll sich sicher fühlen. Deshalb brauchen wir mehr Steuer-CDs. Das ist besser als jede Befreiung von der Strafverfolgung.,Klaus Ernst,,data/txt/18013.txt,Klaus Ernst (DIE LINKE),linke,speech
481247,13,18,0,453,Beifall bei der LINKEN,,,data/txt/18013.txt,,,poi
481248,13,18,0,454,,Klaus Ernst,,data/txt/18013.txt,Klaus Ernst (DIE LINKE),linke,speech
481249,13,18,0,455,"Das Wort hat der Bundesminister der Finanzen, Dr. Wolfgang Schäuble.",Petra Pau,,data/txt/18013.txt,Vizepräsidentin Petra Pau,,chair
481250,13,18,0,456,Beifall bei der CDU/CSU,,,data/txt/18013.txt,,,poi
481251,13,18,0,457,,Petra Pau,,data/txt/18013.txt,Vizepräsidentin Petra Pau,,chair
481252,13,18,0,458,"Frau Präsidentin! Meine sehr verehrten Damen und Herren! Herr Kollege Ernst, im Strafrecht gilt generell: Sie hängen keinen, Sie hätten ihn denn. Die erste Voraussetzung, um jemanden, der ein strafbares Verhalten begangen hat, bestrafen zu können, ist, dass man seine Straftat erkennt und ihn ertappt. Daraus ergibt sich der Unterschied, nach dem Sie gefragt haben. Es geht gar nicht nur um die fiskalischen Interessen des Staates.

Zunächst einmal ist das Problem, dass im Steuerrecht etwas ganz anderes gilt als in der sonstigen Rechtsordnung. In Steuerverfahren verlangen wir von allen Steuerpflichtigen eine umfassende Auskunft. Ansonsten gibt es in unserem Rechtsstaat das grundlegende Prinzip, dass niemand sich selbst belasten muss. Daraus ergibt sich ein gewisser Konflikt, der übrigens auch die Debatte um die strafbefreiende Selbstanzeige unter Verfassungsgesichtspunkten ziemlich kompliziert macht. Wenn Sie dieses Problem nicht für Zwecke einer nachvollziehbaren, auch relativ einfachen Polemik nutzen, sondern an einer ernsthaften Sacherörterung interessiert sind, dann müssen Sie sich zunächst mit der folgenden Frage auseinandersetzen: Gesetzt den Fall, wir würden abschaffen, was vor etwa 100 Jahren in den Erzbergerschen Steuerreformen eingeführt worden ist, was wäre dann? Das ist ein bewährtes Rechtsinstitut - das ist ja nicht neu -, und es gab dafür gute Gründe. Ich könnte Ihnen zu Matthias Erzberger viel erzählen. Es hat lange gedauert, bis man seine Verdienste in Berlin einigermaßen gewürdigt hat. Wir haben einen Saal im Bundesfinanzministerium nach ihm benannt. Dies hat er wirklich verdient. - Seitdem gilt das Prinzip, dass man sich nicht selbst belasten muss, im Steuerrecht nicht; denn sonst kann man die steuerlichen Pflichten nicht erfüllen, und Vergehen werden auch nicht entdeckt.

Daraus ergibt sich das Problem: Wir verlangen vom Steuerpflichtigen, dass er seine Verhältnisse vollständig offenbart, damit wir ihn entsprechend den Steuergesetzen besteuern können. Er muss sich also, wenn Sie so wollen, selbst belasten. Im Strafrecht muss er das ausdrücklich nicht. Wenn wir Ihrer Forderung nachkämen, die strafbefreiende Selbstanzeige ersatzlos abzuschaffen, dann, so wette ich, hätten wir in der Mehrzahl der Steuerverfahren folgendes Problem: Die Verteidiger der Angeklagten würden geltend machen, dass das Belastungsmaterial durch Steuererklärungen des Beschuldigten, des Angeklagten erlangt wurde und deswegen strafprozessual nicht verwertbar ist. So würden dann weniger bestraft werden als bisher. Dieses Problem beschäftigt Sie bei Ihrer Polemik nicht. Dies ist ein sachliches Argument; Sie sollten es trotzdem ernst nehmen.",Dr. Wolfgang Schäuble,,data/txt/18013.txt,"Dr. Wolfgang Schäuble, Bundesminister der Finanzen",,speech
481253,13,18,0,459,Beifall bei der CDU/CSU sowie bei Abgeordneten der SPD,,,data/txt/18013.txt,,,poi
481254,13,18,0,460,Und Steuer-CDs? Was ist mit den Steuer-CDs?,Klaus Ernst,,data/txt/18013.txt,Klaus Ernst [DIE LINKE],linke,poi
481255,13,18,0,461,"- Bei Steuer-CDs, Herr Kollege Ernst, sind Sie bei mir nicht an der richtigen Adresse.

Ich habe im Frühjahr 2010 - da war ich erst relativ kurze Zeit Finanzminister - nach einer sorgfältigen Abwägung - der erste Antrag kam vom Land Nordrhein-Westfalen - entschieden, dass wir einem solchen Ankauf von Steuer-CDs zustimmen und die Hälfte der Kosten übernehmen. Wir machen das regelmäßig in einem bewährten Verfahren. Es war eine schwierige Abwägung, weil natürlich diejenigen, die Steuer-CDs verkaufen, nicht zum erfreulichsten Teil der menschlichen Gesellschaft gehören. Sie handeln anonym und mit allen möglichen Tricks. Im Übrigen ist ihr Handeln nach der Rechtsordnung anderer Länder strafbar.

Wir haben unsere Vorstellungen von Datenschutz und Datenmissbrauch bzw. vom Verstoß gegen Datenschutzbestimmungen, und wir müssen Respekt davor haben, dass auch andere derartige Vorstellungen haben. Trotzdem haben wir uns in der Abwägung dafür entschieden. Denn die Globalisierung schafft sehr viele neue Möglichkeiten der Steuerhinterziehung, und solange wir nicht den vollen Informationsaustausch zwischen den einzelnen Ländern haben, ist der Ankauf von Steuer-CDs, von solchen Datensammlungen in der Güterabwägung richtig.

Wir haben diese Entscheidung also getroffen. Wir haben jetzt gerade wieder so entschieden. Der Bund beteiligt sich immer mit 50 Prozent an den Ankaufkosten, obwohl er an dem Mehraufkommen bei der Einkommensteuer nur zu 42,5 Prozent partizipiert. Übrigens tragen nicht alle Länder die restlichen Kosten. Gucken Sie mal nach, ob das Land, in dem Ihre Partei an der Regierung beteiligt ist, sich an den Kosten des Ankaufs beteiligt. Ich bin nicht ganz sicher. Sie können das ja parteiintern klären, Herr Kollege Ernst.",Dr. Wolfgang Schäuble,,data/txt/18013.txt,"Dr. Wolfgang Schäuble, Bundesminister der Finanzen",,speech
481256,13,18,0,462,Da gibt es nicht so viele Millionäre!,Klaus Ernst,,data/txt/18013.txt,Klaus Ernst [DIE LINKE],linke,poi
481257,13,18,0,463,"- Ja, gut. Bei Ihnen darf man nicht so genau hinschauen.",Dr. Wolfgang Schäuble,,data/txt/18013.txt,"Dr. Wolfgang Schäuble, Bundesminister der Finanzen",,speech
481258,13,18,0,464,Beifall bei der CDU/CSU sowie bei Abgeordneten der SPD,,,data/txt/18013.txt,,,poi
481259,13,18,0,465,Der entscheidende Punkt bei der strafbefreienden Selbstanzeige ist natürlich - das müssen wir bedenken; wir haben es mit dem hohen Gut der Steuergerechtigkeit zu tun -: Steuerhinterziehung ist strafbares Unrecht und muss bestraft werden. Nichts anderes gilt. Daran gibt es überhaupt keinen Zweifel.,Dr. Wolfgang Schäuble,,data/txt/18013.txt,"Dr. Wolfgang Schäuble, Bundesminister der Finanzen",,speech
481260,13,18,0,466,Beifall bei der CDU/CSU und der SPD sowie bei Abgeordneten des BÜNDNISSES 90/DIE GRÜNEN,,,data/txt/18013.txt,,,poi
481261,13,18,0,467,"Über die Ausreden, die ich zum Teil höre, muss ich schon fast mit einer gewissen Milde sagen: Na ja, wenn man in einer blöden Lage ist, sagt man manchmal viele dumme Sachen. - Die meisten haben öffentlich Ausreden gebraucht, die ihre Lage nicht besser, sondern schlechter gemacht haben.",Dr. Wolfgang Schäuble,,data/txt/18013.txt,"Dr. Wolfgang Schäuble, Bundesminister der Finanzen",,speech
481262,13,18,0,468,Beifall bei Abgeordneten der SPD,,,data/txt/18013.txt,,,poi
481263,13,18,0,469,"Auch das ist wahr. Aber das will ich hier nicht kommentieren.

Wir müssen uns ernsthaft damit beschäftigen. Wir müssen immer wieder das Rechtsinstitut, das wir haben, prüfen. Aber wenn wir Steuergerechtigkeit verwirklichen wollen, müssen wir einen Anreiz geben für die Menschen, die Steuern hinterzogen haben und deren Tat nicht entdeckt ist und mit einer hohen Wahrscheinlichkeit unentdeckt verjähren würde. Wenn es unentdeckt verjährt, würden sie nie zahlen; das wäre auch nicht Steuergerechtigkeit. Deswegen müssen wir ihnen ein Angebot machen, unter Zahlung einer Strafe nicht strafverfolgt zu werden. Sie müssen Strafe zahlen; das bleibt strafbares Unrecht. Es ist nach der Systematik der Gesetzesänderung, die wir 2011 gemacht haben, nur ein Strafverfolgungshinderungsgrund. Sie müssen mehr zahlen - als eine Art pauschalierte Strafe. Wir machen ihnen das Angebot, sich zu stellen, obwohl sie nicht entdeckt sind.

Wenn sie bereits entdeckt sind, können sie von der Vergünstigung der strafbefreienden Selbstanzeige keinen Gebrauch mehr machen. Die Frage ist: Was ist mit denen, die sich nicht stellen oder nicht kooperieren wollen? Ich habe gerade an einer Fernsehsendung teilgenommen, in der auch eine Staatsanwältin zugegen war, die gesagt hat: Wenn die nicht kooperieren, dann wird es schwer, sie zu kriegen. - Deswegen müssen wir schauen, wie wir sie dazu kriegen.",Dr. Wolfgang Schäuble,,data/txt/18013.txt,"Dr. Wolfgang Schäuble, Bundesminister der Finanzen",,speech
481264,13,18,0,470,Beugehaft!,Dr. h. c. Hans Michelbach,,data/txt/18013.txt,Dr. h. c. Hans Michelbach [CDU/CSU],cducsu,poi
481265,13,18,0,471,"Aber das ist eine andere Debatte, die ich hier nicht führen will.

Und dann muss man immer wieder prüfen, ob angesichts der Entwicklung der Verhältnisse die Regelung noch dem Gerechtigkeitsempfinden der Bevölkerung entspricht. Deswegen haben wir das Gesetz im Jahre 2011 verschärft. Es ist komplizierter geworden: Wer die strafbefreiende Wirkung will, muss jetzt vollständig alles aufdecken.

Nachdem im vergangenen Jahr einige Fälle von Steuerhinterziehung die Öffentlichkeit wieder sehr beschäftigt hatten, haben wir uns in der Finanzministerkonferenz der Bundesländer - Steuerverwaltung ist Ländersache - mit dieser Frage beschäftigt. Es ging unter anderem darum, wie viele Steuerfahnder die Länder beschäftigen. Der Einzige, der sich dazu vernünftigerweise nicht äußern sollte, ist der Bundesfinanzminister: weil ihm die Länder sonst unkollegiales Verhalten vorwerfen. Steuerverwaltung ist Ländersache; das ist so, Herr Kollege Ernst. Ich bin nicht der Aufseher der Bundesländer - das entspricht nicht unserem föderalen Verständnis -, vielmehr haben die Länder ihre eigene, ihnen vom Grundgesetz zugewiesene Verantwortung. Wir haben damals verabredet, dass die Fachleute - die Steuerabteilungsleiter - einen Bericht darüber erstellen sollen, welche zusätzlichen Maßnahmen man vernünftigerweise ergreifen kann, ohne das Kind mit dem Bade auszuschütten. Der Bericht der Fachleute liegt vor, und die Staatssekretäre bzw. die Finanzminister werden sich demnächst damit beschäftigen. Ich gehe davon aus, dass wir einvernehmlich vorschlagen werden, den Strafzuschlag entsprechend zu verschärfen, und vielleicht, die Frist entsprechend zu verlängern: auf zehn Jahre.

Aber es ist eine gemeinsame Haltung der Finanzministerien von Bund und Ländern, dass man insgesamt an dem bewährten Rechtsinstitut der strafbefreienden Selbstanzeige - mit den Einschränkungen, die ich genannt habe - festhalten sollte. Sonst werden wir weniger Straftäter entdecken. Damit würden wir auch nicht der Gerechtigkeit helfen, allenfalls polemischen Bedürfnissen - aber das ist nicht unsere Verantwortung.

Herzlichen Dank.",Dr. Wolfgang Schäuble,,data/txt/18013.txt,"Dr. Wolfgang Schäuble, Bundesminister der Finanzen",,speech
481266,13,18,0,472,Anhaltender Beifall bei der CDU/CSU,,,data/txt/18013.txt,,,poi
481267,13,18,0,473,Beifall bei der SPD,,,data/txt/18013.txt,,,poi
481268,13,18,0,474,,Dr. Wolfgang Schäuble,,data/txt/18013.txt,"Dr. Wolfgang Schäuble, Bundesminister der Finanzen",,speech
481269,13,18,0,475,Für die Fraktion Bündnis 90/Die Grünen hat nun die Kollegin Lisa Paus das Wort.,Petra Pau,,data/txt/18013.txt,Vizepräsidentin Petra Pau,,chair
481270,13,18,0,476,"Frau Präsidentin! Meine Damen und Herren! Herr Schäuble, auch wenn Sie es gerne verdrängen und es jetzt mit keinem Wort erwähnt haben: Wir führen die heutige Debatte nur aus einem einzigen Grund, und zwar weil die rot-grünen Bundesländer im Bundesrat das deutsch-schweizerische Steuerabkommen gestoppt haben.",Lisa Paus,,data/txt/18013.txt,Lisa Paus (BÜNDNIS 90/DIE GRÜNEN),gruene,speech
481271,13,18,0,477,Beifall beim BÜNDNIS 90/DIE GRÜNEN sowie bei Abgeordneten der SPD,,,data/txt/18013.txt,,,poi
481272,13,18,0,478,"Weder der Fall Hoeneß noch der Fall Schwarzer wären bekannt geworden, wenn das Abkommen mit der Schweiz im Sinne von Finanzminister Schäuble bzw. der Bundesregierung in Kraft getreten wäre. Mit seiner Ablehnung des Steuerabkommens hat der Bundesrat den Weg frei gemacht für einen automatischen Informationsaustausch, europäisch und international.",Lisa Paus,,data/txt/18013.txt,Lisa Paus (BÜNDNIS 90/DIE GRÜNEN),gruene,speech
481273,13,18,0,479,Jetzt zahlen beide weniger!,Dr. Mathias Middelberg,,data/txt/18013.txt,Dr. Mathias Middelberg [CDU/CSU],cducsu,poi
481274,13,18,0,480,Das deutsche Recht kennt die strafbefreiende Selbstanzeige schon seit dem 19. Jahrhundert. Sie hat nicht zu einer nennenswerten Zahl von Selbstanzeigen geführt,Lisa Paus,,data/txt/18013.txt,Lisa Paus (BÜNDNIS 90/DIE GRÜNEN),gruene,speech
481275,13,18,0,481,70 000!,Dr. h. c. Hans Michelbach,,data/txt/18013.txt,Dr. h. c. Hans Michelbach [CDU/CSU],cducsu,poi
481276,13,18,0,482,"und auch nicht zu Milliardenbeträgen an Steuern, die nachgezahlt worden wären. Erst seitdem deutsche Behörden Steuer-CDs ankaufen und der Bundesrat das Steuerabkommen mit der Schweiz abgelehnt und damit den Weg für einen automatischen Informationsaustausch frei gemacht hat, ist die Zahl der Selbstanzeigen gestiegen: 2013 gab es mit 25 000 Selbstanzeigen fast dreimal so viele wie 2012. Das zeigt: Mehr Transparenz ist entscheidend für einen erfolgreichen Kampf gegen Steuerbetrug.",Lisa Paus,,data/txt/18013.txt,Lisa Paus (BÜNDNIS 90/DIE GRÜNEN),gruene,speech
481277,13,18,0,483,Beifall beim BÜNDNIS 90/DIE GRÜNEN,,,data/txt/18013.txt,,,poi
481278,13,18,0,484,"Zu einem erfolgreichen Kampf gegen Steuerhinterziehung gehören allerdings auch staatliche Amtsträger, denen man abnimmt, dass sie bereit sind, sich selbst an die Gesetze zu halten. Der Fall Linssen und der Fall Schmitz - vor allen Dingen der Umgang mit diesen Fällen - zeigen, dass es auch in Teilen der politischen Elite dieses Landes offenbar nach wie vor eine Doppelmoral gibt, die nicht mehr geduldet werden kann.

Damit muss endlich Schluss sein, meine Damen und Herren.",Lisa Paus,,data/txt/18013.txt,Lisa Paus (BÜNDNIS 90/DIE GRÜNEN),gruene,speech
481279,13,18,0,485,Beifall beim BÜNDNIS 90/DIE GRÜNEN sowie bei Abgeordneten der SPD und der LINKEN,,,data/txt/18013.txt,,,poi
481280,13,18,0,486,"Bis vor einem halben Jahr hätte ich vorwegnehmen können, wie eine solche Debatte in diesem Hause verlaufen würde und welche Positionen die Union auf der einen und die SPD auf der anderen Seite vertreten würden. Stellen Sie sich vor, es wäre damals bekannt geworden, dass der Regierende Bürgermeister von Berlin, ein Sozialdemokrat, einen überführten Steuerhinterzieher in seiner Regierungsmannschaft hält. Herr Schmitz hat sich übrigens nicht selbst angezeigt, sondern ist durch eine Steuer-CD überführt worden. Dennoch hielt Klaus Wowereit es nicht für nötig, ein Disziplinarverfahren einzuleiten. Wenn das vor einem halben Jahr bekannt geworden wäre, wären hier die Fetzen geflogen. Was ist heute? Nichts. Ich sage Ihnen: Ich als Berlinerin schäme mich dafür, dass die SPD die Affäre Wowereit in Pofalla-Manier für beendet erklärt und zur Tagesordnung übergehen will. Das werden wir nicht durchgehen lassen.",Lisa Paus,,data/txt/18013.txt,Lisa Paus (BÜNDNIS 90/DIE GRÜNEN),gruene,speech
481281,13,18,0,487,Beifall beim BÜNDNIS 90/DIE GRÜNEN und bei der LINKEN,,,data/txt/18013.txt,,,poi
481282,13,18,0,488,Wir sind hier ja nicht im Abgeordnetenhaus!,Dr. Carsten Sieling,,data/txt/18013.txt,Dr. Carsten Sieling [SPD],spd,poi
481283,13,18,0,489,"Das zeigt eben leider, dass trotz aller Lippenbekenntnisse und starken Worte relevante Teile der SPD Steuerbetrug immer noch für ein Kavaliersdelikt halten.",Lisa Paus,,data/txt/18013.txt,Lisa Paus (BÜNDNIS 90/DIE GRÜNEN),gruene,speech
481284,13,18,0,490,Unfug!,von der SPD,,data/txt/18013.txt,Zuruf von der SPD,spd,poi
