id,sitzung,wahlperiode,in_writing,sequence,text,speaker_cleaned,speaker_fp,filename,speaker,speaker_party,type
481132,13,18,0,338,"Ich glaube, Herr Gehrcke, man darf das nicht auf die militärischen Einsätze verkürzen, wobei militärische Einsätze, wenn es etwa um die Ausbildung der Truppen in Mali geht, etwas anderes sind als ein Kampfeinsatz. Sie wissen auch sehr wohl, dass wir nur in sehr geringem Maße an Kampfeinsätzen beteiligt waren und beteiligt sind.

Insofern muss bei dem Begriff militärische Einsätze immer präzisiert werden, um was es sich handelt. Wir überlegen derzeit, ein Flugzeug, das mit einer medizinischen Intensivstation ausgestattet ist, zur Verfügung zu stellen. Das fällt zwar auch unter das Stichwort militärischer Einsatz, aber damit ist eine große Hilfsaktion verbunden. Insofern muss man sehr viel differenzierter an die Begriffe herangehen.

Aber ich glaube, ich kann mit Fug und Recht sagen, dass der Bundesaußenminister und auch die Bundesverteidigungsministerin - das kann man in den jüngsten Interviews nachlesen - sehr dezidiert darauf abheben, dass man die diplomatischen Möglichkeiten früher nutzen muss, damit es gar nicht erst zur Eskalation kommt. Man muss im Vorfeld wirksam arbeiten. Das bedeutet beispielsweise, Möglichkeiten der Entwicklungshilfe einzusetzen. Ich habe vorhin in der Regierungsbefragung zu dem Stellenwert der auswärtigen Kultur- und Bildungspolitik im Zusammenhang mit der zunehmenden Zahl an Krisen und Konflikten in dieser Welt Stellung genommen.

Wir haben ein vielfältiges Instrumentarium zur Verfügung, das wir in dieser Diskussion in der ganzen Palette und Bandbreite sehen müssen, statt es auf einen einzigen Punkt zu verkürzen und damit auch ein bestimmtes Bild zu malen.",Dr. Maria Böhmer,,data/txt/18013.txt,"Dr. Maria Böhmer, Staatsministerin im Auswärtigen Amt",,speech
481133,13,18,0,339,Sie haben das Wort zur zweiten Nachfrage.,Petra Pau,,data/txt/18013.txt,Vizepräsidentin Petra Pau,,chair
481134,13,18,0,340,"Ich bin gar nicht so scharf darauf, dass dieses Bild an Deutschland hängen bleibt. Ich möchte ganz im Gegenteil ein anderes Bild von Deutschland real und in der Welt gezeichnet haben.

Ich habe eine Frage, die Sie bitte möglicherweise an den Herrn Außenminister, der auch Gegenstand meiner Fragen ist, weiterreichen. Sie haben die Formulierung benutzt, dass für die Bundesregierung der Einsatz von Militär immer die Ultima Ratio, also das letzte Mittel der Vernunft, sein sollte. Ob das immer so ist, bestreite ich.

Der Außenminister hat bei Helmut Ridder in Gießen Völkerrecht studiert, der der renommierteste linke Völkerrechtler in Deutschland war. Würden Sie ihm die Erklärung von Willy Brandt bei der Verleihung des Friedensnobelpreises noch einmal vortragen, dass der Einsatz von Militär nicht Ultima Ratio, sondern Ultima Irratio ist, gerade bei seiner Tradition?",Wolfgang Gehrcke,,data/txt/18013.txt,Wolfgang Gehrcke (DIE LINKE),linke,speech
481135,13,18,0,341,"Sie haben gefragt, ob ich das an den Bundesaußenminister weitergebe. Sie wissen: All das, was wir hier austauschen, wird im Stenografischen Bericht des Bundestages festgehalten. Es ist sogar nachzulesen.",Dr. Maria Böhmer,,data/txt/18013.txt,"Dr. Maria Böhmer, Staatsministerin im Auswärtigen Amt",,speech
481136,13,18,0,342,"Dann kommen wir zur Frage 31 der Kollegin Nicole Gohlke:

Welche Konsequenzen zieht die Bundesregierung aus den Protesten gegen die Einrichtung der Henry-Kissinger-Stiftungsprofessur für Internationale Beziehungen und Völkerrechtsordnung unter besonderer Berücksichtigung sicherheitspolitischer Aspekte an der Rheinischen Friedrich-Wilhelms-Universität Bonn?

Zur Beantwortung steht weiter Frau Staatsministerin Böhmer zur Verfügung.",Petra Pau,,data/txt/18013.txt,Vizepräsidentin Petra Pau,,chair
481137,13,18,0,343,"Frau Kollegin Gohlke, die Bundesregierung teilt die vorgebrachten Bedenken gegen die Benennung der Professur nicht. Mit der Einrichtung der Professur sollen die herausragenden Leistungen des Friedensnobelpreisträgers Henry Kissinger als Wissenschaftler sowie als ehemaliger Nationaler Sicherheitsberater und Außenminister der Vereinigten Staaten von Amerika gewürdigt werden.",Dr. Maria Böhmer,,data/txt/18013.txt,"Dr. Maria Böhmer, Staatsministerin im Auswärtigen Amt",,speech
481138,13,18,0,344,Sie haben das Wort zur ersten Nachfrage.,Petra Pau,,data/txt/18013.txt,Vizepräsidentin Petra Pau,,chair
481139,13,18,0,345,"Vielen Dank. - Frau Staatsministerin, Henry Kissinger wird die mehrfache Beteiligung an Kriegs- und Menschenrechtsverbrechen vorgeworfen, unter anderem die Mitverantwortung für die Bombardements in Laos und Kambodscha, die Unterstützung des indonesischen Überfalls auf Osttimor oder auch seine Beteiligung am Militärputsch in Chile. Jetzt wird von vielfacher Seite gerade auch aus dem Bonner Umfeld und auch aus Bonner Universitätskreisen angemahnt: Solange diese Vorwürfe nicht restlos ausgeräumt sind, kann diese beabsichtigte akademische Ehrung nicht zulässig sein, vor allem weil es sich um einen Lehrstuhl für Völkerrecht handelt. Insbesondere das wird als Provokation aufgefasst.

Wie stehen Sie dazu, dass Kissinger als Vorbild für Wissenschaft und Lehre des Völkerrechts nicht taugt und auch ungeeignet ist, solange diese Vorwürfe nicht ausgeräumt sind?",Nicole Gohlke,,data/txt/18013.txt,Nicole Gohlke (DIE LINKE),linke,speech
481140,13,18,0,346,Sie haben das Wort.,Petra Pau,,data/txt/18013.txt,Vizepräsidentin Petra Pau,,chair
481141,13,18,0,347,"Ich wiederhole gerne, dass die Bundesregierung diese Bedenken nicht teilt, und rücke auch noch einmal in den Blick - nicht umsonst habe ich die Betonung auf dieses Wort gelegt -: Henry Kissinger ist Friedensnobelpreisträger.",Dr. Maria Böhmer,,data/txt/18013.txt,"Dr. Maria Böhmer, Staatsministerin im Auswärtigen Amt",,speech
481142,13,18,0,348,Sie haben die Möglichkeit zu einer zweiten Nachfrage.,Petra Pau,,data/txt/18013.txt,Vizepräsidentin Petra Pau,,chair
481143,13,18,0,349,"Unter diversen Völkerrechtlern sowie in der Friedensforschung ist es unbestritten, dass die Vorwürfe gegen Kissinger nie ausgeräumt werden konnten. Die Bundesregierung hebt bislang darauf ab, dass Kissinger für Deutschland positiv gewirkt habe. Meinen Sie nicht, dass dies ungeachtet dessen, ob man diese Auffassung teilt, die Zahl getöteter und verstümmelter Nichtdeutscher, die infolge seiner Mitwirkung zustande gekommen ist, nicht rechtfertigen kann?",Nicole Gohlke,,data/txt/18013.txt,Nicole Gohlke (DIE LINKE),linke,speech
481144,13,18,0,350,"Sie haben das Wort zur Beantwortung, Frau Staatsministerin.",Petra Pau,,data/txt/18013.txt,Vizepräsidentin Petra Pau,,chair
481145,13,18,0,351,"Frau Kollegin, man kann sagen, dass Henry Kissinger in der Welt ein außerordentlich geachteter Außen- und Sicherheitspolitiker war.",Dr. Maria Böhmer,,data/txt/18013.txt,"Dr. Maria Böhmer, Staatsministerin im Auswärtigen Amt",,speech
481146,13,18,0,352,Ist!,Dr. Franziska Brantner,,data/txt/18013.txt,Dr. Franziska Brantner [BÜNDNIS 90/DIE GRÜNEN],gruene,poi
481147,13,18,0,353,"Dafür, dass ihm der Friedensnobelpreis zuerkannt wurde, dürfte es gute Gründe gegeben haben. Ich sehe die Einrichtung dieser Stiftungsprofessur gerade unter diesem Gesichtspunkt.",Dr. Maria Böhmer,,data/txt/18013.txt,"Dr. Maria Böhmer, Staatsministerin im Auswärtigen Amt",,speech
481148,13,18,0,354,,Petra Pau,,data/txt/18013.txt,Vizepräsidentin Petra Pau,,chair
481149,13,18,0,355,"Was genau versteht die Bundesregierung darunter, wenn sie im Zusammenhang mit der Syrien-Krise humanitäre Korridore einfordert, wie jüngst die Bundeskanzlerin Dr. Angela Merkel beim Besuch des UN-Generalsekretärs Ban Ki-moon am 30. Januar 2014 in Berlin, und mit welchen Mitteln will sie sich zu deren Einrichtung einsetzen?

Bitte, Frau Staatsministerin.",Wir kommen damit zu Frage 32 der Kollegin Dr. Franziska Brantner,,data/txt/18013.txt,Wir kommen damit zu Frage 32 der Kollegin Dr. Franziska Brantner,,speech
481150,13,18,0,356,"Frau Kollegin Brantner, vorrangiges Ziel der deutschen und der internationalen humanitären Hilfe für Syrien ist die Sicherstellung eines ungehinderten Zugangs zu allen bedürftigen Menschen in Syrien, insbesondere in belagerten und umkämpften Gebieten. Diese Gebiete verteilen sich oft kleinteilig über ganz Syrien. Notwendig wären lokal und auch zeitlich begrenzte Maßnahmen, unter anderem die Aushandlung lokaler Waffenstillstände, die Ermöglichung von Hilfslieferungen über Frontlinien hinweg, die Evakuierung von Zivilisten aus belagerten Gebieten, die freie Passage für medizinische Güter und Impfstoffe, der Zugang zu Gefangenen sowie die Ausweitung grenzüberschreitender humanitärer Maßnahmen. Die Ausweitung des humanitären Zugangs kann nur über Vereinbarungen zwischen den beteiligten Konfliktparteien erfolgen.

Die Bundesregierung setzt sich in enger Abstimmung mit wichtigen humanitären Akteuren für die genannten Maßnahmen zur Verbesserung des humanitären Zugangs ein. Dabei werden einerseits eigene Kontakte zur gemäßigten syrischen Opposition genutzt. Andererseits wird im Dialog mit der Russischen Föderation und der Islamischen Republik Iran versucht, den Druck auf das syrische Regime zu verstärken. Wir engagieren uns sowohl im Rahmen des Genf-II-Prozesses als auch in relevanten Foren der Vereinten Nationen, um humanitäre Fortschritte zu erwirken.",Dr. Maria Böhmer,,data/txt/18013.txt,"Dr. Maria Böhmer, Staatsministerin im Auswärtigen Amt",,speech
481151,13,18,0,357,Sie haben das Wort zur ersten Nachfrage.,Petra Pau,,data/txt/18013.txt,Vizepräsidentin Petra Pau,,chair
481152,13,18,0,358,"Danke schön. - Sie haben nicht genau gesagt, was mit dem Wort Korridor gemeint ist. Ich weiß, dass Sie das wahrscheinlich nicht wollen. Erlauben Sie mir aber folgende Nachfrage. Da Sie sich für einen verstärkten humanitären Zugang einsetzen - zumindest das haben Sie bestätigt -: Wird die Bundesregierung dann auch die finanziellen Mittel für die humanitäre Hilfe im Haushalt erhöhen?",Dr. Franziska Brantner,,data/txt/18013.txt,Dr. Franziska Brantner (BÜNDNIS 90/DIE GRÜNEN),gruene,speech
481153,13,18,0,359,"Frau Kollegin, ich darf zunächst einmal etwas zu dem Begriff humanitäre Korridore sagen. Sie haben völlig recht: Wir befinden uns bei der Begrifflichkeit in einer schwierigen Situation. Man muss über die Bedeutung humanitärer Korridore nachdenken. Da sind vielfältige Interpretationsmöglichkeiten wohl gegeben. In unserem Sinne handelt es sich um definierte Routen für Fahrten humanitärer Konvois. In dieser Region ist alles schwierig. Wer die heutige Presseberichterstattung über Homs verfolgt hat, kann nur erschauern. Wir müssen ausloten, wie wir den Menschen dort helfen können.

Jeder von uns hat wahrscheinlich große Hoffnungen auf den Genf-II-Prozess gesetzt. Aber wir haben gesehen, dass es schon dort schwierig war, die Parteien an einen Tisch zu bekommen. Die Möglichkeiten, die nun ausgelotet wurden, um den Menschen in Homs zu helfen, sind auf andere Art und Weise zustande gekommen.

Sie haben nach den finanziellen Mitteln gefragt. Der Haushalt ist vorläufig. Ich hoffe, dass wir schnell Klarheit über den Einsatz der Mittel haben werden. Wie Sie wissen, hat die Bundesregierung ein großes Interesse daran, den Menschen zu helfen, die sich in einer außerordentlich bedrückenden Situation befinden.",Dr. Maria Böhmer,,data/txt/18013.txt,"Dr. Maria Böhmer, Staatsministerin im Auswärtigen Amt",,speech
481154,13,18,0,360,"Dann hoffen wir einmal auf eine Erhöhung der Gelder. - Ich habe eine zweite Nachfrage. Wie Sie gerade erwähnt haben, ist die Situation in Homs mehr als furchtbar. Mehr als 300 Jungen und Männer werden noch immer von Regierungstruppen festgehalten.

Was macht die Bundesregierung, um Russland im Sicherheitsrat umzustimmen, damit endlich die Resolution über den humanitären Zugang im Sicherheitsrat angenommen wird?",Dr. Franziska Brantner,,data/txt/18013.txt,Dr. Franziska Brantner (BÜNDNIS 90/DIE GRÜNEN),gruene,speech
481155,13,18,0,361,"Wir würden es sehr gerne sehen, wenn eine solche Resolution zustande kommt. Sie sprechen direkt Russland an. Sie könnten noch ein weiteres Land nennen. Wir wissen, dass es schwierig ist. Wir werden alles daransetzen, durch Gespräche und Kontakte einen Weg zu ermöglichen. Aber wir haben in der Vergangenheit auch die Erfahrung machen müssen, dass dieser Weg ein sehr langwieriger und schwieriger ist. In einem Fall haben die Bemühungen geholfen. Ich hoffe, dass wir auch in diesem Fall zumindest ein Stück weiterkommen.",Dr. Maria Böhmer,,data/txt/18013.txt,"Dr. Maria Böhmer, Staatsministerin im Auswärtigen Amt",,speech
481156,13,18,0,362,Zu einer Nachfrage hat der Kollege Volker Beck das Wort.,Petra Pau,,data/txt/18013.txt,Vizepräsidentin Petra Pau,,chair
481157,13,18,0,363,"Frau Staatsministerin, wir haben in Syrien einen Bürgerkrieg, einen asymmetrischen Bürgerkrieg. Inwiefern ist denn zu erwarten, dass auf dem Vereinbarungswege Korridore entstehen können, die auch sicher sind und nicht dadurch gefährdet werden, dass sich eine Teilpartei des Konfliktes nicht an die Vereinbarungen hält? Denken Sie darüber nach, wenn es eine Verhandlungslösung gibt, dass diese humanitären Korridore über die Vereinten Nationen militärisch gesichert werden?",Volker Beck,,data/txt/18013.txt,Volker Beck (Köln) (BÜNDNIS 90/DIE GRÜNEN),gruene,speech
481158,13,18,0,364,"Herr Kollege, Sie haben genauso wie wir im Falle von Homs gesehen, dass es eine Vereinbarung gab. Die Lage in Homs ist sehr fragil, was zulasten der Menschen geht. Das Leid ist - ich glaube, das kann man wirklich sagen - unermesslich. Ich glaube, dieses in Zukunft abschätzen zu wollen, ist ein sehr kühner Anspruch. Sie können die Frage nicht beantworten, und ich kann sie auch nicht beantworten. Ich würde das auch nicht wagen. Es verbindet sich viel Hoffnung damit, und es verbindet sich viel Einsatz damit, alles daranzusetzen, den Menschen zu helfen und wirklich gesicherte Wege zu schaffen.

Herr Brahimi macht immer wieder Anläufe, um die Konfliktparteien an einen Tisch zu bekommen. Dafür muss er unsere volle Unterstützung haben. Es handelt sich aber, was die Einschätzung anbetrifft, um mehr als einen Bürgerkrieg.",Dr. Maria Böhmer,,data/txt/18013.txt,"Dr. Maria Böhmer, Staatsministerin im Auswärtigen Amt",,speech
481159,13,18,0,365,"Man muss aber doch eine Antwort auf diese Frage haben, konzeptionell, wenn man so etwas erzählt!",Volker Beck,,data/txt/18013.txt,Volker Beck [Köln] [BÜNDNIS 90/DIE GRÜNEN],gruene,poi
481160,13,18,0,366,,Dr. Maria Böhmer,,data/txt/18013.txt,"Dr. Maria Böhmer, Staatsministerin im Auswärtigen Amt",,speech
481161,13,18,0,367,"Wir kommen nun zur Frage 33 der Kollegin Dr. Franziska Brantner:

Welche konkreten Maßnahmen - bitte aufschlüsseln - hat die Bundesregierung ergriffen, um den Beschluss der EU-Außenminister zum Stopp von Waffenexporten nach Ägypten, den sie am 21. August 2013 auf einem Sondertreffen verabschiedet hatten, umzusetzen?

Bitte, Frau Staatsministerin.",Petra Pau,,data/txt/18013.txt,Vizepräsidentin Petra Pau,,chair
481162,13,18,0,368,"Die Außenminister der Europäischen Union sind hinsichtlich der Arabischen Republik Ägypten am 21. August 2013 übereingekommen, die Genehmigungen für die Ausfuhr von Gütern, die zur internen Repression genutzt werden könnten, auszusetzen und die Genehmigung für die Ausfuhr von Rüstungsgütern zu überprüfen. Dies gilt auch weiterhin.

Die deutschen Zollbehörden wurden bereits vor dem Beschluss der EU-Außenminister angewiesen, keine Ausfuhren von Rüstungsgütern sowie von Gütern, die zum Zwecke der internen Repression verwendet werden können, nach Ägypten abzufertigen und alle Ausfuhrsendungen mit Bestimmungsland Ägypten verstärkten Kontrollmaßnahmen zu unterziehen.

Ab dem 14. August 2013 wurden die Inhaber gültiger Ausfuhrgenehmigungen für Rüstungsgüter nach Ägypten kontaktiert und gebeten, von den Genehmigungen einstweilen keinen Gebrauch zu machen. Dieser Bitte sind die Unternehmen gefolgt.",Dr. Maria Böhmer,,data/txt/18013.txt,"Dr. Maria Böhmer, Staatsministerin im Auswärtigen Amt",,speech
481163,13,18,0,369,Sie haben das Wort zur ersten Nachfrage.,Petra Pau,,data/txt/18013.txt,Vizepräsidentin Petra Pau,,chair
481164,13,18,0,370,"Ein Teil der Vereinbarung im August war es, die Kooperation auch in Sicherheitsfragen zu überprüfen. Daher die Frage: Gibt es noch laufende Projekte der Sicherheitszusammenarbeit mit Ägypten, welche sind das, und mit welcher Begründung werden sie fortgesetzt?",Dr. Franziska Brantner,,data/txt/18013.txt,Dr. Franziska Brantner (BÜNDNIS 90/DIE GRÜNEN),gruene,speech
481165,13,18,0,371,"Frau Kollegin, wenn Sie damit einverstanden sind, würde ich Ihnen das gerne schriftlich geben.",Dr. Maria Böhmer,,data/txt/18013.txt,"Dr. Maria Böhmer, Staatsministerin im Auswärtigen Amt",,speech
481166,13,18,0,372,Haben Sie eine zweite Nachfrage?,Petra Pau,,data/txt/18013.txt,Vizepräsidentin Petra Pau,,chair
481167,13,18,0,373,"Ja. - Ganz konkret: Soweit wir wissen, liegen gerade im Hamburger Hafen Armored Vehicles, also gepanzerte Fahrzeuge, für die ägyptische Marine. Die aktuelle ägyptische Regierung arbeitet stark daran, dass diese ausgeliefert werden und den Hamburger Hafen passieren dürfen. Sind Sie sich dieses Falles bewusst, und tun Sie alles, damit diese Armored Vehicles nicht nach Ägypten gelangen?",Dr. Franziska Brantner,,data/txt/18013.txt,Dr. Franziska Brantner (BÜNDNIS 90/DIE GRÜNEN),gruene,speech
481168,13,18,0,374,Dieser Fall ist mir nicht bekannt; ich bitte um Nachsicht. Ich kann Ihnen nur sagen: Jede Ausfuhr bedarf eines Antrages. Es muss also ein entsprechender Antrag vorliegen. Ich wiederhole: Mir ist dieser Fall nicht bekannt. Aber ich lasse das Ganze gern überprüfen.,Dr. Maria Böhmer,,data/txt/18013.txt,"Dr. Maria Böhmer, Staatsministerin im Auswärtigen Amt",,speech
481169,13,18,0,375,"Die Fragen 34 und 35 des Kollegen Movassat wie auch die Fragen 36 und 37 der Kollegin Pia Zimmermann werden schriftlich beantwortet.

Wir sind damit am Ende des Geschäftsbereiches des Auswärtigen Amtes. Vielen Dank, Frau Staatsministerin, für die Beantwortung der Fragen.

Wir kommen zum Geschäftsbereich des Bundesministeriums des Innern. Zur Beantwortung der Fragen steht der Parlamentarische Staatssekretär Dr. Günter Krings zur Verfügung.

Die Fragen 38 und 39 der Kollegin Wawzyniak wie auch die Frage 40 des Kollegen Hans-Christian Ströbele werden schriftlich beantwortet.

Wir kommen zur Frage 41 der Kollegin Luise Amtsberg:

In wie vielen Fällen mussten gefährdete afghanische Ortskräfte der Bundeswehr, des Auswärtigen Amts und des Bundesministeriums des Innern, die eine Aufnahmezusage erhalten haben, länger als zwei Wochen auf eine Visumerteilung warten (vergleiche die Antwort der Bundesregierung auf meine schriftliche Frage 21 auf Bundestagsdrucksache 18/459), und in wie vielen Fällen warten gefährdete afghanische Ortskräfte derzeit noch auf eine Visumerteilung - bitte jeweils einzeln mit Wartezeit aufschlüsseln -?

Bitte, Herr Staatssekretär.",Petra Pau,,data/txt/18013.txt,Vizepräsidentin Petra Pau,,chair
481170,13,18,0,376,"Ich darf mich zunächst bei Frau Amtsberg bedanken. Ihre Fragen zu diesem Geschäftsbereich sind die einzigen, die mündlich beantwortet werden. Das ist meine Premiere als Parlamentarischer Staatssekretär in der Fragestunde. Insofern freue ich mich, zumindest diese beiden Fragen mündlich beantworten zu dürfen.

Zu Frage 41 - es geht um die Dauer der Visumerteilung -: Das Visumverfahren an der Botschaft Kabul wird erst mit der Visumantragstellung eingeleitet. Mit Stand 7. Februar 2014 haben 56 afghanische Ortskräfte Visumanträge für sich und ihre Familien gestellt. Davon haben bislang 49 Ortskräfte mit insgesamt 111 Familienangehörigen Visa erteilt bekommen. Sieben Visumanträge werden von der Botschaft Kabul derzeit noch bearbeitet. Insgesamt haben 243 afghanische Ortskräfte eine Aufnahmezusage des Bundesministeriums des Innern - eine solche Zusage ist die Stufe, bevor das Visumverfahren beginnt - erhalten. Ihnen steht es mit dieser Aufnahmezusage frei, ein Visum bei der Botschaft zu beantragen.

Vielleicht möchten Sie jetzt entgegnen: Das ist keine Antwort auf die Frage im engeren Sinne. - Zu der konkreten Dauer kann ich nur sagen: Eine Statistik über die Dauer der Bearbeitung der Visa wird in unserer Botschaft in Kabul nicht geführt.",Dr. Günter Krings,,data/txt/18013.txt,"Dr. Günter Krings, Parl. Staatssekretär beim Bundesminister des Innern",,speech
481171,13,18,0,377,"Frau Amtsberg, Sie haben das Wort zur ersten Nachfrage.",Petra Pau,,data/txt/18013.txt,Vizepräsidentin Petra Pau,,chair
481172,13,18,0,378,"Vielen Dank. - Dass die Gefährdung für afghanische Ortskräfte konkret ist, hat uns die Ermordung des Dolmetschers Dschawad Wafa am 24. November 2013 verdeutlicht. Die Bundesregierung sagt, dass es auszuschließen ist, dass es sich hierbei um eine Tat der Taliban handelt, und das, obwohl die Sprecher der Polizeibehörde in Kunduz etwas Gegenteiliges behaupten. Meine Frage: Wie kommen Sie zu dieser Beurteilung? Wird überlegt, die Tathintergründe noch einmal zu überprüfen?",Luise Amtsberg,,data/txt/18013.txt,Luise Amtsberg (BÜNDNIS 90/DIE GRÜNEN),gruene,speech
481173,13,18,0,379,"Die Beurteilung ist so, wie Sie sie eben dargestellt haben. Unsere Behörden haben das geprüft und sind zu ihren Erkenntnissen gekommen. Ich habe bisher keinen Anlass, anzunehmen, dass die nationalen Polizeikräfte in Afghanistan das besser recherchieren konnten und können als die Vertreter unserer Behörden vor Ort. Insofern ist das Ganze in einem Verfahren geprüft worden.

Ich darf in diesem Zusammenhang darauf hinweisen, dass es sehr wohl Vorkehrungen gibt, da, wo wir von konkreten Gefährdungslagen wissen, wirklich sehr schnell zu helfen, notfalls in wenigen Stunden. Es gibt beispielsweise Möglichkeiten, Personen unterzubringen, etwa in Hotels oder in deutschen Polizeieinrichtungen. Ich wiederhole: Da gibt es Möglichkeiten, zu helfen.",Dr. Günter Krings,,data/txt/18013.txt,"Dr. Günter Krings, Parl. Staatssekretär beim Bundesminister des Innern",,speech
481174,13,18,0,380,"Frau Amtsberg, Sie haben das Wort zu einer zweiten Nachfrage.",Petra Pau,,data/txt/18013.txt,Vizepräsidentin Petra Pau,,chair
481175,13,18,0,381,"Es gibt natürlich auch Probleme, so kommt es zu Verzögerungen bei der Ausreise, oder es ist ungeklärt, wie die Ausreise finanziert wird. Es werden auch Vermutungen darüber angestellt, dass viele nicht ausreisen, weil es finanzielle Schwierigkeiten gibt. Bezüglich der konkreten Hilfe stelle ich die Fragen:  Gibt es irgendwelche Überlegungen, zu unterstützen? Wie wird bereits unterstützt, wenn beispielsweise jemand kommt, der sagt, er wolle ausreisen, aber er habe die nötigen finanziellen Mittel nicht? Gibt es irgendeine Struktur, wie wir diesen Leuten helfen können, was zum Beispiel die Ausreise per Flugzeug angeht?",Luise Amtsberg,,data/txt/18013.txt,Luise Amtsberg (BÜNDNIS 90/DIE GRÜNEN),gruene,speech
481176,13,18,0,382,"Ja, da gibt es eine vielfältige Struktur. Es ist so, dass die Kräfte, die für deutsche Einrichtungen wie die Bundespolizei, das Auswärtige Amt oder das Verteidigungsministerium gearbeitet haben, eine recht großzügige Abfindung erhalten, die in aller Regel ausreicht, um das Ticket für den Flug nach Deutschland zu bezahlen. Da, wo das im Einzelfall nicht ausreichend ist, helfen die Ressorts weiter. Insofern gibt es diese Möglichkeiten und ist meines Erachtens sichergestellt, dass da, wo jemand ausreisen möchte, das auch möglich ist.

Man muss allerdings auch sagen, dass die Aufnahmezusage sozusagen erst einmal der erste Schritt ist und dass nicht jeder, der eine solche Zusage in der Tasche hat, auch wirklich unmittelbar ausreisen möchte. Eine solche Zusage ist für manche - ich sage es einmal etwas untechnisch - eine Art Rückversicherung, dass man im Falle, in dem man als Betroffener annimmt, die Bedrohung nehme zu, relativ schnell ein Visum beantragen und nach Deutschland kommen kann. Es ist also ganz natürlich, zumindest nachvollziehbar, dass die Anzahl der Aufnahmezusagen viel höher ist als die Anzahl der gestellten Visumanträge.",Dr. Günter Krings,,data/txt/18013.txt,"Dr. Günter Krings, Parl. Staatssekretär beim Bundesminister des Innern",,speech
481177,13,18,0,383,"Wir kommen damit zur Frage 42 der Kollegin Luise Amtsberg:

In welchen Bundesländern wurden afghanische Ortskräfte der Bundeswehr, des Auswärtigen Amts und des Bundesministeriums des Innern bisher aufgenommen, und in Absprache mit welchen Bundesländern werden derzeit noch Aufnahmeverfahren vorbereitet - bitte jeweils einzeln aufschlüsseln -?

Bitte, Herr Staatssekretär.",Petra Pau,,data/txt/18013.txt,Vizepräsidentin Petra Pau,,chair
