id,sitzung,wahlperiode,in_writing,sequence,text,speaker_cleaned,speaker_fp,filename,speaker,speaker_party,type
480949,13,18,0,155,"Auch wenn Sie gerade sehr vage geblieben sind, Frau Staatssekretärin, versuche ich trotzdem, noch ein paar Dinge herauszufinden. Von wie vielen Vignetten, die aufgrund der verschiedenen Steuersätze bei der heutigen Kfz-Steuer notwendig sind, gehen Sie für die Zukunft aus?",Matthias Gastel,,data/txt/18013.txt,Matthias Gastel (BÜNDNIS 90/DIE GRÜNEN),gruene,speech
480950,13,18,0,156,Frau Staatssekretärin.,Peter Hintze,,data/txt/18013.txt,Vizepräsident Peter Hintze,,chair
480951,13,18,0,157,Wir werden die Pkw-Maut in Einklang mit dem EU-Recht auf den Weg bringen.,Dorothee Bär,,data/txt/18013.txt,"Dorothee Bär, Parl. Staatssekretärin beim Bundesminister für Verkehr und digitale Infrastruktur",,speech
480952,13,18,0,158,"Frau Bär, bitte schön!",Herbert Behrens,,data/txt/18013.txt,Herbert Behrens [DIE LINKE],linke,poi
480953,13,18,0,159,,Dorothee Bär,,data/txt/18013.txt,"Dorothee Bär, Parl. Staatssekretärin beim Bundesminister für Verkehr und digitale Infrastruktur",,speech
480954,13,18,0,160,"Noch eine Nachfrage, Herr Kollege Gastel? - Das ist nicht der Fall. Danke schön.

Gibt es zu den Fragen 6 oder 7 von einem anderen Mitglied des Hauses Nachfragen? - Das ist nicht der Fall.

Damit kommen wir zur Frage 8 des Abgeordneten Stephan Kühn (Dresden), Bündnis 90/Die Grünen:

Wie soll gewährleistet werden, dass jedem Halter von nicht in Deutschland zugelassenen Pkw der Erwerb einer seinem Fahrzeugtyp entsprechenden Vignette ermöglicht wird, und inwiefern ist vorgesehen, ein neues Vertriebssystem hierfür aufzubauen?

Frau Staatssekretärin, bitte.",Peter Hintze,,data/txt/18013.txt,Vizepräsident Peter Hintze,,chair
480955,13,18,0,161,"Lieber Herr Kollege Kühn, ich darf auch die Fragen 8 und 9 im Zusammenhang beantworten.",Dorothee Bär,,data/txt/18013.txt,"Dorothee Bär, Parl. Staatssekretärin beim Bundesminister für Verkehr und digitale Infrastruktur",,speech
480956,13,18,0,162,"Dann rufe ich auch die Frage 9 des Abgeordneten Stephan Kühn auf:

Welche Möglichkeiten sieht die Bundesregierung, damit bei Einführung der Pkw-Maut kein Fahrzeughalter in Deutschland stärker belastet wird als heute, und wie will die Bundesregierung sicherstellen, dass ein Fahrzeughalter in Deutschland nicht selbst aktiv werden muss, um die gezahlte Pkw-Maut erstattet zu bekommen?",Peter Hintze,,data/txt/18013.txt,Vizepräsident Peter Hintze,,chair
480957,13,18,0,163,Die Bundesregierung arbeitet derzeit an einem Konzept zur Einführung einer mit dem EU-Recht in Einklang stehenden Pkw-Maut,Dorothee Bär,,data/txt/18013.txt,"Dorothee Bär, Parl. Staatssekretärin beim Bundesminister für Verkehr und digitale Infrastruktur",,speech
480958,13,18,0,164,Heiterkeit bei der SPD,,,data/txt/18013.txt,,,poi
480959,13,18,0,165,nach den im Koalitionsvertrag festgelegten Maßgaben. Über spezifische Ausgestaltungsmerkmale kann ich derzeit noch keine Angaben machen.,Dorothee Bär,,data/txt/18013.txt,"Dorothee Bär, Parl. Staatssekretärin beim Bundesminister für Verkehr und digitale Infrastruktur",,speech
480960,13,18,0,166,Eine Nachfrage des Kollegen Kühn.,Peter Hintze,,data/txt/18013.txt,Vizepräsident Peter Hintze,,chair
480961,13,18,0,167,"Frau Staatssekretärin, vielen Dank für die präzise Auskunft.",Stephan Kühn,,data/txt/18013.txt,Stephan Kühn (Dresden) (BÜNDNIS 90/DIE GRÜNEN),gruene,speech
480962,13,18,0,168,Heiterkeit bei der SPD,,,data/txt/18013.txt,,,poi
480963,13,18,0,169,"Ich nehme einmal Bezug auf eine Sitzung, auf der wir heute gemeinsam waren, nämlich auf die Sitzung zur Verkehrsinfrastrukturfinanzierung, an der der ehemalige Bundesverkehrsminister Bodewig und der ehemalige Landesverkehrsminister Daehre teilgenommen haben. Da ist auch zum Thema Pkw-Maut für Ausländer gefragt worden. Zu der Frage Kann man da eigentlich in relevanter Höhe Zusatzeinnahmen für die Infrastruktur gewinnen? wurde auf den Aspekt hingewiesen - da geht es um die Frage des demografischen Wandels -, dass immer mehr Fahrzeughalterinnen und -halter, gerade ältere Menschen, immer kürzere Wege zurücklegen und gerade die Autobahnen meiden, also eher auf Landstraßen und nachgeordnete Straßen ausweichen, also von da sozusagen keine Einnahmen generiert werden können. Durch den Verlagerungsverkehr werden sich die Einnahmen aus einer möglichen Pkw-Maut für Ausländer reduzieren. Wie ist das in den Gutachten, die Ihrem Hause vorliegen, berücksichtigt worden, und wie kalkulieren Sie diesen Aspekt bei der Frage ein, in welcher Höhe man zusätzliche Einnahmen aus der Pkw-Maut für Ausländer generieren kann?",Stephan Kühn,,data/txt/18013.txt,Stephan Kühn (Dresden) (BÜNDNIS 90/DIE GRÜNEN),gruene,speech
480964,13,18,0,170,Ich gebe Ihnen recht: Das war heute ein interessantes Expertengespräch im Ausschuss. Selbstverständlich werden die Ergebnisse der Daehre- und der Bodewig-Kommission Eingang finden.,Dorothee Bär,,data/txt/18013.txt,"Dorothee Bär, Parl. Staatssekretärin beim Bundesminister für Verkehr und digitale Infrastruktur",,speech
480965,13,18,0,171,"Haben Sie weitere Fragen, Kollege Kühn?",Peter Hintze,,data/txt/18013.txt,Vizepräsident Peter Hintze,,chair
480966,13,18,0,172,"Es ist immer gut, wenn die Frage länger dauert als die Antwort!",Daniela Ludwig,,data/txt/18013.txt,Daniela Ludwig [CDU/CSU],cducsu,poi
480967,13,18,0,173,,Peter Hintze,,data/txt/18013.txt,Vizepräsident Peter Hintze,,chair
480968,13,18,0,174,"Ja, die habe ich. - Bei dem, was Sie schon mehrfach vorgetragen haben und was auch Ihr Minister vorgetragen hat, ging es darum, dass die deutschen Fahrzeughalter nicht nur keine zusätzlichen Ausgaben, sondern auch keinen zusätzlichen Aufwand haben sollen. Insofern ist die Frage, wie die Rückerstattung der Kosten der Vi-gnette - damit das Ganze für die deutschen Fahrzeughalter kostenneutral ist - gestaltet werden soll, damit kein zeitlicher oder sonstiger Aufwand entsteht. Welche Überlegungen gibt es seitens der Bundesregierung, wie man das - neben der Frage Europarecht - operativ ausgestaltet?",Stephan Kühn,,data/txt/18013.txt,Stephan Kühn (Dresden) (BÜNDNIS 90/DIE GRÜNEN),gruene,speech
480969,13,18,0,175,Frau Staatssekretärin.,Peter Hintze,,data/txt/18013.txt,Vizepräsident Peter Hintze,,chair
480970,13,18,0,176,"Auch mit Blick auf den zuständigen Staatsminister im Kanzleramt ist es für uns natürlich wichtig, dass wir das Ganze auch möglichst bürokratiearm ausgestalten.",Dorothee Bär,,data/txt/18013.txt,"Dorothee Bär, Parl. Staatssekretärin beim Bundesminister für Verkehr und digitale Infrastruktur",,speech
480971,13,18,0,177,"Herr Kollege Kühn, haben Sie eine weitere Nachfrage? - Das ist nicht der Fall.

Gibt es sonst noch Nachfragen? - Frau Dr. Wilms, eine Nachfrage.",Peter Hintze,,data/txt/18013.txt,Vizepräsident Peter Hintze,,chair
480972,13,18,0,178,"Vielen Dank, Herr Präsident. - Ich möchte jetzt, wo wir uns langsam dem Vignettensystem annähern, doch etwas genauer werden.",Dr. Valerie Wilms,,data/txt/18013.txt,Dr. Valerie Wilms (BÜNDNIS 90/DIE GRÜNEN),gruene,speech
480973,13,18,0,179,Heiterkeit bei Abgeordneten der SPD,,,data/txt/18013.txt,,,poi
480974,13,18,0,180,"Welchen Zeitraum veranschlagt die Bundesregierung eigentlich für den Aufbau eines Vertriebssystems? Sie müssen dafür ja eine ganze Reihe von Punkten prüfen. Sie wollen verschiedene Klassen bilden, je nach Schadstoffausstoß. Sie müssen relativ intensive Prüfungsverfahren durchführen, bevor Sie die Vignette aushändigen können. Welche Kosten werden dafür erwartet? Ist schon untersucht worden, ob das ganze Vorhaben angesichts dessen überhaupt noch wirtschaftlich ist oder ob nachher die Kosten für die Durchführung höher sind als die tatsächlichen Einnahmen?",Dr. Valerie Wilms,,data/txt/18013.txt,Dr. Valerie Wilms (BÜNDNIS 90/DIE GRÜNEN),gruene,speech
480975,13,18,0,181,Frau Staatssekretärin.,Peter Hintze,,data/txt/18013.txt,Vizepräsident Peter Hintze,,chair
480976,13,18,0,182,"Liebe Frau Kollegin, Sie machen das sehr geschickt, aber ich möchte für das Protokoll festhalten, dass ich persönlich das Wort Vignette heute noch nicht in den Mund genommen habe - außer gerade eben. Sie können sich sicher sein, dass wir, was die Ausgestaltung betrifft, auch Ihre Überlegungen selbstverständlich im Hinterkopf haben.",Dorothee Bär,,data/txt/18013.txt,"Dorothee Bär, Parl. Staatssekretärin beim Bundesminister für Verkehr und digitale Infrastruktur",,speech
480977,13,18,0,183,"Keine weiteren Nachfragen? - Doch. Bitte schön, Herr Kollege.",Peter Hintze,,data/txt/18013.txt,Vizepräsident Peter Hintze,,chair
480978,13,18,0,184,"Frau Staatssekretärin, die angekündigte Komplexität einer möglichen Ausländermaut macht es schon erforderlich, dass Sie gründlich arbeiten. Insofern habe ich Nachsicht, dass Sie sich darauf zurückziehen müssen, dass Sie noch an einem Konzept arbeiten. Aber auch ein Konzepterarbeitungsprozess ist immer von bestimmten Zwischenschritten geprägt. Ich vermute einmal, Ihr Ministerium arbeitet ähnlich, hoffe ich zumindest. Es muss doch so sein, dass Sie die unterschiedlichen Einwände, die Sie bislang bekommen haben, nämlich zu der Frage, was möglicherweise zulässig ist und was möglicherweise nicht zulässig ist, zumindest zwischengeprüft haben. Darauf zielte, glaube ich, auch die Frage, inwieweit eine europarechtskonforme Vignettenlösung überhaupt schon einmal auf Ihrem Tisch gelegen hat und mit welchem Ergebnis sie geprüft wurde.",Herbert Behrens,,data/txt/18013.txt,Herbert Behrens (DIE LINKE),linke,speech
480979,13,18,0,185,Frau Staatssekretärin.,Peter Hintze,,data/txt/18013.txt,Vizepräsident Peter Hintze,,chair
480980,13,18,0,186,"Alle Vorschläge, die ins Haus kommen, werden selbstverständlich auch geprüft, und dann soll eine EU-konforme Pkw-Maut erarbeitet werden.",Dorothee Bär,,data/txt/18013.txt,"Dorothee Bär, Parl. Staatssekretärin beim Bundesminister für Verkehr und digitale Infrastruktur",,speech
480981,13,18,0,187,"Ich sehe keine weitere Nachfrage zu diesem Komplex.

Dann kommen wir zur Frage 10 des Abgeordneten Markus Tressel, Bündnis 90/Die Grünen:

Wie versteht die Bundesregierung das im Koalitionsvertrag zwischen CDU, CSU und SPD auf Seite 8 zu findende Versprechen ohne im Inland zugelassene Fahrzeuge höher als heute zu belasten unter dem möglichen Effekt der Einführung einer Vignette in unseren Nachbarstaaten, und inwiefern gibt es Abschätzungen, welche Kosten auf Fahrzeughalter von in Deutschland zugelassenen Pkw zukommen, wenn die Nachbarstaaten eine vergleichbare Maut einführen?

Frau Staatssekretärin.",Peter Hintze,,data/txt/18013.txt,Vizepräsident Peter Hintze,,chair
480982,13,18,0,188,"Entschuldigung, ich habe bei Frage 10 einen anderen Kollegen.",Dorothee Bär,,data/txt/18013.txt,"Dorothee Bär, Parl. Staatssekretärin beim Bundesminister für Verkehr und digitale Infrastruktur",,speech
480983,13,18,0,189,"Wenn sich die Frage inhaltlich deckt, wäre das ja vielleicht verkraftbar.",Peter Hintze,,data/txt/18013.txt,Vizepräsident Peter Hintze,,chair
480984,13,18,0,190,"Das weiß ich nicht, ob sich das inhaltlich deckt.",Dorothee Bär,,data/txt/18013.txt,"Dorothee Bär, Parl. Staatssekretärin beim Bundesminister für Verkehr und digitale Infrastruktur",,speech
480985,13,18,0,191,"Die Frage 10 lautet: Wie versteht die Bundesregierung das im Koalitionsvertrag zwischen CDU, CSU und SPD auf Seite 8 zu findende Versprechen ",Peter Hintze,,data/txt/18013.txt,Vizepräsident Peter Hintze,,chair
480986,13,18,0,192,Ja. Dann ist es nur der falsche Kollege.,Dorothee Bär,,data/txt/18013.txt,"Dorothee Bär, Parl. Staatssekretärin beim Bundesminister für Verkehr und digitale Infrastruktur",,speech
480987,13,18,0,193,"Nein, das ist der richtige Kollege. Aber Sie haben den falschen Namen auf dem Zettel.",Peter Hintze,,data/txt/18013.txt,Vizepräsident Peter Hintze,,chair
480988,13,18,0,194,Und die falsche Fraktion. Aber ich beantworte die Frage.,Dorothee Bär,,data/txt/18013.txt,"Dorothee Bär, Parl. Staatssekretärin beim Bundesminister für Verkehr und digitale Infrastruktur",,speech
480989,13,18,0,195,Das ist Konzept-erarbeitung der Bundesregierung!,Herbert Behrens,,data/txt/18013.txt,Herbert Behrens [DIE LINKE],linke,poi
480990,13,18,0,196,Es tut mir leid.,Dorothee Bär,,data/txt/18013.txt,"Dorothee Bär, Parl. Staatssekretärin beim Bundesminister für Verkehr und digitale Infrastruktur",,speech
480991,13,18,0,197,"Frau Staatssekretärin, ich bitte, das Parlament nicht zu irritieren. Jetzt beantworten Sie die Frage 10.",Peter Hintze,,data/txt/18013.txt,Vizepräsident Peter Hintze,,chair
480992,13,18,0,198,"Die Antwort lautet: Die Aussage im Koalitionsvertrag, keinen Fahrzeughalter in Deutschland stärker zu belasten als heute, bezieht sich ausschließlich auf die Einführung einer Pkw-Maut auf deutschen Bundesfernstraßen.",Dorothee Bär,,data/txt/18013.txt,"Dorothee Bär, Parl. Staatssekretärin beim Bundesminister für Verkehr und digitale Infrastruktur",,speech
480993,13,18,0,199,"Kollege Tressel, haben Sie eine Nachfrage?",Peter Hintze,,data/txt/18013.txt,Vizepräsident Peter Hintze,,chair
480994,13,18,0,200,"Selbstverständlich, auch wenn ich nach dem bisherigen Verlauf der Fragestunde keine Hoffnung auf eine gute Antwort habe. - Ich gehe davon aus, dass Sie das schon mit ins Kalkül gezogen haben. Nordrhein-Westfalen grenzt an Belgien und Luxemburg; Ähnliches gilt für Rheinland-Pfalz und das Saarland. Insofern wäre es, glaube ich, klug gewesen, mit ins Kalkül zu ziehen, dass die dortigen Regierungen sich animiert fühlen könnten, eine vergleichbare Maut einzuführen. Deswegen frage ich Sie: Welche Rolle spielen solche möglichen negativen Folgen bei den politischen Entscheidungen hinsichtlich der Einführung einer Vignette, und welche Risikoabschätzung haben Sie da vorgenommen?",Markus Tressel,,data/txt/18013.txt,Markus Tressel (BÜNDNIS 90/DIE GRÜNEN),gruene,speech
480995,13,18,0,201,Frau Staatssekretärin.,Peter Hintze,,data/txt/18013.txt,Vizepräsident Peter Hintze,,chair
480996,13,18,0,202,"Lieber Herr Kollege Tressel, wir haben in den folgenden Nachbarländern eine Pkw-Maut: in Frankreich eine streckenbezogene Maut sowie eine Sondermaut, in Österreich eine Vignettenpflicht und eine Sondermaut, in der Schweiz eine Vignettenpflicht und eine Sondermaut, in der Tschechischen Republik eine Vignettenpflicht, in Belgien eine Sondermaut, in Dänemark eine Sondermaut, in den Niederlanden eine Sondermaut und in Polen eine örtliche Mautpflicht und eine streckenbezogene Maut. Bezüglich der anderen Länder, die Sie angesprochen haben, wären nur Spekulationen möglich, und deshalb kann sich die Bundesregierung nicht dazu äußern.",Dorothee Bär,,data/txt/18013.txt,"Dorothee Bär, Parl. Staatssekretärin beim Bundesminister für Verkehr und digitale Infrastruktur",,speech
480997,13,18,0,203,"Kollege Tressel? - Keine weitere Nachfrage. Gibt es sonst noch Nachfragen? - Kollege Behrens und Frau Dr. Wilms haben jeweils eine Nachfrage. Erst einmal Kollege Behrens, Fraktion Die Linke. Bitte schön.",Peter Hintze,,data/txt/18013.txt,Vizepräsident Peter Hintze,,chair
480998,13,18,0,204,"Frau Staatssekretärin, haben Sie bei der Recherche zu der Frage, wo überall es eine Pkw-Maut gibt, auch untersucht, inwieweit es ein mit Ihren Planungen vergleichbares System gibt, nämlich eine Unterscheidung zwischen ausländischen Fahrzeugführern und inländischen Fahrzeugführern, und wenn ja, in welchen Ländern gibt es ein solches Modell?",Herbert Behrens,,data/txt/18013.txt,Herbert Behrens (DIE LINKE),linke,speech
480999,13,18,0,205,"Frau Staatssekretärin, bitte.",Peter Hintze,,data/txt/18013.txt,Vizepräsident Peter Hintze,,chair
481000,13,18,0,206,"Wir haben jetzt erst einmal die Aufgabe, in Deutschland eine Maut so einzuführen, wie wir es auf der Basis unseres Koalitionsvertrages und des EU-Rechts für richtig erachten, und das wird auch sehr zeitnah geschehen.",Dorothee Bär,,data/txt/18013.txt,"Dorothee Bär, Parl. Staatssekretärin beim Bundesminister für Verkehr und digitale Infrastruktur",,speech
481001,13,18,0,207,Danke schön. - Die nächste Frage hat Frau Kollegin Dr. Wilms.,Peter Hintze,,data/txt/18013.txt,Vizepräsident Peter Hintze,,chair
481002,13,18,0,208,"Vielen Dank, Herr Präsident. - Die Aussage eben hat mich echt erstaunt. Ich bin öfter in Dänemark, weil ich dort mit den Nordschleswigern, also den Deutschen in Dänemark, zu tun habe. Für die Nutzung der dortigen Autobahnen habe ich noch keine Maut bezahlt. Das Gleiche gilt für Belgien. Sie sagen aber, da gebe es angeblich eine Maut. Das ist sehr erstaunlich. Meine Frage: Es gibt ja zum Beispiel Pendler, die in der Nähe von Aachen hinter der deutschen Grenze wohnen und nach Deutschland pendeln bzw. umgekehrt. Inwiefern haben Sie mit den angrenzenden Staaten schon ernsthaft Kontakt aufgenommen, um überhaupt einmal über ein solches Thema zu sprechen?",Dr. Valerie Wilms,,data/txt/18013.txt,Dr. Valerie Wilms (BÜNDNIS 90/DIE GRÜNEN),gruene,speech
481003,13,18,0,209,"Liebe Frau Kollegin, ich habe von einer Sondermaut in Dänemark und Belgien gesprochen. Diese bezieht sich in Belgien auf einen bestimmten Tunnel und in Dänemark auf Tunnel und Brücken.",Dorothee Bär,,data/txt/18013.txt,Dorothee Bär (CDU/CSU),cducsu,speech
481004,13,18,0,210,Vielleicht sind Sie nie über Brücken gefahren!,Daniela Ludwig,,data/txt/18013.txt,"Daniela Ludwig [CDU/CSU], an die Abg. Dr. Valerie Wilms [BÜNDNIS 90/DIE GRÜNEN] gewandt",cducsu,poi
481005,13,18,0,211,,Dorothee Bär,,data/txt/18013.txt,Dorothee Bär (CDU/CSU),cducsu,speech
481006,13,18,0,212,Schönen Dank. - Gibt es zur Frage 10 weitere Nachfragen? - Die gibt es nicht.,Peter Hintze,,data/txt/18013.txt,Vizepräsident Peter Hintze,,chair
481007,13,18,0,213,"Wie viele Stellen bzw. Kilometer des Schienennetzes in Deutschland sind nach Kenntnis der Bundesregierung in einem dringend renovierungsbedürftigen Zustand, und was tut die Bundesregierung in der 18. Wahlperiode, um das Bahnnetz instand zu halten?

Frau Staatssekretärin, bitte.","Dann kommen wir zur Bahn. Ich rufe Frage 11 des Abgeordneten Dr. André Hahn, die Linke, auf",,data/txt/18013.txt,"Dann kommen wir zur Bahn. Ich rufe Frage 11 des Abgeordneten Dr. André Hahn, die Linke, auf",linke,speech
481008,13,18,0,214,"Frage 11, lieber Herr Kollege Dr. Hahn, beantworte ich wie folgt: Dem Bund obliegt nach Art. 87 e Abs. 4 Grundgesetz die Verantwortung für Ausbau und Erhaltung des Schienennetzes der Eisenbahninfrastrukturunternehmen des Bundes. Eigentümer der Schieneninfrastruktur sind die Eisenbahninfrastrukturunternehmen des Bundes.

Zur Finanzierung von Ersatzinvestitionen in das bestehende Netz haben der Bund und die Eisenbahninfrastrukturunternehmen mit Wirkung vom 1. Januar 2009 die Leistungs- und Finanzierungsvereinbarung, die LuFV I, abgeschlossen. In dieser wird die bisherige Inputkontrolle durch eine Outputkontrolle ersetzt. Die -Eisenbahninfrastrukturunternehmen haben sich in der LuFV als Gegenleistung für den jährlichen Infrastrukturbeitrag des Bundes in Höhe von 2,5 Milliarden Euro sanktionsbewehrt zur Einhaltung der vereinbarten Netzqualität, die mit Qualitätskennzahlen gemessen wird, sowie zur Leistung eines bestimmten Ersatzinvestitionsvolumens und eines bestimmten Instandhaltungsbeitrages verpflichtet. Im Gegenzug erhalten sie durch die fünfjährige Laufzeit der LuFV Planungs- und Investitionssicherheit über einen längerfristigen Zeitraum und können selbst über ihre Investitionstätigkeiten und Schwerpunkte im Bestandsnetz entscheiden. Über den konkreten Zustand des Netzes berichten sie jährlich in einem Infrastrukturzustands- und -entwicklungsbericht, der veröffentlicht wird.

Die Laufzeit der LuFV wurde am 6. September 2013 um zwei Jahre, längstens bis 2015, verlängert. In den Jahren 2013 und 2014 ist die LuFV jeweils mit 2,75 Milliarden Euro an Bundesmitteln ausgestattet. Bund und Bahn verhandeln derzeit über eine Nachfolgevereinbarung, die sogenannte LuFV II.",Dorothee Bär,,data/txt/18013.txt,"Dorothee Bär, Parl. Staatssekretärin beim Bundesminister für Verkehr und digitale Infrastruktur",,speech
481009,13,18,0,215,Danke schön. - Kollege Dr. Hahn mit einer Nachfrage. Bitte schön.,Peter Hintze,,data/txt/18013.txt,Vizepräsident Peter Hintze,,chair
481010,13,18,0,216,"Frau Staatssekretärin, dem Verkehrsausschuss des Bundestages wurde im September 2012 ein Bericht des Bundesrechnungshofes zum Zustand des Schienennetzes vorgelegt. Ich habe nach dem gegenwärtigen Zustand gefragt. In dem genannten Bericht des Rechnungshofes heißt es auf Seite 21:

Der Infrastrukturzustands- und -entwicklungsbericht, IZB,

- den haben Sie eben angesprochen -

blendet einen Teil der Infrastrukturmängel systematisch aus. So werden insbesondere Langsamfahrstellen und vollständige Streckensperrungen nicht erfasst, wenn sie höchstens 180 Tage bestanden haben.

Das heißt, in der Statistik tauchen sie nur dann auf, wenn sie länger als sechs Monate existiert haben. Weiter heißt es in dem Bericht:

Das Bundesministerium hat die vom Parlament geforderte Transparenz des Infrastrukturzustandes herzustellen.

Deshalb frage ich Sie: Was hat die Bundesregierung bislang getan, um den vom Bundesrechnungshof benannten Missstand zu beheben?",Dr. André Hahn,,data/txt/18013.txt,Dr. André Hahn (DIE LINKE),linke,speech
481011,13,18,0,217,"Frau Staatssekretärin, bitte.",Peter Hintze,,data/txt/18013.txt,Vizepräsident Peter Hintze,,chair
481012,13,18,0,218,Ihre Anmerkungen sind interessant und werden sicherlich in die Nachfolgevereinbarung von Bund und Bahn aufgenommen werden.,Dorothee Bär,,data/txt/18013.txt,"Dorothee Bär, Parl. Staatssekretärin beim Bundesminister für Verkehr und digitale Infrastruktur",,speech
481013,13,18,0,219,"Herr Kollege Dr. Hahn, haben Sie noch eine Nachfrage?",Peter Hintze,,data/txt/18013.txt,Vizepräsident Peter Hintze,,chair
481014,13,18,0,220,"Es ist etwas schwierig. Herr Präsident, es gehört zum Respekt gegenüber dem Parlament, die Fragen, die gewählte Abgeordnete stellen, auch sachgerecht zu beantworten.",Dr. André Hahn,,data/txt/18013.txt,Dr. André Hahn (DIE LINKE),linke,speech
481015,13,18,0,221,Beifall bei der LINKEN und dem BÜNDNIS 90/DIE GRÜNEN,,,data/txt/18013.txt,,,poi
481016,13,18,0,222,Die Frage lautete: Was hat die Bundesregierung seit diesem Bericht getan? Auf diese Frage hat die Staatssekretärin leider nicht geantwortet.,Dr. André Hahn,,data/txt/18013.txt,Dr. André Hahn (DIE LINKE),linke,speech
481017,13,18,0,223,Vielleicht weiß sie das nicht!,Wolfgang Gehrcke,,data/txt/18013.txt,Wolfgang Gehrcke [DIE LINKE],linke,poi
481018,13,18,0,224,,Dr. André Hahn,,data/txt/18013.txt,Dr. André Hahn (DIE LINKE),linke,speech
481019,13,18,0,225,"Danke schön. - Herr Behrens hat sich gemeldet, dann Frau Dr. Wilms.",Peter Hintze,,data/txt/18013.txt,Vizepräsident Peter Hintze,,chair
481020,13,18,0,226,"Sie haben gesagt, dass Sie derzeit keine Kenntnisse darüber haben und in der LuFV vereinbart ist, was die Bahn renoviert und was nicht. Gleichwohl hat der Verkehrsminister offenbar festgestellt, dass es bestimmte Aussagen der Bahn gibt, die nicht zutreffend sind. Daraufhin hat Herr Dobrindt gesagt: Dann ist es offenbar notwendig, sich nicht nur auf die Prüfergebnisse der Bahn zu verlassen, sondern selber Testfahrten zu unternehmen. - Ich gehe davon aus, dass der Bundesminister das nicht nur aus Jux und Tollerei gemacht hat, sondern weil ihm entsprechende Erkenntnisse zugetragen worden sind. Können Sie zu diesen Erkenntnissen etwas sagen? Wo sind tatsächlich schwere Mängel oder zumindest Mängel aufgetreten, die ihn zu dieser Entscheidung gebracht haben?",Herbert Behrens,,data/txt/18013.txt,Herbert Behrens (DIE LINKE),linke,speech
481021,13,18,0,227,Frau Staatssekretärin.,Peter Hintze,,data/txt/18013.txt,Vizepräsident Peter Hintze,,chair
481022,13,18,0,228,"Ich kann Ihnen dazu nur sagen, dass der Bundesminister die Ankündigung, die er gemacht hat, auch umsetzen wird.",Dorothee Bär,,data/txt/18013.txt,"Dorothee Bär, Parl. Staatssekretärin beim Bundesminister für Verkehr und digitale Infrastruktur",,speech
481023,13,18,0,229,"Eine Nachfrage von Frau Dr. Wilms, Bündnis 90/Die Grünen. - Bitte schön.",Peter Hintze,,data/txt/18013.txt,Vizepräsident Peter Hintze,,chair
481024,13,18,0,230,"Vielen Dank, Herr Präsident. - Frau Staatssekretärin, es ist eben schon einmal darauf hingewiesen worden, wie man mit der Beantwortung von Fragen umgehen sollte. Das, was wir eben gehört haben, war ein bisschen wenig.

Wir haben Ihren Äußerungen entnommen, dass diese Testfahrten jetzt tatsächlich stattfinden, dass der erste Zug, mit dem die Bundesregierung den Zustand der Schienen prüfen und erfassen lassen möchte, in Gang gesetzt worden ist. Wenn Sie das jetzt schon machen, also der DB AG im Hinblick auf die LuFV misstrauen - die Schlussfolgerung daraus ist ja mehr oder weniger, dass uns die Eisenbahninfrastrukturunternehmen des Bundes mit dem Infrastrukturzustands- und -entwicklungsbericht etwas vorlegen, das vielleicht doch nicht so ganz zutreffend ist -, dann frage ich mich: Wie gehen Sie eigentlich mit dem Problem um, dass wir, wie der Bahnchef, Herr Grube, sagt, bei den Brücken einen ganz hohen Investitionsbedarf haben und es soundso viele Brücken gibt - die genaue Zahl habe ich jetzt nicht im Kopf -, die erneuerungs- oder nachbesserungsbedürftig sind? Wollen Sie da jetzt auch noch ein entsprechendes Brückenüberprüfungsprogramm vonseiten des Bundes in Gang setzen? Dann hätten wir mit der Fortschreibung der LuFV, wie sie bisher vorgesehen ist, wenig Erfolg.",Dr. Valerie Wilms,,data/txt/18013.txt,Dr. Valerie Wilms (BÜNDNIS 90/DIE GRÜNEN),gruene,speech
