id,sitzung,wahlperiode,in_writing,sequence,text,speaker_cleaned,speaker_fp,filename,speaker,speaker_party,type
530348,47,18,0,828,"Bayern setzt sich dafür ein, Umweltbelange, Versorgungssicherheit und Bezahlbarkeit in eine verträgliche Balance zu bringen. Viele Jahre lang stand der Aufbau von Kapazitäten aus erneuerbaren Energien sehr im Vordergrund. Ich denke, ich kann sagen: Wir in Bayern wissen, wovon wir reden. Wir sind an der Spitze bei der Erzeugung von Strom aus erneuerbaren Energien - im Gegensatz zu Nordrhein-Westfalen zum Beispiel. Wir decken bereits 36 Prozent unseres Stromverbrauchs aus erneuerbaren Energien.",Barbara Lanzinger,,data/txt/18047.txt,Barbara Lanzinger (CDU/CSU),cducsu,speech
530349,47,18,0,829,Erzählen Sie mal etwas zur Windenergie in Bayern!,Oliver Krischer,,data/txt/18047.txt,Oliver Krischer [BÜNDNIS 90/DIE GRÜNEN],gruene,poi
530350,47,18,0,830,Wir alle wissen aber auch: Leistung durch erneuerbare Energien ist nicht durchgängig sicher und auch nicht grundlastfähig.,Barbara Lanzinger,,data/txt/18047.txt,Barbara Lanzinger (CDU/CSU),cducsu,speech
530351,47,18,0,831,Was ist denn mit der Windenergie in Bayern?,Oliver Krischer,,data/txt/18047.txt,Oliver Krischer [BÜNDNIS 90/DIE GRÜNEN],gruene,poi
530352,47,18,0,832,"Die Energiewende bedeutet die Umstellung unseres gesamten Energiesystems. Dafür brauchen wir verlässliche Rahmenbedingungen - das möchte ich heute auch noch einmal erwähnen -, wie es zum Beispiel bei einem Kapazitätsmarkt der Fall sein kann.

Für einen Kapazitätsmarkt brauchen wir eine technologieoffene, wettbewerbliche und europakompatible Lösung. Notwendig sind die Einbeziehung gesicherter Erzeugungskapazitäten, von Speichern - dahinter setze ich mehrere Ausrufezeichen; Fragezeichen könnte man -theoretisch auch setzen -, eines Lastmanagements sowie die Verstetigung von erneuerbaren Energien, die sehr verlässlich Strom liefern, wie zum Beispiel Wasserkraft und Biogas. Wir brauchen die richtige Mischung.

Es ist gut, dass Sie ebenso wie wir die Speicher als wichtigen Bestandteil der Umstrukturierung unseres Energiesystems betrachten. Es wäre gut gewesen - das sage ich heute sehr deutlich -, wenn wir es geschafft hätten, das Thema Speicher in das EEG einzupflegen. Das ist leider nicht geschehen.",Barbara Lanzinger,,data/txt/18047.txt,Barbara Lanzinger (CDU/CSU),cducsu,speech
530353,47,18,0,833,Wieso haben Sie es denn nicht gemacht? Sie haben doch die Mehrheit!,Oliver Krischer,,data/txt/18047.txt,Oliver Krischer [BÜNDNIS 90/DIE GRÜNEN],gruene,poi
530354,47,18,0,834,"Im Kapazitätsmarkt werden konventionelle Kraftwerke weiter eine Rolle spielen. Sie sind auf absehbare Zeit zur Deckung der Residuallast und damit zur Gewährleistung der Versorgungssicherheit unverzichtbar. Diese konventionellen Kraftwerke müssen jedoch dringend einen wesentlichen Beitrag zur Erreichung der CO2-Reduktionsziele leisten; es ist von mehreren Kollegen ausgeführt worden. Deshalb werden an einen zukünftigen Kraftwerkspark hohe Anforderungen hinsichtlich Effizienz, Emissionen, Flexibilität und Verfügbarkeit gestellt. Hier kommen - auch das wurde schon diskutiert - Gaskraftwerke oder Gasturbinen infrage, die teilweise mit Biogas sowie regenerativ erzeugtem Wasserstoff und Methan betrieben werden könnten.

Neben dem Einsatz hocheffizienter und flexibler Gaskraftwerke ist jedoch der europäische Emissionshandel - auch darauf wurde schon eingegangen - das wichtigste regulatorische Instrument zur Reduktion der CO2-Emissionen. Ich denke schon, dass die zu günstigen Preise - auch das wurde gesagt - ein wesentlicher Grund für den Anstieg der Kohlestromproduktion sind; sie führen dazu, dass sich die klimaschonenden und effizienten Gaskraftwerke nicht rentieren. Auch deshalb müssen wir dringend gemeinsam mit der EU-Kommission an neuen marktwirtschaftlichen Modellen arbeiten und auf nationaler Ebene über unser System der Strombörse diskutieren.

Neben der Umstrukturierung des bisherigen CO2-Emissionszertifikatehandels gilt es aber auch, an anderen Stellen weiterzuarbeiten. Die Sicherstellung der Zuverlässigkeit und der Bezahlbarkeit unserer Energieversorgung kann nicht allein dadurch erreicht werden, dass wir weitere Kapazitäten zubauen, ohne über einen Abbau von Kapazitäten im Kohlebereich zu diskutieren. -Erforderlich sind Maßnahmen zur Umsetzung verbind-licher Effizienzvorgaben. Wir haben ein riesiges Energieeffizienzpotenzial von mindestens 10 bis 15 Prozent, das wir nutzen können, um den Leistungsbedarf zu reduzieren und dadurch Lasten zu verschieben. Ich denke schon, es ist allerhöchste Zeit, insgesamt verantwortungsbewusster mit Energie umzugehen.

Auch wenn wir alle aus der Kohle aussteigen wollen, müssen wir uns dessen bewusst sein, dass sich der Kohleausstieg über etliche Jahrzehnte hinziehen und auch nicht nach dem Muster des Atomausstiegs erfolgen kann und wird. Ich denke, den gewaltigen Unterschied kennen wir alle: Die Atomkraft birgt weitaus höhere Risiken als die Kohlekraft, was einen möglichst schnellen Ausstieg aus der kommerziellen Atomenergienutzung rechtfertigt. So sieht es im Übrigen auch der Sachverständigenrat für Umweltfragen. Er bescheinigt, dass ein Kohleausstieg und eine vollständige Versorgung mit Strom aus erneuerbaren Quellen technisch erst ab 2040 realisierbar sind, und ich denke, darauf gründet auch der Antrag der Linken.",Barbara Lanzinger,,data/txt/18047.txt,Barbara Lanzinger (CDU/CSU),cducsu,speech
530355,47,18,0,835,Das ist ja mal eine Ansage!,Oliver Krischer,,data/txt/18047.txt,Oliver Krischer [BÜNDNIS 90/DIE GRÜNEN],gruene,poi
530356,47,18,0,836,"Klar ist auch: Die Bedeutung der Kohle muss in dem Maße schrumpfen, in dem die Bedeutung der erneuerbaren Energien wächst; darüber besteht auch in der Gesellschaft durchaus Konsens.

Lassen Sie mich unsere bayerische Umweltministerin Ilse Aigner zitieren. Sie hat einen sehr treffenden Vergleich gezogen:

Die Energiewende  ist kein Spaziergang, sondern eine anspruchsvolle Bergtour, bei der man Kondition braucht und die Fähigkeit, bei Unvorhergesehenem auch mal die Route anzupassen oder das Tempo zu ändern.",Barbara Lanzinger,,data/txt/18047.txt,Barbara Lanzinger (CDU/CSU),cducsu,speech
530357,47,18,0,837,Sie ist ja eine Philosophin! Das wusste ich noch gar nicht!,Oliver Krischer,,data/txt/18047.txt,Oliver Krischer [BÜNDNIS 90/DIE GRÜNEN],gruene,poi
530358,47,18,0,838,"Man muss auch mal stehen bleiben, wenn es zum Beispiel Unwetter gibt; das weiß jeder, der schon mal im Gebirge war. Entscheidend ist jedoch, dass es aufwärts geht, dass man - ich bleibe bei diesem Vergleich - das Gipfelkreuz vor Augen hat, das die Richtung und das Ziel vorgibt. Dieses Ziel ist eine sichere, bezahlbare, umweltfreundliche Energieversorgung in einem gut durchdachten Energiesystem.

Je schneller wir die Kohle nicht mehr brauchen, desto besser - das sage ich ganz deutlich. Wir können den Ausstieg aus der Kohle allerdings erst dann gezielt planen, wenn wir ein funktionierendes Marktdesign haben; erst dann können wir sicher sein, eine ausreichende Versorgungssicherheit zu gewährleisten.

Zum Schluss wünsche ich allen einen schönen Sommer, auch einen Arbeitssommer; ich gehe davon aus, dass wir nicht nur Ferien haben, sondern auch zu Hause arbeiten. Ich wünsche, dass alle Kraft tanken können, damit wir im Herbst in aller Sachlichkeit und Ruhe mit Verantwortungsbewusstsein und einem Stück Gelassenheit weiterdiskutieren können.

Vielen herzlichen Dank.",Barbara Lanzinger,,data/txt/18047.txt,Barbara Lanzinger (CDU/CSU),cducsu,speech
530359,47,18,0,839,Beifall bei der CDU/CSU und der SPD,,,data/txt/18047.txt,,,poi
530360,47,18,0,840,,Barbara Lanzinger,,data/txt/18047.txt,Barbara Lanzinger (CDU/CSU),cducsu,speech
530361,47,18,0,841,"Danke auch, Frau Kollegin Lanzinger. - Für die Sozialdemokraten spricht jetzt der Kollege Thomas Jurk.",Johannes Singhammer,,data/txt/18047.txt,Vizepräsident Johannes Singhammer,,chair
530362,47,18,0,842,Beifall bei der SPD sowie bei Abgeordneten der CDU/CSU,,,data/txt/18047.txt,,,poi
530363,47,18,0,843,,Johannes Singhammer,,data/txt/18047.txt,Vizepräsident Johannes Singhammer,,chair
530364,47,18,0,844,"Sehr geehrter Herr Präsident! Meine sehr verehrten Damen und Herren! Die Energiewende muss gelingen, und zwar unter ökonomischen, sozialen und ökologischen Aspekten. Das löst man nicht mit einem den Schalter umlegen. Die Energiewende ist für mich kein unendliches Experimentierfeld, sondern es gibt Rahmenbedingungen, die wir beachten müssen. Als ehemaliger Elektrotechniker sage ich dazu: Es gibt Gesetzmäßigkeiten, die auch wir als Politiker nicht außer Kraft setzen können.

Sehr geehrter Herr Kollege Krischer, Sie haben als Beispiel die Energiepolitik in Großbritannien genannt. Also, ich möchte keine Verhältnisse wie in Großbritannien.",Thomas Jurk,,data/txt/18047.txt,Thomas Jurk (SPD),spd,speech
530365,47,18,0,845,So ist es!,Dirk Becker,,data/txt/18047.txt,Dirk Becker [SPD],spd,poi
530366,47,18,0,846,"Soweit ich weiß, plant man in Großbritannien, Kernkraftwerke unter Zuhilfenahme von Einspeisevergütungen zu errichten.",Thomas Jurk,,data/txt/18047.txt,Thomas Jurk (SPD),spd,speech
530367,47,18,0,847,Ich habe von CO2-Grenzwerten gesprochen und ausdrücklich nicht von Atomkraft!,Oliver Krischer,,data/txt/18047.txt,Oliver Krischer [BÜNDNIS 90/DIE GRÜNEN],gruene,poi
530368,47,18,0,848,Das gehört auch zur Wahrheit dazu. Wollen Sie das wirklich?,Thomas Jurk,,data/txt/18047.txt,Thomas Jurk (SPD),spd,speech
530369,47,18,0,849,Beifall bei der SPD sowie bei Abgeordneten der CDU/CSU,,,data/txt/18047.txt,,,poi
530370,47,18,0,850,Das ist doch albern!,Oliver Krischer,,data/txt/18047.txt,Oliver Krischer [BÜNDNIS 90/DIE GRÜNEN],gruene,poi
530371,47,18,0,851,"Es ist völlig richtig, was einige Vorredner betont haben: Ein paralleler Ausstieg aus der Atomkraft und aus der Braunkohle wird nicht funktionieren können.",Thomas Jurk,,data/txt/18047.txt,Thomas Jurk (SPD),spd,speech
530372,47,18,0,852,"Aha, also doch nicht! Was hat denn Herr Miersch eben gesagt? Was ist denn da jetzt bei den Sozialdemokraten?",Oliver Krischer,,data/txt/18047.txt,Oliver Krischer [BÜNDNIS 90/DIE GRÜNEN],gruene,poi
530373,47,18,0,853,"Es ist Ihnen schon einmal vorgetragen worden, aber damit Sie es sich vor Augen führen:",Thomas Jurk,,data/txt/18047.txt,Thomas Jurk (SPD),spd,speech
530374,47,18,0,854,"Ja, die wollen es nicht kapieren!",Dr. Joachim Pfeiffer,,data/txt/18047.txt,Dr. Joachim Pfeiffer [CDU/CSU],cducsu,poi
530375,47,18,0,855,"Woraus erzeugen wir unseren Strom in Deutschland? 45 Prozent Kohle, 15 Prozent Kernkraft, 25 Prozent erneuerbare Energien. Ich möchte gerne, dass der letztgenannte Anteil weiter steigt. Aber wir alle wissen doch, dass erneuerbare Energien volatil sind. Deshalb müssen wir uns als Politiker darum kümmern, dass die Rahmenbedingungen, auch was die Speicherung anbetrifft, verbessert werden. Ich glaube, die Bundesregierung ist gerade dabei.

Ein anderer wichtiger Punkt ist für mich für das Gelingen der Energiewende notwendig, und das ist die Regelbarkeit. In diesem Zusammenhang komme ich zu den von einigen so verhassten Braunkohlekraftwerken.

Ich komme aus einer Region, in der vor kurzem ein neuer Block ans Netz gegangen ist, der Block R in Boxberg. Er hat übrigens einen Wirkungsgrad von 44 Prozent. Dieser Block lässt sich im Lastmanagement zu je 3 Prozent pro Minute hoch- und runterfahren. Das heißt konkret: Man kann bei einer Gesamtleistung von 675 Megawatt bis zu 250 Megawatt in einer Viertelstunde hoch- oder runterregeln. Das ist eine gewaltige Leistung. Das ist auch dringend notwendig, um passgenaue Lösungen dann zu finden, wenn es mal mehr, mal weniger Sonnen- und Windstrom gibt. Und deshalb sollte man zur Kenntnis nehmen: Das ist ein wichtiges Element für unsere Energiewende.",Thomas Jurk,,data/txt/18047.txt,Thomas Jurk (SPD),spd,speech
530376,47,18,0,856,Beifall bei der CDU/CSU sowie bei Abgeordneten der SPD,,,data/txt/18047.txt,,,poi
530377,47,18,0,857,Das ist das jetzige Modell! Wollen Sie denn noch weitere Kohlekraftwerke? Sagen Sie doch einmal was dazu!,Oliver Krischer,,data/txt/18047.txt,Oliver Krischer [BÜNDNIS 90/DIE GRÜNEN],gruene,poi
530378,47,18,0,858,"Bundesminister Gabriel hat am Montag seine 10-Punkte-Energie-Agenda zu zentralen Vorhaben der Energiewende für die 18. Legislaturperiode vorgestellt; einige Vorredner sind bereits darauf eingegangen. Ich finde, es ist ein sehr gutes Papier und es lohnt, gelesen zu werden, auch vor dem Hintergrund, dass es klare Aussagen zum Strommarktdesign enthält; ich erinnere an die Arbeitsweise: Grünbuch, Weißbuch und entsprechende Gesetzesvorhaben. Das macht deutlich, dass wir nicht nur mit unseren Nachbarländern grenzüberschreitende Lösungen brauchen, sondern in der Europäischen Union insgesamt.

Neue Erzeugerstrukturen, wie sie in den letzten Jahren aufgewachsen sind, verlangen daran angepasste Netze. Sowohl bei Übertragungs- wie auch bei Verteilnetzen gibt es riesigen Investitionsbedarf. Das alles muss finanziert werden.

An dieser Stelle möchte ich den Verteilnetzbetreibern durchaus meinen Dank und meine Anerkennung zollen. In den letzten Monaten und Jahren haben sie Hervorragendes geleistet, um die Versorgungssicherheit in unserem Land aufrechtzuerhalten.",Thomas Jurk,,data/txt/18047.txt,Thomas Jurk (SPD),spd,speech
530379,47,18,0,859,Beifall bei der SPD und der CDU/CSU,,,data/txt/18047.txt,,,poi
530380,47,18,0,860,"Auch hier macht die 10-Punkte-Energie-Agenda von Sigmar Gabriel klar: Wir brauchen Vorgaben und vor allen Dingen eine zeitliche Rahmensetzung, damit auch dieser riesige Kraftakt des Netzausbaus bewältigt werden kann.

Ich komme zum Thema Bergrecht. Ich habe mir sagen lassen, dass das ein altes Thema ist, das auch Sie, Kollege Krischer, immer wieder vor sich hertragen.",Thomas Jurk,,data/txt/18047.txt,Thomas Jurk (SPD),spd,speech
530381,47,18,0,861,Bundesrat!,Oliver Krischer,,data/txt/18047.txt,Oliver Krischer [BÜNDNIS 90/DIE GRÜNEN],gruene,poi
530382,47,18,0,862,"Selbst wenn es in Deutschland keine Kohlekraftwerke gäbe, wäre die rohstoffliche Bedeutung für viele Branchen unserer Volkswirtschaft darin abgebildet. Es ist klar: Da braucht man eine Gesetzgebung.",Thomas Jurk,,data/txt/18047.txt,Thomas Jurk (SPD),spd,speech
530383,47,18,0,863,Das stellt niemand in Zweifel!,Oliver Krischer,,data/txt/18047.txt,Oliver Krischer [BÜNDNIS 90/DIE GRÜNEN],gruene,poi
530384,47,18,0,864,"Seit 1982 haben wir mit dem einheitlichen Bergrecht, das damals in Deutschland geschaffen wurde, eine solide Grundlage geschaffen, die am 3. Oktober 1990 auf das Gebiet der ehemaligen DDR übertragen wurde.",Thomas Jurk,,data/txt/18047.txt,Thomas Jurk (SPD),spd,speech
530385,47,18,0,865,"Ja, schlimm genug!",Oliver Krischer,,data/txt/18047.txt,Oliver Krischer [BÜNDNIS 90/DIE GRÜNEN],gruene,poi
530386,47,18,0,866,"Natürlich gab es noch weitere Vorläufer von Vorschriften, aber ich bitte Sie von den Grünen: Tun Sie doch nicht so, als hätten Sie ein altes und völlig überholtes Gesetz vor sich.",Thomas Jurk,,data/txt/18047.txt,Thomas Jurk (SPD),spd,speech
530387,47,18,0,867,Haben Sie schon was vom Garzweiler-Urteil gehört?,Oliver Krischer,,data/txt/18047.txt,Oliver Krischer [BÜNDNIS 90/DIE GRÜNEN],gruene,poi
530388,47,18,0,868,"- Das Garzweiler-Urteil legt jeder so aus, wie er es braucht; auch wir haben eine Meinung dazu. Wenn Sie ganz in Ruhe darüber nachdenken, stellen Sie fest: So weit ist man da manchen nicht entgegengekommen; das interpretieren Sie hinein.

Auch die SPD-Bundestagsfraktion hat in der jüngsten Zeit Bedarf nach Weiterentwicklung des Bergrechts gesehen,",Thomas Jurk,,data/txt/18047.txt,Thomas Jurk (SPD),spd,speech
530389,47,18,0,869,Aha!,Oliver Krischer,,data/txt/18047.txt,Oliver Krischer [BÜNDNIS 90/DIE GRÜNEN],gruene,poi
530390,47,18,0,870,ohne es abschaffen zu wollen.,Thomas Jurk,,data/txt/18047.txt,Thomas Jurk (SPD),spd,speech
530391,47,18,0,871,"Wer sagt denn, er wolle es abschaffen?",Annalena Baerbock,,data/txt/18047.txt,Annalena Baerbock [BÜNDNIS 90/DIE GRÜNEN],gruene,poi
530392,47,18,0,872,"Deshalb ist es wichtig, darauf hinzuweisen - Sie haben es wahrscheinlich vergessen, deshalb sage ich es jetzt noch einmal -: Uns geht es um die Beteiligung der Öffentlichkeit, zum Beispiel von Gemeinden, von Umwelt- und Wasserbehörden. Besonders wichtig ist uns eine frühzeitige Bürgerbeteiligung auch, um die Akzeptanz für bergrechtliche Verfahren zu erhöhen.

Meine sehr verehrten Damen und Herren, das Bergrecht muss an die Anforderungen einer modernen, aufgeklärten und an Teilhabe interessierten Gesellschaft angepasst werden.",Thomas Jurk,,data/txt/18047.txt,Thomas Jurk (SPD),spd,speech
530393,47,18,0,873,Dann passen Sie es an!,Oliver Krischer,,data/txt/18047.txt,Oliver Krischer [BÜNDNIS 90/DIE GRÜNEN],gruene,poi
530394,47,18,0,874,"Ich sage Ihnen aus meiner Erfahrung heraus: Es gibt keine undemokratischen Verfahren. Schaue ich mir die Erweiterung des Tagebaus in meiner Heimat an, so kann ich feststellen, dass die Mitglieder des Braunkohleausschusses oder der regionale Planungsverband in seiner Verbandsversammlung sehr verantwortungsbewusst das umgesetzt haben, was sie an Informationen bekommen haben. Sie haben übrigens nicht nur Vorlagen von bergbautreibenden Unternehmen, sondern auch Hinweise aus der Bevölkerung aufgegriffen. Nicht jeder war damit einverstanden. Am Ende gehört es zur Demokratie dazu, dass man abstimmt.

Frau Baerbock, ich hatte im Gegensatz zu Ihnen nicht das Glück, vor 1990 einen solchen Rechtsstaat erleben zu können. Mein Heimatort wäre im Jahre 2010 abgebaggert worden, hätte es die DDR noch gegeben. Ich bin sehr froh, dass die Menschen 1989 dafür gesorgt haben, dass das zu Ende war.",Thomas Jurk,,data/txt/18047.txt,Thomas Jurk (SPD),spd,speech
530395,47,18,0,875,Beifall bei der SPD und der CDU/CSU,,,data/txt/18047.txt,,,poi
530396,47,18,0,876,Was hat das mit dem Thema zu tun?,Annalena Baerbock,,data/txt/18047.txt,Annalena Baerbock [BÜNDNIS 90/DIE GRÜNEN],gruene,poi
530397,47,18,0,877,Jetzt baggern sie aber weiter!,Oliver Krischer,,data/txt/18047.txt,Oliver Krischer [BÜNDNIS 90/DIE GRÜNEN],gruene,poi
530398,47,18,0,878,"- Ich bin jetzt bei der Region angekommen. Kohle ist ein regionaler Wirtschaftsfaktor - Herr Krischer, das werden Sie selbst für NRW nicht bestreiten können - für Brandenburg, für Sachsen und für Sachsen-Anhalt. Ganz nebenbei reden wir über einen einheimischen Energieträger, genau so, wie das auch auf die erneuerbaren Energien zutrifft.",Thomas Jurk,,data/txt/18047.txt,Thomas Jurk (SPD),spd,speech
530399,47,18,0,879,"Die Energiewende ist für die neuen Länder sowohl als Produktionsstandort für Anlagen als auch für die Erzeugung erneuerbarer Energien eine große Chance. Auch die Braunkohle spielt nach wie vor eine bedeutende Rolle für die Wirtschaftsstruktur.

Bei manchen Antragstellern hatte ich den Eindruck - spontan fällt mir das Bild vom Hebelumlegen ein -: Jetzt beschließen wir einmal den Strukturwandel. Meine sehr verehrten Damen und Herren, in meiner Heimatregion, in ganz Ostdeutschland haben wir seit 24 Jahren einen ständigen Strukturwandel - mit unterschiedlichem Erfolg.",Im Koalitionsvertrag ist dazu völlig richtig ausgeführt,,data/txt/18047.txt,Im Koalitionsvertrag ist dazu völlig richtig ausgeführt,,speech
530400,47,18,0,880,Das wissen wir schon!,Eva Bulling-Schröter,,data/txt/18047.txt,Eva Bulling-Schröter [DIE LINKE],linke,poi
530401,47,18,0,881,Haben wir in NRW auch!,Oliver Krischer,,data/txt/18047.txt,Oliver Krischer [BÜNDNIS 90/DIE GRÜNEN],gruene,poi
530402,47,18,0,882,"- Ich glaube, das kann man nicht vergleichen, Herr Krischer.",Im Koalitionsvertrag ist dazu völlig richtig ausgeführt,,data/txt/18047.txt,Im Koalitionsvertrag ist dazu völlig richtig ausgeführt,,speech
530403,47,18,0,883,50 Jahre!,Wolfgang Tiefensee,,data/txt/18047.txt,Wolfgang Tiefensee [SPD],spd,poi
530404,47,18,0,884,"Das hat noch eine andere Dimension. Viele Probleme, die wir im Osten haben, die wir jetzt gerade lösen, werden Sie auch in Westdeutschland einholen.",Im Koalitionsvertrag ist dazu völlig richtig ausgeführt,,data/txt/18047.txt,Im Koalitionsvertrag ist dazu völlig richtig ausgeführt,,speech
530405,47,18,0,885,Wollen Sie gerade neuen Tagebau?,vom BÜNDNIS 90/DIE GRÜNEN,,data/txt/18047.txt,Zuruf vom BÜNDNIS 90/DIE GRÜNEN,gruene,poi
530406,47,18,0,886,Sie wollten doch nicht abgebaggert werden!,Oliver Krischer,,data/txt/18047.txt,Oliver Krischer [BÜNDNIS 90/DIE GRÜNEN],gruene,poi
530407,47,18,0,887,Aber Sie baggern ab!,Bärbel Höhn,,data/txt/18047.txt,Bärbel Höhn [BÜNDNIS 90/DIE GRÜNEN],gruene,poi
530408,47,18,0,888,Schamlos ist das!,Steffi Lemke,,data/txt/18047.txt,Steffi Lemke [BÜNDNIS 90/DIE GRÜNEN],gruene,poi
530409,47,18,0,889,"Ich bin froh, dass diese Planung zu Ende ist und dass wir ganz genau wissen, was wir vor uns haben. Deshalb ist es notwendig, einen richtigen Planungsrahmen zu haben. Sie haben nicht vor 1990 in meiner Heimat gelebt und können sich kein Bild machen.",Im Koalitionsvertrag ist dazu völlig richtig ausgeführt,,data/txt/18047.txt,Im Koalitionsvertrag ist dazu völlig richtig ausgeführt,,speech
530410,47,18,0,890,"Wissen Sie, wo ich gelebt habe?",Steffi Lemke,,data/txt/18047.txt,Steffi Lemke [BÜNDNIS 90/DIE GRÜNEN],gruene,poi
530411,47,18,0,891,"Was Sie jetzt machen, ist eine pauschale Verurteilung derjenigen, die dort leben. Das weise ich mit Entschiedenheit zurück.",Im Koalitionsvertrag ist dazu völlig richtig ausgeführt,,data/txt/18047.txt,Im Koalitionsvertrag ist dazu völlig richtig ausgeführt,,speech
530412,47,18,0,892,Beifall bei der SPD und der CDU/CSU,,,data/txt/18047.txt,,,poi
530413,47,18,0,893,Wo hat Frau Lemke gewohnt?,Oliver Krischer,,data/txt/18047.txt,Oliver Krischer [BÜNDNIS 90/DIE GRÜNEN],gruene,poi
530414,47,18,0,894,"Da bin ich bei einem wichtigen Punkt. Auch in der Braunkohlewirtschaft hat es enorme Anpassungsprozesse gegeben. Wir hatten 1990 noch rund 140 000 Beschäftigte in diesem volkswirtschaftlichen Sektor - -sicherlich völlig aufgebläht. Momentan arbeiten in Ostdeutschland 11 000 Leute direkt im Tagebau, in Kraftwerken. Rechnet man mit einem Multiplikator von zwei, kommt man ungefähr auf die Effekte, die durch Dienstleister und Zulieferer entstehen.

Meine sehr verehrten Damen und Herren, der Strukturwandel führt auch zu neuen Landschaftsstrukturen. Das sind einerseits Chancen für den Tourismus - wenn ich an die Seengebiete denke -, aber auch Chancen, der Natur Flächen wieder zurückzugeben. Stetiger Wandel braucht Zeit.",Im Koalitionsvertrag ist dazu völlig richtig ausgeführt,,data/txt/18047.txt,Im Koalitionsvertrag ist dazu völlig richtig ausgeführt,,speech
530415,47,18,0,895,Deshalb baggern Sie ab! Gehts noch? Was ist das denn?,Bärbel Höhn,,data/txt/18047.txt,Bärbel Höhn [BÜNDNIS 90/DIE GRÜNEN],gruene,poi
530416,47,18,0,896,"- Das, was Sie sagen, ist alles zu vereinfacht, Frau Höhn. Das ist der Sache nicht angemessen. Sie setzen sich nicht mit Argumenten auseinander.",Im Koalitionsvertrag ist dazu völlig richtig ausgeführt,,data/txt/18047.txt,Im Koalitionsvertrag ist dazu völlig richtig ausgeführt,,speech
530417,47,18,0,897,Beifall bei den Abgeordneten der CDU/CSU,,,data/txt/18047.txt,,,poi
530418,47,18,0,898,Aber Sie!,Annalena Baerbock,,data/txt/18047.txt,Annalena Baerbock [BÜNDNIS 90/DIE GRÜNEN],gruene,poi
530419,47,18,0,899,Das sagt der Richtige!,Oliver Krischer,,data/txt/18047.txt,Oliver Krischer [BÜNDNIS 90/DIE GRÜNEN],gruene,poi
530420,47,18,0,900,"Strukturwandel braucht seine Zeit. Sie können jetzt gern einmal aufstehen. Ich bin ja noch relativ neu in diesem Parlament. Ich kenne aus dem Sächsischen Landtag Mikrofone; von diesen aus kann man Zwischenfragen stellen. Ich bin bereit, sie zu beantworten.",Im Koalitionsvertrag ist dazu völlig richtig ausgeführt,,data/txt/18047.txt,Im Koalitionsvertrag ist dazu völlig richtig ausgeführt,,speech
530421,47,18,0,901,Beifall bei der SPD,,,data/txt/18047.txt,,,poi
530422,47,18,0,902,Wurden ja nicht zugelassen!,Annalena Baerbock,,data/txt/18047.txt,Annalena Baerbock [BÜNDNIS 90/DIE GRÜNEN],gruene,poi
530423,47,18,0,903,"Stetiger Wandel braucht Zeit. Wir haben für die Region übrigens auch gute Konzepte. Da wird nicht alles gelöst werden können. Das ist doch gar keine Frage. Aber es gibt in diesem Zusammenhang nach wie vor eine sehr hohe Akzeptanz für die Braunkohle. Das sollte man auch einmal zur Kenntnis nehmen. Es gab im Jahr 2013 eine repräsentative Umfrage von Forsa in allen Landkreisen und Städten der Region. Zwei Drittel der Befragten haben auf die Frage - ich lese sie Ihnen vor, damit Sie wissen, was gefragt wurde -: Ist zur Sicherung der langfristigen, zuverlässigen und kostengünstigen Versorgung mit Energie die Erweiterung des Braunkohletagebaus in der Lausitz notwendig?, mit Ja geantwortet.

Ich verstehe alle, die von Braunkohletagebauen betroffen sind und die ihre Heimat verlassen müssen. Das ist ein unglaublich schmerzhafter und harter Prozess, der begleitet werden muss. Ich sage aber auch sehr deutlich: Die Menschen in der Region wollen keine falschen Versprechungen, und sie wissen, was wichtig für sie ist.

Lassen Sie mich die Debatte zusammenfassen. Eines ist klar geworden: In dem Maße, in dem der Ausbau und die Systemintegration der erneuerbaren Energien voranschreiten, wird der Einsatz der Braunkohle als Energieträger zur Stromerzeugung mehr und mehr reduziert werden können. Das ist ja auch das Ziel des Ausbaus der erneuerbaren Energien. In diesem Zusammenhang wird der Anteil der Braunkohle sinken.",Im Koalitionsvertrag ist dazu völlig richtig ausgeführt,,data/txt/18047.txt,Im Koalitionsvertrag ist dazu völlig richtig ausgeführt,,speech
