id,sitzung,wahlperiode,in_writing,sequence,text,speaker_cleaned,speaker_fp,filename,speaker,speaker_party,type
530625,47,18,0,1105,Beifall beim BÜNDNIS 90/DIE GRÜNEN sowie bei Abgeordneten der LINKEN,,,data/txt/18047.txt,,,poi
530626,47,18,0,1106,Schluss mit dem Moppern jetzt!,Michael Grosse-Brömer,,data/txt/18047.txt,Michael Grosse-Brömer [CDU/CSU],cducsu,poi
530627,47,18,0,1107,"Meine Damen und Herren, wir werden selbstverständlich der notwendigen und überfälligen Reparatur des EEG an der einen Stelle zustimmen.",Oliver Krischer,,data/txt/18047.txt,Oliver Krischer (BÜNDNIS 90/DIE GRÜNEN),gruene,speech
530628,47,18,0,1108,Ah!,e von der CDU/CSU,,data/txt/18047.txt,Zurufe von der CDU/CSU,cducsu,poi
530629,47,18,0,1109,Beifall bei Abgeordneten der CDU/CSU und der SPD,,,data/txt/18047.txt,,,poi
530630,47,18,0,1110,"Das ändert aber nichts daran, dass dieses Gesetz ein Desaster ist,",Oliver Krischer,,data/txt/18047.txt,Oliver Krischer (BÜNDNIS 90/DIE GRÜNEN),gruene,speech
530631,47,18,0,1111,Beifall beim BÜNDNIS 90/DIE GRÜNEN,,,data/txt/18047.txt,,,poi
530632,47,18,0,1112,"ein Desaster für die Energiewende, für die Investitionssicherheit, für die Branche der erneuerbaren Energien, für den Klimaschutz und für die Bürgerenergien.",Oliver Krischer,,data/txt/18047.txt,Oliver Krischer (BÜNDNIS 90/DIE GRÜNEN),gruene,speech
530633,47,18,0,1113,Im Gegenteil!,Marcus Held,,data/txt/18047.txt,Marcus Held [SPD],spd,poi
530634,47,18,0,1114,"Da kommen Sie nicht mehr raus, auch nicht mit Ihrem unwürdigen Verfahren in diesem Parlament. Ich hoffe nur, dass Leute zum Gericht gehen und das problematisieren werden, was Sie hier veranstalten.

Ich danke Ihnen.",Oliver Krischer,,data/txt/18047.txt,Oliver Krischer (BÜNDNIS 90/DIE GRÜNEN),gruene,speech
530635,47,18,0,1115,Beifall beim BÜNDNIS 90/DIE GRÜNEN,,,data/txt/18047.txt,,,poi
530636,47,18,0,1116,"Ha! Gegen die deutsche Wirtschaft! Ja, das ist die klare Ansage!",Marcus Held,,data/txt/18047.txt,Marcus Held [SPD],spd,poi
530637,47,18,0,1117,"Nein, gegen euren Murks, nicht gegen die Wirtschaft!",Özcan Mutlu,,data/txt/18047.txt,Gegenruf des Abg. Özcan Mutlu [BÜNDNIS 90/DIE GRÜNEN],gruene,poi
530638,47,18,0,1118,,Oliver Krischer,,data/txt/18047.txt,Oliver Krischer (BÜNDNIS 90/DIE GRÜNEN),gruene,speech
530639,47,18,0,1119,Als letzter Redner in dieser Debatte hat der Kollege Heider das Wort.,Edelgard Bulmahn,,data/txt/18047.txt,Vizepräsidentin Edelgard Bulmahn,,chair
530640,47,18,0,1120,Beifall bei der CDU/CSU sowie bei Abgeordneten der SPD,,,data/txt/18047.txt,,,poi
530641,47,18,0,1121,,Edelgard Bulmahn,,data/txt/18047.txt,Vizepräsidentin Edelgard Bulmahn,,chair
530642,47,18,0,1122,"Frau Präsidentin! Sehr geehrte Kolleginnen und Kollegen! Lieber Kollege Krischer, wer hätte das gedacht, dass Sie einmal versuchen, zum Gesetz zur Bekämpfung von Zahlungsverzug zu reden.",Dr. Matthias Heider,,data/txt/18047.txt,Dr. Matthias Heider (CDU/CSU),cducsu,speech
530643,47,18,0,1123,Sie haben das doch aufgesetzt!,Annalena Baerbock,,data/txt/18047.txt,Annalena Baerbock [BÜNDNIS 90/DIE GRÜNEN],gruene,poi
530644,47,18,0,1124,Ist das EEG da drin oder nicht?,Oliver Krischer,,data/txt/18047.txt,Oliver Krischer [BÜNDNIS 90/DIE GRÜNEN],gruene,poi
530645,47,18,0,1125,"- Natürlich haben wir das aufgesetzt. Ich finde es völlig in Ordnung - bei allen Aufgeregtheiten heute -, dass wir dann, wenn vor der Sommerpause die Notwendigkeit besteht,",Dr. Matthias Heider,,data/txt/18047.txt,Dr. Matthias Heider (CDU/CSU),cducsu,speech
530646,47,18,0,1126,Die Notwendigkeit? Ihre Trümmer!,Oliver Krischer,,data/txt/18047.txt,Oliver Krischer [BÜNDNIS 90/DIE GRÜNEN],gruene,poi
530647,47,18,0,1127,"redaktionelle Fehler zu korrigieren, Gleichlauf mit Übergangsvorschriften herzustellen und Korrekturen im Sinne der Rechtssicherheit vorzunehmen, das an dieser Stelle machen.",Dr. Matthias Heider,,data/txt/18047.txt,Dr. Matthias Heider (CDU/CSU),cducsu,speech
530648,47,18,0,1128,Beifall bei Abgeordneten der CDU/CSU,,,data/txt/18047.txt,,,poi
530649,47,18,0,1129,"Sie haben uns doch gerade gesagt, dass Sie zustimmen wollen. Wo ist das Problem?

Sie haben das einmal als Omnibusgesetz bezeichnet, ein Verfahren, das jetzt genutzt wird. Selbst die Oppo-sition fährt gern Omnibus. Ich kann mich noch gut er-innern, meine Damen und Herren, dass Sie uns hier im letzten Jahr, als es um ein Gesetz gegen den Missbrauch im Geschäftsverkehr ging, Änderungsanträge präsentiert haben, die Ihre Meinung zur Mietpreisbremse und zur Abgeordnetenbestechung enthielten. Da haben Sie auch ganz vorn im Omnibus gesessen. Das ist ein Verfahren, das zwar parlamentarisch nicht besonders schön ist, aber das man zur Not auch einmal wählen kann.",Dr. Matthias Heider,,data/txt/18047.txt,Dr. Matthias Heider (CDU/CSU),cducsu,speech
530650,47,18,0,1130,Beifall bei der CDU/CSU sowie bei Abgeordneten der SPD,,,data/txt/18047.txt,,,poi
530651,47,18,0,1131,Da müsst ihr auch klatschen!,Michael Grosse-Brömer,,data/txt/18047.txt,"Michael Grosse-Brömer [CDU/CSU], an die SPD gewandt",cducsu,poi
530652,47,18,0,1132,"Meine Damen und Herren, damit kommen wir wieder zum eigentlichen Thema des Gesetzes zurück. Der Entwurf aus der letzten Legislaturperiode unterschied nicht zwischen Individualvereinbarungen und den für die Wirtschaft wichtigen Allgemeinen Geschäftsbedingungen. Außerdem sah der Entwurf eine Zahlungsfrist von 60 Tagen für alle vor, für Verbraucher und Unternehmer. Jedenfalls im Handwerk und auch in der Bauwirtschaft wäre das keine Verbesserung gewesen, und das hätte eher zu einer Verschlechterung der Zahlungsmoral geführt.

Jetzt kommen wir zu den 30 Tagen. Das Gesetz bringt natürlich auch für andere Branchen Veränderungen. Es muss sich noch zeigen, ob das für Automobilindustrie und Handel eine gute Regelung ist. Ausgesprochen positiv wird sie sich für Handwerk und Bauwirtschaft auswirken. Die anderen Branchen haben Strukturen, die wir in Zukunft genauer beobachten müssen.

Im Handwerk und in der Bauwirtschaft werden überwiegend Werkverträge vereinbart. Bei solchen ist der Gläubiger der Entgeltforderung vorleistungspflichtig. Daher sind kurze Zahlungsfristen okay. In der Automobilwirtschaft dagegen werden zwischen Automobilhersteller und Zulieferer zumeist Verträge geschlossen, auf die das Kaufrecht, Herr Kollege Wiese, Anwendung findet. Auch bei Werklieferungsverträgen ist das so. Die Zahlungen, die dort in einem rollierenden Gutschriftensystem jeweils zum Ende des nächsten Monats ausgelöst werden, sehen im Detail etwas anders aus, sodass man das alles nicht über einen Leisten schlagen sollte. Wir müssen aufmerksam beobachten, wie das läuft.

Auch im Einzelhandel haben wir meistenteils Kaufrecht. Hier liegt das Problem darin, dass Einzelhändler, die Ware von Einzelhändlern oder Lieferanten kaufen, nicht absehen können, in welchem Zeitraum sie die Ware absetzen. Daher muss die Ware zwischenfinanziert werden. Ich wage, heute zu prognostizieren, dass sich das über kurz oder lang auf die Verbraucherpreise auswirken wird.

Trotzdem ist das Gesetz, so wie es jetzt ausgestaltet ist, ein gutes Gesetz. Es hilft dem Mittelstand. Ich hoffe, dass es bei den Branchen, die vom Volumen her größer sind und im internationalen Rechtsverkehr besondere Bedürfnisse haben, möglich sein wird, entsprechende Individualvereinbarungen zu treffen. Ob das möglich ist, ist die Frage. Wir haben natürlich das Problem, Herr Staatssekretär, dass wir uns mit dieser gesetzlichen Regelung von den anderen Mitgliedstaaten in Europa deutlich abheben. Auch da werden wir beobachten müssen, ob sich das Gesetz auf die Wahl deutschen Rechts für Lieferverträge und auf den Rechtsstandort Deutschland auswirken wird. Ich kann das, genau wie Sie, heute nicht absehen. Aber wir tun gut daran, uns die beiden Branchen anzusehen.

Es ist gut, dass noch eine Änderung hinzugekommen ist, wonach alle Marktbeteiligten die Möglichkeit haben, ihre Allgemeinen Geschäftsbedingungen bis zum Jahr 2016 anzupassen. Im Juni 2016 müssen diese Anpassungen vollzogen sein. Ich glaube, dass diese Übergangsfrist ausreichend ist, um für die Branchen, die Unternehmen, aber auch die Verbraucher etwas im Sinne der Zahlungssicherheit und der Zahlungsschnelligkeit zu tun. Damit gehen wir in die Sommerpause. Nach der Sommerpause werden wir mit den Beobachtungen beginnen.

Vielen Dank.",Dr. Matthias Heider,,data/txt/18047.txt,Dr. Matthias Heider (CDU/CSU),cducsu,speech
530653,47,18,0,1133,Beifall bei der CDU/CSU und der SPD,,,data/txt/18047.txt,,,poi
530654,47,18,0,1134,,Dr. Matthias Heider,,data/txt/18047.txt,Dr. Matthias Heider (CDU/CSU),cducsu,speech
530655,47,18,0,1135,"Liebe Kolleginnen und Kollegen, damit schließe ich die Aussprache.

Wir kommen zur Abstimmung über den von der Bundesregierung eingebrachten Entwurf eines Gesetzes zur Bekämpfung von Zahlungsverzug im Geschäftsverkehr. Der Ausschuss für Recht und Verbraucherschutz empfiehlt in seiner Beschlussempfehlung auf Drucksache 18/2037, den Gesetzentwurf der Bundesregierung auf den Drucksachen 18/1309 und 18/1576 in der Ausschussfassung anzunehmen. Ich bitte diejenigen, die dem Gesetzentwurf in der Ausschussfassung zustimmen wollen, um das Handzeichen. Wer stimmt dafür? - Das sind die Koalitionsfraktionen. Wer stimmt dagegen? - Bündnis 90/Die Grünen. Wer enthält sich? - Das ist die Fraktion Die Linke. Damit ist der Gesetzentwurf in zweiter Beratung angenommen.

Wir kommen zur

dritten Beratung

und Schlussabstimmung. Ich bitte diejenigen, die dem Gesetzentwurf zustimmen wollen, sich zu erheben. - Wer stimmt dagegen? - Bündnis 90/Die Grünen. Wer enthält sich? - Die Linke. Damit ist der Gesetzentwurf mit den Stimmen der Koalition angenommen.",Edelgard Bulmahn,,data/txt/18047.txt,Vizepräsidentin Edelgard Bulmahn,,chair
530656,47,18,0,1136,"Frau Präsidentin, ich hatte Teilung der Abstimmung beantragt! Das ist ganz klar, weil wir beim EEG zustimmen werden!",Britta Haßelmann,,data/txt/18047.txt,Britta Haßelmann [BÜNDNIS 90/DIE GRÜNEN],gruene,poi
530657,47,18,0,1137,Jetzt ist abgestimmt! Ende!,Volker Kauder,,data/txt/18047.txt,Gegenruf des Abg. Volker Kauder [CDU/CSU],cducsu,poi
530658,47,18,0,1138,"Nein, ich hatte das beantragt!",Britta Haßelmann,,data/txt/18047.txt,Britta Haßelmann [BÜNDNIS 90/DIE GRÜNEN],gruene,poi
530659,47,18,0,1139,"Es war Teilung der Abstimmung beantragt. Deshalb bitte ich um Verständnis, dass wir die Abstimmung wiederholen. Wir stimmen zuerst über den Antrag der Teilung ab.",Edelgard Bulmahn,,data/txt/18047.txt,Vizepräsidentin Edelgard Bulmahn,,chair
530660,47,18,0,1140,Nein!,Britta Haßelmann,,data/txt/18047.txt,Britta Haßelmann [BÜNDNIS 90/DIE GRÜNEN],gruene,poi
530661,47,18,0,1141,"- Wir wiederholen die Abstimmung, und zwar geteilt.

Der Ausschuss für Recht und Verbraucherschutz empfiehlt in seiner Beschlussempfehlung auf Drucksache 18/2037, den Gesetzentwurf der Bundesregierung auf Drucksache 18/1309 in der Ausschussfassung anzunehmen. Wer stimmt für diese Beschlussempfehlung?",Edelgard Bulmahn,,data/txt/18047.txt,Vizepräsidentin Edelgard Bulmahn,,chair
530662,47,18,0,1142,Über den Änderungsantrag der Koalitionsfraktionen müssen wir zuerst abstimmen!,Oliver Krischer,,data/txt/18047.txt,Oliver Krischer [BÜNDNIS 90/DIE GRÜNEN],gruene,poi
530663,47,18,0,1143,"Soll ich mal vorschlagen, wie es geht?",Volker Kauder,,data/txt/18047.txt,Volker Kauder [CDU/CSU],cducsu,poi
530664,47,18,0,1144,Heiterkeit bei der CDU/CSU,,,data/txt/18047.txt,,,poi
530665,47,18,0,1145,"Ich gehe davon aus - so habe ich Frau Haßelmann verstanden -, dass Sie folgende Teilung wollen: auf der einen Seite eine Abstimmung über die Drucksache 18/1309 und auf der anderen Seite eine Abstimmung über die Drucksache 18/1576. Ist das zutreffend, oder ist das nicht zutreffend? Ansonsten müssen Sie mir jetzt bitte kurz erläutern, welche Teilung Sie wollen.",Edelgard Bulmahn,,data/txt/18047.txt,Vizepräsidentin Edelgard Bulmahn,,chair
530666,47,18,0,1146,Jetzt macht doch keinen Zirkus!,Volker Kauder,,data/txt/18047.txt,Volker Kauder [CDU/CSU],cducsu,poi
530667,47,18,0,1147,"Nachdem nun geklärt ist, worüber eine getrennte Abstimmung erreicht werden soll, wiederholen wir die Abstimmung noch einmal. Aller guten Dinge sind drei. Es wird eine getrennte Abstimmung über Artikel 4 gewünscht. Deshalb ziehe ich das jetzt vor. Ich lasse zunächst abstimmen über Artikel 4 auf Drucksache 18/2037. Wer stimmt dafür? - Das sind alle. Wer stimmt dagegen? - Niemand. Wer enthält sich? - Auch niemand. Damit ist Artikel 4 auf Drucksache 18/2037 einstimmig angenommen.

Jetzt lasse ich über den Gesetzentwurf im Übrigen abstimmen, und zwar in der Ausschussfassung, wie es vorhin angekündigt worden ist. Wer stimmt dem Gesetzentwurf in der Ausschussfassung zu? - Das sind die Koalitionsfraktionen. Wer stimmt dagegen? - Bündnis 90/Die Grünen. Wer enthält sich? - Die Linke. Damit ist der Gesetzentwurf in der Ausschussfassung mit den Stimmen der Koalition gegen die Stimmen von Bündnis 90/Die Grünen bei Enthaltung der Linken angenommen worden. Das war die zweite Beratung.

Wir kommen nun zur

dritten Beratung

und Schlussabstimmung. Wir stimmen jetzt über den Gesetzentwurf insgesamt, so wie wir ihn eben beschlossen haben, ab. Wer stimmt dem Gesetzentwurf, so wie wir ihn in der zweiten Lesung beschlossen haben, zu? - Wer stimmt dagegen? - Wer enthält sich? - Damit ist der Gesetzentwurf mit den Stimmen der Koalition gegen die Stimmen von Bündnis 90/Die Grünen bei Enthaltung der Linken angenommen.

Liebe Kolleginnen und Kollegen, damit kommen wir jetzt zu den Tagesordnungspunkten 29 a und 29 b:

a)	Zweite und dritte Beratung des von der Bundesregierung eingebrachten Entwurfs eines Gesetzes zur Absicherung stabiler und fairer Leistungen für Lebensversicherte (Lebensversicherungsreformgesetz - LVRG)

Drucksache 18/1772

Beschlussempfehlung und Bericht des Finanzausschusses (7. Ausschuss)

Drucksache 18/2016

b)	Beratung der Beschlussempfehlung und des Berichts des Finanzausschusses (7. Ausschuss) zu dem Antrag der Abgeordneten Susanna Karawanskij, Matthias W. Birkwald, Dr. Axel Troost, weiterer Abgeordneter und der Fraktion DIE LINKE

Lebensversicherungen auf den Prüfstand stellen - Kein Schnellverfahren zu Lasten der Versicherten

Drucksachen 18/1815, 18/2016

Über die Beschlussempfehlung werden wir später namentlich abstimmen. Zu dem Gesetzentwurf der Bundesregierung liegen zwei Änderungsanträge und ein Entschließungsantrag der Fraktion Die Linke vor.

Nach einer interfraktionellen Vereinbarung sind für die Aussprache 38 Minuten vorgesehen. - Dazu höre ich keinen Widerspruch. Dann ist das so beschlossen.

Ich eröffne die Aussprache. Als erster Redner hat Herr Dr. Michelbach das Wort.

Wenn sich alle Kolleginnen und Kollegen gesetzt haben - ich bitte auch alle Kolleginnen und Kollegen in den ersten Reihen darum -, können wir mit der Aussprache beginnen. - Herr Michelbach, Sie haben das Wort.",Edelgard Bulmahn,,data/txt/18047.txt,Vizepräsidentin Edelgard Bulmahn,,chair
530668,47,18,0,1148,"Frau Präsidentin! Kolleginnen und Kollegen! Seit dem Ausbruch der Weltfinanzkrise im Jahr 2008 haben wir in Deutschland, in Europa und weltweit vieles unternommen, um einer Wiederholung dieser Ereignisse vorzubeugen. Mit Bundesfinanzminister Dr. Wolfgang Schäuble haben wir konsequent Regulierungs- und Stabilitätsgesetze auf den Weg gebracht. Allerdings kämpfen wir an manchen Fronten heute noch immer damit, die Folgen der Finanzmarktkrise zu bewältigen.

Zu diesen Folgen gehört auch die anhaltende Niedrigzinspolitik der Notenbanken. Seit fünf Jahren sinken die Zinsen. Für eine Trendumkehr gibt es keine Hinweise. Vielmehr hat die EZB ihren Leitzins gerade erst wieder gesenkt und sogar Negativzinsen für Einlagen bei der Zentralbank eingeführt. Das bedeutet, Kredite werden billiger, was einerseits Verbraucher und Investoren freut. Das bedeutet aber auch, dass die Kapitalerträge zurückgehen, wodurch zum Beispiel private Vorsorge- und Spareinlagen entwertet werden. Ein erheblicher Teil der privaten Altersvorsorge in Deutschland steckt in Lebensversicherungen. Deshalb besteht die Notwendigkeit zu diesem Lebensversicherungsreformgesetz.

Rund 88 Millionen derartige Versicherungsverträge gibt es in Deutschland aktuell. Damit ist die Lebensversicherung eine der wichtigsten Spar- und Altersvorsorgeformen in unserem Land. Gegenwärtig erleben wir die paradoxe Situation, dass Lebensversicherungen umso mehr Geld ausschütten müssen, je niedriger die Zinsen sind. Bewertungsreserven entstehen, weil der Marktwert von Kapitalanlagen bei sinkenden Zinsen über dem früheren Kaufpreis liegt. Dabei handelt es sich um Buchgewinne ohne realen Zuwachs von Finanzmitteln; es gibt also keinen echten Wertzuwachs. Das kann nach Adam Riese auf Dauer nicht gut gehen. Deshalb müssen wir die Vorschriften zur Beteiligung an den Bewertungs-reserven bei festverzinslichen Wertpapieren - nicht bei Aktien und Immobilien - anpassen.

Die Deutsche Bundesbank warnt in einem langfristigen Stressszenario nicht umsonst davor, dass mehr als ein Drittel der deutschen Lebensversicherungen in einem Umfeld langanhaltender Niedrigzinsen bis 2023 die Eigenkapitalanforderungen nicht einhalten können. Das ist der langfristige Ausblick, den wir als Verantwortliche berücksichtigen müssen. Dieser Verantwortung kommen wir heute mit diesem Gesetz nach.

Es wäre absolut fahrlässig, die Warnungen nicht ernst zu nehmen. Wenn wir nicht handeln, fahren wir zwangsläufig einen wesentlichen Teil der privaten Altersvorsorge vor die Wand. Das gebe ich all jenen zu bedenken, allen voran der Opposition in diesem Hause, die seit Wochen mit falschen Argumenten und ohne einen eigenen vernünftigen Lösungsansatz gegen die nun vorliegende Lösung polemisieren. Manchmal habe ich den Eindruck, Sie haben geradezu Freude daran, den Menschen Zukunftsängste zu bereiten. Ich kann Sie nur warnen: Hören Sie mit den Verunsicherungskampagnen auf! Letzten Endes gibt es bei den garantierten Leistungen keine Veränderungen. Sie müssen deutlich machen, dass es hier nur um die Bewertungsreserven geht. Das kann man doch nicht in einen Topf werfen. Sonst verursacht man Zukunftsängste und Verunsicherung. Das lehnen wir ab; wir müssen den Menschen für die Zukunft Sicherheit geben.",Dr. h. c. Hans Michelbach,,data/txt/18047.txt,Dr. h. c. Hans Michelbach (CDU/CSU),cducsu,speech
530669,47,18,0,1149,Beifall bei der CDU/CSU sowie bei Abgeordneten der SPD,,,data/txt/18047.txt,,,poi
530670,47,18,0,1150,"Es steht außer Frage, dass der Gesetzgeber auf die Entwicklung bei den Bewertungsreserven reagieren muss. Es kann nicht sein, dass das Auslaufen der Verträge von 7 Millionen Versicherten einen Nachteil für mehr als 80 Millionen verbleibende Versicherte bedeutet. Ansonsten wäre mittel- und langfristig die Fähigkeit der Versicherungsunternehmen in Gefahr, ihre zugesagten Zinsgarantien einzuhalten. Eine solche Situation darf nicht eintreten. Das ist im Interesse der Versicherungsunternehmen, aber insbesondere auch im Interesse der Versicherten. Wir bevorteilen niemanden, sondern wollen den Ausgleich. Wir wollen Verteilungsgerechtigkeit und eine Balance zwischen den bestehenden Interessen.",Dr. h. c. Hans Michelbach,,data/txt/18047.txt,Dr. h. c. Hans Michelbach (CDU/CSU),cducsu,speech
530671,47,18,0,1151,Beifall bei der CDU/CSU sowie bei Abgeordneten der SPD,,,data/txt/18047.txt,,,poi
530672,47,18,0,1152,"Die Herausforderungen, vor denen wir stehen, können wir nur durch einen gerechten Interessenausgleich bewältigen. Es ist meine feste Überzeugung, dass ein solcher Interessenausgleich mit dem vorliegenden Gesetzentwurf erreicht wird. Der Leitgedanke der Solidargemeinschaft und der Verteilungsgerechtigkeit steht im Vordergrund. Deshalb wird von allen Beteiligten, also von den Versicherungsunternehmen, den Eigentümern - das ist ganz wichtig - und natürlich auch von den Versicherten, ein angemessener und ausgewogener Beitrag verlangt. Wir haben darauf geachtet, dass, sollten sich die Bewertungsreserven für die Versicherten ändern, auch die Eigentümer, die Aktionäre in Form von Ausschüttungen daran beteiligt werden. Damit stärken wir die Eigenkapitalausstattung, die die Versicherungen nach der Solvency-II-Vereinbarung in Zukunft verstärkt benötigen. So schafft das Reformgesetz eine gerechte Verteilung der Lasten zwischen Eigentümern und Versicherten. Darüber hinaus werden wir die Überschussbeteiligung der Versicherten an das Niedrigzinsumfeld anpassen. Die Versicherten werden in Zukunft mit mindestens 90 Prozent an den Risikoüberschüssen beteiligt statt wie bislang mit 75 Prozent. Überschüsse verbleiben im Sondervermögen.

Zudem stärkt das Gesetz die Handlungsmöglichkeiten der Aufsichtsbehörden. Es ist ganz wichtig, dass wir den Aufsichtsbehörden für das Versicherungswesen das richtige Werkzeug an die Hand geben, damit gefährliche Fehlentwicklungen frühzeitig erkannt und effektiv bekämpft werden können. Damit leistet das Gesetz einen wichtigen Beitrag zur Stabilität der Lebensversicherungen. Jedes andere Handeln wäre ein Verstoß gegen eine seriöse Finanzpolitik. Wir haben nach wie vor das Ziel, mit unserer Finanzpolitik zu einer Stabilisierung beizutragen.

Wir haben die Krise in vielerlei Hinsicht erfolgreich bekämpft;",Dr. h. c. Hans Michelbach,,data/txt/18047.txt,Dr. h. c. Hans Michelbach (CDU/CSU),cducsu,speech
530673,47,18,0,1153,Sehr gut!,Volker Kauder,,data/txt/18047.txt,Volker Kauder [CDU/CSU],cducsu,poi
530674,47,18,0,1154,"aber wir sind noch nicht über den Berg. Deswegen ist es notwendig, dass wir auch in Zukunft entsprechende Gesetzentwürfe einbringen. In diesem Sinne ist heute ein guter Tag für die Stabilität unseres Finanzmarktes, für die Versicherten, für die Anbieter und für die Produkte. Lassen Sie uns dieses Gesetz beschließen!

Vielen Dank.",Dr. h. c. Hans Michelbach,,data/txt/18047.txt,Dr. h. c. Hans Michelbach (CDU/CSU),cducsu,speech
530675,47,18,0,1155,Beifall bei der CDU/CSU und der SPD,,,data/txt/18047.txt,,,poi
530676,47,18,0,1156,,Dr. h. c. Hans Michelbach,,data/txt/18047.txt,Dr. h. c. Hans Michelbach (CDU/CSU),cducsu,speech
530677,47,18,0,1157,Als nächste Rednerin hat die Kollegin Susanna Karawanskij das Wort.,Edelgard Bulmahn,,data/txt/18047.txt,Vizepräsidentin Edelgard Bulmahn,,chair
530678,47,18,0,1158,Beifall bei der LINKEN,,,data/txt/18047.txt,,,poi
530679,47,18,0,1159,,Edelgard Bulmahn,,data/txt/18047.txt,Vizepräsidentin Edelgard Bulmahn,,chair
530680,47,18,0,1160,"Vielen Dank. - Sehr geehrte Frau Präsidentin! Sehr geehrte Kolleginnen und Kollegen! Liebe Gäste! Ausgewogen und gerecht haben Sie, Herr Finanzminister - wir haben es jetzt noch einmal vom Kollegen Michelbach gehört -, das Gesetz zur Reform der Lebensversicherungen genannt.",Susanna Karawanskij,,data/txt/18047.txt,Susanna Karawanskij (DIE LINKE),linke,speech
530681,47,18,0,1161,Aber holla!,Dr. Wolfgang Schäuble,,data/txt/18047.txt,"Dr. Wolfgang Schäuble, Bundesminister",,poi
530682,47,18,0,1162,Das ist es ja auch!,Manfred Zöllmer,,data/txt/18047.txt,Manfred Zöllmer [SPD],spd,poi
530683,47,18,0,1163,"Das ist, wenn man sich das Gesetz anschaut, aber nicht zu erkennen.",Susanna Karawanskij,,data/txt/18047.txt,Susanna Karawanskij (DIE LINKE),linke,speech
530684,47,18,0,1164,Beifall bei der LINKEN,,,data/txt/18047.txt,,,poi
530685,47,18,0,1165,Es gibt keinen fairen Interessenausgleich zwischen den Versicherten und den Versicherungsunternehmen.,Susanna Karawanskij,,data/txt/18047.txt,Susanna Karawanskij (DIE LINKE),linke,speech
530686,47,18,0,1166,Das ist doch ein Popanz!,Dr. h. c. Hans Michelbach,,data/txt/18047.txt,Dr. h. c. Hans Michelbach [CDU/CSU],cducsu,poi
530687,47,18,0,1167,Sie sind vor der Versicherungslobby - man muss es einfach so sagen - eingeknickt.,Susanna Karawanskij,,data/txt/18047.txt,Susanna Karawanskij (DIE LINKE),linke,speech
530688,47,18,0,1168,"Nein, hingefallen!",Volker Kauder,,data/txt/18047.txt,Volker Kauder [CDU/CSU],cducsu,poi
530689,47,18,0,1169,Sie haben Ihr Ziel verfehlt.,Susanna Karawanskij,,data/txt/18047.txt,Susanna Karawanskij (DIE LINKE),linke,speech
530690,47,18,0,1170,Beifall bei der LINKEN,,,data/txt/18047.txt,,,poi
530691,47,18,0,1171,"Die Versicherungsbranche jammerte, es müsse schnell gehandelt werden, und ruck, zuck wird ein Gesetz auf den Weg gebracht, das für viele Versicherte - 62 Millionen können davon betroffen sein -,",Susanna Karawanskij,,data/txt/18047.txt,Susanna Karawanskij (DIE LINKE),linke,speech
530692,47,18,0,1172,Positiv betroffen!,Ralph Brinkhaus,,data/txt/18047.txt,Ralph Brinkhaus [CDU/CSU],cducsu,poi
530693,47,18,0,1173,"gravierende Auswirkungen hat, die noch gar nicht überblickt werden können, weil die entsprechenden Daten fehlen. Bislang sind sie nur bruchstückhaft vorhanden.",Susanna Karawanskij,,data/txt/18047.txt,Susanna Karawanskij (DIE LINKE),linke,speech
530694,47,18,0,1174,Punkt!,Volker Kauder,,data/txt/18047.txt,Volker Kauder [CDU/CSU],cducsu,poi
530695,47,18,0,1175,"Nun frage ich mich, wie schlimm es wirklich um die Lebensversicherer steht. Heute war im Handelsblatt zu lesen, dass die Bundesanstalt für Finanzdienstleistungsaufsicht einen Stresstest vorgenommen hat. Dort haben alle Lebensversicherer positiv abgeschnitten. Die Risikotragfähigkeit der deutschen Versicherungswirtschaft ist weiterhin stabil, heißt es dort. Ich frage Sie: Warum dann eine solche Hast? Warum wollen wir nicht ausgiebig und vor allen Dingen umfassend diskutieren und dann ein wirklich gutes Gesetz auf den Weg bringen?",Susanna Karawanskij,,data/txt/18047.txt,Susanna Karawanskij (DIE LINKE),linke,speech
530696,47,18,0,1176,Beifall bei der LINKEN,,,data/txt/18047.txt,,,poi
